contentType,identifier,title,publicationName,doi,publisher,publicationDate,onlineDate,abstract,url,database
Article,doi:10.1007/s10514-012-9315-y,Fast motion planning from experience: trajectory prediction for speeding up movement generation,Autonomous Robots,10.1007/s10514-012-9315-y,Springer,2013-01-01,"Trajectory planning and optimization is a fundamental problem in articulated robotics. Algorithms used typically for this problem compute optimal trajectories from scratch in a new situation. In effect, extensive data is accumulated containing situations together with the respective optimized trajectories—but this data is in practice hardly exploited. This article describes a novel method to learn from such data and speed up motion generation, a method we denote tajectory pediction. The main idea is to use demonstrated optimal motions to quickly predict appropriate trajectories for novel situations. These can be used to initialize and thereby drastically speed-up subsequent optimization of robotic movements. Our approach has two essential ingredients. First, to generalize from previous situations to new ones we need a situation descriptor—we construct features for such descriptors and use a sparse regularized feature selection approach to improve generalization. Second, the transfer of previously optimized trajectories to a new situation should not be made in joint angle space—we propose a more efficient task space transfer. We present extensive results in simulation to illustrate the benefits of the new method, and demonstrate it also with real robot hardware. Our experiments in diverse tasks show that we can predict good motion trajectories in new situations for which the refinement is much faster than an optimization from scratch.",2013-01-12,http://link.springer.com/openurl/fulltext?id=doi:10.1007/s10514-012-9315-y,springer
Article,doi:10.1007/s10846-011-9624-y,Modelling Shared Attention Through Relational Reinforcement Learning,Journal of Intelligent & Robotic Systems,10.1007/s10846-011-9624-y,Springer,2012-04-01,"Shared attention is a type of communication very important among human beings. It is sometimes reserved for the more complex form of communication being constituted by a sequence of four steps: mutual gaze, gaze following, imperative pointing and declarative pointing. Some approaches have been proposed in Human−Robot Interaction area to solve part of shared attention process, that is, the most of works proposed try to solve the first two steps. Models based on temporal difference, neural networks, probabilistic and reinforcement learning are methods used in several works. In this article, we are presenting a robotic architecture that provides a robot or agent, the capacity of learning mutual gaze, gaze following and declarative pointing using a robotic head interacting with a caregiver. Three learning methods have been incorporated to this architecture and a comparison of their performance has been done to find the most adequate to be used in real experiment. The learning capabilities of this architecture have been analyzed by observing the robot interacting with the human in a controlled environment. The experimental results show that the robotic head is able to produce appropriate behavior and to learn from sociable interaction.",2011-08-18,http://link.springer.com/openurl/pdf?id=doi:10.1007/s10846-011-9624-y,springer
Chapter ConferencePaper,doi:10.1007/978-3-642-28942-2_10,Decentralized Multi-tasks Distribution in Heterogeneous Robot Teams by Means of Ant Colony Optimization and Learning Automata,Hybrid Artificial Intelligent Systems,10.1007/978-3-642-28942-2_10,Springer,2012-01-01,"This paper focuses on the general problem of coordinating multiple robots. More specifically, it addresses the self-election of heterogeneous specialized tasks by autonomous robots. In this paper we focus on a specifically distributed or decentralized approach as we are particularly interested on decentralized solution where the robots themselves autonomously and in an individual manner, are responsible of selecting a particular task so that all the existing tasks are optimally distributed and executed. In this regard, we have established an experimental scenario to solve the corresponding multi-tasks distribution problem and we propose a solution using two different approaches by applying Ant Colony Optimization-based deterministic algorithms as well as Learning Automata-based probabilistic algorithms. We have evaluated the robustness of the algorithm, perturbing the number of pending loads to simulate the robot’s error in estimating the real number of pending tasks and also the dynamic generation of loads through time. The paper ends with a critical discussion of experimental results.",,http://link.springer.com/openurl/pdf?id=doi:10.1007/978-3-642-28942-2_10,springer
Article,doi:10.1007/s11071-011-0027-1,ZMP based neural network inspired humanoid robot control,Nonlinear Dynamics,10.1007/s11071-011-0027-1,Springer,2012-01-01,"This paper concerns ZMP-based control that is inspired by artificial neural networks for humanoid robot walking on varying sloped surfaces. Humanoid robots are currently one of the most exciting research topics in the field of robotics, and maintaining stability while they are standing, walking or moving is a key concern. To ensure a steady and smooth walking gait of such robots, a feedforward type of neural network architecture, trained by the back-propagation algorithm, is employed. The inputs and outputs of the neural network architecture are the ZMP x and ZMP y errors of the robot, and the x , y positions of the robot, respectively. The neural network developed allows the controller to generate the desired balance of the robot positions, resulting in a steady gait for the robot as it moves around on a flat floor, and when it is descending or ascending slopes. In this paper, experiments of humanoid robot walking are carried out, in which the actual position data from a prototype robot are measured in real-time situations, and fed into a neural network inspired controller designed for stable bipedal walking. In addition, natural walking motions on the different surfaces with varying slopes are obtained and the performance of the resulting controller is shown to be satisfactory.",2011-04-07,http://link.springer.com/openurl/pdf?id=doi:10.1007/s11071-011-0027-1,springer
Article,doi:10.1007/s00146-011-0366-y,Special issue on social impact of AI: killer robots or friendly fridges,AI & SOCIETY,10.1007/s00146-011-0366-y,Springer,2011-10-11,,2011-10-11,http://link.springer.com/openurl/fulltext?id=doi:10.1007/s00146-011-0366-y,springer
Article,doi:10.1007/s10846-010-9433-8,From the Editor-in-Chief,Journal of Intelligent & Robotic Systems,10.1007/s10846-010-9433-8,Springer,2010-10-01,,2010-05-12,http://link.springer.com/openurl/pdf?id=doi:10.1007/s10846-010-9433-8,springer
Article,doi:10.1007/s10489-010-0212-9,A neural network based retrainable framework for robust object recognition with application to mobile robotics,Applied Intelligence,10.1007/s10489-010-0212-9,Springer,2011-10-01,"In this paper, we address object recognition for a mobile robot which is deployed in a multistory building. To move to another floor, a mobile robot should recognize various objects related to an elevator, e.g., elevator control, call buttons, and LED displays. To this end, we propose a neural network based retrainable framework for object recognition, which consists of four components—preprocessing, binary classification, object identification, and outlier rejection. The binary classifier, a key component of our system, is a neural network that can be retrained, the motivation of which is to adapt to varying environments, especially with illuminations. Without incurring any extra process to prepare new training samples for retraining, they are freely obtained as a result of the outlier rejection component, being extracted on-line. To realize a practical system, we adopt a parallel architecture integrating both recognition and retraining processes for seamless object recognition, and furthermore detect and cope with the deterioration of a retrained neural network to ensure high reliability. We demonstrate the positive effect of retraining on the object recognition performance by conducting experiments over hundreds of images obtained in daytime and nighttime.",2010-02-26,http://link.springer.com/openurl/pdf?id=doi:10.1007/s10489-010-0212-9,springer
Article,doi:10.1007/s12369-011-0113-z,Learning the Selection of Actions for an Autonomous Social Robot by Reinforcement Learning Based on Motivations,International Journal of Social Robotics,10.1007/s12369-011-0113-z,Springer,2011-11-01,"Autonomy is a prime issue on robotics field and it is closely related to decision making. Last researches on decision making for social robots are focused on biologically inspired mechanisms for taking decisions. Following this approach, we propose a motivational system for decision making, using internal (drives) and external stimuli for learning to choose the right action. Actions are selected from a finite set of skills in order to keep robot’s needs within an acceptable range. The robot uses reinforcement learning in order to calculate the suitability of every action in each state. The state of the robot is determined by the dominant motivation and its relation to the objects presents in its environment. The used reinforcement learning method exploits a new algorithm called Object Q-Learning. The proposed reduction of the state space and the new algorithm considering the collateral effects (relationship between different objects) results in a suitable algorithm to be applied to robots living in real environments. In this paper, a first implementation of the decision making system and the learning process is implemented on a social robot showing an improvement in robot’s performance. The quality of its performance will be determined by observing the evolution of the robot’s wellbeing.",2011-09-29,http://link.springer.com/openurl/pdf?id=doi:10.1007/s12369-011-0113-z,springer
Chapter ConferencePaper,doi:10.1007/978-3-642-24769-9_27,Market-Based Dynamic Task Allocation Using Heuristically Accelerated Reinforcement Learning,Progress in Artificial Intelligence,10.1007/978-3-642-24769-9_27,Springer,2011-01-01,"This paper presents a Multi-Robot Task Allocation (MRTA) system, implemented on a RoboCup Small Size League team, where robots participate of auctions for the available roles, such as attacker or defender, and use Heuristically Accelerated Reinforcement Learning to evaluate their aptitude to perform these roles, given the situation of the team, in real-time. The performance of the task allocation mechanism is evaluated and compared in different implementation variants, and results show that the proposed MRTA system significantly increases the team performance, when compared to pre-programmed team behavior algorithms.",,http://link.springer.com/openurl/pdf?id=doi:10.1007/978-3-642-24769-9_27,springer
Chapter ConferencePaper,doi:10.1007/978-3-642-20206-3_16,Dual Adaptive Neurocontrol of Mobile Robots Using the Unscented Transform: Monte Carlo and Experimental Validation,Computational Intelligence,10.1007/978-3-642-20206-3_16,Springer,2011-01-01,"In contrast to most adaptive schemes, dual adaptive controllers do not rely on the heuristic certainty equivalence assumption, but aim to strike a balance between estimation and control at all times. Yet, few such controllers have ever been implemented and tested in practice, especially within the context of intelligent control, and to the best of our knowledge none on mobile robots. With the help of Mont Carlo simulation and real-life experiments, this article presents and validates a novel dual adaptive neurocontroller based on the unscented transform, for the dynamic control of nonholonomic wheeled mobile robots. The robot nonlinear dynamic functions are unknown to the controller and a multilayer perceptron neural network, trained via an unscented Kalman predictor, is used for their approximation in real-time. Moreover, the proposed novel dual adaptive control law employs the unscented transform to improve further the system’s performance.",,http://link.springer.com/openurl/pdf?id=doi:10.1007/978-3-642-20206-3_16,springer
Article,doi:10.1007/s00521-009-0294-7,Application of neural processing paradigm in visual landmark recognition and autonomous robot navigation,Neural Computing and Applications,10.1007/s00521-009-0294-7,Springer,2010-03-01,"This article addresses the issue of visual landmark recognition in autonomous robot navigation along known routes, by intuitively exploiting the functions of the human visual system and its navigational ability. A feedforward–feedbackward architecture has been developed for recognising visual landmarks in real time. It integrates the theoretical concepts from the pre-attentive and attentive stages in the human visual system, the selective attention adaptive resonance theory neural network and its derivatives, and computational approaches towards object recognition in computer vision. The architecture mimics the pre-attentive and attentive stages in the context of object recognition, embedding neural network processing paradigm into a computational template-matching approach in computer vision. The real-time landmark recognition capability is achieved by mimicking the pre-attentive stage, where it models a selective attention mechanism for optimal computational resource allocation, focusing only on the regions of interest to address the computational restrictive nature of current computer processing power. Similarly, the recognition of visual landmarks in both clean and cluttered backgrounds is implemented in the attentive stage by developing a memory feedback modulation (MFM) mechanism that enables knowledge from the memory to interact and enhance the efficiency of earlier stages in the architecture. Furthermore, it also incorporates both top-down and bottom-up facilitatory and inhibition pathways between the memory and the earlier stages to enable the architecture to recognise a 2D landmark, which is partially occluded by adjacent features in the surroundings. The results show that the architecture is able to recognise objects in cluttered backgrounds using real-images in both indoor and outdoor scenes. Furthermore, the architecture application in autonomous robot navigation has been demonstrated through a number of real-time trials in both indoor and outdoor environments.",2009-08-20,http://link.springer.com/openurl/fulltext?id=doi:10.1007/s00521-009-0294-7,springer
Article,doi:10.1007/s10846-010-9462-3,Adaptive Impedance Control for Upper-Limb Rehabilitation Robot Using Evolutionary Dynamic Recurrent Fuzzy Neural Network,Journal of Intelligent & Robotic Systems,10.1007/s10846-010-9462-3,Springer,2011-06-01,"Control system implementation is one of the major difficulties in rehabilitation robot design. A newly developed adaptive impedance controller based on evolutionary dynamic fuzzy neural network (EDRFNN) is presented, where the desired impedance between robot and impaired limb can be regulated in real time according to the impaired limb’s physical recovery condition. Firstly, the impaired limb’s damping and stiffness parameters for evaluating its physical recovery condition are online estimated by using a slide average least squares (SALS)identification algorithm. Then, hybrid learning algorithms for EDRFNN impedance controller are proposed, which comprise genetic algorithm (GA), hybrid evolutionary programming (HEP) and dynamic back-propagation (BP) learning algorithm. GA and HEP are used to off-line optimize DRFNN parameters so as to get suboptimal impedance control parameters. Dynamic BP learning algorithm is further online fine-tuned based on the error gradient descent method. Moreover, the convergence of a closed loop system is proven using the discrete-type Lyapunov function to guarantee the global convergence of tracking error. Finally, simulation results show that the proposed controller provides good dynamic control performance and robustness with regard to the change of the impaired limb’s physical condition.",2010-09-15,http://link.springer.com/openurl/pdf?id=doi:10.1007/s10846-010-9462-3,springer
Article,doi:10.1007/s12555-010-0120-0,Position control of a mobile inverted pendulum system using radial basis function network,"International Journal of Control, Automation and Systems",10.1007/s12555-010-0120-0,Springer,2010-02-01,This article presents the implementation of position control of a mobile inverted pendulum (MIP) system by using the radial basis function (RBF) network. The MIP has two wheels to move on the plane and to balance the pendulum. The MIP is a nonlinear system whose dynamics is nonholonomic. The goal of this study was to control the MIP to maintain the balance of the pendulum while tracking a desired position of the cart. The reference compensation technique scheme is used as a neural network control method for the MIP. The back-propagation learning algorithm of the RBF network is derived for online learning and control. The control algorithm has been embedded on a DSP 2812 board to achieve real-time control. Experimental results are conducted and show successful control performances of both balancing and tracking the desired position of the MIP.,2010-02-17,http://link.springer.com/openurl/pdf?id=doi:10.1007/s12555-010-0120-0,springer
Article,doi:10.1007/s10677-009-9186-2,"Health Care, Capabilities, and AI Assistive Technologies",Ethical Theory and Moral Practice,10.1007/s10677-009-9186-2,Springer,2010-04-01,"Scenarios involving the introduction of artificially intelligent (AI) assistive technologies in health care practices raise several ethical issues. In this paper, I discuss four objections to introducing AI assistive technologies in health care practices as replacements of human care. I analyse them as demands for felt care, good care, private care, and real care. I argue that although these objections cannot stand as good reasons for a general and a priori rejection of AI assistive technologies as such or as replacements of human care, they demand us to clarify what is at stake, to develop more comprehensive criteria for good care, and to rethink existing practices of care. In response to these challenges, I propose a (modified) capabilities approach to care and emphasize the inherent social dimension of care. I also discuss the demand for real care by introducing the ‘Care Experience Machine’ thought experiment. I conclude that if we set the standards of care too high when evaluating the introduction of AI assistive technologies in health care, we have to reject many of our existing, low-tech health care practices.",2009-07-17,http://link.springer.com/openurl/fulltext?id=doi:10.1007/s10677-009-9186-2,springer
Article,doi:10.1007/s11633-010-0055-1,Action control of soccer robots based on simulated human intelligence,International Journal of Automation and Computing,10.1007/s11633-010-0055-1,Springer,2010-02-01,"A multi-modal action control approach is proposed for an autonomous soccer robot when the bottom hardware is unchangeable. Different from existing methods, the proposed control approach defines actions with the principle of “perception-planning-action” inspired by human intelligence. Character extraction is used to divide the perception input into different modes. Different control modes are built by combining different control methods for the linear velocity and angular velocity. Based on production rules, the motion control is realized by connecting different perceptions to the corresponding control mode. Simulation and real experiments are conducted with the middle-sized robot Frontier-I, and the proposed method is compared with a proportional-integral-derivative (PID) control method to display its feasibility and performance. The results show that the multi-modal action control method can make robots react rapidly in a dynamic environment.",2010-02-14,http://link.springer.com/openurl/pdf?id=doi:10.1007/s11633-010-0055-1,springer
Chapter,doi:10.1007/978-3-642-04025-2_9,Skill Transfer of a Mobile Robot Obtained by Reinforcement Learning to a Different Mobile Robot,Brain-Inspired Information Technology,10.1007/978-3-642-04025-2_9,Springer,2010-01-01,"Reinforcement learning (RL) is suitable for navigation of a mobile robot. We overcame some difficulties of RL which are large computational cost and determination of parameter values for RL with the help of a genetic algorithm (GA) and method of parameter prediction based on results of GA and complexity measure. As a result of these proposals, we succeeded in navigating the real robot practically. In our previous studies, we just one kind of mobile robot, which has three wheels. Our RL method can decrease the computational cost for learning of navigation and development of mobile robots, provided the skill obtained by RL for one mobile robot can be transferred to other mobile robots. To verify the generalization capability of RL in navigation of a mobile robot, the present paper proposes to transfer the skill obtained by RL to a different kind of a mobile robot. We carried out the experiment and we succeeded in transferring the skill obtained by RL to a different mobile robot.",,http://link.springer.com/openurl/pdf?id=doi:10.1007/978-3-642-04025-2_9,springer
Article,doi:10.1007/s00521-008-0181-7,"Neural networks for control, robotics and diagnostics",Neural Computing and Applications,10.1007/s00521-008-0181-7,Springer,2008-08-01,,2008-03-04,http://link.springer.com/openurl/fulltext?id=doi:10.1007/s00521-008-0181-7,springer
Article,doi:10.1007/s10472-008-9105-6,"Editorial: Annals of Mathematics and Artificial Intelligence special issue on multi-robot coverage, search, and exploration",Annals of Mathematics and Artificial Intelligence,10.1007/s10472-008-9105-6,Springer,2008-04-01,,2009-03-04,http://link.springer.com/openurl/pdf?id=doi:10.1007/s10472-008-9105-6,springer
Article,doi:10.1007/s12293-009-0015-x,Fast reinforcement learning for simple physical robots,Memetic Computing,10.1007/s12293-009-0015-x,Springer,2009-09-25,"In the past few years, the field of autonomous robot has been rigorously studied and non-industrial applications of robotics are rapidly emerging. One of the most interesting aspects of this field is the development of the learning ability which enables robots to autonomously adapt to given environments without human guidance. As opposed to the conventional methods of robots’ control, where human logically design the behavior of a robot, the ability to acquire action strategies through some learning processes will not only significantly reduce the production costs of robots but also improves the applicability of robots in wider tasks and environments. However, learning algorithms usually require large calculation cost, which make them unsuitable for robots with limited resources. In this study, we propose a simple two-layered neural network that implements a novel and fast Reinforcement Learning. The proposed learning method requires significantly less calculation resources, hence is applicable to small physical robots running in the real world environments. For this study, we built several simple robots and implemented the proposed learning mechanism to them. In the experiments, to evaluate the efficacy of the proposed learning mechanism, several robots were simultaneously trained to acquire obstacle avoidance strategies in the same environment, thus, forming a dynamic environment where the learning task is substantially harder than in the case of learning in a static environment and promising result was obtained.",2009-09-25,http://link.springer.com/openurl/pdf?id=doi:10.1007/s12293-009-0015-x,springer
Chapter ConferencePaper,doi:10.1007/978-3-642-15992-3_5,Learning and Fast Object Recognition in Robot Skill Acquisition: A New Method,Advances in Pattern Recognition,10.1007/978-3-642-15992-3_5,Springer,2010-01-01,"Invariant object recognition aims at recognising an object independently of its position, scale and orientation. This is important in robot skill acquisition during grasping operations especially when working in unstructured environments. In this paper we present an approach to aid the learning of manipulative skills on-line. We introduce and approach based on an ANN for object learning and recognition using a descriptive vector built on recurrent patterns. Experimental learning results using a fast camera are presented. Some simple parts (i.e. circular, squared and radiused-square) were used for comparing different connectionist models (Backpropagation, Perceptron and FuzzyARTMAP) and to select the appropriate model. Later during experiments, complex figures were learned using the chosen FuzzyARTMAP algorithm showing a 93.8% overall efficiency and 100% recognition rate with not so complex parts. Recognition times were lower than 1 ms, which clearly indicates the suitability of the approach to be implemented in robotic real-world operations.",,http://link.springer.com/openurl/pdf?id=doi:10.1007/978-3-642-15992-3_5,springer
