contentType,identifier,title,publicationName,doi,publisher,publicationDate,onlineDate,abstract,url,database
Chapter ConferencePaper,doi:10.1007/978-3-319-68600-4_17,Robot Localization and Orientation Detection Based on Place Cells and Head-Direction Cells,Artificial Neural Networks and Machine Learning – ICANN 2017,10.1007/978-3-319-68600-4_17,Springer,2017-01-01,2017-10-24,"Place cells and head-direction cells play important roles in animal navigation and have distinguishable firing properties in biology. Recently, a slowness principle has been argued as the fundamental learning mechanism behind these firing activities. Based on this principle, we extend previous work, which produced only a continuum of place and head-direction cells and mixtures thereof, to achieve a clean separation of two different cell types from just one exploration. Due to the unsupervised learning strategy, these firing activities do not contain explicit information of position or orientation of an agent. In order to read out these intangible activities for real robots, we propose that place cell activities can be utilized to build a self-organizing topological map of the environment and thus for robot localization. At the same time, the robot’s current orientation can be read out from the head-direction cell activities. The final experimental results demonstrate the feasibility and effectiveness of the proposed methods, which provide a basis for robot navigation.",http://link.springer.com/openurl/fulltext?id=doi:10.1007/978-3-319-68600-4_17,springer
Chapter ConferencePaper,doi:10.1007/978-3-319-68600-4_2,Mixing Actual and Predicted Sensory States Based on Uncertainty Estimation for Flexible and Robust Robot Behavior,Artificial Neural Networks and Machine Learning – ICANN 2017,10.1007/978-3-319-68600-4_2,Springer,2017-01-01,2017-10-24,"In this paper, we propose a method to dynamically modulate the input state of recurrent neural networks (RNNs) so as to realize flexible and robust robot behavior. We employ the so-called stochastic continuous-time RNN (S-CTRNN), which can learn to predict the mean and variance (or uncertainty) of subsequent sensorimotor information. Our proposed method uses this estimated uncertainty to determine a mixture ratio for combining actual and predicted sensory states of network input. The method is evaluated by conducting a robot learning experiment in which a robot is required to perform a sensory-dependent task and a sensory-independent task. The sensory-dependent task requires the robot to incorporate meaningful sensory information, and the sensory-independent task requires the robot to ignore irrelevant sensory information. Experimental results demonstrate that a robot controlled by our proposed method exhibits flexible and robust behavior, which results from dynamic modulation of the network input on the basis of the estimated uncertainty of actual sensory states.",http://link.springer.com/openurl/fulltext?id=doi:10.1007/978-3-319-68600-4_2,springer
Article,doi:10.1007/s13218-016-0443-y,Looking Back on 20 Years of RoboCup,KI - Künstliche Intelligenz,10.1007/s13218-016-0443-y,Springer,2016-10-01,2016-07-25,,http://link.springer.com/openurl/fulltext?id=doi:10.1007/s13218-016-0443-y,springer
Article,doi:10.1007/s13218-015-0423-7,AI and Robotics: RoboCup Evolution,KI - Künstliche Intelligenz,10.1007/s13218-015-0423-7,Springer,2016-10-01,2016-01-26,,http://link.springer.com/openurl/fulltext?id=doi:10.1007/s13218-015-0423-7,springer
Article,doi:10.1007/s11548-015-1340-9,Erratum to: Surgical robotics beyond enhanced dexterity instrumentation: a survey of machine learning techniques and their role in intelligent and autonomous surgical actions,International Journal of Computer Assisted Radiology and Surgery,10.1007/s11548-015-1340-9,Springer,2016-05-01,2016-01-11,,http://link.springer.com/openurl/fulltext?id=doi:10.1007/s11548-015-1340-9,springer
Article,doi:10.1007/s11063-015-9435-4,Editorial: Neural Processing Letters Special Issue on “Neural Networks for Vision and Robotics” ,Neural Processing Letters,10.1007/s11063-015-9435-4,Springer,2016-04-01,2015-05-10,,http://link.springer.com/openurl/fulltext?id=doi:10.1007/s11063-015-9435-4,springer
Chapter ConferencePaper,doi:10.1007/978-3-319-46131-1_33,Practical Bayesian Inverse Reinforcement Learning for Robot Navigation,Machine Learning and Knowledge Discovery in Databases,10.1007/978-3-319-46131-1_33,Springer,2016-01-01,2016-09-03,"Inverse reinforcement learning (irl) provides a concise framework for learning behaviors from human demonstrations; and is highly desired in practical and difficult to specify tasks such as normative robot navigation. However, most existing irl algorithms are often ladened with practical challenges such as representation mismatch and poor scalability when deployed in real world tasks. Moreover, standard reinforcement learning (rl) representations often do not allow for incorporation of task constraints common for example in robot navigation. In this paper, we present an approach that tackles these challenges in a unified manner and delivers a learning setup that is both practical and scalable. We develop a graph-based spare representation for rl and a scalable irl algorithm based on sampled trajectories. Experimental evaluation in simulation and from a real deployment in a busy airport demonstrate the strengths of the learning setup over existing approaches.",http://link.springer.com/openurl/fulltext?id=doi:10.1007/978-3-319-46131-1_33,springer
Chapter ReferenceWorkEntry,doi:10.1007/978-1-4899-7502-7_738-1,Robot Learning,Encyclopedia of Machine Learning and Data Mining,10.1007/978-1-4899-7502-7_738-1,Springer,2016-01-01,2016-08-04,,http://link.springer.com/openurl/fulltext?id=doi:10.1007/978-1-4899-7502-7_738-1,springer
Chapter ConferencePaper,doi:10.1007/978-3-319-47437-3_28,Emotion in Robots Using Convolutional Neural Networks,Social Robotics,10.1007/978-3-319-47437-3_28,Springer,2016-01-01,2016-10-07,"These years, emotion recognition has been one of the hot topics in computer science and especially in Human-Robot Interaction (HRI) and Robot-Robot Interaction (RRI). By emotion (recognition and expression), robots can recognize human behavior and emotion better and can communicate in a more human way. On that point are some research for unimodal emotion system for robots, but because, in the real world, Human emotions are multimodal then multimodal systems can work better for the recognition. Yet, beside this multimodality feature of human emotion, using a flexible and reliable learning method can help robots to recognize better and makes more beneficial interaction. Deep learning showed its force in this area and here our model is a multimodal method which use 3 main traits (Facial Expression, Speech and gesture) for emotion (recognition and expression) in robots. We implemented the model for six basic emotion states and there are some other states of emotion, such as mix emotions, which are really laborious to be picked out by robots. Our experiments show that a significant improvement of identification accuracy is accomplished when we use convolutional Neural Network (CNN) and multimodal information system, from 91 % reported in the previous research [ 27 ] to 98.8 %.",http://link.springer.com/openurl/fulltext?id=doi:10.1007/978-3-319-47437-3_28,springer
Article,doi:10.1007/s11063-015-9452-3,An Evolutionary Radial Basis Function Neural Network with Robust Genetic-Based Immunecomputing for Online Tracking Control of Autonomous Robots,Neural Processing Letters,10.1007/s11063-015-9452-3,Springer,2016-08-01,2015-06-25,This paper presents an evolutionary radial basis function neural network with genetic algorithm and artificial immune system (GAAIS-RBFNN) for tracking control of autonomous robots. Both the GAAIS-RBFNN computational intelligence and online tracking controller are implemented in one field-programmable gate array (FPGA) chip to cope with the optimal control problem of real-world mobile robotics. The hybrid GAAIS paradigm incorporated with Taguchi quality method is employed to determine the optimal structure of RBFNN. The control parameters of tracking controller are online tuned by minimizing the performance index using the proposed GAAIS-RBFNN to achieve trajectory tracking. Experimental results and comparative works are conducted to show the effectiveness and merit of the proposed FPGA-based GAAIS-RBFNN tracking controller using system-on-a-programmable-chip technology. This FPGA-based online hybrid GAAIS-RBFNN intelligent controller outperforms the existing bio-inspired RBFNN controllers using individual GA and AIS algorithms.,http://link.springer.com/openurl/fulltext?id=doi:10.1007/s11063-015-9452-3,springer
Chapter ConferencePaper,doi:10.1007/978-3-319-44778-0_40,Dynamical Linking of Positive and Negative Sentences to Goal-Oriented Robot Behavior by Hierarchical RNN,Artificial Neural Networks and Machine Learning – ICANN 2016,10.1007/978-3-319-44778-0_40,Springer,2016-01-01,2016-08-13,"Meanings of language expressions are constructed not only from words grounded in real-world matters, but also from words such as “not” that participate in the construction by working as logical operators. This study proposes a connectionist method for learning and internally representing functions that deal with both of these word groups, and grounding sentences constructed from them in corresponding behaviors just by experiencing raw sequential data of an imposed task. In the experiment, a robot implemented with a recurrent neural network is required to ground imperative positive and negative sentences given as a sequence of words in corresponding goal-oriented behavior. Analysis of the internal representations reveals that the network fulfilled the requirement by extracting XOR problems implicitly included in the target sequences and solving them by learning to represent the logical operations in its nonlinear dynamics in a self-organizing manner.",http://link.springer.com/openurl/fulltext?id=doi:10.1007/978-3-319-44778-0_40,springer
Chapter ConferencePaper,doi:10.1007/978-3-319-50115-4_29,EUROPtus: A Mixed-Initiative Controller for Multi-vehicle Oceanographic Field Experiments,2016 International Symposium on Experimental Robotics,10.1007/978-3-319-50115-4_29,Springer,2017-01-01,2017-03-21,"Our research concerns the mixed-initiative coordination of air and underwater vehicles interacting over inter-operated radio and underwater communication networks for novel oceanographic field studies. In such an environment, operating multiple vehicles to observe dynamic oceanographic events such as fronts, plumes, blooms and cetaceans has required that we design, implement and operate software, methods and processes which can support ephemeral and unpredictable observations (including those of moving animals) in real-world settings with substantial constraints. We articulate an approach for coordinated measurements using such platforms, which relate directly to task outcomes. We show the use and operational value of a new Artificial Intelligence (AI) based mixed-initiative system, EUROPtus , for handling multiple platforms from a recent field experiment in open waters of the mid-Atlantic.",http://link.springer.com/openurl/fulltext?id=doi:10.1007/978-3-319-50115-4_29,springer
Chapter,doi:10.1007/978-3-319-53327-8_14,Multiagent Approach to Control a Multisection Trunk-Type Manipulator,Smart Electromechanical Systems: The Central Nervous System,10.1007/978-3-319-53327-8_14,Springer,2017-01-01,2017-03-21,"Purpose We consider a multisection trunk type manipulator built on the basis of parallel structure mechanisms, for example, on the basis of tripods or hexapods. Control of such a manipulator is a serious problem, as, in addition to control of each section of the manipulator, it is necessary to control the entire structure. To resolve this problem we suggest using a multiagent approach, neural networks and neuro-fuzzy technologies. We introduce an automatic control system for the trunk type manipulator, as well as the functions implemented by the coordinator and agents of this system. Results We investigate the efficiency of the adaptive agent built on the basis of a neural network inverse model of the control object, as well as on the basis of the reference model of the object in the form of another multilayer neural network . Practical value The presented in the article the automatic control system for the trunk type manipulator can be used to create intelligent robotic system capable to react to changing uncertain conditions in real time.",http://link.springer.com/openurl/fulltext?id=doi:10.1007/978-3-319-53327-8_14,springer
Chapter ConferencePaper,doi:10.1007/978-3-319-66471-2_3,Emotion Recognition System for Human-Robot Interface: Comparison of Two Approaches,Interactive Collaborative Robotics,10.1007/978-3-319-66471-2_3,Springer,2017-01-01,2017-08-11,This paper describes a system for automatic emotion recognition developed to enhance the communication capabilities of an anthropomorphic robot. Two versions of the classification algorithm are proposed and compared. The first version is based on a classic approach requiring the action unit estimation as a preliminary step to emotion recognition. The second version takes advantage of convolutional neural networks as a classifier. The designed system is capable of working in real time. The algorithms were implemented on C++ and tested on an extensive face expression database as well as in real conditions.,http://link.springer.com/openurl/fulltext?id=doi:10.1007/978-3-319-66471-2_3,springer
Chapter ConferencePaper,doi:10.1007/978-3-319-46687-3_31,Learning Visually Guided Risk-Aware Reaching on a Robot Controlled by a GPU Spiking Neural Network,Neural Information Processing,10.1007/978-3-319-46687-3_31,Springer,2016-01-01,2016-09-29,"Risk-aware control is a new type of robust nonlinear stochastic controller in which state variables are represented by time-varying probability densities and the desired trajectory is replaced by a cost function that specifies both the goals of movement and the potential risks associated with deviations. Efficient implementation is possible using the theory of Stochastic Dynamic Operators (SDO), because for most physical systems the SDO operators are near-diagonal and can thus be implemented using distributed computation. I show such an implementation using 4.3 million spiking neurons simulated in real-time on a GPU. I demonstrate successful control of a commercial desktop robot for a visually-guided reaching task, and I show that the operators can be learned during repetitive practice using a recursive learning rule.",http://link.springer.com/openurl/fulltext?id=doi:10.1007/978-3-319-46687-3_31,springer
Article,doi:10.1007/s11063-015-9426-5,Introducing Synaptic Delays in the NEAT Algorithm to Improve Modelling in Cognitive Robotics,Neural Processing Letters,10.1007/s11063-015-9426-5,Springer,2016-04-01,2015-04-28,"This paper describes and tests an approach to improve the temporal processing capabilities of the neuroevolution of augmenting topologies (NEAT) algorithm. This algorithm is quite popular within the robotics community for the production of trained neural networks without having to determine a priori their size and topology. The main drawback of the traditional NEAT algorithm is that, even though it can implement recurrent synaptic connections, which allow it to perform some time related processing tasks, its capabilities are rather limited, especially when dealing with precise time dependent phenomena. NEAT’s ability to capture the underlying dynamics that correspond to complex time series still has a lot of room for improvement. To address this issue, the paper describes a new implementation of the NEAT algorithm that is able to generate artificial neural networks (ANNs) with trainable time delayed synapses in addition to its previous capacities. We show that this approach, called $$\uptau $$ τ -NEAT improves the behavior of the neural networks obtained when dealing with complex time related processes. Several examples are presented, both dealing with the generation of ANNs that are able to produce complex theoretical signals such as chaotic signals or real data series, as in the case of the monthly number of international airline passengers or monthly $$\hbox {CO}_{2}$$ CO 2 concentrations. In these examples, $$\uptau $$ τ -NEAT clearly improves over the traditional NEAT algorithm in these tasks. A final example of the integration of this approach within a robot cognitive mechanism is also presented, showing the clear improvements it could provide in the modeling required for many cognitive processes.",http://link.springer.com/openurl/fulltext?id=doi:10.1007/s11063-015-9426-5,springer
Chapter ConferencePaper,doi:10.1007/978-3-319-39883-9_24,Robot Dream,Agent and Multi-Agent Systems: Technology and Applications,10.1007/978-3-319-39883-9_24,Springer,2016-01-01,2016-06-01,"In this position paper we present a novel approach to neurobiologically plausible implementation of emotional reactions and behaviors for real-time autonomous robotic systems. The working metaphor we use is the “day” and “night” phases of mammalian life. During the “day” phase a robotic system stores the inbound information and is controlled by a light-weight rule-based system in real time. In contrast to that, during the “night” phase the stored information is been transferred to the supercomputing system to update the realistic neural network: emotional and behavioral strategies.",http://link.springer.com/openurl/fulltext?id=doi:10.1007/978-3-319-39883-9_24,springer
Chapter,doi:10.1007/978-3-319-26485-1_28,The Seminal Speculation of a Precursor: Elements of Embodied Cognition and Situated AI in Alan Turing,Fundamental Issues of Artificial Intelligence,10.1007/978-3-319-26485-1_28,Springer,2016-01-01,2016-06-08,"Turing’s visionary contribution to cognitive science is not limited to the foundation of the symbolist approach to cognition and to the exploration of the connectionist approach: it additionally anticipated the germinal disclosure of the embodied approach. Even if Turing never directly dealt with the foundational speculation on the conceptual premises of embodiment, in his theoretical papers we find traces of the idea that a cognitive agent must develop a history of coupling with its natural and social environment, and that primitive bodily stimuli like pain and pleasure drive this coupling and elevate it to real learning by setting its normative preconditions. Turing did not consistently defend the centrality of embodiment, and ended up confounding or deemphasizing in various occasions the critical importance that he had himself implicitly recognized to the body. In line with the anti-representationist, radically enactive approaches to basic cognition, I believe that if Turing eventually failed to fully value the cognitive-developmental role played by the body, this was not because he proposed a computational and functionalist model of the mind, but because he tacitly assumed the content/vehicle dichotomy as a primitive of that model: in fact, he still believed that intelligence is a realized by decontextualized contents that can be detached and transmitted regardless of their mode of physical implementation.",http://link.springer.com/openurl/fulltext?id=doi:10.1007/978-3-319-26485-1_28,springer
Article,doi:10.1007/s11760-015-0805-1,"Real-time, automatic shape-changing robot adjustment and gender classification","Signal, Image and Video Processing",10.1007/s11760-015-0805-1,Springer,2016-04-01,2015-07-31,"This paper introduces the results of novel theoretical and practical studies aimed at providing automatic and accurate real-time activation and adjustment of shape-changing robots in accord to the shape of the body of the user. The proposed method consists of scanning, classifying the instances according to gender and size, performing analysis on both the user’s body and the prospective garment, which is be virtually fitted, modelling, extracting measurements and assigning reference points on them, segmenting the 3D visual data imported from the shape-changing robot, and finally, superimposing, adopting and depicting the resulting garment model on the user’s body. The estimation process of the positions of the moving actuators for adjusting the shape-changing robots tries to determine which input values could result in the closest representation of the desired sizes and distances through devising the mathematical description of a map relating them to each other. In order to classify the data obtained by the 3D scanner, first maximum likelihood function is used for selecting one of the shape-changing robots, according to the presumed gender and size, to be activated, and subsequently, support vector machine is utilized so as to find out which shape template from the dictionary best matches the scanning instance being considered. As a use case, the proposed method is applied to the visual data obtained by scanning Fits.me’s shape-changing robots using 3D laser scanner. The methods currently used are manual, whereas the proposed method is automatic and the experimental results show that it is the accurate and reliable.",http://link.springer.com/openurl/fulltext?id=doi:10.1007/s11760-015-0805-1,springer
Article,doi:10.1007/s10015-015-0258-1,Reinforcement learning in dynamic environment: abstraction of state-action space utilizing properties of the robot body and environment,Artificial Life and Robotics,10.1007/s10015-015-0258-1,Springer,2016-03-01,2016-01-18,"In this paper, we address the autonomous control of a 3D snake-like robot through the use of reinforcement learning, and we apply it in a dynamic environment. In general, snake-like robots have high mobility that is realized by many degrees of freedom, and they can move over dynamically shifting environments such as rubble. However, this freedom and flexibility leads to a state explosion problem, and the complexity of the dynamic environment leads to incomplete learning by the robot. To solve these problems, we focus on the properties of the actual operating environment and the dynamics of a mechanical body. We design the body of the robot so that it can abstract small, but necessary state-action space by utilizing these properties, and we make it possible to apply reinforcement learning. To demonstrate the effectiveness of the proposed snake-like robot, we conduct experiments; from the experimental results we conclude that learning is completed within a reasonable time, and that effective behaviors for the robot to adapt itself to an unknown 3D dynamic environment were realized.",http://link.springer.com/openurl/fulltext?id=doi:10.1007/s10015-015-0258-1,springer
Chapter ConferencePaper,doi:10.1007/978-3-319-44781-0_5,Deep Learning for Emotion Recognition in Faces,Artificial Neural Networks and Machine Learning – ICANN 2016,10.1007/978-3-319-44781-0_5,Springer,2016-01-01,2016-08-13,"Deep Learning (DL) has shown real promise for the classification efficiency for emotion recognition problems. In this paper we present experimental results for a deeply-trained model for emotion recognition through the use of facial expression images. We explore two Convolutional Neural Network (CNN) architectures that offer automatic feature extraction and representation, followed by fully connected softmax layers to classify images into seven emotions. The first architecture explores the impact of reducing the number of deep learning layers and the second splits the input images horizontally into two streams based on eye and mouth positions. The first proposed architecture produces state of the art results with an accuracy rate of 96.93 % and the second architecture with split input produces an average accuracy rate of 86.73 %, respectively.",http://link.springer.com/openurl/fulltext?id=doi:10.1007/978-3-319-44781-0_5,springer
Chapter ConferencePaper,doi:10.1007/978-3-319-31153-1_14,On-line Evolution of Foraging Behaviour in a Population of Real Robots,Applications of Evolutionary Computation,10.1007/978-3-319-31153-1_14,Springer,2016-01-01,2016-04-02,"This paper describes a study in evolutionary robotics conducted completely in hardware without using simulations. The experiments employ on-line evolution, where robot controllers evolve on-the-fly in the robots’ environment as the robots perform their tasks. The main issue we consider is the feasibility of tackling a non-trivial task in a realistic timeframe. In particular, we investigate whether a population of six robots can evolve foraging behaviour in one hour. The experiments demonstrate that this is possible and they also shed light on some of the important features of our evolutionary system. Further to the specific results we also advocate the system itself. It provides an example of a replicable and affordable experimental set-up for other researches to engage in research into on-line evolution in a population of real robots.",http://link.springer.com/openurl/fulltext?id=doi:10.1007/978-3-319-31153-1_14,springer
Article,doi:10.1186/1471-2202-16-S1-P169,ROS-MUSIC toolchain for spiking neural network simulations in a robotic environment,BMC Neuroscience,10.1186/1471-2202-16-S1-P169,BioMed Central,2015-12-18,2015-12-18,,https://www.biomedcentral.com/openurl?doi=10.1186/1471-2202-16-S1-P169,springer
Article,doi:10.1186/1471-2202-16-S1-P104,Spiking neural network configuration designed for switching between basic forms of movement in a biped robot,BMC Neuroscience,10.1186/1471-2202-16-S1-P104,BioMed Central,2015-12-18,2015-12-18,,https://www.biomedcentral.com/openurl?doi=10.1186/1471-2202-16-S1-P104,springer
