contentType,identifier,title,publicationName,doi,publisher,publicationDate,onlineDate,abstract,url,database
Chapter ConferencePaper,doi:10.1007/978-3-030-55789-8_6,Push Recovery and Active Balancing for Inexpensive Humanoid Robots Using RL and DRL,Trends in Artificial Intelligence Theory and Applications. Artificial Intelligence Practices,10.1007/978-3-030-55789-8_6,Springer,2020-01-01,2020-09-04,"Push recovery of a humanoid robot is a challenging task because of many different levels of control and behaviour, from walking gait to dynamic balancing. This research focuses on the active balancing and push recovery problems that allow inexpensive humanoid robots to balance while standing and walking, and to compensate for external forces. In this research, we have proposed a push recovery mechanism that employs two machine learning techniques, Reinforcement Learning and Deep Reinforcement Learning, to learn recovery step trajectories during push recovery using a closed-loop feedback control. We have implemented a 3D model using the Robot Operating System and Gazebo. To reduce wear and tear on the real robot, we used this model for learning the recovery steps for different impact strengths and directions. We evaluated our approach in both in the real world and in simulation. All the real world experiments are performed by Polaris, a teen-sized humanoid robot.",http://link.springer.com/openurl/fulltext?id=doi:10.1007/978-3-030-55789-8_6,springer
Chapter ConferencePaper,doi:10.1007/978-3-030-50729-9_22,A Robot Agent that Learns Group Interaction Through a Team-Based Virtual Reality Game Using Affective Reward Reinforcement Learning,HCI International 2020 - Posters,10.1007/978-3-030-50729-9_22,Springer,2020-01-01,2020-07-10,"In the near future, robots are expected to be integrated into people’s lives, interacting with them. To develop better robotics and artificial intelligence, this research focuses on the concept of teamwork. A robot agent was implemented in a virtual reality(VR) game to play the sport roundnet, a team-based sport similar to table tennis and volleyball [ 2 ]. The agent is trained with reinforcement learning with EDA skin sensor data [ 6 ] of players. The system is evaluated using a questionnaire on the player’s feeling during the experiment and compared with agents not trained with affective data. The system is implemented in Unity3D’s ML-Agents Toolkit.",http://link.springer.com/openurl/fulltext?id=doi:10.1007/978-3-030-50729-9_22,springer
Chapter ConferencePaper,doi:10.1007/978-3-030-51005-3_5,Intelligent Playful Environments in New Urban Social Landscape,Science and Technologies for Smart Cities,10.1007/978-3-030-51005-3_5,Springer,2020-01-01,2020-07-28,"The concept of Smart Cities are giving lots of opportunities for using technology to make citizens heathier and happier in the future cities. Recent development of artificial intelligence and its capacity to support people in creative and learning processes can be crucial factor in changing social landscape and lead to novel social innovations. In this paper, we are presenting art/research projects, and design experiments of interactive designer Predrag K. Nikolic exposed in various public spaces within the period of last ten years. The conceptual idea behind the projects has been to affect human behavior through novel interactions within playful mix realities and lastly in artificial reality (AIR) as new user experience phenomena in a new urban social landscape.",http://link.springer.com/openurl/fulltext?id=doi:10.1007/978-3-030-51005-3_5,springer
Chapter ConferencePaper,doi:10.1007/978-3-030-36150-1_35,Using a Collaborative Robot to the Upper Limb Rehabilitation,Robot 2019: Fourth Iberian Robotics Conference,10.1007/978-3-030-36150-1_35,Springer,2020-01-01,2019-11-20,"Rehabilitation is a relevant process for the recovery from dysfunctions and improves the realization of patient’s Activities of Daily Living (ADLs). Robotic systems are considered an important field within the development of physical rehabilitation, thus allowing the collection of several data, besides performing exercises with intensity and repeatedly. This paper addresses the use of a collaborative robot applied in the rehabilitation field to help the physiotherapy of upper limb of patients, specifically shoulder. To perform the movements with any patient the system must learn to behave to each of them. In this sense, the Reinforcement Learning (RL) algorithm makes the system robust and independent of the path of motion. To test this approach, it is proposed a simulation with a UR3 robot implemented in V-REP platform. The main control variable is the resistance force that the robot is able to do against the movement performed by the human arm.",http://link.springer.com/openurl/fulltext?id=doi:10.1007/978-3-030-36150-1_35,springer
Article,doi:10.1007/s10846-019-01031-z,An Intelligent Hybrid Artificial Neural Network-Based Approach for Control of Aerial Robots,Journal of Intelligent & Robotic Systems,10.1007/s10846-019-01031-z,Springer,2020-02-01,2019-05-04,"In this work, a learning model-free control method is proposed for accurate trajectory tracking and safe landing of unmanned aerial vehicles (UAVs). A realistic scenario is considered where the UAV commutes between stations at high-speeds, experiences a single motor failure while surveying an area, and thus requires to land safely at a designated secure location. The proposed challenge is viewed solely as a control problem. A hybrid control architecture – an artificial neural network (ANN)-assisted proportional-derivative controller – is able to learn the system dynamics online and compensate for the error generated during different phases of the considered scenario: fast and agile flight, motor failure, and safe landing. Firstly, it deals with unmodelled dynamics and operational uncertainties and demonstrates superior performance compared to a conventional proportional-integral-derivative controller during fast and agile flight. Secondly, it behaves as a fault-tolerant controller for a single motor failure case in a coaxial hexacopter thanks to its proposed sliding mode control theory-based learning architecture. Lastly, it yields reliable performance for a safe landing at a secure location in case of an emergency condition. The tuning of weights is not required as the structure of the ANN controller starts to learn online, each time it is initialised, even when the scenario changes – thus, making it completely model-free. Moreover, the simplicity of the neural network-based controller allows for the implementation on a low-cost low-power onboard computer. Overall, the real-time experiments show that the proposed controller outperforms the conventional controller.",http://link.springer.com/openurl/pdf?id=doi:10.1007/s10846-019-01031-z,springer
Chapter ConferencePaper,doi:10.1007/978-3-030-44267-5_25,Continuous Control in Deep Reinforcement Learning with Direct Policy Derivation from Q Network,"Human Interaction, Emerging Technologies and Future Applications II",10.1007/978-3-030-44267-5_25,Springer,2020-01-01,2020-04-03,"The reinforcement learning approach allows learning desired control policy in different environments without explicitly providing system dynamics. A model-free deep Q-learning algorithm is proven to be efficient on a large set of discrete-action tasks. Extension of this method to the continuous control task usually solved with actor-critic methods which approximate a policy function with additional actor network and uses Q function to speed up policy network training. Another approach is to discretize action space which will not give a smooth policy and is not applicable for large action spaces. A direct continuous policy derivation from the Q network leads to optimization of action on each inference and training step which is not efficient but provides optimal and continuous action. Time-efficient Q function input optimization is required in order to apply this method in practice. In this work, we implement efficient action derivation method which allows using Q-learning in real-time continuous control tasks. In addition, we test our algorithm on robotics control tasks from robotics gym environments and compare this method with modern continuous RL methods. The results have shown that in some cases proposed approach learns smooth continuous policy keeping the implementation simplicity of the original discreet action space Q-learning algorithm.",http://link.springer.com/openurl/fulltext?id=doi:10.1007/978-3-030-44267-5_25,springer
Chapter ConferencePaper,doi:10.1007/978-3-030-63955-6_21,Simulation Training Remote Control System of Industrial Robot Based on Deep Learning,"e-Learning, e-Education, and Online Training",10.1007/978-3-030-63955-6_21,Springer,2020-01-01,2020-12-13,"In order to improve the remote control performance of industrial robot simulation training, deep learning algorithm is used to optimize the design of traditional remote control system. On the basis of traditional remote control system, the configuration of hardware system is modified, and the database of control system is established. With the support of hardware system and database, the remote control of two training items of industrial robot simulation mobile training and simulation picking training are realized respectively. Through the system test experiment, the conclusion is drawn: compared with the traditional industrial robot remote control system, the control function of the design control system is improved, and the system can save about 12.5 s response time in the control process.",http://link.springer.com/openurl/fulltext?id=doi:10.1007/978-3-030-63955-6_21,springer
Chapter ConferencePaper,doi:10.1007/978-3-030-60128-7_21,Producing an Immersive Experience Using Human-Robot Interaction Stimuli,"HCI International 2020 – Late Breaking Papers: Cognition, Learning and Games",10.1007/978-3-030-60128-7_21,Springer,2020-01-01,2020-10-04,"Human-Robot Interaction (HRI) is an emerging topic within contemporary science and this topic spans the literatures between engineering, psychology, computer science, artificial intelligence, machine learning and robotics. The study of HRI requires scenarios and other affordances from which to contextualize the HRI to study the factors that shape human attitudes, behaviors, and biases as they relate to robots. The current paper details the rationale, software/hardware, and contextual considerations associated with the creation of HRI stimuli used in experiments, specifically the creation of a set of video stimuli. These stimuli centered on the concept of an autonomous security robot (ASR) and provided a scenario wherein humans (research confederates) would interact with the ASR in a realistic scenario. A video was created to foster a realistic visual and auditory representation of the HRI encounter from a dynamic perspective – meaning shifting perspectives between a first-person experiential vantage point to a birds-eye-view of the broader situation. The scenario used involved a security context where the confederates sought access to a secure facility. The ASR’s role was to examine visitor access credentials and determine if the visitor was authorized or not. The robot’s behaviors, while scripted, were depicted as autonomous in the video and included verbal interactions/instructions as well as physical limb motions, gestures, and instructions. Several important features of the stimuli were considered in its creation, namely: realism, immersive experience, and simulated vulnerability of the human to the robot. The current paper walks through each of these considerations with details provided in our approach. To date, the HRI stimuli have been used in multiple experiments and have demonstrated flexibility in addressing multiple research questions in the domain of HRI.",http://link.springer.com/openurl/fulltext?id=doi:10.1007/978-3-030-60128-7_21,springer
Chapter ConferencePaper,doi:10.1007/978-3-030-60337-3_8,Collision Detection in the Work of Collaborative Robots Using an Intelligent System,Interactive Collaborative Robotics,10.1007/978-3-030-60337-3_8,Springer,2020-01-01,2020-09-30,"This paper describes an approach to applying the JSM method for automatic recognition of collision situations when working with collaborative robots. The approach uses the description of situations in the form of a set of primitives that determine the position of a person in the work space and allow you to distinguish a person from surrounding objects. An intelligent JSM system requires training that can be realized in real time. In the course of experiments, the efficiency of the proposed approach was confirmed and estimates of the collision detection time were made.",http://link.springer.com/openurl/fulltext?id=doi:10.1007/978-3-030-60337-3_8,springer
Chapter ConferencePaper,doi:10.1007/978-3-030-48989-2_56,"Crashing to Learn, Learning to Survive: Planning in Dynamic Environments via Domain Randomization",Advances in Service and Industrial Robotics,10.1007/978-3-030-48989-2_56,Springer,2020-01-01,2020-06-19,"Autonomous robots in the real world should avert collisions with pedestrians and react quickly to sudden changes in the environment. Most local planners rely on static environment maps that cannot capture such critical elements of uncertainty. Learning based methods for end-to-end navigation have become popular recently, but it is still unclear how to incorporate collision avoidance in a simple, safe and quick manner. We propose a reinforcement learning curriculum based on domain randomization to train a high performing policy entirely in simulation. The policy is first trained in a simple obstacle-free environment to quickly learn point to point navigation. The learned policy is transferred to a dynamic environment to learn collision avoidance. The key idea is to randomize the obstacle dynamics to obtain a robust planner that can be directly deployed to the real world. The resultant policy outperforms conventional planners in dynamic real world environments, even when the robot is intentionally obstructed.",http://link.springer.com/openurl/fulltext?id=doi:10.1007/978-3-030-48989-2_56,springer
Chapter ReferenceWorkEntry,doi:10.1007/978-3-319-74336-3_636-1,Autonomous Weapon Systems (AWS),The Palgrave Encyclopedia of Global Security Studies,10.1007/978-3-319-74336-3_636-1,Springer,2020-01-01,2020-09-05,,http://link.springer.com/openurl/fulltext?id=doi:10.1007/978-3-319-74336-3_636-1,springer
Chapter ConferencePaper,doi:10.1007/978-981-15-3242-9_21,Sapling Health Monitoring System,Advanced Computing Technologies and Applications,10.1007/978-981-15-3242-9_21,Springer,2020-01-01,2020-05-07,"Aim is to create a system that helps in time to time analysis of field to collect real-time data of field crops about moisture, soil pH, etc. System also helps in detecting diseases if any in crops by collecting their leaf snaps. The paper briefly explains the system and its architecture which is implemented on a rover equipped to collect data and is further processed using deep learning concepts. The paper discusses the real-world implementation of this device and its work cycle.",http://link.springer.com/openurl/fulltext?id=doi:10.1007/978-981-15-3242-9_21,springer
Chapter,doi:10.1007/978-981-32-9990-0_5,Autonomous Robot Navigation Using Moth-Flame-Based Neuroevolution,Evolutionary Machine Learning Techniques,10.1007/978-981-32-9990-0_5,Springer,2020-01-01,2019-11-12,"Determining the best set of weights and biases for training neural networks (NN) using gradient descent techniques is a computationally challenging task. On the other hand, training of gradient descent algorithms suffers from being trapped in local optima and slow convergence speed in the last iterations. The moth-flame optimization (MFO) is a novel evolutionary method based on navigation paths of moths in nature. This algorithm showed its effectiveness in many real-world optimization problems. In this chapter, MFO is employed for training multilayer perceptron (MLP) to overcome the problems of gradient descent algorithms. This algorithm also investigates the application of the MFO for tackling the navigation of autonomous mobile robots. The results are compared with four powerful evolutionary algorithms including gray wolf optimizer (GWO), cuckoo search (CS), multiverse optimizer algorithm (MVO), and particle swarm optimization (PSO). Moreover, the results are compared to two gradient-based training MLP algorithms including Levenberg–Marquardt (LM) and back-propagation (BP). The evaluation metrics used in this book chapter are accuracy and area under the curve (AUC). The experimental results show that MFO-based MLP algorithm outperforms other algorithms and showed its capabilities effectively.",http://link.springer.com/openurl/fulltext?id=doi:10.1007/978-981-32-9990-0_5,springer
Chapter ConferencePaper,doi:10.1007/978-3-030-29135-8_3,The AI Driving Olympics at NeurIPS 2018,The NeurIPS '18 Competition,10.1007/978-3-030-29135-8_3,Springer,2020-01-01,2019-11-30,"Despite recent breakthroughs, the ability of deep learning and reinforcement learning to outperform traditional approaches to control physically embodied robotic agents remains largely unproven. To help bridge this gap, we present the “AI Driving Olympics” (AI-DO), a competition with the objective of evaluating the state of the art in machine learning and artificial intelligence for mobile robotics. Based on the simple and well-specified autonomous driving and navigation environment called “Duckietown,” the AI-DO includes a series of tasks of increasing complexity—from simple lane-following to fleet management. For each task, we provide tools for competitors to use in the form of simulators, logs, code templates, baseline implementations and low-cost access to robotic hardware. We evaluate submissions in simulation online, on standardized hardware environments, and finally at the competition event. The first AI-DO, AI-DO 1, occurred at the Neural Information Processing Systems (NeurIPS) conference in December 2018. In this paper we will describe the AI-DO 1 including the motivation and design objections, the challenges, the provided infrastructure, an overview of the approaches of the top submissions, and a frank assessment of what worked well as well as what needs improvement. The results of AI-DO 1 highlight the need for better benchmarks, which are lacking in robotics, as well as improved mechanisms to bridge the gap between simulation and reality.",http://link.springer.com/openurl/fulltext?id=doi:10.1007/978-3-030-29135-8_3,springer
Chapter ConferencePaper,doi:10.1007/978-3-030-28619-4_60,Stochastic Motion Planning for Hopping Rovers on Small Solar System Bodies,Robotics Research,10.1007/978-3-030-28619-4_60,Springer,2020-01-01,2019-11-28,"Hopping rovers have emerged as a promising platform for the future surface exploration of small Solar System bodies, such as asteroids and comets. However, hopping dynamics are governed by nonlinear gravity fields and stochastic bouncing on highly irregular surfaces, which pose several challenges for traditional motion planning methods. This paper presents the first ever discussion of motion planning for hopping rovers that explicitly accounts for various sources of uncertainty. We first address the problem of planning a single hopping trajectory by developing (1) an algorithm for robustly solving Lambert’s orbital boundary value problems in irregular gravity fields, and (2) a method for computing landing distributions by propagating control and model uncertainties—from which, a time/energy-optimal hop can be selected using a (myopic) policy gradient. We then cast the sequential planning problem as a Markov decision process and apply a sample-efficient, off-line, off-policy reinforcement learning algorithm—namely, a variant of least squares policy iteration (LSPI)—to derive approximately optimal control policies that are safe, efficient, and amenable to real-time implementation on computationally-constrained rover hardware. These policies are demonstrated in simulation to be robust to modelling errors and outperform previous heuristics.",http://link.springer.com/openurl/fulltext?id=doi:10.1007/978-3-030-28619-4_60,springer
Chapter ConferencePaper,doi:10.1007/978-3-030-60337-3_29,A Modular Deep Learning Architecture for Anomaly Detection in HRI,Interactive Collaborative Robotics,10.1007/978-3-030-60337-3_29,Springer,2020-01-01,2020-09-30,"Considering humans as a non-deterministic factor makes anomaly detection in Human-Robot Interaction scenarios rather a challenging problem. Anomalous events like unexpected user interaction or unforeseen environment changes are unknown before they happen. On the other hand, the work process or user intentions could evolve in time. To address this issue, a modular deep learning approach is presented that is able to learn normal behavior patterns in an unsupervised manner. We combined the unsupervised feature extraction learning ability of an autoencoder with a sequence modeling neural network. Both models were firstly evaluated on benchmark video datasets, revealing adequate performance comparable to the state-of-the-art methods. For HRI application, a continuous training approach for real-time anomaly detection was developed and evaluated in an HRI-experiment with a collaborative robot, ToF camera, and proximity sensors. In the user study with 10 subjects irregular interactions and misplaced objects were the most common anomalies, which system was able to detect reliably.",http://link.springer.com/openurl/fulltext?id=doi:10.1007/978-3-030-60337-3_29,springer
Chapter ConferencePaper,doi:10.1007/978-3-030-60117-1_16,A Sociable Robotic Platform to Make Career Advices for Undergraduates,HCI International 2020 - Late Breaking Papers: Multimodality and Intelligence,10.1007/978-3-030-60117-1_16,Springer,2020-01-01,2020-10-17,"Most of the undergraduates couldn’t figure out a proper direction for their future careers since advising depends on the person and students show aversion in revealing their information to other humans. This research focused on creating a social robotic platform to interact with undergraduates in the field of computer science to realize possible career paths, as recent researches show social companion robots tend to form a stronger bond, which helps the addressee to share their information easily. The robot was created as a tabletop robot employing minimalistic design with a friendly view attached with speech synthesis for communicating purposes. Data was collected from 202 persons, who followed a degree in computer science. Data contains their experience, qualifications, and skills. Thereafter an artificial neural network was created using supervised learning to predict the career path with 95% performance accuracy. The experiment was performed by engaging 15 students from the final year who are a doing degree in computer science and they were asked to provide feedback on the interactions with the robot. The gathered responses highlighted robot animacy, interaction, technology and usefulness. Therefore, from the results it can be concluded that a majority of the students accepted the robot, interacted without hesitation and had friendly conversations with the robot where they valued the generated output from the robot.",http://link.springer.com/openurl/fulltext?id=doi:10.1007/978-3-030-60117-1_16,springer
Chapter,doi:10.1007/978-981-15-4095-0_16,Robot Learning in Simulation,Deep Reinforcement Learning,10.1007/978-981-15-4095-0_16,Springer,2020-01-01,2020-06-30,"This chapter introduces a hands-on project for robot learning in simulation, including the process of setting up a task with a robot arm for objects grasping in CoppeliaSim and the deep reinforcement learning solution with soft actor-critic algorithm. The effects of different reward functions are also shown in the experimental sections, which testifies the importance of auxiliary dense rewards for solving a hard-to-explore task like the robot grasping ones. Brief discussions on robot learning applications, sim-to-real transfer, other robot learning projects and simulators are also provided at the end of this chapter.",http://link.springer.com/openurl/fulltext?id=doi:10.1007/978-981-15-4095-0_16,springer
Chapter ConferencePaper,doi:10.1007/978-3-030-42058-1_32,Soft Computing-Based Control System of Intelligent Robot Navigation,Intelligent Information and Database Systems,10.1007/978-3-030-42058-1_32,Springer,2020-01-01,2020-03-04,"This paper focuses on the study of intelligent navigation techniques which are capable of navigating a mobile robot autonomously in unknown environments in real-time. We primarily focused on a soft computing-based control system of autonomous robot behaviour. The soft computing methods included artificial neural networks and fuzzy logic. Using them, it was possible to control autonomous robot behaviour. Based on defined behaviour, this device was able to deduce a corresponding reaction to an unknown situation. Real robotic equipment was represented by a Lego Mindstorms EV3 robot. The outcomes of all experiments were analysed in the conclusion.",http://link.springer.com/openurl/fulltext?id=doi:10.1007/978-3-030-42058-1_32,springer
Article,doi:10.1007/s10734-019-00387-3,Joseph E. Aoun: Robot-proof: higher education in the age of artificial intelligence,Higher Education,10.1007/s10734-019-00387-3,Springer,2019-12-01,2019-04-09,,http://link.springer.com/openurl/fulltext?id=doi:10.1007/s10734-019-00387-3,springer
