contentType,identifier,title,publicationName,doi,publisher,publicationDate,onlineDate,abstract,url,database
Article,doi:10.1186/s13673-019-0205-6,Developing an online hate classifier for multiple social media platforms,Human-centric Computing and Information Sciences,10.1186/s13673-019-0205-6,Springer,2020-01-02,2020-01-02,"The proliferation of social media enables people to express their opinions widely online. However, at the same time, this has resulted in the emergence of conflict and hate, making online environments uninviting for users. Although researchers have found that hate is a problem across multiple platforms, there is a lack of models for online hate detection using multi-platform data. To address this research gap, we collect a total of 197,566 comments from four platforms: YouTube, Reddit, Wikipedia, and Twitter, with 80% of the comments labeled as non-hateful and the remaining 20% labeled as hateful. We then experiment with several classification algorithms (Logistic Regression, Naïve Bayes, Support Vector Machines, XGBoost, and Neural Networks) and feature representations (Bag-of-Words, TF-IDF, Word2Vec, BERT, and their combination). While all the models significantly outperform the keyword-based baseline classifier, XGBoost using all features performs the best (F1 = 0.92). Feature importance analysis indicates that BERT features are the most impactful for the predictions. Findings support the generalizability of the best model, as the platform-specific results from Twitter and Wikipedia are comparable to their respective source papers. We make our code publicly available for application in real software systems as well as for further development by online hate researchers.",https://www.biomedcentral.com/openurl?doi=10.1186/s13673-019-0205-6,springer
Chapter ConferencePaper,doi:10.1007/978-3-030-55789-8_26,Estimation of Cable Lines Insulating Materials Resource Using Multistage Neural Network Forecasting Method,Trends in Artificial Intelligence Theory and Applications. Artificial Intelligence Practices,10.1007/978-3-030-55789-8_26,Springer,2020-01-01,2020-09-04,"The use of artificial neural networks (ANN) for predicting the temperature regime of a power cable line (PCL) core is considered. The relevance of the task of creating neural networks for assessing the throughput, calculating and forecasting the PCL core temperature in real time based on the data from a temperature monitoring system, taking into account changes in the current load of the line and external conditions of heat removal, is substantiated. When analyzing the data, it was determined that the maximum deviation of the neural network (NN) data from the data of the training sample was less than 3% and 5.6% for experimental data, which is an acceptable result. It was established that ANN can be used to make a forecast of the cable core temperature regime with a given accuracy of the core temperature. The comparison of the predicted values with the actual ones allows us to talk about the adequacy of the selected network model and its applicability in practice for reliable operation of the cable power supply system of consumers. The model allows evaluating the insulation current state and predicting the PCL residual life. The results analysis showed that the more aged PCL insulation material, the greater the temperature difference between the original and aged sample. This is due to the loss of electrical insulation properties of the material due to the accumulation of the destroyed structure fragments, containing, in an increasing amount, inclusions of pure carbon and other conductive inclusions.",http://link.springer.com/openurl/fulltext?id=doi:10.1007/978-3-030-55789-8_26,springer
Article,doi:10.1007/s11280-019-00727-4,Co-Detection of crowdturfing microblogs and spammers in online social networks,World Wide Web,10.1007/s11280-019-00727-4,Springer,2020-01-01,2019-10-23,"The rise of online crowdsourcing services has prompted an evolution from traditional spamming accounts, which spread unwanted advertisements and fraudulent content, into novel spammers that resemble those of normal users. Prior research has mainly focused on machine accounts and spams separately, but characteristics of new types of spammers and spamming make it difficult for traditional methods to perform well. In this paper, we integrate the study of these new types of spammers with the study of crowdturfing microblogs, investigating the mechanism of crowdsourcing and the close relationship between crowdturfing spammers and microblogs in order to detect new types of spammers and spams more precisely. We propose a novel semi-supervised learning framework for co-detecting crowdturfing microblogs and spammers by comprehensively modeling user behavior, message content, and users’ following and retweeting networks. In order to meet the challenge of sparsely labeled datasets, we design an elaborate co-detection target optimal function to minimize empirical error and to permit the dissemination of sparse labels to unlabeled samples. The advantage of this framework is threefold. First, through a deep-level mining of new-type spammers, we aggregate a number of new-found features that can help us make significant distinctions between normal users and new-type spammers. Secondly, by modeling both following networks and retweeting networks, we characterize the essence of the crowdsourcing mechanism abused by spammers in crowdturfing microblog diffusion to markedly increase detection performance. Thirdly, through our optimal function based on semi-supervised methods, we overcome the problem of label sparseness, thus obtaining a more reliable capacity to deal with the challenges of big, sparsely labeled data. Extensive experiments on real datasets demonstrate that our method outperforms four baselines in various metrics (Precision-Recall, AUC values, Precision@K and so on). We also develop a robust system, the functions of which include data collection and availability analysis, spam and spammer detection, and visualization. To render our experiments replicable, we have made our dataset and codes openly available at https://github.com/sunxiangguo/Crowdturfing .",http://link.springer.com/openurl/fulltext?id=doi:10.1007/s11280-019-00727-4,springer
Article,doi:10.1007/s42354-019-0243-2,Quantum Humanities: A First Use Case for Quantum-ML in Media Science,Digitale Welt,10.1007/s42354-019-0243-2,Springer,2020-01-01,2019-12-04,,http://link.springer.com/openurl/pdf?id=doi:10.1007/s42354-019-0243-2,springer
Article,doi:10.1557/mrs.2020.8,US National Science Foundation commits to long-term investment in artificial intelligence,MRS Bulletin,10.1557/mrs.2020.8,Springer,2020-01-01,2020-09-27,,http://link.springer.com/openurl/fulltext?id=doi:10.1557/mrs.2020.8,springer
Chapter ConferencePaper,doi:10.1007/978-3-030-39878-1_19,Social Influence Prediction by a Community-Based Convolutional Neural Network,Advances in Artificial Intelligence,10.1007/978-3-030-39878-1_19,Springer,2020-01-01,2020-02-04,"This is an extension from a selected paper from JSAI2019. Learning social influence between users on social networks has beextensively studied in a decade. Many models were proposed to model the microscopic diffusion process or to directly predict the final diffusion results. However, most of them need expensive Monte Carlo simulations to estimate diffusion results and some of them just predict the size of the spread via regression techniques, where people who will adopt the information becomes unknown. In this work, we regard the prediction of final influence diffusion results in a social network as a classification problem to avoid expensive simulations with knowing the final adopters. Furthermore, we propose a community-based convolutional neural network to capture the information of local structure with the aforementioned network. The proposed model is referred to as the Social Influence Learning on Community-based Convolutional Neural Network, SIL-CCNN. In the experiment, SIL-CCNN shows the promising results in both synthetic and real-world datasets. In addition, modeling local structure is indeed useful for the prediction of information diffusion.",http://link.springer.com/openurl/fulltext?id=doi:10.1007/978-3-030-39878-1_19,springer
Article,doi:10.1038/s42256-019-0139-8,Validity of machine learning in biology and medicine increased through collaborations across fields of expertise,Nature Machine Intelligence,10.1038/s42256-019-0139-8,Nature,2020-01-01,2020-01-13,"Machine learning (ML) has become an essential asset for the life sciences and medicine. We selected 250 articles describing ML applications from 17 journals sampling 26 different fields between 2011 and 2016. Independent evaluation by two readers highlighted three results. First, only half of the articles shared software, 64% shared data and 81% applied any kind of evaluation. Although crucial for ensuring the validity of ML applications, these aspects were met more by publications in lower-ranked journals. Second, the authors’ scientific backgrounds highly influenced how technical aspects were addressed: reproducibility and computational evaluation methods were more prominent with computational co-authors; experimental proofs more with experimentalists. Third, 73% of the ML applications resulted from interdisciplinary collaborations comprising authors from at least two of the three disciplines: computational sciences, biology, and medicine. The results suggested collaborations between computational and experimental scientists to generate more scientifically sound and impactful work integrating knowledge from both domains. Although scientifically more valid solutions and collaborations involving diverse expertise did not correlate with impact factors, such collaborations provide opportunities to both sides: computational scientists are given access to novel and challenging real-world biological data, increasing the scientific impact of their research, and experimentalists benefit from more in-depth computational analyses improving the technical correctness of work. Applications of machine learning in the life sciences and medicine require expertise in computational methods and in scientific subject matter. The authors surveyed articles in the life sciences that included machine learning applications, and found that interdisciplinary collaborations increased the scientific validity of published research.",https://www.nature.com/articles/s42256-019-0139-8,springer
Chapter ConferencePaper,doi:10.1007/978-3-030-50794-7_13,Data Analysis of Readiness Programs of Machine-Building Enterprises,"Advances in Design, Simulation and Manufacturing III",10.1007/978-3-030-50794-7_13,Springer,2020-01-01,2020-06-05,"One of the important aspects of providing the high level of the enterprises IT-readiness at machine-building enterprises is using the data science approach. By using data analysis, we mean the ability of the enterprises’ experts to increase using data by the most effective appliance of modern data science algorithms. In our research, the analysis has been carried out and the proposed approach can be used in real practice to evaluate the implementation of program projects to boost IT readiness. For example, at the initial stage, when the project is just starting and we do not know the real values of features, we can assign to modifications the average value for each, and then when the project arrives the real value of modification, we can calculate the target and track the dynamics of the assessment, the quality of the program projects to boost IT-readiness of machine-building enterprises. Thus, an important question is the compliance of the enterprise to the necessary level of IT-readiness which is directly connected with data analysis.",http://link.springer.com/openurl/fulltext?id=doi:10.1007/978-3-030-50794-7_13,springer
Chapter ConferencePaper,doi:10.1007/978-3-030-53956-6_45,Methods of Machine Learning in System Abnormal Behavior Detection,Advances in Swarm Intelligence,10.1007/978-3-030-53956-6_45,Springer,2020-01-01,2020-07-13,"The aim of the research is to develop mathematical and program support for detecting abnormal behavior of users. It will be based on analysis of their behavioral biometric characteristics. One of the major problems in UEBA/DSS intelligent systems is obtaining useful information from a large amount of unstructured, inconsistent data. Management decision-making should be based on real data collected from the analysed feature. However, based on the information received, it is rather difficult to make any management decision, as the data are heterogeneous and their volumes are extremely large. Application of machine learning methods in implementation of mobile UEBA/DSS system is proposed. This will make it possible to achieve a data analysis high quality and find complex dependencies in it. A list of the most significant factors submitted to the input of the analysing methods was formed during the research.",http://link.springer.com/openurl/fulltext?id=doi:10.1007/978-3-030-53956-6_45,springer
Article,doi:10.1007/s12369-019-00560-9,Learning Proxemics for Personalized Human–Robot Social Interaction,International Journal of Social Robotics,10.1007/s12369-019-00560-9,Springer,2020-01-01,2019-05-25,"Each person has their personal area which they do not want to share with others during social interactions. The size of this area usually depends on various factors such as their culture, personal traits, and acquaintanceship. The same applies to the case of human–robot interaction, especially when the robot is required to exhibit a certain level of social competence. Here, we propose a new robot navigation strategy to socially interact with people reflecting upon the social relationship between the robot and each person. To this end, we need a clear definition of interaction areas: (1) quality interaction area where people can be engaged in high-quality interactions with robots, and (2) private area not to be interfered with by the robot speech or action. A technical challenge in enhancing social human–robot interactions is how to enable robots to delineate the boundary of the two areas of each person. Specifically, the social force model (SFM) is designed by a fuzzy inference system, where the membership functions are optimized to give the robot the ability to navigate autonomously in the quality interaction area using a reinforcement learning algorithm. Finally, the proposed model was verified through simulations and experiments with a real robot that can generate a suitable SFM of each person, allowing the robot to maintain the quality of interaction with each person while keeping their private personal distance.",http://link.springer.com/openurl/fulltext?id=doi:10.1007/s12369-019-00560-9,springer
Chapter ConferencePaper,doi:10.1007/978-3-030-43859-3_14,Controlling Self-organization in Generative Creative Systems,"Artificial Intelligence in Music, Sound, Art and Design",10.1007/978-3-030-43859-3_14,Springer,2020-01-01,2020-04-09,"We present a new tool which simulates the development of Artificial Chemistries (AChems) to produce real-time imagery for artistic/entertainment purposes. There have been many such usages of complex systems (CSs) for artistic purposes, but deciding which parameters to use for such unpredictable systems can lead to a feeling of lack of control. For our purposes, we struggled to gain enough control over the AChem real-time image generation tool to accompany music in a video-jockeying application. To overcome this difficulty, we developed a general-purpose clustering approach that attempts to produce sets of parameter configurations which lead to maximally distinct visualisations, thus ensuring users feel that they have influence over the AChem when controlled with a suitable GUI. We present this approach and its application to controlling the development of AChems, along with the results from experiments with different clustering approaches, aided by both machine vision analysis and human curation. We conclude by advocating an overfitting approach supplemented by a final check by a designer, and discuss potential applications of this in artistic and entertainment settings.",http://link.springer.com/openurl/fulltext?id=doi:10.1007/978-3-030-43859-3_14,springer
Chapter ConferencePaper,doi:10.1007/978-3-030-64583-0_57,Caching Suggestions Using Reinforcement Learning,"Machine Learning, Optimization, and Data Science",10.1007/978-3-030-64583-0_57,Springer,2020-01-01,2021-01-08,"Big data is usually processed in a decentralized computational environment with a number of distributed storage systems and processing facilities to enable both online and offline data analysis. In such a context, data access is fundamental to enhance processing efficiency as well as the user experience inspecting the data and the caching system is a solution widely adopted in many diverse domains. In this context, the optimization of cache management plays a central role to sustain the growing demand for data. In this article, we propose an autonomous approach based on a Reinforcement Learning technique to implement an agent to manage the file storing decisions. Moreover, we test the proposed method in a real context using the information on data analysis workflows of the CMS experiment at CERN.",http://link.springer.com/openurl/fulltext?id=doi:10.1007/978-3-030-64583-0_57,springer
Chapter ConferencePaper,doi:10.1007/978-3-030-55393-7_15,Seeds Selection for Influence Maximization Based on Device-to-Device Social Knowledge by Reinforcement Learning,"Knowledge Science, Engineering and Management",10.1007/978-3-030-55393-7_15,Springer,2020-01-01,2020-08-20,"Recently, how to use Device-to-Device (D2D) social knowledge to reduce the network traffic on mobile networks has become a hot topic. We aim to leverage D2D social knowledge to select influential users (seed users or seeds) for influence maximization to minimize network traffic. Lots of work has been done for seeds selection in a single community. However, few studies are about seeds selection in multiple communities. In this paper, we build a Multi-Community Coverage Maximization (MCCM) model to maximize the D2D social coverage so that the cellular network traffic can be minimized. We transform it into a resource allocation problem and use a Reinforcement Learning (RL) approach to tackle it. Specifically, we present a novel seeds allocation algorithm based on Value Iteration method. To reduce the time delay, we design an edge-cloud computing framework for our method by moving part of the computing tasks from the remote cloud to adjacent base stations (BSs). The experiment results on a realistic D2D data set show our method improves D2D coverage by 17.65% than heuristic average allocation. The cellular network traffic is reduced by 26.35% and the time delay is reduced by 63.53%.",http://link.springer.com/openurl/fulltext?id=doi:10.1007/978-3-030-55393-7_15,springer
Article,doi:10.1186/s12859-019-3225-3,The coming era of artificial intelligence in biological data science,BMC Bioinformatics,10.1186/s12859-019-3225-3,BioMed Central,2019-12-30,2019-12-30,,https://www.biomedcentral.com/openurl?doi=10.1186/s12859-019-3225-3,springer
Chapter ConferencePaper,doi:10.1007/978-3-030-60259-8_37,Graph Attentive Network for Region Recommendation with POI- and ROI-Level Attention,Web and Big Data,10.1007/978-3-030-60259-8_37,Springer,2020-01-01,2020-10-16,"Due to the prevalence of human activity in urban space, recommending ROIs (region-of-interest) to users becomes an important task in social networks. The fundamental problem is how to aggregate users’ preferences over POIs (point-of-interest) to infer the users’ region-level mobility patterns. We emphasize two facts in this paper: (1) there simultaneously exists ROI-level and POI-level implicitness that blurs the users’ underlying preferences; and (2) individual POIs should have non-uniform weights and more importantly, the weights should vary across different users. To address these issues, we contribute a novel solution, namely GANR $$^2$$ (Graph Attentive Neural Network for Region Recommendation), based on the recent development of attention network and Neural Graph Collaborative Filtering (NGCF). Specifically, to learn the user preferences over ROIs, we provide a principled neural network model equipped with two attention modules: the POI-level attention module, to select informative POIs of one ROI, and the ROI-level attention module, to learn the ROI preferences. Moreover, we learn the interactions between users and ROIs under the NGCF framework. Extensive experiments on two real-world datasets demonstrate the effectiveness of the proposed framework.",http://link.springer.com/openurl/fulltext?id=doi:10.1007/978-3-030-60259-8_37,springer
Chapter ConferencePaper,doi:10.1007/978-981-13-8196-6_1,Combined Intelligent and Adaptive Optimization in End Milling of Multi-layered 16MnCr5/316L,Advanced Engineering Optimization Through Intelligent Techniques,10.1007/978-981-13-8196-6_1,Springer,2020-01-01,2019-07-10,"In this work, a new intelligent and adaptive optimization for end milling of four-layer functionally graded steel is presented in order to maximize the machining performance, minimize the production costs, and maximize the metal removal rate and ensuring the surface quality requirements. The proposed optimization consists of intelligent modeling of cutting quantities and particle swarm optimization (PSO) algorithm. Particle swarm optimization method is employed in real time to find optimum cutting conditions considering the real tool wear. Adaptive neural inference system is used to predict the tool flank wear timely on the basis of estimated cutting forces. Cutting forces and finally surface roughness were estimated during machining by using artificial neural networks (ANNs). The experimental results show that the proposed approach found an optimal solution of cutting conditions which improved the metal removal rate and improved the machining performance for 24% compared to conventional machining with off-line optimized parameters.",http://link.springer.com/openurl/fulltext?id=doi:10.1007/978-981-13-8196-6_1,springer
Article,doi:10.1007/s41109-019-0215-3,Model-based learning of information diffusion in social media networks,Applied Network Science,10.1007/s41109-019-0215-3,Springer,2019-11-26,2019-11-26,"Social networks have become widely used platforms for their users to share information. Learning the information diffusion process is essential for successful applications of viral marketing and cyber security in social media networks. This paper proposes two learning models that are aimed at learning person-to-person influence in information diffusion from historical cascades based on the threshold propagation model. The first model is based on the linear threshold propagation model. In addition, by considering multi-step information propagation in one time period, this paper proposes a learning model for multi-step diffusion influence between pairs of users based on the idea of random walk. Mixed integer programs (MIP) have been used to learn these models by minimizing the prediction errors, where decision variables are estimations of the diffusion influence between pairs of users. For large-scale networks, this paper develops approximate methods for those learning models by using artificial neural networks to learn the pairwise influence. Extensive computational experiments using both synthetic data and real data have been conducted to demonstrate the effectiveness of the proposed models and methods.",https://www.biomedcentral.com/openurl?doi=10.1007/s41109-019-0215-3,springer
Article,doi:10.1007/s42438-019-00059-6,"Review of Ben Williamson (2017). Big Data in Education: the Digital Future of Learning, Policy and Practice",Postdigital Science and Education,10.1007/s42438-019-00059-6,Springer,2019-10-01,2019-07-26,,http://link.springer.com/openurl/fulltext?id=doi:10.1007/s42438-019-00059-6,springer
Article,doi:10.1557/mrs.2019.113,Using artificial intelligence to accelerate materials development,MRS Bulletin,10.1557/mrs.2019.113,Springer,2019-05-01,2020-09-27,,http://link.springer.com/openurl/pdf?id=doi:10.1557/mrs.2019.113,springer
Article,doi:10.1557/mrc.2019.73,Deep materials informatics: Applications of deep learning in materials science,MRS Communications,10.1557/mrc.2019.73,Springer,2019-09-01,2019-09-20,"The growing application of data-driven analytics in materials science has led to the rise of materials informatics. Within the arena of data analytics, deep learning has emerged as a game-changing technique in the last few years, enabling numerous real-world applications, such as self-driving cars. In this paper, the authors present an overview of deep learning, its advantages, challenges, and recent applications on different types of materials data. The increasingly availability of materials databases and big data in general, along with groundbreaking advances in deep learning offers a lot of promise to accelerate the discovery, design, and deployment of next-generation materials.",http://link.springer.com/openurl/fulltext?id=doi:10.1557/mrc.2019.73,springer
