contentType,identifier,title,publicationName,doi,publisher,publicationDate,onlineDate,abstract,url,database
Article,doi:10.1007/s12517-021-08936-w,Retraction Note: Research on artificial intelligence-based mountain mineral composition detection and big data chemistry education,Arabian Journal of Geosciences,10.1007/s12517-021-08936-w,Springer,2021-11-15,2021-11-15,,http://link.springer.com/openurl/fulltext?id=doi:10.1007/s12517-021-08936-w,springer
Article,doi:10.1007/s11004-021-09982-6,Correction to: Surface Warping Incorporating Machine Learning Assisted Domain Likelihood Estimation: A New Paradigm in Mine Geology Modeling and Automation,Mathematical Geosciences,10.1007/s11004-021-09982-6,Springer,2021-11-11,2021-11-11,,http://link.springer.com/openurl/fulltext?id=doi:10.1007/s11004-021-09982-6,springer
Chapter ConferencePaper,doi:10.1007/978-981-16-3346-1_35,Efficacious Governance During Pandemics Like Covid-19 Using Intelligent Decision Support Framework for User Generated Content,Proceedings of Second Doctoral Symposium on Computational Intelligence,10.1007/978-981-16-3346-1_35,Springer,2022-01-01,2021-09-20,"Jindal, Rajni Malhotra, Anshu During the unprecedented global health emergency caused by the pandemic Covid-19, the governments and nationalized organizations of all countries are struggling to control its spread by enforcing various measures, and also manage its social economic impact through policy intervention. In such critical situation, it becomes imperative to take data driven decisions. User generated content over online social media is an untapped data source that can be leveraged to gain insights for effective governance and decision making; and can also serve as a first hand communication medium between the various government bodies and citizens. In this paper, we have proposed a novel governance framework that leverages user generated content on social media for effective decision making by the authorities. We have used topic modelling techniques to discover social-economic trends, and to understand the issues or concerns of public interest. We used information extraction techniques like noun and verb phrase extraction, and Named Entity Recognition to measure the geographical spread, identify Covid-19 hotspots, assist in contact tracing, and discovering new health conditions. From the available literature, we could not find any intelligent framework for effective governance during pandemics, where user generated content has been utilized for real time decision making. In this paper, we address this real world problem through our proposed decision support System, and demonstrate as a proof-of-concept of how it can be used for effective governance during the pandemics through its prototype implementation.",http://link.springer.com/openurl/fulltext?id=doi:10.1007/978-981-16-3346-1_35,springer
Article,doi:10.1007/s10660-019-09395-y,Towards effective discovery of natural communities in complex networks and implications in e-commerce,Electronic Commerce Research,10.1007/s10660-019-09395-y,Springer,2021-12-01,2020-01-06,"Automated community detection is an important problem in the study of complex networks. The idea of community detection is closely related to the concept of data clustering in pattern recognition. Data clustering refers to the task of grouping similar objects and segregating dissimilar objects. The community detection problem can be thought of as finding groups of densely interconnected nodes with few connections to nodes outside the group. A node similarity measure is proposed here that finds the similarity between two nodes by considering both neighbors and non-neighbors of these two nodes. Subsequently, a method is introduced for identifying communities in complex networks using this node similarity measure and the notion of data clustering. The significant characteristic of the proposed method is that it does not need any prior knowledge about the actual communities of a network. Extensive experiments on several real world and artificial networks with known ground-truth communities are reported. The proposed method is compared with various state of the art community detection algorithms by using several criteria, viz. normalized mutual information, f-measure etc. Moreover, it has been successfully applied in improving the effectiveness of a recommender system which is rapidly becoming a crucial tool in e-commerce applications. The empirical results suggest that the proposed technique has the potential to improve the performance of a recommender system and hence it may be useful for other e-commerce applications.",http://link.springer.com/openurl/fulltext?id=doi:10.1007/s10660-019-09395-y,springer
Chapter ConferencePaper,doi:10.1007/978-3-030-82193-7_17,Discovering Nonlinear Dynamics Through Scientific Machine Learning,Intelligent Systems and Applications,10.1007/978-3-030-82193-7_17,Springer,2022-01-01,2021-08-04,"Scientific Machine Learning (SciML) is a new multidisciplinary methodology that combines the data-driven machine learning models and the principle-based computational models to improve the simulations of scientific phenomenon and uncover new scientific rules from existing measurements. This article reveals the experience of using the SciML method to discover the nonlinear dynamics that may be hard to model or be unknown in the real-world scenario. The SciML method solves the traditional principle-based differential equations by integrating a neural network to accurately model the nonlinear dynamics while respecting the scientific constraints and principles. The paper discusses the latest SciML models and apply them to the oscillator simulations and experiment. Besides better capacity to simulate, and match with the observation, the results also demonstrate a successful discovery of the hidden physics in the pendulum dynamics using SciML.",http://link.springer.com/openurl/fulltext?id=doi:10.1007/978-3-030-82193-7_17,springer
Chapter ConferencePaper,doi:10.1007/978-981-16-3071-2_12,Predicting Prior Academic Failure of Students’ Using Machine Learning Approach,International Conference on Innovative Computing and Communications,10.1007/978-981-16-3071-2_12,Springer,2022-01-01,2021-08-29,"In the educational institutions, research on educational data is on demand due to its predictive power and decision-making process using machine learning approach. The present research work can be broadly categorized into two modules. Firstly, data pre-processing directed on real-time data of Government Polytechnic College Ambala, Haryana, India. Secondly, desired data collected along with exploratory data analysis and human-interpretable features is tested on six different classifier to predict student third-year performance as binary classification based on first- and second-year performance, and maximum accuracy of 98.7% was achieved. This generates a chance to identify low-performing students, and accordingly, early interventions can be deployed to prevent them from failing or dropping. This study also suggests a viable direction to use educational data for getting insights by using the machine learning approach.",http://link.springer.com/openurl/fulltext?id=doi:10.1007/978-981-16-3071-2_12,springer
Chapter ConferencePaper,doi:10.1007/978-981-16-4126-8_25,Toward a Social Media Emergency Events Detection Based on Supervised Learning,"Communication, Smart Technologies and Innovation for Society",10.1007/978-981-16-4126-8_25,Springer,2022-01-01,2021-09-28,"Urban emergency events affect many lives and property of people every day. They should be tackled in a fast, precise, and with an early detection goal. In recent years, social media has become popular, turning its users into proper “citizen sensors,” which means a person who, through devices, records incidents on these platforms. Therefore, they become real-time communicators of emergency events. This paper presents a preliminary study based on supervised learning toward social media emergency events detection. This approach has four phases: the first two correspond to data acquisition and preprocessing, where tweets available in a public repository about emergency and non-emergency were taken, filtered, and converted through a process of lemma feature extraction. In the third phase, four most commonly used supervised algorithms were implemented to detect tweets containing emergency events. Finally, using validation metrics and algorithms to detect emergency and non-emergency reported in the tweets was verified. Computational results showed that all evaluated algorithms achieved average rates of 85.38% of accuracy meanwhile that in execution time about 23 seconds, to detect a real emergency event. The best algorithm when trade-offs between execution time and emergency detection capability are considered was the SVM.",http://link.springer.com/openurl/fulltext?id=doi:10.1007/978-981-16-4126-8_25,springer
Chapter,doi:10.1007/978-981-16-6210-2_3,Artificial Intelligence in Agri-Food Systems—An Introduction,"Internet of Things and Analytics for Agriculture, Volume 3",10.1007/978-981-16-6210-2_3,Springer,2022-01-01,2021-11-11,"Artificial intelligence (AI) is a replacement to human intelligence with expanded capabilities that has empowered the industries to handle and drive more complex systems. In agri-food industrial systems, an artificial intelligent system would drive a system towards the set objectives based on the information and knowledge gathered from the consumers, farmers, machines, and domain experts. Machine learning (ML) is the preferred tool to process the knowledge and information for identifying some underlying rules and patterns to support the implementation of the AI based solution. ML-based AI is preferred, because the heterogeneity in consumer preference, biological variability of material characteristics, and unpredictable system behavior presents a highly complex system to be handled by the rule based expert systems. This chapter gives an insight of the fundamentals of machine learning and deep learning with the emphasis on their application for AI implementation in the field of agri-food material handling. Popular ML algorithms viz., support vector machine (SVM), K-nearest neighbor (KNN), artificial neural networks (ANN), decision trees, and convolutional neural networks (CNN) are discussed as feature description methods for classification and recognition, based on the product images. Works from different researchers are cited to demonstrate the potential application of these techniques for solving real-life complex problems.",http://link.springer.com/openurl/fulltext?id=doi:10.1007/978-981-16-6210-2_3,springer
Article,doi:10.1007/s41019-021-00165-1,Predicting Geolocation of Tweets: Using Combination of CNN and BiLSTM,Data Science and Engineering,10.1007/s41019-021-00165-1,Springer,2021-12-01,2021-07-08,"Twitter is one of the most popular micro-blogging and social networking platforms where users post their opinions, preferences, activities, thoughts, views, etc., in form of tweets within the limit of 280 characters. In order to study and analyse the social behavior and activities of a user across a region, it becomes necessary to identify the location of the tweet. This paper aims to predict geolocation of real-time tweets at the city level collected for a period of 30 days by using a combination of convolutional neural network and a bidirectional long short-term memory by extracting features within the tweets and features associated with the tweets. We have also compared our results with previous baseline models and the findings of our experiment show a significant improvement over baselines methods achieving an accuracy of 92.6 with a median error of 22.4 km at city level prediction.",http://link.springer.com/openurl/fulltext?id=doi:10.1007/s41019-021-00165-1,springer
Article,doi:10.1007/s13278-021-00800-9,GANBOT: a GAN-based framework for social bot detection,Social Network Analysis and Mining,10.1007/s13278-021-00800-9,Springer,2021-11-14,2021-11-14,"Nowadays, a massive number of people are involved in various social media. This fact enables organizations and institutions to more easily access their audiences across the globe. Some of them use social bots as an automatic entity to gain intangible access and influence on their users by faster content propagation. Thereby, malicious social bots are populating more and more to fool humans with their unrealistic behavior and content. Hence, that’s necessary to distinguish these fake social accounts from real ones. Multiple approaches have been investigated in the literature to answer this problem. Statistical machine learning methods are one of them focusing on handcrafted features to represent characteristics of social bots. Although they reached successful results in some cases, they relied on the bot’s behavior and failed in the behavioral change patterns of bots. On the other hands, more advanced deep neural network-based methods aim to overcome this limitation. Generative adversarial network (GAN) as new technology from this domain is a semi-supervised method that demonstrates to extract the behavioral pattern of the data. In this work, we use GAN to leak more information of bot samples for state-of-the-art textual bot detection method ( Contextual LSTM ). Although GAN augments low labeled data, original textual GAN ( Sequence Generative Adversarial Net (SeqGAN) ) has the known limitation of convergence. In this paper, we invested this limitation and customized the GAN idea in a new framework called GANBOT , in which the generator and classifier connect by an LSTM layer as a shared channel between them. Our experimental results on a bench-marked dataset of Twitter social bot show our proposed framework outperforms the existing contextual LSTM method by increasing bot detection probabilities.",http://link.springer.com/openurl/fulltext?id=doi:10.1007/s13278-021-00800-9,springer
Article,doi:10.1038/s41592-021-01304-2,Author Correction: DOME: recommendations for supervised machine learning validation in biology,Nature Methods,10.1038/s41592-021-01304-2,Nature,2021-11-01,2021-09-23,,https://www.nature.com/articles/s41592-021-01304-2,springer
Article,doi:10.1007/s00603-021-02657-y,Prediction of Particle Size Distribution Curves of Dump Materials Using Convolutional Neural Networks,Rock Mechanics and Rock Engineering,10.1007/s00603-021-02657-y,Springer,2021-10-15,2021-10-15,,http://link.springer.com/openurl/fulltext?id=doi:10.1007/s00603-021-02657-y,springer
Article,doi:10.1007/s00466-021-02064-8,Constrained neural network training and its application to hyperelastic material modeling,Computational Mechanics,10.1007/s00466-021-02064-8,Springer,2021-11-01,2021-08-03,"Neural networks (NN) have been studied and used widely in the field of computational mechanics, especially to approximate material behavior. One of their disadvantages is the large amount of data needed for the training process. In this paper, a new approach to enhance NN training with physical knowledge using constraint optimization techniques is presented. Specific constraints for hyperelastic materials are introduced, which include energy conservation, normalization and material symmetries. We show, that the introduced enhancements lead to better learning behavior with respect to well known issues like a small number of training samples or noisy data. The NN is used as a material law within a finite element analysis and its convergence behavior is discussed with regard to the newly introduced training enhancements. The feasibility of NNs trained with physical constraints is shown for data based on real world experiments. We show, that the enhanced training outperforms state-of-the-art techniques with respect to stability and convergence behavior within FE simulations.",http://link.springer.com/openurl/fulltext?id=doi:10.1007/s00466-021-02064-8,springer
Article,doi:10.1007/s42979-021-00864-6,Explaining Causal Influence of External Factors on Incidence Rate of Covid-19,SN Computer Science,10.1007/s42979-021-00864-6,Nature,2021-09-18,2021-09-18,"Classical susceptible–infected–removed model with constant transmission rate and removal rate may not capture real world dynamics of epidemic due to complex influence of multiple external factors on the spread and spatio-temporal variation of transmission rate. Also, explainability of a model is of prime necessity to understand the influence of multiple factors on transmission rate. Thus, we modified discrete global susceptible–infected–removed model with time-varying transmission rate, recovery rate and multiple spatially local models. We have derived the criteria for disease-free equilibrium within a specific time period. A convolutional LSTM model is created and trained to map multiple spatiotemporal features to transmission rate. The model achieved 8.39% mean absolute percent error in terms of cumulative infection cases in each locality in a region in USA for a 10-day prediction period. Comparison with current state of the art methods reveals performance superiority of the proposed method. A perturbation-based spatio-temporal model interpretation method is proposed which generates spatio-temporal local interpretations. Global interpretations are generated by statistically accumulating the local interpretations. Global interpretations of transmission rate for a region in USA shows consistent positive influence of population density, whereas, temperature and humidity have very minor influence. An experiment with what-if scenario reveals locality specific quick identification of positive cases, rapid isolation and improving healthcare facilities are keys to rapid convergence to disease-free equilibrium. A long-term forecasting of 160 days predicts new infection cases in a region in USA with a median error of 455 cases.",https://www.nature.com/articles/s42979-021-00864-6,springer
Article,doi:10.1007/s10489-021-02765-w,Modeling knowledge proficiency using multi-hierarchical capsule graph neural network,Applied Intelligence,10.1007/s10489-021-02765-w,Springer,2021-09-22,2021-09-22,"Knowledge Tracking (KT) predicts student performance by modeling the mastery of knowledge components in past interactions. Although the latest research on KT is excellent to model behavior changes, the increasingly complex knowledge components and semantic relationships of new exercises have made courses sparse and difficult to adequately diagnose knowledge mastery. Hence, it is not enough to satisfy only the personalized learning. This paper proposes a graph-based method with multi-hierarchical network (Caps-HAGKT) for tracking capsule knowledge, which integrates rich structural information of the knowledge space, including multiple skills, prerequisites, attribution, and conceptual meta-paths. Firstly, we use the multi-hierarchical knowledge capsule network to track a variety of high-level knowledge concepts, and then extract the latent knowledge structure between levels. In addition, we adopt a new graph network with an external memory matrix to model the relationship between concept capsules at the same level and update concept states. In previous works, it was difficult to use complex graph information without any expert pre-definition. In Caps-HAGKT, the semantic attention of knowledge capsules is used to merge different semantics in knowledge according to their importance. Extensive experiments on some real-world datasets show that the prediction performance of Caps-HAGKT is better than that of the existing KT method (AUC is increased by 3.05% on an average). The visualization of both latent graphs and case studies indicates the excellent interpretability of predictions.",http://link.springer.com/openurl/fulltext?id=doi:10.1007/s10489-021-02765-w,springer
Article,doi:10.1007/s12652-020-02640-5,TextSpamDetector: textual content based deep learning framework for social spam detection using conjoint attention mechanism,Journal of Ambient Intelligence and Humanized Computing,10.1007/s12652-020-02640-5,Springer,2021-10-01,2020-11-09,"Online Social Networks (OSNs) allow easy membership leading to registration of a huge population and generation of voluminous information. These characteristics attract spammers to spread spam which may cause annoyance, financial loss, or personal information loss to the user and also weaken the reputation of social network sites. Most of the spam detection methods are based on user and content-based features using machine learning techniques. But, these annotated features are difficult to extract in real-time due to the privacy policy of most social network sites. Even for the features that can be extracted, because of their large size, the manual extraction process is complex and time-consuming. So there is a need for text level spam detection that does not require extraction of hard-core features. Existing deep learning based or existing single attention mechanism based text classification methods could not perform well as social network data are sparse with short texts and noises. Moreover, Spammers avoid direct spam words and use indirect words to evade spam filtering techniques and thus resulting in the dynamic and non-stationary nature of the social network spam texts. These indirect words contain hidden context that creates attention drift problem. So conjoint attention mechanism along with two attention mechanisms namely normal attention and context preserving attention are proposed to avoid attention drift problem in this deep learning-based text level spam detection technique (TextSpamDetector). Attention drift problem is solved by one attention mechanism which helps to find the important words while another attention mechanism allows focusing on attention in target context by referring to higher level abstraction of context vector. These attention mechanisms are referring to different context representations of the input text for finding informative words from the structural context representation. This structural context representation containing both local semantic features as well as global semantic dependency features is generated by CNN and BiLSTM. The proposed model is evaluated with the existing spam detection techniques using three datasets and the experimental results have proved that the proposed model performs well in terms of accuracy, F measure, and false-positive rate.",http://link.springer.com/openurl/fulltext?id=doi:10.1007/s12652-020-02640-5,springer
Article,doi:10.1007/s42514-021-00077-6,Editorial for the special issue on large-scale AI in classical HPC environment and AI for science,CCF Transactions on High Performance Computing,10.1007/s42514-021-00077-6,Springer,2021-09-01,2021-09-20,,http://link.springer.com/openurl/fulltext?id=doi:10.1007/s42514-021-00077-6,springer
Article,doi:10.1140/epjs/s11734-021-00275-x,Measure or infer? Role of modeling and machine learning in modern astronomy,The European Physical Journal Special Topics,10.1140/epjs/s11734-021-00275-x,Springer,2021-09-01,2021-09-07,,http://link.springer.com/openurl/fulltext?id=doi:10.1140/epjs/s11734-021-00275-x,springer
Article,doi:10.1007/s13246-021-01028-9,AI Notes: A new article type in Physical and Engineering Sciences in Medicine,Physical and Engineering Sciences in Medicine,10.1007/s13246-021-01028-9,Springer,2021-09-01,2021-07-01,,http://link.springer.com/openurl/fulltext?id=doi:10.1007/s13246-021-01028-9,springer
Article,doi:10.1007/s42438-021-00242-8,Review of Cathrine Hasse (2020). Posthumanist Learning: What Robots and Cyborgs Teach us About Being Ultra-social,Postdigital Science and Education,10.1007/s42438-021-00242-8,Springer,2021-07-22,2021-07-22,,http://link.springer.com/openurl/fulltext?id=doi:10.1007/s42438-021-00242-8,springer
Article,doi:10.1007/s11280-021-00910-6,GSIRec: Learning with graph side information for recommendation,World Wide Web,10.1007/s11280-021-00910-6,Springer,2021-09-01,2021-07-05,"Collaborative filtering (CF) is one of the dominant techniques used in modern recommender systems. Traditional CF-based methods suffer from issues of data sparsity and cold start. Therefore, side information has been widely utilized by researchers to address these problems. Most side information is typically heterogeneous and in the form of the graph structure. In this work, we propose a deep end-to-end recommendation framework named GSIRec to make full use of the graph side information. Specifically, GSIRec derives a multi-task learning approach that introduces a side information task to assist the recommendation task. The key idea is that we design a delicate knowledge assistance module to be the bridge between tasks, which captures useful knowledge to complement each task. Also, we utilize a graph attention method to exploit the topological structure of side information to enhance recommendation. To show the wide application and flexibility of our framework, we integrate side information from two aspects: social networks (for users) and knowledge graphs (for items). We apply GSIRec in two recommendation scenarios: social-aware recommendation and knowledge-aware recommendation. To evaluate the effectiveness of our framework, we conduct extensive experiments with four real-world public datasets. The results reveal that GSIRec consistently outperforms the state-of-the-art methods on the rating prediction task and top-K recommendation task. Moreover, GSIRec can alleviate data sparsity and cold start issues to some extent.",http://link.springer.com/openurl/fulltext?id=doi:10.1007/s11280-021-00910-6,springer
