contentType,identifier,title,publicationName,doi,publisher,publicationDate,onlineDate,abstract,url,database
Chapter,doi:10.1007/978-3-030-78992-3_6,"Epilogue by Michael M.J. Fischer: Hauntology’s Genesis, Catacoustics, and Future Shadows",The Hauntology of Everyday Life,10.1007/978-3-030-78992-3_6,Springer,2021-01-01,2021-08-19,"Hauntology has gone through three major historical formations indexed by dreamwork, electronic music, and algorithmic simulacra. Rahimi introduces the first with: a story of a mentally disturbed man as a kind of midrash (often a story mode of biblical or qur’anic interpretation); the second with the analogy of justice as a slingshot around a black hole; and the third with an invocation of emergent cyberworlds and virtual reality as new forms of power relations depending less on information than on data and simulacra. Hauntology itself is the undoing of all ontology, all singularities, all claims to singular origins; of singular sovereignties, of the unified self, and of European philosophy as a restricted language game. Behind every claim of “how things are” lie shadows, ghosts, temporary suppressions of alternatives and contestations in the rich possibilities of life, history, politics, justice, and desire. The first horizon, of psychoanalysis before 1970, is evoked in the rich metaphorical languages drawn from Genesis, the Qur’an, the poetry of Hafiz, and the seventeenth-century Golem at the dawn of the scientific revolution. The horizon of the 1970s is evoked through electronic music and sampling in popular music, playing upon the sonic (blue note) difference between ontology and hauntology. The music scene in England in particular, beginning with the Thatcher-Reagan era articulated a sense that the past as cultural resource was nearing exhaustion, that all past senses of the future were being foreclosed, and that the new digital worlds threatened to be subject to neoliberal manipulation as datafication and gamification became tools of replacing the welfare state and social democracy. The emergent third horizon of contemporary cyberworlds is one of contending with “operational images” (legible to machines more than to humans), “modeling,” and self-generating digital and biological networks, over which we need to take control choreographically, to produce decolonial pluri-worlds and what Andean nations (among other places) are producing under the banners of, in Quechua, sumak kawsay (Spanish, buen Vivir; English: good or beautiful life). These are not mere slogans but have brought an indigenous president to power in Bolivia, changed the terms of politics in Peru, and are being struggled over in decentralized health care in Columbia, as well as municipal experiments in Barcelona. All are struggles in process, all are haunted by pasts. These pasts and hauntologies may not operate as they have in the past.",http://link.springer.com/openurl/fulltext?id=doi:10.1007/978-3-030-78992-3_6,springer
Chapter ConferencePaper,doi:10.1007/978-981-15-4474-3_29,A Survey on Machine Learning and Deep Learning Based Approaches for Sarcasm Identification in Social Media,Data Science and Intelligent Applications,10.1007/978-981-15-4474-3_29,Springer,2021-01-01,2020-06-18,"Today, sentiment analysis is a basic way through which one can get an idea regarding opinion, attitude and emotion towards person or aspects or products or services, etc. In the last several years, researchers are working on a technique to analyse social media data and social chain to identify the undisclosed information from it and to make meaningful patterns and decisions through it. In sentiment analysis, sarcasm is one kind of emotion which contains the contents that are opposite of what you really want to say. People use it to show disrespect or to taunt someone. Sarcasm is useful to show silliness and to be entertaining. Sarcasm can be expressed verbally or through certain gestural clues like rolling of the eyes or raising the eyebrows, etc. A number of ways are implemented to detect sarcasm. In this paper, we try to explain current and trending ways which are used to detect sarcasm.",http://link.springer.com/openurl/fulltext?id=doi:10.1007/978-981-15-4474-3_29,springer
Chapter ConferencePaper,doi:10.1007/978-3-030-69367-1_1,Challenges and Frontiers in Implementing Artificial Intelligence in Process Industry,Impact and Opportunities of Artificial Intelligence Techniques in the Steel Industry,10.1007/978-3-030-69367-1_1,Springer,2021-01-01,2021-02-05,"The implementation of artificial intelligence faces different challenges of infrastructural, data related, security related and social scope. These aspects are discussed, reflecting on the requirements of introducing such a technology in a broader way. Machine learning, as subfield of artificial intelligence, benefits from advances in Big Data science. One example is the $$\lambda $$ λ -architecture which can be used for the treatment of streamed process data in industrial applications. Digital twins are shown as further tool providing object-oriented data for machine learning applications. Yet, the increasing freedom of data transfer within a plant, as propagated by Industry 4.0, poses new risks for information technology and automation systems: security of those components is one of the big challenges. Here, artificial intelligence can seen as both risk and solution. A last relevant challenge is acceptance among the staff, as artificial intelligence is associated with fears. Counterstrategies for those fears are presented as a proposed guideline for real applications. Finally, current frontiers at process industry are considered and discussed. These include the need for strengthening the use of high-dimensional data availability, increased roll-out of optimisation concepts and rigorous progresses in semantic modelling of processes and process chains, in order to fully exploit the beneficial scope of artificial intelligence in industry.",http://link.springer.com/openurl/fulltext?id=doi:10.1007/978-3-030-69367-1_1,springer
Chapter ConferencePaper,doi:10.1007/978-3-030-86383-8_32,Design and Evaluation of Deep Learning Models for Real-Time Credibility Assessment in Twitter,Artificial Neural Networks and Machine Learning – ICANN 2021,10.1007/978-3-030-86383-8_32,Springer,2021-01-01,2021-09-07,"Social media have an enormous impact on modern life but are prone to the dissemination of false information. In several domains, such as crisis management or political communication, it is of utmost importance to detect false and to promote credible information. Although educational measures might help individuals to detect false information, the sheer volume of social big data, which sometimes need to be analysed under time-critical constraints, calls for automated and (near) real-time assessment methods. Hence, this paper reviews existing approaches before designing and evaluating three deep learning models (MLP, RNN, BERT) for real-time credibility assessment using the example of Twitter posts. While our BERT implementation achieved best results with an accuracy of up to 87.07% and an F1 score of 0.8764 when using metadata, text, and user features, MLP and RNN showed lower classification quality but better performance for real-time application. Furthermore, the paper contributes with a novel dataset for credibility assessment.",http://link.springer.com/openurl/fulltext?id=doi:10.1007/978-3-030-86383-8_32,springer
Chapter ConferencePaper,doi:10.1007/978-981-16-0942-8_48,Comparative Analysis of Machine Learning and Deep Learning Algorithms for Detection of Online Hate Speech,Advances in Mechanical Engineering,10.1007/978-981-16-0942-8_48,Springer,2021-01-01,2021-06-27,"In the day and age of social media, users have become prone to online hate speech. Several attempts have been made to classify hate speech using machine learning, but the state-of-the-art models are not robust enough for practical applications. This is attributed to the use of primitive NLP feature engineering techniques. In this paper, we explored various feature engineering techniques ranging from different embeddings to conventional NLP algorithms. We also experimented with combinations of different features. From our experimentation, we realized that robustly optimized BERT approach (RoBERTa)-based sentence embeddings classified using decision trees gives the best results of 0.9998 F _1 score. In our paper, we concluded that BERT based embeddings give the most useful features for this problem and have the capacity to be made into a practical robust model.",http://link.springer.com/openurl/fulltext?id=doi:10.1007/978-981-16-0942-8_48,springer
Chapter ConferencePaper,doi:10.1007/978-981-16-1685-3_24,Real-Time Social Distancing Alert System Using Pose Estimation on Smart Edge Devices,Recent Challenges in Intelligent Information and Database Systems,10.1007/978-981-16-1685-3_24,Springer,2021-01-01,2021-04-06,"This paper focuses on developing a social distance alert system using pose estimation for smart edge devices. Recently, with the rapid development of the Deep Learning model for computer vision, a vision-based automatic real-time warning system for social distance becomes an emergent issue. In this study, different from previous works, we propose a new framework for distance measurement using pose estimation. Moreover, the system is developed on smart edge devices, which is able to deal with moving cameras instead of fixed cameras of surveillance systems. Specifically, our method includes three main processes, which are video pre-processing, pose estimation, and object distance estimation. The experiment on coral board, an AI accelerator device, provides promising results of our proposed method in which the accuracies are able to achieve more than 85% from different datasets.",http://link.springer.com/openurl/fulltext?id=doi:10.1007/978-981-16-1685-3_24,springer
Chapter ReferenceWorkEntry,doi:10.1007/978-3-319-23514-1_1232-1,Artificial Intelligence and Teaching Values in Science,Encyclopedia of Business and Professional Ethics,10.1007/978-3-319-23514-1_1232-1,Springer,2021-01-01,2021-07-28,,http://link.springer.com/openurl/fulltext?id=doi:10.1007/978-3-319-23514-1_1232-1,springer
Chapter ConferencePaper,doi:10.1007/978-981-15-5397-4_14,Basic Review of Different Strategies for Classification of Sentiment Analysis in Social Networks,Communication Software and Networks,10.1007/978-981-15-5397-4_14,Springer,2021-01-01,2020-10-04,"The growth of different online networks such as MySpace, Twitter, LinkedIn, and Face book has been increased in recent years, high amount of data outsource via social media into data sources. This huge amount of data analyzed for research on different types of real-time applications. So that analysis of sentiment and mining user opinion is one of aggressive concepts to explore meaning of outsourced data. While different types of approaches are implemented to identifying sentiment and opinion in social networks like pattern-based classification with respect to parts of speech, emotions, and batch model learning while analyzing huge amount of data. So that in this paper description of different machine learning methodologies to describe utilizes sentiment of huge amount data in social networks. We give survey of different approaches with respect to sentiment exploration from online social network. Also describe comparative analysis of different methods used for analysis of sentiment and mining of user opinion in online social networks.",http://link.springer.com/openurl/fulltext?id=doi:10.1007/978-981-15-5397-4_14,springer
Chapter ReferenceWorkEntry,doi:10.1007/978-3-030-49629-6_26,Agent Reasoning in AI-Powered Negotiation,Handbook of Group Decision and Negotiation,10.1007/978-3-030-49629-6_26,Springer,2021-01-01,2021-05-18,"Negotiation, a fast-developing application area of artificial intelligence, has been studied by social and mathematical scientists with starkly different goals. Whereas social scientists have sought to understand various factors and reasoning processes underlying human negotiation behavior, mathematical scientists have developed theoretic models that formalize various elements of negotiation. The focus of this chapter is on mathematical models of agent reasoning in a negotiation, which can be either analytical or computational by nature: Analytical models offer structural predictions of agent behavior and provide managerial insights into negotiation strategy, whereas computational models offer optimization algorithms and heuristics to function as building blocks of negotiation tools powered by artificial intelligence (AI). Together, mathematical models of negotiation can often be implemented in autonomous processes, referred to as negotiation agents, that can incorporate realistic negotiation factors and engage in negotiations in a decentralized manner. Such agent models promise to contribute to our understanding of human information processing in negotiation and can be used for decision support of human decision-makers. In the long run, they may even become substitutes for human negotiators. This chapter reviews the analytical and computational negotiation literature, reveals areas of differences and synergies, and provides pointers to open questions and future research.",http://link.springer.com/openurl/fulltext?id=doi:10.1007/978-3-030-49629-6_26,springer
Chapter ConferencePaper,doi:10.1007/978-3-030-82472-3_7,MONITOR: A Multimodal Fusion Framework to Assess Message Veracity in Social Networks,Advances in Databases and Information Systems,10.1007/978-3-030-82472-3_7,Springer,2021-01-01,2021-08-16,"Users of social networks tend to post and share content with little restraint. Hence, rumors and fake news can quickly spread on a huge scale. This may pose a threat to the credibility of social media and can cause serious consequences in real life. Therefore, the task of rumor detection and verification has become extremely important. Assessing the veracity of a social media message (e.g., by fact checkers) is a very time-consuming task that can be much helped by machine learning. In the literature, most message veracity verification methods only exploit textual contents and metadata. Very few take both textual and visual contents, and more particularly images, into account. In this paper, we second the hypothesis that exploiting all of the components of a social media post enhances the accuracy of veracity detection. To further the state of the art, we first propose using a set of advanced image features that are inspired from the field of image quality assessment, Then, we introduce the Multimodal fusiON framework to assess message veracIty in social neTwORks (MONITOR), which exploits all message features (i.e., text, social context, and image features) by supervised machine learning. Extensive experiments are conducted on two multimedia datasets. The experimental results show that MONITOR can outperform the state-of-the-art machine learning baselines.",http://link.springer.com/openurl/fulltext?id=doi:10.1007/978-3-030-82472-3_7,springer
Chapter ConferencePaper,doi:10.1007/978-981-16-7189-0_7,Pretrained Self-supervised Material Reflectance Estimation Based on a Differentiable Image-Based Renderer,Image and Graphics Technologies and Applications,10.1007/978-981-16-7189-0_7,Springer,2021-01-01,2021-10-29,"Measuring the material reflectance of surfaces is a key technology in inverse rendering, which can be used in object appearance reconstruction. In this paper we propose a novel deep learning-based method to extract material information represented by a physically-based bidirectional reflectance distribution function from an RGB image of an object. Firstly, we design new deep convolutional neural network architectures to regress material parameters by self-supervised training based on a differentiable image-based renderer. Then we generate a synthetic dataset to train the model as the initialization of the self-supervised system. To transfer the domain from the synthetic data to the real image, we introduce a test-time training strategy to finetune the pretrained model to improve the performance. The proposed architecture only requires one image as input and the experiments are conducted to evaluate the proposed method on both the synthetic data and real data. The results show that our trained model presents dramatic improvement and verifies the effectiveness of the proposed methods.",http://link.springer.com/openurl/fulltext?id=doi:10.1007/978-981-16-7189-0_7,springer
Chapter ConferencePaper,doi:10.1007/978-3-030-86970-0_5,Understanding Drug Abuse Social Network Using Weighted Graph Neural Networks Explainer,Computational Science and Its Applications – ICCSA 2021,10.1007/978-3-030-86970-0_5,Springer,2021-01-01,2021-09-11,"Relational data are universal in today’s society, such as social media network, citation network, and molecules. They can be transformed into graph data consisting of nodes and edges. To classify the class of nodes in graph, GNNs is a state-of-the-art model in this domain. For example, anti-drug police rely on social data to identify hidden drug abusers. However, in the deployment of GNNs, it still require interpretability techniques to support. Because GNNs embed the node information and pass them through the adjacency network, resulting in the lack of transparency in its model. However, the common explanation technique used in other models are not directly applicable on GNNs. And those explanation methods in CNNs are not applicable either considering the topological variety of graph. In order to explain our GNN model on drug abuse social network, we proposed a framework to preprocess graph data, train GNN model, and apply our Maximal Mutual Information (MMI) method to help explain the prediction made by the GNN model. We evaluate the performance of the explanation model with evaluation metrics consistency and contrastivity . The explanation model performs impressively in both real world data and two synthetic data compared to other baselines. The results also show that our model can mimic GNN explanation made by human in node classification.",http://link.springer.com/openurl/fulltext?id=doi:10.1007/978-3-030-86970-0_5,springer
Chapter ReferenceWorkEntry,doi:10.1007/978-3-030-26050-7_1-1,Artificial Intelligence in the Earth Sciences,Encyclopedia of Mathematical Geosciences,10.1007/978-3-030-26050-7_1-1,Springer,2021-01-01,2021-09-08,,http://link.springer.com/openurl/fulltext?id=doi:10.1007/978-3-030-26050-7_1-1,springer
Article,doi:10.1007/s13218-020-00692-5,Rethinking Computer Science Through AI,KI - Künstliche Intelligenz,10.1007/s13218-020-00692-5,Springer,2020-12-01,2020-12-11,,http://link.springer.com/openurl/fulltext?id=doi:10.1007/s13218-020-00692-5,springer
Chapter ConferencePaper,doi:10.1007/978-3-030-86517-7_31,Calling to CNN-LSTM for Rumor Detection: A Deep Multi-channel Model for Message Veracity Classification in Microblogs,Machine Learning and Knowledge Discovery in Databases. Applied Data Science Track,10.1007/978-3-030-86517-7_31,Springer,2021-01-01,2021-09-10,"Reputed by their low-cost, easy-access, real-time and valuable information, social media also wildly spread unverified or fake news. Rumors can notably cause severe damage on individuals and the society. Therefore, rumor detection on social media has recently attracted tremendous attention. Most rumor detection approaches focus on rumor feature analysis and social features, i.e., metadata in social media. Unfortunately, these features are data-specific and may not always be available. In contrast, post contents (including images or videos) play an important role and can indicate the diffusion purpose of a rumor. Furthermore, rumor classification is also closely related to opinion mining and sentiment analysis. Yet, to the best of our knowledge, exploiting images and sentiments is little investigated. Considering the available multimodal features from microblogs, notably, we propose in this paper an end-to-end model called deepMONITOR that is based on deep neural networks, by utilizing all three characteristics: post textual and image contents, as well as sentiment. deepMONITOR concatenates image features with the joint text and sentiment features to produce a reliable, fused classification. We conduct extensive experiments on two large-scale, real-world datasets. The results show that deepMONITOR achieves a higher accuracy than state-of-the-art methods.",http://link.springer.com/openurl/fulltext?id=doi:10.1007/978-3-030-86517-7_31,springer
Chapter ConferencePaper,doi:10.1007/978-3-030-65351-4_5,Graph Convolutional Network with Time-Based Mini-Batch for Information Diffusion Prediction,Complex Networks & Their Applications IX,10.1007/978-3-030-65351-4_5,Springer,2021-01-01,2021-01-05,"Information diffusion prediction is a fundamental task for understanding information spreading phenomenon. Many of the previous works use static social graph or cascade data for prediction. In contrast, a recently proposed deep leaning model DyHGCN [ 20 ] newly considers users’ dynamic preference by using dynamic graphs and achieve better performance. However, training phase of DyHGCN is computationally expensive due to the multiple graph convolution computations. Faster training is also important to reflect users’ dynamic preferences quickly. Therefore, we propose a novel graph convolutional network model with time-based mini-batch (GCNTM) to improve training speed while modeling users’ dynamic preference. Time-based mini-batch is a novel input form to handle dynamic graphs efficiently. Using this input, we reduce the graph convolution computation only once per mini-batch. The experimental results on three real-world datasets show that our model performs comparable results against baseline models. Moreover, our model learns about 5.97 times faster than DyHGCN.",http://link.springer.com/openurl/fulltext?id=doi:10.1007/978-3-030-65351-4_5,springer
Chapter ConferencePaper,doi:10.1007/978-3-030-73194-6_37,Personalized POI Recommendation: Spatio-Temporal Representation Learning with Social Tie,Database Systems for Advanced Applications,10.1007/978-3-030-73194-6_37,Springer,2021-01-01,2021-04-06,"Recommending a limited number of Point-of-Interests (POIs) a user will visit next has become increasingly important to both users and POI holders for Location-Based Social Networks (LBSNs). However, POI recommendation is a challenging task since complex sequential patterns and rich contexts are contained in extremely sparse user check-in data. Recent studies show that embedding techniques effectively incorporate POI contextual information to alleviate the data sparsity issue, and Recurrent Neural Network (RNN) has been successfully employed for sequential prediction. Nevertheless, existing POI recommendation approaches are still limited in capturing user personalized preference due to separate embedding learning or network modeling. To this end, we propose a novel unified spatio-temporal neural network framework, named PPR, which leverages users’ check-in records and social ties to recommend personalized POIs for querying users by joint embedding and sequential modeling. Specifically, PPR first learns user and POI representations by joint modeling User-POI relation, sequential patterns, geographical influence, and social ties in a heterogeneous graph, and then models user personalized sequential patterns using the designed spatio-temporal neural network based on LSTM model for the personalized POI recommendation. Extensive experiments on three real-world datasets demonstrate that our model significantly outperforms state-of-the-art baselines for successive POI recommendation in terms of Accuracy, Precision, Recall and NDCG. The source code is available at:  https://github.com/dsj96/PPR-master .",http://link.springer.com/openurl/fulltext?id=doi:10.1007/978-3-030-73194-6_37,springer
Chapter ConferencePaper,doi:10.1007/978-3-030-73194-6_45,STMG: Spatial-Temporal Mobility Graph for Location Prediction,Database Systems for Advanced Applications,10.1007/978-3-030-73194-6_45,Springer,2021-01-01,2021-04-06,"Location-Based Social Networks (LBSNs) data reflects a large amount of user mobility patterns. So it is possible to infer users’ unvisited Points of Interest (POIs) through the users’ check-in records in LBSNs. Existing location prediction approaches typically regard user check-ins as sequences, while they ignore the spatial and temporal correlations between non-adjacent records. Moreover, the serialized form is insufficient to analog user complex POI moving behaviors. In this paper, we model user check-in records as a graph, named Spatial-Temporal Mobility Graph (STMG), where the nodes and edges fuse the spatial-temporal information in absolute and relative aspect respectively. Based on STMG, we propose a location prediction model named S patial-temporal E nhanced G raph Neural N etwork (SEGN). In SEGN, the STMG nodes are encoded as the embeddings with specific time and location semantics. Last but not the least, we introduce three kinds of matrices, which completely depict the user moving behaviors among POIs, as well as the relative relationships of time and location on STMG edges. Extensive experiments on three real-world LBSNs datasets demonstrate that with specific time information, SEGN outperforms seven state-of-the-art approaches on four metrics.",http://link.springer.com/openurl/fulltext?id=doi:10.1007/978-3-030-73194-6_45,springer
