contentType,identifier,title,publicationName,doi,publisher,publicationDate,onlineDate,abstract,url,database
Chapter,doi:10.1007/978-3-319-60164-9_4,The IoT and Smart Environments: An Overview,Internet of Things and Smart Environments,10.1007/978-3-319-60164-9_4,Springer,2017-01-01,2017-07-21,"The enterprises are beginning to take advantage of the opportunities that the IoT offers by implanting sensors and actuators into their products and services. The IoT adoptions have also enabled the development of smart environments. These advances are drastically shifting the way businesses function and how people engage with the physical world. The pervasive nature of the IoT and the context-aware characteristics that stem from connecting everything together, support the provisions of ambient intelligence. The capabilities to communicate such intelligence with other machines, including those nearby and those providing cloud-based deep learning and AI capacities, hold significant potentials for improving people’s lives in many respects. This chapter outlines the fundamental structure and characteristics of the IoT and smart environments, focusing on those features that can be substantial for assistive technology developments and employments. The chapter also presents some of the typical applications of the IoT and smart environments, to demonstrate the advantages and implications of their deployment in aged-care and for empowering people living with disability or dementia.",http://link.springer.com/openurl/fulltext?id=doi:10.1007/978-3-319-60164-9_4,springer
Chapter ReferenceWorkEntry,doi:10.1007/978-1-4899-7993-3_636-2,Machine Learning in Computational Biology,Encyclopedia of Database Systems,10.1007/978-1-4899-7993-3_636-2,Springer,2017-01-01,2017-08-08,,http://link.springer.com/openurl/fulltext?id=doi:10.1007/978-1-4899-7993-3_636-2,springer
Chapter ConferencePaper,doi:10.1007/978-3-319-47913-2_24,Assessment of Driver Behavior Based on Machine Learning Approaches in a Social Gaming Scenario,"Applications in Electronics Pervading Industry, Environment and Society",10.1007/978-3-319-47913-2_24,Springer,2017-01-01,2017-01-03,"The estimation of user performance analytics in the area of car driver performance was carried out in this paper. The main focus relies on the descriptive analysis with our approaches emphasizing on educational serious games, in order to improvise the driver’s behavior (specifically green driving) in a pleasant and challenging way. We also propose a general Internet of the Things (IoT) social gaming platform (SGP) concept that could be adaptable and deployable to any kind of application domain. The social gaming scenario in this application enables the users to compete with peers based on their physical location. The efficient drivers will be awarded with virtual coins and gained virtual coins can be used in real world applications (such as purchasing travel tickets, reservation of parking lots, etc.). This research work is part of TEAM project co-funded within the EU FP7 ICT research program.",http://link.springer.com/openurl/fulltext?id=doi:10.1007/978-3-319-47913-2_24,springer
Article,doi:10.1186/s12859-016-1305-1,Selected proceedings of Machine Learning in Systems Biology: MLSB 2016,BMC Bioinformatics,10.1186/s12859-016-1305-1,BioMed Central,2016-12-13,2016-12-13,,https://www.biomedcentral.com/openurl?doi=10.1186/s12859-016-1305-1,springer
Article,doi:10.1007/s40593-015-0046-z,RETRACTED ARTICLE: Worked Examples are more Efficient for Learning than High-Assistance Instructional Software,International Journal of Artificial Intelligence in Education,10.1007/s40593-015-0046-z,Springer,2016-12-01,2015-05-28,,http://link.springer.com/openurl/fulltext?id=doi:10.1007/s40593-015-0046-z,springer
Chapter ConferencePaper,doi:10.1007/978-3-319-69784-0_3,Analysis and Classification of Multi-opinionated Content in the Era of Cyber Activism,Digital Transformation and Global Society,10.1007/978-3-319-69784-0_3,Springer,2017-01-01,2017-11-09,"Today, the use of Online Social Media (OSM) is not restricted to merely networking and socializing. Recent events all around the globe attest to the prevalence of use of OSM sites for bringing about dramatic and drastic reforms in real world, phenomenon being referred as Cyber Activism . The real world is marred with various turmoils and people hold myriad variety of views and judgments regarding various issues. Their opinions are often poorly backed by facts. We refer to such inconclusive judgements that users generate and propagate on OSM platforms as Multi-Opinionated Content . One of the greatest challenge in such an environment is to analyze and classify such content into multiple opinion classes. In this work, we propose a generic semi-supervised classification based methodology for analyzing and classifying multi-opinionated content. We have used widely known off-the-shelf classifiers namely KNN, decision tree and random forest in our approach. To implement and validate our methodology, we have mined opinions on content in various forms, namely videos, tweets and posts on three popular social media platforms namely Youtube, Twitter and Facebook, respectively. In our validation, we have taken the Kashmir conflict between India and Pakistan as our case study. We have used plethora of features in building the classification model. Our experiments show that Random Forest classifier gives maximum accuracy of 90.02% and user level features give the best results. Our work can be used to process large amount of multi-opinionated content for effective and accurate decision making in the era of cyber activism generating multi-opinionated content.",http://link.springer.com/openurl/fulltext?id=doi:10.1007/978-3-319-69784-0_3,springer
Chapter ConferencePaper,doi:10.1007/978-3-319-46562-3_20,SentiNet: Mining Visual Sentiment from Scratch,Advances in Computational Intelligence Systems,10.1007/978-3-319-46562-3_20,Springer,2017-01-01,2016-09-07,"An image is worth a thousand of words for sentiment expression, but the semantic gap between low-level pixels and high-level sentiment make visual sentiment analysis difficult. Our work focuses on two aspects to bridge the gap: (1) High-level abstract feature learning for visual sentiment content. (2) Utilizing large-scale unlabeled dataset. We propose a hierarchical structure for automatic discovery of visual sentiment features—we called SentiNet which employed a ConvNet structure. In order to deal with the limitation of labeled data, we leverage the sentiment related signal to pre-annotate unlabeled samples from different source domains. In particular, we propose a hierarchy-stack fine-tune strategy to train SentiNet. We show how this pipeline can be applied on social media visual sentiment analysis. Our experiments on real-world covering half-million unlabeled images and two thousands labeled images show that our method defeats state-of-the-art visual methods, and prove the importance of large scale data and hierarchical architecture for visual sentiment analysis.",http://link.springer.com/openurl/fulltext?id=doi:10.1007/978-3-319-46562-3_20,springer
Chapter ConferencePaper,doi:10.1007/978-3-319-70145-5_10,A Neural Network Model for Social-Aware Recommendation,Information Retrieval Technology,10.1007/978-3-319-70145-5_10,Springer,2017-01-01,2017-11-08,"Social-aware recommender systems have been popular with the rapid growth of social media applications. Existing approaches have attempted to accommodate social information into typical Collaborative Filtering methods and achieved significant improvements. Neural networks are gaining increasing interests in information retrieval tasks. However few studies have considered applying neural network in social-aware recommendation tasks. In this paper, we aim to fill this gap and propose a social-aware neural recommender system. Extensive experiments on real-world datasets demonstrate that our model outperforms state-of-art approaches significantly.",http://link.springer.com/openurl/fulltext?id=doi:10.1007/978-3-319-70145-5_10,springer
Chapter ConferencePaper,doi:10.1007/978-3-319-57454-7_19,Hierarchical Mixed Neural Network for Joint Representation Learning of Social-Attribute Network,Advances in Knowledge Discovery and Data Mining,10.1007/978-3-319-57454-7_19,Springer,2017-01-01,2017-04-23,"Most existing network representation learning (NRL) methods are designed for homogeneous network, which only consider topological properties of networks. However, in real-world networks, text or categorical attributes are usually associated with nodes, providing another description for networks in a different perspective. In this paper, we present a joint learning approach which learns the representations of nodes and attributes in the same low-dimensional vector space simultaneously. Particularly, we show that more discriminative node representations can be acquired by leveraging attribute features. The experiments conducted on three social-attribute network datasets demonstrate that our model outperforms several state-of-the-art baselines significantly for node classification task and network visualization task.",http://link.springer.com/openurl/fulltext?id=doi:10.1007/978-3-319-57454-7_19,springer
Article,doi:10.1007/s11018-016-0972-7,Use of Intelligent Sensors to Rapidly Estimate Moisture Content in Moving Pastelike Material During the Drying Process,Measurement Techniques,10.1007/s11018-016-0972-7,Springer,2016-07-01,2016-07-30,"A method is examined that allows the moisture content in moving pastelike material to be estimated rapidly, in real time, in the process of drying. The method is implemented using intelligent moisture sensors that operate on the basis of a neural network.",http://link.springer.com/openurl/fulltext?id=doi:10.1007/s11018-016-0972-7,springer
Chapter ConferencePaper,doi:10.1007/978-3-319-63558-3_23,Inferring User Profiles in Online Social Networks Based on Convolutional Neural Network,"Knowledge Science, Engineering and Management",10.1007/978-3-319-63558-3_23,Springer,2017-01-01,2017-07-19,"We propose a novel method to infer missing attributes (e.g., occupation, gender, and location) of online social network users, which is an important problem in social network analysis. Existing works generally utilize classification algorithms or label propagation methods to solve this problem. However, these works had to train a specific model for inferring one kind of missing attributes, which achieve limited precision rates in inferring multi-value attributes. To address above challenges, we proposed a convolutional neural network architecture to infer users’ all missing attributes based on one trained model. And it’s novel that we represent the input matrix using features of target user and his neighbors, including their explicit attributes and behaviors which are available in online social networks. In the experiments, we used a real-word large scale dataset with 220,000 users, and results demonstrated the effectiveness of our method and the importance of social links in attribute inference. Especially, our work achieved a 76.28% precision in the occupation inference task which improved upon the state of the art.",http://link.springer.com/openurl/fulltext?id=doi:10.1007/978-3-319-63558-3_23,springer
Chapter ConferencePaper,doi:10.1007/978-3-319-68560-1_36,Visual and Textual Sentiment Analysis of Brand-Related Social Media Pictures Using Deep Convolutional Neural Networks,Image Analysis and Processing - ICIAP 2017,10.1007/978-3-319-68560-1_36,Springer,2017-01-01,2017-10-13,"Social media pictures represent a rich source of knowledge for companies to understand consumers’ opinions, as they are available in real time and at low costs and represent an active feedback which is of importance not only for companies developing products, but also to their rivals and potential consumers. In order to estimate the overall sentiment of a picture, it is essential to not only judge the sentiment of the visual elements but also to understand the meaning of the included text. This paper introduces an approach to estimate the overall sentiment of brand-related pictures from social media based on both visual and textual clues. In contrast to existing papers, we do not consider text accompanying a picture, but text embedded in a picture, which is more challenging since the text has to be detected and recognized first, before its sentiment can be identified. Based on visual and textual features extracted from two trained Deep Convolutional Neural Networks (DCNNs), the sentiment of a picture is identified by a machine learning classifier. The approach was applied and tested on a newly collected dataset, “GfK Verein Dataset” and several machine learning algorithms are compared. The experiments yield high accuracy, demonstrating the effectiveness and suitability of the proposed approach.",http://link.springer.com/openurl/fulltext?id=doi:10.1007/978-3-319-68560-1_36,springer
Article,doi:10.1007/s13278-016-0354-9,Exploiting abused trending topics to identify spam campaigns in Twitter,Social Network Analysis and Mining,10.1007/s13278-016-0354-9,Springer,2016-07-13,2016-07-13,"Twitter is an online social network (OSN) with approximately 650 million users. It has been fairly characterized as one of the most influential OSNs since it includes public figures, organizations, news media and official authorities. Twitter has an inherent simple philosophy with short messages, friendship relations, hashtags and support for media sharing such as photos and short videos. Popular hashtags that emerge from users’ activity are displayed prominently in the platform as Popular Trends . Unfortunately, the capabilities of the platform can be also abused and exploited for distributing illicit content or boosting false information, and the consequences of such actions can be really severe: one false tweet was enough for making the stock market crash for a short period of time in 2013. In this study, we make an experimental analysis on a large dataset containing 150 million tweets. We delve into the dynamics of the popular trends as well as other Twitter features in regard to deliberate misuse. We investigate traditional spam techniques as well as an obfuscated way of spam campaigns that exploit trending topics and hides malicious URLs within Google search result links. We implement a simple and lightweight classifier for indentifying spam users as well as spam tweets. Finally, we visualize these spam campaigns and investigate their inner properties.",http://link.springer.com/openurl/fulltext?id=doi:10.1007/s13278-016-0354-9,springer
Chapter ConferencePaper,doi:10.1007/978-3-319-51963-0_33,A Hybrid Model for Linking Multiple Social Identities Across Heterogeneous Online Social Networks,SOFSEM 2017: Theory and Practice of Computer Science,10.1007/978-3-319-51963-0_33,Springer,2017-01-01,2017-01-11,"Automated online profiling consists of the accurate identification and linking of multiple online identities across heterogeneous online social networks that correspond to the same entity in the physical world. The paper proposes a hybrid profile correlation model which relies on a diversity of techniques from different application domains, such as record linkage and data integration, image and text similarity, and machine learning. It involves distance-based comparison methods and the exploitation of information produced by a social network identification process for use as external knowledge towards searches on other social networks; thus, the remaining identification tasks for the same individual are optimized. The experimental study shows that, even with limited resources, the proposed method collects and combines accurate information effectively from different online sources in a fully-automated way. The mined knowledge then becomes a powerful toolkit to carry out social engineering and other attacks, or for profit and decision-making data mining purposes.",http://link.springer.com/openurl/fulltext?id=doi:10.1007/978-3-319-51963-0_33,springer
Article,doi:10.1007/s00339-015-9451-2,Erratum to: Process modeling and parameter optimization using radial basis function neural network and genetic algorithm for laser welding of dissimilar materials,Applied Physics A,10.1007/s00339-015-9451-2,Springer,2015-11-01,2015-09-17,,http://link.springer.com/openurl/fulltext?id=doi:10.1007/s00339-015-9451-2,springer
Chapter ConferencePaper,doi:10.1007/978-3-319-23766-4_46,Hierarchical Deep Learning: A Promising Technique for Opinion Monitoring and Sentiment Analysis in Russian-Language Social Networks,Creativity in Intelligent Technologies and Data Science,10.1007/978-3-319-23766-4_46,Springer,2015-01-01,2015-12-01,,http://link.springer.com/openurl/pdf?id=doi:10.1007/978-3-319-23766-4_46,springer
Chapter,doi:10.1007/978-3-319-16378-9_2,Cognitive Science in Telemedicine: From Psychology to Artificial Intelligence,Tele-oncology,10.1007/978-3-319-16378-9_2,Springer,2015-01-01,,,http://link.springer.com/openurl/fulltext?id=doi:10.1007/978-3-319-16378-9_2,springer
Article,doi:10.1007/s11299-014-0145-9,Special issue on “Bounded Rationality updated”,Mind & Society,10.1007/s11299-014-0145-9,Springer,2014-06-01,2014-05-03,,http://link.springer.com/openurl/fulltext?id=doi:10.1007/s11299-014-0145-9,springer
Article,doi:10.7238/rusc.v12i1.1944,Mobile learning: perspectives,International Journal of Educational Technology in Higher Education,10.7238/rusc.v12i1.1944,Springer,2015-01-01,2015-01-15,"El futuro del aprendizaje, desde una perspectiva técnica, está integrado por cuatro ejes que lo definen y sobre los que se articulan esfuerzos tecnológicos y metodológicos. Estos ejes son: la movilidad, la interacción, la inteligencia artificial y recursos basados en tecnología como la realidad aumentada y los juegos aplicados al aprendizaje. Su combinación supone la creación de un modelo de escenarios móviles, interactivos e inteligentes que aprovechan todos los espacios y tiempos disponibles para el aprendiente. Las distintas tecnologías, cada una por su lado, ya están disponibles y son utilizadas en diversas experiencias educativas; lo que se hace necesario es la conjugación de estas a través de modelos didácticos en los que el aprendizaje alcanzado por los estudiantes sea significativo. En este artículo se discuten estas tecnologías y se plantea un modelo de integración que posibilita el establecimiento de un marco referential de trabajo didáctico. Se concluye la necesidad de experimentar tecnologías y plasmar los resultados en modelos de enseñanza-aprendizaje que utilicen esquemas de interacción alternativos y la urgencia de contar con sistemas tutoriales inteligentes para masificar la tutoría. From a technical perspective, the future of learning is defined by four axes around which technological and methodological efforts revolve. These axes are mobility, interaction, artificial intelligence and technology-based resources such as augmented reality and games applied to learning. Combining them means creating a model of mobile, interactive and intelligent scenarios that take advantage of the spaces and times available to the learner. The various technologies are already available yet used separately in different educational experiences. It is therefore crucial to combine and integrate them into didactic models wherein the learning attained by students is significant. This article discusses these technologies and proposes an integrative model that enables a framework of reference for didactic work to be established. It concludes by highlighting the need to experiment with technologies and to apply the results to teaching-learning models using alternative interaction schema, and the urgency of having intelligent tutoring systems to make tutoring available on a massive scale.",https://www.biomedcentral.com/openurl/pdf?id=doi:10.7238/rusc.v12i1.1944,springer
Article,doi:10.1007/s10817-015-9330-8,MizAR 40 for Mizar 40,Journal of Automated Reasoning,10.1007/s10817-015-9330-8,Springer,2015-10-01,2015-07-21,"As a present to Mizar on its 40th anniversary, we develop an AI/ATP system that in 30 seconds of real time on a 14-CPU machine automatically proves 40 % of the theorems in the latest official version of the Mizar Mathematical Library ( MML ). This is a considerable improvement over previous performance of large-theory AI/ATP methods measured on the whole MML . To achieve that, a large suite of AI/ATP methods is employed and further developed. We implement the most useful methods efficiently, to scale them to the 150000 formulas in MML . This reduces the training times over the corpus to 1–3 seconds, allowing a simple practical deployment of the methods in the online automated reasoning service for the Mizar users ( Miz AR $\mathbb {A}\mathbb {R}$ ).",http://link.springer.com/openurl/pdf?id=doi:10.1007/s10817-015-9330-8,springer
Article,doi:10.1007/s10817-014-9303-3,Learning-Assisted Automated Reasoning with Flyspeck,Journal of Automated Reasoning,10.1007/s10817-014-9303-3,Springer,2014-08-01,2014-06-01,"The considerable mathematical knowledge encoded by the Flyspeck project is combined with external automated theorem provers (ATPs) and machine-learning premise selection methods trained on the Flyspeck proofs, producing an AI system capable of proving a wide range of mathematical conjectures automatically. The performance of this architecture is evaluated in a bootstrapping scenario emulating the development of Flyspeck from axioms to the last theorem, each time using only the previous theorems and proofs. It is shown that 39 % of the 14185 theorems could be proved in a push-button mode (without any high-level advice and user interaction) in 30 seconds of real time on a fourteen-CPU workstation. The necessary work involves: (i) an implementation of sound translations of the HOL Light logic to ATP formalisms: untyped first-order, polymorphic typed first-order, and typed higher-order, (ii) export of the dependency information from HOL Light and ATP proofs for the machine learners, and (iii) choice of suitable representations and methods for learning from previous proofs, and their integration as advisors with HOL Light. This work is described and discussed here, and an initial analysis of the body of proofs that were found fully automatically is provided.",http://link.springer.com/openurl/pdf?id=doi:10.1007/s10817-014-9303-3,springer
Chapter ConferencePaper,doi:10.1007/978-3-319-16483-0_58,Logical Modeling and Analysis of Regulatory Genetic Networks in a Non Monotonic Framework,Bioinformatics and Biomedical Engineering,10.1007/978-3-319-16483-0_58,Springer,2015-01-01,,"We present a constraint based declarative approach for analyzing qualitatively genetic regulatory networks (GRNs) with the discrete formalism of R. Thomas. For this purpose, we use the logic programming technology ASP (Answer Set Programming) whose related logic is non monotonic. Our aim is twofold. First, we give a formal modeling of both Thomas’ GRNs and biological data like experimental behaviors and gene interactions and we evaluate the declarative approach on three real biological applications. Secondly, for taking into account both gene interaction properties which are only generally true and automatic inconsistency repairing, we introduce an optimized modeling which leads us to exhibit new logical expressions for the conjunction of defaults and to show that they can be applied safely to Thomas’ GRNs.",http://link.springer.com/openurl/pdf?id=doi:10.1007/978-3-319-16483-0_58,springer
