doi,url,title,abstract,publisher,publication_date,database,query_name,query_value
095f98cc481046a4ab3b25af4eac7178ccd8736f,https://www.semanticscholar.org/paper/095f98cc481046a4ab3b25af4eac7178ccd8736f,"SCADA Systems With Focus on Continuous Manufacturing and Steel Industry: A Survey on Architectures, Standards, Challenges and Industry 5.0","Recent technological advances encompassed by the smart factory concept have fundamentally changed industrial control systems in the way they are structured and how they operate. Majority of these changes affect Supervisory Control And Data Acquisition (SCADA) systems, shifting them to a higher level of interoperability, heterogeneous networks, big data and toward internet technologies and services in general. However, this transformation does not affect all SCADA systems equally. The immediate industrial environment and controlled processes have a significant impact as well. This paper presents a holistic approach to SCADA systems implemented in continuous flow production control within the steel industry production environment. We outline the multi-layer architecture of the SCADA control framework and the aspects of interoperability and interconnectivity within the architecture reference models, together with the research challenges and opportunities arising from the recent rapid increasement of the industrial control systems complexity and digital transformation under the Industry 4.0 paradigm, resulting in disrupting levels of the traditional automation pyramid based on Purdue model toward a higher level of integration and interoperability enabling cross-level data exchange empowered by the Industrial Internet of Things. Furthermore, the paper addresses the problem of proprietary SCADA systems and elaborates the causal correlation between SCADA quality requirements and adoption of new technologies in relation to the specific industrial environment of the steel manufacturing process.",IEEE Access,2022,semantic_scholar,citation,citation
390f735ab2a12565006e761850c78bd487667a97,https://www.semanticscholar.org/paper/390f735ab2a12565006e761850c78bd487667a97,Continuous Design Control for Machine Learning in Certified Medical Systems,,Software Quality Journal,2022,semantic_scholar,citation,citation
03211db44025aa6b1f7025faf3781a0c6f8d06c4,https://www.semanticscholar.org/paper/03211db44025aa6b1f7025faf3781a0c6f8d06c4,Development of medical applications based on AI models and register data – regulatory considerations,<jats:p />,Linköping Electronic Conference Proceedings,2022,semantic_scholar,citation,citation
267e19842ee07b786572629d464cca56a0e1c6b3,https://www.semanticscholar.org/paper/267e19842ee07b786572629d464cca56a0e1c6b3,MLOps: A Guide to its Adoption in the Context of Responsible AI,"DevOps practices have increasingly been applied to software development as well as the machine learning lifecycle, in a process known as MLOps. Currently, many professionals have written about this topic, but still few results can be found in the academic and scientific literature on MLOps and how to to implement it effectively. Considering aspects of responsible AI, this number is even lower, opening up a field of research with many possibilities. This article presents five steps to guide the understanding and adoption of MLOps in the context of responsible AI. The study aims to serve as a reference guide for all those who wish to learn more about the topic and intend to implement MLOps practices to develop their systems, following responsible AI principles.CCS CONCEPTS• Software and its engineering → Software creation and management; • Computing methodologies → Machine learning.",2022 IEEE/ACM 1st International Workshop on Software Engineering for Responsible Artificial Intelligence (SE4RAI),2022,semantic_scholar,citation,citation
c82e39cc3b49bcb9868bad539376ddff34730ada,https://www.semanticscholar.org/paper/c82e39cc3b49bcb9868bad539376ddff34730ada,Operationalizing Machine Learning Models - A Systematic Literature Review,"Deploying machine learning (ML) models to production with the same level of rigor and automation as traditional software systems has shown itself to be a non-trivial task, requiring extra care and infrastructure to deal with the additional challenges. Although many studies focus on adapting ML software engineering (SE) approaches and techniques, few studies have summarized the status and challenges of operationalizing ML models. Model operationalization encompasses all steps after model training and evaluation, including packaging the model in a format appropriate for deployment, publishing to a model registry or storage, integrating the model into a broader software system, serving, and monitoring. This study is the first systematic literature review investigating the techniques, tools, and infrastructures to operationalize ML models. After reviewing 24 primary studies, the results show that there are a number of tools for most use cases to operationalize ML models and cloud deployment in particular. The review also revealed several research opportunities, such as dynamic model-switching, continuous model-monitoring, and efficient edge ML deployments. CCS CONCEPTS • General and reference → Surveys and overviews; • Computing methodologies → Machine learning; • Software and its engineering → Software development techniques.",2022 IEEE/ACM 1st International Workshop on Software Engineering for Responsible Artificial Intelligence (SE4RAI),2022,semantic_scholar,citation,citation
f54fc76b7574e1600bad79f82e9eceefcecd3bc6,https://www.semanticscholar.org/paper/f54fc76b7574e1600bad79f82e9eceefcecd3bc6,MLOps: A Taxonomy and a Methodology,"Over the past few decades, the substantial growth in enterprise-data availability and the advancements in Artificial Intelligence (AI) have allowed companies to solve real-world problems using Machine Learning (ML). ML Operations (MLOps) represents an effective strategy for bringing ML models from academic resources to useful tools for solving problems in the corporate world. The current literature on MLOps is still mostly disconnected and sporadic. In this work, we review the existing scientific literature and we propose a taxonomy for clustering research papers on MLOps. In addition, we present methodologies and operations aimed at defining a ML pipeline to simplify the release of ML applications in industry. The pipeline is based on ten steps: business problem understanding, data acquisition, ML methodology, ML training & testing, continuous integration, continuous delivery, continuous training, continuous monitoring, explainability, and sustainability. The scientific and business interest and the impact of MLOps have grown significantly over the past years. The definition of a clear and standardized methodology for conducting MLOps projects is the main contribution of this paper.",IEEE Access,2022,semantic_scholar,citation,citation
92dfb6f46dcb158d281282a8cacd07f440a03508,https://www.semanticscholar.org/paper/92dfb6f46dcb158d281282a8cacd07f440a03508,Applying DevOps to Machine Learning Processes: A Systematic Mapping,"Práticas de DevOps têm sido cada vez mais utilizadas por equipes de engenharia de software com o intuito de aprimorar as etapas de desenvolvimento. Em processos que envolvem machine learning (ML), DevOps também pode ser aplicado a fim de implantar modelos de aprendizado de máquina em produção – prática também conhecida como MLOps. Neste mapeamento sistemático objetiva-se entender como DevOps tem sido aplicado a processos de machine learning e quais são os desafios enfrentados. Foram selecionados 15 artigos e observou-se que a maioria faz uso de práticas de CI/CD e propõe arquiteturas para a implantação de modelos de ML. Como maiores desafios, têm-se as características inerentes aos modelos de ML e resistência à mudança.",Anais do XVIII Encontro Nacional de Inteligência Artificial e Computacional (ENIAC 2021),2021,semantic_scholar,citation,citation
4241129513a8407c3a598cf3724e50a4e743fd6d,https://www.semanticscholar.org/paper/4241129513a8407c3a598cf3724e50a4e743fd6d,Towards RegOps: A DevOps Pipeline for Medical Device Software,,PROFES,2021,semantic_scholar,citation,citation
539ca3f39cf1a4c690d823ec64dcb5154d57249d,https://www.semanticscholar.org/paper/539ca3f39cf1a4c690d823ec64dcb5154d57249d,Semi-Supervised Condition Monitoring and Visualization of Fused Magnesium Furnace,"This paper introduces a novel practice of using image based condition classification and visualization system to augment operators in the task of monitoring the working condition of fused magnesium furnace. The system implements two functions: working condition detection and remote visually reconstruction of the furnace flame. For the problem of working condition detection, we combine the image features and the smelting electrical currents to train the classifier under semi-supervised learning framework. We also introduce a highly efficient cross-entropy based optimization method for training. For the visualization task, we propose a practical end-to-end solution which can visually simulate the dynamic furnace flame at remote monitoring consoles according to the visual feature of the monitoring video. Finally, we introduce the distributed structure of the monitoring system which consists of a private cloud, an edge server and remote monitoring consoles. The proposed solution can be applicable for various monitoring tasks in industry. Note to Practitioners—This paper introduces an image based solution to the practical problem of condition monitoring of fused magnesium furnace. The solution includes two parts: working condition detection and visualization. First, for the abnormal condition detection problem, most existing approaches use the process monitoring video as the condition predictor. It also assumes that the video data are fully labeled with condition category, which often is not available in practice. This paper suggests a novel approach combining the monitoring video and the smelting electrical currents under semi-supervised learning framework to the development of condition classifier. Experiments show that the detection accuracy is remarkably improved comparing to the approach using monitoring video only. Second, this paper presents a remote visualization solution which enables instant reconstruction of the furnace flame at monitoring consoles using only essential features of the flame. This technique is well suited for situation of real-time remote visual monitoring with very limited network bandwidth. Finally, the condition monitoring system adopts a distributed structure including a private cloud, an edge server and remote monitoring consoles. The presented techniques in this paper can be applicable for various monitoring tasks in industry.",IEEE Transactions on Automation Science and Engineering,2022,semantic_scholar,citation,citation
22fe5b7aab5019c542487f078686ff5a404b9a28,https://www.semanticscholar.org/paper/22fe5b7aab5019c542487f078686ff5a404b9a28,RX-ADS: Interpretable Anomaly Detection using Adversarial ML for Electric Vehicle CAN data,"—Recent year has brought considerable advance- ments in Electric Vehicles (EVs) and associated infrastruc-tures/communications. Intrusion Detection Systems (IDS) are widely deployed for anomaly detection in such critical infrastructures. This paper presents an Interpretable Anomaly Detection System (RX-ADS) for intrusion detection in CAN protocol communication in EVs. Contributions include: 1) window based feature extraction method; 2) deep Autoencoder based anomaly detection method; and 3) adversarial machine learning based explanation generation methodology. The presented approach was tested on two benchmark CAN datasets: OTIDS and Car Hacking. The anomaly detection performance of RX-ADS was compared against the state-of-the-art approaches on these datasets: HIDS and GIDS. The RX-ADS approach presented performance comparable to the HIDS approach (OTIDS dataset) and has outperformed HIDS and GIDS approaches (Car Hacking dataset). Further, the proposed approach was able to gener- ate explanations for detected abnormal behaviors arising from various intrusions. These explanations were later validated by information used by domain experts to detect anomalies. Other advantages of RX-ADS include: 1) the method can be trained on unlabeled data; 2) explanations help experts in understanding anomalies and root course analysis, and also help with AI model debugging and diagnostics, ultimately improving user trust in AI systems.",ArXiv,2022,semantic_scholar,citation,citation
aca5b2ed9871637899c7ef22ace3f7c33c455760,https://www.semanticscholar.org/paper/aca5b2ed9871637899c7ef22ace3f7c33c455760,Allocation of Network Levels and Organization of Data Transmission in the Workshop Information Space of Digital Production,"The article is devoted to studying and solution of the problems of creating a unified information space for a digital industrial manufacture. For effective control of a manufacture, it is necessary to have a complete understanding of the state of production, workshops, technological complexes and each unit of equipment. This article presents practical aspects of developing a platform for collecting, storing, transmitting and analyzing information about the operation of technological equipment. The generalized structure of a workshop information space of a digital manufacture is presented; it based on the allocation of four network levels: real-time networks, workshop-level networks, networks of terminal clients and industrial internet of things (IIoT) networks. The sources of information are special software and hardware embedded in technological complexes (CNC systems, robot control systems, PLCs, Motion Control, PAC etc. The general principle of the platform operation is described. The issues of organization of interaction of the monitoring system with other built-in systems and subsystems of manufacture are considered; their interaction is organized on the basis of industrial standards and communication protocols. The tests of the platform operation on the basis of the developed experimental stand containing technological equipment from different manufacturers are demonstrated.",2022 International Russian Automation Conference (RusAutoCon),2022,semantic_scholar,citation,citation
abb2aa22bd685c3c0e0ebdda753dfa56ff1bf3a6,https://www.semanticscholar.org/paper/abb2aa22bd685c3c0e0ebdda753dfa56ff1bf3a6,Elderly People Activity Recognition in Smart Grid Monitoring Environment,"Elderly people activity recognition has become a vital necessity in many countries, because most of the elderly people live alone and are vulnerable. Thus, more research to advance in the monitoring systems used to recognize the activities of elderly people is required. Many researchers have proposed different monitoring systems for activity recognition using wired and wireless wearable sensing devices. However, the activity classification accuracy achieved so far should be improved to meet the challenges of more precise activity monitoring. Our study proposes a smart Human Activity Recognition system architecture utilizing an open source dataset generated by wireless, batteryless sensors used by 14 healthy aged persons and unsupervised and supervised machine learning algorithms. In this paper, we also propose using a smart grid for checking regularly the wearable sensing device operational status to address the well-known reliability challenges of these devices, such as wireless charging and data trustworthiness. As the data from the sensing device is very noisy, we employ the K-means++ clustering to identify outliers and use advanced ensemble classification techniques, such as the stacking classifier for which a meta model built using the random forest algorithm gave better results than all other base models considered. We also employ a bagging classifier, which is an ensemble meta-estimator fitting the prediction outputs of the base classifiers and aggregating them to produce the ensemble output. The best classification accuracy of 99.81 was achieved by the stacking classifier in training and 99.78% in testing, respectively. Comparisons for finding the best model were conducted using the recall, F1 score, and precision values.",Mathematical Problems in Engineering,2022,semantic_scholar,citation,citation
db08a0ace7e1378c3c0093a2495a0e1a192e35f6,https://www.semanticscholar.org/paper/db08a0ace7e1378c3c0093a2495a0e1a192e35f6,Cyber-Physical System for Donor Organs' Rejection Risks Prevention Based on Donor and Recipient Health Monitoring,"Today in Ukraine the problem of transplantation of organs and other anatomical materials to humans is very acute. Among the reasons hindering the development of transplantation of anatomical materials to humans in Ukraine is the rejection of donor organs by the recipient's body. The dependences of the process of rejection of donor organs by the recipient's body on the different surface structures of cells in the recipient and donor, on the incompatibility of recipient and donor on HLA antigens, on the level of dangerous antibodies in the recipient's body, on consideration of only the waiting time for the distribution of donor organs, on the origin of the donor organ (cadaveric organ or organ from a living donor), on the general health of the recipient, on the age of the donor, on the gender of the recipient, on the recipient's disease and its phase, which required transplantation, on the chosen type of immunosuppressive therapy, and on the presence of progressive chronic dysfunction of the transplanted organ. The established dependencies are useful in the selection of donor organs in order to minimize the risk of rejection of organs by the recipient. Rules and method for supporting the decision on the possibility or undesirableness of donation and transplantation, taking into account the risks of rejection of donor organs, have been developed. The architecture of the cyber-physical system for donor organs' rejection risks prevention based on donor and recipient health monitoring is developed, aimed at verifying the existing list of factors of donor organ rejection. Based on this test, the developed cyber-physical system offers a conclusion on the possibility (if all donor organ rejection factors are eliminated or minimized) or undesirableness (if one or a group of donor organ rejection factors cannot be eliminated) of donation and transplantation in a given case.",IntelITSIS,2022,semantic_scholar,citation,citation
053166fe63e374e2244a2b0d5e8d8738654077fe,https://www.semanticscholar.org/paper/053166fe63e374e2244a2b0d5e8d8738654077fe,Anomaly Detection in Smart Grids using Machine Learning,"Smart grid data can be analyzed for detecting abnormalities in many different areas such as cybersecurity, fault detection, electricity theft, etc. There is a strong case for the use of machine learning in anomaly detection. The raw grid data requires feature extraction. Anomalies can be defined as instances or changes in the smart grid data that are out of character concerning the average trend. A typical grid architecture results can vary significantly, depending on trends or changes in power, voltage, current, or consumption. This paper develops an anomaly detection model for a real-world smart grid system implemented on a hardware-based testbed. By detecting abnormal activities, one can improve the system behavior in data communication flow. It will also identify if there are parameter changes that indicate the presence of cyber-attacks. Our proposed anomaly detection model is build based on Isolation Forest (IF) to isolate outliers from standard observations through multiple decision trees. The performance of the proposed detection method was verified using the simulation results on a hardware-based testbed. Feature selection was optimized by principal component analysis and the model was further analyzed for performance with dickey-fuller test.",IECON 2021 – 47th Annual Conference of the IEEE Industrial Electronics Society,2021,semantic_scholar,citation,citation
abefa5253251092a447665b1dc860351be6a414a,https://www.semanticscholar.org/paper/abefa5253251092a447665b1dc860351be6a414a,Discussing resilience in the context of cyber physical systems,,Comput. Ind. Eng.,2021,semantic_scholar,citation,citation
2791fcd1ff399018984e21d85df225e60f3ec9ea,https://www.semanticscholar.org/paper/2791fcd1ff399018984e21d85df225e60f3ec9ea,A Comprehensive Survey on Cyber-Physical Smart Grid Testbed Architectures: Requirements and Challenges,"The integration of improved control techniques with advanced information technologies enables the rapid development of smart grids. The necessity of having an efficient, reliable, and flexible communication infrastructure is achieved by enabling real-time data exchange between numerous intelligent and traditional electrical grid elements. The performance and efficiency of the power grid are enhanced with the incorporation of communication networks, intelligent automation, advanced sensors, and information technologies. Although smart grid technologies bring about valuable economic, social, and environmental benefits, testing the combination of heterogeneous and co-existing Cyber-Physical-Smart Grids (CP-SGs) with conventional technologies presents many challenges. The examination for both hardware and software components of the Smart Grid (SG) system is essential prior to the deployment in real-time systems. This can take place by developing a prototype to mimic the real operational circumstances with adequate configurations and precision. Therefore, it is essential to summarize state-of-the-art technologies of industrial control system testbeds and evaluate new technologies and vulnerabilities with the motivation of stimulating discoveries and designs. In this paper, a comprehensive review of the advancement of CP-SGs with their corresponding testbeds including diverse testing paradigms has been performed. In particular, we broadly discuss CP-SG testbed architectures along with the associated functions and main vulnerabilities. The testbed requirements, constraints, and applications are also discussed. Finally, the trends and future research directions are highlighted and specified.",Electronics,2021,semantic_scholar,citation,citation
e87fed422a2df353c9efd4a1861a3326bc35a559,https://www.semanticscholar.org/paper/e87fed422a2df353c9efd4a1861a3326bc35a559,Review of Design Elements within Power Infrastructure Cyber–Physical Test Beds as Threat Analysis Environments,"Cyber–physical systems (CPSs) are an integral part of modern society; thus, enhancing these systems’ reliability and resilience is paramount. Cyber–physical testbeds (CPTs) are a safe way to test and explore the interplay between the cyber and physical domains and to cost-effectively enhance the reliability and resilience of CPSs. Here a review of CPT elements, broken down into physical components (simulators, emulators, and physical hardware), soft components (communication protocols, network timing protocols), and user interfaces (visualization-dashboard design considerations) is presented. Various methods used to validate CPS performance are reviewed and evaluated for potential applications in CPT performance validation. Last, initial simulated results for a CPT design, based on the IEEE 33 bus system, are presented, along with a brief discussion on how model-based testing and fault–injection-based testing (using scaling and ramp-type attacks) may be used to help validate CPT performance.",Energies,2021,semantic_scholar,citation,citation
a62c585820a62f7944cc43c8e307b9f76b4584ae,https://www.semanticscholar.org/paper/a62c585820a62f7944cc43c8e307b9f76b4584ae,Data-Driven Correlation of Cyber and Physical Anomalies for Holistic System Health Monitoring,"Concerns of cyber-security threats are increasingly becoming a part of everyday operations of cyber-physical systems, especially in the context of critical infrastructures. However, despite the tight integration of cyber and physical components in modern critical infrastructures, the monitoring of cyber and physical subsystems is still done separately. For successful health monitoring of such systems, a holistic approach is needed. In this paper, we present an approach for holistic health monitoring of cyber-physical systems based on cyber and physical anomaly detection and correlation. We provide a data-driven approach for the detection of cyber and physical anomalies based on machine learning. The benefits of the presented approach are: 1) integrated architecture that supports acquisition and real-time analysis of both cyber and physical data; 2) a metric for holistic health monitoring that allows for differentiation between physical faults, cyber intrusion, and cyber-physical attacks. We present experimental analysis on a power-grid use case using the IEEE-33 bus model. The system was tested on several types of attacks such as network scan, Denial of Service (DOS), and malicious command injections.",IEEE Access,2021,semantic_scholar,citation,citation
