doi,url,title,abstract,publisher,publication_date,database,query_name,query_value
ced24304f28c5cae926d08486f8eb252eb81bb80,https://www.semanticscholar.org/paper/ced24304f28c5cae926d08486f8eb252eb81bb80,An Optimization Algorithm for the NP-hard 3 D Gallery Guarding Problem and its Application on Autonomous Pipeline Inspection,"This paper introduces a hierarchical optimization algorithm to an open NP-hard 3D guarding problem for massive data sets. The proposed hierarchical integer linear programming (HILP) algorithm can find the fewest spots necessary to cover an entire given 3D region. Efficiently solving this problem can greatly benefit autonomous pipeline monitoring and inspections. Unlike most existing pipeline inspection systems that focus on designing mobility and control of the explore robots, this framework focuses on planning automatic and thorough inspection in a complex environment. We demonstrate its efficacy on a simulated system built upon scanned pipelines environments using our prototype robots, in which leaks, clogs, and deformation can be detected thoroughly.",,2011,semantic_scholar,citation,citation
514021c79e5bbbbcbd82c96f10193aa94be81233,https://www.semanticscholar.org/paper/514021c79e5bbbbcbd82c96f10193aa94be81233,Modular Robotics and Locomotion: Application to Limbless Robots,"This dissertation discusses the locomotion of modular robots. It is focused specifically on the study of 1D topology configurations (called snakes or limbless robots). The problem to solve is how to coordinate the joint's movement so that modular robots can move both in one and two dimensions. A big challenge in robotics is the development of a very versatile robot with the full capability of moving on different terrains. This is especially important in applications where the environment is unknown in advance, such as the exploration of other planet's surfaces, navigation in hostile environments and search and rescue operations. Modular robotics offers the promise of increasing the versatility in locomotion by means of building robots from basic modules. Each configuration has its own locomotive characteristics that should be studied. If the robots have the ability to be self-reconfigurable, then they will be able to change their shapes and topology in order to select the best gait for every terrain and negotiate with different tasks. One kind of bio-inspired controllers for mobile robots used in the last decade are based on CPG (Central pattern generators), which are a specialized neurons that produce rhythms for controlling the muscle activities of animals. In the steady state CPG behave like fixed-frequency oscillators. For that reason, they can be replaced by a simplified model like sinusoidal generators. The main advantage is that they are extremely simple to implement and requires very few computing resources. Therefore, they can be implemented in low-end inexpensive microcontrollers. Moreover, the generators can also be realized directly as hardware components using either digital or analog electronics. In this dissertation a general classification of modular robots is established based on their topologies and types of connection. The hypothesis of using sinusoidal generators for controlling the locomotion of 1D pitch-pitch and pitch-yaw modular robots of any length is raised. The results show that this simple model is efficient and the gaits obtained are natural and smooth. It is shown that at least they can move in five different movements. Some of them are totally new and have not been previously studied or implemented by other researchers, from the best of our knowledge. In addition, the relationships between the generator's parameters and the robot kinematics have been obtained. Another problem is to find the minimal configurations for locomotion, which are the modular robots within the studied groups that have the minimum number of modules and are still capable of moving in one and two dimensions. This problem has been solved and the two minimal configurations are presented. Their kinematics models are studied throughout too. The experiments confirm that the solutions found to the coordination problem are valid for the locomotion of real mobile modular robots. Four kinds of modular robotic prototypes have been built using the identical Y1 modules, which have been designed specifically for this thesis. Finally the knowledge about the locomotion of pitch-pitch and pitch-yaw connecting modular robots has been summarized in 27 key principles.",,2008,semantic_scholar,citation,citation
d0ee48da308177d90666b2b3bdec2cfc884907e1,https://www.semanticscholar.org/paper/d0ee48da308177d90666b2b3bdec2cfc884907e1,Wheeeler - Hypermobile Robot,,Eurobot Conference,2008,semantic_scholar,citation,citation
d9f7bdd804aa16699dc88f273f9bf1485b3a570a,https://www.semanticscholar.org/paper/d9f7bdd804aa16699dc88f273f9bf1485b3a570a,MODULAR ROBOTICS AND LOCOMOTION: APPLICATION TO LIMBLESS ROBOTS,,,2008,semantic_scholar,citation,citation
96592e477bb29b3f8848cbcf08a8204bf42d8c40,https://www.semanticscholar.org/paper/96592e477bb29b3f8848cbcf08a8204bf42d8c40,A Historical Perspective of Legged Robots,"The objective of this paper is to present the evolution and the state-of-the-art in the area of legged locomotion systems. In a first phase different possibilities for implementing mobile robots are discussed, namely the case of artificial legged locomotion systems, while emphasizing their advantages and limitations. In a second phase a historical overview of the evolution of these systems is presented, bearing in mind several particular cases often considered as milestones of technological and scientific progress. After this historical timeline, some of the present-day systems are examined and their performance is analyzed. In a third phase the major areas of research and development that are presently being followed in the construction of legged robots are pointed out. Finally, some still unsolved problems that remain defying robotics research, are also addressed.",,2007,semantic_scholar,citation,citation
6ead6afb82e1289ec1d9abded475e92509a74060,https://www.semanticscholar.org/paper/6ead6afb82e1289ec1d9abded475e92509a74060,In-pipe robot for inspection and sampling tasks,"Purpose – To develop an in‐pipe robot to be used for inspecting pipes that are laid underneath a waste disposal site and for sampling sewage water leaking from holes around the pipe.Design/methodology/approach – The paper presents a compact design of the robot's mechanical and electronic systems, and develops a simple and practical method for determining the hole position using some characteristics of this in‐pipe robot.Findings – Development of a multi‐functional in‐pipe robot with elaborate design is feasible, and multiple trapezoidal‐shaped wheels have good capabilities of providing the robot large traction force and keeping the robot horizontal in pipeline. A good mechanical structure design can greatly reduce control and computation cost by using some specific features of the object system.Research limitations/implications – This study provides guidance for future design of multi‐functional in‐pipe robots.Practical implications – The combination of a vision system and a manipulator can perform in‐pip...",Ind. Robot,2007,semantic_scholar,citation,citation
6e6ae08259b22ac769c9a81a62f9752eb2b9e732,https://www.semanticscholar.org/paper/6e6ae08259b22ac769c9a81a62f9752eb2b9e732,Applying CORBA Technology for the Teleoperation of Wheeeler,,RoMoCo,2007,semantic_scholar,citation,citation
97158f289481e54a9b29216ac54e19024dac30f0,https://www.semanticscholar.org/paper/97158f289481e54a9b29216ac54e19024dac30f0,Serpentine Robots for Industrial Inspection and Surveillance,"¶ Urban search and rescue, industrial inspections, and military intelligence have one need in common: smallsized mobile robots that can travel across the rubble of a collapsed building, squeeze through small crawl-spaces to take measurements or perform visual inspections, and slither into the shelter of insurgents to gather intelligence. Some of these areas are not only difficult to reach, but may also present safety and health hazards to human inspectors. One species of mobile robots that promises to deliver such hypermobility is the so-called serpentine or snake robot (see Figure 1). Serpentine robots typically comprise of three or more rigid segments that are connected by 2or 3-degree-of-freedom (DOF) joints. The segments typically have powered wheels, tracks, or legs to propel the vehicle forward, while the joints may be powered or unpowered. Desired capabilities for such a robot are: • ability to traverse rugged terrain, such as concrete floors cluttered with debris, or unfinished floors such as those found on constructions sites; • ability to fit through small openings; • ability to climb up and over tall vertical steps;",,2006,semantic_scholar,citation,citation
df5a34d4900b24c31c55fe706805663188368fa4,https://www.semanticscholar.org/paper/df5a34d4900b24c31c55fe706805663188368fa4,An Overview of Legged Robots,"The objective of this paper is to present the evolution and the state-of-theart in the area of legged locomotion systems. In a first phase different possibilities for mobile robots are discussed, namely the case of artificial legged locomotion systems, while emphasizing their advantages and limitations. In a second phase an historical overview of the evolution of these systems is presented, bearing in mind several particular cases often considered as milestones on the technological and scientific progress. After this historical timeline, some of the present day systems are examined and their performance is analyzed. In a third phase are pointed out the major areas for research and development that are presently being followed in the construction of legged robots. Finally, some of the problems still unsolved, that remain defying robotics research, are also addressed.",,2006,semantic_scholar,citation,citation
7f47a51a51407401a586927b1865675dd83e4158,https://www.semanticscholar.org/paper/7f47a51a51407401a586927b1865675dd83e4158,Compliant motion of a multi-segmented inspection robot,"This paper presents a method to potentate the multi-segmented inspection robot Kairo-II to navigate in unstructured and dynamic environment. Previous methods for motion planning for such robots come from driving scenarios in highly structured areas. The virtual tube algorithm is introduced which enables a multi-segmented robot to range in such complex environment. Precise force feedback is required. Therefore, we present a sensor system which is based on strain-gauges technology. Information extracted by this sensor enables the trajectory planning algorithm to adapt its curve. Thus, the proposed system provides and evaluates key functions for compliant motion of a multi-segmented robot within unstructured environment.",2005 IEEE/RSJ International Conference on Intelligent Robots and Systems,2005,semantic_scholar,citation,citation
89fbaa0cacab3c7bbcd7e502be1fc19d6751194f,https://www.semanticscholar.org/paper/89fbaa0cacab3c7bbcd7e502be1fc19d6751194f,The OmniTread serpentine robot with pneumatic joint actuation,"This paper describes the design of a pneumatic joint actuation system for the OmniTread serpentine robot, developed at the University of Michigan. Serpentine robots are mobile robots with one unique characteristic: they have a very large ratio of length to diameter. To implement this unique shape, they usually have multiple segments connected by joints. Some serpentine robots provide legged, wheeled, or tracked propulsion, and, in addition, actuation for the joints. In this paper we present a detailed analysis of pneumatic integrated joint actuators (IJA) invented and built especially for serpentine robots. The IJA combines advantages of pneumatic bellows-like actuators with our proportional position and stiffness (PPS) control algorithm. Controllable stiffness is of crucial importance in serpentine robots, which require stiff joints to cross gaps and compliant joints to conform to rough terrain for effective propulsion. The paper also includes results of tests performed at the Southwest Research Institute.","Proceedings of the Fifth International Workshop on Robot Motion and Control, 2005. RoMoCo '05.",2005,semantic_scholar,citation,citation
f300dd2ae1d90369fe0bc284689a14a99ecafc96,https://www.semanticscholar.org/paper/f300dd2ae1d90369fe0bc284689a14a99ecafc96,Edge Computing Architectures for Enabling the Realisation of the Next Generation Robotic Systems,"Edge Computing is a promising technology to provide new capabilities in technological fields that require instantaneous data processing. Researchers in areas such as machine and deep learning use extensively edge and cloud computing for their applications, mainly due to the significant computational and storage resources that they provide. Currently, Robotics is seeking to take advantage of these capabilities as well, and with the development of 5G networks, some existing limitations in the field can be overcome. In this context, it is important to know how to utilize the emerging edge architectures, what types of edge architectures and platforms exist today and which of them can and should be used based on each robotic application. In general, Edge platforms can be implemented and used differently, especially since there are several providers offering more or less the same set of services with some essential differences. Thus, this study addresses these discussions for those who work in the development of the next generation robotic systems and will help to understand the advantages and disadvantages of each edge computing architecture in order to choose wisely the right one for each application.",2022 30th Mediterranean Conference on Control and Automation (MED),2022,semantic_scholar,citation,citation
7ef8118665186657fccff43e9146319abae82f24,https://www.semanticscholar.org/paper/7ef8118665186657fccff43e9146319abae82f24,Deep Learning for Real Time Satellite Pose Estimation on Low Power Edge TPU,"— Pose estimation of an uncooperative space resident object is a key asset towards autonomy in close proximity operations. In this context monocular cameras are a valuable solution because of their low system requirements. However, the associated image processing algorithms are either too computationally expen-sive for real time on-board implementation, or not enough accurate. In this paper we propose a pose estimation software exploiting neural network architectures which can be scaled to different accuracy-latency trade-offs. We designed our pipeline to be compatible with Edge Tensor Processing Units to show how low power machine learning accelerators could enable Artificial Intelligence exploitation in space. The neural networks were tested both on the benchmark Spacecraft Pose Estimation Dataset, and on the pur-posely developed Cosmo Photorealistic Dataset, which depicts a COSMO-SkyMed satellite in a variety of random poses and steerable solar panels orientations. The lightest version of our architecture achieves state-of-the-art accuracy on both datasets but at a fraction of networks complexity, running at 7.7 frames per second on a Coral Dev Board Mini consuming just 2.2W.",ArXiv,2022,semantic_scholar,citation,citation
04d20d1da1899ed34a47f11165ca788dab06abd8,https://www.semanticscholar.org/paper/04d20d1da1899ed34a47f11165ca788dab06abd8,3D Garment Design Model Based on Convolution Neural Network and Virtual Reality,"The development of virtual reality technology has promoted the unceasing reform and development in the field of fashion design. Aiming at the key technologies and research difficulties in 3D clothing design, the structure of convolution neural network was designed, and a 3D clothing design model based on convolution neural network and virtual reality was constructed. By designing experiments, the average error, matching rate, prediction accuracy, pressure value, and other evaluation indexes are used to measure the performance of convolution neural network model in virtual reality three-dimensional clothing design. The results show that: first, the convolution neural network has the fastest training speed, with the maximum error of 1.63% and the average error of 0.48%. Second, with the increase of parameters, the matching degree of each part of the version and the corresponding data of the human body will gradually increase, the matching rate will slowly improve, and finally tends to 0.9 or so to achieve stability, Thirdly, the prediction accuracy of the convolution neural network is 92.689%, and the loss value is the least. Fourthly, in the virtual fitting and garment wearing experiments, the fit of the sample is within the allowed range, indicating that the automatic generation of fit sample has wearability and rationality.",Computational intelligence and neuroscience,2022,semantic_scholar,citation,citation
e989b24611c1d5bd1d957420466a04f93f268ad1,https://www.semanticscholar.org/paper/e989b24611c1d5bd1d957420466a04f93f268ad1,Towards a Framework for Human-AI Interaction Patterns in Co-Creative GAN Applications 92-102,"With the rise of Generative Adversarial Networks (GANs), AI has increasingly become a partner to human designers in co-creating cultural artifacts. While generative models have been applied in various creative tasks across disciplines, a theoretical foundation for understanding human-GAN collaboration is yet to be developed. Drawing from the mixed-initiative co-creation community, we propose a preliminary framework to analyze co-creative GAN applications. We identify four primary interaction patterns: Curating , Exploring , Evolving , and Conditioning . The suggested framework enables us to discuss the affordances and limitations of the different kind of interactions underlying co-creative GAN applications.",IUI Workshops,2022,semantic_scholar,citation,citation
bcf6f6e1d959a713347c8114f671cd0f46205a1e,https://www.semanticscholar.org/paper/bcf6f6e1d959a713347c8114f671cd0f46205a1e,fAshIon after fashion: A Report of AI in Fashion,"In this independent report fAshIon after fashion, we examine the development of fAshIon (artificial intelligence (AI) in fashion) and explore its potentiality to become a major disruptor of the fashion industry in the near future. To do this, we investigate AI technologies used in the fashion industry – through several lenses. We summarise fAshIon studies conducted over the past decade and categorise them into seven groups: Overview, Evaluation, Basic Tech, Selling, Styling, Design, and Buying. The datasets mentioned in fAshIon research have been consolidated on one GitHub page for ease of use1. We analyse the authors’ backgrounds and the geographic regions treated in these studies to determine the landscape of fAshIon research. The results of our analysis are presented with an aim to provide researchers with a holistic view of research in fAshIon. As part of our primary research, we also review a wide range of cases of applied fAshIon in the fashion industry and analyse their impact on the industry, markets and individuals. We also identify the challenges presented by fAshIon and suggest that these may form the basis for future research. We finally exhibit that many potential opportunities exist for the use of AI in fashion which can transform the fashion industry embedded with AI technologies and boost profits.",ArXiv,2021,semantic_scholar,citation,citation
767b5e373facf6c1ddd30e0b45b3720beb83cb9c,https://www.semanticscholar.org/paper/767b5e373facf6c1ddd30e0b45b3720beb83cb9c,Generative Adversarial Networks–Enabled Human–Artificial Intelligence Collaborative Applications for Creative and Design Industries: A Systematic Review of Current Approaches and Trends,"The future of work and workplace is very much in flux. A vast amount has been written about artificial intelligence (AI) and its impact on work, with much of it focused on automation and its impact in terms of potential job losses. This review will address one area where AI is being added to creative and design practitioners’ toolbox to enhance their creativity, productivity, and design horizons. A designer’s primary purpose is to create, or generate, the most optimal artifact or prototype, given a set of constraints. We have seen AI encroaching into this space with the advent of generative networks and generative adversarial networks (GANs) in particular. This area has become one of the most active research fields in machine learning over the past number of years, and a number of these techniques, particularly those around plausible image generation, have garnered considerable media attention. We will look beyond automatic techniques and solutions and see how GANs are being incorporated into user pipelines for design practitioners. A systematic review of publications indexed on ScienceDirect, SpringerLink, Web of Science, Scopus, IEEExplore, and ACM DigitalLibrary was conducted from 2015 to 2020. Results are reported according to PRISMA statement. From 317 search results, 34 studies (including two snowball sampled) are reviewed, highlighting key trends in this area. The studies’ limitations are presented, particularly a lack of user studies and the prevalence of toy-examples or implementations that are unlikely to scale. Areas for future study are also identified.",Frontiers in Artificial Intelligence,2021,semantic_scholar,citation,citation
2a36402451c4fcab33c9e7f59fc027167c070aa6,https://www.semanticscholar.org/paper/2a36402451c4fcab33c9e7f59fc027167c070aa6,Perfection Not Required? Human-AI Partnerships in Code Translation,"Generative models have become adept at producing artifacts such as images, videos, and prose at human-like levels of proficiency. New generative techniques, such as unsupervised neural machine translation (NMT), have recently been applied to the task of generating source code, translating it from one programming language to another. The artifacts produced in this way may contain imperfections, such as compilation or logical errors. We examine the extent to which software engineers would tolerate such imperfections and explore ways to aid the detection and correction of those errors. Using a design scenario approach, we interviewed 11 software engineers to understand their reactions to the use of an NMT model in the context of application modernization, focusing on the task of translating source code from one language to another. Our three-stage scenario sparked discussions about the utility and desirability of working with an imperfect AI system, how acceptance of that system’s outputs would be established, and future opportunities for generative AI in application modernization. Our study highlights how UI features such as confidence highlighting and alternate translations help software engineers work with and better understand generative NMT models.",IUI,2021,semantic_scholar,citation,citation
7f4d129454480cea7683c5ed610c128876b6e12f,https://www.semanticscholar.org/paper/7f4d129454480cea7683c5ed610c128876b6e12f,Technology enablers for the implementation of Industry 4.0 to traditional manufacturing sectors: A review,,Comput. Ind.,2021,semantic_scholar,citation,citation
57607cbb83724ca7596c5a1e26fafaf884ef378a,https://www.semanticscholar.org/paper/57607cbb83724ca7596c5a1e26fafaf884ef378a,Facial Recognition Using Edge-Driven Biometric System,"Non-invasive biometric methods such as facial recognition reduce the risks and difficulty that come with handling confidential biometric data. Also, it makes the task of providing security simpler while ensuring accurate results simultaneously. Integrating biometric systems with Edge Computing and Deep Learning, makes the system more robust and dynamic by reducing latency and bandwidth usage. The purpose of this paper is to present an optimal facial recognition model suitable for a wide range of applications. The system uses HOG descriptors combined with Deep Learning to identify a person from a custom database. The facial recognition system is hosted on low-power devices with the help of an Internet-of-Things (IoT) network, making it entirely edge-based. A standard Message Queue Telemetry Transport (MQTT) protocol hosted over a local Wi-Fi network is used to facilitate communication between devices in the network. An accuracy of 98.33% has been achieved.",2022 International Conference on Applied Artificial Intelligence and Computing (ICAAIC),2022,semantic_scholar,citation,citation
eb7a8fa2cfebfaecd665ffe9ffee55f2b1408f90,https://www.semanticscholar.org/paper/eb7a8fa2cfebfaecd665ffe9ffee55f2b1408f90,FACE MASK DETECTION USING DEEP LEARNING,"In the Covid-19 Pandemic all countries government warned the citizens to wear a mask whenever they are away from home. They ordered not to leave house without a face mask. In every public premise, offices, in transportation the government and office officials held a face mask compulsory poster. The police and others usually warn and alert a person who does not wear a face mask. In the offices at the entrance the people are examined individually for face mask manually.",,2021,semantic_scholar,citation,citation
