doi,url,title,abstract,publisher,publication_date,database,query_name,query_value
decdee81c80445d6b83e835a4b641ef5edc6a7a8,https://www.semanticscholar.org/paper/decdee81c80445d6b83e835a4b641ef5edc6a7a8,The interplay between the Internet of things and supply chain management: challenges and opportunities based on a systematic literature review,"PurposeThis study aims to identify and analyze how Internet of things (IoT) technology affects supply chain management (SCM) performance.Design/methodology/approachA systematic literature review was conducted (using Scopus, JSTOR, Emerald, ProQuest, Science Direct and Web of Science) covering a 20-year timeframe (2000–2020). Out of 2,572 papers identified, 171 peer-reviewed papers from the most important journals were selected. Content analysis was used following the Global Supply Chain Forum (GSCF) SCM framework.FindingsRegarding the GSCF SCM framework processes, most IoT-based studies have addressed improving order fulfilment, manufacturing flow management and demand management processes. However, no studies addressing the Supplier relationship management process were identified, suggesting that IoT-based applications are perceived to add more value in downstream than upstream SCM processes. The importance of using enabling technologies to realize the potential of value generation of IoT was also revealed. Findings suggest new research avenues related to product development and commercialization process, the supplier relationship management process, the returns management process, servitization strategies, new SCM models and new business models.Research limitations/implicationsThe review encompasses only academic papers from journals considered the most relevant (retrieved from specific databases), using the impact factor as the quality criterion.Practical implicationsThe findings can help business managers better understand the potential of IoT technology, such as the main applications identified in the literature and their impacts on SCM processes. Their importance in enabling technologies to leverage SCM performance is identified and the emerging SCM models/business models that IoT deployment can enable are highlighted.Originality/valueThis study contributes to filling a gap in the literature using a systematic literature review of how IoT technology affects SCM performance through content analysis, using an SCM framework to clarify which SCM processes are affected. Academic articles from the most important journals from 2000 to 2020 are identified.",Benchmarking: An International Journal,2021.0,semantic_scholar,citation,citation
5f4634aa233231551b832729ac753fdfd0dd8f11,https://www.semanticscholar.org/paper/5f4634aa233231551b832729ac753fdfd0dd8f11,Agri-Food 4.0 and Innovations: Revamping the Supply Chain Operations,"Abstract The agri-food sector contributes significantly to economic and social advancements globally despite numerous challenges such as food safety and security, demand and supply gaps, product quality, traceability, etc. Digital technologies offer effective and sustainable ways to these challenges through reduced human interference and improved data-accuracy. Innovations led by digital transformations in the agri-food supply chains (AFSCs) are the main aim of ‘Agri-Food 4.0’. This brings significant transformations in the agri-food sector by reducing food wastage, real-time product monitoring, reducing scalability issues, etc. This paper presents a systematic review of the innovations in the agri-food for digital technologies such as internet-of-things, artificial intelligence, big data, RFID, robotics, block-chain technology, etc. The employment of these technologies from the ‘farm to fork’ along AFSC emphasizes a review of 159 articles solicited from different sources. This paper also highlights digitization in developing smart, sensible, and sustainable agri-food supply chain systems.",Production Engineering Archives,2021.0,semantic_scholar,citation,citation
10542bf911b137821192465188e8c5cea8367003,https://www.semanticscholar.org/paper/10542bf911b137821192465188e8c5cea8367003,Edge-Based Missing Data Imputation in Large-Scale Environments,"Smart cities leverage large amounts of data acquired in the urban environment in the context of decision support tools. These tools enable monitoring the environment to improve the quality of services offered to citizens. The increasing diffusion of personal Internet of things devices capable of sensing the physical environment allows for low-cost solutions to acquire a large amount of information within the urban environment. On the one hand, the use of mobile and intermittent sensors implies new scenarios of large-scale data analysis; on the other hand, it involves different challenges such as intermittent sensors and integrity of acquired data. To this effect, edge computing emerges as a methodology to distribute computation among different IoT devices to analyze data locally. We present here a new methodology for imputing environmental information during the acquisition step, due to missing or otherwise out of order sensors, by distributing the computation among a variety of fixed and mobile devices. Numerous experiments have been carried out on real data to confirm the validity of the proposed method.",Inf.,2021.0,semantic_scholar,citation,citation
7f2271d9d18928fbb166bd1478be467fdccd54dd,https://www.semanticscholar.org/paper/7f2271d9d18928fbb166bd1478be467fdccd54dd,"A Survey of Industrial Internet of Things Platforms for Establishing Centralized Data-Acquisition Middleware: Categorization, Experiment, and Challenges","The development of industrial Internet of Things (IIoT), big data, and artificial intelligence technologies is leading to a major change in the production system. The change is being propagated into the wave of transforming the existing system with a vertical structure into the corresponding horizontal platform or middleware. Accordingly, the way of acquiring IIoT data from an individual system is being altered to the way of being increasingly centralized through an integrated middleware of a scalable server or through a large platform. That said, middleware-based IIoT data acquisition must consider multiple factors, such as infrastructure (e.g., operation environment and network), protocol heterogeneity, interoperability (e.g., links with legacy systems), real-time, and security. This manuscript explains these five aspects in detail and provides a taxonomy of eighteen state-of-the-art IIoT data-acquisition middleware systems based on these aspects. To validate one of these aspects (network), we present our evaluation results at a real production site where IIoT data-acquisition loss rates are compared between wireless (long-term evolution) and wired networks. As a result, the wired communication can be more suitable for centralized IIoT data-acquisition middleware than wireless networks. Finally, we discuss several challenges in establishing the best IIoT data-acquisition middleware in a centralized way.",Sci. Program.,2021.0,semantic_scholar,citation,citation
13e35abae4e70dcbab11fbf87a63df996cb70feb,https://www.semanticscholar.org/paper/13e35abae4e70dcbab11fbf87a63df996cb70feb,Internet of Things for the Future of Smart Agriculture: A Comprehensive Survey of Emerging Technologies,"This paper presents a comprehensive review of emerging technologies for the internet of things (IoT)-based smart agriculture. We begin by summarizing the existing surveys and describing emergent technologies for the agricultural IoT, such as unmanned aerial vehicles, wireless technologies, open-source IoT platforms, software defined networking (SDN), network function virtualization (NFV) technologies, cloud/fog computing, and middleware platforms. We also provide a classification of IoT applications for smart agriculture into seven categories: including smart monitoring, smart water management, agrochemicals applications, disease management, smart harvesting, supply chain management, and smart agricultural practices. Moreover, we provide a taxonomy and a side-by-side comparison of the state-of-the-art methods toward supply chain management based on the blockchain technology for agricultural IoTs. Furthermore, we present real projects that use most of the aforementioned technologies, which demonstrate their great performance in the field of smart agriculture. Finally, we highlight open research challenges and discuss possible future research directions for agricultural IoTs.",IEEE/CAA Journal of Automatica Sinica,2021.0,semantic_scholar,citation,citation
695ddb52912766fedda9327b074b56685610ac03,https://www.semanticscholar.org/paper/695ddb52912766fedda9327b074b56685610ac03,Internet of Things (IoT) for Smart Farming: A Systematic Review,"The world population growth is projected to increase in the coming years and it brings along challenges such as food insecurity and increasing demand for food as a result of production challenges. For these reasons, sustainable and innovative agriculture practices are given higher priority. Smart farming is one of the innovative practices which has seen a significant growth as a result of improved technology and it is a novel farm management method that uses technologies to optimize farming activities and increase productivity. Many reviews on application of IoTs for farming have been published which shows significant contributions in this area of research. In existing reviews, the focus is mainly on areas like Unmanned Aerial Vehicles (UAC) and network topologies, technologies and protocols. This work uses the Preferred Reporting Items for Systematic Reviews and Meta-Analyses (PRISMA) methodology to make a systematic review of current state of IoTs for farming by identifying the state-of-the-art sensing, networking, communication and data management technologies commonly used to implement the solution. The work demonstrates the growing importance of IoTs in farm management and reveals a significant improvement in the way sensor data are",,2021.0,semantic_scholar,citation,citation
4569fd73ae68a948e5b9c24a4e45b1022c4a68b5,https://www.semanticscholar.org/paper/4569fd73ae68a948e5b9c24a4e45b1022c4a68b5,Precision Livestock Farming Technologies: Novel Direction of Information Flow,"Precision livestock farming (PLF) is a digital management system that continuously measures the production, reproduction, health and welfare of animals and environmental impacts of the herd by using information and communication technologies (ICT) and controls all stages of the production process. In conventional livestock management, decisions are mostly based on the appraisal, judgment, and experience of the farmer, veterinarian, and workers. The increasing demand for production and the number of animals makes it difficult for humans to keep track of animals. It is clear that a person is not able to continuously watch the animals 24 hours a day to receive reliable audio-visual data for management. Recent technologies already changed the information flow from animal to human, which helps people to collect reliable information and transform it into an operational decision-making process (eg reproduction management or calving surveillance). Today, livestock farming must combine requirements for a transparent food supply chain, animal welfare, health, and ethics as a traceable-sustainable model by obtaining and processing reliable data using novel technologies. This review provides preliminary information on the advances in ICT for livestock management.",,2021.0,semantic_scholar,citation,citation
08c1cf776e592f1ae9afa099e674526142444f22,https://www.semanticscholar.org/paper/08c1cf776e592f1ae9afa099e674526142444f22,Blockchain technology for a sustainable agri-food supply chain,"PurposeThe present paper is aimed at 1) performing a systematic literature review (SLR) on applications in the perspective of sustainable agri-food supply chain (SC) of blockchain technology (BCT); 2) analyzing the selected literature, focusing on the advantages of the sustainable uses of the blockchain of the aforementioned SC and 3) presenting an outlook and research directions capable of addressing unresolved problems.Design/methodology/approachThe SLR was conducted using detailed criteria to identify academic articles. Moreover, specific keywords and databases were used. The time frame considered included the years 2010–2020.FindingsThe review analysis indicates that the use of BCT or BCT supported by ICT/IoT contributes to sustainability of agri-food production. However, this technology can lead to several challenges such as scalability, privacy leakage, high cost and connectivity problems.Research limitations/implicationsThe paper demonstrates that BCT can widely use agri-food supply chain due to its intrinsic characteristics. However, it is not excluded that the criteria chosen may not have identified important articles regarding BCT, the agri-food sector and sustainability.Originality/valueAlthough the body of academic literature published on this topic is expansive, the effect of BCT on the agri-food SC's sustainability aspects has not yet been adequately analyzed. Thus, the article is aimed at investigating how BCT is used in the SC. In particular, the article is intended to update information about BCT and its impact on sustainability.",,2021.0,semantic_scholar,citation,citation
cb0630bbe0f22662abae83a44cf26ef70814c4e7,https://www.semanticscholar.org/paper/cb0630bbe0f22662abae83a44cf26ef70814c4e7,Digital Livestock Farming,,,2021.0,semantic_scholar,citation,citation
bd8a0b88a8e8e8ed7939165b2c000a93065162ad,https://www.semanticscholar.org/paper/bd8a0b88a8e8e8ed7939165b2c000a93065162ad,The internet of things in the food supply chain: adoption challenges,"Purpose: The food supply chain (FSC) challenges coupled with global disruptions, such as the recent coronavirus disease 2019 (COVID-19) pandemic outbreak, exacerbate its vulnerability The Internet of things (IoT) is one of the disruptive technologies being adopted in food supply chain management (FSCM) This study aims to address the challenges of IoT adoption in the FSC by systematically analyzing the prior pertinent literature Design/methodology/approach: A structured literature review was used to collate a list of peer-reviewed and relevant publications A total of 72 out of 210 articles were selected for the final evaluation Findings: The literature review findings suggest five themes: technical, financial, social, operational, educational and governmental related challenges A total of 15 challenges were devised from the review related literature of IoT adoption The study concludes with future research recommendations for scholars and practical implications for practitioners Research limitations/implications: While this study focuses on the overall FSC, further research should address other domains in the FSC such as cold supply chain, agriculture and perishable food to gain a better contextual understanding of the specific case Originality/value: The topic of IoT adoption in the FSCM is still considered emerging Therefore, the present work contributes to the limited studies and documentation on the level of IoT implementation in the FSCM This study should help organizations to assimilate how to adopt and manage the IoT application by addressing the factors and challenges presented in this research © 2021, Emerald Publishing Limited",,2021.0,semantic_scholar,citation,citation
03c4a3cf167a043e43a41f93014a58b8f25e8306,https://www.semanticscholar.org/paper/03c4a3cf167a043e43a41f93014a58b8f25e8306,An IoT open source platform for photovoltaic plants supervision,,,2021.0,semantic_scholar,citation,citation
a5091cc4bb36220146278146baf50a8be3401202,https://www.semanticscholar.org/paper/a5091cc4bb36220146278146baf50a8be3401202,A LoRa sensor network for monitoring pastured livestock location and activity1,"Abstract Precision technologies for confinement animal agricultural systems have increased rapidly over the past decade, though precision technology solutions for pastured livestock remain limited. There are a number of reasons for this limited expansion of technologies for pastured animals, including networking availability and reliability, power requirements, and expense, among others. The objective of this work was to demonstrate a rapidly deployable long-range radio (LoRa) based, low-cost sensor suite that can be used to track location and activity of pastured livestock. The sensor is comprised of an inexpensive Arduino-compatible microprocessor, a generic MPU-9250 motion sensor which contains a 3-axis accelerometer, 3-axis magnetometer, and a 3-axis gyroscope, a generic GPS receiver, and a RFM95W generic LoRa radio. The microprocessor can be programmed flexibly using the open source Arduino IDE software to adjust the frequency of sampling, the data packet to send, and what conditions are needed to operate. The LoRa radio transmits to a Dragino LoRa gateway which can also be flexibly programmed through the Arduino IDE software to send data to local storage or, in cases where a web or cellular connection is available, to cloud storage. The sensor was powered using a USB cord connected to a 3,350 mAh lithium-ion battery pack. The Dragino gateway was programmed to upload data to the ThingSpeak IoT application programming interface for data storage, handling, and visualization. Evaluations showed minimal benefit associated with reducing sampling frequency as a strategy to preserve battery life. Packet loss ranged from 40% to 60%. In a 3 d evaluation on pastured sheep, the sensor suite was able to report GPS locations, inertial sensor readings, and temperature. Preliminary demonstrations of our system are satisfactory to detect animal location based on GPS data in real-time. This system has clear utility as a lower-cost strategy to deploy flexible, useful precision technologies for pasture-based livestock species.",Translational animal science,2021.0,semantic_scholar,citation,citation
cdb98f103a98a58ceffb6b19dc93e6bcf61c4072,https://www.semanticscholar.org/paper/cdb98f103a98a58ceffb6b19dc93e6bcf61c4072,Hybrid Grasshopper Optimization Algorithm and Genetic Algorithm for Optimal Water Control in Sugarcane Crops,": The Internet of Things (IoT) inventive services lead to the model of complicated systems by exploiting heterogeneous technologies. IoT pretense combines networks to present even services to people. In sustainable sugarcane crop production, irrigation plays an important role in regions that undergo a scarcity of water. In agriculture, the efficient exploitation of water is an important constraint because of raising the water demand as well as the extreme need to improve productivity. This work presents a Hybrid Grasshopper Optimization Algorithm and Genetic Algorithm based Deep convolution neural network named (Hybrid GOA and GA-DeepCNN) approach to provide the best water control in sugarcane crops. Moreover, the push-based approach, as well as the transformation of a log, is used to make the data appropriate for processing. Additionally, apriori approach is used to select the effectual feature from an enormous set of features acclimatizing a feature score. In order to maximize the classifier accuracy, the apriori approach is aided. In order to compute the watering quantity, a feature score is recently formulated to recognize the capable features. By exploiting the Deep CNN the water controlling stage is carried out and that is trained using the Hybrid GOA and GA optimization approach. The developed model performs better than the conventional models with maximum accuracy, sensitivity as well as specificity.",Journal of Networking and Communication Systems (JNACS),2021.0,semantic_scholar,citation,citation
5f4634aa233231551b832729ac753fdfd0dd8f11,https://www.semanticscholar.org/paper/5f4634aa233231551b832729ac753fdfd0dd8f11,Agri-Food 4.0 and Innovations: Revamping the Supply Chain Operations,"Abstract The agri-food sector contributes significantly to economic and social advancements globally despite numerous challenges such as food safety and security, demand and supply gaps, product quality, traceability, etc. Digital technologies offer effective and sustainable ways to these challenges through reduced human interference and improved data-accuracy. Innovations led by digital transformations in the agri-food supply chains (AFSCs) are the main aim of ‘Agri-Food 4.0’. This brings significant transformations in the agri-food sector by reducing food wastage, real-time product monitoring, reducing scalability issues, etc. This paper presents a systematic review of the innovations in the agri-food for digital technologies such as internet-of-things, artificial intelligence, big data, RFID, robotics, block-chain technology, etc. The employment of these technologies from the ‘farm to fork’ along AFSC emphasizes a review of 159 articles solicited from different sources. This paper also highlights digitization in developing smart, sensible, and sustainable agri-food supply chain systems.",Production Engineering Archives,2021.0,semantic_scholar,citation,citation
5cad7c7671850bb389a0eb1b54b865929ef287ea,https://www.semanticscholar.org/paper/5cad7c7671850bb389a0eb1b54b865929ef287ea,"Smart Dairy Farming Overview: Innovation, Algorithms and Challenges",,Transactions on Computer Systems and Networks,2021.0,semantic_scholar,citation,citation
543ac6f38a29670e032dac56632cb3c0e0b99d73,https://www.semanticscholar.org/paper/543ac6f38a29670e032dac56632cb3c0e0b99d73,A Survey on IoT Applications in Smart Cities,,Immersive Technology in Smart Cities,2021.0,semantic_scholar,citation,citation
f0374706c249edd43ac22c7f54561dd80bbfdd81,https://www.semanticscholar.org/paper/f0374706c249edd43ac22c7f54561dd80bbfdd81,An Edge-IoT Architecture and Regression Techniques Applied to an Agriculture Industry Scenario,,SSCT,2021.0,semantic_scholar,citation,citation
ee81f3a32d613afd6ad9656eb7417ef77f6c8066,https://www.semanticscholar.org/paper/ee81f3a32d613afd6ad9656eb7417ef77f6c8066,Nanostructured gas sensors in smart manufacturing,,,2021.0,semantic_scholar,citation,citation
47e452663e24b13bd949a4430a85f8e889c0e199,https://www.semanticscholar.org/paper/47e452663e24b13bd949a4430a85f8e889c0e199,Blockchain-Based Flexible Double-Chain Architecture and Performance Optimization for Better Sustainability in Agriculture,": Blockchain is an emerging decentralized distributed technology that can cross the boundaries and guarantee safe and trustworthy value transfers between participants. Combining the blockchain technology with the Internet of Things (IoT) technology to enhance the transparency and sustainability of agricultural supply chains, has attracted researchers from both academia and industry. This paper reviews the latest applications of the blockchain and IoT technologies in the sustainable agricultural supply chain management and explores the design and implementation of a blockchain-based sustainable solution. By placing the sustainable agricultural supply chain management at its core, a blockchain-based framework is designed. Considering the hetero-geneity of the transaction data and the IoT data, the openness of sustainability information and the sensitivity of participants’ data, a double-chain structure is proposed including the consensus method, the transaction mechanisms, the sustainability assessment method and the performance optimization strategy. The sustainable management practices of all participants are introduced into the blockchain network, especially those allowing the government to play a more significant role in agriculture supply management. Meanwhile, to meet the scenario requirements, a data reduction method is designed to improve performance and reduce block size. Simulations are performed to evaluate the latency, throughput, costs and efficiency of the proposed structure. This paper can be a useful reference for further research on the application of blockchain and IoT technologies in sustainable agricultural management.","Computers, Materials & Continua",2021.0,semantic_scholar,citation,citation
