doi,url,title,abstract,publisher,publication_date,database,query_name,query_value
c970bef8360e3c075c23533b2c49e53b9d216355,https://www.semanticscholar.org/paper/c970bef8360e3c075c23533b2c49e53b9d216355,A large-scale spatio-temporal data analytics system for wildfire risk management,"Wildfires have been a significant concern for communities and fire response agencies in many countries. Hence, it is critical to be able to predict the fire risk in a timely and accurate manner and at granular level. However, this requires accessing and processing large amounts of spatial and temporal data from a number of sources in near real-time, while ensuring the immediate availability of risk measurement results. In this paper, we describe a large-scale data-driven system for personalized risk mitigation, fire response's resource optimization and dynamic evacuation planning. It leverages large spatial and temporal datasets to provide predictive analytics in near real-time and to deliver tailored insights to government agencies, communities and individuals.",GeoRich '17,2017.0,semantic_scholar,citation,citation
b2457f02af8fc8c4dadfda079913f38bffcccd18,https://www.semanticscholar.org/paper/b2457f02af8fc8c4dadfda079913f38bffcccd18,Optimal query processing on geo-spatial objects,"Information located on Earth's surface is called as Geo-spatial if it is mapped using coordinates. Geo-spatial data is collection of all geographical demographics present on the earth and mapped using Global Information System. Query processing on such data opens a whole new dimension in technology, enabling people from multiple sectors to analyze and benefit from it. This paper proposes a query processor for Geo-spatial data stored in spatial database and its corresponding query language. The proposed strategy breaks the user given query into two parts, relational and spatial. The relational part involves queries on properties of objects, such as name, population, etc., while the spatial part involves queries on the geometric aspect of objects, such as intersection or union of shapes. This query when fired on the database, returns a set of filtered candidates of which the false hits are eliminated to give the final result.","2017 2nd IEEE International Conference on Recent Trends in Electronics, Information & Communication Technology (RTEICT)",2017.0,semantic_scholar,citation,citation
aa95ba5eeaf25d0b08eacc627433203eb5c22af1,https://www.semanticscholar.org/paper/aa95ba5eeaf25d0b08eacc627433203eb5c22af1,Drone-based reconstruction for 3D geospatial data processing,"Urban air quality affects health and well-being of more than half of the world's population. Measurement, modeling and real time action on pollution sources can alleviate their impact. A preliminary study for drone-based image acquisition and processing steps required for 3D reconstruction of potential pollution sources is presented. The 3D surface terrain models combined with sensor data are inputs into air pollution models for visualization, understanding and potential mitigation of methane plumes. Scaling these technologies across large areas requires the integration of big geospatial data with modeling, machine learning, and image processing.",2016 IEEE 3rd World Forum on Internet of Things (WF-IoT),2016.0,semantic_scholar,citation,citation
15de03bee8e1d382ca7b39d5af6dd85a70f5c6d1,https://www.semanticscholar.org/paper/15de03bee8e1d382ca7b39d5af6dd85a70f5c6d1,Solar irradiance forecasting by machine learning for solar car races,"Solar car race competitions offer realistic conditions to test and demonstrate the state-of-the-art technologies in multidisciplinary fields. In such races the solar panels mounted on the car produce the energy required to power the vehicle. A simulator runs during the race determines the optimal race speed based on the predicted availability of solar energy and other parameters as well as road conditions. The accuracy of the forecasts, especially the solar irradiance forecasts, has a significant impact on the race strategy. Here we report on the experience of providing irradiance forecasts for two races run by the University of Michigan Solar Car Team at the Bridgestone World Solar Challenge 2015 in Australia and at the American Solar Challenge 2016 from Ohio to South Dakota. The probabilistic forecasts of hourly solar irradiance generated from machine learning algorithms were deployed to optimally decide on the race strategy. This work showcases an example of real time decision making based on insights derived from machine learning utilizing big geospatial data — weather models and measurement data from weather station networks.",2016 IEEE International Conference on Big Data (Big Data),2016.0,semantic_scholar,citation,citation
d38288416634df8b125a65be046139e9db7ef13c,https://www.semanticscholar.org/paper/d38288416634df8b125a65be046139e9db7ef13c,IBM PAIRS curated big data service for accelerated geospatial data analytics and discovery,"IBM's Physical Analytics Integrated Data Repository and Services (PAIRS) is a geospatial Big Data service. PAIRS contains a massive amount of curated geospatial (or more precisely spatio-temporal) data from a large number of public and private data resources, and also supports user contributed data layers. PAIRS offers an easy-to-use platform for both rapid assembly and retrieval of geospatial datasets or performing complex analytics, lowering time-to-discovery significantly by reducing the data curation and management burden. In this paper, we review recent progress with PAIRS and showcase a few exemplary analytical applications which the authors are able to build with relative ease leveraging this technology.",2016 IEEE International Conference on Big Data (Big Data),2016.0,semantic_scholar,citation,citation
2eebe45c4c7188b96853f9e6b8abefd6e33f8fde,https://www.semanticscholar.org/paper/2eebe45c4c7188b96853f9e6b8abefd6e33f8fde,Toward large-scale crop production forecasts for global food security,"Predicting crop production plays a critical role in food price forecasting and mitigating potential food shortages. Crop models may require parameters from, for example, weather, crop genotype, farm management, and soil. Sources for these data are often found in very different places. Researchers spend a significant amount of time to collect and curate them. In addition, in order to scale yield forecasts from the single-farm level up to the continental scale, crop models have to be coupled with a geospatial big data platform to provide the required data inputs. In a proof-of-concept case study, we investigate the coupling of a scalable geospatial big data platform, Physical Analytics Integrated Repository and Services (PAIRS), to the Decision Support System for Agrotechnology Transfer (DSSAT) crop model. We envision running this system on a global scale. For geospatial analytics, PAIRS provides curation of heterogeneous data sources to simulate crop models using hundreds of terabytes of data.",IBM J. Res. Dev.,2016.0,semantic_scholar,citation,citation
74a41a69714c0092abb141851a62c03788e98c52,https://www.semanticscholar.org/paper/74a41a69714c0092abb141851a62c03788e98c52,Überlegungen zu einer Spatial Big Data Architektur im BigGIS Projekt,"In the recent years, a number of data-management and data-analytics applications and technologies under the label “big data” has found much interest among academics and practitioners. From our point of view, the respective researchers and commercial providers, up to now, neglected to a large extent both the spatial dimension of potential big-data applications and their usage potential in the area of environment protection and environment management. Hence, the RTD project BigGIS investigates methods and tools for “Spatial Big Data” in three environment-related application scenarios. In this paper, some basic definitions and considerations are explained, the three application scenarios of BigGIS are presented and some initial insights regarding software architectures for Spatial Big Data solutions in the area of geo data and environmental applications are presented. Zusammenfassung Unter der Überschrift “Big Data” machen in den vergangenen Jahren eine Reihe neuartiger Anwendungen und Technologien für Datenmanagement und -analyse viel von sich reden, in Wissenschaft und Praxis. In der Wahrnehmung der Autoren wurden dabei bisher sowohl die räumliche Komponente möglicher Big Data Anwendungen als auch Anwendungsideen im Kontext Umweltschutz und -verwaltung eher stiefmütterlich",UIS,2016.0,semantic_scholar,citation,citation
98bafc17b84a574a6147460ae4a941f2d565cd66,https://www.semanticscholar.org/paper/98bafc17b84a574a6147460ae4a941f2d565cd66,Applying big data and stream processing to the real estate domain,"ABSTRACT In this paper, we propose an architecture that combines Big Data and Stream Processing which can be applied to the Real Estate Domain. Our approach consists of a specialisation of Lambda architecture and it is inspired by some aspects of Kappa architecture. As a proof of this solution, we show a prototype developed following it and a comparison of the three architecture quality models. Finally, we highlight the differences between the proposed architecture and similar ones and draw some future lines following the present approach.",Behav. Inf. Technol.,2019,semantic_scholar,citation,citation
015d82334cb0d616974fe314d7088e83653bf268,https://www.semanticscholar.org/paper/015d82334cb0d616974fe314d7088e83653bf268,"FogROS G: Enabling Secure, Connected and Mobile Fog Robotics with Global Addressability","—Fog Robotics renders networked robots with greater mobility, on-demand compute capabilities and better energy efﬁciency by ofﬂoading heavy robotics workloads to nearby Edge and distant Cloud data centers. However, as the de-facto standard for implementing fog robotics applications, Robot Operating System (ROS) and its successor ROS2 fail to provide fog robots with a mobile-friendly and secure commu- nication infrastructure. In this work, we present FogROSG, a secure routing frame- work that connects robotics software components from different physical locations, networks, Data Distribution Service (DDS) and ROS distributions. FogROSG indexes networked robots with globally unique 256-bit names that remains constant even if the robot roams between multiple administrative network domains. FogROSG leverages Global Data Plane, a global and secure peer-to-peer routing infrastructure between the names, guaranteeing that only authenticated party can send to or receive from the robot. FogROSG adopts a proxy-based design that connect nodes from ROS1 and ROS2 with mainstream DDS vendors; this can be done without any changes to the application code. The code is publicly available at https: //github.com/KeplerC/gdp-for-ros .",,2022.0,semantic_scholar,citation,citation
c6be04cc7fc5c27aeeaed84b5b12cba4d93899ba,https://www.semanticscholar.org/paper/c6be04cc7fc5c27aeeaed84b5b12cba4d93899ba,A Secure and Efficient Multi-Object Grasping Detection Approach for Robotic Arms,"—Robotic arms are widely used in automatic indus- tries. However, with wide applications of deep learning in robotic arms, there are new challenges such as the allocation of grasping computing power and the growing demand for security. In this work, we propose a robotic arm grasping approach based on deep learning and edge-cloud collaboration. This approach realizes the arbitrary grasp planning of the robot arm and considers the grasp efﬁciency and information security. In addition, the encoder and decoder trained by GAN enable the images to be encrypted while compressing, which ensures the security of privacy. The model achieves 92 % accuracy on the OCID dataset, the image compression ratio reaches 0.03%, and the structural difference value is higher than 0.91.",ArXiv,2022.0,semantic_scholar,citation,citation
d0d954ab7d8d1f7ce3a0d8fbfdb6f928f0fa816b,https://www.semanticscholar.org/paper/d0d954ab7d8d1f7ce3a0d8fbfdb6f928f0fa816b,FogROS 2: An Adaptive and Extensible Platform for Cloud and Fog Robotics Using ROS 2,"—Mobility, power, and price points often dictate that robots do not have sufﬁcient computing power on board to run modern robot algorithms at desired rates. Cloud computing providers such as AWS, GCP, and Azure offer immense computing power on demand, but tapping into that power from a robot is non-trivial. In this paper, we present FogROS 2, an easy-to-use, open-source platform to facilitate cloud and fog robotics that is compatible with the emerging Robot Operating System 2 (ROS 2) standard. FogROS 2 provisions a cloud computer, deploys and launches ROS 2 nodes to the cloud computer, sets up secure networking between the robot and cloud, and starts the application running. FogROS 2 is completely redesigned and distinct from its predecessor to support ROS 2 applications, transparent video compression and communication, improved performance and security, support for multiple cloud-computing providers, and remote monitoring and visualization. We demonstrate in example applications that the performance gained by using cloud computers can overcome the network latency to signiﬁcantly speed up robot performance. In examples, FogROS 2 reduces SLAM latency by 50%, reduces grasp planning time from 14s to 1.2s, and speeds up motion planning 28x. When compared to alternatives, FogROS 2 reduces network utilization by up to 3.8x. FogROS 2, source, examples, and documentation is available at https: //github.com/BerkeleyAutomation/FogROS2 .",ArXiv,2022.0,semantic_scholar,citation,citation
393c00c22f3b94acc28508644609ac4c41fd72c4,https://www.semanticscholar.org/paper/393c00c22f3b94acc28508644609ac4c41fd72c4,Fog Robotics—Understanding the Research Challenges,"Fog robotics is an emerging topic that derives from cloud robotics, but similarly as fog computing, the applications require low latency connections in order to be useful in real life environments. This article presents a new perspective to the topic in which not only robotics takes advantage of the fog computing paradigm, but fog computing is able to leverage the robotics technology in order to enhance its features. This work highlights the benefits obtained by each technology when it is mixed with the other and sketches the relevant topics to research in order to make this partnership possible.",IEEE Internet Computing,2021.0,semantic_scholar,citation,citation
73208c1fbb1606228b4ab0d2ec91bde33154e1ce,https://www.semanticscholar.org/paper/73208c1fbb1606228b4ab0d2ec91bde33154e1ce,FogROS: An Adaptive Framework for Automating Fog Robotics Deployment,"As many robot automation applications increasingly rely on multi-core processing or deep-learning models, cloud computing is becoming an attractive and economically viable resource for systems that do not contain high computing power onboard. Despite its immense computing capacity, it is often underused by the robotics and automation community due to lack of expertise in cloud computing and cloud-based infrastructure. Fog Robotics balances computing and data between cloud edge devices. We propose a software framework, FogROS, as an extension of the Robot Operating System (ROS), the defacto standard for creating robot automation applications and components. It allows researchers to deploy components of their software to the cloud with minimal effort, and correspondingly gain access to additional computing cores, GPUs, FPGAs, and TPUs, as well as predeployed software made available by other researchers. FogROS allows a researcher to specify which components of their software will be deployed to the cloud and to what type of computing hardware. We evaluate FogROS on 3 examples: (1) simultaneous localization and mapping (ORB-SLAM2), (2) Dexterity Network (Dex-Net) GPU-based grasp planning, and (3) multi-core motion planning using a 96-core cloud-based server. In all three examples, a component is deployed to the cloud and accelerated with a small change in system launch configuration, while incurring additional latency of 1.2 s, 0.6 s, and 0.5 s due to network communication, the computation speed is improved by 2.6×, 6.0× and 34.2×, respectively. Code, videos, and supplementary material can be found at https://github.com/BerkeleyAutomation/FogROS.",2021 IEEE 17th International Conference on Automation Science and Engineering (CASE),2021.0,semantic_scholar,citation,citation
e7d3454021d19efffb0ee8220266ead93028eadd,https://www.semanticscholar.org/paper/e7d3454021d19efffb0ee8220266ead93028eadd,"Task offloading in Edge and Cloud Computing: A survey on mathematical, artificial intelligence and control theory solutions",,Comput. Networks,2021.0,semantic_scholar,citation,citation
29cf8d784d077f91198265fa0706ca1a62837c1a,https://www.semanticscholar.org/paper/29cf8d784d077f91198265fa0706ca1a62837c1a,Resource Allocation and Service Provisioning in Multi-Agent Cloud Robotics: A Comprehensive Survey,"Robotic applications nowadays are widely adopted to enhance operational automation and performance of real-world Cyber-Physical Systems (CPSs) including Industry 4.0, agriculture, healthcare, and disaster management. These applications are composed of latency-sensitive, data-heavy, and compute-intensive tasks. The robots, however, are constrained in the computational power and storage capacity. The concept of multi-agent cloud robotics enables robot-to-robot cooperation and creates a complementary environment for the robots in executing large-scale applications with the capability to utilize the edge and cloud resources. However, in such a collaborative environment, the optimal resource allocation for robotic tasks is challenging to achieve. Heterogeneous energy consumption rates and application of execution costs associated with the robots and computing instances make it even more complex. In addition, the data transmission delay between local robots, edge nodes, and cloud data centres adversely affects the real-time interactions and impedes service performance guarantee. Taking all these issues into account, this paper comprehensively surveys the state-of-the-art on resource allocation and service provisioning in multi-agent cloud robotics. The paper presents the application domains of multi-agent cloud robotics through explicit comparison with the contemporary computing paradigms and identifies the specific research challenges. A complete taxonomy on resource allocation is presented for the first time, together with the discussion of resource pooling, computation offloading, and task scheduling for efficient service provisioning. Furthermore, we highlight the research gaps from the learned lessons, and present future directions deemed beneficial to further advance this emerging field.",IEEE Communications Surveys & Tutorials,2021.0,semantic_scholar,citation,citation
225e3b7519fb7a9b482926714e451da2e15b7a29,https://www.semanticscholar.org/paper/225e3b7519fb7a9b482926714e451da2e15b7a29,CoEdge: Cooperative DNN Inference With Adaptive Workload Partitioning Over Heterogeneous Edge Devices,"Recent advances in artificial intelligence have driven increasing intelligent applications at the network edge, such as smart home, smart factory, and smart city. To deploy computationally intensive Deep Neural Networks (DNNs) on resource-constrained edge devices, traditional approaches have relied on either offloading workload to the remote cloud or optimizing computation at the end device locally. However, the cloud-assisted approaches suffer from the unreliable and delay-significant wide-area network, and the local computing approaches are limited by the constrained computing capability. Towards high-performance edge intelligence, the cooperative execution mechanism offers a new paradigm, which has attracted growing research interest recently. In this paper, we propose CoEdge, a distributed DNN computing system that orchestrates cooperative DNN inference over heterogeneous edge devices. CoEdge utilizes available computation and communication resources at the edge and dynamically partitions the DNN inference workload adaptive to devices’ computing capabilities and network conditions. Experimental evaluations based on a realistic prototype show that CoEdge outperforms status-quo approaches in saving energy with close inference latency, achieving up to 25.5% ~ 66.9% energy reduction for four widely-adopted CNN models.",IEEE/ACM Transactions on Networking,2020.0,semantic_scholar,citation,citation
316465e2b1fc16e3c8f5da5758b81f61fe1d1205,https://www.semanticscholar.org/paper/316465e2b1fc16e3c8f5da5758b81f61fe1d1205,Co-Design of Communication and Machine Inference for Cloud Robotics,"Today, even the most compute-and-power constrained robots can measure complex, high data-rate video and LIDAR sensory streams. Often, such robots, ranging from lowpower drones to space and subterranean rovers, need to transmit high-bitrate sensory data to a remote compute server if they are uncertain or cannot scalably run complex perception or mapping tasks locally. However, today’s representations for sensory data are mostly designed for human, not robotic, perception and thus often waste precious compute or wireless network resources to transmit unimportant parts of a scene that are unnecessary for a high-level robotic task. This paper presents an algorithm to learn task-relevant representations of sensory data that are codesigned with a pre-trained robotic perception model’s ultimate objective. Our algorithm aggressively compresses robotic sensory data by up to 11 × more than competing methods. Further, it achieves high accuracy and robust generalization on diverse tasks including Mars terrain classification with low-power deep learning accelerators, neural motion planning, and environmental timeseries classification.",Robotics: Science and Systems,2021.0,semantic_scholar,citation,citation
1588122baaa14de3bddc3ed3d41c47b93a2757d3,https://www.semanticscholar.org/paper/1588122baaa14de3bddc3ed3d41c47b93a2757d3,DIRL: Domain-Invariant Representation Learning for Sim-to-Real Transfer,"Generating large-scale synthetic data in simulation is a feasible alternative to collecting/labelling real data for training vision-based deep learning models, albeit the modelling inaccuracies do not generalize to the physical world. In this paper, we present a domain-invariant representation learning (DIRL) algorithm to adapt deep models to the physical environment with a small amount of real data. Existing approaches that only mitigate the covariate shift by aligning the marginal distributions across the domains and assume the conditional distributions to be domain-invariant can lead to ambiguous transfer in real scenarios. We propose to jointly align the marginal (input domains) and the conditional (output labels) distributions to mitigate the covariate and the conditional shift across the domains with adversarial learning, and combine it with a triplet distribution loss to make the conditional distributions disjoint in the shared feature space. Experiments on digit domains yield state-of-the-art performance on challenging benchmarks, while sim-to-real transfer of object recognition for vision-based decluttering with a mobile robot improves from 26.8 % to 91.0 %, resulting in 86.5 % grasping accuracy of a wide variety of objects. Code and supplementary details are available at this https URL",CoRL,2020.0,semantic_scholar,citation,citation
b090b708289fa99bd426600410233918e0286da8,https://www.semanticscholar.org/paper/b090b708289fa99bd426600410233918e0286da8,Task-relevant Representation Learning for Networked Robotic Perception,"Today, even the most compute-and-power constrained robots can measure complex, high data-rate video and LIDAR sensory streams. Often, such robots, ranging from low-power drones to space and subterranean rovers, need to transmit high-bitrate sensory data to a remote compute server if they are uncertain or cannot scalably run complex perception or mapping tasks locally. However, today's representations for sensory data are mostly designed for human, not robotic, perception and thus often waste precious compute or wireless network resources to transmit unimportant parts of a scene that are unnecessary for a high-level robotic task. This paper presents an algorithm to learn task-relevant representations of sensory data that are co-designed with a pre-trained robotic perception model's ultimate objective. Our algorithm aggressively compresses robotic sensory data by up to 11x more than competing methods. Further, it achieves high accuracy and robust generalization on diverse tasks including Mars terrain classification with low-power deep learning accelerators, neural motion planning, and environmental timeseries classification.",ArXiv,2020.0,semantic_scholar,citation,citation
e7dcabe663ba0378b2795cea563aade22ec61dc0,https://www.semanticscholar.org/paper/e7dcabe663ba0378b2795cea563aade22ec61dc0,Network Offloading Policies for Cloud Robotics: a Learning-based Approach,,Robotics: Science and Systems,2019.0,semantic_scholar,citation,citation
,,Robot Encoder Server Decoder Server Task Model Train-Time Only DNN Local Compute,,,,semantic_scholar,citation,citation
c8592c34606565860395736050c7603ff22c937c,https://www.semanticscholar.org/paper/c8592c34606565860395736050c7603ff22c937c,Towards assisting visually impaired individuals: A review on current status and future prospects,,Biosensors and Bioelectronics: X,2022,semantic_scholar,citation,citation
