doi,type,query_name,query_value,publication,publisher,publication_date,database,title,url,abstract,status,id,semantic_score
10.1109/sose52839.2021.00025,to_check,systems engineering,'systems engineering' AND ('generative ai' OR 'artificial intelligence'),semantic_scholar,International Symposium on Service Oriented Software Engineering,2021-01-01 00:00:00,semantic_scholar,"a vision for composing, integrating, and deploying ai planning functionalities",https://www.semanticscholar.org/paper/54abdfcefd2ca6b17e826b0fb7949c93a63469d4,"AI planning deals with automatically selecting and organising actions to achieve some user objective. The field offers planning tools not only to solve planning problems but also to address other planning aspects, such as modeling problems and validating found solutions. Despite the need for a fully-fledged planning functionality in real-world applications, however, no tool exists supporting all aspects. As a result, there is a need to manually combine several planning tools that are heterogeneous in terms of software, design, and configuration requirements. While the manual process of combining, integrating and, finally, deploying these systems is time-consuming and error-prone, it also demands immense planning and technical expertise from the practitioners. In this paper, we introduce a vision for composing, integrating, and deploying AI planning functionalities contemplated given several prerequisites for the design of planning services. The objective is to enable straightforward composition and integration of various modular planning services provided by different tools into advanced AI planning systems by intuitive modelling and automatic deployment. Our vision can lead to new research and development opportunities in both AI planning and system engineering, ultimately contributing to the industrialisation of AI.",not included,949,0.8496817350387573
10.1145/3522664.3528598,to_check,systems engineering,'systems engineering' AND ('generative ai' OR 'artificial intelligence'),semantic_scholar,2022 IEEE/ACM 1st International Conference on AI Engineering – Software Engineering for AI (CAIN),2022-01-01 00:00:00,semantic_scholar,ai governance in the system development life cycle: insights on responsible machine learning engineering,https://www.semanticscholar.org/paper/bfa3cb3fae2d4fcc66b18dba752467f4f5861073,"In this study we explore the incorporation of artificial intelligence (AI) governance to system development life cycle (SDLC) models. We conducted expert interviews among AI and SDLC professionals and analyzed the interview data using qualitative coding and clustering to extract AI governance concepts. Subsequently, we mapped these concepts onto three stages in the machine learning (ML) system development process: (1) design, (2) development, and (3) operation. We discovered 20 governance concepts, some of which are relevant to more than one of the three stages. Our analysis highlights AI governance as a complex process that involves multiple activities and stakeholders. As development projects are unique, the governance requirements and processes also vary. This study is a step towards understanding how AI governance is conceptually connected to ML systems’ management processes through the project life cycle. CCS CONCEPTS • Software and its engineering $^{\rightarrow}$ Software creation and management.",included,1138,0.8494580388069153
10.1002/iis2.12988,to_check,systems engineering,'systems engineering' AND ('generative ai' OR 'artificial intelligence'),semantic_scholar,INCOSE International Symposium,2022-01-01 00:00:00,semantic_scholar,artificial intelligence capabilities for effective model‐based systems engineering: a vision paper,https://www.semanticscholar.org/paper/b964424f02da2e6ef879c96d33dfcae103630e14,"Both Model‐Based Systems Engineering (MBSE) and Artificial Intelligence (AI) have been challenged for their deployment in real‐world applications. Although MBSE remains the focal point of any systems engineering activities, its adoption still faces significant hurdles to demonstrate its return on investment. Recently, AI has received intensive attention, and its applications made their way into our daily life products. From an industrial perspective, within the context of the design and development of mechatronic systems, there is a lack of coherent foundation to enable the application of AI in MBSE. This vision paper discusses the role of AI in solving a set of MBSE challenges. As a result, we contribute by describing the actual MBSE adoption challenges and follow up with the characterization of the capabilities of AI in solving these challenges. With this initial work, we aim to trigger both AI and MBSE communities for further research discussions and industrial applications to help in achieving an intelligent design and development environment.",not included,1118,0.8473312854766846
10.4230/dagrep.10.2.76,to_check,systems engineering,'systems engineering' AND ('generative ai' OR 'artificial intelligence'),semantic_scholar,Dagstuhl Reports,2020-01-01 00:00:00,semantic_scholar,se4ml - software engineering for ai-ml-based systems (dagstuhl seminar 20091),https://www.semanticscholar.org/paper/a979947809dd146c81a11625a8eedd52536bacfc,"Multiple research disciplines, from cognitive sciences to biology, finance, physics, and the social sciences, as well as many companies, believe that data-driven and intelligent solutions are necessary. Unfortunately, current artificial intelligence (AI) and machine learning (ML) technologies are not sufficiently democratized - building complex AI and ML systems requires deep expertise in computer science and extensive programming skills to work with various machine reasoning and learning techniques at a rather low level of abstraction. It also requires extensive trial and error exploration for model selection, data cleaning, feature selection, and parameter tuning. Moreover, there is a lack of theoretical understanding that could be used to abstract away these subtleties. Conventional programming languages and software engineering paradigms have also not been designed to address challenges faced by AI and ML practitioners. In 2016, companies invested $26–39 billion in AI and McKinsey predicts that investments will be growing over the next few years. Any AI/ML-based systems will need to be built, tested, and maintained, yet there is a lack of established engineering practices in industry for such systems because they are fundamentally different from traditional software systems. 
This Dagstuhl Seminar brought together two rather disjoint communities together, software engineering and programming languages (PL/SE) and artificial intelligence and machine learning (AI-ML) to discuss open problems on how to improve the productivity of data scientists, software engineers, and AI-ML practitioners in industry.",not included,768,0.8467990756034851
10.1109/icse-seip55303.2022.9793864,to_check,systems engineering,'systems engineering' AND ('generative ai' OR 'artificial intelligence'),semantic_scholar,2022 IEEE/ACM 44th International Conference on Software Engineering: Software Engineering in Practice (ICSE-SEIP),2021-01-01 00:00:00,semantic_scholar,software engineering for responsible ai: an empirical study and operationalised patterns,https://www.semanticscholar.org/paper/6a03b02e61b447ce1456624853d7accfd24a2711,"AI ethics principles and guidelines are typically high-level and do not provide concrete guidance on how to develop responsible AI systems. To address this shortcoming, we perform an empirical study involving interviews with 21 scientists and engineers to understand the practitioners' views on AI ethics principles and their implementation. Our major findings are: (1) the current practice is often a done-once-and-forget type of ethical risk assessment at a particular development step, which is not sufficient for highly uncertain and continual learning AI systems; (2) ethical requirements are either omitted or mostly stated as high-level objectives, and not specified explicitly in verifiable way as system outputs or outcomes; (3) although ethical requirements have the characteristics of cross-cutting quality and non-functional requirements amenable to architecture and design analysis, system-level architecture and design are under-explored; (4) there is a strong desire for continuously monitoring and validating AI systems post deployment for ethical requirements but current operation practices provide limited guidance. To address these findings, we suggest a preliminary list of patterns to provide operationalised guidance for developing responsible AI systems.",included,917,0.8452555537223816
10.1002/j.2371-9621.2021.tb00015.x,to_check,systems engineering,'systems engineering' AND ('generative ai' OR 'artificial intelligence'),semantic_scholar,The AI Magazine,2021-01-01 00:00:00,semantic_scholar,advances in theory and applications of artificial intelligence,https://www.semanticscholar.org/paper/29417f1e3578c914cb73c53f24404671acb81e98,"Copyright © 2021, Association for the Advancement of Artificial Intelligence. All rights reserved. ISSN 0738-4602 86 AI MAGAZINE This year, the 33rd meeting of the International Conference on Industrial, Engineering, and Other Applications of Applied Intelligent Systems 20201 was held in Kitakyushu, Japan from 22 to 25 September 2020. The International Conference on Industrial, Engineering, and Other Applications of Applied Intelligent Systems focuses on artificial intelligence (AI) and its applications. This long-standing conference has been held every year since 1988. To date, the conference has been located in twenty different countries. The 2020 conference was sponsored by the International Society of Applied Intelligence and was held in cooperation with Springer; Kitakyushu City; the KDDI Foundation; the Association for the Advancement of Artificial Intelligence; the Association for Computing Machinery; the Austrian Association for Artificial Intelligence; the Institute of Electrical and Electronics Engineers; the Catalan Association for Artificial Intelligence; the Graz University of Technology; the Italian Artificial Intelligence Association; Iwate Prefectural University, Japan; the Japanese Society for Artificial Intelligence; the Lithuanian Computer Society; the Spanish Society for Artificial Intelligence; the Society for the Study of AI and the Simulation of Behavior; the Taiwanese Association for Consumer Electronics; the Taiwanese Association for Artificial Intelligence; Texas State University; and the University of Klagenfurt. This year, one-hundred and nineteen papers were submitted to the conference. The papers were submitted either to the main track or to one of special sessions: Collective Intelligence in Social Media and Intelligent Knowledge Engineering in Decision-Making Systems. An international program committee composed of eighty-two researchers from thirtysix countries evaluated each paper during a three-review double-blind peer review process. Sixty-two full papers and seventeen short papers were selected for publication in the conference proceedings, which were published in Springer’s Lectures Notes in Artificial Intelligence series.2 Nine additional papers were selected as poster papers and published in a separate proceeding.  The 33rd International Conference on Industrial, Engineering, and Other Applications of Applied Intelligent Systems was held in Kitakyushu, Japan on 22 to 25 September 2020. This report provides an overview and summary of the conference. Advances in Theory and Applications of Artificial Intelligence",not included,1064,0.8448173999786377
http://arxiv.org/abs/2401.03223v2,to_check,systems engineering,'systems engineering' AND ('generative ai' OR 'artificial intelligence'),arxiv,arxiv,2024-01-06 00:00:00,arxiv,"an intelligent sociotechnical systems (ists) framework: toward a
  sociotechnically-based hierarchical human-centered ai approach",http://arxiv.org/abs/2401.03223v2,"Insights: - The human-centered AI (HCAI) approach and the sociotechnical
systems (STS) theory share the same goal: ensuring that new technologies such
as AI best serve humans in a sociotechnical environment. - HCAI practice needs
to fully embrace sociotechnical systems thinking, while traditional STS needs
to evolve to address the emerging characteristics of AI technology. - We
propose a conceptual framework for intelligent sociotechnical systems (iSTS) to
enhance traditional STS theory in the AI era. - Based on iSTS, we further
propose a sociotechnical-based hierarchical HCAI approach as a paradigmatic
extension to existing HCAI practice, further advancing HCAI practice.",included,9,0.844709575176239
10.1007/s43681-023-00276-7,to_check,systems engineering,'systems engineering' AND ('generative ai' OR 'artificial intelligence'),AI and Ethics,Springer,2023-03-27 00:00:00,springer,the rapid competitive economy of machine learning development: a discussion on the social risks and benefits,http://dx.doi.org/10.1007/s43681-023-00276-7,"Research in artificial intelligence (AI) has started in the twentieth century but it was not until 2012 that modern models of artificial neural networks aided the machine learning process considerably so that in the past ten years, both computer vision as well as natural language processing have become increasingly better. AI developments have accelerated rapidly, leaving open questions about the potential benefits and risks of these dynamics and how the latter might be managed. This paper discusses three major risks, all lying in the domain of AI safety engineering: the problem of AI alignment, the problem of AI abuse, and the problem of information control. The discussion goes through a short history of AI development, briefly touching on the benefits and risks, and eventually making the case that the risks might potentially be mitigated through strong collaborations and awareness concerning trustworthy AI. Implications for the (digital) humanities are discussed.",not included,1606,0.8446024656295776
10.1109/sysose.2019.8753852,to_check,systems engineering,'systems engineering' AND ('generative ai' OR 'artificial intelligence'),2019 14th Annual Conference System of Systems Engineering (SoSE),IEEE,2019-05-22 00:00:00,ieeexplore,experiences in evolving system-of-systems engineering methodology to address pain points,https://ieeexplore.ieee.org/document/8753852/,"The growing interest in System-of-Systems has resulted in rapid and widespread application of its concepts to a variety of problems. While this generated a large number of novel and valuable techniques, tools, and methodologies in System-of-Systems Engineering, it also broadened the problem domains, and subsequently made it difficult to achieve a high degree of coordination and cohesion in the discipline. Previous attempts at creating a formal structure to System-of-Systems Engineering provided valuable support to practitioners, but have been sometimes disconnected from the current practical needs in the discipline, leaving behind some pain points that still need to be addressed. In this work, we propose a different perspective to deal with the pain points: based on our experience and on analysis of the current challenges of System-of-Systems Engineering, we identify potential research directions which are based on domain-agnostic methodology, but of interest to a variety of problems in System-of-Systems. This dual feature of the research directions is explored here to identify a connection between the necessity of establishing formal and generic procedures for System-of-Systems Engineering along with the usability and utility of practical tools and techniques for applied problems.",not included,1747,0.8444346189498901
10.1109/emr.2023.3284708,to_check,systems engineering,'systems engineering' AND ('generative ai' OR 'artificial intelligence'),SCOPUS_ID:85165915950,scopus,2023-01-01 00:00:00,scopus,artificial intelligence in engineering management - an editor's perspective (2023),https://www.scopus.com/inward/record.uri?partnerID=HzOxMe3b&scp=85165915950&origin=inward,"
AbstractView references

Today, we live in a world determined by multiple crises creating less certainty about the future and its prediction. At the same time, new Artificial Intelligence (AI) technologies are developed at high pace that may lead to a new revolution in how we do business and manage companies. Generative AI tools offer exciting opportunities while at the same time putting to question some well-established solutions. This calls for more and extensive insights in research and practice to tackle the question how these technologies can be used for engineering management. © 1973-2011 IEEE.
",not included,2412,0.8440803289413452
10.1007/s43681-022-00206-z,to_check,systems engineering,'systems engineering' AND ('generative ai' OR 'artificial intelligence'),AI and Ethics,Springer,2023-08-01 00:00:00,springer,needs and artificial intelligence,http://dx.doi.org/10.1007/s43681-022-00206-z,"Throughout our history, we, Homo sapiens, have used technologies to better satisfy our needs . The relation between needs and technology is so fundamental that the US National Research Council defines the distinguishing characteristic of technology as its goal “to make modifications in the world [in order] to meet human needs” [ 1 ]. Artificial intelligence (AI) is one of the most promising emerging technologies of our time. Similar to other technologies, AI is expected by many “to meet [human] needs”. In this article, we reflect on the relationship between needs and AI, and call for the realization of needs-aware AI systems. We argue that re-thinking needs for , through , by , and with AI can be a very useful means towards the development of realistic approaches for sustainable H uman-aware, A ccountable, L awful, and E thical (HALE) AI systems. We discuss some of the most critical gaps, barriers, enablers, and drivers of co-creating future AI-based sociotechnical systems in which [human] needs are well considered and met. Finally, we provide an overview of potential challenges and considerations that should be carefully taken into account; and call for joint, immediate, and interdisciplinary efforts and collaborations to start on the path to needs-aware AI.",not included,1595,0.8438124060630798
10.1145/3437479.3437485,to_check,systems engineering,'systems engineering' AND ('generative ai' OR 'artificial intelligence'),semantic_scholar,ACM SIGSOFT Softw. Eng. Notes,2021-01-01 00:00:00,semantic_scholar,the 8th international workshop on realizing artificial intelligence synergies in software engineering,https://www.semanticscholar.org/paper/a1c0693ee6ff7874ade2b4998692049744e06d50,"The International Workshop on Realizing Arti cial Intelligence Synergies in Software Engineering (RAISE) aims to present the state of the art in the crossover between Software Engineering and Arti cial Intelligence. This workshop explored not only the appli- cation of AI techniques to SE problems but also the application of SE techniques to AI problems. Software has become critical for realizing functions central to our society. For example, software is essential for nancial and transport systems, energy generation and distribution systems, and safety-critical medical applications. Software development costs trillions of dollars each year yet, still, many of our software engineering methods remain mostly man- ual. If we can improve software production by smarter AI-based methods, even by small margins, then this would improve a crit- ical component of the international infrastructure, while freeing up tens of billions of dollars for other tasks.",not included,993,0.8436208367347717
10.1109/sysose.2018.8428714,to_check,systems engineering,'systems engineering' AND ('generative ai' OR 'artificial intelligence'),2018 13th Annual Conference on System of Systems Engineering (SoSE),IEEE,2018-06-22 00:00:00,ieeexplore,sose 2018 [front cover],https://ieeexplore.ieee.org/document/8428714/,The following topics are dealt with: systems engineering; software architecture; systems analysis; Internet of Things; health care; security of data; formal specification; mobile robots; decision making; learning (artificial intelligence).,not included,1818,0.8433235883712769
10.1007/978-3-031-34560-9_2,to_check,systems engineering,'systems engineering' AND ('generative ai' OR 'artificial intelligence'),Advanced Information Systems Engineering,Springer,2023-01-01 00:00:00,springer,can information system engineering make cyber-human systems smarter?,http://dx.doi.org/10.1007/978-3-031-34560-9_2,"The term smart is often used carelessly in relation to systems, devices, and other entities such as cities that capture or otherwise process or use information. This exploratory paper takes the idea of smartness seriously as a way to reveal basic issues related to IS engineering and its possibilities and limitations. This paper defines work system, cyber-human system, digital agent, smartness of systems and devices, and IS engineering. It links those ideas to IS engineering challenges related to cyber-human systems. Those challenges call for applying ideas that are not applied often in IS engineering, such as facets of work, roles and responsibilities of digital agents, patterns of interaction between people and digital agents, knowledge objects, and a range of criteria for evaluating cyber-human systems and digital agents. In combination, those ideas point to new possibilities for expanding IS engineering to reflect emerging challenges related to making cyber-human systems smarter.",not included,1642,0.8418298363685608
10.1109/syscon53536.2022.9773829,to_check,systems engineering,'systems engineering' AND ('generative ai' OR 'artificial intelligence'),2022 IEEE International Systems Conference (SysCon),IEEE,2022-04-28 00:00:00,ieeexplore,closed systems paradigm for intelligent systems,https://ieeexplore.ieee.org/document/9773829/,"Intelligent systems ought to be distinguished as a special type of system. While some adopt this view informally, in practice, systems engineering methods for intelligent systems are still centered around traditional systems engineering notions of engineering by aggregation of components. We posit that this traditional approach follows from holding a notion of open systems as the fundamental precept, and that engineering intelligent systems, in contrast, requires an approach that holds notions of closed systems as fundamental precepts. We take a systems theoretic approach to defining closed system phenomena and their relation to engineering intelligence. We propose the concept of variety; particularly the law of requisite variety to enable closed view in engineering. We discuss how open and closed view approaches to engineering intelligent systems address variety differently, as well as the implications of this difference on engineering practice.",included,1786,0.8415651321411133
10.1109/models-c.2019.00028,to_check,systems engineering,'systems engineering' AND ('generative ai' OR 'artificial intelligence'),semantic_scholar,2019 ACM/IEEE 22nd International Conference on Model Driven Engineering Languages and Systems Companion (MODELS-C),2019-01-01 00:00:00,semantic_scholar,preface to mde intelligence 2019: 1st workshop on artificial intelligence and model-driven engineering,https://www.semanticscholar.org/paper/054fbd019b5762e37070e3dcaa87f6797f63d6fd,"Model-driven engineering (MDE) and Artificial Intelligence (AI) are two separate fields in computer science, which can clearly benefit from cross-fertilization and collaboration. There are at least two ways in which such integrations - which we call MDE Intelligence - can manifest: (1) MDE can benefit from integrating AI concepts and ideas to increasing the power and flexibility of model-driven techniques by means of the application of AI algorithms. (2) Conversely, AI can benefit from integrating concepts and ideas from MDE—for example, using domain-specific languages and model transformations allows domain experts to directly express and manipulate their problems while providing an auditable computation pipeline. To discuss and further stimulate such integrations, the 1st edition of the Workshop on Artificial Intelligence and Model-driven Engineering (MDE Intelligence) was held on September 16, 2019 in Munich, Germany, as part of the satellite events of the IEEE/ACM 22th International Conference on Model-Driven Engineering Languages and Systems (MODELS 2019).",not included,682,0.8413366079330444
