doi,type,query_name,query_value,publication,publisher,publication_date,database,title,url,abstract,status,id,semantic_score
10.1109/jas.2020.1003432,to_check,systems engineering,'systems engineering' AND ('generative ai' OR 'artificial intelligence'),semantic_scholar,IEEE/CAA Journal of Automatica Sinica,2021-01-01 00:00:00,semantic_scholar,towards a theoretical framework of autonomous systems underpinned by intelligence and systems sciences,https://www.semanticscholar.org/paper/7bb320e281f16a476255a5c654c48e4644a6c3ed,"Autonomous systems are an emerging AI technology functioning without human intervention underpinned by the latest advances in intelligence, cognition, computer, and systems sciences. This paper explores the intelligent and mathematical foundations of autonomous systems. It focuses on structural and behavioral properties that constitute the intelligent power of autonomous systems. It explains how system intelligence aggregates from reflexive, imperative, adaptive intelligence to autonomous and cognitive intelligence. A hierarchical intelligence model ( HIM ) is introduced to elaborate the evolution of human and system intelligence as an inductive process. The properties of system autonomy are formally analyzed towards a wide range of applications in computational intelligence and systems engineering. Emerging paradigms of autonomous systems including brain-inspired systems, cognitive robots, and autonomous knowledge learning systems are described. Advances in autonomous systems will pave a way towards highly intelligent machines for augmenting human capabilities.",included,951,0.8254063129425049
10.1080/17477778.2020.1863755,to_check,systems engineering,'systems engineering' AND ('generative ai' OR 'artificial intelligence'),semantic_scholar,J. Simulation,2021-01-01 00:00:00,semantic_scholar,bringing ai to the edge: a formal m&s specification to deploy effective iot architectures,https://www.semanticscholar.org/paper/80715ef54a3c2de4557f7961103d6802ce80ecfc,"ABSTRACT Internet of Things applications are based on ubiquitous networks of multiple distributed devices, with limited computing resources and power, capable of collecting and storing data from heterogeneous sources in real-time. To avoid network saturation and delays, new architectures are needed to provide real-time Big Data and data analytics capabilities at the edge of the network, where energy efficiency needs to be considered to ensure a sustainable and effective deployment in areas of human activity. In this research, we present an IoT model based on the principles of Model-Based Systems Engineering. It covers the description of the entire architecture, from IoT devices to the processing units in edge data centres, and includes the location-awareness of user equipment, network, and computing infrastructures to optimise federated resource management in terms of delay and power consumption. We present a framework to assist the dimensioning and the dynamic operation of IoT data stream analytics applications.",not included,945,0.8252373933792114
10.1109/rams51492.2024.10457626,to_check,systems engineering,'systems engineering' AND ('generative ai' OR 'artificial intelligence'),2024 Annual Reliability and Maintainability Symposium (RAMS),IEEE,2024-01-25 00:00:00,ieeexplore,arcs-r: mission critical combined reliability and cybersecurity systems engineering analysis,https://ieeexplore.ieee.org/document/10457626/,"This paper explores how reliability analysis and cyber-security analysis can be combined using Artificial Intelligence and Machine Learning (AI/ML), and Large Language Models (LLM) to produce a continuously updated resilience analysis. This is achieved by modeling both the hardware and software of the system, and employing LLMs and AI/ML to continuously search for new software vulnerabilities and feed that information into continuously updating resilience models. A case study of a drone is presented that demonstrates the promise of the proposed method. It is expected that using the proposed method, named Assessment for Risk in Cybersecurity and Safety - Resilience (ARCS-R), will reduce failure rate of mission-critical cyber-physical systems by reducing the likelihood of a potential initiating event causing a prolonged degradation in system performance that impacts system resilience.",not included,1742,0.8250085711479187
10.1109/rew56159.2022.00007,to_check,systems engineering,'systems engineering' AND ('generative ai' OR 'artificial intelligence'),semantic_scholar,2022 IEEE 30th International Requirements Engineering Conference Workshops (REW),2022-01-01 00:00:00,semantic_scholar,an re’22 workshop on environment-driven requirements engineering (envire’22),https://www.semanticscholar.org/paper/07205c2acc12899a9d6c5115b1b66f2b4037eb7b,"We organize a one-day workshop on Environment-Driven Requirements Engineering (EnviRE’22) in conjunction with the 30th IEEE International Requirements Engineering Conference. With the rising influence of AI, IoT, and cyber-physical systems, we realize that the environment, in which the software operates, becomes more open and evolves rapidly with stakeholders’ changing needs. EnviRE’22 features one keynote and five accepted papers. Overall, the workshop is aimed at bringing the interested researchers and practitioners together, exchanging ideas and visions, and exploring a set of open problems to pursue in the years to come.",not included,1238,0.8248109817504883
10.1109/aire51212.2020.00012,to_check,systems engineering,'systems engineering' AND ('generative ai' OR 'artificial intelligence'),semantic_scholar,International Workshop on Artificial Intelligence for Requirements Engineering,2020-01-01 00:00:00,semantic_scholar,towards an extended requirements problem formulation for superintelligence safety,https://www.semanticscholar.org/paper/60fd917a81fe79c94e2cda4599802269e412d5e6,"Under the headline ""AI safety"", a wide-reaching issue is being discussed, whether in the future some ""superhuman artificial intelligence"" / ""superintelligence"" could pose a threat to humanity. In addition, the late Steven Hawking warned that the rise of robots may be disastrous for mankind. A major concern is that even benevolent superhuman artificial intelligence (AI) may become seriously harmful if its given goals are not exactly aligned with ours, or if we cannot specify precisely its objective function. Metaphorically, this is compared to king Midas in Greek mythology, who expressed the wish that everything he touched should turn to gold, but obviously this wish was not specified precisely enough. In our view, this sounds like requirements problems and the challenge of their precise formulation. Hence, we take a new perspective on the problem by exploring it using insights from requirements engineering (RE). In addition, the overall issue calls for a major RE endeavor, figuring out the wishes and the needs with regard to a superintelligence, which will in our opinion most likely be a very complex softwareintensive system based on AI. In this paper, we introduce the idea of developing a new theoretical formulation of an extended requirements problem applicable to it, since it involves goals of both stakeholders and of the AI-based system-to-be-built.",included,883,0.8247873783111572
10.1007/s43039-023-00076-1,to_check,systems engineering,'systems engineering' AND ('generative ai' OR 'artificial intelligence'),Italian Journal of Marketing,Springer,2023-09-01 00:00:00,springer,"how intelligent automation, service robots, and ai will reshape service products and their delivery",http://dx.doi.org/10.1007/s43039-023-00076-1,"Intelligent Automation in form of robots, smart self-service technologies, wearable technologies, software and systems such as machine learning, generative artificial intelligence (AI) such as ChatGPT, and the metaverse are increasingly adopted in a wide range of customer-facing service settings. The shift toward robot- and AI-powered services will lead to improved customer experiences, service quality, and productivity all at the same time. However, these also carry ethical, fairness, and privacy risks for customers and society. In this opinion piece, we discuss the implications of the service revolution for service firms, their marketing, and their customers, and provide avenues for future research opportunities.",not included,1588,0.8247710466384888
10.1109/peeic59336.2023.10450939,to_check,systems engineering,'systems engineering' AND ('generative ai' OR 'artificial intelligence'),"2023 International Conference on Power Energy, Environment & Intelligent Control (PEEIC)",IEEE,2023-12-23 00:00:00,ieeexplore,"transforming electronics engineering with artificial intelligence: opportunities and challenges in design, testing, production, maintenance, and control systems",https://ieeexplore.ieee.org/document/10450939/,"This article examines how artificial intelligence (AI) is being incorporated into electronics engineering and how this might completely change the discipline. AI-based systems have prospects for raising system dependability, lowering energy usage, and boosting performance. The study offers a summary of the most recent developments in the fields of design automation, testing and diagnostic, production, maintenance, and control systems in electronics engineering. AI-based design automation technologies optimize the design process by cutting expenses and time spent on development while enhancing precision and effectiveness. AI-powered testing and diagnosis systems identify flaws early on, saving money and downtime. AI-powered industrial solutions improve efficiency, reduce waste, and boost effectiveness. AI-based maintenance methods reduce expenses and downtime while improving equipment reliability. AI-driven control systems improve system performance, reduce energy consumption, and increase stability. It is likely that as AI advances, new applications and tactics that push the boundaries of electronics engineering will surface. Concerns such as employment displacement, ethical dilemmas, data security, and privacy must all be addressed. However, the application of AI in the field of electronics has the potential to greatly advance a variety of industries and businesses given enough consideration and planning.",not included,1880,0.824475884437561
10.1145/3098888.3098895,to_check,systems engineering,'systems engineering' AND ('generative ai' OR 'artificial intelligence'),semantic_scholar,SIGAI,2017-01-01 00:00:00,semantic_scholar,ai practioners: on the northeast ohio acm,https://www.semanticscholar.org/paper/55caf28fc364133cf8e578c12e455ca6930b7132,"I am currently the chair of NEOACM (North-east Ohio ACM), a professional chapter of the ACM, located in the state of Ohio in the U.S. founded in 2008. NEOACM is quickly coming up on its 10th anniversary. Our chapter, like most, is dedicated to advancing the art, science, engineering, and application of information technology, serving both professional and public interests. We accomplish much of our mission by hosting workshops, speakers, and panel discussions that are open to the public. In my capacity as chair, I have had the opportunity to influence the direction of some of the workshops and panel discussions that we host. I've always had a predilection for most things AI and I'm particularly interested in how the descriptions of embedded AI technologies are worded when those technologies are integral to goods and services targeted toward the average citizen or general public. Sure as insiders we throw around phrases like computational linguistics, particle swarm optimization, machine learning, domain ontologies, agent-oriented architectures, etc. all the time because its normal vernacular. But we know in most instances our techno-speak will need to be translated into terminology that's more consumer-oriented once commercial applications start to be generated. It's the gap that I worry about. The translation from artificial intelligence, computer science, and mathematics specific terminology into descriptions that the average citizen will end up trying to grapple with. For instance:",not included,525,0.8241390585899353
10.1145/3522664.3528590,to_check,systems engineering,'systems engineering' AND ('generative ai' OR 'artificial intelligence'),semantic_scholar,2022 IEEE/ACM 1st International Conference on AI Engineering – Software Engineering for AI (CAIN),2022-01-01 00:00:00,semantic_scholar,"data smells: categories, causes and consequences, and detection of suspicious data in ai-based systems",https://www.semanticscholar.org/paper/90af44f974da16aaa4d7c0fc4c771f27e7f4da58,"High data quality is fundamental for today’s AI-based systems. However, although data quality has been an object of research for decades, there is a clear lack of research on potential data quality issues (e.g., ambiguous, extraneous values). These kinds of issues are latent in nature and thus often not obvious. Nevertheless, they can be associated with an increased risk of future problems in AI-based systems (e.g., technical debt, data-induced faults). As a counterpart to code smells in software engineering, we refer to such issues as Data Smells. This article conceptualizes data smells and elaborates on their causes, consequences, detection, and use in the context of AI-based systems. In addition, a catalogue of 36 data smells divided into three categories (i.e., Believability Smells, Understandability Smells, Consistency Smells) is presented. Moreover, the article outlines tool support for detecting data smells and presents the result of an initial smell detection on more than 240 real-world datasets.",not included,1131,0.8239993453025818
10.1609/aimag.v40i4.5202,to_check,systems engineering,'systems engineering' AND ('generative ai' OR 'artificial intelligence'),semantic_scholar,The AI Magazine,2019-01-01 00:00:00,semantic_scholar,current approaches in applied artificial intelligence: the 2019 iea/aie conference the iea/aie 2019 conference,https://www.semanticscholar.org/paper/3fe8c50b151b36350d3ba8a50dfb1b170d94f1c4,"The 32nd meeting of the International Conference on Industrial, Engineering and Other Applications of Applied Intelligent Systems was held July 9–11, 2019, in Graz, Austria. The conference focus for 2019 was on automated driving, autonomous systems, robotics, and AI in tourism.",not included,733,0.823138952255249
10.1109/fuzz-ieee55066.2022.9882675,to_check,systems engineering,'systems engineering' AND ('generative ai' OR 'artificial intelligence'),semantic_scholar,IEEE International Conference on Fuzzy Systems,2022-01-01 00:00:00,semantic_scholar,security considerations for the procurement and acquisition of artificial intelligence (ai) systems,https://www.semanticscholar.org/paper/d42e04841c817a11eb6d8717d8d62b14c38fcff3,"Procurement is a critical step in the setup of systems, as reverting decisions made at this point is typically time-consuming and costly. Especially Artificial Intelligence (AI) based systems face many challenges, starting with unclear and unknown side parameters at design time of the systems, changing ecosystems and regulations, as well as problems of overselling capabilities of systems by vendors. Furthermore, the AI Act puts forth a great deal of additional requirements for operators of critical AI systems, like risk management and transparency measures, thus making procurement even more complex. In addition, the number of providers of AI systems is drastically increasing. In this paper we provide guidelines for the procurement of AI based systems that support the decision maker in identifying the key elements for the procurement of secure AI systems, depending on the respective technical and regulatory environment. Furthermore, we provide additional resources for utilizing these guidelines in practical procurement.",included,1412,0.8225700259208679
10.1017/s0890060421000068,to_check,systems engineering,'systems engineering' AND ('generative ai' OR 'artificial intelligence'),semantic_scholar,"Artificial intelligence for engineering design, analysis and manufacturing",2021-01-01 00:00:00,semantic_scholar,connectors of smart design and smart systems,https://www.semanticscholar.org/paper/be91fa22a3b8bfb9483ae7ca0781d7ca9e4c65f8,"Abstract Though they can be traced back to different roots, both smart design and smart systems have to do with the recent developments of artificial intelligence. There are two major questions related to them: (i) What way are smart design and smart systems enabled by artificial narrow, general, or super intelligence? and (ii) How can smart design be used in the realization of smart systems? and How can smart systems contribute to smart designing? A difficulty is that there are no exact definitions for these novel concepts in the literature. The endeavor to analyze the current situation and to answer the above questions stimulated an exploratory research whose first findings are summarized in this paper. Its first part elaborates on a plausible interpretation of the concept of smartness and provides an overview of the characteristics of smart design as a creative problem solving methodology supported by artificial intelligence. The second part exposes the paradigmatic features and system engineering issues of smart systems, which are equipped with application-specific synthetic system knowledge and reasoning mechanisms. The third part presents and elaborates on a conceptual model of AI-based couplings of smart design and smart systems. The couplings may manifest in various concrete forms in real life that are referred to as “connectors” in this paper. The principal types of connectors are exemplified and discussed. It has been found that smart design tends to manifest as a methodology of blue-printing smart systems and that smart systems will be intellectualized the enablers of implementation of smart design. Understanding the affordances of and creating proper connectors between smart design and smart systems need further explorative research.",not included,1005,0.8224819898605347
10.1007/978-3-031-42307-9_1,to_check,systems engineering,'systems engineering' AND ('generative ai' OR 'artificial intelligence'),"Systems, Software and Services Process Improvement",Springer,2023-01-01 00:00:00,springer,sustained enablement of ai ethics in industry,http://dx.doi.org/10.1007/978-3-031-42307-9_1,"Artificial Intelligence (AI) has become an increasingly pervasive technology in various industries, offering numerous benefits such as increased efficiency, productivity, and innovation. However, the ethical implications of AI adoption in industry have raised concerns and AI ethics has emerged as a critical field of study, focusing on the trustworthy development, deployment, and use of AI technologies. In this paper, we explore an AI Ethics concept with a particular focus on sustained enabling factors to guide organizations in navigating the ethical challenges associated with AI adoption.",not included,1678,0.8222194910049438
10.1002/j.2371-9621.2021.tb00012.x,to_check,systems engineering,'systems engineering' AND ('generative ai' OR 'artificial intelligence'),semantic_scholar,The AI Magazine,2021-01-01 00:00:00,semantic_scholar,"artificial intelligence's grand challenges: past, present, and future",https://www.semanticscholar.org/paper/f707a3f2aaa12dfb27f04b282253630ed29c32c0,"Copyright © 2021, Association for the Advancement of Artificial Intelligence. All rights reserved. ISSN 0738-4602 Spring 2021 61 grand challenges are important as they act as compasses for researchers and practitioners alike — especially young professionals — who are pondering worthwhile problems to work on, testing the boundaries of what is possible! Challenge tasks also unleash the competitive spirit in participants as evidenced by the plethora of active participants in Kaggle competitions (and forum discussions therein). prize money and research bragging rights also accrue to the winners. The Defense Advanced research projects Agency grand Challenges1 and X prizes2 are some of the best-known successful programs that have helped make significant progress across many domains applying artificial intelligence (Ai). As grand challenges are accomplished, other than the long-term benefits the solutions engender, the positive press they garner helps rally society behind the field. Trickle-down benefits include renewed respect for and trust in science and technology by citizens, as well as a desirable focus on science, technology, engineering, and mathematics education.  Innovative, bold initiatives that capture the imagination of researchers and system builders are often required to spur a field of science or technology forward. A vision for the future of artificial intelligence was laid out by Turing Award winner Raj Reddy in his 1988 Presidential address to the Association for the Advancement of Artificial Intelligence. It is time to provide an accounting of the progress that has been made in the field, over the last three decades, toward the challenge goals. While some tasks such as the world-champion chess machine were accomplished in short order, many others, such as self-replicating systems, require more focus and breakthroughs for completion. A new set of challenges for the current decade is also proposed, spanning the health, wealth, and wisdom spheres. Artificial Intelligence’s Grand Challenges: Past, Present, and Future",not included,1091,0.8216977119445801
10.1145/3075564.3076259,to_check,systems engineering,'systems engineering' AND ('generative ai' OR 'artificial intelligence'),semantic_scholar,Conf. Computing Frontiers,2017-01-01 00:00:00,semantic_scholar,bonseyes: platform for open development of systems of artificial intelligence: invited paper,https://www.semanticscholar.org/paper/250f130fadcec134088be094b230489286dadf8e,"The Bonseyes EU H2020 collaborative project aims to develop a platform consisting of a Data Marketplace, a Deep Learning Toolbox, and Developer Reference Platforms for organizations wanting to adopt Artificial Intelligence. The project will be focused on using artificial intelligence in low power Internet of Things (IoT) devices (""edge computing""), embedded computing systems, and data center servers (""cloud computing""). It will bring about orders of magnitude improvements in efficiency, performance, reliability, security, and productivity in the design and programming of systems of artificial intelligence that incorporate Smart Cyber-Physical Systems (CPS). In addition, it will solve a causality problem for organizations who lack access to Data and Models. Its open software architecture will facilitate adoption of the whole concept on a wider scale. To evaluate the effectiveness, technical feasibility, and to quantify the real-world improvements in efficiency, security, performance, effort and cost of adding AI to products and services using the Bonseyes platform, four complementary demonstrators will be built. Bonseyes platform capabilities are aimed at being aligned with the European FI-PPP activities and take advantage of its flagship project FIWARE. This paper provides a description of the project motivation, goals and preliminary work.",included,103,0.8214880228042603
10.3233/jid-229010,to_check,systems engineering,'systems engineering' AND ('generative ai' OR 'artificial intelligence'),semantic_scholar,Journal of Integrated Design & Process Science,2022-01-01 00:00:00,semantic_scholar,digital engineering transformation with trustworthy ai towards industry 4.0: emerging paradigm shifts,https://www.semanticscholar.org/paper/f9ce47cfa0292fa13a201ebd195c9b348757f86e,"Digital engineering transformation is a crucial process for the engineering paradigm shifts in the fourth industrial revolution (4IR), and artificial intelligence (AI) is a critical enabling technology in digital engineering transformation. This article discusses the following research questions: What are the fundamental changes in the 4IR? More specifically, what are the fundamental changes in engineering? What is digital engineering? What are the main uncertainties there? What is trustworthy AI? Why is it important today? What are emerging engineering paradigm shifts in the 4IR? What is the relationship between the data-intensive paradigm and digital engineering transformation? What should we do for digitalization? From investigating the pattern of industrial revolutions, this article argues that ubiquitous machine intelligence is the defining power brought by the 4IR. Digitalization is a condition to leverage ubiquitous machine intelligence. Digital engineering transformation towards Industry 4.0 has three essential building blocks: digitalization of engineering, leveraging ubiquitous machine intelligence, and building digital trust and security. The engineering design community at large is facing an excellent opportunity to bring the new capabilities of ubiquitous machine intelligence and trustworthy AI principles, as well as digital trust, together in various engineering systems design to ensure the trustworthiness of systems in Industry 4.0.",not included,1162,0.8212636709213257
