doi,type,query_name,query_value,publication,publisher,publication_date,database,title,url,abstract,status,id,semantic_score
10.1109/ms.2020.2993662,to_check,systems engineering,'systems engineering' AND ('generative ai' OR 'artificial intelligence'),semantic_scholar,IEEE Software,2020-01-01 00:00:00,semantic_scholar,what is really different in engineering ai-enabled systems?,https://www.semanticscholar.org/paper/05086329135fdb15049a5ac8edd7f980762f2097,"Advances in machine learning (ML) algorithms and increasing availability of computational power have resulted in huge investments in systems that aspire to exploit artificial intelligence (AI), in particular ML. AIenabled systems, software-reliant systems that include data and components that implement algorithms mimicking learning and problem solving, have inherently different characteristics than software systems alone.1 However, the development and sustainment of such systems also have many parallels with building, deploying, and sustaining software systems. A common observation is that although software systems are deterministic and you can build and test to a specification, AI-enabled systems, in particular those that include ML components, are generally probabilistic. Systems with ML components can have a high margin of error due to the uncertainty that often follows predictive algorithms. The margin of error can be related to the inability to predict the result in advance or the same result cannot be reproduced. This characteristic makes AI-enabled systems hard to test and verify.2 Consequently, it is easy to assume that what we know about designing and reasoning about software systems does not immediately apply in AI engineering. AI-enabled systems are software systems. The sneaky part about engineering AI systems is they are ""just like"" conventional software systems we can design and reason about until they?re not.",included,765,0.9178138971328736
10.1515/auto-2022-0020,to_check,systems engineering,'systems engineering' AND ('generative ai' OR 'artificial intelligence'),semantic_scholar,at - Automatisierungstechnik,2022-01-01 00:00:00,semantic_scholar,paise® – process model for ai systems engineering,https://www.semanticscholar.org/paper/20e4fac51b5a8ced6e66f9fe11cddad7d87c6d6e,"Abstract The application of artificial-intelligence-(AI)-based methods within the context of complex systems poses new challenges within the product life cycle. The process model for AI systems engineering, PAISE®, addresses these challenges by combining approaches from the disciplines of systems engineering, software development and data science. The general approach builds on a component-wise development of the overall system including an AI component. This allows domain specific development processes to be parallelized. At the same time, component dependencies are tested within interdisciplinary checkpoints, thus resulting in a refinement of component specifications.",included,1111,0.9021071195602416
http://arxiv.org/abs/2001.07522v2,to_check,systems engineering,'systems engineering' AND ('generative ai' OR 'artificial intelligence'),arxiv,arxiv,2020-01-16 00:00:00,arxiv,engineering ai systems: a research agenda,http://arxiv.org/abs/2001.07522v2,"Artificial intelligence (AI) and machine learning (ML) are increasingly
broadly adopted in industry, However, based on well over a dozen case studies,
we have learned that deploying industry-strength, production quality ML models
in systems proves to be challenging. Companies experience challenges related to
data quality, design methods and processes, performance of models as well as
deployment and compliance. We learned that a new, structured engineering
approach is required to construct and evolve systems that contain ML/DL
components. In this paper, we provide a conceptualization of the typical
evolution patterns that companies experience when employing ML as well as an
overview of the key problems experienced by the companies that we have studied.
The main contribution of the paper is a research agenda for AI engineering that
provides an overview of the key engineering challenges surrounding ML solutions
and an overview of open items that need to be addressed by the research
community at large.",not included,71,0.8996371030807495
http://arxiv.org/abs/1707.09095v2,to_check,systems engineering,'systems engineering' AND ('generative ai' OR 'artificial intelligence'),arxiv,arxiv,2017-07-28 00:00:00,arxiv,toward the starting line: a systems engineering approach to strong ai,http://arxiv.org/abs/1707.09095v2,"Artificial General Intelligence (AGI) or Strong AI aims to create machines
with human-like or human-level intelligence, which is still a very ambitious
goal when compared to the existing computing and AI systems. After many hype
cycles and lessons from AI history, it is clear that a big conceptual leap is
needed for crossing the starting line to kick-start mainstream AGI research.
This position paper aims to make a small conceptual contribution toward
reaching that starting line. After a broad analysis of the AGI problem from
different perspectives, a system-theoretic and engineering-based research
approach is introduced, which builds upon the existing mainstream AI and
systems foundations. Several promising cross-fertilization opportunities
between systems disciplines and AI research are identified. Specific potential
research directions are discussed.",included,79,0.8995599150657654
10.1109/bigdata55660.2022.10021121,to_check,systems engineering,'systems engineering' AND ('generative ai' OR 'artificial intelligence'),semantic_scholar,2022 IEEE International Conference on Big Data (Big Data),2022-01-01 00:00:00,semantic_scholar,towards implementing responsible ai,https://www.semanticscholar.org/paper/6035386cbdadfd80ccae0b103bda9d04f65b44fb,"As the deployment of artificial intelligence (AI) is changing many fields and industries, there are concerns about AI systems making decisions and recommendations without adequately considering various ethical aspects, such as accountability, reliability, transparency, explainability, contestability, privacy, and fairness. While many sets of AI ethics principles have been recently proposed that acknowledge these concerns, such principles are high-level and do not provide tangible advice on how to develop ethical and responsible AI systems. To gain insight on the possible implementation of the principles, we conducted an empirical investigation involving semi-structured interviews with a cohort of AI practitioners. The salient findings cover four aspects of AI system design and development, adapting processes used in software engineering: (i) high-level view, (ii) requirements engineering, (iii) design and implementation, (iv) deployment and operation.",not included,1196,0.894280195236206
10.1109/wain52551.2021.00015,to_check,systems engineering,'systems engineering' AND ('generative ai' OR 'artificial intelligence'),semantic_scholar,Workshop on AI Engineering - Software Engineering for AI,2021-01-01 00:00:00,semantic_scholar,understanding and modeling ai-intensive system development,https://www.semanticscholar.org/paper/854aa07af911d493de2c465c5748b9453cee6a4d,"Developers of AI-Intensive Systems—i.e., systems that involve both “traditional” software and Artificial Intelligence—are recognizing the need to organize development systematically and use engineered methods and tools. Since an AI-Intensive System (AIIS) relies heavily on software, it is expected that Software Engineering (SE) methods and tools can help. However, AIIS development differs from the development of “traditional” software systems in a few substantial aspects. Hence, traditional SE methods and tools are not suitable or sufficient by themselves and need to be adapted and extended.A quest for “SE for AI” methods and tools has started. We believe that, in this effort, we should learn from experience and avoid repeating some of the mistakes made in the quest for SE in past years. To this end, a fundamental instrument is a set of concepts and a notation to deal with AIIS and the problems that characterize their development processes.In this paper, we propose to describe AIIS via a notation that was proposed for SE and embeds a set of concepts that are suitable to represent AIIS as well. We demonstrate the usage of the notation by modeling some characteristics that are particularly relevant for AIIS.",included,960,0.8918479681015015
10.1109/wain52551.2021.00020,to_check,systems engineering,'systems engineering' AND ('generative ai' OR 'artificial intelligence'),semantic_scholar,Workshop on AI Engineering - Software Engineering for AI,2021-01-01 00:00:00,semantic_scholar,requirement engineering challenges for ai-intense systems development,https://www.semanticscholar.org/paper/e4189dca82737cbaf9b56d1e6f58e9e1dddd8151,"Availability of powerful computation and communication technology as well as advances in artificial intelligence enable a new generation of complex, AI-intense systems and applications. Such systems and applications promise exciting improvements on a societal level, yet they also bring with them new challenges for their development. In this paper we argue that significant challenges relate to defining and ensuring behaviour and quality attributes of such systems and applications. We specifically derive four challenge areas from relevant use cases of complex, AI-intense systems and applications related to industry, transportation, and home automation: understanding, determining, and specifying (i) contextual definitions and requirements, (ii) data attributes and requirements, (iii) performance definition and monitoring, and (iv) the impact of human factors on system acceptance and success. Solving these challenges will imply process support that integrates new requirements engineering methods into development approaches for complex, AI-intense systems and applications. We present these challenges in detail and propose a research roadmap.",not included,910,0.8906081318855286
10.1145/3452383.3453718,to_check,systems engineering,'systems engineering' AND ('generative ai' OR 'artificial intelligence'),semantic_scholar,International Symposium on Electronic Commerce,2021-01-01 00:00:00,semantic_scholar,a report on the second international workshop on software engineering for artificial intelligence (se4ai 2021),https://www.semanticscholar.org/paper/b4a45aaa71fb7d32c25bc7b17ebe255ab7ff2abd,"Computers control increasing numbers of objects in our daily life: phones, aircraft, cars, buildings, manufacturing machines, musical instruments, etc. In these so-called cyber-physical systems (CPSs), computers interact directly with the physical world through sensors and actuators. Those systems are becoming the key infrastructure and backbone of our society and are at the heart of revolutionary changes in our daily lives and economy. The sophistication and complexity of CPSs keep increasing since they must realize more functions with limited resources, which makes them increasingly difficult to build and manage. In particular, the cyber (software) part of these systems is growing rapidly and has become a key part of CPS, as they are the basis of operation for these systems. Artificial intelligence (AI) has a fundamental influence on the economy, administration, and society. AI is now also affecting software engineering, providing robust approaches for software development to analyze and evaluate complex software and its development processes. Repository mining, machine learning, big data analytics, and software visualization enable targeted insights and powerful predictions for software quality, software development, and software project management. The research community has shown a keen interest in this emerging field. This report presents a summary of the workshop held on February 2021 at KIT Bhubaneswar, co-located with the 14th Innovations in Software Engineering Conference (ISEC 2021).",not included,994,0.8878777623176575
10.48550/arxiv.2212.11854,to_check,systems engineering,'systems engineering' AND ('generative ai' OR 'artificial intelligence'),semantic_scholar,Business &amp; Information Systems Engineering,2022-01-01 00:00:00,semantic_scholar,data-centric artificial intelligence,https://www.semanticscholar.org/paper/70df7fec4224c0d98252a6c61ee5f835be6f9e0b,"Data-centric artificial intelligence (data-centric AI) represents an emerging paradigm that emphasizes the importance of enhancing data systematically and at scale to  build effective and efficient AI-based systems. The novel paradigm complements recent model-centric AI, which focuses on improving the performance of AI-based systems based on changes in the model using a fixed set of data. The objective of this article is to introduce practitioners and researchers from the field of Business and Information Systems Engineering (BISE) to data-centric AI. The paper defines relevant terms, provides key characteristics to contrast the paradigm of data-centric AI with the model-centric one, and introduces a framework to illustrate the different dimensions of data-centric AI. In addition, an overview of available tools for data-centric AI is presented and this novel paradigm is differenciated from related concepts. Finally, the paper discusses the longer-term implications of data-centric AI for the BISE community.",included,1263,0.8859785795211792
10.1109/rew.2019.00051,to_check,systems engineering,'systems engineering' AND ('generative ai' OR 'artificial intelligence'),semantic_scholar,2019 IEEE 27th International Requirements Engineering Conference Workshops (REW),2019-01-01 00:00:00,semantic_scholar,requirements engineering challenges in building ai-based complex systems,https://www.semanticscholar.org/paper/58090cdbb7526f4e22c09387814ee060dab1de54,"This paper identifies and tackles the challenges of the requirements engineering discipline when applied to development of AI-based complex systems. Due to their complex behaviour, there is an immanent need for a tailored development process for such systems. However, there is still no widely used and specifically tailored process in place to effectively and efficiently deal with requirements suitable for specifying a software solution that uses machine learning. By analysing the related work from software engineering and artificial intelligence fields, potential contributions have been recognized from agent-based software engineering and goal-oriented requirements engineering research, as well as examples from large product development companies. The challenges have been discussed, with proposals given how and when to tackle them. RE4AI taxonomy has also been outlined, to inform the tailoring of development process.",included,651,0.8855636715888977
10.1184/r1/16560183.v1,to_check,systems engineering,'systems engineering' AND ('generative ai' OR 'artificial intelligence'),semantic_scholar,IEEE pervasive computing,2021-01-01 00:00:00,semantic_scholar,human-centered ai,https://www.semanticscholar.org/paper/264b9b136889da3b4d7e50ef58c77678b35dc3e0,"We identify three specific areas of focus to advance human-centered AI:• Designers and systems must understand the context of use and sense changes over time: Successful AI Engineering depends on the team’s ability to identify and articulate the desired system outcome and understand human and contextual factors affecting the outcome. The system itself must be able to learn when shifts in context have occurred. What are the best ways to maintain clarity around operational intent and mechanisms for adapting and evolving systems based on dynamic contexts and user needs?• Development of tools, processes, and practices to scope and facilitate human-machine teaming: Implementation of AI systems entails high levels of interdependence between human and machine. Adoption of AI systems requires the primary users to interact with and understand systems, gaining appropriate levels of trust. Every AI system needs to be designed to recognize boundaries and unfamiliar scenarios, and to provide transparency regarding its limitations.• Methods, mechanisms, and mindsets to engage in critical oversight: AI systems learn through data and observations, rather than being explicitly programmed for a deterministic outcome. Critical and reflective oversight by organizations, teams, and individuals that create and use AI systems is needed to uphold ethical principles and proactively consider the risks of bias, misuse, abuse, and unintended consequences through design, development, and ongoing deployment.For each area, we identify ongoing work as well and challenges and opportunities in developing and deploying AI systems with confidence.",included,934,0.8841918706893921
10.18293/seke2019-094,to_check,systems engineering,'systems engineering' AND ('generative ai' OR 'artificial intelligence'),semantic_scholar,International Conference on Software Engineering and Knowledge Engineering,2019-01-01 00:00:00,semantic_scholar,safe-by-design development method for artificial intelligent based systems,https://www.semanticscholar.org/paper/876d346fb11be7636f30b11f597a525ce50dfd26,"Albeit Artiﬁcial Intelligent (AI) based systems are nowa-days deployed in a variety of safety critical domains, current engineering methods and standards are barely applicable for their development and assurance. The lack of common criteria to assess safety levels as well as the dependency of certain development phases w.r.t. the chosen technology (e.g., machine learning modules) are among the identiﬁed drawbacks. In addition, the development of such engineering methods has been hampered by the emerging challenges in AI-based systems design mainly regarding autonomy, correctness and prevention of catastrophic risks. In this paper we propose an approach to conduct a safe-by-design development process for AI based systems. The approach relies upon a method which beneﬁts from a reference AI architecture and safety principles. This contribution helps to address safety concerns and to comprehend current AI architectures diversity and particularities.",included,691,0.8835116624832153
10.1515/auto-2022-0076,to_check,systems engineering,'systems engineering' AND ('generative ai' OR 'artificial intelligence'),semantic_scholar,at - Automatisierungstechnik,2022-01-01 00:00:00,semantic_scholar,ki-engineering – ai systems engineering,https://www.semanticscholar.org/paper/f8492b9265e21f7db13c71214b68d640c6bf3903,Abstract KI-Engineering – translated as AI Systems Engineering – aims at the development of a new engineering practice in the intersection of Systems Engineering and Artificial Intelligence. Its goal is to professionalize the use of AI methods in a systems engineering context. The article defines KI-Engineering and compares it with historical examples of research disciplines that founded engineering disciplines. It furthermore discusses the long-term challenges where further development is needed and which results were already achieved in the context of the Competence Center for KI-Engineering (CC-KING).,included,1110,0.8826118111610413
10.1109/iisr.2018.8535903,to_check,systems engineering,'systems engineering' AND ('generative ai' OR 'artificial intelligence'),semantic_scholar,International Symposium on Robotics,2018-01-01 00:00:00,semantic_scholar,the risks of low level narrow artificial intelligence,https://www.semanticscholar.org/paper/a537f52e8febb263d320690cdf3eb99a4e03131d,"There is a great deal of concern expressed by many in the artificial intelligence (AI) community about the existential risk of this rapidly developing technology. This paper provides a discussion on some issues that need to be addressed to handle potential future risks and provides some new perspectives. The development of artificial intelligence is moving from relatively limited standalone to large-scale, complex distributed systems. However, potential risks such as malfunction, malicious attacks and mismatch of objective can occur from hardware and software failures or design errors. Moreover, a system controlled by high level AI can become unpredictable in its behaviours and thus ethical risks can emerge when such systems have to make a decision related to operational issues. Given that all new, disruptive, technologies have risks associated with them, what we need to do, as practitioners and users, is to find ways of mitigating those risks. We discuss applications of agent-based simulation to illustrate some of the risks and, potentially, how to mitigate them.",included,173,0.8822519183158875
10.1109/re51729.2021.00070,to_check,systems engineering,'systems engineering' AND ('generative ai' OR 'artificial intelligence'),semantic_scholar,IEEE International Requirements Engineering Conference,2021-01-01 00:00:00,semantic_scholar,human-centric requirements engineering for artificial intelligence software systems,https://www.semanticscholar.org/paper/60727256f6d41a2d5b5e20a45c3eb53a04fe2565,"The surge in data availability and processing power has made it possible for Artificial Intelligence (AI) to advance at a faster rate. However, the different nature of AI systems has posed significant new challenges to Requirements Engineering (RE). Literature has shown that AI systems do not use current RE methods. It was also found that data scientists are taking the role of the requirements engineers resulting in software that does not focus on users needs. Building AI software with a human-centric approach has proven to produce more ethical, transparent, inclusive and non-bias outcomes. This research will look into adjusting current RE methodologies to fit into AI systems from a human-centric perspective. The project will aim to establish requirements specifications for human-centric AI and map them into a modeling language. A platform will be used to visually model and present requirements. Finally, I plan to conduct a case study to evaluate the modeling language. To date, I have conducted a Systematic Literature Review (SLR) to find current RE methodologies and challenges in AI and currently in the planning phase of a survey to find adopted practices in the industry.",included,929,0.8811267614364624
10.1145/3194104.3194109,to_check,systems engineering,'systems engineering' AND ('generative ai' OR 'artificial intelligence'),semantic_scholar,2018 IEEE/ACM 6th International Workshop on Realizing Artificial Intelligence Synergies in Software Engineering (RAISE),2018-01-01 00:00:00,semantic_scholar,ways of applying artificial intelligence in software engineering,https://www.semanticscholar.org/paper/e2d55453c901bc5b26ae24b80d14a9a88c35f71f,"As Artificial Intelligence (AI) techniques become more powerful and easier to use they are increasingly deployed as key components of modern software systems. While this enables new functionality and often allows better adaptation to user needs it also creates additional problems for software engineers and exposes companies to new risks. Some work has been done to better understand the interaction between Software Engineering and AI but we lack methods to classify ways of applying AI in software systems and to analyse and understand the risks this poses. Only by doing so can we devise tools and solutions to help mitigate them. This paper presents the AI in SE Application Levels (AI-SEAL) taxonomy that categorises applications according to their point of application, the type of AI technology used and the automation level allowed. We show the usefulness of this taxonomy by classifying 15 papers from previous editions of the RAISE workshop. Results show that the taxonomy allows classification of distinct AI applications and provides insights concerning the risks associated with them. We argue that this will be important for companies in deciding how to apply AI in their software applications and to create strategies for its use.",not included,85,0.8807332515716553
10.1145/3368089.3417039,to_check,systems engineering,'systems engineering' AND ('generative ai' OR 'artificial intelligence'),semantic_scholar,ESEC/SIGSOFT FSE,2020-01-01 00:00:00,semantic_scholar,continuous experimentation on artificial intelligence software: a research agenda,https://www.semanticscholar.org/paper/68b5623e6aeaaa32d4f6a09b18148fee096bb940,"Moving from experiments to industrial level AI software development requires a shift from understanding AI/ ML model attributes as a standalone experiment to know-how integrating and operating AI models in a large-scale software system. It is a growing demand for adopting state-of-the-art software engineering paradigms into AI development, so that the development efforts can be aligned with business strategies in a lean and fast-paced manner. We describe AI development as an “unknown unknown” problem where both business needs and AI models evolve over time. We describe a holistic view of an iterative, continuous approach to develop industrial AI software basing on business goals, requirements and Minimum Viable Products. From this, five areas of challenges are presented with the focus on experimentation. In the end, we propose a research agenda with seven questions for future studies.",not included,878,0.8805668950080872
