doi,type,query_name,query_value,publication,publisher,publication_date,database,title,url,abstract,status,id,semantic_score
10.1177/15553434221097357,to_check,systems engineering,'systems engineering' AND ('generative ai' OR 'artificial intelligence'),semantic_scholar,Journal of Cognitive Engineering and Decision Making,2022-01-01 00:00:00,semantic_scholar,a sociotechnical systems framework for the application of artificial intelligence in health care delivery,https://www.semanticscholar.org/paper/f47fe4e6a34083f5f9a48cf281acfdd1fe52c1ea,"In the coming years, artificial intelligence (AI) will pervade almost every aspect of the health care delivery system. AI has the potential to improve patient safety (e.g., diagnostic accuracy) as well as reduce the burden on clinicians (e.g., documentation-related workload); however, these benefits are yet to be realized. AI is only one element of a larger sociotechnical system that needs to be considered for effective AI application. In this paper, we describe the current challenges of integrating AI into clinical care and propose a sociotechnical systems (STS) approach for AI design and implementation. We demonstrate the importance of an STS approach through a case study on the design and implementation of a clinical decision support (CDS). In order for AI to reach its potential, the entire work system as well as clinical workflow must be systematically considered throughout the design of AI technology.",included,1408,0.8117738962173462
10.1109/sose52839.2021.00028,to_check,systems engineering,'systems engineering' AND ('generative ai' OR 'artificial intelligence'),semantic_scholar,International Symposium on Service Oriented Software Engineering,2021-01-01 00:00:00,semantic_scholar,model-based test modeling and automation tool for intelligent mobile apps,https://www.semanticscholar.org/paper/bee60aa8343ae0057ce24cea34df4302e0f916f7,"Functionalities of AI-powered mobile Apps or systems heavily depend on the given training dataset. The challenge in this case is that a learning system will change its behavior due to a slight change of dataset. While current alternative approaches for evaluating these apps either focus on individual performance measurement such as accuracy etc. Inspired by principles of the decision tree test method in software engineering, we introduce a 3D decision tree testing model for AI testing, a combined AI feature input tree, context tree, and output tree methodology for testing AI-powered applications. We report a newly developed AI test automation tool (known as AITest), which is built and implemented based on an innovative 3D AI Test model for AI-powered functions in intelligent mobile apps to support model-based AI function testing, test data generation, and auto test scripting and execution, and adequate test coverage analysis. Furthermore, the tool infrastructure, components, sample applications, and case study results are presented.",included,1061,0.8117448687553406
10.1109/jsyst.2017.2725920,to_check,systems engineering,'systems engineering' AND ('generative ai' OR 'artificial intelligence'),IEEE Systems Journal,IEEE,2018-09-01 00:00:00,ieeexplore,a human–machine methodology for investigating systems thinking in a complex corpus,https://ieeexplore.ieee.org/document/7990334/,"Systems thinking characterizes the paradigm needed to effectively design, maintain, and utilize systems. Prior work has shown that there is a language of systems thinking and that its presence can be quantified within text using supervised learning methods. Building on this foundation, we present a human-in-the-loop methodology that utilizes topic models to facilitate the identification of systems thinking within a corpus of documents. Though explorative, it requires no manual grading of documents, which makes it significantly faster than previous methods. The methodology uses each document's topic proportion within a systems thinking topic as a proxy measure for the potential of strong systems thinking. The novel aspect of the methodology is in the seeding of the corpus; the user encourages the emergence of the systems thinking topic by adding several documents that demonstrate strong systems thinking to the corpus. Additionally, seeding could be used with concepts other than systems thinking. A Tukey test on a graded corpus reveals that the top echelons of strong systems thinking papers have significantly higher mean topic proportions in the systems thinking topic than lower graded papers. Additionally, a case study on a corpus of Army documents related to the development, character, and management of soldiers demonstrates the methodology's effectiveness in overviewing a system and in providing research direction. The definition of strong systems thinking and the interpretation of topics are subjective, but the methodology overcomes this hurdle by leveraging human intuition and keeping a human in the loop.",not included,1851,0.8115895986557007
http://arxiv.org/abs/2101.03989v2,to_check,systems engineering,'systems engineering' AND ('generative ai' OR 'artificial intelligence'),arxiv,arxiv,2021-01-11 00:00:00,arxiv,technology readiness levels for machine learning systems,http://arxiv.org/abs/2101.03989v2,"The development and deployment of machine learning (ML) systems can be
executed easily with modern tools, but the process is typically rushed and
means-to-an-end. The lack of diligence can lead to technical debt, scope creep
and misaligned objectives, model misuse and failures, and expensive
consequences. Engineering systems, on the other hand, follow well-defined
processes and testing standards to streamline development for high-quality,
reliable results. The extreme is spacecraft systems, where mission critical
measures and robustness are ingrained in the development process. Drawing on
experience in both spacecraft engineering and ML (from research through product
across domain areas), we have developed a proven systems engineering approach
for machine learning development and deployment. Our ""Machine Learning
Technology Readiness Levels"" (MLTRL) framework defines a principled process to
ensure robust, reliable, and responsible systems while being streamlined for ML
workflows, including key distinctions from traditional software engineering.
Even more, MLTRL defines a lingua franca for people across teams and
organizations to work collaboratively on artificial intelligence and machine
learning technologies. Here we describe the framework and elucidate it with
several real world use-cases of developing ML methods from basic research
through productization and deployment, in areas such as medical diagnostics,
consumer computer vision, satellite imagery, and particle physics.",included,57,0.8114748001098633
10.1609/aimag.v40i3.5181,to_check,systems engineering,'systems engineering' AND ('generative ai' OR 'artificial intelligence'),semantic_scholar,The AI Magazine,2019-01-01 00:00:00,semantic_scholar,reports of the aaai 2019 spring symposium series,https://www.semanticscholar.org/paper/49c9b0776f3119ea5eb29ee18d89b94cfca6f939,"
 
 
The AAAI 2019 Spring Series was held Monday through Wednesday, March 25–27, 2019 on the campus of Stanford University, adjacent to Palo Alto, California. The titles of the nine symposia were Artificial Intelligence, Autonomous Machines, and Human Awareness: User Interventions, Intuition and Mutually Constructed Context; Beyond Curve Fitting — Causation, Counterfactuals and Imagination-Based AI; Combining Machine Learning with Knowledge Engineering; Interpretable AI for Well-Being: Understanding Cognitive Bias and Social Embeddedness; Privacy- Enhancing Artificial Intelligence and Language Technologies; Story-Enabled Intelligence; Towards Artificial Intelligence for Collaborative Open Science; Towards Conscious AI Systems; and Verification of Neural Networks. 
 
 
",not included,735,0.8113674521446228
10.1007/978-3-030-47124-8_40,to_check,systems engineering,'systems engineering' AND ('generative ai' OR 'artificial intelligence'),SCOPUS_ID:85088453211,scopus,2021-01-01 00:00:00,scopus,zadehian paradigms shaping 21<sup>st</sup> century artificial intelligence,https://www.scopus.com/inward/record.uri?partnerID=HzOxMe3b&scp=85088453211&origin=inward,"
AbstractView references

Starting from the premise that Zadeh’s research heritage is irreducible to his 20th Century work, the paper aims to show that his Generalized Theory of Uncertainty is even more influential now, for 21st Century service-oriented engineering, than his papers on fuzzy sets were for the product-based industrial era. To mirror the whole architectonics of Zadeh’s work, the paper highlights the lasting puissance and evolution of 20th Century Zadehian paradigms. On this groundwork, two paradigmatic breakthroughs follow: (a) moving from ‘information is statistical in nature’ to ‘information is a generalized constraint’; (b) setting as target ‘achievement of NL-capability’. Next, two cardinal upshots: reshaping the relation between numbers and words and scaling down the importance of algorithmic paradigms. Both are needed to meet the challenge of modern artificial intelligence: interacting with living systems; emphasis is on model tractability (for efficiency) and on model interpretability (for user acceptance). © 2021, Springer Nature Switzerland AG.
",not included,2757,0.8105475902557373
10.1080/10447318.2022.2086033,to_check,systems engineering,'systems engineering' AND ('generative ai' OR 'artificial intelligence'),semantic_scholar,International journal of human computer interactions,2022-01-01 00:00:00,semantic_scholar,insight into user acceptance and adoption of autonomous systems in mission critical environments,https://www.semanticscholar.org/paper/265e0035527bdf048deaff1db372647be8f08f95,"Abstract With Industry 4.0 the immense progression of Artificial Intelligence (AI) technology has introduced new challenges for engineers to effectively design human-automation interaction in autonomous systems that are mission critical. Although various autonomous systems are currently being utilized in mission critical environments, there is limited literature and research on which factors affect the acceptance and adoption of said systems. Understanding which factors are most critical for the human-automation interaction could lead to seamless acceptance and adoption and more effective and less expensive missions. Findings of 47 semi-structured interviews revealed ease of use and system reliability to be significant factors for the acceptance and adoption of autonomous systems independent of the level of automation. Through our findings we expand on the current technology acceptance models by including mission critical factors. Emphasis is given to the discussion and consideration of the human factors and engineering approaches associated with the design of autonomous systems for mission critical environments that are needed to empower tomorrow’s users with effective AI systems technology.",not included,1246,0.8103929758071899
10.1109/ice.2018.8436265,to_check,systems engineering,'systems engineering' AND ('generative ai' OR 'artificial intelligence'),semantic_scholar,"International Conference on Engineering, Technology and Innovation",2018-01-01 00:00:00,semantic_scholar,the key concepts of ethics of artificial intelligence,https://www.semanticscholar.org/paper/82afc6e1e3aa05e957e77db2343ef39f5f312b81,"The growing influence and decision-making capacities of Autonomous systems and Artificial Intelligence in our lives force us to consider the values embedded in these systems. But how ethics should be implemented into these systems? In this study, the solution is seen on philosophical conceptualization as a framework to form practical implementation model for ethics of AI. To take the first steps on conceptualization main concepts used on the field needs to be identified. A keyword based Systematic Mapping Study (SMS) on the keywords used in AI and ethics was conducted to help in identifying, defying and comparing main concepts used in current AI ethics discourse. Out of 1062 papers retrieved SMS discovered 37 re-occurring keywords in 83 academic papers. We suggest that the focus on finding keywords is the first step in guiding and providing direction for future research in the AI ethics field.",not included,105,0.8103669881820679
http://arxiv.org/abs/2307.04495v1,to_check,systems engineering,'systems engineering' AND ('generative ai' OR 'artificial intelligence'),arxiv,arxiv,2023-07-10 00:00:00,arxiv,"model-driven engineering method to support the formalization of machine
  learning using sysml",http://arxiv.org/abs/2307.04495v1,"Methods: This work introduces a method supporting the collaborative
definition of machine learning tasks by leveraging model-based engineering in
the formalization of the systems modeling language SysML. The method supports
the identification and integration of various data sources, the required
definition of semantic connections between data attributes, and the definition
of data processing steps within the machine learning support.
  Results: By consolidating the knowledge of domain and machine learning
experts, a powerful tool to describe machine learning tasks by formalizing
knowledge using the systems modeling language SysML is introduced. The method
is evaluated based on two use cases, i.e., a smart weather system that allows
to predict weather forecasts based on sensor data, and a waste prevention case
for 3D printer filament that cancels the printing if the intended result cannot
be achieved (image processing). Further, a user study is conducted to gather
insights of potential users regarding perceived workload and usability of the
elaborated method.
  Conclusion: Integrating machine learning-specific properties in systems
engineering techniques allows non-data scientists to understand formalized
knowledge and define specific aspects of a machine learning problem, document
knowledge on the data, and to further support data scientists to use the
formalized knowledge as input for an implementation using (semi-) automatic
code generation. In this respect, this work contributes by consolidating
knowledge from various domains and therefore, fosters the integration of
machine learning in industry by involving several stakeholders.",included,25,0.8103031516075134
10.1109/tse.2021.3106280,to_check,systems engineering,'systems engineering' AND ('generative ai' OR 'artificial intelligence'),semantic_scholar,IEEE Transactions on Software Engineering,2021-01-01 00:00:00,semantic_scholar,socio-technical grounded theory for software engineering,https://www.semanticscholar.org/paper/7abac45941d30b162e93ba6c5203d1ccc955c585,"Grounded Theory (GT), a sociological research method designed to study social phenomena, is increasingly being used to investigate the human and social aspects of software engineering (SE). However, being written by and for sociologists, GT is often challenging for a majority of SE researchers to understand and apply. Additionally, SE researchers attempting ad hoc adaptations of traditional GT guidelines for modern socio-technical (ST) contexts often struggle in the absence of clear and relevant guidelines to do so, resulting in poor quality studies. To overcome these research community challenges and leverage modern research opportunities, this paper presents Socio-Technical Grounded Theory (STGT) designed to ease application and achieve quality outcomes. It defines what exactly is meant by an ST research context and presents the STGT guidelines that expand GT's philosophical foundations, provide increased clarity and flexibility in its methodological steps and procedures, define possible scope and contexts of application, encourage frequent reporting of a variety of interim, preliminary, and mature outcomes, and introduce nuanced evaluation guidelines for different outcomes. It is hoped that the SE research community and related ST disciplines such as computer science, data science, artificial intelligence, information systems, human computer/robot/AI interaction, human-centered emerging technologies (and increasingly other disciplines being transformed by rapid digitalisation and AI-based augmentation), will benefit from applying STGT to conduct quality research studies and systematically produce rich findings and mature theories with confidence.",not included,1015,0.8101922869682312
10.1109/iccicc53683.2021.9811324,to_check,systems engineering,'systems engineering' AND ('generative ai' OR 'artificial intelligence'),semantic_scholar,IEEE International Conference on Cognitive Informatics and Cognitive Computing,2021-01-01 00:00:00,semantic_scholar,ieee icci*cc series in year 20: latest advances in cognitive informatics and cognitive computing towards general ai (plenary panel report-i),https://www.semanticscholar.org/paper/c08c5016aa6784b37b32aa0215bae45f8e47bbe4,"Cognitive Informatics (CI) and Cognitive Computing (CC) are fundamental intelligence theories and general AI technologies triggered by the transdisciplinary advances in intelligence, computer, brain, knowledge, cognitive, robotic, and cybernetic sciences for engineering implementations. This paper presents a summary of the plenary panel (Part I) on the theoretical foundations of CI/CC as well recent breakthroughs in AI engineering reported in the 20th IEEE International ICCI*CC Conference (ICCI*CC'21). The latest advances in CI and CC towards general AI are presented by twenty-two distinguished panelists. Strategic AI engineering applications in CI, CC, and cognitive systems are elaborated for abstract intelligence, general AI, cognitive robots, autonomous systems, intelligent vehicles, and safety-and-mission-critical systems.",not included,954,0.8100847601890564
10.1109/smc42975.2020.9282836,to_check,systems engineering,'systems engineering' AND ('generative ai' OR 'artificial intelligence'),"2020 IEEE International Conference on Systems, Man, and Cybernetics (SMC)",IEEE,2020-10-14 00:00:00,ieeexplore,toward a mbse research testbed: prototype implementation and lessons learned,https://ieeexplore.ieee.org/document/9282836/,"As Model Based Systems Engineering (MBSE) continues to advance in terms of system life cycle coverage, modeling languages, methods, and tools, there is a growing need of an overarching framework for organizing MBSE artifacts that facilitates their rapid retrieval and use by MBSE researchers. At the same time, researchers must have an environment supportive of exploring, experimenting with, and collecting performance data when using potentially heterogenous modeling constructs and algorithms over broad ranges of conditions and assumptions. These requirements jointly imply the need for a MBSE research testbed that enables experimentation with diverse modeling, analysis, simulation, verification, and validation approaches under nominal and off-nominal conditions, collect and analyze data to uncover patterns and trends, reuse models and components as applicable, and serve as a repository for scenarios, models, case studies, and lessons learned. This paper presents progress to date and lessons learned from the prototype MBSE testbed implementation.",not included,1830,0.8098418712615967
10.1007/978-3-031-29053-4_5,to_check,systems engineering,'systems engineering' AND ('generative ai' OR 'artificial intelligence'),The AI-Enabled Enterprise,Springer,2023-01-01 00:00:00,springer,democratized hyper-automated software development,http://dx.doi.org/10.1007/978-3-031-29053-4_5,"Modern enterprises are evolving into a complex system of systems that need to deliver stated goals while operating in a dynamic and uncertain environment. Given the ever-increasing pervasiveness of software, enterprises are relying heavily on software systems to address a variety of adaptive needs at strategy, process and system levels. The demand-supply situation for trained software developers is already skewed, and the skew is likely to increase further with time. Recent advances in AI techniques in general and Generative AI in particular may lead to a promising solution wherein Subject Matter Experts are empowered to play a greater and more direct role in software development. This chapter motivates the need, proposes a pragmatic line of attack and discusses technology enablers to support this line of attack.",not included,1625,0.8098028302192688
10.1109/syscon48628.2021.9447091,to_check,systems engineering,'systems engineering' AND ('generative ai' OR 'artificial intelligence'),semantic_scholar,IEEE Systems Conference,2021-01-01 00:00:00,semantic_scholar,system level knowledge representation for complexity,https://www.semanticscholar.org/paper/0be5103e7414f164d206bea9b01ab06feca0f9d9,"To develop systems capable of high level cognitive functions such as intelligence, it is necessary to formally capture different types of knowledge, so that they can be used to support complex processes, such as inference and reasoning. The design and engineering of Intelligent Systems to support large distributed socio technical processes increasingly leverages converging techniques from Artificial Intelligence, Knowledge Representation (KR) and Cognitive Architectures. This is resulting in multi layered architectures and AI technologies which one the one hand offer unprecedented capabilities, on the other hand present innumerable, often inconceivable risks. Sophisticated conceptual structures are necessary not only to support the modeling, validation and explanation of complex engineered systems, but primarily to support cognition and conceptualization of the complexities involved, for designers, developers, end users and any stakeholder. Depending on the cognitive makeup of observers, and on the knowledge available, complexity can be conceptualized and traversed following a diversity of methods and patterns. Sometimes complexity can be broken down into cognitively accessible chunks, in other cases however, it cannot be broken down without losing essential information about the system as a whole. Addressing the need to develop cognitive artifacts, methods and techniques that can capture and represent complexity, this paper proposes the outline of conceptual structure that bridges existing approaches which tend to distinguish between cognitive engineering and Knowledge Representation, with the aim to integrate technical and socio technical systems dimensions. The paper presents considerations about cognitive aspects of complex systems theory and practice. It anticipates a convergence between cognitive architectures and KR, introduces the notion of System Level Knowledge Representation and applies it to navigate socio technical complexity in systems engineering. A summary of related work where the System Level Knowledge Representation is being developed and evaluated is also provided.",not included,1065,0.8096051812171936
10.1145/3578527.3578548,to_check,systems engineering,'systems engineering' AND ('generative ai' OR 'artificial intelligence'),SCOPUS_ID:85149125083,scopus,2023-02-23 00:00:00,scopus,a modeling language for novice engineers to design well at saas product companies,https://www.scopus.com/inward/record.uri?partnerID=HzOxMe3b&scp=85149125083&origin=inward,"
AbstractView references

Software-as-a-Service (SaaS) product companies have brought in significant changes in how we build software from architecture and engineering process perspective. SaaS products are large, distributed software systems hosted in cloud and built using collaborating services (or micro-services). The software releases happen in days and weeks, necessitating an agile development process. Novice engineers (those who join the company fresh from college) need to become comfortable with complex systems and proficient in agile delivery with high quality, otherwise they fall behind in productivity. The paper posits that, to be successful at these SaaS product companies, the novice engineers need good modeling and design skills. While this has been for all software development, the changes driven by SaaS products have made this need more acute. Such skills will allow them to capture their feature behaviors (in context of their understanding of the larger product) in an implementation-independent manner and any knowledge gaps can be identified and bridged by their collaborators. We propose a modeling language that is easy for them to learn and use, and which has characteristics suitable for the kind of engineering work they need to do in their early years in a SaaS product company. This modeling language is based on the notion of Transition Systems. The paper demonstrates the usage and value of this language by creating a model for a real feature. The modeling language is quite general and transcends abstraction boundaries. We also present a modeling process that should be used with this language for better results. This is a short position paper that presents an idea about a new modeling language for a specific purpose (helping novice engineers design well at SaaS product companies). Validation studies for the language and the design process is a work in progress and the results will be shared in a full paper later. © 2023 ACM.
",not included,2181,0.8095322847366333
