doi,type,publication,publisher,publication_date,database,title,url,abstract,domain,id
f66df4762da27773e3a6ed820665aa74d4db0e76,filtered,semantic_scholar,2018 IEEE European Symposium on Security and Privacy (EuroS&P),2018-01-01,semantic_scholar,security risks in asynchronous web servers: when performance optimizations amplify the impact of data-oriented attacks,https://www.semanticscholar.org/paper/f66df4762da27773e3a6ed820665aa74d4db0e76,"Over the past decade, many innovations have been achieved with respect to improving the responsiveness of highly-trafficked servers. These innovations are fueled by a desire to support complex and data-rich web applications while consuming minimal resources. One of the chief advancements has been the emergence of the asynchronous web server architecture, which is built from the ground up for scalability. While this architecture can offer a significant boost in performance over classic forking servers, it does so at the cost of abandoning memory space isolation between client interactions. This shift in design, that delegates the handling of many unrelated requests within the same process, enables powerful and covert data-oriented attacks that rival complete web server takeover — without ever hijacking the control flow of the server application. To demonstrate the severity of this threat, we present a technique for identifying security-critical web server data by tracing memory accesses committed by the program in generating responses to client requests. We further develop a framework for performing live memory analysis of a running server in order to understand how low-level memory structures can be corrupted for malicious intent. A fundamental goal of our work is to assess the realism of such data-oriented attacks in terms of the types of memory errors that can be leveraged to perform them, and to understand the prominence of these errors in real-world web servers. Our case study on a leading asynchronous architecture, namely Nginx, shows how dataoriented attacks allow an adversary to re-configure an Nginx instance on the fly in order to degrade or disable services (e.g., error reporting, security headers like HSTS, access control), steal sensitive information, as well as distribute arbitrary web content to unsuspecting clients — all by manipulating only a few bytes in memory. Our empirical findings on the susceptibility of modern asynchronous web servers to two wellknown CVEs show that the damage could be severe. To address this threat, we also discuss several potential mitigations. Taken as a whole, our work tells a cautionary tale regarding the risks of blindly pushing forward with performance optimizations.",data oriented architecture,54
0790af19ce0f479f822b890388791cfd3ebfe276,filtered,semantic_scholar,,1998-01-01,semantic_scholar,the wasa approach to workflow management for scientific applications,https://www.semanticscholar.org/paper/0790af19ce0f479f822b890388791cfd3ebfe276,"Workflow management has gained increasing attention recently, since it allows one to combine a data-oriented view on applications, which is the traditional one for an information system, with a process-oriented one in which activities and their occurrences over time are modeled and supported properly. While workflow management has mostly been considered in business applications so far, the focus of the WASA project is on scientific applications such as geoprocessing, molecular biology, or laboratory environments. In particular, WASA aims at flexible and platform-independent workflow support, with respect to both specification and execution of workflows. It turns out that the modeling and execution of workflows in traditional and in scientific applications exhibit significant differences. In particular, the need for dynamic modifications of workflow models while workflows are running is an important feature in scientific applications. Observations like these have resulted in a generic WASA architecture, which can be tailored towards various specific application domains. The conceptual design and functionality of a WASA prototype is outlined, in particular that of its core workflow engine, and it is shown how the requirements of flexibility in modeling and executing workflows, imposed by scientific applications, are met by this prototype.",data oriented architecture,55
3c43e848a6cf8f90c17298d6298ce0b58007881e,filtered,semantic_scholar,,2012-01-01,semantic_scholar,generic adaptation framework for unifying adaptive web-based systems,https://www.semanticscholar.org/paper/3c43e848a6cf8f90c17298d6298ce0b58007881e,"The Generic Adaptation Framework (GAF) research project first and foremost creates a common formal framework for describing current and future adaptive hypermedia (AHS) and adaptive webbased systems in general. It provides a commonly agreed upon taxonomy and a reference model that encompasses the most general architectures of the present and future, including conventional AHS, and different types of personalization-enabling systems and applications such as recommender systems (RS) personalized web search, semantic web enabled applications used in personalized information delivery, adaptive e-Learning applications and many more. At the same time GAF is trying to bring together two (seemingly not intersecting) views on the adaptation: a classical pre-authored type, with conventional domain and overlay user models and data-driven adaptation which includes a set of data mining, machine learning and information retrieval tools. To bring these research fields together we conducted a number GAF compliance studies including RS, AHS, and other applications combining adaptation, recommendation and search. We also performed a number of real systems’ case-studies to prove the point and perform a detailed analysis and evaluation of the framework. Secondly it introduces a number of new ideas in the field of AH, such as the Generic Adaptation Process (GAP) which aligns with a layered (data-oriented) architecture and serves as a reference adaptation process. This also helps to understand the compliance features mentioned earlier. Besides that GAF deals with important and novel aspects of adaptation enabling and leveraging technologies such as provenance and versioning. The existence of such a reference basis should stimulate AHS research and enable researchers to demonstrate ideas for new adaptation methods much more quickly than if they had to start from scratch. GAF will thus help bootstrap any adaptive web-based system research, design, analysis and evaluation.",data oriented architecture,56
63c7863fcba665bb8b87ee7f204ec79dcd60ba9a,filtered,semantic_scholar,2020 IEEE Symposium on Security and Privacy (SP),2020-01-01,semantic_scholar,xmp: selective memory protection for kernel and user space,https://www.semanticscholar.org/paper/63c7863fcba665bb8b87ee7f204ec79dcd60ba9a,"Attackers leverage memory corruption vulnerabilities to establish primitives for reading from or writing to the address space of a vulnerable process. These primitives form the foundation for code-reuse and data-oriented attacks. While various defenses against the former class of attacks have proven effective, mitigation of the latter remains an open problem. In this paper, we identify various shortcomings of the x86 architecture regarding memory isolation, and leverage virtualization to build an effective defense against data-oriented attacks. Our approach, called xMP, provides (in-guest) selective memory protection primitives that allow VMs to isolate sensitive data in user or kernel space in disjoint xMP domains. We interface the Xen altp2m subsystem with the Linux memory management system, lending VMs the flexibility to define custom policies. Contrary to conventional approaches, xMP takes advantage of virtualization extensions, but after initialization, it does not require any hypervisor intervention. To ensure the integrity of in-kernel management information and pointers to sensitive data within isolated domains, xMP protects pointers with HMACs bound to an immutable context, so that integrity validation succeeds only in the right context. We have applied xMP to protect the page tables and process credentials of the Linux kernel, as well as sensitive data in various user-space applications. Overall, our evaluation shows that xMP introduces minimal overhead for real-world workloads and applications, and offers effective protection against data-oriented attacks.",data oriented architecture,57
bdd38349d22ab12ddd44a500d5720853ee17286b,filtered,semantic_scholar,2012 IEEE International Conference on Communications (ICC),2012-01-01,semantic_scholar,traffic engineering for information-centric networks,https://www.semanticscholar.org/paper/bdd38349d22ab12ddd44a500d5720853ee17286b,"Information-centric networking (ICN) proposes a networking architecture that uses methodologies such as publish-subscribe to achieve a data-oriented approach as opposed to a destination based approach found in the current Internet. This new architecture brings both new problems to be solved and also natural solutions to existing problems. This paper investigates an intra-domain traffic engineering (TE) problem for an information-centric networking (ICN) architecture where a form of source routing is used as the forwarding mechanism. The TE goal is to maximise the residual capacity in the network so that the load is spread evenly. A network flow approach is used and it is shown that the source routing mechanism allows the traffic to be split across multiple paths in a manner that is difficult to achieve using existing IP or IP/MPLS networks. Allowing splittable flows means that a fully polynomial-time approximation scheme can be used that has superior results when compared to existing constraint based routing schemes for flows that cannot be split. Consequently, this work demonstrates that the ICN architecture can simplify the given TE problem in a natural manner.",data oriented architecture,58
536ab937378e5965f8687b5bf29af2e360aac3bb,filtered,semantic_scholar,2006 ieee/aiaa 25TH Digital Avionics Systems Conference,2006-01-01,semantic_scholar,system-wide information management (swim) demonstration security architecture,https://www.semanticscholar.org/paper/536ab937378e5965f8687b5bf29af2e360aac3bb,"System-wide information management (SWIM) is a Federal Aviation Administration (FAA) network-centric environment that facilitates software application integration in the National Airspace System (NAS). Built on a set of five core service types - interfaces, registries, message brokers, information assurance and system management - SWIM accelerates NAS evolution by defining a secure common infrastructure for application integration and a framework for information modeling and exchange. Providing information security in this distributed network-centric environment is a significant challenge. System users must be confident that their critical data is protected. Competing requirements, the transportation of sensitive data and air-to-ground bandwidth constraints mean that a network layer-based approach to security is no longer sufficient. Trusted security at every layer of a network-centric architecture - combined with strong identity management and a data-oriented approach to information assurance - is the key to success. This paper introduces the FAA SWIM demonstration security architecture, and explores some of the methods and mechanisms used to provide end-to-end security, confidentiality, integrity, availability and privacy for NAS applications and their users",data oriented architecture,59
b728578e4b46a145a24cf02a2f5b70c01eb9b78a,filtered,semantic_scholar,FM,2005-01-01,semantic_scholar,verification of a signature architecture with hol-z,https://www.semanticscholar.org/paper/b728578e4b46a145a24cf02a2f5b70c01eb9b78a,"We report on a case study in using HOL-Z, an embedding of Z in higher-order logic, to specify and verify a security architecture for administering digital signatures. We have used HOL-Z to formalize and combine both data-oriented and process-oriented architectural views. Afterwards, we formalized temporal requirements in Z and carried out verification in higher-order logic. 
 
The same architecture has been previously verified using the SPIN model checker. Based on this, we provide a detailed comparison of these two different approaches to formalization (infinite state with rich data types versus finite state) and verification (theorem proving versus model checking). Contrary to common belief, our case study suggests that Z is well suited for temporal reasoning about process models with rich data. Moreover, our comparison highlights the advantages of this approach and provides evidence that, in the hands of experienced users, theorem proving is neither substantially more time-consuming nor more complex than model checking.",data oriented architecture,60
fee36f1cbb7047ef8519221492a7a3620910d62c,filtered,semantic_scholar,,1999-01-01,semantic_scholar,engineering parallel symbolic programs in gph,https://www.semanticscholar.org/paper/fee36f1cbb7047ef8519221492a7a3620910d62c,"We investigate the claim that functional languages offer low-cost parallelism in the context of symbolic programs on modest parallel architectures. In our investigation we present the first comparative study of the construction of large applications in a parallel functional language, in our case in Glasgow Parallel Haskell (GPH). The applications cover a range of application areas, use several parallel programming paradigms, and are measured on two very different parallel architectures. 
 
On the applications level the most significant result is that we are able to achieve modest wall-clock speedups (between factors of 2 and 10) over the optimised sequential versions for all but one of the programs. Speedups are obtained even for programs that were not written with the intention of being parallelised. These gains are achieved with a relatively small programmer-effort. One reason for the relative ease of parallelisation is the use of evaluation strategies, a new parallel programming technique that separates the algorithm from the co-ordination of parallel behaviour. 
 
On the language level we show that the combination of lazy and parallel evaluation is useful for achieving a high level of abstraction. In particular we can describe top-level parallelism, and also preserve module abstraction by describing parallelism over the data structures provided at the module interface (‘data-oriented parallelism’). Furthermore, we find that the determinism of the language is helpful, as is the largely implicit nature of parallelism in GPH. Copyright © 1999 John Wiley & Sons, Ltd.",data oriented architecture,61
f0c611b788794234c65bb32b4f748a17bd6cebbd,filtered,semantic_scholar,,2017-01-01,semantic_scholar,digital economy: conceptual architecture of a digital economic sector ecosystem,https://www.semanticscholar.org/paper/f0c611b788794234c65bb32b4f748a17bd6cebbd,"Yury M. Akatkin - Head of Laboratory of Social-Demographic Statistics, Plekhanov Russian University of EconomicsAddress: 36, Stremyanny Lane, Moscow, 117997, Russian FederationE-mail: u.akatkin@semanticpro.orgOleg E. Karpov - Corresponding Member, Russian Academy of Sciences; General Director of Pirogov National Medical-Surgical CenterAddress: 70, Nizhnyaya Pervomaiskaya Street, Moscow, 105203, Russian FederationE-mail: nmhc@mail.ruValery A. Konyavskiy - Head of Information Security Department, Moscow Institute of Physics and TechnologyAddress: 1A, Kerchenskaya Street, Moscow, 117303, Russian FederationE-mail: konyavskiy@gospochta.ruElena D. Yasinovskaya - Senior Researcher, Laboratory of Social-Demographic Statistics, Plekhanov Russian University of EconomicsAddress: 36, Stremyanny Lane, Moscow, 117997, Russian FederationE-mail: elena@semanticpro.org The main objective of digital transformation is to fulfill the needs of a “new digital generation customer” for on-demand delivery, quality and personalization. ”Anything as a service” has become the key principle of the digital paradigm. This is about a data-oriented service which relies on sharing information resources (including public ones) and the requirements for interoperability, security and trust. This paper presents the main approaches to digital transformation based on the example of the most innovatively active sectors such as banking and healthcare. We compare the proprietary development of digital services (products) to the building of a digital sector ecosystem aimed at attracting an unlimited number of participants. We defined the purpose of creating an ecosystem that is to provide the population with digital services formed on demand, in real time, in compliance with legislation and regulations, as well as in the context of maximum trust. We emphasize the role of openness for uniting the efforts of the community interested in the development of a digital industry, extension of public-private partnerships and building a competitive environment in order to ensure the rapid growth of available digital services, as well as to improve their quality. Since the knowledge economy is the basis for the digital economy, the authors consider it especially important to form a semantic core which acts as the carrier of knowledge in a digital sector ecosystem. We confirmed the necessity to implement the semantic core by a brief analysis of modern semantic approaches to standardization of information sharing in the above-mentioned industries, such as FIBO, BIAN (banking), HL7 and UMLS (health). The research carried out allowed the authors to design the conceptual architecture of the ecosystem and to suggest several proposals for digital transformation of an industry. The proposals express the necessity of state support for innovation and providing the conditions for the entry of new digital products based on the following principles: accessibility, timeliness, personalization, adaptability and security.",data oriented architecture,62
449b756485d77d452b0cc0805b1a7a6767d8f525,filtered,semantic_scholar,IEEE Transactions on Industrial Informatics,2017-01-01,semantic_scholar,iot-based techniques for online m2m-interactive itemized data registration and offline information traceability in a digital manufacturing system,https://www.semanticscholar.org/paper/449b756485d77d452b0cc0805b1a7a6767d8f525,"The integration of internet-of-things (IoT) technologies in the industry benefits digital manufacturing applications by allowing ubiquitous interaction and collaborative automation between machines. Online data collection and data interaction are critical for real-time decision making and machine collaborations. However, due to the specificity of digital manufacturing applications, the technical gap between IoT techniques and practical machine operation could hinder the efficient data interactions, collaborations between machines, and the effectiveness as well as the accuracy of itemized data collection. This investigation, therefore, identifies some major technical problems and challenges that current IoT-based digital manufacturing is facing, and proposes a method to bridge the technical gap for itemized product management. The highlights of this investigation are: 1) a data-oriented system architecture toward flexible data interaction between machines, 2) a customized machine-to-machine protocol for machine discovery, presence, and messaging, (3) flexible data structure and data presentation for interoperability, and (4) versatile information tracing approaches for product management. The proposed solutions have been implemented in PicknPack digital food manufacturing line, and achieved ubiquitous data interaction, online data collection, and versatile product information tracing methods have shown the feasibility and significance of the presented methods.",data oriented architecture,63
63f8e385951558e9c6b49cb4c83098b09ed704e3,filtered,semantic_scholar,2013 International Conference on Advanced Cloud and Big Data,2013-01-01,semantic_scholar,a mechanism of information-centric networking based on data centers,https://www.semanticscholar.org/paper/63f8e385951558e9c6b49cb4c83098b09ed704e3,"Information-centric networking (ICN) aims to make the Internet more data-oriented or content-centric, thus name-based routing and universal caching are used to change the way users requesting and fetching content, as well as to improve network performance. However, current implementation mechanisms define some kinds of ""clean-slate"" architecture and certain brand new technologies need to be designed and implemented. In this paper, some requisites reflecting ICN's essential ingredients are generalized, and based on the OpenFlow and the data center technologies, a mechanism called odICN, which can satisfy those aforementioned requisites, is proposed together with its algorithmic framework. Finally, a prototype of odICN is built to verify its feasibility.",data oriented architecture,64
9703eec800ca2f2cbbcdb8edc565da15ba15af8c,filtered,semantic_scholar,Formal Aspects of Computing,2007-01-01,semantic_scholar,verifying a signature architecture: a comparative case study,https://www.semanticscholar.org/paper/9703eec800ca2f2cbbcdb8edc565da15ba15af8c,"We report on a case study in applying different formal methods to model and verify an architecture for administrating digital signatures. The architecture comprises several concurrently executing systems that authenticate users and generate and store digital signatures by passing security relevant data through a tightly controlled interface. The architecture is interesting from a formal-methods perspective as it involves complex operations on data as well as process coordination and hence is a candidate for both data-oriented and process-oriented formal methods.We have built and verified two models of the signature architecture using two representative formal methods. In the first, we specify a data model of the architecture in Z that we extend to a trace model and interactively verify by theorem proving. In the second, we model the architecture as a system of communicating processes that we verify by finite-state model checking. We provide a detailed comparison of these two different approaches to formalization (infinite state with rich data types versus finite state) and verification (theorem proving versus model checking). Contrary to common belief, our case study suggests that Z is well suited for temporal reasoning about process models with complex operations on data. Moreover, our comparison highlights the advantages of proving theorems about such models and provides evidence that, in the hands of an experienced user, theorem proving may be neither substantially more time-consuming nor more complex than model checking.",data oriented architecture,65
62bdf319dcb9743d8abe61d5ba3f4e2180092a2e,filtered,semantic_scholar,IEEE Wireless Communications,2015-01-01,semantic_scholar,video delivery in heterogenous crans: architectures and strategies,https://www.semanticscholar.org/paper/62bdf319dcb9743d8abe61d5ba3f4e2180092a2e,"Video traffic has become a major part of mobile data traffic, and will keep growing in the coming years. The performance of video delivery is fundamentally constrained by the structure of the underlying wireless networks. The recently proposed heterogeneous cloud access networks have been widely recognized as an inevitable evolution trend of the current cellular system toward the future 5G system, where multiple hybrid radio access technologies coexist to provide flexible access for mobile users. As a key enabling functional block for high-performance video delivery, a powerful centralized baseband processing unit pool is adopted to control all the radio access technologies, and possibly facilitate the video encoding and transmission, which opens up the potential to achieve higher throughput, lower traffic delay, and greater robustness compared to its basic baseband processing unit counterpart without central control functions. However, such a centralized control framework also raises many new research challenges to be addressed. In this article, we provide an overview of the state-of-the-art video delivery architectures and video packet transmission strategies in heterogeneous cloud radio access networks, with highlights on the networking architectures, transmission strategies, performance analysis, and design challenges. This article also sheds some light on the design principles for future big-data-oriented wireless networks.",data oriented architecture,66
