doi,type,publication,publisher,publication_date,database,title,url,abstract,domain,id
5420d66a752c1eb434633e1e96f9f2c9743a5c69,filtered,semantic_scholar,Proceedings of NOMS '94 - IEEE Network Operations and Management Symposium,1994-01-01,semantic_scholar,information engineering architecture for strategic network operations and management platforms,https://www.semanticscholar.org/paper/5420d66a752c1eb434633e1e96f9f2c9743a5c69,"Today's telecommunications industry in Japan is not merely a business for an equipment infrastructure. Service providers are fiercely competing to improve customer satisfaction: providing services more quickly, notifying customers of exact recovery times, and supplying advanced new services. To improve customer satisfaction, all network operations and management (O&M) activities from customer services to administration have to flow smoothly and in cooperation with each other. A major factor in achieving this is an efficient information flow. An important aspect in this flow is that information must be readily available at any time and any place. To achieve global availability, the meaning, representation, and structure of the information must be systematized and standardized at an enterprise level and represented specifically at the local processing level. It is therefore necessary to construct O&M systems by using methodologies based on an information(data-) oriented perspective. An O&M system so constructed can be characterized as a strategic information system (SIS). Traditionally, O&M systems have been based on a process-oriented perspective and have been isolated from the flow of information. This paper describes the information engineering architecture we have developed for constructing a strategic network operation platform as an SIS. We have designed part of an information model based on this architecture and are studying the operation platform construction. 268 0-7803-181 1-0/94$04.00019941EEE Operation Systems: Present and Future Basic Structure of Process1 Qriented Operation Systems-df I .~.~..""-.,"""".~~.~.. .. .. ~ ......~... (Information L ,-.-.. ... .. ...-.. .. .""........"".. . .......-... . .."".....-,. Basic Structure of Data-oriente>j Platforms Application Platforms Presentation I [Data Communication Network) In&ormutton Resources Encupsuluted wtdh Merhods 1 Information Resource Platforms Traditional O&M systems focus on operating and managing the equipment and the network; they are developed by using methodologies based on a process-oriented perspective. Their data modeling and standardization are therefore done independently, so their data naming and data coding are not consistent. Information flows among these systems by means of paper and floppy disks, leading to duplicate data input, data transformation, and data inconsistency. The O&Ms are becoming strategic, advanced, and commercialized. For example, customers will be able to control their own networks, or they can let the service provider do it for them. To achieve strategic and advanced O&M, several O&M systems are needed and information must flow among them. In traditional vertically-structured systems, it is difficult to simplify data flow management, maintain data quality, and reduce data transformation costs. It is necessary to construct an information infrastructure which does not limit processing and managing data flows. The information needed by any O&M system must be immediately available, so information must be able to easily and quickly flow to all related O&M systems. From the view that ""Information is a final product which is gained by processing data"", it is necessary to construct O&M systems by using methodologies based on an information(data-) oriented perspective. We have developed a horizontally-structured O&M systems environment based on a data-oriented perspective. We call it an operation platform.",data oriented architecture,144
41869028b49ed2aac17ae9aede4f482ce7c6372c,filtered,semantic_scholar,,1998-01-01,semantic_scholar,evaluation results nlp components ovis2,https://www.semanticscholar.org/paper/41869028b49ed2aac17ae9aede4f482ce7c6372c,"The NWO Priority Programme Language and Speech Technology is a research programme aiming at the development of spoken language information systems. Its immediate goal is to develop a demonstrator of a public transport information system, which operates over ordinary telephone lines. This demonstrator is called OVIS, Openbaar Vervoer Informatie Systeem (Public Transport Information System). The language of the system is Dutch. In this Programme, two alternative natural language processing modules are developed in parallel: a ‘grammar-based’ (conventional, rule-based) module and a ‘data-oriented’ (statistical, probabilistic, DOP) module. Both of these modules fit into the system architecture of OVIS. For detailed descriptions of these modules, the reader is refered to (van Noord et al., 1996), (van Noord et al., 1996) and (van Noord et al., 1997) for the grammar-based NLP module. The DOP approach is documented in (Scha et al., 1996), (Sima’an, 1997b), (Bod and Scha, 1997). In order to compare both NLP modules, a formal evaluation has been carried out. This evaluation was planned originally for the beginning of 1997. Because the design of the update language (the interface between NLP and the pragmatic component and dialog manager) took more time than foreseen, and because the (semantic) annotation of corpus material has been available only since May 1997, this formal evaluation could only start in february 1998. The evaluation procedure is described in (van Noord, 1997), and summarized here in section 2. The methods implemented in Groningen and Amsterdam are described in somewhat more detail in section 3. Some characteristics of the test set are provided in section 4. The results of the evaluation are presented in section 5.",data oriented architecture,145
fd4cbfabe49082a784e60ea60359c9483af8c216,filtered,semantic_scholar,22017 IEEE International Conference on Computational Science and Engineering (CSE) and IEEE International Conference on Embedded and Ubiquitous Computing (EUC),2017-01-01,semantic_scholar,identity-based proxy signature multiple-file pdp for mobile cloud computing,https://www.semanticscholar.org/paper/fd4cbfabe49082a784e60ea60359c9483af8c216,"Provable Data Possession (PDP) schemes which are vital to data-oriented mobile cloud computing security architecture enable users to check the integrity of their data in the cloud efficiently. Due to the limitation of storage space and computing power of the mobile terminals, a new identity-based proxy signature multiple-file data integrity verification scheme called Identity-Based Proxy Signature Multiple-File PDP(IBPS-MPDP) for mobile cloud computing is proposed. In this paper, by using identity-based proxy signature, the system does not need to take the additional overhead to manage the public key certifications and the mobile users do not need to take additional cost to authenticate others' certificates yet. Allotting the heavy proxy signature tasks to the proxy sign party to implement to reduce the mobile terminal users' computing pressures. Adopting the aggregate signature to diminish the communication overhead of cloud and mobile users. The security of the scheme is proved in the random oracle model.",data oriented architecture,146
cddb42247b854abce14ee1e059f332f42be54c5d,filtered,semantic_scholar,2015 IEEE Global Conference on Signal and Information Processing (GlobalSIP),2015-01-01,semantic_scholar,rapid customization of image processors using halide,https://www.semanticscholar.org/paper/cddb42247b854abce14ee1e059f332f42be54c5d,"Image processing applications typically involve data-oriented kernels with limited control divergence. In order to efficiently exploit the data level parallelism, image processors include SIMD instructions and other parallel computation resources. Generic processors that can be purchased off-the-shelf are adequate for most of the use scenarios of image processing. However, especially with embedded mobile devices, they might not be optimal for the algorithm, the environment, or the energy budget at hand. Such cases call for programmable customized architectures with just enough hardware resources to ensure the high priority applications reach their real time goals with minimal overheads. In order to maintain high engineer productivity, implementing image algorithms for customized processors should be as easy as with standard processors. This is emphasized at the processor co-design time; because the program is used to drive the processor design space exploration towards an optimized architecture, assembly programming is not feasible due to the required porting effort whenever the architecture is modified. In this paper we propose an image processor customization flow that exploits the domain-specific Halide language as an input to a processor co-design environment. In addition to efficiently exploiting standard resources in the customized processors, the flow provides an easy way to invoke special instructions from Halide programs. We validate the performance benefits of custom operations using example filters described with the Halide language.",data oriented architecture,147
de0c291d6c16ee7e3b2774f30ba3ee488cea0d82,filtered,semantic_scholar,2017 International Carnahan Conference on Security Technology (ICCST),2017-01-01,semantic_scholar,"encrypted computing: speed, security and provable obfuscation against insiders",https://www.semanticscholar.org/paper/de0c291d6c16ee7e3b2774f30ba3ee488cea0d82,"Over the past few years we have articulated theory that describes ‘encrypted computing’, in which data remains in encrypted form while being worked on inside a processor, by virtue of a modified arithmetic. The last two years have seen research and development on a standards-compliant processor that shows that near-conventional speeds are attainable via this approach. Benchmark performance with the US AES-128 flagship encryption and a 1GHz clock is now equivalent to a 433MHz classic Pentium, and most block encryptions fit in AES's place. This summary article details how user data is protected by a system based on the processor from being read or interfered with by the computer operator, for those computing paradigms that entail trust in data-oriented computation in remote locations where it may be accessible to powerful and dishonest insiders. We combine: (i) the processor that runs encrypted; (ii) a slightly modified conventional machine code instruction set architecture with which security is achievable; (iii) an ‘obfuscating’ compiler that takes advantage of its possibilities, forming a three-point system that provably provides cryptographic ‘semantic security’ for user data against the operator and system insiders.",data oriented architecture,148
bf25baf2eac5677cad335addbfab8b1c51ee360e,filtered,semantic_scholar,,2003-01-01,semantic_scholar,a method to find uniq e sequences on distrib ted genomic databases,https://www.semanticscholar.org/paper/bf25baf2eac5677cad335addbfab8b1c51ee360e,"Thanks to the development of genetic engineering, various kinds of genomic information are being unveiled.Hence, it becomes feasible to analyze the entire genomicinformation all at once. On the other hand, the quantity ofthe genomic information stocked on databases is increasingday after day. In order to process the whole information, wehave to develop an effective method to deal with lots of data.Therefore, it is indis ensable not only to make an effectiveand rapid algorithm but also to use high-speed computerresource so as to analyze the biological information. Forthis purpose, as one of the most promised computing environments, the grid computing architecture has appearedrecently. The European Data Grid (EDG) is one of the data-oriented grid computing environments [11].In the field of bioinformatics, it is important to findunique sequences to succeed in molecular biological experiments [6]. Once unique sequences have been found, theycan be useful for target specific probes/primers design, genesequence comparison and so on. In this paper, we propose amethod to discover unique sequences from among genomicdatabases located in a distributed environment. Next, weimplement this method upon the European Data Grid andshow the calculation results for E. coli genomes.",data oriented architecture,149
e585a4d141b078b4fffcdb6355a24770c28bbfd2,filtered,semantic_scholar,,2009-01-01,semantic_scholar,data-oriented internet routing architecture,https://www.semanticscholar.org/paper/e585a4d141b078b4fffcdb6355a24770c28bbfd2,"This paper proposes a data-oriented routing architecture(DORA) which inherently supports endpoints mobility,data replication and migration.DORA routes directly on nodes and data's flat names,which gets rid of IP addresses and Reference Resolution Server(RRS) such as DNS.It takes data and service as first class objects like endpoints while considering endpoints as aggregations of data and service logically.This model provides an extendable,secure framework for future Internet with simple routing mechanism.",data oriented architecture,150
88af34df634edebdfe39871f82166e61ad0a4835,filtered,semantic_scholar,,2010-01-01,semantic_scholar,electronic communications of the easst volume 28 ( 2010 ) proceedings of the third international discotec workshop on context-aware adaptation mechanisms for pervasive and ubiquitous services ( campus 2010 ) modelling feedback control loops for self-adaptive systems,https://www.semanticscholar.org/paper/88af34df634edebdfe39871f82166e61ad0a4835,"Feedback Control Loops (FCLs) are the heart of any self-adaptive system. Existing engineering approaches for building self-ad aptive systems mask FCL by providing abstraction layers that hide the application c mplexity. In this paper, we investigate a model-driven approach for the engineering of FCLs whose architecture is based on the Service Component Architecture (SCA) model. Our proposal consists in exploiting the data streaming model, to specify the characteristics of the control policies, and to generate FCLs of self-adaptive sys tem deployed in largescale environment. We argue that the use of a data-oriented m odel for designing self-adaptive systems significantly increases FCL visibil ity.",data oriented architecture,151
05fbbfb5cdab641e15c49690064b9aa1728bd2c3,filtered,semantic_scholar,,2015-01-01,semantic_scholar,non-volatile in-memory computing,https://www.semanticscholar.org/paper/05fbbfb5cdab641e15c49690064b9aa1728bd2c3,"The analysis of big-data at exa-scale (1018 bytes or flops) has called for an urgent need to re-examine the existing hardware platform that can support intensive data-oriented computing. A big-data-driven application requires huge bandwidth and yet able to ensure low-power density. For example, web-searching application involves crawling, comparing, ranking, and paging of billions of web-pages with extensive memory access. The existing memory technologies have critical challenges of scaling at nano-scale due to process variation, leakage current and I/O access limitations. Recently, the emerging non-volatile memory (NVM) technologies such as resistive-RAM (ReRAM), spintransfer torque RAM (STT-RAM), domain-wall nanowire racetrack memory etc., have all shown significantly reduced standby power and increased integration density, not forgetting the close-to DRAM/SRAM access speed. Therefore, they are considered as promising candidates of universal memory for future big-data applications. The primary challenge to validate a hybrid design with both CMOS and nonvolatile devices is the lack of design platform that can validate the large-scale NVM circuit and system design accurately and efficiently. In addition, due to the use of non-electrical states of emerging NVM devices, new cells structures and their agreeing circuits for both read and write operations are needed to harness non-volatile memory with unique operations. For example, the transistor-free crossbar array that associates with NVM is different from conventional access transistor based memory structure. What is more, leveraging the NVM for computing, one also needs to examine the potential logic-inmemory computing architecture with significantly improved bandwidth and reduced power. In order to tackle above challenges ranging from device to system levels, this PhD thesis has explored the development of NVM design platform to support designs of non-volatile memories, readout and logic circuit designs, as well as the in-memory computing architecture. For the NVM design platform, the target is to perform accurate yet efficient circuit level simulation. The previous approaches either ignore dynamic effect without considering non-volatile states for dynamic behavior, or need equivalent circuits with high complexity to curve-fit non-linearity of those devices. We proposed a SPICE simulaiii tor named NVM-SPICE. This tool takes advantages of its new modified nodal analysis (MNA) framework, which can effectively support the non-electrical state variables of emerging non-volatile devices, such as ReRAM and spintronics devices. Due to the physics based modeling approach, NVM-SPICE is able to perform hybrid NVM/CMOS circuits efficiently and accurately. Compared to the equivalent circuit model based approach, the NVM-SPICE simulator exhibits more than 117x faster simulation speed for spintronics category devices and 40x faster speed for RRAM category devices. For NVM in-memory architecture, both memory elements and logic elements are implemented by emerging spintronics devices, which leads to a system purely composed of non-volatile devices. The detailed non-volatile memory and logic circuits are explored within the NVM-SPICE platform. In addition, logic is built inside the memory so that the I/O workload can be alleviated. Applications such as data retention, encryption, machine learning that play critical roles for big-data computing are explored within the non-volatile in-memory architecture. The evaluation results show that the purely non-volatile memory based platforms with in-memory architecture greatly contribute to power efficiency and throughput improvement for big-data oriented applications, and thus are potential candidates to be next generation information and communication technology.",data oriented architecture,152
c78864537e89a1cfb3d1c0c86d1c0798f06957c3,filtered,semantic_scholar,Euro-Par Workshops,2017-01-01,semantic_scholar,on the effects of data-aware allocation on fully distributed storage systems for exascale,https://www.semanticscholar.org/paper/c78864537e89a1cfb3d1c0c86d1c0798f06957c3,"The convergence between computing- and data-centric workloads and platforms is imposing new challenges on how to best use the resources of modern computing systems. In this paper we show the need of enhancing system schedulers to differentiate between compute- and data-oriented applications to minimise interferences between storage and application traffic. These interferences can be especially harmful in systems featuring fully distributed storage systems together with unified interconnects, such as our custom-made architecture ExaNeSt. We analyse several data-aware allocation strategies, and found that such strategies are essential to maintain performance in distributed storage systems.",data oriented architecture,153
f16778cf55577077edc2105942cfd1f3107b27e6,filtered,semantic_scholar,MobiSys 2007,2007-01-01,semantic_scholar,programming and securing service-oriented wireless sensor networks,https://www.semanticscholar.org/paper/f16778cf55577077edc2105942cfd1f3107b27e6,"Our demonstrator shows the implementation of a Serviceoriented Architecture (SoA) for wireless sensor-actuator networks (WSAN). It demonstrates the feasibility of our serviceoriented system in a real-world, resource-restricted WSAN based on off-the-shelf MICAz motes running the operation system TinyOS. In contrast to data-oriented approaches our service-oriented system does not only provide ”traditional” uni-directional data transfer (from sensor nodes to a base station), but also enables autonomous collaboration of sensor nodes. The nodes collaborate in the sense that the input of several sensors is used to trigger actuators, which in turn affect the sensor readings etc. For demonstration purposes we built an intelligent greenhouse that autonomously adapts its ambience in order to cultivate plants according to their individual and collective needs (see Figure 1). E.g., the lighting of the greenhouse is adapted considering all plants’ needs and the sunlight. For visualization we constructed a miniature version of the greenhouse with several plants. The greenhouse itself as well as the plants within are all equipped with various sensors and actuators in order to measure and modify the plants’ ecosystem (i.e. light and soil humidity). We also simulate external influence on the ecosystem, such as the influence of the sun on the greenhouse’s light control. Protocol details of our service-oriented system can be observed via a couple of PDAs connected to the sensor nodes. These PDAs allow for inspecting and changing the internal state of sensor nodes. Hence, attendees of the demonstration can use these PDAs to interact with the WSAN. We show two fundamental aspects of our Service-oriented Architecture in the demonstration: • Service description and execution: The intelligent greenhouse application is composed of services. The services are described and executed by Talassa (Tasking Language for Service-oriented Sensor-Actuator Networks [1]). • Secure lookup of available services: Services are stored in a distributed service directory, SCAN (Secure Content Addressable Network [2]). As this is a security critical component of our architecture, SCAN has been designed to provide secure service discovery. Talassa is a description language for distributed WSAN applications based on services. An application consists of a number of atomic services, which perform either basic hardware interaction or influence the control flow of other services. A virtual machine on each sensor node executes any of the above mentioned service types and provides inter-service new plant “sun”",data oriented architecture,154
99b369f722dd4e7c21d173d1281de767993de7e2,filtered,semantic_scholar,2012 IEEE 28th International Conference on Data Engineering,2012-01-01,semantic_scholar,provenance-based debugging and drill-down in data-oriented workflows,https://www.semanticscholar.org/paper/99b369f722dd4e7c21d173d1281de767993de7e2,"Panda (for Provenance and Data), a system for data-oriented workflows that supports debugging and drill-down using logical provenance-provenance information stored at the processing-node level is demonstrated. In this demonstration, Panda is used to integrate, process, and analyze actual education data from multiple sources.",data oriented architecture,155
70804d851dfe5995fce4eb99c065c0af481c8ce4,filtered,semantic_scholar,2013 IEEE 29th International Conference on Data Engineering (ICDE),2013-01-01,semantic_scholar,logical provenance in data-oriented workflows?,https://www.semanticscholar.org/paper/70804d851dfe5995fce4eb99c065c0af481c8ce4,"We consider the problem of defining, generating, and tracing provenance in data-oriented workflows, in which input data sets are processed by a graph of transformations to produce output results. We first give a new general definition of provenance for general transformations, introducing the notions of correctness, precision, and minimality. We then determine when properties such as correctness and minimality carry over from the individual transformations' provenance to the workflow provenance. We describe a simple logical-provenance specification language consisting of attribute mappings and filters. We provide an algorithm for provenance tracing in workflows where logical provenance for each transformation is specified using our language. We consider logical provenance in the relational setting, observing that for a class of Select-Project-Join (SPJ) transformations, logical provenance specifications encode minimal provenance. We have built a prototype system supporting the features and algorithms presented in the paper, and we report a few preliminary experimental results.",data oriented architecture,156
