doi,type,publication,publisher,publication_date,database,title,url,abstract,domain,id
92229332f42836d60c1977fd26dfff630853d401,filtered,semantic_scholar,,1998-01-01,semantic_scholar,"requirement capture, formal description and verification of an invoicing system",https://www.semanticscholar.org/paper/92229332f42836d60c1977fd26dfff630853d401,"The Invoicing case study is a typical business system proposed by Henri Habrias as a common example for a contest on the capacity of particular formal methods to capture requirements from the client. For this, the case study is informally described by half a page of English text. In this report, we use the formal description technique LOTOS for requirement capture, formal description and verification of the Invoicing case study. First, we analyse and interpret the informal requirements of the case study using the LOTOS approach for description of systems. This leads to a set of twenty questions about the informal description. By answering to these questions, we obtain a high-level specification architecture that can be formalised. Then, we present the formal description of the case study in LOTOS and, for comparison, in E-LOTOS, the new version of LOTOS currently being standardized. Since LOTOS allows a balance to be struck between process-oriented and data-oriented modeling, descriptions in both styles are given. After that, we verify the LOTOS descriptions by model-checking using the CADP (CAESAR/ALDEBARAN) toolbox. The underlying Labelled Transition System (LTS) models corresponding to various scenarios are generated using the CAESAR compiler. We push further the analysis of the case study by formalizing in temporal logic six properties of the system. We verify these properties on the LTS models using the XTL model-checker. Finally, we study the equivalence of the process-oriented and data-oriented descriptions using the ALDEBARAN tool.",data oriented architecture,100
7261028c80d1ac82828f26c46318557a50c42176,filtered,semantic_scholar,,2007-01-01,semantic_scholar,biofederator: a data federation system for bioinformatics on the web,https://www.semanticscholar.org/paper/7261028c80d1ac82828f26c46318557a50c42176,"A problem facing many bioinformatics researchers today is the aggregation and analysis of vast amounts of data produced by large scale projects from various laboratories around the world. Depositing such data into centralized web-based repositories (e.g. NCBI, UCSCGenome Browser) is the common approach. However, the distributed nature of the data, its growth rate, and increased collaborative needs represent real challenges calling for novel decentralized web architectures. The BioFederator is a web services-based data federation architecture for bioinformatics applications. Based on collaborations with bioinformatics researchers, several domainspecific data federation challenges and needs are identified. The BioFederator addresses such challenges and provides an architecture that incorporates a series of utility services. These address issues like automatic workflow composition, domain semantics, and the distributed nature of the data. It also incorporates a series of data-oriented services that facilitate the actual integration of data. The BioFederator is deployed on a grid environment over the web. The proposed design, services, and usage scenarios are discussed in detail. We demonstrate how our architecture can be leveraged for a real-world bioinformatics problem involving tissue specificity of gene expression.",data oriented architecture,101
52c5ec6acd2dfb2194ec655bd695474f76876754,filtered,semantic_scholar,,2003-01-01,semantic_scholar,when theory meets practice: building traffic control systems made easy,https://www.semanticscholar.org/paper/52c5ec6acd2dfb2194ec655bd695474f76876754,"Two separate road developments in traffic management in the Netherlands have been the Motorway Traffic Control Architecture (MTCA) and the implementation of data-oriented middleware by Trinite in the first Traffic Management Centre in the Netherlands. The move towards integration in different systems at the traffic management level is described. The principles behind the MTCA are outlined. The architecture had to offer a framework for existing and future traffic control (TC) measures, to adopt an infrastruture-oriented approach and the different parts had to be integrated. Measures are controlled by so-called Traffic Controls, software components that are based on the composite design pattern. The programmable distributed architecture developed by Trinite is the platform on which Traffic Controls are realised in the software. The implementation of an infrastructural system with Traffic Controls involves determining the information needs, adding information elements and adding functionality.",data oriented architecture,102
ea3dcf5053cde3f444d270b8dc29a0eeac585621,filtered,semantic_scholar,ArXiv,2017-01-01,semantic_scholar,hardscope: thwarting dop with hardware-assisted run-time scope enforcement,https://www.semanticscholar.org/paper/ea3dcf5053cde3f444d270b8dc29a0eeac585621,"Widespread use of memory unsafe programming languages (e.g., C 
and C++) leaves many systems vulnerable to memory corruption 
attacks. A variety of defenses have been proposed to mitigate attacks 
that exploit memory errors to hijack the control flow of the code 
at run-time, e.g., (fine-grained) randomization or Control Flow Integrity. However, recent work on data-oriented programming (DOP) 
demonstrated highly expressive (Turing-complete) attacks, even in 
the presence of these state-of-the-art defenses. Although multiple 
real-world DOP attacks have been demonstrated, no efficient defenses are yet available. We propose run-time scope enforcement 
(RSE), a novel approach designed to efficiently mitigate all currently 
known DOP attacks by enforcing compile-time memory safety constraints (e.g., variable visibility rules) at run-time. We present HardScope, a proof-of-concept implementation of hardware-assisted 
RSE for the new RISC-V open instruction set architecture. We 
discuss our systematic empirical evaluation of HardScope which 
demonstrates that it can mitigate all currently known DOP attacks, 
and has a real-world performance overhead of 3.2% in embedded 
benchmarks.",data oriented architecture,103
c641fb970edff6345974c540394e94e2e58e6f67,filtered,semantic_scholar,,2014-01-01,semantic_scholar,high-performance big data management across cloud data centers,https://www.semanticscholar.org/paper/c641fb970edff6345974c540394e94e2e58e6f67,"The easily-accessible computation power offered by cloud infrastructures coupled with the revolution of Big Data are expanding the scale and speed at which data analysis is performed. The cloud resources for computation and storage are spread among globally distributed data centers. Enabling fast data transfers in such scenarios becomes particularly important for scientific applications for which moving the processing close to data is rather expensive or not feasible (e.g. genome mapping, high-energy physics simulations, large sensors network). Analyzing how clouds can become “Big Data - friendly”, and what are the best options to provide data-oriented cloud services to address applications needs are the key goals of this thesis. In this talk, we present our contributions for providing high performance data management for applications running across multiple cloud data centers. We start by focusing on the scalability aspects of single-site processing and show how the MapReduce model can be extended across multi-sites. Next, we present a transfer service architecture that enables configurable cost-performance optimizations for inter-site transfers. This transfer scheme is then leveraged in the context of real-time streaming across cloud data centers. Finally, we investigate the viability of leveraging this data movement solution as a cloud-provided service, following a Transfer-as-a-Service paradigm based on a flexible pricing scheme.",data oriented architecture,104
f6b19b56439769bb7a1e0d7c4660393fceac5d9f,filtered,semantic_scholar,SSDBM,2008-01-01,semantic_scholar,ivip - a scientific workflow system to support experts in spatial planning of crop production,https://www.semanticscholar.org/paper/f6b19b56439769bb7a1e0d7c4660393fceac5d9f,"Decision making for crop production planning is essentially driven by location-based or more precisely by space-oriented information. Therefore, farmers and regional experts in the field mostly rely on new spatial-data-oriented decision making tools. IVIP is a prototype for a Web-based Spatial Decision Support System (WSDSS) demonstrating the benefits of location-based decision making using digitalized geographic information about ground allocation and soil quality. We present how the library of potential models for the IVIP WSDSS has been realized by extending the Scientific Workflow Management System Kepler that assists the collaboration of agricultural experts and computer scientists during model development. We first describe the requirements of our WSDSS, and then give a short introduction to the Kepler platform and explain in detail which extensions have been realized: cascading client-server architecture, spatial operations support, and WSDL interface. Finally, we illustrate how the biomass yield model has been modeled in our system.",data oriented architecture,105
23ac46cc5175021e9b65b869150fab041de93606,filtered,semantic_scholar,ArXiv,2013-01-01,semantic_scholar,a practical approach to ontology-enabled control systems for astronomical instrumentation,https://www.semanticscholar.org/paper/23ac46cc5175021e9b65b869150fab041de93606,"Even though modern service-oriented and data-oriented architectures promise to deliver loosely coupled control systems, they are inherently brittle as they commonly depend on a priori agreed interfaces and data models. At the same time, the Semantic Web and a whole set of accompanying standards and tools are emerging, advocating ontologies as the basis for knowledge exchange. In this paper we aim to identify a number of key ideas from the myriad of knowledge-based practices that can readily be implemented by control systems today. We demonstrate with a practical example (a three-channel imager for the Mercator Telescope) how ontologies developed in the Web Ontology Language (OWL) can serve as a meta-model for our instrument, covering as many engineering aspects of the project as needed. We show how a concrete system model can be built on top of this meta-model via a set of Domain Specific Languages (DSLs), supporting both formal verification and the generation of software and documentation artifacts. Finally we reason how the available semantics can be exposed at run-time by adding a ""semantic layer"" that can be browsed, queried, monitored etc. by any OPC UA-enabled client.",data oriented architecture,106
ca56089de18fc6b2ad67408dfdf1411bbce37c1a,filtered,semantic_scholar,,1999-01-01,semantic_scholar,software architecture of the u-70 accelerator complex new control system,https://www.semanticscholar.org/paper/ca56089de18fc6b2ad67408dfdf1411bbce37c1a,"The software of the new control system of the 70GeV accelerator complex is built around the distributed real time DBMS SSUDA with emphasis on control of technological process, not equipment. SSUDA was designed to store current states of dynamic parameters and supports 3-D tables. The tables are distributed around all levels of the CS, including equipment controllers. So, DB access protocols are used to access ECs. There are only two data-oriented atomic objects that applications deal with: vector and structure. All tasks interact exclusively through DBs and each task belongs to one of three weakly related types: data processing, hardware I/O and manmachine interface. The organization of parameter value storage is standardized, so data processing and I/O applications are highly unified. Only the console program serves the MMI for all tasks that are solved by operators and accelerator physicists.",data oriented architecture,107
30de295c1412f57fc92e3b3a1bbc7bd71f0ebfee,filtered,semantic_scholar,ICSOC Workshops,2011-01-01,semantic_scholar,data flow-oriented process mining to support security audits,https://www.semanticscholar.org/paper/30de295c1412f57fc92e3b3a1bbc7bd71f0ebfee,"The automated execution of dynamically-evolving business processes in service-oriented architectures requires audit methods to assert that they fulfill required security properties. Process mining techniques can provide models for the actual process behavior, but mostly disregard the dynamics of processes running in highly flexible environments and neglect the data flow perspective. This research plan is on novel data-oriented mining techniques to tackle these shortcomings in order to support effective security audits.",data oriented architecture,108
26c3b18f7a5ee7adee14245654e887d728a8570b,filtered,semantic_scholar,,2018-01-01,semantic_scholar,on efficient data exchange in multicore architectures,https://www.semanticscholar.org/paper/26c3b18f7a5ee7adee14245654e887d728a8570b,"In contemporary multicore architectures, three trends can be observed: (i) A growing number of cores, (ii) shared memory as the primary means of communication and data exchange and (iii) high diversity between platform architectures. Still, these platforms are typically programmed manually on a core-by-core basis; the most helpful tool that is widely accepted are library implementations of frequently used algorithms. This complicated task of multicore programming will grow further in complexity with the increasing numbers of cores. In addition, the constant change in architecture designs and thus in platform-specific programming demands will continue to make it laborious to migrate existing code to new platforms. State-of-the-art methods of automatic multicore code generation only partially meet the requirements of modern multicore platforms. They typically have a high overhead for different threads when growing numbers of cores and thus shrinking thread granularities demand the opposite. Also, they typically use message passing models for implementing data exchange when memory sharing should be the natural mode of data exchange. As a result, they often fail to produce efficient code, especially when large data throughput is required. This thesis proposes a data-oriented approach to multicore programming. It shows how dividing a program into discrete tasks with clearly specified inputs and outputs helps to formalise the problem of optimising high data throughput applications for a large range of multicore architectures, at the same time enabling an efficient, low-overhead implementation. In detail, its contributions are as follows. • Inefficiencies in existing programming models are demonstrated for the cases of the CAL actor language and Kahn process networks. Methods are shown to reduce these inefficiencies. • Ladybirds, a specificationmodel and language for parallel programs is presented. A Ladybirds program consists of a tasks with clearly defined inputs and outputs and of dependencies between them. It is explained how Ladybirds aims at execution efficiency also in the domains of data placement and transport and what steps are necessary to get from a Ladybirds specification to executable program code.The examples of comfortable debugging and ofminimising state retention overhead for transient systems underline the usability and versatility of Ladybirds. • An optimisation method for Ladybirds programs on the Kalray MPPA platform is presented. It tries to place data on different memory banks such as to avoid access conflicts. Afterwards, the Ladybirds optimisation problem for",data oriented architecture,109
d581245d95ee49532968413a9a4a695634cd3744,filtered,semantic_scholar,SECRYPT,2021-01-01,semantic_scholar,a unified model to detect information flow and access control violations in software architectures,https://www.semanticscholar.org/paper/d581245d95ee49532968413a9a4a695634cd3744,"Software architectures allow identifying confidentiality issues early and in a cost-efficient way. Information Flow (IF) and Access Control (AC) are established confidentiality mechanisms, so modeling and analysis approaches should support them. Because confidentiality issues often trace back to data usage, data-oriented approaches are promising. However, we could not identify a data-oriented approach handling both, IF and AC. Therefore, we present a unified data-oriented modeling and analysis approach supporting both, IF and AC, within the same model in this paper. We demonstrate the integration into an existing architectural description language and evaluate the resulting expressiveness and accuracy by a case study considering 22 cases.",data oriented architecture,110
d4d7701d4fdebddccef04ba1a2715820fffdfb10,filtered,semantic_scholar,Workshop on Information Integration on the Web,2001-01-01,semantic_scholar,"data-driven, xml-based web management in highly personalized environments",https://www.semanticscholar.org/paper/d4d7701d4fdebddccef04ba1a2715820fffdfb10,"In the domain of XML-based Web applications, sets of XML documents derived from heterogeneous data sources are to be managed. The deployment o XML offers a single and common data model which allows these sets to consider under a data-oriented perspective and to compose their elements to a single, logica XML document. The introduction of a logical representation of the underlying data by a so-called unified view enables comprehensive personalization and customization, because the document structure as well as its graphical presentation can be changed and adapted independently. The intention of this paper is to discuss the idea of building the unified view. Therefore, an overview of the corresponding architecture is given and basic strategies for the building process are presented.",data oriented architecture,111
d61555ba40f6c5a3f7bf36333534c1e28f8f62d9,filtered,semantic_scholar,ICA3PP,2009-01-01,semantic_scholar,a software transactional memory service for grids,https://www.semanticscholar.org/paper/d61555ba40f6c5a3f7bf36333534c1e28f8f62d9,"In-memory data sharing for grids allow location-transparent access to data stored in volatile memory. Existing Grid middlewares typ- ically support only explicit data transfer between Grid nodes. We be- lieve that Grid systems benefit from complementing traditional message- passing techniques with a data-oriented sharing technique. The latter includes automatic replica management, data consistency, and location- transparent access. As a proof of concept, we are implementing a POSIX- compatible object sharing service as part of the EU-funded XtreemOS project, which builds a Linux-based Grid operating system. In this paper we describe the software architecture of the object sharing service and design decisions including transactional consistency and peer-to-peer net- work structure. We also present preliminary evaluation results analyzing lower-bound transaction-overhead using a parallel raytracing application.",data oriented architecture,112
60881ba191ac396c88bf081b940b547c51d1b5b0,filtered,semantic_scholar,,1999-01-01,semantic_scholar,a scalable service architecture for computer-telephony integration,https://www.semanticscholar.org/paper/60881ba191ac396c88bf081b940b547c51d1b5b0,"The convergence of traditional voice-oriented telecommunications networks and data-oriented computer communications networks is yielding new challenges for building systems equally adept at handling voice and data applications. While there is much discussion about packetized voice over IP networks, a little explored opportunity is the ability to more easily deploy innovative new services based on the Internet’s client-server paradigm and the ease with which software agents can be introduced and migrated around the network. We discuss our new architecture for middleware services that more effectively enables the integration of telephone and data application. This horizontally-integrated architecture supports competition between interchangeable service implementations, based upon features, cost, etc. It is characterized by pervasive and seamless access across multiple cascaded networks. We describe our experiences in integrating an Internet-based core with cellular and other access networks, and our analysis of IP performance in this testbed using a graphical multi-layer protocol analysis tool. Based on our architecture, we have developed prototype converged applications for voice-actuated room control and personal “universal in-box” information management.",data oriented architecture,113
7e9647ea45c28306b39c64d04acbdad35654f720,filtered,semantic_scholar,"2009 Third International Conference on Emerging Security Information, Systems and Technologies",2009-01-01,semantic_scholar,runtime protection via dataflow flattening,https://www.semanticscholar.org/paper/7e9647ea45c28306b39c64d04acbdad35654f720,"Software running on an open architecture, such as the PC, is vulnerable to inspection and modification. Since software may process valuable or sensitive information, many defenses against data analysis and modification have been proposed. This paper complements existing work and focuses on hiding data location throughout program execution. To achieve this, we combine three techniques: (i) periodic reordering of the heap, (ii) migrating local variables from the stack to the heap and (iii) pointer scrambling. By essentially flattening the dataflow graph of the program, the techniques serve to complicate static dataflow analysis and dynamic data tracking. Our methodology can be viewed as a data-oriented analogue of control-flow flattening techniques. Dataflow flattening is useful in practical scenarios like DRM, information-flow protection, and exploit resistance. Our prototype implementation compiles C programs into a binary for which every access to the heap is redirected through a memory management unit. Stack-based variables may be migrated to the heap, while pointer accesses and arithmetic may be scrambled and redirected. We evaluate our approach experimentally on the SPEC CPU2006 benchmark suite.",data oriented architecture,114
c4a6463cec7b29136a9f858d7bbb8e6a98772fa6,filtered,semantic_scholar,"2009 12th Euromicro Conference on Digital System Design, Architectures, Methods and Tools",2009-01-01,semantic_scholar,run-time reconfigurable array using magnetic ram,https://www.semanticscholar.org/paper/c4a6463cec7b29136a9f858d7bbb8e6a98772fa6,"This paper presents the implementation of a coarse-grained Magnetic RAM based Reconfigurable Array. The Reconfigurable Array architecture is organized as a one- dimensional array of programmable ALU, with the configura- tion bits stored in magnetic random-access memories. The use of MRAM technology to implement run-time reconfigurable hardware devices is a very promising technological solution because MRAM can provide non-volatility with cell areas and access speeds comparable to those of SRAM, and with lower process complexity than flash memory. This type of coarse- grained array, where each reconfigurable element computes on 4-bit or larger input words, is more suitable to execute data-oriented algorithms and is more able to exploit larger amounts of operation-level parallelism than common fine- grained architectures. By substantially reducing the overhead for configurability, this coarse-grain architecture is also more apt to efficiently exploit run-time reconfiguration and therefore to take advantage of multi-context MRAM-based configuration memories. Keywords-reconfigurable array; MRAM; programmable fab- rics;",data oriented architecture,115
826ac2113812ee288da45f585759f81318ce4c85,filtered,semantic_scholar,,2017-01-01,semantic_scholar,information management for enabling systems medicine,https://www.semanticscholar.org/paper/826ac2113812ee288da45f585759f81318ce4c85,"Abstract Systems medicine is a data-oriented approach in research and clinical practice to support study and treatment of complex diseases. It relies on well-defined information management processes providing comprehensive and up to date information as basis for electronic decision support. The authors suggest a three-layer information technology (IT) architecture for systems medicine and a cyclic data management approach including a knowledge base that is dynamically updated by extract, transform, and load (ETL) procedures. Decision support is suggested as case-based and rule-based components. Results are presented via a user interface to acknowledging clinical requirements in terms of time and complexity. The systems medicine application was implemented as a prototype.",data oriented architecture,116
