doi,type,publication,publisher,publication_date,database,title,url,abstract,domain,id
10.1109/iccda.2010.5540715,filtered,2010 International Conference On Computer Design and Applications,IEEE,2010-06-27 00:00:00,ieeexplore,data-oriented architecture for double and single bits error correction using cycle redundancy code,https://ieeexplore.ieee.org/document/5540715/,"Error occurs during transferring, storing and retrieving data. Thus error detection and correction is a necessary technique in information technology. Cycle Redundancy Code, CRC, is a common method in error detection. A new method based on data-oriented theory for single and double bit errors correction by using CRC is presented. The conceptual model of presented method as data-oriented architecture is designed to implement it with hardware. This method is able to determine the exact place of one and two bits in error and correct them. In a way, nonzero calculated remainder on receiver is compared with remainder field of the content of Problem Solution Data Structure, PSDS, to find the error location, as a solution.",data oriented architecture,1
10.1109/icacc.2010.5487131,filtered,2010 2nd International Conference on Advanced Computer Control,IEEE,2010-03-29 00:00:00,ieeexplore,data-oriented architecture of ln function,https://ieeexplore.ieee.org/document/5487131/,"In this paper a new architecture to calculate Ln function based on data-oriented theory is introduced. Because of using proper and huge amount of data in modeling, implementing of this type of models causes less calculation complexity. Data-oriented architecture is made of considering memory and small calculation unit together. Proposed method calculates Ln function faster than common methods.",data oriented architecture,2
10.1109/icetc.2010.5529337,filtered,2010 2nd International Conference on Education Technology and Computer,IEEE,2010-06-24 00:00:00,ieeexplore,data-oriented architecture of sine,https://ieeexplore.ieee.org/document/5529337/,"A data-oriented architecture is introduced to calculate Sine function by using sine data-oriented model as a data structure and a small calculation unit. The main contribution of this paper is to use a content-accessed memory to handle and manage data-oriented model of sine in this architecture. Using this architecture, sine function calculation will be fast.",data oriented architecture,3
10.1109/icacte.2010.5579358,filtered,2010 3rd International Conference on Advanced Computer Theory and Engineering(ICACTE),IEEE,2010-08-22 00:00:00,ieeexplore,data-oriented architecture of sine and cosine functions,https://ieeexplore.ieee.org/document/5579358/,"In this paper a new architecture to calculate Sine and Cosine Function based on data-oriented theory is introduced. To compute sine and cosine by this model less mathematical operations are needed comparing to common methods. Therefore, hardware implementation of this architecture provides faster module.",data oriented architecture,4
10.1109/icepe.2014.6970070,filtered,2014 International Conference and Exposition on Electrical and Power Engineering (EPE),IEEE,2014-10-18 00:00:00,ieeexplore,domain specific languages in power systems engineering,https://ieeexplore.ieee.org/document/6970070/,"This paper proposes an information system for data mining that allows the specification of ad-hoc queries on a data warehouse, which contain historical information relative to exceptions (i.e., operating faults) recorded by a SCADA system in a power distribution network. The proposed application can be used by the power system engineers to explore the existent historical data, with no need for any “low level” programming expertise. The data-oriented architecture of the system provides important advantages related to application development and system maintainability.",data oriented architecture,5
10.1109/icmss.2010.5577074,filtered,2010 International Conference on Management and Service Science,IEEE,2010-08-26 00:00:00,ieeexplore,research of soa-based crm in telecommunications industry,https://ieeexplore.ieee.org/document/5577074/,"This paper first analyzes the architecture of the existing CRM in operators and its disadvantages. When operators integrate the 3G services into their business, it is necessary to propel their business support system shift from DOA (data-oriented architecture) to SOA (service-oriented architecture).Then an architecture of the CRM system based on SOA is presented. The paper finally takes an example of how to integrate the CRM and SFS based on SOA.",data oriented architecture,6
10.1109/lcomm.2016.2645768,filtered,IEEE Communications Letters,IEEE,2017-04-01 00:00:00,ieeexplore,broadcast-based content delivery in information-centric hybrid multihop wireless networks,https://ieeexplore.ieee.org/document/7801039/,"Information-centric networking is a “data-oriented” architecture for Future Internet. Since unicast routing cannot exploit the natural broadcast property of wireless networks and unicast paths may be broken down frequently due to node mobility, broadcast transmission is applied for content delivery in information-centric multihop wireless networks. It will face two key challenges: which nodes that receive the broadcasted packet should forward it, and how to avoid multiple nodes simultaneously transmitting it. In this letter, we solve these two issues by taking node mobility and available link capacity into account. A mobility-based forward node selection algorithm is proposed, which tends to select the less mobility nodes as the forward ones. An available link capacity-based forwarding scheme is proposed, which tends to select forward nodes with larger available link capacities to forward packets. Simulation results demonstrate the effectiveness of the proposed mechanism.",data oriented architecture,7
http://arxiv.org/abs/1706.03968v2,filtered,arxiv,arxiv,2017-06-13 00:00:00,arxiv,asynchronous graph pattern matching on multiprocessor systems,http://arxiv.org/abs/1706.03968v2,"Pattern matching on large graphs is the foundation for a variety of
application domains. Strict latency requirements and continuously increasing
graph sizes demand the usage of highly parallel in-memory graph processing
engines that need to consider non-uniform memory access (NUMA) and concurrency
issues to scale up on modern multiprocessor systems. To tackle these aspects,
graph partitioning becomes increasingly important. Hence, we present a
technique to process graph pattern matching on NUMA systems in this paper. As a
scalable pattern matching processing infrastructure, we leverage a
data-oriented architecture that preserves data locality and minimizes
concurrency-related bottlenecks on NUMA systems. We show in detail, how graph
pattern matching can be asynchronously processed on a multiprocessor system.",data oriented architecture,8
http://arxiv.org/abs/1310.5488v1,filtered,arxiv,arxiv,2013-10-21 00:00:00,arxiv,"a practical approach to ontology-enabled control systems for
  astronomical instrumentation",http://arxiv.org/abs/1310.5488v1,"Even though modern service-oriented and data-oriented architectures promise
to deliver loosely coupled control systems, they are inherently brittle as they
commonly depend on a priori agreed interfaces and data models. At the same
time, the Semantic Web and a whole set of accompanying standards and tools are
emerging, advocating ontologies as the basis for knowledge exchange. In this
paper we aim to identify a number of key ideas from the myriad of
knowledge-based practices that can readily be implemented by control systems
today. We demonstrate with a practical example (a three-channel imager for the
Mercator Telescope) how ontologies developed in the Web Ontology Language (OWL)
can serve as a meta-model for our instrument, covering as many engineering
aspects of the project as needed. We show how a concrete system model can be
built on top of this meta-model via a set of Domain Specific Languages (DSLs),
supporting both formal verification and the generation of software and
documentation artifacts. Finally we reason how the available semantics can be
exposed at run-time by adding a ""semantic layer"" that can be browsed, queried,
monitored etc. by any OPC UA-enabled client.",data oriented architecture,9
,filtered,core,International Foundation for Telemetering,2008-10-01 00:00:00,core,a data-oriented software architecture for telemetry,,"ITC/USA 2008 Conference Proceedings / The Forty-Fourth Annual International Telemetering Conference and Technical Exhibition / October 27-30, 2008 / Town and Country Resort & Convention Center, San Diego, CaliforniaBuilding modern telemetry systems is fraught with challenges involving subsystem integration, the role and management of data, scalability issues, disparate technologies, concerns about cost-effectiveness and more. This article addresses today's challenges with a solution based on adopting a data-oriented architecture and relying on a standards-based, integrated high-performance middleware platform with standards-based programmable components. Key to the solution is integrating around the system information model instead of the application or technology infrastructure. A standards-based middleware infrastructure that breaks away from traditional assumptions is at the core of this approach. The article also presents successful applications of data-oriented architecture using standards-based middleware.International Foundation for TelemeteringProceedings from the International Telemetering Conference are made available by the International Foundation for Telemetering and the University of Arizona Libraries. Visit http://www.telemetry.org/index.php/contact-us if you have questions about items in this collection",data oriented architecture,10
10.15598/aeee.v19i4.4183,filtered,core,"'VSB Technical University of Ostrava, Faculty of Electrical Engineering and Computer Sciences'",2021-01-01 00:00:00,core,intelligent bearing fault diagnosis method based on hnr envelope and classification using supervised machine learning algorithms,https://core.ac.uk/download/490710719.pdf,"Research on data-driven bearing fault diagnosis techniques has recently drawn more and more attention due to the availability of massive condition monitoring data. The research work presented in this paper aims to develop an architecture for the detection and diagnosis of bearing faults in the induction machines. The developed data-oriented architecture uses vibration signals collected by sensors placed on the machine, which is based, in the first place, on the extraction of fault indicators based on the harmonics-to-noise ratio envelope. Normalisation is then applied to the extracted indicators to create a well-processed data set. The evolution of these indicators will be studied afterwards according to the type and severity of defects using sequential backward selection technique. Supervised machine learning classification methods are developed to classify the measurements described by the feature vector with respect to the known modes of operation. In the last phase concerning decision making, ten classifiers are tested and applied based on the selected and combined indicators. The developed classification methods allow classifying the observations, with respect to the different modes of bearing condition (outer race, inner race fault or healthy condition). The proposed method is validated on data collected using an experimental bearing test bench. The experimental results indicate that the proposed architecture achieves high accuracy in bearing fault detection under all operational conditions. The results show that, compared to some proposed approaches, our proposed architecture can achieve better performance overall in terms of the number of optimal features and the accuracy of the tests",data oriented architecture,11
10.3390/electronics10151810,filtered,core,'MDPI AG',2021-07-01 00:00:00,core,on-board data management layer: connected vehicle as data platform,,"For connected vehicles, as well as generally for the transportation sector, data are now seen as a precious resource. They can be used to make right decisions, improve road safety, reduce CO2 emissions, or optimize processes. However, analyzing these data is not so much a question of which technologies to use, but rather about where these data are analyzed. Thereby, the emerging vehicle architecture has to become a data-oriented architecture based on embedded computing platforms and take into account new applications, artificial intelligence elements, advanced analytics, and operating systems. Accordingly, in this paper, we introduce the concept of data management to the vehicle by proposing an on-board data management layer, so that the vehicle can play the role of data platform capable of storing, processing, and diffusing data. Our proposed layer supports analytics and data science to deliver additional value from the connected vehicle data and stimulate the development of new services. In addition, our data platform can also form or contribute to shaping the backbone of data-driven transport. An on-board platform was built where the dataset size was reduced 80% and a rate of 99% accuracy was achieved in a 5 min traffic flow prediction using artificial neural networks (ANNs)",data oriented architecture,12
10.1109/hoticn50779.2020.9350821,filtered,2020 3rd International Conference on Hot Information-Centric Networking (HotICN),IEEE,2020-12-14 00:00:00,ieeexplore,hierarchical identity-based security mechanism using blockchain in named data networking,https://ieeexplore.ieee.org/document/9350821/,"Named Data Networking (NDN) with the data-centric design has been viewed as a promising future Internet architecture. It requires a new security model orienting data but not host. In this paper, a Hierarchical Identity-based Security Mechanism by Blockchain (HISM-B) is to be proposed for NDN networks. It could satisfy the two assumptions specified in the NDN testbed to maintain the data-oriented authentication. At one hand, the hierarchical identity-based cryptology is used to bind the data name with the public key and then two signatures are encapsulated in the data packet so that the data source authentication and the integrity of data packet can be supported. At the other hand, a blockchain is employed to manage public keys for different domains to avoid catastrophes due to a single node failure. The validation result shows that the proposed HISM-B is safe.",data centric architecture,13
987f1feddb599eac1c924ce5dc39f9c57e93d5e0,filtered,semantic_scholar,,2012-01-01,semantic_scholar,data-oriented architecture for system integration,https://www.semanticscholar.org/paper/987f1feddb599eac1c924ce5dc39f9c57e93d5e0,"According to the problem that,in the process of integrating large-scale distributed system,the subsystems are difficult to manage,extend,and maintenance,which caused by their different implementation technologies and tightly-coupled design.A pattern of data-oriented design is introduced,and the principle based on the pattern and the related middleware technology were discussed.A data-oriented architecture for system integration was proposed.Finally,based on the example of a real-time package tracking system-of-systems,the architecture of data-oriented integration was discussed in detail.",data oriented architecture,14
b671e6b6ad4b5cb346f19414c709f78e862da379,filtered,semantic_scholar,2019 15th International Wireless Communications & Mobile Computing Conference (IWCMC),2019-01-01,semantic_scholar,uav-gcs centralized data-oriented communication architecture for crowd surveillance applications,https://www.semanticscholar.org/paper/b671e6b6ad4b5cb346f19414c709f78e862da379,"In recent years, a large number of researchers investigate the conception of systems that use a unique Unmanned Ariel Vehicles (UAV) or multiple independent UAVs to conduct civil or military missions, with minimal human intervention. In this paper we focus on using multiple UAVs to cooperatively monitor a crowded area. Communication in such UAVs network is an ongoing project. Due to the lack of proper communication standards and rules, designing a reliable communication model is essential for: (i) multi-UAV coordination, (ii) efficient bandwidth sharing according to data priority and urgency and (iii) avoiding useless transmission of the same data by multiple UAVs. To address the above challenges, we propose a centralized data-oriented communication architecture for crowd surveillance allocations using an UAV fleet. The Ground Control Station (GCS) is used as a central coordinator to manage bandwidth usage for the UAV fleet in its coverage area. To allow UAVs to send priority messages urgently to the GCS, we define two classes of urgent messages: critical state and important result. The class of the data as well as other relevant information about the detected event will be used by the GCS to authorize or not UAV data transmission and hence to optimize the bandwidth usage efficiency.",data oriented architecture,15
6d5165205564bc98c1afcf20a1652a21f1e3e61e,filtered,semantic_scholar,,2007-01-01,semantic_scholar,data-oriented architecture: a loosely-coupled real-time soa,https://www.semanticscholar.org/paper/6d5165205564bc98c1afcf20a1652a21f1e3e61e,"2007 August "" Data dominates. If you've chosen the right data structures and organized things well, the algorithms will almost always be self-evident. Data structures, not algorithms, are central to programming. Abstract As more devices and systems get woven into the fabric of our networked world, the scale and the complexity of integration is growing at a rapid pace. Our existing methodologies and training for system software design, rooted in principles of object-oriented design, that worked superbly for small scale systems begin to break down as we discover operational limits which requires frequent and unintended redesigns in programs year over year. Fundamentally, object-oriented thinking leads us to think in terms of tightly-coupled interactions that include strong state assumptions. Large scale distributed systems are often a mix of subsystems created by independent parties, often using different middleware technologies, with misaligned interfaces. Integrating such subsystems using object-oriented thinking poses some fundamental challenges: (1) it is brittle to incremental and independent development, where interfaces can change without notice; (2) there is often an ""impedance mis-match"" between subsystems in the quantity and the quality of information that must be exchanged between the two sides; (3) there is a real need to dynamically adapt in real-time to network topology reconfigurations and failures; (4) scalability, performance, and up-time cannot always be compromised in this dynamic environment. A different paradigm is needed in order to address these new challenges in a systematic manner. As the scale of the integration and complexity grows, the only unifying common denominators between disparate subsystems (generally numbering more than two) are: (1) the data they produce and consume; (2) the services they use and offer. In order to scale, system software architecture must be organized around a common ""shared information model"" that spans multiple systems. This leads us to the principle of ""data-oriented"" design: expose the data and hide the code. In this paper, we will discuss the principles of data-oriented thinking, and discuss why it offers an appropriate paradigm to address large scale system integration. We discuss the critical role played by the middleware infrastructure in applying data-oriented design, and describe a generic data-oriented integration architecture based on the data distribution service (DDS) middleware standard. We analyze popular architectural styles including data flow architecture, event driven architecture, and service oriented architecture from this perspective and establish that they can be viewed as specializations of the generic data-oriented architecture. Finally we illustrate …",data oriented architecture,16
9fc03132540aa5d53f50b875bb4ccb620dee09ea,filtered,semantic_scholar,,2007-01-01,semantic_scholar,data-oriented architecture,https://www.semanticscholar.org/paper/9fc03132540aa5d53f50b875bb4ccb620dee09ea,"2007 January "" Data dominates. If you've chosen the right data structures and organized things well, the algorithms will almost always be self-evident. Data structures, not algorithms, are central to programming. Abstract As more devices and systems get woven into the fabric of our networked world, the scale and the complexity of integration is growing at a rapid pace. Our existing methodologies and training for system software design, rooted in principles of object-oriented design, that worked superbly for small scale systems begin to break down as we discover operational limits which requires frequent and unintended redesigns in programs year over year. Fundamentally, object-oriented thinking leads us to think in terms of tightly-coupled interactions that include strong state assumptions. Large scale distributed systems are often a mix of subsystems created by independent parties, often using different middleware technologies, with misaligned interfaces. Integrating such subsystems using object-oriented thinking poses some fundamental challenges: (1) it is brittle to incremental and independent development, where interfaces can change without notice; (2) there is often an ""impedance mis-match"" between subsystems in the quantity and the quality of information that must be exchanged between the two sides; (3) there is a real need to dynamically adapt in real-time to network topology reconfigurations and failures; (4) scalability, performance, and up-time cannot always be compromised in this dynamic environment. A different paradigm is needed in order to address these new challenges in a systematic manner. As the scale of the integration and complexity grows, the only unifying common denominators between disparate subsystems (generally numbering more than two) are: (1) the data they produce and consume; (2) the services they use and offer. In order to scale, system software architecture must be organized around a common ""shared information model"" that spans multiple systems. This leads us to the principle of ""data-oriented"" design: expose the data and hide the code. In this paper, we will discuss the principles of data-oriented thinking, and discuss why it offers an appropriate paradigm to address large scale system integration. We discuss the critical role played by the middleware infrastructure in applying data-oriented design, and describe a generic data-oriented integration architecture based on the data distribution service (DDS) middleware standard. We analyze popular architectural styles including data flow architecture, event driven architecture, and service oriented architecture from this perspective and establish that they can be viewed as specializations of the generic data-oriented architecture. Finally we illustrate …",data oriented architecture,17
f7946ea31a3da644fd59303be9fff721579987fd,filtered,semantic_scholar,IEEE Internet of Things Journal,2017-01-01,semantic_scholar,a data-oriented m2m messaging mechanism for industrial iot applications,https://www.semanticscholar.org/paper/f7946ea31a3da644fd59303be9fff721579987fd,"Machine-to-machine (M2M) communication is a key enabling technology for the future industrial Internet of Things applications. It plays an important role in the connectivity and integration of computerized machines, such as sensors, actuators, controllers, and robots. The requirements in flexibility, efficiency, and cross-platform compatibility of the intermodule communication between the connected machines raise challenges for the M2M messaging mechanism toward ubiquitous data access and events notification. This investigation determines the challenges facing the M2M communication of industrial systems and presents a data-oriented M2M messaging mechanism based on ZeroMQ for the ubiquitous data access in rich sensing pervasive industrial applications. To prove the feasibility of the proposed solution, the EU funded PickNPack production line with a reference industrial network architecture is presented, and the communication between a microwave sensor device and the quality assessment and sensing module controller of the PickNPack line is illustrated as a case study. The evaluation is carried out through qualitative analysis and experimental studies, and the results demonstrate the feasibility of the proposed messaging mechanism. Due to the flexibility in dealing with hierarchical system architecture and cross-platform heterogeneity of industrial applications, this messaging mechanism deserves extensive investigations and further evaluations.",data oriented architecture,18
