doi,type,publication,publisher,publication_date,database,title,url,abstract,domain,id
c7f42b0f6dc0e7f593035327822dafe6c5605e4a,filtered,semantic_scholar,CoNEXT '08,39448,semantic_scholar,towards a new generation of information-oriented internetworking architectures,https://www.semanticscholar.org/paper/c7f42b0f6dc0e7f593035327822dafe6c5605e4a,"In response to the limitations of the Internet architecture when used for applications for which it was not originally designed, a series of clean slate efforts have emerged to shape the so-called future Internet. Recently, visionary voices have advised a shift in the networking problem under research, moving from seamless host-reachability to internetworking of information. We contribute to the healthy debate on future Internet design and discuss ongoing information oriented efforts. Inspired by recent works in Bloom-filterlike data structures, we propose the SPSwitch as a novel switching engine to make wire speed forwarding decisions on flat information labels. We address part of the scalability issues in a data-oriented forwarding layer by trading overdeliveries for state reduction and line speed operations.",data oriented architecture,195
bb4b9316c514860dbfd54bbd50baec757e37b83d,filtered,semantic_scholar,,40909,semantic_scholar,data as a service (daas) in cloud computing,https://www.semanticscholar.org/paper/bb4b9316c514860dbfd54bbd50baec757e37b83d,"Data has become the enabling technology for many of the recent innovations. ""More data trumps smarter algorithms"" has been the mantra behind this revolution in computing. Given the rate at which the data is produced, there is need for scalable solutions to extract information out of them. Allowing the data to be stored in the cloud and be accessed without geographical and scalability limitations will remove many bottlenecks in bringing data-oriented innovations. Current cloud architecture solves the issues of accessibility and scalability, but poses several new challenges such as automatic management of the service, pricing the data, and security of the data. This talk will include several techniques to address these challenges using automatic physical design, servicebased pricing, and cryptographic mechanisms. Data Information Knowledge Intelligence.",data oriented architecture,196
6c4fca03bf42a507fcf0ef437d89a6e9f9c12b90,filtered,semantic_scholar,The IEEE symposium on Computers and Communications,40179,semantic_scholar,roles and security in a publish/subscribe network architecture,https://www.semanticscholar.org/paper/6c4fca03bf42a507fcf0ef437d89a6e9f9c12b90,"Several publish/subscribe (pub/sub) and data-oriented networking proposals have been presented to overcome limitations of the current message- and host-centric Internet. However, security issues of these solutions have not been addressed comprehensively. In this paper we examine roles of actors comprising an inter-domain pub/sub network, together with security requirements and minimal required trust associations arising from this setting. We then introduce and analyze a security design for a clean-slate pub/sub network architecture that secures both the control and data planes. The solution addresses availability and data integrity while remaining scalable and usable.",data oriented architecture,197
78f3d4f90cf3a094b7bd883d1b6b63b83f65028b,filtered,semantic_scholar,IEEE Communications Magazine,41275,semantic_scholar,on functionality separation for green mobile networks: concept study over lte,https://www.semanticscholar.org/paper/78f3d4f90cf3a094b7bd883d1b6b63b83f65028b,"Traditional wireless networks are designed for ubiquitous network access provision with low-rate voice services, which thus preserve the homogeneous architecture and tight coupling for infrastructures such as base stations. With the traffic explosion and the paradigm shift from voice-oriented services to data-oriented services, traditional homogeneous architecture no longer maintains its optimality, and heterogeneous deployment with flexible network control capability becomes a promising evolution direction. To achieve this goal, in this article, we propose a two-layer network functionality separation scheme, targeting at low control signaling overhead and flexible network reconfiguration for future mobile networks. The proposed scheme is shown to support all kinds of user activities defined in current networks. Moreover, we give two examples to illustrate how the proposed scheme can be applied to multicarrier networks and suggest two important design principles for future green networks. Numerical results show that the proposed scheme achieves significant energy reduction over traditional LTE networks, and can be recommended as a candidate solution for future green mobile networks.",data oriented architecture,198
4f762aa3881094a1c4de7fff2dac8d8f3c1106cf,filtered,semantic_scholar,IEEE Transactions on Industrial Electronics,42005,semantic_scholar,design and optimization of multiclocked embedded systems using formal techniques,https://www.semanticscholar.org/paper/4f762aa3881094a1c4de7fff2dac8d8f3c1106cf,"Today's system-on-chip and distributed systems are commonly equipped with multiple clocks. The key challenge in designing such systems is that two situations have to be captured and evaluated in a single framework. The first is the heterogeneous control-oriented and data-oriented behaviors within one clock domain, and the second is the asynchronous communications between two clock domains. In this paper, we propose to use timed automata and synchronous dataflow to model the dynamic behaviors of the multiclock train-control system, and a multiprocessor architecture for the implementation from our model to the real system. Data-oriented behaviors are captured by synchronous dataflow, control-oriented behaviors are captured by timed automata, and asynchronous communications of the interclock domain can be modeled as an interface timed automaton or a synchronous dataflow module. The behaviors of synchronous dataflow are interpreted by some equivalent timed automata to maintain the semantic consistency of the mixed model. Then, various functional properties that are important to guarantee the correctness of the system can be simulated and verified within the framework. We apply the framework to the design of a control system described in the standard IEC 61 375 and several bugs are detected. The bugs in the standard have been fixed, and the new version has been implemented and used in the real-world subway communication control system.",data oriented architecture,199
ec02fc78f7ec0d9cbef609f4386143eaa84d4ae5,filtered,semantic_scholar,ADMS@VLDB,41640,semantic_scholar,eris: a numa-aware in-memory storage engine for analytical workload,https://www.semanticscholar.org/paper/ec02fc78f7ec0d9cbef609f4386143eaa84d4ae5,"The ever-growing demand for more computing power forces hardware vendors to put an increasing number of multiprocessors into a single server system, which usually exhibits a non-uniform memory access (NUMA). In-memory database systems running on NUMA platforms face several issues such as the increased latency and the decreased bandwidth when accessing remote main memory. To cope with these NUMA-related issues, NUMA-awareness has to be considered as a major design principle for the fundamental architecture of a database system. In this paper we present ERIS, a NUMA-aware inmemory storage engine that is based on a data-oriented architecture. In contrast to existing approaches that focus on transactional workloads on a disk-based DBMS, ERIS aims at tera-scale analytical workloads that are executed entirely in main memory. ERIS uses an adaptive partitioning approach that exploits the topology of the underlying NUMA platform and significantly reduces NUMA-related issues. We evaluate ERIS on widespread standard server systems as well as on a system consisting of 64 multiprocessors and 512 cores. On these platforms, we achieve a more than linear speedup for index lookups and scalable parallel scan operations that are only limited by the available local bandwidth of the multiprocessor. Moreover, we measured a performance gain of up to 200% (index lookups) respectively 660% (column scans) in the memory-bound case compared to a NUMA-agnostic storage subsystem.",data oriented architecture,200
14fb54b6e2515274d82df8a3f15c77904ad66ddf,filtered,semantic_scholar,,34335,semantic_scholar,real-time communication in packet-switched networks,https://www.semanticscholar.org/paper/14fb54b6e2515274d82df8a3f15c77904ad66ddf,"The dramatically increased bandwidths and processing capabilities of future high-speed networks make possible many distributed real-time applications, such as sensor-based applications and multimedia services. Since these applications will have traffic characteristics and performance requirements that differ dramatically from those of current data-oriented applications, new communication network architectures, and protocols will be required. In this paper we discuss the performance requirements and traffic characteristics of various real-time applications, survey recent developments in the areas of network architecture and protocols for supporting real-time services, and develop frameworks in which these, and future, research efforts can be considered. >",data oriented architecture,201
9ea9411fa553275a9f3bc5b1467cebedd5c554a4,filtered,semantic_scholar,IEEE Commun. Mag.,35796,semantic_scholar,a programmable transport architecture with qos guarantees,https://www.semanticscholar.org/paper/9ea9411fa553275a9f3bc5b1467cebedd5c554a4,"The emergence of distributed multimedia applications exhibiting significantly more stringent quality of service requirements than conventional data-oriented applications calls for new transport protocols with different characteristics to coexist and be integrated within single applications. The different delivery requirements posed by these diverse multimedia applications often imply the need for highly customized protocol implementations. Hence, application developers are faced with the threat of code obsolescence caused by the development of even newer delivery techniques. We present an object-oriented transport architecture that allows for dynamically binding a variety of protocol stacks on a per-call basis. By binding protocol stacks together, the special needs of the application can be met without the need to rewrite the code. This differs significantly from the traditional transport architecture which assumes preinstalled transport protocol stacks that cannot be customized. To illustrate some of the advantages provided by the architecture, we describe the transport component of the first reference implementation of the 150 MPEG-4 Delivery Multimedia Integration Framework and demonstrate how quickly it was implemented in our framework.",data oriented architecture,202
1112c1cd0e7b0c96a1f5231bd1767603466d4300,filtered,semantic_scholar,CIDR,38718,semantic_scholar,turning cluster management into data management; a system overview,https://www.semanticscholar.org/paper/1112c1cd0e7b0c96a1f5231bd1767603466d4300,"This paper introduces the CondorJ2 cluster management system. Traditionally, cluster management systems such as Condor employ a process-oriented approach with little or no use of modern database system technology. In contrast, CondorJ2 employs a data-centric, 3-tier web-application architecture for all system functions (e.g., job submission, monitoring and scheduling; node configuration, monitoring and management, etc.) except for job execution. Employing a data-oriented approach allows the core challenge (i.e., managing and coordinating a large set of distributed computing resources) to be transformed from a relatively low-level systems problem into a more abstract, higher-level data management problem. Preliminary results suggest that CondorJ2’s use of standard 3-tier software represents a significant step forward to the design and implementation of large clusters (1,000 to 10,000 nodes).",data oriented architecture,203
ff156dca361d06d6ddc4754fd208d84bfe7d6bb4,filtered,semantic_scholar,,42370,semantic_scholar,information-centric networks (icn),https://www.semanticscholar.org/paper/ff156dca361d06d6ddc4754fd208d84bfe7d6bb4,"During the past decades, serious efforts have been made to propose various architectures for the future Internet. Each of those architectures has one thing in common, i.e., to focus on content delivery rather than on host-centric approaches. However, only few of them gained popularity due to their possible applications being investigated. In this chapter, we describe the overview of various future Internet architectures such as data-oriented networking architecture, content-centric networking, named-data networking, publish/subscribe, and network of information. The main objective of this chapter is to allow our readers to become familiar with the transformation of these architectures.",data oriented architecture,204
96be97fc6ec58a35601ada2e353e17b1afa09335,filtered,semantic_scholar,IEEE J. Sel. Areas Commun.,37622,semantic_scholar,a summary of the hornet project: a next-generation metropolitan area network,https://www.semanticscholar.org/paper/96be97fc6ec58a35601ada2e353e17b1afa09335,"Metropolitan area networks are currently undergoing an evolution aimed at more efficiently transport of data-oriented traffic. However, the incoming generation of metro networks is based on conventional technology, which prevents them scaling cost-effectively to ultrahigh capacities. We have developed a new architecture and set of protocols for the next generation of metro networks. The architecture, named HORNET (hybrid optoelectronic ring network), is a packet-over-wavelength-division multiplexing ring network that utilizes fast-tunable packet transmitters and wavelength routing to enable it to scale cost-effectively to ultrahigh capacities. A control-channel-based media access control (MAC) protocol enables the network nodes to share the bandwidth of the network while preventing collisions. The MAC protocol is designed to transport variable-sized packets and to provide fairness control to all network end users. The efficiency and the fairness of the MAC protocol is demonstrated with custom-designed simulations. The implementation of the MAC protocol and the survivability of the network have been demonstrated in a laboratory experimental testbed. The article summarizes the accomplishments of the HORNET project, including the design, analysis, and demonstration of a metro architecture and a set of protocols. The HORNET architecture is an excellent candidate for next-generation high-capacity metro networks.",data oriented architecture,205
4587979e037cce59feb86f54411c25e949ec555d,filtered,semantic_scholar,2010 IEEE Second International Conference on Cloud Computing Technology and Science,40179,semantic_scholar,dynamic request allocation and scheduling for context aware applications subject to a percentile response time sla in a distributed cloud,https://www.semanticscholar.org/paper/4587979e037cce59feb86f54411c25e949ec555d,"We consider geographically distributed data centers forming a collectively managed cloud computing system, hosting multiple Service Oriented Architecture (SOA) based context aware applications, each subject to Service Level Agreements (SLA). The Service Level Agreements for each context aware application require the response time of a certain percentile of the input requests to be less than a specified value for a profit to be charged by the cloud provider. We present a novel approach of data-oriented dynamic service-request allocation with gi-FIFO scheduling, in each of the geographically distributed data centers, to globally increase the profit charged by the cloud computing system. Our evaluation shows that our dynamic scheme far outperforms the commonly deployed static allocation with either First in First Out (FIFO) or Weighted Round Robin (WRR) scheduling.",data oriented architecture,206
8cc03eadb1c418dd2b927fcb5a3717fad8982033,filtered,semantic_scholar,MIS Q.,40544,semantic_scholar,design and implementation of decision support systems in the public sector,https://www.semanticscholar.org/paper/8cc03eadb1c418dd2b927fcb5a3717fad8982033,"This article examines the implications of utilizing decision support systems (DSS) in the public sector based on a DSS developed and implemented for a community mental health system. The DSS includes a multiple objective (goal programming) allocation model and encompasses a multiple party decision process. The experiences and insights acquired during the development and implementation of this DSS are relevant to public sector decision support in general. The importance of a DSS as a process-support aid rather than a product-oriented aid (i.e., simply providing answers) and the interaction of system architecture and the chosen design strategy are key insights. In particular, the distinction between model-oriented and data-oriented DSS does not appear to be appropriate. The public sector decision maker's concern with issues of equity requires the ability to operate in a higher dimensional framework than the typical spreadsheet model and there is a critical need for communication support.",data oriented architecture,207
ea835ee626baa1d719a54206f4af3f5e6349173e,filtered,semantic_scholar,Third IEEE International Conference on Data Mining,37622,semantic_scholar,a dynamic adaptive self-organising hybrid model for text clustering,https://www.semanticscholar.org/paper/ea835ee626baa1d719a54206f4af3f5e6349173e,"Clustering by document concepts is a powerful way of retrieving information from a large number of documents. This task in general does not make any assumption on the data distribution. For this task we propose a new competitive self-organising (SOM) model, namely the dynamic adaptive self-organising hybrid model (DASH). The features of DASH are a dynamic structure, hierarchical clustering, nonstationary data learning and parameter self-adjustment. All features are data-oriented: DASH adjusts its behaviour not only by modifying its parameters but also by an adaptive structure. The hierarchical growing architecture is a useful facility for such a competitive neural model which is designed for text clustering. We have presented a new type of self-organising dynamic growing neural network which can deal with the nonuniform data distribution and the nonstationary data sets and represent the inner data structure by a hierarchical view.",data oriented architecture,208
911120ae7b436fce58e857b860dfdd04ca1823f7,filtered,semantic_scholar,CoNEXT '08,39448,semantic_scholar,incentive-compatible caching and peering in data-oriented networks,https://www.semanticscholar.org/paper/911120ae7b436fce58e857b860dfdd04ca1823f7,"Several new, data-oriented internetworking architectures have been proposed recently. However, the practical deployability of such designs is an open question. In this paper, we consider data-oriented network designs in the light of the policy and incentive structures of the present internetworking economy. A main observation of our work is that none of the present proposals is both policy-compliant and incentive-compatible with the current internetworking market, which makes their deployment very challenging if not impossible. This difficulty stems from the unfounded implicit assumption that data-oriented routing policies directly reflect the underlying packet-level inter-domain policies. We find that to enable the more effective network utilization promised by data-oriented networking, essential caching incentives need to exist, and that data-oriented peering needs be considered separately from peering for packet forwarding.",data oriented architecture,209
da5b5e36c8b2ee9f1637f1f5ca0f979e3ed40319,filtered,semantic_scholar,2013 IEEE 29th Symposium on Mass Storage Systems and Technologies (MSST),41275,semantic_scholar,enabling cost-effective data processing with smart ssd,https://www.semanticscholar.org/paper/da5b5e36c8b2ee9f1637f1f5ca0f979e3ed40319,"This paper explores the benefits and limitations of in-storage processing on current Solid-State Disk (SSD) architectures. While disk-based in-storage processing has not been widely adopted, due to the characteristics of hard disks, modern SSDs provide high performance on concurrent random writes, and have powerful processors, memory, and multiple I/O channels to flash memory, enabling in-storage processing with almost no hardware changes. In addition, offloading I/O tasks allows a host system to fully utilize devices' internal parallelism without knowing the details of their hardware configurations. To leverage the enhanced data processing capabilities of modern SSDs, we introduce the Smart SSD model, which pairs in-device processing with a powerful host system capable of handling data-oriented tasks without modifying operating system code. By isolating the data traffic within the device, this model promises low energy consumption, high parallelism, low host memory footprint and better performance. To demonstrate these capabilities, we constructed a prototype implementing this model on a real SATA-based SSD. Our system uses an object-based protocol for low-level communication with the host, and extends the Hadoop MapReduce framework to support a Smart SSD. Our experiments show that total energy consumption is reduced by 50% due to the low-power processing inside a Smart SSD. Moreover, a system with a Smart SSD can outperform host-side processing by a factor of two or three by efficiently utilizing internal parallelism when applications have light trafic to the device DRAM under the current architecture.",data oriented architecture,210
72fb63afa01d87aab9b6070ab8b45c2ba308a962,filtered,semantic_scholar,HotNets-X,40544,semantic_scholar,information-centric networking: seeing the forest for the trees,https://www.semanticscholar.org/paper/72fb63afa01d87aab9b6070ab8b45c2ba308a962,"There have been many recent papers on data-oriented or content-centric network architectures. Despite the voluminous literature, surprisingly little clarity is emerging as most papers focus on what differentiates them from other proposals. We begin this paper by identifying the existing commonalities and important differences in these designs, and then discuss some remaining research issues. After our review, we emerge skeptical (but open-minded) about the value of this approach to networking.",data oriented architecture,211
3217ddafee28cd2a7db9cff8aa69051e56373da6,filtered,semantic_scholar,,34700,semantic_scholar,coordination approaches for cim,https://www.semanticscholar.org/paper/3217ddafee28cd2a7db9cff8aa69051e56373da6,"We propose a general architecture for Computer Integrated Manufacturing (CIM) based on the coordination, rather than integration, of component systems. The coordination process is achieved through inter-system dependencies controlled by a central, global coordinator. Coordination, like integration, may be either data- or application-oriented. In the case of data-oriented coordination, multidatabase technologies may be exploited to maintain global data consistency. For application-oriented coordination, the global coordinator uses operational dependencies as a basis for the invocation of methods in remote systems. We examine each of these orientations in detail and then provide a comparison of approaches. Specifically, we describe two prototype systems developed in the context of the CIM/Z project.",data oriented architecture,212
fd5324394d82b42bc33c10725d41ca36d2ef06dd,filtered,semantic_scholar,ESSoS,41275,semantic_scholar,a fully homomorphic crypto-processor design,https://www.semanticscholar.org/paper/fd5324394d82b42bc33c10725d41ca36d2ef06dd,"A KPU is a replacement for a standard CPU that natively runs encrypted machine code on encrypted data in registers and memory --- a 'crypto-processor unit', in other words. Its computations are opaque to an observer with physical access to the processor but remain meaningful to the owner of the computation. In theory, a KPU can be run in simulation and remain as secure (or otherwise) as in hardware. Any block cipher with a block-size of about a word is compatible with this developing technology, the long-term aim of which is to make it safe to entrust data-oriented computation to a remote environment. 
 
Hardware is arranged in a KPU to make the chosen cipher behave as a mathematical homomorphism with respect to computer arithmetic. We describe the architecture formally here and show that 'type-safe' programs run correctly when encrypted.",data oriented architecture,213
