doi,type,publication,publisher,publication_date,database,title,url,abstract,domain,id
10.1109/iccda.2010.5540715,filtered,2010 International Conference On Computer Design and Applications,IEEE,6/27/2010 0:00,ieeexplore,data-oriented architecture for double and single bits error correction using cycle redundancy code,https://ieeexplore.ieee.org/document/5540715/,"Error occurs during transferring, storing and retrieving data. Thus error detection and correction is a necessary technique in information technology. Cycle Redundancy Code, CRC, is a common method in error detection. A new method based on data-oriented theory for single and double bit errors correction by using CRC is presented. The conceptual model of presented method as data-oriented architecture is designed to implement it with hardware. This method is able to determine the exact place of one and two bits in error and correct them. In a way, nonzero calculated remainder on receiver is compared with remainder field of the content of Problem Solution Data Structure, PSDS, to find the error location, as a solution.",data oriented architecture,1
10.1109/icacc.2010.5487131,filtered,2010 2nd International Conference on Advanced Computer Control,IEEE,3/29/2010 0:00,ieeexplore,data-oriented architecture of ln function,https://ieeexplore.ieee.org/document/5487131/,"In this paper a new architecture to calculate Ln function based on data-oriented theory is introduced. Because of using proper and huge amount of data in modeling, implementing of this type of models causes less calculation complexity. Data-oriented architecture is made of considering memory and small calculation unit together. Proposed method calculates Ln function faster than common methods.",data oriented architecture,2
10.1109/icetc.2010.5529337,filtered,2010 2nd International Conference on Education Technology and Computer,IEEE,6/24/2010 0:00,ieeexplore,data-oriented architecture of sine,https://ieeexplore.ieee.org/document/5529337/,"A data-oriented architecture is introduced to calculate Sine function by using sine data-oriented model as a data structure and a small calculation unit. The main contribution of this paper is to use a content-accessed memory to handle and manage data-oriented model of sine in this architecture. Using this architecture, sine function calculation will be fast.",data oriented architecture,3
10.1109/icacte.2010.5579358,filtered,2010 3rd International Conference on Advanced Computer Theory and Engineering(ICACTE),IEEE,8/22/2010 0:00,ieeexplore,data-oriented architecture of sine and cosine functions,https://ieeexplore.ieee.org/document/5579358/,"In this paper a new architecture to calculate Sine and Cosine Function based on data-oriented theory is introduced. To compute sine and cosine by this model less mathematical operations are needed comparing to common methods. Therefore, hardware implementation of this architecture provides faster module.",data oriented architecture,4
10.1109/icepe.2014.6970070,filtered,2014 International Conference and Exposition on Electrical and Power Engineering (EPE),IEEE,10/18/2014 0:00,ieeexplore,domain specific languages in power systems engineering,https://ieeexplore.ieee.org/document/6970070/,"This paper proposes an information system for data mining that allows the specification of ad-hoc queries on a data warehouse, which contain historical information relative to exceptions (i.e., operating faults) recorded by a SCADA system in a power distribution network. The proposed application can be used by the power system engineers to explore the existent historical data, with no need for any “low level” programming expertise. The data-oriented architecture of the system provides important advantages related to application development and system maintainability.",data oriented architecture,5
10.1109/cse.2014.128,filtered,2014 IEEE 17th International Conference on Computational Science and Engineering,IEEE,12/21/2014 0:00,ieeexplore,exploring the benefits of introducing network coding into named data networking,https://ieeexplore.ieee.org/document/7023638/,"In recent years, the focus to optimize network transmission efficiency has evolved to adopt methods that let those intermediate data transferring nodes get involved with routing, forwarding and caching. In other words, the new network architecture designs become in favor of hop-to-hop model, instead of traditional TCP-like end-to-end model. Named data networking is a promising future internet data oriented architecture which uses names instead of addresses and exchanges or forwards interest/data pair packets at each node along the path to route data for delivery. And meanwhile Network coding (NC) is a content oriented and effective method to reduce redundancy, increase network throughput and improve robustness. Nonetheless, due to NDN's current preliminary research, less research has combined these two technologies together. This paper presents some new thoughts to study on the benefits brought by integrating network coding to NDN, which can effectively improve network utilization, strengthen caching privacy, and also promote development of the NDN architecture itself.",data oriented architecture,6
10.1109/icmss.2010.5577074,filtered,2010 International Conference on Management and Service Science,IEEE,8/26/2010 0:00,ieeexplore,research of soa-based crm in telecommunications industry,https://ieeexplore.ieee.org/document/5577074/,"This paper first analyzes the architecture of the existing CRM in operators and its disadvantages. When operators integrate the 3G services into their business, it is necessary to propel their business support system shift from DOA (data-oriented architecture) to SOA (service-oriented architecture).Then an architecture of the CRM system based on SOA is presented. The paper finally takes an example of how to integrate the CRM and SFS based on SOA.",data oriented architecture,7
10.1109/lcomm.2016.2645768,filtered,IEEE Communications Letters,IEEE,4/1/2017 0:00,ieeexplore,broadcast-based content delivery in information-centric hybrid multihop wireless networks,https://ieeexplore.ieee.org/document/7801039/,"Information-centric networking is a “data-oriented” architecture for Future Internet. Since unicast routing cannot exploit the natural broadcast property of wireless networks and unicast paths may be broken down frequently due to node mobility, broadcast transmission is applied for content delivery in information-centric multihop wireless networks. It will face two key challenges: which nodes that receive the broadcasted packet should forward it, and how to avoid multiple nodes simultaneously transmitting it. In this letter, we solve these two issues by taking node mobility and available link capacity into account. A mobility-based forward node selection algorithm is proposed, which tends to select the less mobility nodes as the forward ones. An available link capacity-based forwarding scheme is proposed, which tends to select forward nodes with larger available link capacities to forward packets. Simulation results demonstrate the effectiveness of the proposed mechanism.",data oriented architecture,8
10.1007/978-3-030-88207-5_17,filtered,"Cooperative Design, Visualization, and Engineering",Springer,1/1/2021 0:00,springer,building a big data oriented architecture for enterprise integration,http://link.springer.com/openurl/fulltext?id=doi:10.1007/978-3-030-88207-5_17,"Digital transformation is happening across all industries and affecting all facets of our daily life. However, in many corporations, this important process is fragmented and is undertaken without a farsighted plan to take advantage of an invaluable resource: data. This can be due to a variety of reasons, for example, lack of funding, poor business vision, inappropriate consulting or deployment. Digital transformation is a considerable investment since it will determine the system’s ability to grow and adapt to the company’s changing requirements. To achieve that end, the architecture must be flexible both in development and deployment and must also be able to harness the ever-increasing data of the corporation. Among the widely used information system architectures being used in the world, Micro-service is a standout with many advantages. The adaptation of this architecture to work with Big Data, as well as to tackle different aspects of a data system such as load-balancing, file handling and storage, etc. is a very practical area of research. This paper presents such an enterprise integration solution for a mega-corporation client in Vietnam, the An Pha Petrol Group Joint Stock Company, including the architecture and technologies used to build a comprehensive system that brings novel experiences to its 2,000 internal users. It consists of building the information infrastructure and system, super applications for both desktop and mobile devices to enhance the work performance and quality. The approaches and results of this paper are applicable to similar large enterprise solutions.",data oriented architecture,9
10.1007/978-3-319-44881-7_1,filtered,Resource Management for Big Data Platforms,Springer,1/1/2016 0:00,springer,performance modeling of big data-oriented architectures,http://link.springer.com/openurl/fulltext?id=doi:10.1007/978-3-319-44881-7_1,"Big Data applications provide new, disruptive tools to advance our knowledge about the mechanisms that characterize complex aspects of reality. Be it a high energy physics experiment or an analysis of social networks data, the strength of the approach is the availability of a huge richness of data; but, at the same time, it is also the main challenge, as this abundance of information must be processed at a bearable cost per information unit and requires higher scale systems to provide enough computing power. This is only possible if the Big Data platform is properly managed and exploited according to the needs of the applications, and a fundamental premise is the capability for a proper performance evaluation of the platform. In this chapter, we provide a glance over the main aspects of performance evaluation for Big Data architectures, together with some examples of model-based evaluation, in order to show how it is possible to characterize big scale architectures to support their correct management, and suggest a methodological coarse grain solution to exploit different conceptual and technical tools to integrate a flexible, model-based, performance analysis supported approach to Big Data systems design, capable of scaling up easily in the core evaluation stage means of Markovian agents.",data oriented architecture,10
http://arxiv.org/abs/1706.03968v2,filtered,arxiv,arxiv,6/13/2017 0:00,arxiv,asynchronous graph pattern matching on multiprocessor systems,http://arxiv.org/abs/1706.03968v2,"Pattern matching on large graphs is the foundation for a variety of
application domains. Strict latency requirements and continuously increasing
graph sizes demand the usage of highly parallel in-memory graph processing
engines that need to consider non-uniform memory access (NUMA) and concurrency
issues to scale up on modern multiprocessor systems. To tackle these aspects,
graph partitioning becomes increasingly important. Hence, we present a
technique to process graph pattern matching on NUMA systems in this paper. As a
scalable pattern matching processing infrastructure, we leverage a
data-oriented architecture that preserves data locality and minimizes
concurrency-related bottlenecks on NUMA systems. We show in detail, how graph
pattern matching can be asynchronously processed on a multiprocessor system.",data oriented architecture,11
http://arxiv.org/abs/1310.5488v1,filtered,arxiv,arxiv,10/21/2013 0:00,arxiv,"a practical approach to ontology-enabled control systems for
  astronomical instrumentation",http://arxiv.org/abs/1310.5488v1,"Even though modern service-oriented and data-oriented architectures promise
to deliver loosely coupled control systems, they are inherently brittle as they
commonly depend on a priori agreed interfaces and data models. At the same
time, the Semantic Web and a whole set of accompanying standards and tools are
emerging, advocating ontologies as the basis for knowledge exchange. In this
paper we aim to identify a number of key ideas from the myriad of
knowledge-based practices that can readily be implemented by control systems
today. We demonstrate with a practical example (a three-channel imager for the
Mercator Telescope) how ontologies developed in the Web Ontology Language (OWL)
can serve as a meta-model for our instrument, covering as many engineering
aspects of the project as needed. We show how a concrete system model can be
built on top of this meta-model via a set of Domain Specific Languages (DSLs),
supporting both formal verification and the generation of software and
documentation artifacts. Finally we reason how the available semantics can be
exposed at run-time by adding a ""semantic layer"" that can be browsed, queried,
monitored etc. by any OPC UA-enabled client.",data oriented architecture,12
,filtered,core,International Foundation for Telemetering,10/1/2008 0:00,core,a data-oriented software architecture for telemetry,,"ITC/USA 2008 Conference Proceedings / The Forty-Fourth Annual International Telemetering Conference and Technical Exhibition / October 27-30, 2008 / Town and Country Resort & Convention Center, San Diego, CaliforniaBuilding modern telemetry systems is fraught with challenges involving subsystem integration, the role and management of data, scalability issues, disparate technologies, concerns about cost-effectiveness and more. This article addresses today's challenges with a solution based on adopting a data-oriented architecture and relying on a standards-based, integrated high-performance middleware platform with standards-based programmable components. Key to the solution is integrating around the system information model instead of the application or technology infrastructure. A standards-based middleware infrastructure that breaks away from traditional assumptions is at the core of this approach. The article also presents successful applications of data-oriented architecture using standards-based middleware.International Foundation for TelemeteringProceedings from the International Telemetering Conference are made available by the International Foundation for Telemetering and the University of Arizona Libraries. Visit http://www.telemetry.org/index.php/contact-us if you have questions about items in this collection",data oriented architecture,13
10.15598/aeee.v19i4.4183,filtered,core,"'VSB Technical University of Ostrava, Faculty of Electrical Engineering and Computer Sciences'",1/1/2021 0:00,core,intelligent bearing fault diagnosis method based on hnr envelope and classification using supervised machine learning algorithms,https://core.ac.uk/download/490710719.pdf,"Research on data-driven bearing fault diagnosis techniques has recently drawn more and more attention due to the availability of massive condition monitoring data. The research work presented in this paper aims to develop an architecture for the detection and diagnosis of bearing faults in the induction machines. The developed data-oriented architecture uses vibration signals collected by sensors placed on the machine, which is based, in the first place, on the extraction of fault indicators based on the harmonics-to-noise ratio envelope. Normalisation is then applied to the extracted indicators to create a well-processed data set. The evolution of these indicators will be studied afterwards according to the type and severity of defects using sequential backward selection technique. Supervised machine learning classification methods are developed to classify the measurements described by the feature vector with respect to the known modes of operation. In the last phase concerning decision making, ten classifiers are tested and applied based on the selected and combined indicators. The developed classification methods allow classifying the observations, with respect to the different modes of bearing condition (outer race, inner race fault or healthy condition). The proposed method is validated on data collected using an experimental bearing test bench. The experimental results indicate that the proposed architecture achieves high accuracy in bearing fault detection under all operational conditions. The results show that, compared to some proposed approaches, our proposed architecture can achieve better performance overall in terms of the number of optimal features and the accuracy of the tests",data oriented architecture,14
10.3390/electronics10151810,filtered,core,'MDPI AG',7/1/2021 0:00,core,on-board data management layer: connected vehicle as data platform,,"For connected vehicles, as well as generally for the transportation sector, data are now seen as a precious resource. They can be used to make right decisions, improve road safety, reduce CO2 emissions, or optimize processes. However, analyzing these data is not so much a question of which technologies to use, but rather about where these data are analyzed. Thereby, the emerging vehicle architecture has to become a data-oriented architecture based on embedded computing platforms and take into account new applications, artificial intelligence elements, advanced analytics, and operating systems. Accordingly, in this paper, we introduce the concept of data management to the vehicle by proposing an on-board data management layer, so that the vehicle can play the role of data platform capable of storing, processing, and diffusing data. Our proposed layer supports analytics and data science to deliver additional value from the connected vehicle data and stimulate the development of new services. In addition, our data platform can also form or contribute to shaping the backbone of data-driven transport. An on-board platform was built where the dataset size was reduced 80% and a rate of 99% accuracy was achieved in a 5 min traffic flow prediction using artificial neural networks (ANNs)",data oriented architecture,15
10.1007/978-3-642-45249-9_36,filtered,core,'Springer Science and Business Media LLC',1/4/2014 0:00,core,towards a new internetworking architecture: a new deployment approach for information centric networks,,"International audienceNew research efforts are trying to evolve the current Inter-net. With satisfying communication hardware, the intent is to switch to data oriented networks. In this new vision, data will be the heart of the architecture and protocols have to be changed to dial with this concept. Promising ideas are proposed up in order to develop clean slate design solutions. However, these propositions encounter many deployment problems. In this paper, we propose new approach based on Bloom Filter to cope with storage space problem in data oriented architecture DONA",data oriented architecture,16
10.1109/asru.2007.4430168,filtered,2007 IEEE Workshop on Automatic Speech Recognition & Understanding (ASRU),IEEE,12/13/2007 0:00,ieeexplore,a data-centric architecture for data-driven spoken dialog systems,https://ieeexplore.ieee.org/document/4430168/,"Data is becoming increasingly crucial for training and (self-) evaluation of spoken dialog systems (SDS). Data is used to train models (e.g. acoustic models) and is 'forgotten'. Data is generated on-line from the different components of the SDS system, e.g. the dialog manager, as well as from the world it is interacting with (e.g. news streams, ambient sensors etc.). The data is used to evaluate and analyze conversational systems both on-line and off-line. We need to be able query such heterogeneous data for further processing. In this paper we present an approach with two novel components: first, an architecture for SDSs that takes a data-centric view, ensuring persistency and consistency of data as it is generated. The architecture is centered around a database that stores dialog data beyond the lifetime of individual dialog sessions, facilitating dialog mining, annotation, and logging. Second, we take advantage of the state-fullness of the data-centric architecture by means of a lightweight, reactive and inference-based dialog manager that itself is stateless. The feasibility of our approach has been validated within a prototype of a phone-based university help-desk application. We detail SDS architecture and dialog management, model, and data representation.",data centric architecture,17
10.1109/icdcsw.2003.1203556,filtered,"23rd International Conference on Distributed Computing Systems Workshops, 2003. Proceedings.",IEEE,5/22/2003 0:00,ieeexplore,"""data-centric to the max"", the splice architecture experience",https://ieeexplore.ieee.org/document/1203556/,"Over the past 10 years, Thales Naval Nederland (TNN) has successfully applied a pure data-centric architecture called SPLICE in its naval Combat Management Systems This fielded architecture provides the essential non-functional properties as demanded in these mission-critical environments such as (real-time) performance, scalability, fault-tolerance and evolveability. Thales recently contributed this knowledge and experience in a joint submission regarding the OMG's Data Distribution Service (DDS) for Real-time systems. The SPLICE architecture is characterized by autonomous applications with minimal dependencies where function and interaction are clearly separated and SPLICE-agents act as real-time information brokers. SPLICE thus offers a normalized environment that is designed once for all applications and which delivers 'the right information at the right place at the right time'.",data centric architecture,18
10.1109/cluster.2012.80,filtered,2012 IEEE International Conference on Cluster Computing,IEEE,9/28/2012 0:00,ieeexplore,a decoupled execution paradigm for data-intensive high-end computing,https://ieeexplore.ieee.org/document/6337781/,"High-end computing (HEC) applications in critical areas of science and technology tend to be more and more data intensive. I/O has become a vital performance bottleneck of modern HEC practice. Conventional HEC execution paradigms, however, are computing-centric for computation intensive applications. They are designed to utilize memory and CPU performance and have inherent limitations in addressing the critical I/O bottleneck issues of HEC. In this study, we propose a decoupled execution paradigm (DEP) to address the challenging I/O bottleneck issues. DEP is the first paradigm enabling users to identify and handle data-intensive operations separately. It can significantly reduce costly data movement and is better than the existing execution paradigms for data-intensive applications. The initial experimental tests have confirmed its promising potential. Its data-centric architecture could have an impact in future HEC systems, programming models, and algorithms design and development.",data centric architecture,19
10.1109/siot.2016.007,filtered,2016 International Workshop on Secure Internet of Things (SIoT),IEEE,9/30/2016 0:00,ieeexplore,addressing data-centric security requirements for iot-based systems,https://ieeexplore.ieee.org/document/7913560/,"Allowing users to control access to their data is paramount for the success of the Internet of Things, therefore, it is imperative to ensure it, even when data has left the users' control, e.g. shared with cloud infrastructure. Consequently, we propose several state of the art mechanisms from the security and privacy research fields to cope with this requirement. To illustrate how each mechanism can be applied, we derive a data-centric architecture providing access control and privacy guaranties for the users of IoT-based applications. Moreover, we discuss the limitations and challenges related to applying the selected mechanisms to ensure access control remotely. Also, we validate our architecture by showing how it empowers users to control access to their health data in a quantified self use case.",data centric architecture,20
10.1109/icce-china.2017.7991141,filtered,2017 IEEE International Conference on Consumer Electronics - Taiwan (ICCE-TW),IEEE,6/14/2017 0:00,ieeexplore,an iot framework for intelligent roadside assistance system,https://ieeexplore.ieee.org/document/7991141/,"The connected road infrastructure and roadside assistance services constitute an important consumer market segment in the Intelligent Transportation System (ITS) and Smart Cities. A closer look at available such services reveal the presence of data silos, heterogeneity and lack of interoperability. They affect the overall consumer experience and increase the cost of service development &amp; maintenance. This paper proposes an IoT framework for next generation, intelligent roadside assistance system. A data centric architecture is presented along with solutions of the mentioned challenges.",data centric architecture,21
10.1109/issnip.2005.1595552,filtered,"2005 International Conference on Intelligent Sensors, Sensor Networks and Information Processing",IEEE,12/8/2005 0:00,ieeexplore,architectures for wireless sensor networks,https://ieeexplore.ieee.org/document/1595552/,Various architectures have been developed for wireless sensor networks. Many of them leave to the programmer important concepts as the way in which the inter-task communication and dynamic reconfigurations are addressed. In this paper we describe the characteristics of a new architecture we proposed - the data-centric architecture. This architecture offers an easy way of structuring the applications designed for wireless sensor nodes that confers them superior performances.,data centric architecture,22
