doi,type,publication,publisher,publication_date,database,title,url,abstract,domain,id
7e9647ea45c28306b39c64d04acbdad35654f720,filtered,semantic_scholar,"2009 Third International Conference on Emerging Security Information, Systems and Technologies",39814,semantic_scholar,runtime protection via dataflow flattening,https://www.semanticscholar.org/paper/7e9647ea45c28306b39c64d04acbdad35654f720,"Software running on an open architecture, such as the PC, is vulnerable to inspection and modification. Since software may process valuable or sensitive information, many defenses against data analysis and modification have been proposed. This paper complements existing work and focuses on hiding data location throughout program execution. To achieve this, we combine three techniques: (i) periodic reordering of the heap, (ii) migrating local variables from the stack to the heap and (iii) pointer scrambling. By essentially flattening the dataflow graph of the program, the techniques serve to complicate static dataflow analysis and dynamic data tracking. Our methodology can be viewed as a data-oriented analogue of control-flow flattening techniques. Dataflow flattening is useful in practical scenarios like DRM, information-flow protection, and exploit resistance. Our prototype implementation compiles C programs into a binary for which every access to the heap is redirected through a memory management unit. Stack-based variables may be migrated to the heap, while pointer accesses and arithmetic may be scrambled and redirected. We evaluate our approach experimentally on the SPEC CPU2006 benchmark suite.",data oriented architecture,278
c4a6463cec7b29136a9f858d7bbb8e6a98772fa6,filtered,semantic_scholar,"2009 12th Euromicro Conference on Digital System Design, Architectures, Methods and Tools",39814,semantic_scholar,run-time reconfigurable array using magnetic ram,https://www.semanticscholar.org/paper/c4a6463cec7b29136a9f858d7bbb8e6a98772fa6,"This paper presents the implementation of a coarse-grained Magnetic RAM based Reconfigurable Array. The Reconfigurable Array architecture is organized as a one- dimensional array of programmable ALU, with the configura- tion bits stored in magnetic random-access memories. The use of MRAM technology to implement run-time reconfigurable hardware devices is a very promising technological solution because MRAM can provide non-volatility with cell areas and access speeds comparable to those of SRAM, and with lower process complexity than flash memory. This type of coarse- grained array, where each reconfigurable element computes on 4-bit or larger input words, is more suitable to execute data-oriented algorithms and is more able to exploit larger amounts of operation-level parallelism than common fine- grained architectures. By substantially reducing the overhead for configurability, this coarse-grain architecture is also more apt to efficiently exploit run-time reconfiguration and therefore to take advantage of multi-context MRAM-based configuration memories. Keywords-reconfigurable array; MRAM; programmable fab- rics;",data oriented architecture,279
826ac2113812ee288da45f585759f81318ce4c85,filtered,semantic_scholar,,42736,semantic_scholar,information management for enabling systems medicine,https://www.semanticscholar.org/paper/826ac2113812ee288da45f585759f81318ce4c85,"Abstract Systems medicine is a data-oriented approach in research and clinical practice to support study and treatment of complex diseases. It relies on well-defined information management processes providing comprehensive and up to date information as basis for electronic decision support. The authors suggest a three-layer information technology (IT) architecture for systems medicine and a cyclic data management approach including a knowledge base that is dynamically updated by extract, transform, and load (ETL) procedures. Decision support is suggested as case-based and rule-based components. Results are presented via a user interface to acknowledging clinical requirements in terms of time and complexity. The systems medicine application was implemented as a prototype.",data oriented architecture,280
61f0f98f644912b1c71d137a829db60782eebd63,filtered,semantic_scholar,IEEE Access,43831,semantic_scholar,cyber physical and social networks in iov (cpsn-iov): a multimodal architecture in edge-based networks for optimal route selection using 5g technologies,https://www.semanticscholar.org/paper/61f0f98f644912b1c71d137a829db60782eebd63,"Humans are blessed with the intelligence to create links, develop semantic metaphors and models for reasoning; construct rules for decision making; and to form bounded loops for interaction, socialization and knowledge sharing. But machines are inadequate with these extraordinary abilities rather, numerous algorithms and mathematical models can be used to connect physical resources with cyberspaces to control objects and, develop cognitive learning for optimal decision making. Connected users and devices in closed virtual and physical proximity give direction towards the plethora of real-world applications for physical, social and, cyber computing. Because of the increase in social media networking and 5G communication links offer real-time crowdsourcing and sensing as a complementary base for information. Proceeding this idea, in this study we have proposed Cyber-Physical and Social Networks (CPSN) for two fundamental operations in IoV (Internet of Vehicles) as CPSN-IoV; (1) to define conceptual architecture of CPSN-IoV for data-oriented network for smart infrastructure and, (2) to create the significant virtual space where the instances of smart vehicles, devices, and things will have meaningful links with the real world objects where, CPSN-IoV will evolve, emerge, compete, and collaborate with all connected objects to strengthen the decision making process. To investigate the potential impact of our proposed study, we have simulated the taxicab trajectory data of the urban city of Portugal in OMNeT++ for the in-depth understanding of road topology, connected vehicles and things, and their traffic trends; and users’ social media streams in respective edge for efficient route planning. The results of simulation demonstrate that our proposed framework has the ability to achieve human-machine intellectual association for managing the smart environment.",data oriented architecture,281
1d750ce96c2cda75c18b2c7bafb4f56f4e9dc36d,filtered,semantic_scholar,Conf. Computing Frontiers,42370,semantic_scholar,from flops to bytes: disruptive change in high-performance computing towards the post-moore era,https://www.semanticscholar.org/paper/1d750ce96c2cda75c18b2c7bafb4f56f4e9dc36d,"Slowdown and inevitable end in exponential scaling of processor performance, the end of the so-called ""Moore's Law"" is predicted to occur around 2025--2030 timeframe. Because CMOS semiconductor voltage is also approaching its limits, this means that logic transistor power will become constant, and as a result, the system FLOPS will cease to improve, resulting in serious consequences for IT in general, especially supercomputing. Existing attempts to overcome the end of Moore's law are rather limited in their future outlook or applicability. We claim that data-oriented parameters, such as bandwidth and capacity, or BYTES, are the new parameters that will allow continued performance gains for periods even after computing performance or FLOPS ceases to improve, due to continued advances in storage device technologies and optics, and manufacturing technologies including 3-D packaging. Such transition from FLOPS to BYTES will lead to disruptive changes in the overall systems from applications, algorithms, software to architecture, as to what parameter to optimize for, in order to achieve continued performance growth over time. We are launching a new set of research efforts to investigate and devise new technologies to enable such disruptive changes from FLOPS to BYTES in the Post-Moore era, focusing on HPC, where there is extreme sensitivity to performance, and expect the results to disseminate to the rest of IT.",data oriented architecture,282
141ac67c51134b03e993dca1a4e038266c6a45aa,filtered,semantic_scholar,WABBWUAS@UMAP,40179,semantic_scholar,generic adaptation process,https://www.semanticscholar.org/paper/141ac67c51134b03e993dca1a4e038266c6a45aa,Adaptive Hypermedia Systems (AHS) have long been mainly represented by domain- or application-specific systems. Few reference models exist and they provide only a brief overview of how to describe and organize the ‘adaptation process’ in a generic way. In this paper we consider the process aspects of AHS from the very first classical ‘user modelling-adaptation’ loop to a generic detailed flowchart of the adaptation in AHS.We introduce a Generic Adaptation Process and by aligning it with a layered (data-oriented) AHS architecture we show that it can serve as the process part of a new reference model for AHS.,data oriented architecture,283
74a462a4e6426679aa9f2f0c172e28c0bb064258,filtered,semantic_scholar,ACM Multimedia,43831,semantic_scholar,pose-native network architecture search for multi-person human pose estimation,https://www.semanticscholar.org/paper/74a462a4e6426679aa9f2f0c172e28c0bb064258,"Multi-person pose estimation has achieved great progress in recent years, even though, the precise prediction for occluded and invisible hard keypoints remains challenging. Most of the human pose estimation networks are equipped with an image classification-based pose encoder for feature extraction and a handcrafted pose decoder for high-resolution representations. However, the pose encoder might be sub-optimal because of the gap between image classification and pose estimation. The widely used multi-scale feature fusion in pose decoder is still coarse and cannot provide sufficient high-resolution details for hard keypoints. Neural Architecture Search (NAS) has shown great potential in many visual tasks to automatically search efficient networks. In this work, we present the Pose-native Network Architecture Search (PoseNAS) to simultaneously design a better pose encoder and pose decoder for pose estimation. Specifically, we directly search a data-oriented pose encoder with stacked searchable cells, which can provide an optimum feature extractor for the pose specific task. In the pose decoder, we exploit scale-adaptive fusion cells to promote rich information exchange across the multi-scale feature maps. Meanwhile, the pose decoder adopts a Fusion-and-Enhancement manner to progressively boost the high-resolution representations that are non-trivial for the precious prediction of hard keypoints. With the exquisitely designed search space and search strategy, PoseNAS can simultaneously search all modules in an end-to-end manner. PoseNAS achieves state-of-the-art performance on three public datasets, MPII, COCO, and PoseTrack, with small-scale parameters compared with the existing methods. Our best model obtains 76.7% mAP and 75.9% mAP on the COCO validation set and test set with only 33.6M parameters. Code and implementation are available at https://github.com/for-code0216/PoseNAS.",data oriented architecture,284
92d394435385cfd3baedd18054b87f29455154d1,filtered,semantic_scholar,ArXiv,41640,semantic_scholar,time series data mining for the gaia variability analysis,https://www.semanticscholar.org/paper/92d394435385cfd3baedd18054b87f29455154d1,"Gaia is an ESA cornerstone mission, which was successfully launched December 2013 and commenced operations in July 2014. Within the Gaia Data Processing and Analysis consortium, Coordination Unit 7 (CU7) is responsible for the variability analysis of over a billion celestial sources and nearly 4 billion associated time series (photometric, spectrophotometric, and spectroscopic), encoding information in over 800 billion observations during the 5 years of the mission, resulting in a petabyte scale analytical problem. In this article, we briefly describe the solutions we developed to address the challenges of time series variability analysis: from the structure for a distributed data-oriented scientific collaboration to architectural choices and specific components used. Our approach is based on Open Source components with a distributed, partitioned database as the core to handle incrementally: ingestion, distributed processing, analysis, results and export in a constrained time window.",data oriented architecture,285
f4dda7d65b3b3c21beb58483c712911945649b33,filtered,semantic_scholar,ICN,43831,semantic_scholar,toward a restful information-centric web of things: a deeper look at data orientation in coap,https://www.semanticscholar.org/paper/f4dda7d65b3b3c21beb58483c712911945649b33,"The information-centric networking (ICN) paradigm offers replication of autonomously verifiable content throughout a network, in which content is bound to names instead of hosts. This has proven beneficial in particular for the constrained IoT. Several approaches, the most prominent of which being Named Data Networking, propose access to named content directly on the network layer. Independently, the IETF CoAP protocol group started to develop mechanisms that support autonomous content processing and in-network storage. In this paper, we explore the emerging CoAP protocol building blocks and how they contribute to an information-centric network architecture for a data-oriented RESTful Web of Things. We discuss design options and measure characteristic performances of different network configurations, which deploy CoAP proxies and OSCORE content object security, and compare with NDN. Our findings indicate an almost continuous design space ranging from plain CoAP at the one end to NDN on the other. On both ends---ICN and CoAP---we identify protocol features and aspects whose mutual transfer potentially improves design and operation of the other.",data oriented architecture,286
5bebd0d71a010e6a9b1b1de6cbcac9a59483aa35,filtered,semantic_scholar,,35065,semantic_scholar,a data model for architecture independent parallel programming,https://www.semanticscholar.org/paper/5bebd0d71a010e6a9b1b1de6cbcac9a59483aa35,"This paper presents a common data model for both shared and distributed parallel programming. Our model aims at parallel application programming, especially in th e field of data parallelism. We introduce coordinators shared objects which automatically perform synchronization in shared memory programming and remote communication in distributed programming. Programming with coordinators allows a static definition of dynamic access properties (shared access patterns) in a declarative manner. Thus, there is no need for explicit use of synchronization or communication primitiv es in order to get well defined and efficient parallel programs. In contrast, declarativity allows to think in abstract coor dination categories. Our paradigm is named Declarative Imperative Parallel Programming due to this fact and due to our commitment to imperative applications, mainly from the field of scientific computing, image processing, simulation and optimization. 1. The DIPP programming model Ideally, explicit parallel programming should be uniform for shared and distributed platforms. One way to achieve this is to give the programmer the illusion of shared memory even on distributed platforms[18]. While we think that this might be exactly what a programmer wants we must acknowledge that this goal is not reached yet. The performance issue implies some sort of discrimination of local from non-local data for distributed platforms. We believe that the process model can be uniform without any impact on performance. We propose such a model (a workpool model) in [13]. The aim of this paper is to show that even the data model can benefit from an uniform approach allowing architecture invariant programmin g without too much loss of performance. The relationship between our data model and the workpool is described in [14]. The main property of the approach presented in this paper is a paradigm which makes explicit synchronization or remote communication obsolete without performance degradation1. We introducecoordinators, a means for declaratively specifying the dynamic access properties of objects to be used by more than one process. The access properties directly correspond to algorithmic patterns typically found i data parallel algorithms such as fan-in or fan-out. In the context of message passing we have the related term broadcast. These all are specific cases of access patterns which can be defined by coordinators. The automatic coordination behavior of a system that implements coordinators can be derived from the specified patterns. Since coordinators are a declarative means to be used in imperative programming the programming model is named Declarative Imperative Parallel Programming. Imperativity is one of the properties which make coordinators different from other implicit synchronization paradigms such as futures [10]. See the discussion of related work for details. Coordinators are objects that may be accessed by more than one process in a coordinated fashion. In shared memory programming they might be named selfsynchronized objects. In distributed programming the term self-distributing might be in order. Accesses to coordinators may trigger synchronization or remote communication actions. We discriminate writing accesses (producers) from reading accesses (consumers). Note, that we do not support general producer-consumer aspects like buffering. In contras t, coordinators are a means for synchronized control allowing a tight coupling between producer and consumer. We 1Notice that we are concerned with application programming; we do not claim that our model does away with explicit synchroniza tion or coordination for parallel system programming such as operati ng systems or databases. specify access properties in a declarative manner: Access patterns are declared separately for reading and writing. The parallel semantics is defined by switching between a writableand areadablestate of a coordinator. The patterns statically describe the conditions which trigger the state switches. These conditions are defined in terms of “who reads or writes an object how many times”. Inappropriate (premature) accesses are delayed until the state switches. This behavior is implemented by implicit synchronization or communication, depending on the underlying architecture. 1.1. Dynamic behavior of coordinators The basic assumption about accesses to coordinators is that writing accesses are distinguished from reading accesses. In imperative programs, switches between writable and readabletypically occur repeatedly inside loops. In functional programs there is exactly one switch from writable to readable. 2 In the following, we informally describe the dynamic behavior of coordinators. Two state semantics Coordinators exhibit a two state semantics: A coordinator is initially in thewritablestate. After construction of the first value it switches to the readable state. After the last read access the coordinator switches t o thewritable state again, thus allowing multiple updates of objects. Depending on the access patterns defined for each state (see section 1.2), the switches may be triggered by dif ferent actions. Blocking If a coordinator is accessed and its state does not correspond to the access kind (i.e. a read access while the coordinator is writable and vice versa) the access is automatically blocked. Blocking lasts at least until the stat e has switched (e.g. by completion of some other accesses). By defining the switch conditions between the two states, the access patterns also determine blocking conditions. Computational steps Our focus is on iteratively writing and reading objects inside some loop or recursion. All such activities within one iteration are referred to as a computational step. More accurately, we define a computational stepwith respect to a coordinator as (dynamically) starting in the writable state and ending when this state is reached again, i.e. a computational step consists of a write phase and aread phase .3 2Readers familiar withfuturesor I-structuresmight see some relationship to these. 3In the functional world, the whole lifetime of a variable is a computational step. The semantics of coordinators is defined by their behavior during one computational step. In general, different co ordinators will carry out different computational steps. 1.2. De ning access patterns Every coordinator reveals a specific access pattern with respect to both phases of a computational step. The access patterns must be specified by the user separately for both phases. Access patterns correspond to algorithmic pat terns as they typically occur in “data-oriented” parallel a lgorithms (e.g. in numerical computation). We have defined the following patterns: each(<process group >,<no of accesses >) each(<process group >) arbitrary(<no of accesses >) arbitrary() The main patternseach and arbitrary differ in the mode of cooperation between the involved processes while their shapes denote the events that trigger a state change. Theeach pattern is used for a homogeneous group of processes <process group >, when the overall task within the write or read phase of a computational step can be defined by specifying the task of every single process within the phase. The intended standard way to specify such a task is to declare how many times the process will access the coordinator within the phase. To do so the each pattern is used with a<no of accesses > specification ( <no of accesses > will be 1 in many cases). This pattern fits for most algorithms that work on regular data (like arrays) in a regular fashion. If the number of accesses cannot be given, each process has to state explicitly that its task within a phase is finished by invoking the coordinator method procReady(<phase>). This method is parameterized with the phase, since it must be synchronized with concurrent accesses. Thus, a call to procReady is a further potential blocking situation. The state change is triggered as soon as each process has finished its task. In order to get a proper definition of this switch condition we require an invariable line-up of the pro cess group (except for an initial phase, see [13]). In contrast, thearbitrary pattern is used if an arbitrary, possibly varying number of possibly inhomogeneous processes share the coordinator. Within this cooperation mode, we can provide only global switch conditions: In the arbitrary pattern a<no of accesses > specification refers to the overall number of accesses, i.e. the state of the coordinator switches after exactly <no of accesses > accesses, no matter which processes were involved. Again, if the number of accesses cannot be given the state switch has to be triggered explicitly. In contrast to theeach pattern this is done by only one process, using the coordinator method switch(<phase>). It can be concluded that this pattern is appropriate e.g. for a farm work model where a centralized master controls the work of several slave processes. 1.3. A short example We illustrate the use of coordinators in a small example, using aC++ like notation enhanced with simple syntactic extensions. Our example implements a producer-consumer scenario where an integer variable sharedInt is repeatedly written by a single producer and subsequently read by nProcs different consumers. We ensure that each value written by the producer is read exactly once by each consumer, by simply definingsharedInt as a coordinator:",data oriented architecture,287
44c75858494b9aecb62b9c50fe4cea48a7e045d1,filtered,semantic_scholar,"CCGrid 2003. 3rd IEEE/ACM International Symposium on Cluster Computing and the Grid, 2003. Proceedings.",37622,semantic_scholar,a method to find unique sequences on distributed genomic databases,https://www.semanticscholar.org/paper/44c75858494b9aecb62b9c50fe4cea48a7e045d1,"Thanks to the development of genetic engineering, various kinds of genomic information are being unveiled. Hence, it becomes feasible to analyze the entire genomic information all at once. On the other hand, the quantity of the genomic information stocked on databases is increasing day after day. In order to process the whole information, we have to develop an effective method to deal with lots of data. Therefore, it is indispensable not only to make an effective and rapid algorithm but also to use high-speed computer resource so as to analyze the biological information. For this purpose, as one of the most promised computing environments, the grid computing architecture has appeared recently. The European Data Grid (EDG) is one of the data-oriented grid computing environments [11]. In the field of bioinformatics, it is important to find unique sequences to succeed in molecular biological experiments [6]. Once unique sequences have been found they can be useful for target specific probes/primers design, gene sequence comparison and so on. In this paper, we propose a method to discover unique sequences from among genomic databases located in a distributed environment. Next, we implement this method upon the European Data Grid and show the calculation results for E. coli genomes.",data oriented architecture,288
