doi,type,publication,publisher,publication_date,database,title,url,abstract,domain,id
10.1007/978-3-319-07863-2_21,filtered,Human Interface and the Management of Information. Information and Knowledge in Applications and Services,Springer,1/1/2014 0:00,springer,data driven enterprise ux: a case study of enterprise management systems,http://link.springer.com/openurl/fulltext?id=doi:10.1007/978-3-319-07863-2_21,"This paper describes and makes a case for a data driven user experience design process for Enterprise IT. The method described employs an approach that focuses on defining the key modules (objects) in an enterprise IT software and the data sets used by these modules very early in the design process. We discuss how mapping parent child relationships between key entities in the software and the linked data helps create a holistic view of the product ecosystem which in turn allows the designer to create an uncluttered information architecture and user journey that maps closely to mental construct of the system in the user’s mind. We further argue that in the present age of big data, working with well-defined data sets and visible data relationships creates a valuable information repository for the designer to take decisions regarding task optimization and building business intelligence in the system itself. We also discuss the urgent need, advantages and methods of ‘consumerizing’ the Enterprise UI to increase users productivity and reduce the learning curve. Lastly, these ideas are exemplified through a real life case study for an enterprise server management system.",data driven architecture,107
10.1007/978-1-4471-6410-4_14,filtered,Data-driven Design of Fault Diagnosis and Fault-tolerant Control Systems,Springer,1/1/2014 0:00,springer,data-driven design of observer-based control systems,http://link.springer.com/openurl/fulltext?id=doi:10.1007/978-1-4471-6410-4_14,"In the previous chapter, we have introduced the fault-tolerant architecture and the associated design parameters. In this chapter, we focus on the data-driven design of the state feedback gain matrix, an H-PRIO parameter of the fault-tolerant architecture, and its application to the observer-based control schemes.",data driven architecture,108
10.1007/978-3-642-39200-9_5,filtered,Web Engineering,Springer,1/1/2013 0:00,springer,semantic data driven interfaces for web applications,http://link.springer.com/openurl/fulltext?id=doi:10.1007/978-3-642-39200-9_5,"Modern day interfaces must deal with a large number of heterogeneity factors, such as varying user profiles and runtime hardware and software platforms. These conditions require interfaces that can adapt to the changes in the <user, platform, environment> triad. The Model-Based User Interface approach has been proposed as a way to deal with these requirements. In this paper we present a data-driven, rule-based interface definition model capable of taking into account the semantics of the data it is manipulating, especially in the case of Linked Data. An implementation architecture based on the Synth environment supporting this model is presented.",data driven architecture,109
10.1007/978-3-642-23333-3_4,filtered,Electronic Participation,Springer,1/1/2011 0:00,springer,combining social and government open data for participatory decision-making,http://link.springer.com/openurl/fulltext?id=doi:10.1007/978-3-642-23333-3_4,"In the last years, several research endeavors were launched aiming at involving popular social media platforms in electronic participation. These early endeavors seem to present some essential limitations related mainly to scalability and uptake. In order to avoid these limitations, we introduce a two-phased approach for supporting participatory decision-making based on the integration and analysis of social and government open data. The proposed approach is based on the literature related to the analysis of massive amounts of social data for future events prediction. In this paper we also present a Web data driven architecture for the implementation of the proposed approach. The architecture is based on the use of linked data paradigm as a layer that will enable integration of data from different sources. We anticipate that the proposed approach will (i) allow decision makers to understand and predict public opinion and reaction about specific decisions; and (ii) enable citizens to inadvertently contribute in decision-making.",data driven architecture,110
10.1007/978-3-642-04492-2_21,filtered,Management Enabling the Future Internet for Changing Business and New Computing Services,Springer,1/1/2009 0:00,springer,the proposal of service delivery platform built on distributed data driven architecture,http://link.springer.com/openurl/fulltext?id=doi:10.1007/978-3-642-04492-2_21,"SDP (Service Delivery Platform) is a recommended system platform for NGN (Next Generation Network) that is expected to resolve two common system running problems: one is functional aspects such as high availability and providing effective maintenance methods, the other is cost aspects such as simplifying development method of a service. However, SDP is still on the way to be standardized, and its architecture has two problems: the congestion of service requests and flexibility of enabler, a service component of SDP. This paper explains how to build a SDP by adopting Distributed Data Driven Architecture and how our system resolves the problems by evaluating the prototype.",data driven architecture,111
10.1007/978-3-540-30117-2_119,filtered,Field Programmable Logic and Application,Springer,1/1/2004 0:00,springer,an environment for exploring data-driven architectures,http://link.springer.com/openurl/fulltext?id=doi:10.1007/978-3-540-30117-2_119,"A wide range of reconfigurable coarse-grain architectures has been proposed in recent years, for an extensive set of applications. These architectures vary widely in the interconnectivity, number, granularity and complexity of the processing elements (PEs). The performance of a specific application usually depends heavily on the adequacy of the PEs to the particular tasks involved, but tools to efficiently experiment architectural features are lacking. This work proposes an environment for exploration and simulation of coarse-grain reconfigurable data-driven architectures. The proposed environment takes advantage of Java and XML technologies to enable a very efficient backend for experiments with different architectural trade-offs, from the array connectivity and topology to the granularity and complexity of each PE. For a proof of concept, we show results on implementing different versions of a FIR filter on a hexagonal data-driven array.",data driven architecture,112
10.1007/978-94-015-8196-7_6,filtered,Linear Algebra for Large Scale and Real-Time Applications,Springer,1/1/1993 0:00,springer,a parallel image rendering algorithm and architecture based on ray tracing and radiosity shading,http://link.springer.com/openurl/fulltext?id=doi:10.1007/978-94-015-8196-7_6,"Algorithms for rendering color scenes on a video screen potentially belong to the class of massively parallel algorithms. Developing effective and efficient data-driven architectures for algorithms from this class is in general a hard problem. However, in case of application specific algorithms, such as the rendering algorithm described in this paper, feasible solutions are conceivable. The parallel algorithm/architecture presented in this paper is a linear speed-up accelerator for the rendering of photo realistic scenes in interaction time.",data driven architecture,113
10.1007/3-540-53065-7_86,filtered,CONPAR 90 — VAPP IV,Springer,1/1/1990 0:00,springer,a decoupled data-driven architecture with vectors and macro actors,http://link.springer.com/openurl/fulltext?id=doi:10.1007/3-540-53065-7_86,"This paper presents the implementation of scientific programs on a decoupled data-driven architecture with vectors and macro actors. This hybrid multiprocessor combines the dynamic data-flow principles of execution with the control-flow of the von Neumann model of execution. The two major ideas utilized by the decoupled model are: vector and macro actors with variable resolution, and asynchronous execution of graph and computation operations. The compiler generates graphs with various-sized actors in order to match the characteristics of the computation. For instance, vector actors are proposed for many aspects of scientific computing while lower resolution (complier-generated collection of scalar actors) or higher resolution (scalar actors) is used for unvectorizable programs. A block-scheduling technique for extracting more parallelism from sequential constructs is incorporated in the decoupled architecture. In addition a graph-level priority-scheduling mechanism is implemented that improves resource utilization and yields higher performance. A graph unit executes all graph operations and a computation unit executes all computation operations. The independence of the two main units of the machine allows the efficient pipelined execution of macro actors with diverse granularity characteristics.",data driven architecture,114
http://arxiv.org/abs/2202.10565v1,filtered,arxiv,arxiv,2/21/2022 0:00,arxiv,"t-metaset: task-aware generation of metamaterial datasets by
  diversity-based active learning",http://arxiv.org/abs/2202.10565v1,"Inspired by the recent success of deep learning in diverse domains,
data-driven metamaterials design has emerged as a compelling design paradigm to
unlock the potential of multiscale architecture. However, existing
model-centric approaches lack principled methodologies dedicated to
high-quality data generation. Resorting to space-filling design in shape
descriptor space, existing metamaterial datasets suffer from property
distributions that are either highly imbalanced or at odds with design tasks of
interest. To this end, we propose t-METASET: an intelligent data acquisition
framework for task-aware dataset generation. We seek a solution to a
commonplace yet frequently overlooked scenario at early design stages: when a
massive ($~\sim O(10^4)$) shape library has been prepared with no properties
evaluated. The key idea is to exploit a data-driven shape descriptor learned
from generative models, fit a sparse regressor as the start-up agent, and
leverage diversity-related metrics to drive data acquisition to areas that help
designers fulfill design goals. We validate the proposed framework in three
hypothetical deployment scenarios, which encompass general use, task-aware use,
and tailorable use. Two large-scale shape-only mechanical metamaterial datasets
are used as test datasets. The results demonstrate that t-METASET can
incrementally grow task-aware datasets. Applicable to general design
representations, t-METASET can boost future advancements of not only
metamaterials but data-driven design in other domains.",data driven architecture,115
http://arxiv.org/abs/2202.07448v1,filtered,arxiv,arxiv,2/4/2022 0:00,arxiv,"towards a unified pandemic management architecture: survey, challenges
  and future directions",http://arxiv.org/abs/2202.07448v1,"The pandemic caused by SARS-CoV-2 has left an unprecedented impact on health,
economy and society worldwide. Emerging strains are making pandemic management
increasingly challenging. There is an urge to collect epidemiological,
clinical, and physiological data to make an informed decision on mitigation
measures. Advances in the Internet of Things (IoT) and edge computing provide
solutions for pandemic management through data collection and intelligent
computation. While existing data-driven architectures attempt to automate
decision-making, they do not capture the multifaceted interaction among
computational models, communication infrastructure, and the generated data. In
this paper, we perform a survey of the existing approaches for pandemic
management, including online data repositories and contact-tracing
applications. We then envision a unified pandemic management architecture that
leverages the IoT and edge computing to automate recommendations on vaccine
distribution, dynamic lockdown, mobility scheduling and pandemic prediction. We
elucidate the flow of data among the layers of the architecture, namely, cloud,
edge and end device layers. Moreover, we address the privacy implications,
threats, regulations, and existing solutions that may be adapted to optimize
the utility of health data with security guarantees. The paper ends with a
lowdown on the limitations of the architecture and research directions to
enhance its practicality.",data driven architecture,116
http://arxiv.org/abs/2110.09005v1,filtered,arxiv,arxiv,10/18/2021 0:00,arxiv,unsupervised learned kalman filtering,http://arxiv.org/abs/2110.09005v1,"In this paper we adapt KalmanNet, which is a recently pro-posed deep neural
network (DNN)-aided system whose architecture follows the operation of the
model-based Kalman filter (KF), to learn its mapping in an unsupervised manner,
i.e., without requiring ground-truth states. The unsupervised adaptation is
achieved by exploiting the hybrid model-based/data-driven architecture of
KalmanNet, which internally predicts the next observation as the KF does. These
internal features are then used to compute the loss rather than the state
estimate at the output of the system. With the capability of unsupervised
learning, one can use KalmanNet not only to track the hidden state, but also to
adapt to variations in the state space (SS) model. We numerically demonstrate
that when the noise statistics are unknown, unsupervised KalmanNet achieves a
similar performance to KalmanNet with supervised learning. We also show that we
can adapt a pre-trained KalmanNet to changing SS models without providing
additional data thanks to the unsupervised capabilities.",data driven architecture,117
http://arxiv.org/abs/2108.13178v1,filtered,arxiv,arxiv,8/4/2021 0:00,arxiv,"black-box and modular meta-learning for power control via random edge
  graph neural networks",http://arxiv.org/abs/2108.13178v1,"In this paper, we consider the problem of power control for a wireless
network with an arbitrarily time-varying topology, including the possible
addition or removal of nodes. A data-driven design methodology that leverages
graph neural networks (GNNs) is adopted in order to efficiently parametrize the
power control policy mapping the channel state information (CSI) to transmit
powers. The specific GNN architecture, known as random edge GNN (REGNN),
defines a non-linear graph convolutional filter whose spatial weights are tied
to the channel coefficients. While prior work assumed a joint training approach
whereby the REGNN-based policy is shared across all topologies, this paper
targets adaptation of the power control policy based on limited CSI data
regarding the current topology. To this end, we propose both black-box and
modular meta-learning techniques. Black-box meta-learning optimizes a
general-purpose adaptation procedure via (stochastic) gradient descent, while
modular meta-learning finds a set of reusable modules that can form components
of a solution for any new network topology. Numerical results validate the
benefits of meta-learning for power control problems over joint training
schemes, and demonstrate the advantages of modular meta-learning when data
availability is extremely limited.",data driven architecture,118
http://arxiv.org/abs/2106.15356v2,filtered,arxiv,arxiv,6/26/2021 0:00,arxiv,"scalable gaussian processes for data-driven design using big data with
  categorical factors",http://arxiv.org/abs/2106.15356v2,"Scientific and engineering problems often require the use of artificial
intelligence to aid understanding and the search for promising designs. While
Gaussian processes (GP) stand out as easy-to-use and interpretable learners,
they have difficulties in accommodating big datasets, categorical inputs, and
multiple responses, which has become a common challenge for a growing number of
data-driven design applications. In this paper, we propose a GP model that
utilizes latent variables and functions obtained through variational inference
to address the aforementioned challenges simultaneously. The method is built
upon the latent variable Gaussian process (LVGP) model where categorical
factors are mapped into a continuous latent space to enable GP modeling of
mixed-variable datasets. By extending variational inference to LVGP models, the
large training dataset is replaced by a small set of inducing points to address
the scalability issue. Output response vectors are represented by a linear
combination of independent latent functions, forming a flexible kernel
structure to handle multiple responses that might have distinct behaviors.
Comparative studies demonstrate that the proposed method scales well for large
datasets with over 10^4 data points, while outperforming state-of-the-art
machine learning methods without requiring much hyperparameter tuning. In
addition, an interpretable latent space is obtained to draw insights into the
effect of categorical factors, such as those associated with building blocks of
architectures and element choices in metamaterial and materials design. Our
approach is demonstrated for machine learning of ternary oxide materials and
topology optimization of a multiscale compliant mechanism with aperiodic
microstructures and multiple materials.",data driven architecture,119
http://arxiv.org/abs/2105.00459v1,filtered,arxiv,arxiv,5/2/2021 0:00,arxiv,"fast power control adaptation via meta-learning for random edge graph
  neural networks",http://arxiv.org/abs/2105.00459v1,"Power control in decentralized wireless networks poses a complex stochastic
optimization problem when formulated as the maximization of the average sum
rate for arbitrary interference graphs. Recent work has introduced data-driven
design methods that leverage graph neural network (GNN) to efficiently
parametrize the power control policy mapping channel state information (CSI) to
the power vector. The specific GNN architecture, known as random edge GNN
(REGNN), defines a non-linear graph convolutional architecture whose spatial
weights are tied to the channel coefficients, enabling a direct adaption to
channel conditions. This paper studies the higher-level problem of enabling
fast adaption of the power control policy to time-varying topologies. To this
end, we apply first-order meta-learning on data from multiple topologies with
the aim of optimizing for a few-shot adaptation to new network configurations.",data driven architecture,120
http://arxiv.org/abs/2008.00442v2,filtered,arxiv,arxiv,8/2/2020 0:00,arxiv,"identifying the elastic isotropy of architectured materials based on
  deep learning method",http://arxiv.org/abs/2008.00442v2,"With the achievement on the additive manufacturing, the mechanical properties
of architectured materials can be precisely designed by tailoring
microstructures. As one of the primary design objectives, the elastic isotropy
is of great significance for many engineering applications. However, the
prevailing experimental and numerical methods are normally too costly and
time-consuming to determine the elastic isotropy of architectured materials
with tens of thousands of possible microstructures in design space. The quick
mechanical characterization is thus desired for the advanced design of
architectured materials. Here, a deep learning-based approach is developed as a
portable and efficient tool to identify the elastic isotropy of architectured
materials directly from the images of their representative microstructures with
arbitrary component distributions. The measure of elastic isotropy for
architectured materials is derived firstly in this paper to construct a
database with associated images of microstructures. Then a convolutional neural
network is trained with the database. It is found that the convolutional neural
network shows good performance on the isotropy identification. Meanwhile, it
exhibits enough robustness to maintain the performance under fluctuated
material properties in practical fabrications. Moreover, the well-trained
convolutional neural network can be successfully transferred among different
types of architectured materials, including two-phase composites and porous
materials, which greatly enhance the efficiency of the deep learning-based
approach. This study can give new inspirations on the fast mechanical
characterization for the big-data driven design of architectured materials.",data driven architecture,121
http://arxiv.org/abs/1910.06115v1,filtered,arxiv,arxiv,10/11/2019 0:00,arxiv,"microservices based linked data quality model for buildings energy
  management services",http://arxiv.org/abs/1910.06115v1,"During the production, distribution, and consumption of energy, a large
quantity of data is generated. For efficiently using of energy resources other
supplementary data such as building information, weather, and environmental
data etc. are also collected and used. All these energy data and relevant data
is published as linked data in order to enhance the reusability of data and
maximization of energy management services capability. However, the quality of
this linked data is questionable because of wear and tears of sensors,
unreliable communication channels, and highly diversification of data sources.
The provision of high-quality energy management services requires high quality
linked data, which reduces billing cost and improve the quality of the living
environment. Assessment and improvement methodologies for the quality of data
along with linked data needs to process very diverse data from highly diverse
data sources. Microservices based data-driven architecture has great
significance to processes highly diverse linked data with modularity,
scalability, and reliability. This paper proposed microservices based
architecture along with domain data and metadata ontologies to enhance and
assess energy-related linked data quality.",data driven architecture,122
http://arxiv.org/abs/1909.10819v2,filtered,arxiv,arxiv,9/24/2019 0:00,arxiv,"investigating customization strategies and convergence behaviors of
  task-specific admm",http://arxiv.org/abs/1909.10819v2,"Alternating Direction Method of Multiplier (ADMM) has been a popular
algorithmic framework for separable optimization problems with linear
constraints. For numerical ADMM fail to exploit the particular structure of the
problem at hand nor the input data information, leveraging task-specific
modules (e.g., neural networks and other data-driven architectures) to extend
ADMM is a significant but challenging task. This work focuses on designing a
flexible algorithmic framework to incorporate various task-specific modules
(with no additional constraints) to improve the performance of ADMM in
real-world applications. Specifically, we propose Guidance from Optimality
(GO), a new customization strategy, to embed task-specific modules into ADMM
(GO-ADMM). By introducing an optimality-based criterion to guide the
propagation, GO-ADMM establishes an updating scheme agnostic to the choice of
additional modules. The existing task-specific methods just plug their
task-specific modules into the numerical iterations in a straightforward
manner. Even with some restrictive constraints on the plug-in modules, they can
only obtain some relatively weaker convergence properties for the resulted ADMM
iterations. Fortunately, without any restrictions on the embedded modules, we
prove the convergence of GO-ADMM regarding objective values and constraint
violations, and derive the worst-case convergence rate measured by iteration
complexity. Extensive experiments are conducted to verify the theoretical
results and demonstrate the efficiency of GO-ADMM.",data driven architecture,123
http://arxiv.org/abs/1905.06179v1,filtered,arxiv,arxiv,5/15/2019 0:00,arxiv,differentiable linearized admm,http://arxiv.org/abs/1905.06179v1,"Recently, a number of learning-based optimization methods that combine
data-driven architectures with the classical optimization algorithms have been
proposed and explored, showing superior empirical performance in solving
various ill-posed inverse problems, but there is still a scarcity of rigorous
analysis about the convergence behaviors of learning-based optimization. In
particular, most existing analyses are specific to unconstrained problems but
cannot apply to the more general cases where some variables of interest are
subject to certain constraints. In this paper, we propose Differentiable
Linearized ADMM (D-LADMM) for solving the problems with linear constraints.
Specifically, D-LADMM is a K-layer LADMM inspired deep neural network, which is
obtained by firstly introducing some learnable weights in the classical
Linearized ADMM algorithm and then generalizing the proximal operator to some
learnable activation function. Notably, we rigorously prove that there exist a
set of learnable parameters for D-LADMM to generate globally converged
solutions, and we show that those desired parameters can be attained by
training D-LADMM in a proper way. To the best of our knowledge, we are the
first to provide the convergence analysis for the learning-based optimization
method on constrained problems.",data driven architecture,124
