id,doi,publisher,database,url,domain,publication_date,algorithm_type,training_schema,algorithm_goal,architecture,title,abstract,status
20,10.1109/aero.2005.1559422,IEEE,ieeexplore,https://ieeexplore.ieee.org/document/1559422/,data centric architecture,2005-03-12 00:00:00,,,,,"data centric, position-based routing in space networks","Envisioned space exploration systems and planned space science missions involve increasingly large number of satellites and surface rovers/sensors communicating for coordinated science operations or for on-demand commanding and/or transfer of data. Current approaches that use static routing cannot scale to large numbers of satellites and spacecrafts of future missions. This requires a dynamic approach that can discover networks and links as they become available and intelligently use them for routing. Furthermore, most of the science missions will be geared towards collecting data using various sensors. Adoption of a data-centric communication mechanism can enable in-network aggregation and processing which help make data forwarding more efficient. In this paper, we briefly describe ASCoT, a routing system for science missions of tomorrow, which a) leverages the predictability of satellite trajectories to effect position-based routing in the space backbone, and b) departs from traditional address-centric communication and uses a data-centric architecture to enable energy efficient and low latency operation in proximity networks. Our simulation study using STK/OPNET shows that ASCoT architecture is viable.",excluded
21,10.1109/nssmic.2000.949945,IEEE,ieeexplore,https://ieeexplore.ieee.org/document/949945/,data driven architecture,2000-10-20 00:00:00,,,,,error handling for the cdf silicon vertex tracker,"The SVT online tracker for the CDF upgrade reconstructs two-dimensional tracks using information from the Silicon Vertex detector (SVXII) and the Central Outer Tracker (COT). The SVT has an event rate of 100 kHz and a latency time of 10 /spl mu/s. The system is composed of 104 VME 9U digital boards (of 8 different types) and it is implemented as a data driven architecture. Each board runs on its own 30 MHz clock. Since the data output from the SVT (few Mbytes/sec) are a small fraction of the input data (200 Mbytes/sec), it is extremely difficult to track possible internal errors by using only the output stream. For this reason several diagnostic tools have been implemented: local error registers, error bits propagated through the data streams and the Spy Buffer system. Data flowing through each input and output stream of every board are continuously copied to memory banks named Spy Buffers which act as built in logic state analyzers hooked continuously to internal data streams. The contents of all buffers can be frozen at any time (e.g. on error detection) to take a snapshot of all data flowing through each SVT board. The Spy Buffers are coordinated at system level by the Spy Control Board. The architecture, design and implementation of this system are described.",architecture
22,10.1007/978-3-319-75429-1_18,Springer,springer,http://link.springer.com/openurl/fulltext?id=doi:10.1007/978-3-319-75429-1_18,data driven architecture,2018-01-01 00:00:00,,,,,big data driven architecture for medical knowledge management systems in intracranial hemorrhage diagnosis,"Stroke is the most common and dangerous cerebrovascular disease. According to the statistics from World Health Organization (WHO), only following heart attack, stroke is one of the two leading causes of human deaths. In addition, in Vietnam, a shortage of specialized equipment and qualified professionals is becoming a significant problem for not only accurate diagnosis but also timely and effective treatment of stroke, especially intracranial hemorrhage (ICH), an acute case of stroke. This research will analyze challenges and show solutions for constructing an effective knowledge system in ICH diagnosis and treatment that helps to shorten professional gap among hospitals and regions. We suggest a service-oriented architecture for the big data driven knowledge system based on medical imaging of ICH. The architecture ensures the development of knowledge obeying a systematic and complete process including the exploration and exploitation of knowledge from medical imaging. Besides, the architecture adapts to modern trends in knowledge service modeling.",architecture
23,10.1109/tns.2006.870173,IEEE,ieeexplore,https://ieeexplore.ieee.org/document/1610954/,data driven architecture,2006-02-01 00:00:00,,,,,design and evaluation of the clear-pem scanner for positron emission mammography,"The design and evaluation of the imaging system Clear-PEM for positron emission mammography, under development by the PEM Consortium within the framework of the Crystal Clear Collaboration at CERN, is presented. The proposed apparatus is based on fast, segmented, high atomic number radiation sensors with depth-of-interaction measurement capabilities, and state-of-the-art data acquisition techniques. The camera consists of two compact and planar detector heads with dimensions 16.5/spl times/14.5 cm/sup 2/ for breast and axilla imaging. Low-noise integrated electronics provide signal amplification and analog multiplexing based on a new data-driven architecture. The coincidence trigger and data acquisition architecture makes extensive use of pipeline processing structures and multi-event memories for high efficiency up to a data acquisition rate of one million events/s. Experimental validation of the detection techniques, namely the basic properties of the radiation sensors and the ability to measure the depth-of-interaction of the incoming photons, are presented. System performance in terms of detection sensitivity, count-rates and reconstructed image spatial resolution were also evaluated by means of a detailed Monte Carlo simulation and an iterative image reconstruction algorithm.",excluded
24,10.3390/electronics10151810,'MDPI AG',core,,data oriented architecture,2021-07-01 00:00:00,,,,,on-board data management layer: connected vehicle as data platform,"For connected vehicles, as well as generally for the transportation sector, data are now seen as a precious resource. They can be used to make right decisions, improve road safety, reduce CO2 emissions, or optimize processes. However, analyzing these data is not so much a question of which technologies to use, but rather about where these data are analyzed. Thereby, the emerging vehicle architecture has to become a data-oriented architecture based on embedded computing platforms and take into account new applications, artificial intelligence elements, advanced analytics, and operating systems. Accordingly, in this paper, we introduce the concept of data management to the vehicle by proposing an on-board data management layer, so that the vehicle can play the role of data platform capable of storing, processing, and diffusing data. Our proposed layer supports analytics and data science to deliver additional value from the connected vehicle data and stimulate the development of new services. In addition, our data platform can also form or contribute to shaping the backbone of data-driven transport. An on-board platform was built where the dataset size was reduced 80% and a rate of 99% accuracy was achieved in a 5 min traffic flow prediction using artificial neural networks (ANNs)",excluded
25,10.1109/tcc.2015.2474385,IEEE,ieeexplore,https://ieeexplore.ieee.org/document/7229313/,data centric architecture,2020-06-01 00:00:00,,,,,cross-cloud mapreduce for big data,"MapReduce plays a critical role as a leading framework for big data analytics. In this paper, we consider a geo-distributed cloud architecture that provides MapReduce services based on the big data collected from end users all over the world. Existing work handles MapReduce jobs by a traditional computation-centric approach that all input data distributed in multiple clouds are aggregated to a virtual cluster that resides in a single cloud. Its poor efficiency and high cost for big data support motivate us to propose a novel data-centric architecture with three key techniques, namely, cross-cloud virtual cluster, data-centric job placement, and network coding based traffic routing. Our design leads to an optimization framework with the objective of minimizing both computation and transmission cost for running a set of MapReduce jobs in geo-distributed clouds. We further design a parallel algorithm by decomposing the original large-scale problem into several distributively solvable subproblems that are coordinated by a high-level master problem. Finally, we conduct real-world experiments and extensive simulations to show that our proposal significantly outperforms the existing works.",excluded
26,10.1109/issnip.2005.1595552,IEEE,ieeexplore,https://ieeexplore.ieee.org/document/1595552/,data centric architecture,2005-12-08 00:00:00,,,,,architectures for wireless sensor networks,Various architectures have been developed for wireless sensor networks. Many of them leave to the programmer important concepts as the way in which the inter-task communication and dynamic reconfigurations are addressed. In this paper we describe the characteristics of a new architecture we proposed - the data-centric architecture. This architecture offers an easy way of structuring the applications designed for wireless sensor nodes that confers them superior performances.,architecture
27,10.1109/icacc.2010.5487131,IEEE,ieeexplore,https://ieeexplore.ieee.org/document/5487131/,data oriented architecture,2010-03-29 00:00:00,,,,,data-oriented architecture of ln function,"In this paper a new architecture to calculate Ln function based on data-oriented theory is introduced. Because of using proper and huge amount of data in modeling, implementing of this type of models causes less calculation complexity. Data-oriented architecture is made of considering memory and small calculation unit together. Proposed method calculates Ln function faster than common methods.",architecture
28,10.1109/icsea.2010.30,IEEE,ieeexplore,https://ieeexplore.ieee.org/document/5615125/,data centric architecture,2010-08-27 00:00:00,,,,,content server architecture pattern for evolvability and scalability,"Significant requirements for a large digital preservation system are the system scalability, its ability to store and service heterogeneous digital holdings, and the evolvability over time of both the technologies comprising the system and the data formats in its storage. The use of information technology by the government, business corporations, academic institutions, and the general public results in staggering amounts of digital-born materials requiring long-term preservation and access. Organizations in different domains have to cope with the daunting task of storing and providing access to the growing amount of digital data. In many cases data heterogeneity, which ranges from office automation and geospatial images, to multimedia artifacts, adds to the challenge. In response to these challenges, we propose a Content Server Architecture Pattern. Content Server Architecture Pattern can be applied for instantiation of data-centric architecture, service-centric architecture, storage technology-centric architecture or an architecture that is some hybrid of that set to implement a Content Server Repository portion of a digital preservation system. A key characteristic of Content Server Architecture Pattern is its versatility that allows tailoring of the architecture of a digital preservation system to specific business needs.",excluded
29,,,core,,data centric architecture,2009-08-31 00:00:00,,,,,a context-oriented synchronization approach,"Synchronization gained great importance in modern applications and allows mobility in the context of information technology. Users are not limited to one computer any more, but can take their data with them on a laptop. Two common architectures have been developed recently, the Data-Centric Architecture as well as the Service-Oriented Architecture. This paper compares two existing technologies for the implementation of a mobile client and introduces a new approach, developed based on the requirements of a major insurance company, the Context-Oriented Architecture. This approach allows detection and resolution of conflicts within the context in which the objects were changed, while still ensuring data correctness and consistency. Therefore two new synchronization concepts are introduced: the synchronization of complex objects and dialogue-sensitive synchronization. An application implementing this approach has been realized and successfully deployed. 1",excluded
30,10.1109/icdcsw.2003.1203556,IEEE,ieeexplore,https://ieeexplore.ieee.org/document/1203556/,data centric architecture,2003-05-22 00:00:00,,,,,"""data-centric to the max"", the splice architecture experience","Over the past 10 years, Thales Naval Nederland (TNN) has successfully applied a pure data-centric architecture called SPLICE in its naval Combat Management Systems This fielded architecture provides the essential non-functional properties as demanded in these mission-critical environments such as (real-time) performance, scalability, fault-tolerance and evolveability. Thales recently contributed this knowledge and experience in a joint submission regarding the OMG's Data Distribution Service (DDS) for Real-time systems. The SPLICE architecture is characterized by autonomous applications with minimal dependencies where function and interaction are clearly separated and SPLICE-agents act as real-time information brokers. SPLICE thus offers a normalized environment that is designed once for all applications and which delivers 'the right information at the right place at the right time'.",architecture
31,10.1007/978-3-642-39200-9_5,Springer,springer,http://link.springer.com/openurl/fulltext?id=doi:10.1007/978-3-642-39200-9_5,data driven architecture,2013-01-01 00:00:00,,,,,semantic data driven interfaces for web applications,"Modern day interfaces must deal with a large number of heterogeneity factors, such as varying user profiles and runtime hardware and software platforms. These conditions require interfaces that can adapt to the changes in the <user, platform, environment> triad. The Model-Based User Interface approach has been proposed as a way to deal with these requirements. In this paper we present a data-driven, rule-based interface definition model capable of taking into account the semantics of the data it is manipulating, especially in the case of Linked Data. An implementation architecture based on the Synth environment supporting this model is presented.",excluded
32,10.1109/access.2021.3091716,IEEE,ieeexplore,https://ieeexplore.ieee.org/document/9462829/,data driven architecture,2021-01-01 00:00:00,,,,,modeling and key technologies of a data-driven smart city system,"The smart city operation and management center with a hierarchical data-driven architecture has already become one of the most widely used solutions for smart cities in practice, solving the problems associated with data acquisition, data gathering and storage, data processing, and data application. At present, the construction of smart city operation and management center faces bottlenecks such as incomplete top-level design theory, the insufficient integration capability of software and hardware, the low efficiency of data collection and aggregation, and the lack of intelligence in data analysis and application. Aiming to address the above problems, this paper proposes a `two-dimension, three-layer, and six-goal' top-level design model for a smart city, with six principles for a smart city operational pattern, and focuses on three key technologies: (1) infrastructure integration and application, (2) multidimensional perception data collection and aggregation, and (3) intelligent data analysis and data service. Following the guidance of this model, Longgang District of Shenzhen has constructed a smart city operation and management center including integrated ICT infrastructure, an urban fine management system, and an intelligent urban data analysis and service system. The actual effects and quantitative improvements in the practical case show that the top-level design model of a smart city proposed in this paper has achieved successful results, and it thereby offers an applicability model of a smart city that can be referenced and replicated.",architecture
33,10.1109/icepe.2014.6970070,IEEE,ieeexplore,https://ieeexplore.ieee.org/document/6970070/,data oriented architecture,2014-10-18 00:00:00,,,,,domain specific languages in power systems engineering,"This paper proposes an information system for data mining that allows the specification of ad-hoc queries on a data warehouse, which contain historical information relative to exceptions (i.e., operating faults) recorded by a SCADA system in a power distribution network. The proposed application can be used by the power system engineers to explore the existent historical data, with no need for any “low level” programming expertise. The data-oriented architecture of the system provides important advantages related to application development and system maintainability.",architecture
34,10.1109/bigdata.2015.7363971,IEEE,ieeexplore,https://ieeexplore.ieee.org/document/7363971/,data centric architecture,2015-11-01 00:00:00,,,,,component based dataflow processing framework,"In this paper we present SOA based CLAs12 event Reconstruction and Analyses (CLARA) framework used to develop Earth Science multi-sensor data fusion, processing, and analytics applications (NAIADS: NASA JLAB collaboration). CLARA design focus is on two main traits: a) real-time data stream processing, and b) service oriented architecture (SOA) in a flow based programming (FBP) paradigm. Data driven and data centric architecture of CLARA presents an environment for developing agile, elastic, multilingual data processing applications. The CLARA framework presents solutions, capable of processing large volumes of data interactively and substantially faster than batch systems.",excluded
35,10.1109/tina.1997.660723,IEEE,ieeexplore,https://ieeexplore.ieee.org/document/660723/,data driven architecture,1997-11-20 00:00:00,,,,,data-driven implementation of tina kernel transport network,"To realize the actual TINA-based telecommunications network, the performance of the kernel Transport Network (kTN) such as availability, reliability, throughput and load tolerance becomes more crucial than for existing computer networks. The authors have been studying and developing a super-integrated data-driven processor to be applied to the TINA kTN nodes and network interfaces in CUE (Coordinating Users' requirements and Engineering constraints) project. Since the processor is primarily designed to be a scalable VLSI component, it is easily interconnected to form a super-integrated chip and multi-chip system for achieving the performance and reliability demanded in a TINA environment. We first examine the requirements for kTN. A stream-oriented data-driven architecture is then proposed with special emphasis on effective multiprocessing capability with overload tolerance. After that, we demonstrate that autonomous load balancing among super-integrated data-driven processors without adding any runtime overhead to achieve effective and reliable multiprocessing is possible by utilizing the overload tolerance of the processor. Finally, this paper shows preliminary performance estimations of the super-integrated data-driven processor being developed to perform efficient multiprocessing in protocol handling such as TCP/IP.",architecture
36,10.1109/cluster.2012.80,IEEE,ieeexplore,https://ieeexplore.ieee.org/document/6337781/,data centric architecture,2012-09-28 00:00:00,,,,,a decoupled execution paradigm for data-intensive high-end computing,"High-end computing (HEC) applications in critical areas of science and technology tend to be more and more data intensive. I/O has become a vital performance bottleneck of modern HEC practice. Conventional HEC execution paradigms, however, are computing-centric for computation intensive applications. They are designed to utilize memory and CPU performance and have inherent limitations in addressing the critical I/O bottleneck issues of HEC. In this study, we propose a decoupled execution paradigm (DEP) to address the challenging I/O bottleneck issues. DEP is the first paradigm enabling users to identify and handle data-intensive operations separately. It can significantly reduce costly data movement and is better than the existing execution paradigms for data-intensive applications. The initial experimental tests have confirmed its promising potential. Its data-centric architecture could have an impact in future HEC systems, programming models, and algorithms design and development.",architecture
37,'elsevier bv',https://core.ac.uk/download/146492122.pdf,core,,data driven architecture,2013-01-01 00:00:00,,,,,10.1016/j.procs.2013.05.357,"Cloud computing urges the need for novel on-demand approaches, where the Quality of Service (QoS) requirements of cloud-based services can dynamically and adaptively evolve at runtime as Service Level Agreement (SLA) and environment changes. Given the unpredictable, dynamic and on-demand nature of the cloud, it would be unrealistic to assume that optimal QoS can be achieved at design time. As a result, there is an increasing need for dynamic and self- adaptive QoS optimization solutions to respond to dynamic changes in SLA and the environment. In this context, we posit that the challenge of self-adaptive QoS optimization encompasses two dynamics, which are related to QoS sensitivity and conflicting objectives at runtime. We propose novel design of a dynamic data-driven architecture for optimizing QoS influenced by those dynamics. The architecture leverages on DDDAS primitives by employing distributed simulations and symbiotic feedback loops, to dynamically adapt decision making metaheuristics, which optimizes for QoS tradeoffs in cloud-based systems. We use a scenario to exemplify and evaluate the approach",excluded
38,10.1109/nssmic.2004.1466709,IEEE,ieeexplore,https://ieeexplore.ieee.org/document/1466709/,data driven architecture,2004-10-22 00:00:00,,,,,design and evaluation of the clear-pem detector for positron emission mammography,"The design and evaluation of the imaging system Clear-PEM for positron emission mammography, under development by the PEM Consortium within the framework of the Crystal Clear Collaboration at CERN, is presented. The proposed apparatus is based on fast, segmented, high atomic number radiation sensors with depth-of-interaction measurement capabilities and state-of-the-art data acquisition techniques. The camera consists of two compact and planar detector heads with adequate field-of-view dimensions for breast and axilla imaging. Low-noise integrated electronics provide signal amplification and analog multiplexing based on a new data-driven architecture. The coincidence trigger and data acquisition architecture makes extensive use of pipeline processing structures and multi-event memories for high efficiency up to a data acquisition rate of one million events/s. Experimental validation of the detection techniques, namely the basic properties of the radiation sensors and the ability to measure the depth-of-interaction of the incoming photons, are presented. System performance in terms of detection sensitivity, count-rates and reconstructed image spatial resolution were also evaluated by means of a detailed Monte Carlo simulation and an iterative image reconstruction algorithm.",excluded
39,10.1109/icccn.2019.8847129,IEEE,ieeexplore,https://ieeexplore.ieee.org/document/8847129/,data centric architecture,2019-08-01 00:00:00,,,,,data-centric video for mixed reality,"Network video streaming abstractions tend to replicate the paradigms of hardwired video dating back to analog broadcast. With IP video distribution becoming increasingly realistic for a variety of low-latency applications, this paper looks ahead to a data-centric architecture for video that can provide a superset of features from existing abstractions, to support how video is increasingly being used: for non-linear retrieval, variable speed and spatially selective playback, machine analysis, and other new approaches. As a case study, the paper describes the use of the Named Data Networking (NDN) network architecture within an experimental theatrical work being developed at UCLA. The work, a new play, Entropy Bound, uses NDN to enable a hybrid design paradigm for real-time video that combines properties of streams, buses, and stores. This approach unifies real-time live and historical playback, and is used to support edge-assisted machine learning. The paper introduces the play and its requirements (as well as the NDN components applied and developed), discusses key design patterns enabled and explored and their influence on the application architecture, and describes what was learned through practical implementation in a realworld production setting. The paper intends to inform future experimentation with real-time media over information-centric networking and elaborate on the benefits and challenges of using NDN in practice for mixed reality applications today.",architecture
