id,doi,publisher,database,url,domain,publication_date,algorithm_type,training_schema,algorithm_goal,architecture,title,abstract,status
40,,,core,,data oriented architecture,1994-01-01 00:00:00,,,,,"a language-independent, data-oriented architecture for grapheme-to-phoneme conversion","We report on an implemented grapheme-to-phoneme conversion architecture. Given a set of examples (spelling words with their associated phonetic representation) in a language, a grapheme-to-phoneme conversion system is automatically produced for that language which takes as its input the spelling of words, and produces as its output the phonetic transcription according to the rules implicit in the training data. This paper describes the architecture and focuses on our solution to the alignment problem: given the spelling and the phonetic trancription of a word (often differing in length), these two representations have to be aligned in such a way that grapheme symbols or strings of grapheme symbols are consistently associated with the same phonetic symbol. If this alignment has to be done by hand, it is extremely labour-intensive. 1 Introduction  Grapheme-to-phoneme conversion is an essential module in any text-to-speech system. Various language-specific sources of linguistic knowledge ..",excluded
41,http://arxiv.org/abs/1706.03968v2,arxiv,arxiv,http://arxiv.org/abs/1706.03968v2,data oriented architecture,2017-06-13 00:00:00,,,,,asynchronous graph pattern matching on multiprocessor systems,"Pattern matching on large graphs is the foundation for a variety of
application domains. Strict latency requirements and continuously increasing
graph sizes demand the usage of highly parallel in-memory graph processing
engines that need to consider non-uniform memory access (NUMA) and concurrency
issues to scale up on modern multiprocessor systems. To tackle these aspects,
graph partitioning becomes increasingly important. Hence, we present a
technique to process graph pattern matching on NUMA systems in this paper. As a
scalable pattern matching processing infrastructure, we leverage a
data-oriented architecture that preserves data locality and minimizes
concurrency-related bottlenecks on NUMA systems. We show in detail, how graph
pattern matching can be asynchronously processed on a multiprocessor system.",architecture
42,10.1109/cac.2017.8244168,IEEE,ieeexplore,https://ieeexplore.ieee.org/document/8244168/,data driven architecture,2017-10-22 00:00:00,,,,,design and implementation of data-driven based universal data editing framework,"Apply Integrated Logistics Support (ILS) to weapon equipment can efficiently improve equipment's automation and digital level. ILS needs support of various integrated support systems, which have demands for data editing. Nowadays, most of data editing software used in these systems are customized and provide a form-based editing approach, which becomes an obstacle to carry out ILS. This paper brings forward to design a data-driven based universal data editing framework. In this framework, data models are taken as input and only corresponding data models need to be modified when data change. Firstly, the whole development process of data editing software that adopt form-based development mode is analyzed in detail to find out problems exists in this development mode. Then the data-driven based universal data editing framework is designed. New idea of data-driven architecture is proposed. Data-driven architecture takes data models as input and processes all data models in a universal way. Finally, key technology for framework realization is given.",excluded
43,10.1109/netsys.2019.8854515,IEEE,ieeexplore,https://ieeexplore.ieee.org/document/8854515/,data centric architecture,2019-03-21 00:00:00,,,,,information-centric iot middleware overlay: vsl,"The heart of the Internet of Things (IoT) is data. IoT services processes data from sensors that interface their physical surroundings, and from other software such as Internet weather databases. They produce data to control physical environments via actuators, and offer data to other services. More recently, service-centric designs for managing the IoT have been proposed. Data-centric or name-based communication architectures complement these developments very well. Especially for edge-based or site-local installations, data-centric Internet architectures can be implemented already today, as they do not require any changes at the core. We present the Virtual State Layer (VSL), a site-local data-centric architecture for the IoT. Special features of our solution are full separation of logic and data in IoT services, offering the data-centric VSL interface directly to developers, which significantly reduces the overall system complexity, explicit data modeling, a semantically-rich data item lookup, stream connections between services, and security-by-design. We evaluate our solution regarding usability, performance, scalability, resilience, energy efficiency, and security.",architecture
44,,,core,https://core.ac.uk/download/pdf/10560731.pdf,data centric architecture,2011-01-01 00:00:00,,,,,data serving climate simulation science at the nasa center for climate simulation,"The NASA Center for Climate Simulation (NCCS) provides high performance computational resources, a multi-petabyte archive, and data services in support of climate simulation research and other NASA-sponsored science. This talk describes the NCCS's data-centric architecture and processing, which are evolving in anticipation of researchers' growing requirements for higher resolution simulations and increased data sharing among NCCS users and the external science community",excluded
45,,,core,,data centric architecture,2001-01-01 00:00:00,,,,,adaptive collaboration for wired and wireless platforms - a data-centric architecture for collaboration environments uses xml to adapt shared data dynamically between devices with widely disparate capabilities.,"This article begins by introducing a data-centric  architecture that abstracts collaborative tasks as  editing of data repositories, followed by descriptions  of the role of XML in managing heterogeneity  and intelligent software agents in discovering  network and computing environment condition",excluded
46,10.1109/asru.2007.4430168,IEEE,ieeexplore,https://ieeexplore.ieee.org/document/4430168/,data centric architecture,2007-12-13 00:00:00,,,,,a data-centric architecture for data-driven spoken dialog systems,"Data is becoming increasingly crucial for training and (self-) evaluation of spoken dialog systems (SDS). Data is used to train models (e.g. acoustic models) and is 'forgotten'. Data is generated on-line from the different components of the SDS system, e.g. the dialog manager, as well as from the world it is interacting with (e.g. news streams, ambient sensors etc.). The data is used to evaluate and analyze conversational systems both on-line and off-line. We need to be able query such heterogeneous data for further processing. In this paper we present an approach with two novel components: first, an architecture for SDSs that takes a data-centric view, ensuring persistency and consistency of data as it is generated. The architecture is centered around a database that stores dialog data beyond the lifetime of individual dialog sessions, facilitating dialog mining, annotation, and logging. Second, we take advantage of the state-fullness of the data-centric architecture by means of a lightweight, reactive and inference-based dialog manager that itself is stateless. The feasibility of our approach has been validated within a prototype of a phone-based university help-desk application. We detail SDS architecture and dialog management, model, and data representation.",architecture
47,,,core,,data centric architecture,2004-01-01 00:00:00,,,,,wireless sensor networks dynamic runtime configuration,"Current Wireless Sensor Networks (WSN) use fixed layered architectures, that can be modified only at compile time. Using a non-layered architecture, which allows dynamic loading of modules and automatic reconfiguration to adapt to the surrounding environment was believed to be too resource consuming to be employed. We have created a so-called data centric architecture and developed a new operating system (DCOS), to support it. As we will show in this paper, the new architecture and operating system are good candidates for WSNs, allowing flexibility in the configuration and exploitation of the sensor network",architecture
48,10.1109/bigdata47090.2019.9006235,IEEE,ieeexplore,https://ieeexplore.ieee.org/document/9006235/,data centric architecture,2019-12-12 00:00:00,,,,,hybrid 2d and 3d visual analytics of network simulation data,We present a visualization architecture to support 2D and 3D visual analytics applications. The architecture is designed to be data-flow-oriented and reconfigurable such that several diverse visualization components can operate as one integrated system. Our prototype application allows users to visually analyze the results of a complex 3D network simulation data both on large high-resolution display and HTC Vive Head Mounted Display. The network simulation outputs variables describing various characteristics of network connectivity between the moving nodes on the ground and in the air interacting in a dynamically changing 3D environment. Our system uses 2D charting tools to visualize the statistical relationships between simulation variables. We developed a Unity application to animate the network simulation in a virtual environment showing the timevarying results in a 3D environment. The Unity application runs on a complete-immersive Head Mounted Display device. The 2D visualization framework running on our Large High-Resolution Display system supports multiple coordinated views across all the different 2D visualization components including a 2D map. Preliminary results show our data-centric design provides a usercentric visualization tool that can greatly enhance the analytical process and speed up the derivation of insights from data.,architecture
49,10.1016/j.future.2021.06.020,'Elsevier BV',core,,data centric architecture,2023-06-19 00:00:00,,,,,a big data-centric architecture metamodel for industry 4.0,"The effective implementation of Industry 4.0 requires the reformulation of industrial processes in order to achieve the vertical and horizontal digitalization of the value chain. For this purpose, it is necessary to provide tools that enable their successful implementation. This paper therefore proposes a data-centric, distributed, dynamically scalable reference architecture that integrates cutting-edge technologies being aware of the existence of legacy technology typically present in these environments. In order to make its implementation easier, we have designed a metamodel that collects the description of all the elements involved in a digital platform (data, resources, applications and monitoring metrics) as well as the necessary information to configure, deploy and execute applications on it. Likewise, we provide a tool compliant to the metamodel that automates the generation of configuration, deployment and launch files and their corresponding transference and execution in the nodes of the platform. We show the flexibility, extensibility and validity of our software artefacts through their application in two case studies, one addressed to preprocess and store pollution data and the other one, more complex, which simulates the management of an electric power distribution of a smart city",architecture
50,,"Web Monitoring of EOS Front-End Ground Operations, Science Downlinks and Level 0 Processing",core,,data driven architecture,2008-01-01 00:00:00,,,,,https://core.ac.uk/download/pdf/195383281.pdf,"This paper addresses the efforts undertaken and the technology deployed to aggregate and distribute the metadata characterizing the real-time operations associated with NASA Earth Observing Systems (EOS) high-rate front-end systems and the science data collected at multiple ground stations and forwarded to the Goddard Space Flight Center for level 0 processing. Station operators, mission project management personnel, spacecraft flight operations personnel and data end-users for various EOS missions can retrieve the information at any time from any location having access to the internet. The users are distributed and the EOS systems are distributed but the centralized metadata accessed via an external web server provide an effective global and detailed view of the enterprise-wide events as they are happening. The data-driven architecture and the implementation of applied middleware technology, open source database, open source monitoring tools, and external web server converge nicely to fulfill the various needs of the enterprise. The timeliness and content of the information provided are key to making timely and correct decisions which reduce project risk and enhance overall customer satisfaction. The authors discuss security measures employed to limit access of data to authorized users only",excluded
51,,HAL CCSD,core,https://core.ac.uk/download/145154055.pdf,data centric architecture,2017-03-27 00:00:00,,,,,towards blockchain-based auditable storage and sharing of iot data,"International audienceToday the cloud plays a central role in storing, processing , and distributing data. Despite contributing to the rapid development of various applications, including the IoT, the current centralized storage architecture has led into a myriad of isolated data silos and is preventing the full potential of holistic data-driven analytics for IoT data. In this abstract, we advocate a data-centric design for IoT with focus on resilience, sharing, and auditable protection of information. We introduce the initial design of our blockchain-based end-to-end encrypted data storage system. We enable a secure and persistent data management, by utilizing the blockchain as an auditable access control layer to a decentralized storage layer",excluded
52,10.1007/978-3-030-88207-5_17,Springer,springer,http://link.springer.com/openurl/fulltext?id=doi:10.1007/978-3-030-88207-5_17,data oriented architecture,2021-01-01 00:00:00,,,,,building a big data oriented architecture for enterprise integration,"Digital transformation is happening across all industries and affecting all facets of our daily life. However, in many corporations, this important process is fragmented and is undertaken without a farsighted plan to take advantage of an invaluable resource: data. This can be due to a variety of reasons, for example, lack of funding, poor business vision, inappropriate consulting or deployment. Digital transformation is a considerable investment since it will determine the system’s ability to grow and adapt to the company’s changing requirements. To achieve that end, the architecture must be flexible both in development and deployment and must also be able to harness the ever-increasing data of the corporation. Among the widely used information system architectures being used in the world, Micro-service is a standout with many advantages. The adaptation of this architecture to work with Big Data, as well as to tackle different aspects of a data system such as load-balancing, file handling and storage, etc. is a very practical area of research. This paper presents such an enterprise integration solution for a mega-corporation client in Vietnam, the An Pha Petrol Group Joint Stock Company, including the architecture and technologies used to build a comprehensive system that brings novel experiences to its 2,000 internal users. It consists of building the information infrastructure and system, super applications for both desktop and mobile devices to enhance the work performance and quality. The approaches and results of this paper are applicable to similar large enterprise solutions.",architecture
53,http://arxiv.org/abs/1705.04958v1,arxiv,arxiv,http://arxiv.org/abs/1705.04958v1,data centric architecture,2017-05-14 00:00:00,,,,,a proposed architecture for big data driven supply chain analytics,"Advancement in information and communication technology (ICT) has given rise
to explosion of data in every field of operations. Working with the enormous
volume of data (or Big Data, as it is popularly known as) for extraction of
useful information to support decision making is one of the sources of
competitive advantage for organizations today. Enterprises are leveraging the
power of analytics in formulating business strategy in every facet of their
operations to mitigate business risk. Volatile global market scenario has
compelled the organizations to redefine their supply chain management (SCM). In
this paper, we have delineated the relevance of Big Data and its importance in
managing end to end supply chains for achieving business excellence. A Big
Data-centric architecture for SCM has been proposed that exploits the current
state of the art technology of data management, analytics and visualization.
The security and privacy requirements of a Big Data system have also been
highlighted and several mechanisms have been discussed to implement these
features in a real world Big Data system deployment in the context of SCM. Some
future scope of work has also been pointed out. Keyword: Big Data, Analytics,
Cloud, Architecture, Protocols, Supply Chain Management, Security, Privacy.",excluded
54,10.1109/siot.2016.007,IEEE,ieeexplore,https://ieeexplore.ieee.org/document/7913560/,data centric architecture,2016-09-30 00:00:00,,,,,addressing data-centric security requirements for iot-based systems,"Allowing users to control access to their data is paramount for the success of the Internet of Things, therefore, it is imperative to ensure it, even when data has left the users' control, e.g. shared with cloud infrastructure. Consequently, we propose several state of the art mechanisms from the security and privacy research fields to cope with this requirement. To illustrate how each mechanism can be applied, we derive a data-centric architecture providing access control and privacy guaranties for the users of IoT-based applications. Moreover, we discuss the limitations and challenges related to applying the selected mechanisms to ensure access control remotely. Also, we validate our architecture by showing how it empowers users to control access to their health data in a quantified self use case.",excluded
55,10.1109/icetc.2010.5529337,IEEE,ieeexplore,https://ieeexplore.ieee.org/document/5529337/,data oriented architecture,2010-06-24 00:00:00,,,,,data-oriented architecture of sine,"A data-oriented architecture is introduced to calculate Sine function by using sine data-oriented model as a data structure and a small calculation unit. The main contribution of this paper is to use a content-accessed memory to handle and manage data-oriented model of sine in this architecture. Using this architecture, sine function calculation will be fast.",architecture
56,10.1109/cast.2016.7914932,IEEE,ieeexplore,https://ieeexplore.ieee.org/document/7914932/,data centric architecture,2016-12-21 00:00:00,,,,,big data architecture with mobile cloud in cdroid operating system for storing huge data,We are stepping frontward for an epoch of zeta bytes from Giga/Tera/Peta/Exa bytes in this era of computer science. The data storage in clouds is not the only preference as big data technology is obtainable for processing of both structured and unstructured data. Today a colossal sum of data is engendered by mobile phones (Smartphone) of both the composition types. For the sake of faster processing and elegant data utilization for gigantic quantity of data CDroid operating systems can be implemented with big data. Big data architecture is realized with mobile cloud for paramount deployment of wherewithal. The faster execution can be ended feasible for the make use of a new data centric architecture of MapReduce technology where as HDFS (Hadoop Distributed File System) also plays a big accountability in using data with dissimilar structures. As time advances the degree of data and information generated from smartphone augments and faster execution is call for the same. As per our research and development the only resolution for this mammoth amount of data is to put into practice Big data with CDroid scheme for best use of it. We believe this effort will budge a step ahead on the road to healthier civilization in close proximity to expectations.,architecture
