id,doi,publisher,database,url,domain,publication_date,algorithm_type,training_schema,algorithm_goal,architecture,title,abstract,status
1,,,core,,data centric architecture,2012-01-01 00:00:00,,,,,measurements in opportunistic networks,"Opportunistic networks are a subset of delay tolerant networks where the contacts are unscheduled. Such networks can be formed ad hoc by wire-less devices, such as mobile phones and laptops. In this work we use a data-centric architecture for opportunistic networks to evaluate data dis-semination overhead, congestion in nodes ’ buffer, and the impact of transfer ordering. Dissemination brings an overhead since data is replicated to be spread in the network and overhead leads to congestion, i.e., overloaded buffers. We develop and implement an emulation testbed to experimentally eval-uate properties of opportunistic networks. We evaluate the repeatability of experiments in the emulated testbed that is based on virtual computers. We show that the timing variations are on the order of milliseconds. The testbed was used to investigate overhead in data dissemination, congestion avoidance, and transfer ordering in opportunistic networks. We show that the overhead can be reduced by informing other nodes in the network about what data a node is carrying. Congestion avoidance was evaluated in terms of buffer management, since that is the available tool in an opportunistic network, to handle congestion. It was shown that replication information of data objects in the buffer yields the best results. We show that in a data-centric architecture were each data item is valued differently, transfer ordering is important to achieve delivery of the most valued data. 1 ",excluded
2,10.1109/i-span.2009.67,IEEE,ieeexplore,https://ieeexplore.ieee.org/document/5381871/,data driven architecture,2009-12-16 00:00:00,,,,,a data-driven architecture for remote control of sensors over a wireless sensor network and the internet,"This study revealed an applicable architecture in which a data-driven mechanism was designed to bridge a wireless sensor network (WSN) and the Internet. The system was divided into two independent parts. The first part is the data communication between the sensor network and the database. The other part is the data communication between the database and the user interface (UI). These two parts are connected by the database server. Asynchronous interoperation was introduced while exchanging data between these two parts. Users were not allowed to control the sensors through direct connection to the sensors and can only use the Web service to update the sensor profile built in the database. The sensors were triggered to start the action through a data-update event from the database. A sensor profile built in the database collected all sensor information and all user control command. For the information to be centralized and triggered by the database, regardless of whether sensors were measured in a periodic sampling or an event-driven environment, all sensor actions were triggered through a data-update event in the database. For the sake of improving user experience, a Web-based UI was implemented using scalable vector graphics (SVG) and Ajax technologies. All operations by users were conducted through the Hypertext Transfer Protocol (HTTP) standard method. Therefore, this system can be used via a browser and easily deployed. The proposed architecture is suitable for a healthcare system, a personal body area network, and the Infranet for control.",architecture
3,10.1002/dac.2964,"John Wiley & Sons, Inc.",core,,data centric architecture,2017-01-01 00:00:00,,,,,push applications and dynamic content generation over content-centric networking,"Content-Centric Networking (CCN) represents an established candidate for the future Internet, proposing a routing architecture designed to elevate content to first class entity. Starting from the fact that the network usage has dramatically evolved towards content retrieval, CCN relies on an on-demand pull based mechanism to transfer data from the different sources to the heterogeneous consumers. This paradigm enhances the network in a number of ways, ranging from the newly introduced in-network caching capabilities to the benefits provided by the symmetric data routing adopted by CCN. In this renewed network scenario, we place our attention to those applications that do not perfectly fit the pull paradigm, stating that they need to be supported as well and proposing an effective way to achieve scalability on large scale push applications. We provide the following contributions: (i) we identify the functions that a data-centric architecture should support; (ii) propose and compare our solution with the state of the art framework designed for the specific problem of pushing data to content requesters; and (iii) evaluate their performance in terms of traffic generated and scalability achieved by simulating a real Internet Service Provider (ISP) topology and the realistic workload of a generic social network application",excluded
4,http://arxiv.org/abs/2202.07448v1,arxiv,arxiv,http://arxiv.org/abs/2202.07448v1,data driven architecture,2022-02-04 00:00:00,,,,,"towards a unified pandemic management architecture: survey, challenges
  and future directions","The pandemic caused by SARS-CoV-2 has left an unprecedented impact on health,
economy and society worldwide. Emerging strains are making pandemic management
increasingly challenging. There is an urge to collect epidemiological,
clinical, and physiological data to make an informed decision on mitigation
measures. Advances in the Internet of Things (IoT) and edge computing provide
solutions for pandemic management through data collection and intelligent
computation. While existing data-driven architectures attempt to automate
decision-making, they do not capture the multifaceted interaction among
computational models, communication infrastructure, and the generated data. In
this paper, we perform a survey of the existing approaches for pandemic
management, including online data repositories and contact-tracing
applications. We then envision a unified pandemic management architecture that
leverages the IoT and edge computing to automate recommendations on vaccine
distribution, dynamic lockdown, mobility scheduling and pandemic prediction. We
elucidate the flow of data among the layers of the architecture, namely, cloud,
edge and end device layers. Moreover, we address the privacy implications,
threats, regulations, and existing solutions that may be adapted to optimize
the utility of health data with security guarantees. The paper ends with a
lowdown on the limitations of the architecture and research directions to
enhance its practicality.",excluded
5,10.1109/waina.2013.19,IEEE,ieeexplore,https://ieeexplore.ieee.org/document/6550523/,data centric architecture,2013-03-28 00:00:00,,,,,ccn-tv: a data-centric approach to real-time video services,"Content-Centric Networking (CCN) is a promising data-centric architecture, based on in-network caching, name-driven routing, and receiver-initiated sessions, which can greatly enhance the way Internet resources are currently used, making support for a broader set of users with increasing traffic demands possible. The CCN vision is, currently, attracting the attention of many researchers across the world, since it has all the potential to become ready to the market, to be gradually deployed in the Internet of today, and to facilitate a graceful transition from a host-centric networking rationale to a more effective data-centric working behaviour. At the same time, several issues have to be investigated before CCN can be safely deployed at the Internet scale. They include routing, congestion control, caching operations, name-space planning, and application design. With reference to application-related facets, it is worth noticing that the demand for TV services is growing at an exponential rate over time, thus requiring a very careful analysis of their performance in CCN architectures. To this end, in the present contribution we deploy a CCN-TV system, capable of delivering real-time streaming TV services, and we evaluate its performance through a simulation campaign based on real-world topologies.",excluded
6,10.1109/icacte.2010.5579358,IEEE,ieeexplore,https://ieeexplore.ieee.org/document/5579358/,data oriented architecture,2010-08-22 00:00:00,,,,,data-oriented architecture of sine and cosine functions,"In this paper a new architecture to calculate Sine and Cosine Function based on data-oriented theory is introduced. To compute sine and cosine by this model less mathematical operations are needed comparing to common methods. Therefore, hardware implementation of this architecture provides faster module.",architecture
7,10.1147/jrd.2019.2960220,IBM,ieeexplore,https://ieeexplore.ieee.org/document/8935422/,data centric architecture,2020-07-01 00:00:00,,,,,the coral supercomputer systems,"In 2014, the U.S. Department of Energy (DoE) initiated a multiyear collaboration between Oak Ridge National Laboratory (ORNL), Argonne National Laboratory, and Lawrence Livermore National Laboratory (LLNL), known as “CORAL,” the next major phase in the DoE's scientific computing roadmap. The IBM CORAL systems are based on a fundamentally new data-centric architecture, where compute power is embedded everywhere data resides, combining powerful central processing units (CPUs) with graphics processing units (GPUs) optimized for scientific computing and artificial intelligence workloads. The IBM CORAL systems were built on the combination of mature technologies: 9th-generation POWER CPU, 6th-generation NVIDIA GPU, and 5th-generation Mellanox InfiniBand. These systems are providing scientists with computing power to solve challenges in many research areas beyond previously possible. This article provides an overview of the system solutions deployed at ORNL and LLNL.",architecture
8,,,core,,data centric architecture,2013-09-24 00:00:00,,,,,s.: persistent information state in a data-centric architecture,"We present the ADAMACH data centric dialog system, that allows to perform on- and offline mining of dialog context, speech recognition results and other system-generated representations, both within and across dialogs. The architecture implements a “fat pipeline” for speech and language processing. We detail how the approach integrates domain knowledge and evolving empirical data, based on a user study in the University Helpdesk domain. ",excluded
9,10.2514/6.2012-549,,core,,data centric architecture,2012-01-01 00:00:00,,,,,towards a unified framework using cpacs for geometry management in aircraft design,"The performance requirements for the next generations of airliners are stringent and

require invention and design of unconventional configurations departing from the classical

Cayley functional decomposition. The break with tradition calls for higher fidelity physics-

based predictions of performance early on in the project. The paper makes the case for a

unified, open, data-centric software environment for aircraft design and describes the merge

of the CEASIOM conceptual design software package, developed by a number of partners

including KTH, with the CPACS formalized data management system developed at DLR.

The system provides multi-fidelity and multi-disciplinary analysis capabilities for concur-

rent design by geographically distributed expert teams. The data-centric architecture uses

the CPACS schema and access mechanisms for management of design data across all dis-

ciplines and fidelity levels. This makes the system extensible and mitigates the problems

encountered in handing over the model to later design phases. The concepts have been

tested by interfacing external modules to CEASIOM/CPACS through a graphical CPACS

XML editor, the ACbuilder gateway. Results of comparative analyses on models imported

in this way from the RDS and VAMPzero conceptual design packages are reported here.

CPACS will be released to the general public in spring ’12. The CEASIOM team expe-

rience of joining forces via CPACS with DLR is altogether positive and further in-house

development of software for aircraft performance prediction and design by the CEASIOM

team will use the CPACS system",excluded
10,10.1109/30.982782,IEEE,ieeexplore,https://ieeexplore.ieee.org/document/982782/,data driven architecture,2001-11-01 00:00:00,,,,,a novel hdtv video decoder and decentralized control scheme,"A novel dedicated architecture for an HDTV video decoding chip is developed. Each task is mapped to a highly optimized hardware unit by classifying the video processing tasks into three levels. On the function level, a data driven architecture is adopted to make each processing unit operate once the processing data and buffer are available. Therefore the high computing efficiency of each unit is exploited, hardware is saved, and the computing capability is maximized compared with conventional pipeline decoder. On the system level, a decentralized control scheme is designed to provide high efficient communication between all the processing units to yield the best overall performance. Moreover it features simple control logic and minimum size of the connecting buffers.",architecture
11,,,core,,data centric architecture,2015-08-26 00:00:00,,,,,adaptive collaboration for wired and wireless platforms,"A data-centric architecture for collaboration environments uses XML to adapt shared data dynamically between devices with widely disparate capabilities. Expanding the Internet’s reach withwireless links and mobile terminalsestablishes an infrastructure that permits not only individual roaming but also, potentially, interactive collaboration in a more complex workspace. The classic example is an expert using a 3D CAD model on a workstation to collaborate with someone in the field using a handheld device. The possibilities for collaboration will become more elaborate with advances in visualization technologies for small portable devices (for example, see the MiniGL 3D graphics library from Digita",excluded
12,10.1109/ciot.2018.8627124,IEEE,ieeexplore,https://ieeexplore.ieee.org/document/8627124/,data centric architecture,2018-07-04 00:00:00,,,,,"fogø5: unifying the computing, networking and storage fabrics end-to-end","Fog computing aims at providing horizontal, system-level, abstractions to distribute computing, storage, control and networking functions closer to the user along a cloud-to-thing continuum. Whilst fog computing is increasingly recognized as the key paradigm at the foundation of Consumer and Industrial Internet of Things (IoT), most of the initiatives on fog computing focus on extending cloud infrastructure. As a consequence, these infrastructure fall short in addressing heterogeneity and resource constraints characteristics of fog computing environments. In this paper, we (1) explain the requirements of fog computing infrastructure and how they extend well beyond those traditionally addressed by Cloud Computing infrastructures; (2) introduce fogØ5, a fog Infrastructure that unifies computing, networking and storage fabrics end-to-end, while addressing the challenges imposed by resource heterogeneity, (3) explain the novel architectural approach adopted by fogØ5 to have a server-less data-centric architecture that is scalable, secure, and highly resilient to failures, (4) demonstrate the use of fogØ5 in some real-world use cases and (5) conclude and reports on future works.",architecture
13,10.1049/cp.2012.1116,IET,ieeexplore,https://ieeexplore.ieee.org/document/6492723/,data centric architecture,2012-03-05 00:00:00,,,,,design of real-time distributed system using dds,Data-centric design is a modern method for building advanced real-time distributed system. DDS (Data Distribution Service) is an API specification and an interoperable wire-protocol that defines a data-centric publish-subscribe architecture for connecting the anonymous information providers with the information consumers. The DDS APIs also allow data providers and consumers to present type-safe programming interfaces which are well suited for data-critical real-time distributed systems and QoS-enabled applications. The goal idea of this paper is to present a kind of real-time distributed system based on DDS and a general design of high level API which abstract the publish-subscribe process.,architecture
14,10.1109/iccda.2010.5540715,IEEE,ieeexplore,https://ieeexplore.ieee.org/document/5540715/,data oriented architecture,2010-06-27 00:00:00,,,,,data-oriented architecture for double and single bits error correction using cycle redundancy code,"Error occurs during transferring, storing and retrieving data. Thus error detection and correction is a necessary technique in information technology. Cycle Redundancy Code, CRC, is a common method in error detection. A new method based on data-oriented theory for single and double bit errors correction by using CRC is presented. The conceptual model of presented method as data-oriented architecture is designed to implement it with hardware. This method is able to determine the exact place of one and two bits in error and correct them. In a way, nonzero calculated remainder on receiver is compared with remainder field of the content of Problem Solution Data Structure, PSDS, to find the error location, as a solution.",excluded
15,10.1007/s10845-018-1430-y,Springer,springer,http://link.springer.com/openurl/fulltext?id=doi:10.1007/s10845-018-1430-y,data driven architecture,2020-01-01 00:00:00,,,,,"a data-driven cyber-physical approach for personalised smart, connected product co-development in a cloud-based environment","The rapid development of information and communication technology enables a promising market of information densely product, i.e. smart, connected product (SCP), and also changes the way of user–designer interaction in the product development process. For SCP, massive data generated by users drives its design innovation and somehow determines its final success. Nevertheless, most existing works only look at the new functionalities or values that are derived in the one-way communication by introducing novel data analytics methods. Few work discusses about an effective and systematic approach to enable individual user innovation in such context, i.e. co-development process, which sets the fundamental basis of the prevailing concept of data-driven design. Aiming to fill this gap, this paper proposes a generic data-driven cyber-physical approach for personalised SCP co-development in a cloud-based environment. A novel concept of smart, connected, open architecture product is hence introduced with a generic cyber-physical model established in a cloud-based environment, of which the interaction processes are enabled by co-development toolkits with smartness and connectedness. Both the personalized SCP modelling method and the establishment of its cyber-physical product model are described in details. To further demonstrate the proposed approach, a case study of a smart wearable device (i.e. i-BRE respiratory mask) development process is given with general discussions.",excluded
16,10.1007/978-3-642-04492-2_21,Springer,springer,http://link.springer.com/openurl/fulltext?id=doi:10.1007/978-3-642-04492-2_21,data driven architecture,2009-01-01 00:00:00,,,,,the proposal of service delivery platform built on distributed data driven architecture,"SDP (Service Delivery Platform) is a recommended system platform for NGN (Next Generation Network) that is expected to resolve two common system running problems: one is functional aspects such as high availability and providing effective maintenance methods, the other is cost aspects such as simplifying development method of a service. However, SDP is still on the way to be standardized, and its architecture has two problems: the congestion of service requests and flexibility of enabler, a service component of SDP. This paper explains how to build a SDP by adopting Distributed Data Driven Architecture and how our system resolves the problems by evaluating the prototype.",excluded
17,10.1007/978-94-015-8196-7_6,Springer,springer,http://link.springer.com/openurl/fulltext?id=doi:10.1007/978-94-015-8196-7_6,data driven architecture,1993-01-01 00:00:00,,,,,a parallel image rendering algorithm and architecture based on ray tracing and radiosity shading,"Algorithms for rendering color scenes on a video screen potentially belong to the class of massively parallel algorithms. Developing effective and efficient data-driven architectures for algorithms from this class is in general a hard problem. However, in case of application specific algorithms, such as the rendering algorithm described in this paper, feasible solutions are conceivable. The parallel algorithm/architecture presented in this paper is a linear speed-up accelerator for the rendering of photo realistic scenes in interaction time.",excluded
18,,,core,https://core.ac.uk/download/158321560.pdf,data centric architecture,2017-05-01 00:00:00,,,,,resource management in sensing services with audio applications,"Middleware abstractions, or services, that can bridge the gap between the increasingly pervasive sensors and the sophisticated inference applications exist, but they lack the necessary resource-awareness to support high data-rate sensing modalities such as audio/video. This work therefore investigates the resource management problem in sensing services, with application in audio sensing. First, a modular, data-centric architecture is proposed as the framework within which optimal resource management is studied. Next, the guided-processing principle is proposed to achieve optimized trade-off between resource (energy) and (inference) performance.

On cascade-based systems, empirical results show that the proposed approach significantly improves the detection performance (up to 1.7x and 4x reduction in false-alarm and miss rate, respectively) for the same energy consumption, when compared to the duty-cycling approach. Furthermore, the guided-processing approach is also generalizable to graph-based systems. Resource-efficiency in the multiple-application setting is achieved through the feature-sharing principle. Once applied, the method results in a system that can achieve 9x resource saving and 1.43x improvement in detection performance in an example application.

Based on the encouraging results above, a prototype audio sensing service is built for demonstration. An interference-robust audio classification technique with limited training data would prove valuable within the service, so a novel algorithm with the desired properties is proposed. The technique combines AI-gram time-frequency representation and multidimensional dynamic time warping, and it outperforms the state-of-the-art using the prominent-region-based approach across a wide range of (synthetic, both stationary and transient) interference types and signal-to-interference ratios, and also on field recordings (with areas under the receiver operating characteristic and precision-recall curves being 91% and 87%, respectively)",excluded
19,10.1109/trustcom.2016.0248,IEEE,ieeexplore,https://ieeexplore.ieee.org/document/7847131/,data centric architecture,2016-08-26 00:00:00,,,,,rethinking high performance computing system architecture for scientific big data applications,"The increasingly important data-intensive scientific discovery presents a critical question to the high performance computing (HPC) community - how to efficiently support these growing scientific big data applications with HPC systems that are traditionally designed for big compute applications? The conventional HPC systems are computing-centric and designed for computation-intensive applications. Scientific big data applications have growlingly different characteristics compared to big compute applications. These scientific applications, however, will still largely rely on HPC systems to be solved. In this research, we try to answer this question with a rethinking of HPC system architecture. We study and analyze the potential of a new decoupled HPC system architecture for data-intensive scientific applications. The fundamental idea is to decouple conventional compute nodes and dynamically provision as data processing nodes that focus on data processing capability. We present studies and analyses for such decoupled HPC system architecture. The current results have shown its promising potential. Its data-centric architecture can have an impact in designing and developing future HPC systems for growingly important data-intensive scientific discovery and innovation.",architecture
