doi,title,publisher,content_type,abstract,html_url,publication_title,publication_date,database
10.1109/MSM49833.2020.9201644,A Preliminary Investigation of an Autonomous Vehicle Validation Infrastructure for Smart Cities,IEEE,Conferences,"The research and development of autonomous vehicle has entered the era of commercialization. While the vehicle self-driving technology has been growing rapidly, the validation for autonomous vehicle in terms of driving model, human factor model and traffic model is still maturing. Most of previous infrastructures are mainly focused on validation of those three models separately resorting either on real driving test at physical infrastructure or software simulation in virtualized infrastructure. However, neither the real driving test can cover all possible scenarios of autonomous driving and human factors, nor the virtualized software simulation can generate a feasible model for practical on/off-road driving. Furthermore, future autonomous transport in smart cities requires comprehensive validation. In order for autonomous vehicles to meet the autonomous transport in such complex traffic environment, an integrated testing and simulation infrastructure has been built targeting the systematic validation for autonomous vehicles: the Multi-User Environment for Autonomous Vehicle Innovation (MUEAVI). A preliminary investigation of a new autonomous vehicle validation infrastructure that can serve a multitude of research projects for smart city is presented.",https://ieeexplore.ieee.org/document/9201644/,2020 International Conference Mechatronic Systems and Materials (MSM),1-3 July 2020,ieeexplore
10.1109/ROBOT.1986.1087458,An architecture for reflexive autonomous vehicle control,IEEE,Conferences,"We describe a software architecture to support the planning and control requirements of an autonomous land vehicle. This architecture is designed specifically to handle diverse terrain with maximal speed, efficacy and versatility through the use of a library of reflexive strategies specialized to particular needs. A hierarchy of control is built in which lower level modules perform tasks requiring greatest immediacy while higher level modules perform tasks involving greater assimilation of sensor data. With all levels of the hierarchy operating in parallel, higher level modules perform selective activation and deactivation of lower level responses with limited interference from demands for immediacy, allowing the system to exploit the advantages of both immediate and assimilated data. The reflexive component of this system has been demonstrated both in a detailed real-time simulation and on a small indoor robotic vehicle.",https://ieeexplore.ieee.org/document/1087458/,Proceedings. 1986 IEEE International Conference on Robotics and Automation,7-10 April 1986,ieeexplore
10.1109/IVS.2018.8500461,Autonomous Vehicle Testing and Validation Platform: Integrated Simulation System with Hardware in the Loop*,IEEE,Conferences,"With the development of autonomous driving, offline testing remains an important process allowing low-cost and efficient validation of vehicle performance and vehicle control algorithms in multiple virtual scenarios. This paper aims to propose a novel simulation platform with hardware in the loop (HIL). This platform comprises of four layers: the vehicle simulation layer, the virtual sensors layer, the virtual environment layer and the Electronic Control Unit (ECU) layer for hardware control. Our platform has attained multiple capabilities: (1) it enables the construction and simulation of kinematic car models, various sensors and virtual testing fields; (2) it performs a closed-loop evaluation of scene perception, path planning, decision-making and vehicle control algorithms, whilst also having multi-agent interaction system; (3) it further enables rapid migrations of control and decision-making algorithms from the virtual environment to real self-driving cars. In order to verify the effectiveness of our simulation platform, several experiments have been performed with self-defined car models in virtual scenarios of a public road and an open parking lot and the results are substantial.",https://ieeexplore.ieee.org/document/8500461/,2018 IEEE Intelligent Vehicles Symposium (IV),26-30 June 2018,ieeexplore
10.1109/CMPEUR.1992.218441,Developments in autonomous vehicle navigation,IEEE,Conferences,An approach to autonomous vehicle navigation using neural networks to imitate human driving behavior is presented. The results are based on the measured actions of a real human driver in a real car. The car environment and the information that is recorded during driving are described. The problem that should be solved by the neural network is discussed. The actual learning of the driving task is presented. The quality of the leaned driving behavior is reviewed. The experiments showed that medium-sized neural networks were able to approximate the driving behavior within a maximum error of 5%.&lt;<ETX>&gt;</ETX>,https://ieeexplore.ieee.org/document/218441/,CompEuro 1992 Proceedings Computer Systems and Software Engineering,4-8 May 1992,ieeexplore
10.1109/AICAS51828.2021.9458488,Evaluation of Machine Learning-based Detection against Side-Channel Attacks on Autonomous Vehicle,IEEE,Conferences,"Autonomous vehicles are becoming increasingly popular, but their reliance on computer systems to sense and operate in the physical world has introduced new security risks. Recent studies have shown that using Cache-based Side-Channel Attacks (SCAs) could infer sensitive users' information (e.g., which route the user is taking) highlighting significant vulnerability posed to today's computer systems. As a result, it is crucial to propose effective detection mechanisms against emerging microarchitectural SCAs on autonomous driving systems. In response, we first identify the threat model and victim applications of autonomous driving systems in this work. Next, we explore the suitability of various machine learning-based classifiers trained by information collected from built-in hardware performance counter registers available in modern autonomous vehicle systems. To this end, various supervised machine learning models are implemented for cache-based SCAs detection and precisely compared and characterized in terms of detection accuracy, robustness, and latency of the detection. Our experiments conducted on an Intel Xeon, which Waymo autonomous driving vendor uses, demonstrate that J48 achieves 99.5% accuracy with the highest efficiency compared with other investigated models.",https://ieeexplore.ieee.org/document/9458488/,2021 IEEE 3rd International Conference on Artificial Intelligence Circuits and Systems (AICAS),6-9 June 2021,ieeexplore
10.1109/VTCFall.2017.8288318,Impact to Longitude Velocity Control of Autonomous Vehicle from Human Driver's Distraction Behavior,IEEE,Conferences,"Driver distraction behaviors are usually blind to autonomous vehicles (AVs), leading to probable late preparation for AVs to take emergency measures. Hence, this paper aims to build a bridge between AV control and driver behavior detection, to assist AVs to predict the potential risk and avoid abnormal drivers carefully like experienced drivers. Our main contributions of this paper consist: i) put forward a practicable system framework integrating driver distraction monitoring, vehicle-to-vehicle communication and AV velocity control; ii) provide a real-time driver distraction monitoring implementation building on convolutional neural network trained offline; iii) propose a method of longitude velocity control of AV considering the risk of driver distraction behavior based on model predictive control strategy. Simulation results validate the effectiveness of our work.",https://ieeexplore.ieee.org/document/8288318/,2017 IEEE 86th Vehicular Technology Conference (VTC-Fall),24-27 Sept. 2017,ieeexplore
10.1109/ICMLC.2010.71,Microcontroller Based Neural Network Controlled Low Cost Autonomous Vehicle,IEEE,Conferences,"In this paper, design of a low cost autonomous vehicle based on neural network for navigation in unknown environments is presented. The vehicle is equipped with four ultrasonic sensors for hurdle distance measurement, a wheel encoder for measuring distance traveled, a compass for heading information, a GPS receiver for goal position information, a GSM modem for changing destination place on run time and a nonvolatile RAM for storing waypoint data; all interfaced to a low cost AT89C52 microcontroller. The microcontroller processes the information acquired from the sensors and generates robot motion commands accordingly through neural network. The neural network running inside the microcontroller is a multilayer feed-forward network with back-propagation training algorithm. The network is trained offline with tangent-sigmoid as activation function for neurons and is implemented in real time with piecewise linear approximation of tangent-sigmoid function. Results have shown that upto twenty neurons can be implemented in hidden layer with this technique. The vehicle is tested with varying destination places in outdoor environments containing stationary as well as moving obstacles and is found to reach the set targets successfully.",https://ieeexplore.ieee.org/document/5460762/,2010 Second International Conference on Machine Learning and Computing,9-11 Feb. 2010,ieeexplore
10.1109/URAI.2016.7734068,Monocular vision-based object recognition for autonomous vehicle driving in a real driving environment,IEEE,Conferences,"Nowadays, many attentions have been devoted to autonomous vehicles because the automation of driving technology has a large number of benefits, such as the minimization of risks, the improvement of mobility and ease of drivers. Among many technologies for autonomous driving, road environmental recognition is one of the key issues. In this paper, we present the test results of various object detection algorithms using single monocular camera for autonomous vehicle in real driving conditions. The vision recognition system tested in this paper has three main recognition parts: pedestrian detection, traffic sign and traffic light recognition. We use Histogram of Gradients (HOG) features and detect the pedestrians by Support Vector Machine (SVM). Also features of traffic signs are extracted by Principal Components Analysis (PCA) and canny edge detection is used for traffic lights. These two signals are classified by Neural Network (NN). Algorithms that we tested are implemented in General-Purpose computing on Graphics Processing Units (GPGPU). We show the effectiveness of these methods in real-time applications for autonomous driving.",https://ieeexplore.ieee.org/document/7734068/,2016 13th International Conference on Ubiquitous Robots and Ambient Intelligence (URAI),19-22 Aug. 2016,ieeexplore
10.1109/ICICCS51141.2021.9432186,Pothole and Object Detection for an Autonomous Vehicle Using YOLO,IEEE,Conferences,"Object Detection is an key software and a fundamental task for an autonomous driving system that provides remarkable change in computer vision. İn recent years, company's are planning to launch autonomous vehicle in an full swing that's the most important ascpets for object detection and one of most challenging task for locating specific object from from multiple objects in a specific scenario. The computer vision and machine learning algorithm is the important tool for detecting objects in and around the environment. In this paper, which consists of two parts The first part is implemented on object detection in the surrounding with Yolo (You Only Look Once)Algorithm provides exact classification and position which is configured on newly created datasets for classes of object: a car, a person, a truck, a bus, traffic light, motorcycle, pothole, wetland uses the Convolutional Neural Network and max-polling layer for prediction that improves detecting of small target and these deep learning technique provides a high accuracy for detecting real world. Detecting potholes in Indian road help the autonomous vehicle to move smoothly without getting struck in the potholes. In part two of the proposed method is implemented on Raspberry pi4 a popular embedded computer board explores suitability for the running objects. That solves the real world problems and improves the impact on detecting objects. Knowing pothole and wetland detection for self-driving vehicle is needed badly to solve the road lay problems like: accident, slowing down the transport system these are solved by deep learning.",https://ieeexplore.ieee.org/document/9432186/,2021 5th International Conference on Intelligent Computing and Control Systems (ICICCS),6-8 May 2021,ieeexplore
10.1109/ICC42927.2021.9500318,Reinforcement Learning for Autonomous Vehicle Movements in Wireless Sensor Networks,IEEE,Conferences,"In this work we use autonomous vehicles to improve the performance of Wireless Sensor Networks (WSNs). In contrast to other autonomous vehicle applications, WSNs have two metrics for performance evaluation. First, quality of information (QoI) which is used to measure the quality of sensed data (e.g., measurement uncertainties or signal strength). Second, quality of service (QoS) which is used to measure the network’s performance for data forwarding (e.g., delay and packet losses). As a use case, we consider wireless acoustic sensor networks, where a group of speakers move inside a room and there are autonomous vehicles installed with microphones for streaming the audio data. We formulate the problem as a Markov decision problem (MDP) and solve it using Deep-Q-Networks (DQN). Additionally, we compare the performance of DQN solution to two different real-world implementations: speakers holding/passing microphones and microphones being preinstalled in fixed positions.We show using simulations that the performance of autonomous vehicles in terms of QoI and QoS is better than the real-world implementation in some scenarios. Moreover, we study the impact of the vehicles speed on the learning process of the DQN solution and show how low speeds degrade the performance. Finally, we compare the DQN solution to a heuristic one and provide theoretical analysis of the performance with respect to dynamic WSNs.",https://ieeexplore.ieee.org/document/9500318/,ICC 2021 - IEEE International Conference on Communications,14-23 June 2021,ieeexplore
10.1109/ISORC.2018.00025,Representative Safety Assessment of Autonomous Vehicle for Public Transportation,IEEE,Conferences,"The implementations and testing in real conditions of Autonomous Vehicles (AV) for private usage show important advances. However, a lack still exists in addressing the particularities of AVs for Public Transportation. Such particularities range from limited safety mechanisms aboard, risky situations associated to particular users and complex self-driving situations up to the limited passengers-vehicle interactions possible. Since, to our knowledge, no comprehensive safety assessment actually exists and the current automotive related standards do not address identified aspects, in this paper, we propose to conduct a minimal but representative safety assessment based upon a local but real autonomous vehicle implementation. To conduct our study, the Hazard Analysis and Risks Assessment introduced in the ISO 26262 standard is taken as a basis. Initial outcomes suggest that critical autonomy aspects, like machine learning of complex operational situations, the metrics for quantitative assessment of autonomy, and potential conflicts between autonomy principles and external safety fences can have critical safety impacts and demand further discussions.",https://ieeexplore.ieee.org/document/8421156/,2018 IEEE 21st International Symposium on Real-Time Distributed Computing (ISORC),29-31 May 2018,ieeexplore
,Road following for autonomous vehicle navigation using a concurrent neural classifier,IEEE,Conferences,"The paper presents an original approach for visual identification of road direction of an autonomous vehicle using a neural network classifier called Concurrent Self-Organizing Maps (CSOM), representing a winner-takes-all collection of neural modules. We present the experimental results obtained by computer simulation of our model. The path to be identified has been quantized in 5 output directions. For training and testing the neural model, we captured and labeled a road image data set which has been divided in two lots: 30 images for training and other 30 images for test. We have also performed, trained and tested a real time neural path follower based on CSOM model, implemented on a mobile robot (car toy).",https://ieeexplore.ieee.org/document/4699060/,2008 World Automation Congress,28 Sept.-2 Oct. 2008,ieeexplore
10.1109/ACMI53878.2021.9528185,Speed Bump &amp; Pothole Detection with Single Shot MultiBox Detector Algorithm &amp; Speed Control for Autonomous Vehicle,IEEE,Conferences,"The development of self-driving cars has always been an extensive research field for the automobile industry. To make a capable self-driving car, many challenges need to be resolved. Detection of the road condition is one of them. This paper focuses on a particular part-detection of speed bumps and potholes using a camera and analyzing the video feed with the help of artificial intelligence. To solve this problem a popular and lightweight algorithm, SSD (Single Shot Multibox Detector) is used. This is an optimal choice because of being lightweight and also accurate enough to run on mobile devices and to use in real-life situations. For detecting speed bumps and potholes, a dataset has been created based on the road structure of Bangladesh as the main priority of this system is to work on the local environment. Raspberry Pi has been used as the main processing unit because of being small but powerful. A warning system has been implemented so that it can warn the onboard driver about the upcoming pothole or speed bump. This system can also send a signal to the speed controller unit of the car to reduce the speed on detection to avoid accidents or damages to the car. The speed control unit is a microcontroller-based system that uses an ATmega328 microcontroller and L298 motor driver. This paper summarizes the combination of an artificial intelligence-based detection system injunction with a microcontroller-based speed control system in a cost-effective way that can be used in building self-driving cars.",https://ieeexplore.ieee.org/document/9528185/,"2021 International Conference on Automation, Control and Mechatronics for Industry 4.0 (ACMI)",8-9 July 2021,ieeexplore
10.1109/TCSII.2020.3011367,An Extensive Soft Error Reliability Analysis of a Real Autonomous Vehicle Software Stack,IEEE,Journals,"Automotive systems are integrating artificial intelligence and complex software stacks aiming to interpret the real world, make decisions, and perform actions without human input. The occurrence of soft errors in such systems can lead to wrong decisions, which might ultimately incur in life losses. This brief focuses on the soft error susceptibility assessment of a real automotive application running on top of unmodified Linux kernels, and considering two commercially available processors, and three cross-compilers. Results collected from more than 29 thousand simulation hours show that the occurrence of faults in critical functions may cause 2.16× more failures on the system.",https://ieeexplore.ieee.org/document/9146326/,IEEE Transactions on Circuits and Systems II: Express Briefs,Jan. 2021,ieeexplore
10.1109/ACCESS.2021.3125620,Autonomous Vehicle Evaluation: A Comprehensive Survey on Modeling and Simulation Approaches,IEEE,Journals,"In recent years, autonomous vehicles (AVs), which observe the driving environment and lead a few or all of the driving tasks, have garnered tremendous success. The field of AVs has been rapidly developing and has found many applications. As a safety requirement established by policymakers, these vehicles must be evaluated before their deployment. The evaluation process for AVs is challenging because crashes are rare events, and AVs can escape passing predefined test scenarios. Therefore, capturing crashes and creating real test scenarios should be considered in order to develop an evaluation approach that represents real-world scenarios. One evaluation approach is based on the naturalistic field operational test (N-FOT), in which prototype AVs are driven on roads by volunteers or test engineers. Unfortunately, this approach is time-consuming and costly because thousands of miles need to be driven to experience a police-reported collision and nearly millions of miles for a fatal crash. Another approach is the accelerated evaluation method. The core idea of the accelerated evaluation approach is to modify the statistics of naturalistic driving so that safety-critical events are emphasized. This paper presents a brief survey of the advances that have occurred in the area of the evaluation of partially or fully autonomous vehicles, starting with naturalistic field operational tests (N-FOTs). The review covers the test matrix evaluation, worst-case scenario evaluation (WCSE), Monte Carlo simulations, and accelerated evaluation (AE). We also present all the simulation-based and agent-based modeling approaches that do not follow any evaluation protocol listed above. This study provides a scientific analysis of each evaluation techniques, focusing on their advantages/disadvantages, inherent restrictions, practicability, and optimality. The results reveal that the accelerated evaluation approach outperforms naturalistic field operational tests (N-FOTs), test matrix evaluation, worst-case scenario evaluation (WCSE), and Monte Carlo simulation methods in some of the car-following and lane-change studies when using specific models. Moreover, the agent-based model and augmented and virtual reality approaches show promising results in AV evaluation. Furthermore, integrating machine and deep learning into the available AV evaluation methods can improve their performance and generate encouraging outcomes.",https://ieeexplore.ieee.org/document/9605690/,IEEE Access,2021,ieeexplore
10.1109/ACCESS.2020.2982963,Trajectory Tracking Control Algorithm for Autonomous Vehicle Considering Cornering Characteristics,IEEE,Journals,"Trajectory tracking control is a key technology in the research and development of autonomous vehicles. With the aim of addressing problems such as low control accuracy and poor real-time performance, which can occur easily when an autonomous vehicle avoids obstacles, this research focuses on the trajectory tracking control algorithm for autonomous vehicle considering cornering characteristics. First, the vehicle dynamics model and tire model are established through appropriate simplification. Then, based on the basic principle of model predictive control, a linear time-varying model predictive controller (LTV MPC) that considers the cornering characteristics is designed and optimized. Finally, using CarSim and MATLAB/Simulink software, a joint simulation model is established and the trajectory tracking performance of the controlled vehicle under different vehicle speeds and road adhesion conditions are tested through simulation experiments in combination with the double-shift line reference trajectory. The simulation results show the LTV MPC controller that considers cornering characteristics has good self-adaptability under complicated and severe working conditions, and no cases, such as car sideslip or track departure, were observed. Compared with other controllers and algorithms, the designed trajectory tracking controller has remarkable comprehensive performance, exhibits superior robustness and anti-interference ability, and significant improvements in the trajectory tracking control accuracy and real-time performance. The proposed control algorithm is of great importance in improving the tracking stability and driving safety of autonomous vehicles under complex extreme conditions and conducive to the further development and improvement of the technological level of intelligent vehicle driving assistance.",https://ieeexplore.ieee.org/document/9045954/,IEEE Access,2020,ieeexplore
10.1109/ISSCC.2009.4977352,A 201.4GOPS 496mW real-time multi-object recognition processor with bio-inspired neural perception engine,IEEE,Conferences,"The visual attention mechanism, which is the way humans perform object recognition, was applied to the implementation of a high performance object recognition chip. Even though the previous chip achieved 50% gain of computational cost, it could recognize only one object in a frame so that it is not suitable for advanced multi-object recognition applications such as video surveillance, intelligent robots, and autonomous vehicle",https://ieeexplore.ieee.org/document/4977352/,2009 IEEE International Solid-State Circuits Conference - Digest of Technical Papers,8-12 Feb. 2009,ieeexplore
