doi,title,publisher,content_type,abstract,html_url,publication_title,publication_date,database
10.1109/TIE.2017.2764849,A Vision-Aided Approach to Perching a Bioinspired Unmanned Aerial Vehicle,IEEE,Journals,"This paper presents the implementation of a machine learning approach for replicating highly adaptive avian perching behavior. With full consideration of both the configuration of flying vehicles and perching principles, a bioinspired aerial robot comprising one flight subsystem and one perching subsystem is designed. Based on the real-time landing speed and attitude, a novel type of soft grasping mechanism for dexterous perching is proposed to provide adhesive force and absorb impact force. During the critical perching phase, the dynamics of the perching actuator change with the touchdown conditions and the type of perching target. A hybrid automation of a time-to-contact theory-based attitude controller and a robust self-localization system are utilized to regulate the desired perching maneuvers. The experimental results are provided to attest to the effectiveness of the proposed perching method.",https://ieeexplore.ieee.org/document/8074761/,IEEE Transactions on Industrial Electronics,May 2018,ieeexplore
10.1109/ICRA.2019.8794446,A Reinforcement Learning Approach for Control of a Nature-Inspired Aerial Vehicle,IEEE,Conferences,"In this work, reinforcement learning is used to develop a position controller for an underactuated nature-inspired Unmanned Aerial Vehicle (UAV). This particular configuration of UAVs achieves lift by spinning its entire body contrary to standard multi-rotors or fixed-wing aircraft. Deep Deterministic Policy Gradients (DDPG) with Ape-X Distributed Prioritized Experience Replay was used to train neural network function approximators that were implemented as the final control policy. The reinforcement learning agent was trained in simulations and directly ported over to real-life hardware. Position control tests were performed on the learned control policy and compared to a baseline PID controller. The learned controller was found to exhibit better control over the inherent oscillations that arise from the non-linear dynamics of the platform.",https://ieeexplore.ieee.org/document/8794446/,2019 International Conference on Robotics and Automation (ICRA),20-24 May 2019,ieeexplore
10.1109/ICUAS.2019.8798329,A Vision-based Unmanned Aircraft System for Autonomous Grasp &amp; Transport,IEEE,Conferences,"The progress in sensor technologies, computer capabilities and artificial intelligence has endowed the unmanned aircraft system (UAS) with more autonomous abilities. Motivated by the 6th International Unmanned Aerial Vehicle Innovation Grand Prix (UAVGP), a UAS with high degree of autonomy was developed to perform the mission of building a simulated tower using prefabricated components. According to the requirement of the competition, the UAS was designed and implemented from the following four parts: 1) navigation and control, 2) recognition and location, 3) grasp and construction, and 4) task planning and scheduling. Different levels of autonomy have been given to the UAS based on these parts. The system hardware was developed on a quadrotor platform by integrating various components, including sensors, computers, power and grasp mechanism. Software which included precise navigation, mission planning, real-time perception and control was implemented and integrated with the developed UAS hardware. The performance in the test environment and actual competition showed that the UAS could perform the mission without human intervention with high autonomy and reliability. This paper addresses the major components and development process of the UAS and describes its application to the practical mission.",https://ieeexplore.ieee.org/document/8798329/,2019 International Conference on Unmanned Aircraft Systems (ICUAS),11-14 June 2019,ieeexplore
10.23919/URSI-AT-RASC.2018.8471616,A Wireless Method for Drone Identification and Monitoring Using AIS Technology,IEEE,Conferences,"The fast growth of UAV (Unmanned Aerial Vehicle) technology in the last years has allowed to extend the use of these devices in many applications. However, the massive use of drones has alerted many governments about an inadequate usage, mainly in terms of security and terrorism. In regards to this problem, some laws about drone usage have been approved by some countries. Among these laws, it is mandatory that all drones are identified and monitored all the time. In this paper, a wireless prototype to identify drones is proposed. To that end, the AIS (Automatic Identification System) is used to transmit parameters as name, ID, speed or the course of drones. This proposed solution can solve the drone identification problem and even, allows to monitor this device in real time. A prototype of this method has been implemented and tested in a real environment, around many locations in the island of Gran Canaria.",https://ieeexplore.ieee.org/document/8471616/,2018 2nd URSI Atlantic Radio Science Meeting (AT-RASC),28 May-1 June 2018,ieeexplore
10.1109/ITAIC.2011.6030219,A redeployment strategy based on Unmanned Aerial Vehicle in wireless sensor network,IEEE,Conferences,"In reality, holes in large-scale sensor networks are exist due to various reasons, such as energy depletion and randomness deployment. These holes may degrade the detection performance of the entire sensor networks. Based on the probabilistic detection model with false alarm rate, this paper proposes a new redeployment method. A method of using an Unmanned Aerial Vehicle (UAV) was proposed for boundaries of holes detection. In particular, in this paper, the contour graph was used for redeploy the holes based on depth-first strategy. According to the simulation results, the proposed method can attain better coverage rate.",https://ieeexplore.ieee.org/document/6030219/,2011 6th IEEE Joint International Information Technology and Artificial Intelligence Conference,20-22 Aug. 2011,ieeexplore
10.1109/AERO.2005.1559516,A scalable learning system for video recognition,IEEE,Conferences,"Learning has become an essential part of many image and video processing systems, but it is not often used as an end-to-end solution. Some of the most successful demonstrations of end-to-end learning have been with convolutional, or shared weight networks. We are interested in how this approach can scale and have developed a flexible framework for implementing and training large scale convolutional networks called Harpo. We present an overview of the Harpo framework and describe a multilevel learning strategy used to optimize convolutional networks for particular features of interest in video data streams. Harpo is designed to exploit reconfigurable hardware to accelerate massively parallel convolutional network components and achieve real-time processing speeds. In this paper, we present initial software experiments which use the system to segment exhaust plumes coming from military vehicles in unmanned aerial vehicle video data",https://ieeexplore.ieee.org/document/1559516/,2005 IEEE Aerospace Conference,5-12 March 2005,ieeexplore
10.1109/MED.2007.4433822,Attitude and heading refernce system I-AHRS for the EFIGENIA autonomous unmanned aerial vehicles UAV based on MEMS sensor and a neural network strategy for attitude estimation,IEEE,Conferences,"For the autonomous flight, navigation, guidance and control of the EFIGENIA unmanned aerial vehicle it is essential to have high performance 6-DOF attitude and heading reference system measurements. This paper presents the design and development of a real-time intelligent attitude and heading reference system I-AHRS, as in the hardware, as in the intelligent digital neural network software scheme, analysis, design and construction for the orientation calculation for the EFIGENIA EJ-1B MOZART and the EFIGENIA EJ-2B MARIA autonomous unmanned aerial vehicles UAVs. The EFIGENIA I-AHRS consists of three MEMS accelerometers, three MEMS rate-gyros and three magneto-resistive transducers that send its outputs to a digital neural network in which is possible to develop a strategy for attitude estimation. Additionally it is well known that the Kalman Filter is an option as multi-sensor data fusion and integration, however it has some adaptability limitations. In this paper, FPGA reconfigurable hardware digital neural network architecture is presented and utilized to replace the Kalman Filter in the integration of MEMS IMU inertial sensors signals and the Magneto resistive sensors.",https://ieeexplore.ieee.org/document/4433822/,2007 Mediterranean Conference on Control & Automation,27-29 June 2007,ieeexplore
10.1109/UVS.2019.8658283,Automatic Fault Detection of Power Lines using Unmanned Aerial Vehicle (UAV),IEEE,Conferences,"Safety and automation are the two major challenges in the application of Unmanned Aerial Vehicle (UAV), commonly known as drone, to the power lines inspection and fault detection. While current state-of-the-art UAVs are equipped with collision avoidance features, there is less attention to the automatic and real-time fault detection of power lines using UAVs. This paper presents the architecture of three drone-oriented concept designs for automatic and real-time fault detection of power lines using UAVs. The proposed systems could be potential candidates for replacing traditional inspection methods of power lines, which are risky and costly. By incorporating a robust neural network, i.e., Artificial Intelligence (AI), and using appropriate and efficient sensors, the systems can automatically detect various faults and defects on power lines with high precision. We propose three concept design options comprised of different hardware/software components and their feasibility factors. For instance, FLIR Duo Pro R as a thermal sensor and Zenmuse XT for thermal vision have been proposed to be used in the concept designs. For data communication, the proposed designs use cloud-based virtual private network (VPN) for a secure connection between remote control (RC) of the UAV and the server. Based on the advantages and disadvantages of the three proposed design options, the most efficient design is also discussed. This design proposes a system with lightweight sensors, which could increase the flight time of the UAV. Further, the AI interface is coded on to the RC, making it economical, without any database for big data storage. The back-end of the neural network is stored in a cloud server. With the help of GSM antenna, the AI can run on the tablet if there is an available cellular network.",https://ieeexplore.ieee.org/document/8658283/,2019 1st International Conference on Unmanned Vehicle Systems-Oman (UVS),5-7 Feb. 2019,ieeexplore
10.1109/WorldS4.2019.8904014,Autonomous Drone for Defence Machinery Maintenance and Surveillance,IEEE,Conferences,"This proposed research work focuses on the implementation of an autonomous unmanned aerial vehicle (UAV) which is controlled using a pix hawk flight controller. The Quad Copter is capable of navigating autonomously without any real-time input from the user and also programmed to follow a specified path autonomously. The algorithm enables a control technique by which quad copter is empowered to fly autonomously, trajectory tracking, graceful motion and accurate altitude hold performance. Surveillance and Machinery maintenance application are the primary applications designed for the Defense purposes in the Line Of Control and War-zones. This work is aimed to design a quad copter that will follow a command to fly through specified way points. The deep learning algorithm detects human motions and from data acquired camera and ultrasonic sensors to the cloud. On deviations from the standard protocol which is detected using a Sjcam 5000x elite Camera. Also, here a backup auxiliary mini drone is programmed to eject along with the data stored on the primary drone's memory on an unforeseen calamity or an attack that would damage the primary drone's ability to fly.",https://ieeexplore.ieee.org/document/8904014/,2019 Third World Conference on Smart Trends in Systems Security and Sustainablity (WorldS4),30-31 July 2019,ieeexplore
10.1109/UIC-ATC.2017.8397582,Autonomous UAV forced graffiti detection and removal system based on machine learning,IEEE,Conferences,"This paper proposes a smart graffiti clean-up system based on an autonomous Unmanned Aerial Vehicle (UAV) platform. This smart clean system is based on edge detection and machine learning algorithms to realize the detection and tracking of graffiti image in real time. In Graffiti detection, we aim to build a model to detect graffiti on walls which can help navigate the UAV to the correct coordinate and estimate the area of the graffiti. The data set which contain graffiti images are trained using machine learning techniques which will be used for the detections of the graffiti patterns. This will automate the process of detecting the location of the graffiti based on the edge detection technique and the model will be able to estimate the area of the graffiti. To achieve obstacle detection, and collision, a smart navigation approach is also proposed with the help of LiDAR and external camera. The overall graffiti cleanup system contains hardware and software that allow the user to use spray enamel with the reach and scale of an autonomous UAV.",https://ieeexplore.ieee.org/document/8397582/,"2017 IEEE SmartWorld, Ubiquitous Intelligence & Computing, Advanced & Trusted Computed, Scalable Computing & Communications, Cloud & Big Data Computing, Internet of People and Smart City Innovation (SmartWorld/SCALCOM/UIC/ATC/CBDCom/IOP/SCI)",4-8 Aug. 2017,ieeexplore
10.1109/GLOBECOM42002.2020.9322556,Caching Placement and Resource Allocation for AR Application in UAV NOMA Networks,IEEE,Conferences,"The cache-enabling unmanned aerial vehicle (UAV) cellular networks with massive access capability supported by non-orthogonal multiple access (NOMA) are investigated in this paper. The delivery of multi-media contents for the mixed augmented reality (AR) and normal multi-media application is assisted by multiple mobile UAV base stations, which cache popular contents for wireless backhaul link traffic offloading. To cope with the dynamic content requests and mobility of users in practical scenarios, the dynamic optimization problem for user association, caching placement of UAVs, real-time deployment of UAVs, and power allocation of NOMA is modeled as a stackelberg game to minimize the long-term content delivery delay. Specifically, the game is decomposed into a leader level problem and a number of follower level problems. A correction mechanism is added in deep reinforcement learning (DRL) to optimize the user association in leader level. A meta actor network is proposed in DRL to jointly optimize the UAVs caching placement, real-time UAVs deployment and power allocation of NOMA in follower level. Then, a dynamic caching placement and resource allocation algorithm based on multi-agent meta deep reinforcement learning is proposed to minimize the long-term content delivery delay. Finally, we demonstrate that the considerable gains are achieved by the proposed algorithm.",https://ieeexplore.ieee.org/document/9322556/,GLOBECOM 2020 - 2020 IEEE Global Communications Conference,7-11 Dec. 2020,ieeexplore
10.1109/ICAIIC51459.2021.9415209,Controller module implementation to reduce interrupt in CNPC uplink,IEEE,Conferences,"The unmanned aerial vehicle is used in diverse area. In order to make more use of the unmanned aerial vehicle, reliable communication system is required. CNPC has been developed to standardize the communication system for unmanned aerial vehicle over 150kg. CNPC uplink should support diverse UAV in TDD. To implement CNPC in real world, operating system and FPGA should be used with the interface between the two. To reduce the use of interrupts in uplink implementations on FPGA, simple controller is designed to generate signals which act as the interrupts whenever other user message is needed. To implement this controller in FPGA, this paper deals with timing diagram for this module.",https://ieeexplore.ieee.org/document/9415209/,2021 International Conference on Artificial Intelligence in Information and Communication (ICAIIC),13-16 April 2021,ieeexplore
10.1109/VTC2020-Fall49728.2020.9348616,Deep Q-Network Based Dynamic Movement Strategy in a UAV-Assisted Network,IEEE,Conferences,"Unmanned aerial vehicle (UAV)-assisted communications is a promising solution to improve the performance of future wireless networks, where UAVs are deployed as base stations for enhancing the quality of service (QoS) provided to ground users when traditional terrestrial base stations are unavailable or not sufficient. An effective framework is proposed in this paper to manage the dynamic movement of multiple unmanned aerial vehicles (UAVs) in response to ground user mobility, with the objective to maximize the sum data rate of the ground users. First, we discuss the relationship between the air-to-ground (A2G) path loss (PL) and the location of UAVs. Then a deep Q-network (DQN) based method is proposed to adjust the locations of UAVs to maximize the sum data rate of the user equipment (UE). Finally, simulation results show that the proposed method is capable of adjusting UAV locations in a real-time condition to improve the QoS of the entire network.",https://ieeexplore.ieee.org/document/9348616/,2020 IEEE 92nd Vehicular Technology Conference (VTC2020-Fall),18 Nov.-16 Dec. 2020,ieeexplore
10.23919/SoftCOM50211.2020.9238313,Deep Semantic Image Segmentation for UAV-UGV Cooperative Path Planning: A Car Park Use Case,IEEE,Conferences,"Navigation of Unmanned Ground Vehicles (UGV) in unknown environments is an active area of research for mobile robotics. A main hindering factor for UGV navigation is the limited range of the on-board sensors that process only restricted areas of the environment at a time. In addition, most existing approaches process sensor information under the assumption of a static environment. This restrains the exploration capability of the UGV especially in time-critical applications such as search and rescue. The cooperation with an Unmanned Aerial Vehicle (UAV) can provide the UGV with an extended perspective of the environment which enables a better-suited path planning solution that can be adjusted on demand. In this work, we propose a UAV-UGV cooperative path planning approach for dynamic environments by performing semantic segmentation on images acquired from the UAV's view via a deep neural network. The approach is evaluated in a car park scenario, with the goal of providing a path plan to an empty parking space for a ground-based vehicle. The experiments were performed on a created dataset of real-world car park images located in Croatia and Germany, in addition to images from a simulated environment. The segmentation results demonstrate the viability of the proposed approach in producing maps of the dynamic environment on demand and accordingly generating path plans for ground-based vehicles.",https://ieeexplore.ieee.org/document/9238313/,"2020 International Conference on Software, Telecommunications and Computer Networks (SoftCOM)",17-19 Sept. 2020,ieeexplore
10.1109/RAAI52226.2021.9508033,Development of Gasoline-Electric Hybrid Propulsion Surveillance and Reconnaissance VTOL UAV,IEEE,Conferences,"Vertical Take-Off and Landing (VTOL) Unmanned Aerial Vehicles (UAV) have been a high potential topic in the aerospace industry during the last decades due to its multirotor and fixed-wing nature of the aircraft. Besides, having the ability to rapidly deploy from a tight airstrip and gathering Intelligence, Surveillance, and Reconnaissance (ISR) information is the best way to be one step ahead of the enemy. In this paper, we present the implementation and development of gasoline-electric hybrid propulsion VTOL Unmanned Aerial vehicle respectively. The Hybrid propulsion VTOL UAV offers image and real-time video transmission to the ground station with fully autonomous control to get the best view of the enemy from the sky. The gasoline-electric hybrid propulsion system provides long flight endurance with efficient power consumption. The fundamentals of the multirotor and the conventional fixed-wing aircraft present the theoretical background of the aircraft. The accomplished design consists of high-performance multirotor motors with an efficient gasoline engine. Furthermore, the control system architecture, avionics, and power distribution system presented with addressing cost-effective trending design techniques. The performance of the system has been improved using commercially off-the-shelf (COTS) hardware.",https://ieeexplore.ieee.org/document/9508033/,"2021 IEEE International Conference on Robotics, Automation and Artificial Intelligence (RAAI)",21-23 April 2021,ieeexplore
10.1109/SNPD.2007.475,Double Unmanned Aerial Vehicle's Path Planning for Scout via Cross-Entropy Method,IEEE,Conferences,"Cross-entropy has been recently applied to combinatorial optimization problems with satisfying results. This paper introduce the cross-entropy method theory, the way of model making, real time and robust, and the application, in military scout , Unmanned Aerial Vehicle(UAV) is a special tool, with so many advantage in real time and global space. A new method, based on cross-entropy method, was used for the optimal way of double UAV's path planning.",https://ieeexplore.ieee.org/document/4287760/,"Eighth ACIS International Conference on Software Engineering, Artificial Intelligence, Networking, and Parallel/Distributed Computing (SNPD 2007)",30 July-1 Aug. 2007,ieeexplore
,EXPRESS: An Energy-Efficient and Secure Framework for Mobile Edge Computing and Blockchain based Smart Systems,IEEE,Conferences,"As most smart systems such as smart logistic and smart manufacturing are delay sensitive, the current mainstream cloud computing based system architecture is facing the critical issue of high latency over the Internet. Meanwhile, as huge amount of data is generated by smart devices with limited battery and computing power, the increasing demand for energy-efficient machine learning and secure data communication at the network edge has become a hurdle to the success of smart systems. To address these challenges with using smart UAV (Unmanned Aerial Vehicle) delivery system as an example, we propose EXPRESS, a novel energy-efficient and secure framework based on mobile edge computing and blockchain technologies. We focus on computation and data (resource) management which are two of the most prominent components in this framework. The effectiveness of the EXPRESS framework is demonstrated through the implementation of a real-world UAV delivery system. As an open-source framework, EXPRESS can help researchers implement their own prototypes and test their computation and data management strategies in different smart systems. The demo video can be found at https://youtu.be/r3U1iU8tSmk.",https://ieeexplore.ieee.org/document/9286009/,2020 35th IEEE/ACM International Conference on Automated Software Engineering (ASE),21-25 Sept. 2020,ieeexplore
10.1109/ISAECT50560.2020.9523700,Edge-Cloud Architectures Using UAVs Dedicated To Industrial IoT Monitoring And Control Applications,IEEE,Conferences,"The deployment of new technologies to ease the control and management of a massive data volume and its uncertainty is a very significant challenge in the industry. Under the name ""Smart Factory"", the Industrial Internet of Things (IoT) aims to send data from systems that monitor and control the physical world to data processing systems for which cloud computing has proven to be an important tool to meet processing needs. unmanned aerial vehicles (UAVs) are now being introduced as part of IIoT and can perform important tasks. UAVs are now considered one of the best remote sensing techniques for collecting data over large areas. In the field of fog and edge computing, the IoT gateway connects various objects and sensors to the Internet. It function as a common interface for different networks and support different communication protocols. Edge intelligence is expected to replace Deep Learning (DL) computing in the cloud, providing a variety of distributed, low-latency and reliable intelligent services. In this paper, An unmanned aerial vehicle is automatically integrated into an industrial control system through an IoT gateway platform. Rather than sending photos from the UAV to the cloud for processing, an AI cloud trained model is deployed in the IoT gateway and used to process the taken photos. This model is designed to overcome the latency channels of the cloud computing architecture. The results show that the monitoring and tracking process using advanced computing in the IoT gateway is significantly faster than in the cloud.",https://ieeexplore.ieee.org/document/9523700/,2020 International Symposium on Advanced Electrical and Communication Technologies (ISAECT),25-27 Nov. 2020,ieeexplore
