doi,title,publisher,content_type,abstract,html_url,publication_title,publication_date,database
10.1109/ICCE-Berlin.2018.8576190,End to End Learning based Self-Driving using JacintoNet,IEEE,Conferences,"Automated driving functions, like highway driving and parking assist, are getting increasing deployed in high-end cars with the trend moving towards the self-driving car. With the advent of deep learning, many traditional computer vision techniques have been replaced by deep convolutional neural networks (CNN). End to end learning is one of the paradigm for self-driving, in which user provides a input images from the front facing camera to the given neural network and the network outputs the car control signals such as throttle, steering and braking. The paper proposes an embedded friendly convolutional neural network, `Jacintonet', to demonstrate self-driving using end to end learning paradigm in a virtual simulation environment. Paper discusses key learning during the training methodology and presents the results on embedded platform. Texas Instruments (TI) TDA2x System on Chip (SoC) is used as embedded platform for running `Jacintonet', real-time to demonstrate self-driving car in the virtual simulator.",https://ieeexplore.ieee.org/document/8576190/,2018 IEEE 8th International Conference on Consumer Electronics - Berlin (ICCE-Berlin),2-5 Sept. 2018,ieeexplore
10.1109/SysCon48628.2021.9447097,Experimental Validation of a Steering Control System using an Adaptive Fuzzy Controller and Computer Vision,IEEE,Conferences,"This paper proposes an adaptive steering control strategy for self-driving cars based on a Fuzzy Expert System and Reinforcement Learning. Our objective consists in deriving an appropriate control law directly from a real vehicle that allows it to navigate on several types of lanes, by controlling the position in relation to the center of the tracks and also the translation speed of the vehicle. Using an on-line Reinforcement Learning approach, the Fuzzy expert controller is derived considering the coupling and non-linearity of the model on straight and winding tracks. To do this, an embedded camera captures the images and sends them to the computer vision algorithm responsible for performing tracks detection and recognition. From that, the control references which indicate the navigation path and direction on the lane are calculated. The main contribution of this work is to apply an online reinforcement learning approach to tune and optimize the fuzzy steering controller while the vehicle navigates through different routes. Using a real vehicle equipped with an embedded computer and also the implemented web user interface, the learning evolution of the adaptive fuzzy controller can be managed remotely during trial in actual environments. Experimental results showed that the learned fuzzy expert controller controls the self-driving car during the path tracking and precisely performs the execution of different maneuvers.",https://ieeexplore.ieee.org/document/9447097/,2021 IEEE International Systems Conference (SysCon),15 April-15 May 2021,ieeexplore
10.1109/ISQED.2018.8357325,Low cost and power CNN/deep learning solution for automated driving,IEEE,Conferences,"Automated driving functions, like highway driving and parking assist, are increasingly getting deployed in high-end cars with the ultimate goal of realizing self-driving car using Deep learning techniques like convolution neural network (CNN). For mass-market deployment, the embedded solution is required to address the right cost and performance envelope along with security and safety. In the case of automated driving, one of the key functionality is “finding drivable free space”, which is addressed using deep learning techniques like CNN. These CNN networks pose huge computing requirements in terms of hundreds of GOPS/TOPS (Giga or Tera operations per second), which seems beyond the capability of today's embedded SoC. This paper covers various techniques consisting of fixed-point conversion, sparse multiplication, fusing of layers and network pruning, for tailoring on the embedded solution. These techniques are implemented on the device by means of optimized Deep learning library for inference. The paper concludes by demonstrating the results of a CNN network running in real time on TI's TDA2X embedded platform producing a high-quality drivable space output for automated driving.",https://ieeexplore.ieee.org/document/8357325/,2018 19th International Symposium on Quality Electronic Design (ISQED),13-14 March 2018,ieeexplore
10.1109/ITSC.2018.8569665,Monocular Fisheye Camera Depth Estimation Using Sparse LiDAR Supervision,IEEE,Conferences,"Near-field depth estimation around a self-driving car is an important function that can be achieved by four wide-angle fisheye cameras having a field of view of over 180°. Depth estimation based on convolutional neural networks (CNNs) produce state of the art results, but progress is hindered because depth annotation cannot be obtained manually. Synthetic datasets are commonly used but they have limitations. For instance, they do not capture the extensive variability in the appearance of objects like vehicles present in real datasets. There is also a domain shift while performing inference on natural images illustrated by many attempts to handle the domain adaptation explicitly. In this work, we explore an alternate approach of training using sparse LiDAR data as ground truth for depth estimation for fisheye camera. We built our own dataset using our self-driving car setup which has a 64-beam Velodyne LiDAR and four wide angle fisheye cameras. To handle the difference in view-points of LiDAR and fisheye camera, an occlusion resolution mechanism was implemented. We started with Eigen's multiscale convolutional network architecture [1] and improved by modifying activation function and optimizer. We obtained promising results on our dataset with RMSE errors comparable to the state-of-the-art results obtained on KITTI.",https://ieeexplore.ieee.org/document/8569665/,2018 21st International Conference on Intelligent Transportation Systems (ITSC),4-7 Nov. 2018,ieeexplore
10.1109/SMC.2014.6974391,Predicting dynamic computational workload of a self-driving car,IEEE,Conferences,"This study aims at developing a method that predicts the CPU usage patterns of software tasks running on a self-driving car. To ensure safety of such dynamic systems, the worst-case-based CPU utilization analysis has been used; however, the nature of dynamically changing driving contexts requires more flexible approach for an efficient computing resource management. To better understand the dynamic CPU usage patterns, this paper presents an effort of designing a feature vector to represent the information of driving environments and of predicting, using regression methods, the selected tasks' CPU usage patterns given specific driving contexts. Experiments with real-world vehicle data show a promising result and validate the usefulness of the proposed method.",https://ieeexplore.ieee.org/document/6974391/,"2014 IEEE International Conference on Systems, Man, and Cybernetics (SMC)",5-8 Oct. 2014,ieeexplore
10.1109/SAMI50585.2021.9378655,Psychophysiological modelling of trust in technology: Comparative analysis of algorithm ensemble methods,IEEE,Conferences,"Measuring user's trust in technology in real-time using psychophysiological signals depends on the availability of stable, accurate, variance sensitive, and non-bias trust classifier model which can be achieved through ensembling several algorithms. Prior efforts resulted to fairly accurate but unstable models. This article investigates what ensemble method is most suitable for developing an ensemble trust classifier model for assessing users trust in technology with psychophysiological signals. Using a self-driving car game, a within subject four condition experiment was implemented. During which 31 participant were involved, and multimodal psychophysiological data (EEG, ECG, EDA, and Facial-EMG) were recorded. An exhaustive 172 features from time and frequency domain were extracted. Six carefully selected algorithms were combined for developing ensemble trust classifier models using each of the four ensemble methods (voting, bagging, stacking, boosting). The result indicated that the Stack ensemble method was more superior, despite voting method dominating prior studies.",https://ieeexplore.ieee.org/document/9378655/,2021 IEEE 19th World Symposium on Applied Machine Intelligence and Informatics (SAMI),21-23 Jan. 2021,ieeexplore
10.1109/GTSD.2018.8595590,Real-Time Self-Driving Car Navigation Using Deep Neural Network,IEEE,Conferences,"In this paper, a monocular vision-based self-driving car prototype using Deep Neural Network on Raspberry Pi is proposed. Self-driving cars are one of the most increasing interests in recent years as the definitely developing relevant hardware and software technologies toward fully autonomous driving capability with no human intervention. Level-3/4 autonomous vehicles are potentially turning into a reality in near future. Convolutional Neural Networks (CNNs) have been shown to achieve significant performance in various perception and control tasks in comparison to other techniques in the latest years. The key factors behind these impressive results are their ability to learn millions of parameters using a large amount of labeled data. In this work, we concentrate on finding a model that directly maps raw input images to a predicted steering angle as output using a deep neural network. The technical contributions of this work are two-fold. First, the CNN model parameters were trained by using data collected from vehicle platform built with a 1/10 scale RC car, Raspberry Pi 3 Model B computer and front-facing camera. The training data were road images paired with the time-synchronized steering angle generated by manually driving. Second, road tests the model on Raspberry to drive itself in the outdoor environment around oval-shaped and 8-shaped with traffic sign lined track. The experimental results demonstrate the effectiveness and robustness of autopilot model in lane keeping task. Vehicle's top speed is about 5-6km/h in a wide variety of driving conditions, regardless of whether lane markings are present or not.",https://ieeexplore.ieee.org/document/8595590/,2018 4th International Conference on Green Technology and Sustainable Development (GTSD),23-24 Nov. 2018,ieeexplore
10.1109/ACMI53878.2021.9528185,Speed Bump &amp; Pothole Detection with Single Shot MultiBox Detector Algorithm &amp; Speed Control for Autonomous Vehicle,IEEE,Conferences,"The development of self-driving cars has always been an extensive research field for the automobile industry. To make a capable self-driving car, many challenges need to be resolved. Detection of the road condition is one of them. This paper focuses on a particular part-detection of speed bumps and potholes using a camera and analyzing the video feed with the help of artificial intelligence. To solve this problem a popular and lightweight algorithm, SSD (Single Shot Multibox Detector) is used. This is an optimal choice because of being lightweight and also accurate enough to run on mobile devices and to use in real-life situations. For detecting speed bumps and potholes, a dataset has been created based on the road structure of Bangladesh as the main priority of this system is to work on the local environment. Raspberry Pi has been used as the main processing unit because of being small but powerful. A warning system has been implemented so that it can warn the onboard driver about the upcoming pothole or speed bump. This system can also send a signal to the speed controller unit of the car to reduce the speed on detection to avoid accidents or damages to the car. The speed control unit is a microcontroller-based system that uses an ATmega328 microcontroller and L298 motor driver. This paper summarizes the combination of an artificial intelligence-based detection system injunction with a microcontroller-based speed control system in a cost-effective way that can be used in building self-driving cars.",https://ieeexplore.ieee.org/document/9528185/,"2021 International Conference on Automation, Control and Mechatronics for Industry 4.0 (ACMI)",8-9 July 2021,ieeexplore
10.1109/Ubi-Media.2019.00014,The Matter of Deep Reinforcement Learning Towards Practical AI Applications,IEEE,Conferences,"Reinforcement Learning (RL) is an extraordinarily paradigm that aims to solve a complex problem. This technique leverages the traditional feedforward networks with temporal-difference learning to overcome supervised and unsupervised real-world problems. However, RL is one of state-of-the-art topic due to the opaque aspects in design and implementation. Also, in which situation we will get performance gain from RL is still unclear. Therefore, This study firstly examines the impact of Experience Replay in Deep Q-Learning agent with Self-Driving Car application. Secondly, The impact of Eligibility Trace in RNN A3C agents with Breakout AI game application is studied. Our results indicated that these two techniques enhance RL performance by more than 20 percent as compared with traditional RL methods.",https://ieeexplore.ieee.org/document/9049567/,2019 Twelfth International Conference on Ubi-Media Computing (Ubi-Media),5-8 Aug. 2019,ieeexplore
10.1109/ICAMIMIA47173.2019.9223365,Autonomous Car Simulation Using Evolutionary Neural Network Algorithm,IEEE,Conferences,"Automation with artificial intelligence (AI) has widely implemented in robotics, transportation and manufacture. AI has become a powerful technology that change human life and help human more flexible doing something. In this paper, it will show a result of simulation from an autonomous car using the evolutionary neural network algorithm which combines genetic algorithm and neural network. The purpose of the simulation is to test the model that we develop to know the right direction based on the track, so the evolutionary neural network that implemented to the autonomous car be able to deliver the best solution before it implements in the real machine or car technology. Genetic algorithm combines with a neural network to reach an evolution condition. The evolution process is achieved through crossover, mutation and selection process, so the algorithm will give the best result from the iteration of the experiment. The result of our experiment shows that evolutionary neural network algorithm give the best result within 3 layer architecture, with iteration average is 14.5 reach finish point (check point) 3 in the track simulation. Based on the simulation, our car model can find out the right direction.",https://ieeexplore.ieee.org/document/9223365/,"2019 International Conference on Advanced Mechatronics, Intelligent Manufacture and Industrial Automation (ICAMIMIA)",9-10 Oct. 2019,ieeexplore
10.1109/ICST46399.2020.00019,Comparing Offline and Online Testing of Deep Neural Networks: An Autonomous Car Case Study,IEEE,Conferences,"There is a growing body of research on developing testing techniques for Deep Neural Networks (DNNs). We distinguish two general modes of testing for DNNs: Offline testing where DNNs are tested as individual units based on test datasets obtained independently from the DNNs under test, and online testing where DNNs are embedded into a specific application and tested in a close-loop mode in interaction with the application environment. In addition, we identify two sources for generating test datasets for DNNs: Datasets obtained from real-life and datasets generated by simulators. While offline testing can be used with datasets obtained from either sources, online testing is largely confined to using simulators since online testing within real-life applications can be time consuming, expensive and dangerous. In this paper, we study the following two important questions aiming to compare test datasets and testing modes for DNNs: First, can we use simulator-generated data as a reliable substitute to real-world data for the purpose of DNN testing? Second, how do online and offline testing results differ and complement each other? Though these questions are generally relevant to all autonomous systems, we study them in the context of automated driving systems where, as study subjects, we use DNNs automating end-to-end control of cars' steering actuators. Our results show that simulator-generated datasets are able to yield DNN prediction errors that are similar to those obtained by testing DNNs with real-life datasets. Further, offline testing is more optimistic than online testing as many safety violations identified by online testing could not be identified by offline testing, while large prediction errors generated by offline testing always led to severe safety violations detectable by online testing.",https://ieeexplore.ieee.org/document/9159088/,"2020 IEEE 13th International Conference on Software Testing, Validation and Verification (ICST)",24-28 Oct. 2020,ieeexplore
10.1109/ASYU50717.2020.9259830,Real-Time Implementation of Mini Autonomous Car Based on MobileNet - Single Shot Detector,IEEE,Conferences,"In this paper, in order to realize a prototype of an autonomous vehicle, we present a framework that consists of convolutional neural networks and image processing methods. The study is comprised of two main parts as software and hardware. In the hardware part, a small-sized smart video car kit is used as the prototype of the autonomous car. This programmable tool consists of Raspberry Pi, servo motors and a USB webcam whose angle of vision is equal to 120°. In the software part, we propose an algorithm in which we use Convolutional Neural Networks to detect the objects (vehicles, pedestrians, and traffic signs) and Hough transformation to detect the road lanes. Based on the outputs of the object and lane detections, the system decides the speed and the direction of the car in real-time. In our results, the vehicle performs autonomous driving in the scaled real-world application.",https://ieeexplore.ieee.org/document/9259830/,2020 Innovations in Intelligent Systems and Applications Conference (ASYU),15-17 Oct. 2020,ieeexplore
10.1109/TNNLS.2019.2892327,A Novel Dual Successive Projection-Based Model-Free Adaptive Control Method and Application to an Autonomous Car,IEEE,Journals,"In this paper, a novel model-free adaptive control (MFAC) algorithm based on a dual successive projection (DuSP)-MFAC method is proposed, and it is analyzed using the introduced DuSP method and the symmetrically similar structures of the controller and its parameter estimator of MFAC. Then, the proposed DuSP-MFAC scheme is successfully implemented in an autonomous car “Ruilong” for the lateral tracking control problem via converting the trajectory tracking problem into a stabilization problem by using the proposed preview-deviation-yaw angle. This MFAC-based lateral tracking control method was tested and demonstrated satisfactory performance on real roads in Fengtai, Beijing, China, and through successful participation in the Chinese Smart Car Future Challenge Competition held in 2015 and 2016.",https://ieeexplore.ieee.org/document/8641438/,IEEE Transactions on Neural Networks and Learning Systems,Nov. 2019,ieeexplore
10.1109/LRA.2021.3097345,Vision-Based Autonomous Car Racing Using Deep Imitative Reinforcement Learning,IEEE,Journals,"Autonomous car racing is a challenging task in the robotic control area. Traditional modular methods require accurate mapping, localization and planning, which makes them computationally inefficient and sensitive to environmental changes. Recently, deep-learning-based end-to-end systems have shown promising results for autonomous driving/racing. However, they are commonly implemented by supervised imitation learning (IL), which suffers from the distribution mismatch problem, or by reinforcement learning (RL), which requires a huge amount of risky interaction data. In this work, we present a general deep imitative reinforcement learning approach (DIRL), which successfully achieves agile autonomous racing using visual inputs. The driving knowledge is acquired from both IL and model-based RL, where the agent can learn from human teachers as well as perform self-improvement by safely interacting with an offline world model. We validate our algorithm both in a high-fidelity driving simulation and on a real-world 1/20-scale RC-car with limited onboard computation. The evaluation results demonstrate that our method outperforms previous IL and RL methods in terms of sample efficiency and task performance. Demonstration videos are available at https://caipeide.github.io/autorace-dirl/.",https://ieeexplore.ieee.org/document/9488179/,IEEE Robotics and Automation Letters,Oct. 2021,ieeexplore
10.1109/CRV.2018.00024,A Hierarchical Deep Architecture and Mini-batch Selection Method for Joint Traffic Sign and Light Detection,IEEE,Conferences,"Traffic light and sign detectors on autonomous cars are integral for road scene perception. The literature is abundant with deep learning networks that detect either lights or signs, not both, which makes them unsuitable for real-life deployment due to the limited graphics processing unit (GPU) memory and power available on embedded systems. The root cause of this issue is that no public dataset contains both traffic light and sign labels, which leads to difficulties in developing a joint detection framework. We present a deep hierarchical architecture in conjunction with a mini-batch proposal selection mechanism that allows a network to detect both traffic lights and signs from training on separate traffic light and sign datasets. Our method solves the overlapping issue where instances from one dataset are not labelled in the other dataset. We are the first to present a network that performs joint detection on traffic lights and signs. We measure our network on the Tsinghua-Tencent 100K benchmark for traffic sign detection and the Bosch Small Traffic Lights benchmark for traffic light detection and show it outperforms the existing Bosch Small Traffic light state-of-the-art method. We focus on autonomous car deployment and show our network is more suitable than others because of its low memory footprint and real-time image processing time. Qualitative results can be viewed at https://youtu.be/ YmogPzBXOw.",https://ieeexplore.ieee.org/document/8575742/,2018 15th Conference on Computer and Robot Vision (CRV),8-10 May 2018,ieeexplore
10.1109/I-SMAC.2018.8653736,A Novel Design of Autonomous Cars using IoT and Visual Features,IEEE,Conferences,"Autonomous car is a ground vehicle that is capable of driving without user interference. Traffic congestion and number of collisions are major issues in road traffic control due to rapid increase day-by-day. Autonomous cars provide a solution to this problem in an efficient and economical way. The proposed system utilizes mathematical models like neural networks and image processing techniques to sense the environment. This is implemented as three major components: curved road detection (steering), road sign and signal detection and obstacle detection (collision avoidance). Back Propagation is used for steering control with detection of curved roads; Haar features are used for road signal, sign detection and a distance sensor for collision avoidance. Data collected from the sensors is sent to a server for processing. Based on the result, a command is sent to the car. A GPS module attached to the car identifies the location of the car and with the help of a 3rd party location service, route to destination is identified and directions are sent to the car. Wireless networks are used to transmit data between sensors and the server. Python scripts are used to control and integrate all the units together. The designed system can attain high accuracy with real - time constraints.",https://ieeexplore.ieee.org/document/8653736/,"2018 2nd International Conference on I-SMAC (IoT in Social, Mobile, Analytics and Cloud) (I-SMAC)I-SMAC (IoT in Social, Mobile, Analytics and Cloud) (I-SMAC), 2018 2nd International Conference on",30-31 Aug. 2018,ieeexplore
10.1109/ICAMIMIA47173.2019.9223365,Autonomous Car Simulation Using Evolutionary Neural Network Algorithm,IEEE,Conferences,"Automation with artificial intelligence (AI) has widely implemented in robotics, transportation and manufacture. AI has become a powerful technology that change human life and help human more flexible doing something. In this paper, it will show a result of simulation from an autonomous car using the evolutionary neural network algorithm which combines genetic algorithm and neural network. The purpose of the simulation is to test the model that we develop to know the right direction based on the track, so the evolutionary neural network that implemented to the autonomous car be able to deliver the best solution before it implements in the real machine or car technology. Genetic algorithm combines with a neural network to reach an evolution condition. The evolution process is achieved through crossover, mutation and selection process, so the algorithm will give the best result from the iteration of the experiment. The result of our experiment shows that evolutionary neural network algorithm give the best result within 3 layer architecture, with iteration average is 14.5 reach finish point (check point) 3 in the track simulation. Based on the simulation, our car model can find out the right direction.",https://ieeexplore.ieee.org/document/9223365/,"2019 International Conference on Advanced Mechatronics, Intelligent Manufacture and Industrial Automation (ICAMIMIA)",9-10 Oct. 2019,ieeexplore
