contentType,identifier,title,publicationName,doi,publisher,publicationDate,onlineDate,abstract,url,database
Chapter ConferencePaper,doi:10.1007/978-3-319-27400-3_36,Detection of Zero Day Exploits Using Real-Time Social Media Streams,Advances in Nature and Biologically Inspired Computing,10.1007/978-3-319-27400-3_36,Springer,2016-01-01,2015-11-18,"Detection of zero day exploits is a challenging problem. Vulnerabilities that are known only by attackers but not by software vendors and neither by users have severe impact on security of systems and networks. Such vulnerabilities are exploited to intrude systems and often cause leakage of confidential data. Due to the hitherto unknown pattern of the exploitation, real-time detection is hardly possible. Hence, often an incident is detected only long time after it took place, if it is detected at all. More timely detection of attacks is necessary to trigger suitable counter-measures like reconfiguration of firewalls and sending alerts to administrators of other vulnerable targets. Therefore, to know the attributes of a novel attack’s target system supports the protection of other vulnerable systems. We suggest a novel approach of post-incident intrusion detection system, to be precise—a crowd-based intrusion detection system. To accomplish this, we take advantage of social media users’ postings about incidents that affect their user accounts of attacked target systems or their observations about misbehaving online services. Combining knowledge of the attacked systems and reported incidents, we should be able to recognize patterns that define the attributes of vulnerable systems. Furthermore, by matching detected attribute sets with those attributes of well-known attacks, we should be able to link attacks to already existing entries in the Common Vulnerabilities and Exposures database. If a link to an existing entry is not found, we can assume to have detected an exploitation of an unknown vulnerability, i.e., a zero day exploit or the result of an advanced persistent threat. This finding could also be used to direct efforts of examining vulnerabilities of attacked systems and simultaneously lead to faster patch deployment.",http://link.springer.com/openurl/fulltext?id=doi:10.1007/978-3-319-27400-3_36,springer
Article,doi:10.1007/s11018-016-0972-7,Use of Intelligent Sensors to Rapidly Estimate Moisture Content in Moving Pastelike Material During the Drying Process,Measurement Techniques,10.1007/s11018-016-0972-7,Springer,2016-07-01,2016-07-30,"A method is examined that allows the moisture content in moving pastelike material to be estimated rapidly, in real time, in the process of drying. The method is implemented using intelligent moisture sensors that operate on the basis of a neural network.",http://link.springer.com/openurl/fulltext?id=doi:10.1007/s11018-016-0972-7,springer
Chapter ConferencePaper,doi:10.1007/978-981-10-2738-3_39,SocialBot: Behavioral Analysis and Detection,Security in Computing and Communications,10.1007/978-981-10-2738-3_39,Springer,2016-01-01,2016-09-17,"Bots refer to automated software that have the capability to execute commands on receiving instructions from BotMaster. SocialBots are the bots present in Online Social Network (OSN) which mimic the activities of the real users. They have the capability to automatically perform the basic functionalities offered by the OSN platforms. These socialbots have widespread usage in political campaigning and product marketing, but SocialBots can also been used for the purpose of swaying voters, mounting political attacks, manipulating public opinion, etc. Apart from these, SocialBots posses various security risks, one of which is befriending an OSN user thereby gaining access to personal details such as birthday, email id, phone number, address, etc. Detection of these SocialBots is therefore an important problem to be solved in order to maintain the reputation of OSN. Our work concentrates on behavioral analysis of these SocialBots in the OSN and identifying features to be used to develop a model for detection of these Socialbots using machine learning. The model, thus developed, is further used as a background process to create a web-based tool for detection of SocialBots. In our work, we created a SocialBot to perform behavioral analysis. This SocialBot got a good response from the real users and was able to grab 100+ real followers along with some real interactions in form of retweet, mention and direct messages.",http://link.springer.com/openurl/fulltext?id=doi:10.1007/978-981-10-2738-3_39,springer
Article,doi:10.1007/s00339-015-9451-2,Erratum to: Process modeling and parameter optimization using radial basis function neural network and genetic algorithm for laser welding of dissimilar materials,Applied Physics A,10.1007/s00339-015-9451-2,Springer,2015-11-01,2015-09-17,,http://link.springer.com/openurl/fulltext?id=doi:10.1007/s00339-015-9451-2,springer
Chapter ConferencePaper,doi:10.1007/978-3-319-23766-4_46,Hierarchical Deep Learning: A Promising Technique for Opinion Monitoring and Sentiment Analysis in Russian-Language Social Networks,Creativity in Intelligent Technologies and Data Science,10.1007/978-3-319-23766-4_46,Springer,2015-01-01,2015-12-01,,http://link.springer.com/openurl/pdf?id=doi:10.1007/978-3-319-23766-4_46,springer
Chapter,doi:10.1007/978-3-319-16378-9_2,Cognitive Science in Telemedicine: From Psychology to Artificial Intelligence,Tele-oncology,10.1007/978-3-319-16378-9_2,Springer,2015-01-01,,,http://link.springer.com/openurl/fulltext?id=doi:10.1007/978-3-319-16378-9_2,springer
Article,doi:10.1007/s10817-015-9330-8,MizAR 40 for Mizar 40,Journal of Automated Reasoning,10.1007/s10817-015-9330-8,Springer,2015-10-01,2015-07-21,"As a present to Mizar on its 40th anniversary, we develop an AI/ATP system that in 30 seconds of real time on a 14-CPU machine automatically proves 40 % of the theorems in the latest official version of the Mizar Mathematical Library ( MML ). This is a considerable improvement over previous performance of large-theory AI/ATP methods measured on the whole MML . To achieve that, a large suite of AI/ATP methods is employed and further developed. We implement the most useful methods efficiently, to scale them to the 150000 formulas in MML . This reduces the training times over the corpus to 1–3 seconds, allowing a simple practical deployment of the methods in the online automated reasoning service for the Mizar users ( Miz AR $\mathbb {A}\mathbb {R}$ ).",http://link.springer.com/openurl/pdf?id=doi:10.1007/s10817-015-9330-8,springer
Article,doi:10.1007/s11299-014-0145-9,Special issue on “Bounded Rationality updated”,Mind & Society,10.1007/s11299-014-0145-9,Springer,2014-06-01,2014-05-03,,http://link.springer.com/openurl/fulltext?id=doi:10.1007/s11299-014-0145-9,springer
Chapter ReferenceWorkEntry,doi:10.1007/978-1-4614-7320-6_763-1,Model Reproducibility: Overview,Encyclopedia of Computational Neuroscience,10.1007/978-1-4614-7320-6_763-1,Springer,2014-01-01,2014-02-21,,http://link.springer.com/openurl/fulltext?id=doi:10.1007/978-1-4614-7320-6_763-1,springer
Article,doi:10.1007/s11047-013-9402-9,Special issue on the frontiers of natural computing,Natural Computing,10.1007/s11047-013-9402-9,Springer,2013-12-01,2013-10-20,,http://link.springer.com/openurl/fulltext?id=doi:10.1007/s11047-013-9402-9,springer
Article,doi:10.1007/s13218-013-0248-1,From Supervised to Unsupervised Support Vector Machines and Applications in Astronomy,KI - Künstliche Intelligenz,10.1007/s13218-013-0248-1,Springer,2013-08-01,2013-03-29,"Support vector machines are among the most popular techniques in machine learning. Given sufficient labeled data, they often yield excellent results. However, for a variety of real-world tasks, the acquisition of sufficient labeled data can be very time-consuming; unlabeled data, on the other hand, can often be obtained easily in huge quantities. Semi-supervised support vector machines try to take advantage of these additional unlabeled patterns and have been successfully applied in this context. However, they induce a hard combinatorial optimization problem. In this work, we present two optimization strategies that address this task and evaluate the potential of the resulting implementations on real-world data sets, including an example from the field of astronomy.",http://link.springer.com/openurl/fulltext?id=doi:10.1007/s13218-013-0248-1,springer
Chapter ConferencePaper,doi:10.1007/978-3-319-06826-8_20,Location-Based Mobile Recommendations by Hybrid Reasoning on Social Media Streams,Semantic Technology,10.1007/978-3-319-06826-8_20,Springer,2014-01-01,2014-05-21,"In this paper, we introduce BOTTARI: an augmented reality application that offers personalized and location-based recommendations of Point Of Interests based on sentiment analysis with geo-semantic query and reasoning. We present a mobile recommendation platform and application working on semantic technologies (knowledge representation and query for geo-social data, and inductive and deductive stream reasoning), and the lesson learned in deploying BOTTARI in Insadong. We have been collecting and analyzing tweets for three years to rate the few hundreds of restaurants in the district. The results of our study show the commercial feasibility of BOTTARI.",http://link.springer.com/openurl/fulltext?id=doi:10.1007/978-3-319-06826-8_20,springer
Article,doi:10.1007/s10817-014-9303-3,Learning-Assisted Automated Reasoning with Flyspeck,Journal of Automated Reasoning,10.1007/s10817-014-9303-3,Springer,2014-08-01,2014-06-01,"The considerable mathematical knowledge encoded by the Flyspeck project is combined with external automated theorem provers (ATPs) and machine-learning premise selection methods trained on the Flyspeck proofs, producing an AI system capable of proving a wide range of mathematical conjectures automatically. The performance of this architecture is evaluated in a bootstrapping scenario emulating the development of Flyspeck from axioms to the last theorem, each time using only the previous theorems and proofs. It is shown that 39 % of the 14185 theorems could be proved in a push-button mode (without any high-level advice and user interaction) in 30 seconds of real time on a fourteen-CPU workstation. The necessary work involves: (i) an implementation of sound translations of the HOL Light logic to ATP formalisms: untyped first-order, polymorphic typed first-order, and typed higher-order, (ii) export of the dependency information from HOL Light and ATP proofs for the machine learners, and (iii) choice of suitable representations and methods for learning from previous proofs, and their integration as advisors with HOL Light. This work is described and discussed here, and an initial analysis of the body of proofs that were found fully automatically is provided.",http://link.springer.com/openurl/pdf?id=doi:10.1007/s10817-014-9303-3,springer
Chapter ReferenceWorkEntry,doi:10.1007/978-1-4614-7320-6_377-6,Simulation Experiment Description Markup Language (SED-ML),Encyclopedia of Computational Neuroscience,10.1007/978-1-4614-7320-6_377-6,Springer,2013-01-01,,2014-03-15,http://link.springer.com/openurl/fulltext?id=doi:10.1007/978-1-4614-7320-6_377-6,springer
Article,doi:10.1007/s11460-012-0194-y,Machine learning and intelligence science: IScIDE (C),Frontiers of Electrical and Electronic Engineering,10.1007/s11460-012-0194-y,Springer,2012-03-01,,2012-03-02,http://link.springer.com/openurl/pdf?id=doi:10.1007/s11460-012-0194-y,springer
Article,doi:10.1007/s10579-011-9149-9,"E. Francesconi, S. Montemagni, W. Peters, D. Tiscornia: Semantic Processing of Legal Texts: where the language of law meets the law of language (Lecture notes in computer science: lecture notes in artificial intelligence, Vol 6036)",Language Resources and Evaluation,10.1007/s10579-011-9149-9,Springer,2012-03-01,,2011-06-24,http://link.springer.com/openurl/fulltext?id=doi:10.1007/s10579-011-9149-9,springer
Chapter ConferencePaper,doi:10.1007/978-3-642-29262-0_27,Syndromic Classification of Twitter Messages,Electronic Healthcare,10.1007/978-3-642-29262-0_27,Springer,2012-01-01,Recent studies have shown strong correlation between social networking data and national influenza rates. We expanded upon this success to develop an automated text mining system that classifies Twitter messages in real time into six syndromic categories based on key terms from a public health ontology. 10-fold cross validation tests were used to compare Naive Bayes (NB) and Support Vector Machine (SVM) models on a corpus of 7431 Twitter messages. SVM performed better than NB on 4 out of 6 syndromes. The best performing classifiers showed moderately strong F1 scores: respiratory = 86.2 (NB); gastrointestinal = 85.4 (SVM polynomial kernel degree 2); neurological = 88.6 (SVM polynomial kernel degree 1); rash = 86.0 (SVM polynomial kernel degree 1); constitutional = 89.3 (SVM polynomial kernel degree 1); hemorrhagic = 89.9 (NB). The resulting classifiers were deployed together with an EARS C2 aberration detection algorithm in an experimental online system.,,http://link.springer.com/openurl/pdf?id=doi:10.1007/978-3-642-29262-0_27,springer
Article,doi:10.1007/s12369-011-0113-z,Learning the Selection of Actions for an Autonomous Social Robot by Reinforcement Learning Based on Motivations,International Journal of Social Robotics,10.1007/s12369-011-0113-z,Springer,2011-11-01,"Autonomy is a prime issue on robotics field and it is closely related to decision making. Last researches on decision making for social robots are focused on biologically inspired mechanisms for taking decisions. Following this approach, we propose a motivational system for decision making, using internal (drives) and external stimuli for learning to choose the right action. Actions are selected from a finite set of skills in order to keep robot’s needs within an acceptable range. The robot uses reinforcement learning in order to calculate the suitability of every action in each state. The state of the robot is determined by the dominant motivation and its relation to the objects presents in its environment. The used reinforcement learning method exploits a new algorithm called Object Q-Learning. The proposed reduction of the state space and the new algorithm considering the collateral effects (relationship between different objects) results in a suitable algorithm to be applied to robots living in real environments. In this paper, a first implementation of the decision making system and the learning process is implemented on a social robot showing an improvement in robot’s performance. The quality of its performance will be determined by observing the evolution of the robot’s wellbeing.",2011-09-29,http://link.springer.com/openurl/pdf?id=doi:10.1007/s12369-011-0113-z,springer
Article,doi:10.1007/s00146-011-0366-y,Special issue on social impact of AI: killer robots or friendly fridges,AI & SOCIETY,10.1007/s00146-011-0366-y,Springer,2011-10-11,2011-10-11,,http://link.springer.com/openurl/fulltext?id=doi:10.1007/s00146-011-0366-y,springer
Article,doi:10.1007/s11460-011-0120-8,Machine learning and intelligence science: Sino-foreign-interchange workshop on IScIDE2010 (B),Frontiers of Electrical and Electronic Engineering in China,10.1007/s11460-011-0120-8,Springer,2011-06-10,2011-06-10,,http://link.springer.com/openurl/pdf?id=doi:10.1007/s11460-011-0120-8,springer
Article,doi:10.1007/s10994-011-5242-y,The changing science of machine learning,Machine Learning,10.1007/s10994-011-5242-y,Springer,2011-03-01,2011-02-18,,http://link.springer.com/openurl/pdf?id=doi:10.1007/s10994-011-5242-y,springer
Article,doi:10.1007/s11460-011-0136-0,Machine learning and intelligence science: Sino-foreign interchange workshop IScIDE2010 (A),Frontiers of Electrical and Electronic Engineering in China,10.1007/s11460-011-0136-0,Springer,2011-03-01,2011-03-04,,http://link.springer.com/openurl/pdf?id=doi:10.1007/s11460-011-0136-0,springer
Chapter,doi:10.1007/978-90-481-9911-2_6,Conclusions: AI and a Unified Science,Social Understanding,10.1007/978-90-481-9911-2_6,Springer,2011-01-01,2010-11-30,,http://link.springer.com/openurl/fulltext?id=doi:10.1007/978-90-481-9911-2_6,springer
Article,doi:10.1007/s10588-010-9079-x,Going back home,Computational and Mathematical Organization Theory,10.1007/s10588-010-9079-x,Springer,2010-12-01,2010-10-20,,http://link.springer.com/openurl/pdf?id=doi:10.1007/s10588-010-9079-x,springer
Chapter ReferenceWorkEntry,doi:10.1007/978-0-387-39940-9_3008,Machine Learning in Systems Biology,Encyclopedia of Database Systems,10.1007/978-0-387-39940-9_3008,Springer,2009-01-01,,,http://link.springer.com/openurl/fulltext?id=doi:10.1007/978-0-387-39940-9_3008,springer
Chapter ReferenceWorkEntry,doi:10.1007/978-0-387-39940-9_636,Machine Learning in Computational Biology,Encyclopedia of Database Systems,10.1007/978-0-387-39940-9_636,Springer,2009-01-01,,,http://link.springer.com/openurl/fulltext?id=doi:10.1007/978-0-387-39940-9_636,springer
Chapter ConferencePaper,doi:10.1007/978-3-642-17537-4_81,Exploit of Online Social Networks with Community-Based Graph Semi-Supervised Learning,Neural Information Processing. Theory and Algorithms,10.1007/978-3-642-17537-4_81,Springer,2010-01-01,,"With the rapid growth of the Internet, more and more people interact with their friends in online social networks like Facebook. Currently, the privacy issue of online social networks becomes a hot and dynamic research topic. Though some privacy protecting strategies are implemented, they are not stringent enough. Recently, Semi-Supervised Learning (SSL), which has the advantage of utilizing the unlabeled data to achieve better performance, attracts much attention from the web research community. By utilizing a large number of unlabeled data from websites, SSL can effectively infer hidden or sensitive information on the Internet. Furthermore, graph-based SSL is much more suitable for modeling real-world objects with graph characteristics, like online social networks. Thus, we propose a novel Community-based Graph (CG) SSL model that can be applied to exploit security issues in online social networks, then provide two consistent algorithms satisfying distinct needs. In order to evaluate the effectiveness of this model, we conduct a series of experiments on a synthetic data and two real-world data from StudiVZ and Facebook. Experimental results demonstrate that our approach can more accurately and confidently predict sensitive information of online users, comparing to previous models.",http://link.springer.com/openurl/pdf?id=doi:10.1007/978-3-642-17537-4_81,springer
Chapter,doi:10.1007/978-3-642-23418-7_7,New Possibilities in Using of Neural Networks Library for Material Defect Detection Diagnosis,Semantic Methods for Knowledge Management and Communication,10.1007/978-3-642-23418-7_7,Springer,2011-01-01,,"Use of neural network as a tool for a data selection or data mining is well known and discussed many times. Use of neural networks and new software libraries for diagnostics is however not widely used. Our described project deal with a phenomenon of new possibilities in using neural networks implemented in software library for material defect diagnostics which can save a huge amount of money in several special cases. This paper describe also a design and realization of a test application developed in object orientated programming language C#. Developed application classifies data obtained from industrial processes of metallurgical plant. Data used in this project was received during measurement of material diagnostics and its structural defects. Core of developed application is based on neural networks design, which is capable to classify whether the material has defect or not. Basically this project’s aim is to substitute commonly used Statistica software by a special application software solution developed in C#.",http://link.springer.com/openurl/pdf?id=doi:10.1007/978-3-642-23418-7_7,springer
Article,doi:10.1007/s10472-008-9105-6,"Editorial: Annals of Mathematics and Artificial Intelligence special issue on multi-robot coverage, search, and exploration",Annals of Mathematics and Artificial Intelligence,10.1007/s10472-008-9105-6,Springer,2008-04-01,2009-03-04,,http://link.springer.com/openurl/pdf?id=doi:10.1007/s10472-008-9105-6,springer
Article,doi:10.1186/1471-2105-8-S10-S1,NIPS workshop on New Problems and Methods in Computational Biology,BMC Bioinformatics,10.1186/1471-2105-8-S10-S1,BioMed Central,2007-12-21,2007-12-21,,https://www.biomedcentral.com/openurl?doi=10.1186/1471-2105-8-S10-S1,springer
Article,doi:10.1134/S1028334X07090176,Possibility of realization of contact-free electromagnetic geothermometer,Doklady Earth Sciences,10.1134/S1028334X07090176,Springer,2007-12-01,,,http://link.springer.com/openurl/pdf?id=doi:10.1134/S1028334X07090176,springer
Article,doi:10.1007/s10514-007-9025-z,Introduction to the special issue on the science behind embodied AI : The robots of the AAAI competition and exhibition,Autonomous Robots,10.1007/s10514-007-9025-z,Springer,2007-05-01,2007-02-07,,http://link.springer.com/openurl/pdf?id=doi:10.1007/s10514-007-9025-z,springer
Article,doi:10.1007/s10462-008-9070-9,Editorial: the 18th artificial intelligence and cognitive science conference (AICS-07),Artificial Intelligence Review,10.1007/s10462-008-9070-9,Springer,2007-04-01,2008-09-13,,http://link.springer.com/openurl/pdf?id=doi:10.1007/s10462-008-9070-9,springer
Article,doi:10.1007/s10462-007-9054-1,Editorial: The 17th Artificial Intelligence and Cognitive Science Conference (AICS-06),Artificial Intelligence Review,10.1007/s10462-007-9054-1,Springer,2006-10-01,2007-11-20,,http://link.springer.com/openurl/pdf?id=doi:10.1007/s10462-007-9054-1,springer
Article,doi:10.1007/s10462-007-9046-1,Editorial: The 16th Artificial Intelligence and Cognitive Science Conference (AICS’05),Artificial Intelligence Review,10.1007/s10462-007-9046-1,Springer,2006-04-01,2007-10-17,,http://link.springer.com/openurl/pdf?id=doi:10.1007/s10462-007-9046-1,springer
Article,doi:10.1007/s10462-005-9016-4,Editorial – The 15th Artificial Intelligence and Cognitive Science Conference (AICS-04),Artificial Intelligence Review,10.1007/s10462-005-9016-4,Springer,2005-11-01,2005-10-21,,http://link.springer.com/openurl/pdf?id=doi:10.1007/s10462-005-9016-4,springer
Article,doi:10.1007/s10472-004-5757-z,Annals of Mathematics and Artificial Intelligence,Annals of Mathematics and Artificial Intelligence,10.1007/s10472-004-5757-z,Springer,2005-01-01,2014-04-24,,http://link.springer.com/openurl/pdf?id=doi:10.1007/s10472-004-5757-z,springer
Article,doi:10.1023/B:AMAI.0000038379.34269.38,Erratum for: A Study of Homogeneity in Relational Databases [Annals of Mathematics and Artificial Intelligence 33(2) (2001) 379–414],Annals of Mathematics and Artificial Intelligence,10.1023/B:AMAI.0000038379.34269.38,Springer,2004-12-01,,,http://link.springer.com/openurl/pdf?id=doi:10.1023/B:AMAI.0000038379.34269.38,springer
Article,doi:10.1140/epje/i2004-10062-8,Charles Soret. A short biography^a,The European Physical Journal E,10.1140/epje/i2004-10062-8,Springer,2004-11-01,2004-11-16,,http://link.springer.com/openurl/pdf?id=doi:10.1140/epje/i2004-10062-8,springer
Article,doi:10.1140/epje/i2004-10077-1,Editorial,The European Physical Journal E,10.1140/epje/i2004-10077-1,Springer,2004-11-01,2004-11-25,,http://link.springer.com/openurl/pdf?id=doi:10.1140/epje/i2004-10077-1,springer
Article,doi:10.1557/jmr.2006.0076,Identification of viscoplastic material parameters from spherical indentation data: Part I. Neural networks,Journal of Materials Research,10.1557/jmr.2006.0076,Springer,2006-03-01,2006-03-01,"In this paper, a new method for the identification of material parameters is presented. Neural networks, which are trained on the basis of finite element simulations, are used to solve the inverse problem. The material parameters to be identified are part of a viscoplasticity model that has been formulated for finite deformations and implemented in the finite element code ABAQUS. A proper multi-creep loading history was developed in a previous paper using a phenomenological model for viscoplastic spherical indentation. Now, this phenomenological model is replaced by a more realistic finite element model, which provides fast computation and numerical solutions of high accuracy at the same time. As a consequence, existing neural networks developed for the phenomenological model have been extended from a power law hardening with two material parameters to an Armstrong-Frederick hardening rule with three parameters. These are the yield stress, the initial slope of work hardening, and maximum hardening stress of the equilibrium response. In addition, elastic deformation is taken into account. The viscous part is based on a Chaboche-like overstress model, consisting of two material parameters determining velocity dependence and overstress as a function of the strain rate. The method has been verified by additional finite element simulations. Its application for various metals will be presented in Part II, [ J. Mater. Res. 21 , 677 (2006)].",http://link.springer.com/openurl/pdf?id=doi:10.1557/jmr.2006.0076,springer
