contentType,identifier,title,publicationName,doi,publisher,publicationDate,onlineDate,abstract,url,database
Article,doi:10.1007/s10514-018-9810-x,Advancing multi-vehicle deployments in oceanographic field experiments,Autonomous Robots,10.1007/s10514-018-9810-x,Springer,2019-08-15,2018-10-26,"Our research concerns the coordination and control of robotic vehicles for upper water-column oceanographic observations. In such an environment, operating multiple vehicles to observe dynamic oceanographic phenomena, such as ocean processes and marine life, from fronts to cetaceans, has required that we design, implement and operate software, methods and processes which can support opportunistic needs in real-world settings with substantial constraints. In this work, an approach for coordinated measurements using such platforms, which relate directly to task outcomes, is presented. We show the use and operational value of a new Artificial Intelligence based mixed-initiative system for handling multiple platforms along with the networked infrastructure support needed to conduct such operations in the open sea. We articulate the need and use of a range of middleware architectures, critical for such deployments and ground this in the context of a field experiment in open waters of the mid-Atlantic in the summer of 2015.",http://link.springer.com/openurl/fulltext?id=doi:10.1007/s10514-018-9810-x,springer
Article,doi:10.1007/s10489-018-1359-z,A social recommender system using deep architecture and network embedding,Applied Intelligence,10.1007/s10489-018-1359-z,Springer,2019-05-15,2018-12-18,"A recommender system is an active tool for information filtering that can be deployed in a complex and dynamic online environment to provide the most relevant and accurate content to the users based on their unique preferences and tastes. The recent direction towards enhancing the recommender system leverages deep learning techniques and trust information. However, building a unified model for a recommender system that integrates deep architecture with trust information is an open challenge. Here, we propose a hybrid method by modeling a joint optimization function which extends deep Autoencoder with top- k semantic social information. We use network representation learning methods to capture the implicit semantic social information. We conducted experiments with various real-world data sets and evaluated the performance of the proposed method using different evaluation measures. Experimental results show the performance improvement of the proposed system compared to state-of-the-art methods.",http://link.springer.com/openurl/fulltext?id=doi:10.1007/s10489-018-1359-z,springer
Article,doi:10.1557/mrs.2019.113,Using artificial intelligence to accelerate materials development,MRS Bulletin,10.1557/mrs.2019.113,Springer,2019-05-01,2020-09-27,,http://link.springer.com/openurl/pdf?id=doi:10.1557/mrs.2019.113,springer
Article,doi:10.1557/mrs.2019.51,Artificial intelligence is aiding the search for energy materials,MRS Bulletin,10.1557/mrs.2019.51,Springer,2019-03-01,2020-09-27,,http://link.springer.com/openurl/fulltext?id=doi:10.1557/mrs.2019.51,springer
Chapter ReferenceWorkEntry,doi:10.1007/978-3-319-77525-8_100207,Machine Learning for Health and Life Sciences,Encyclopedia of Big Data Technologies,10.1007/978-3-319-77525-8_100207,Springer,2019-01-01,2019-02-20,,http://link.springer.com/openurl/fulltext?id=doi:10.1007/978-3-319-77525-8_100207,springer
Chapter ConferencePaper,doi:10.1007/978-981-13-8410-3_13,Citizen Visual Search Engine: Detection and Curation of Urban Objects,"Computer-Aided Architectural Design. ""Hello, Culture""",10.1007/978-981-13-8410-3_13,Springer,2019-01-01,2019-05-21,"Increasingly, the ubiquity of satellite imagery has made the data analysis and machine learning of large geographical datasets one of the building blocks of visuospatial intelligence. It is the key to discover current (and predict future) cultural, social, financial and political realities. How can we, as designers and researchers, empower citizens to understand and participate in the design of our cities amid this technological shift? As an initial step towards this broader ambition, a series of creative web applications, in the form of visual search engines, has been developed and implemented to data mine large datasets. Using open sourced deep learning and computer vision libraries, these applications facilitate the searching, detecting and curating of urban objects. In turn, the paper proposes and formulates a framework to design truly citizen-centric creative visual search engines – a contribution to citizen science and citizen journalism in spatial terms.",http://link.springer.com/openurl/fulltext?id=doi:10.1007/978-981-13-8410-3_13,springer
Article,doi:10.1007/s10707-019-00347-0,Bayesian networks for spatial learning: a workflow on using limited survey data for intelligent learning in spatial agent-based models,GeoInformatica,10.1007/s10707-019-00347-0,Springer,2019-04-15,2019-04-26,"Machine learning (ML) algorithms steer agent decisions in agent-based models (ABMs), serving as a vehicle for implementing behaviour changes during simulation runs. However, when training an ML algorithm, obtaining large sets of micro-level human behaviour data is often problematic. Information on human behaviour is often collected via surveys of relatively small sample sizes. This paper presents a methodology for training a learning algorithm to guide agent behaviour in a spatial ABM using a limited survey data sample. We apply different implementation strategies using survey data and Bayesian networks (BNs). By being grounded in probabilistic directed graphical models, BNs stand out among other learning algorithms in that they can be based on expert knowledge and/or known datasets. This paper presents four alternative implementations of data-driven BNs to support agent decisions in a spatial ABM. We differentiate between training BNs prior to, or during the simulation runs, using only survey data or a combination of survey data and expert knowledge. The four different implementations are then illustrated using a spatial ABM of cholera diffusion for Kumasi, Ghana. The results indicate that a balance between expert knowledge and survey data provides the best control over the learning process of the agents and produces the most realistic agent behaviour.",http://link.springer.com/openurl/fulltext?id=doi:10.1007/s10707-019-00347-0,springer
Chapter ReferenceWorkEntry,doi:10.1007/978-3-319-69891-5_14-2,Machine Learning,Encyclopedia of Security and Emergency Management,10.1007/978-3-319-69891-5_14-2,Springer,2019-01-01,2018-11-12,,http://link.springer.com/openurl/fulltext?id=doi:10.1007/978-3-319-69891-5_14-2,springer
Chapter ReferenceWorkEntry,doi:10.1007/978-3-319-69891-5_14-3,Machine Learning,Encyclopedia of Security and Emergency Management,10.1007/978-3-319-69891-5_14-3,Springer,2019-01-01,2019-04-09,,http://link.springer.com/openurl/fulltext?id=doi:10.1007/978-3-319-69891-5_14-3,springer
Chapter ConferencePaper,doi:10.1007/978-3-030-26072-9_9,A Learning Approach for Topic-Aware Influence Maximization,Web and Big Data,10.1007/978-3-030-26072-9_9,Springer,2019-01-01,2019-07-18,"Motivated by the application of viral marketing , the topic-aware influence maximization (TIM) problem has been proposed to identify the most influential users under given topics. In particular, it aims to find k seeds (users) in social network G , such that the seeds can maximize the influence on users under the specific query topics . This problem has been proved to be NP-hard and most of the proposed techniques suffer from the efficiency issue due to the lack of generalization. Even worse, the design of these algorithms requires significant specialized knowledge which is hard to be understood and implemented. To overcome these issues, this paper aims to learn a generalized heuristic framework to solve TIM problems by meta-learning. To this end, we encode the feature of each node by a vector and introduce a deep learning model, called deep-influence-evaluation-model (DIEM), to evaluate users’ influence under different circumstances. Based on this model, we can construct the solution according to the influence evaluations efficiently, rather than spending a high cost to compute the exact influence by considering the complex graph structure. We conducted experiments on generated graph instances and real-world social networks. The results show the superiority in performance and comparable quality of our framework.",http://link.springer.com/openurl/fulltext?id=doi:10.1007/978-3-030-26072-9_9,springer
Chapter ReferenceWorkEntry,doi:10.1007/978-3-642-41981-2_116-1,Enhancing Student Learning Experience with Practical Big Data Analytics Techniques,Handbook of Mobile Teaching and Learning,10.1007/978-3-642-41981-2_116-1,Springer,2019-01-01,2018-10-17,"With the enormous growing volumes and varieties of consumer data, generated by various desktop, mobile, and Internet of Things applications, e-commerce, and other resources, and the recent advances of computational processing and data storage technologies, big data analytics has become an increasingly important tool of transforming large quantities of digital data into meaningful insight and decisions (see “Characteristics of Mobile Teaching and Learning”). The concept of big data has been around for decades, but it has only become a hot buzzword in the last few years, and its broad applications nowadays have been enthusiastically embraced by financial service providers, retailers, insurers, manufacturers, healthcare organizations, universities, and other enterprises. To meet the great demand for data scientists and engineers from almost every sector of industry, business, and government, several universities have recently started graduate programs in data science or data analytics. However, the number of undergraduate programs that have integrated big data analytics courses into their curricula still remains very small. In this chapter, the author describes the design, implementation, and evaluation of two data analytics courses, Introduction to Data Mining and Introduction to Artificial Neural Networks, which have been developed and included in the undergraduate computer science program at the University of San Diego (USD). Since the spring of 2011, both courses have been offered as upper-division electives on a regular basis, and it has been a very successful learning experience for both the instructor and the students. The courses include, in addition to the coverage on key data analytics concepts, principles, and applications, a unique student lecture series, programming projects, and research activities to engage students in active learning. The author has also recently been offering the data mining course as a study abroad program in China, integrated with additional guest lectures by data scientists from the host institutions and field trips to visit top information technology firms in the host country. The author’s experience has shown that big data analytics can be successfully taught at the undergraduate level, and in fact, students enrolled in the courses have learned a great deal of data analytics techniques and have been able to apply them to solve many real-world problems.",http://link.springer.com/openurl/fulltext?id=doi:10.1007/978-3-642-41981-2_116-1,springer
Chapter ReferenceWorkEntry,doi:10.1007/978-981-13-2766-7_116,Enhancing Student Learning Experience with Practical Big Data Analytics Techniques,Handbook of Mobile Teaching and Learning,10.1007/978-981-13-2766-7_116,Springer,2019-01-01,2019-08-29,"With the enormous growing volumes and varieties of consumer data, generated by various desktop, mobile, and Internet of Things applications, e-commerce, and other resources, and the recent advances of computational processing and data storage technologies, big data analytics has become an increasingly important tool of transforming large quantities of digital data into meaningful insight and decisions (see Chap. 2, “Characteristics of Mobile Teaching and Learning” ). The concept of big data has been around for decades, but it has only become a hot buzzword in the last few years, and its broad applications nowadays have been enthusiastically embraced by financial service providers, retailers, insurers, manufacturers, healthcare organizations, universities, and other enterprises. To meet the great demand for data scientists and engineers from almost every sector of industry, business, and government, several universities have recently started graduate programs in data science or data analytics. However, the number of undergraduate programs that have integrated big data analytics courses into their curricula still remains very small. In this chapter, the author describes the design, implementation, and evaluation of two data analytics courses, Introduction to Data Mining and Introduction to Artificial Neural Networks, which have been developed and included in the undergraduate computer science program at the University of San Diego (USD). Since the spring of 2011, both courses have been offered as upper-division electives on a regular basis, and it has been a very successful learning experience for both the instructor and the students. The courses include, in addition to the coverage on key data analytics concepts, principles, and applications, a unique student lecture series, programming projects, and research activities to engage students in active learning. The author has also recently been offering the data mining course as a study abroad program in China, integrated with additional guest lectures by data scientists from the host institutions and field trips to visit top information technology firms in the host country. The author’s experience has shown that big data analytics can be successfully taught at the undergraduate level, and in fact, students enrolled in the courses have learned a great deal of data analytics techniques and have been able to apply them to solve many real-world problems.",http://link.springer.com/openurl/fulltext?id=doi:10.1007/978-981-13-2766-7_116,springer
Chapter,doi:10.1007/978-3-030-11286-8_8,A Data Science Approach to Predict the Impact of Collateralization on Systemic Risk,From Security to Community Detection in Social Networking Platforms,10.1007/978-3-030-11286-8_8,Springer,2019-01-01,2019-04-10,"In this chapter, we simulate and analyze the impact of financial regulations concerning the collateralization of derivative trades on systemic risk—a topic that has been vigorously discussed since the financial crisis in 2007/08. Experts often disagree on the efficacy of these regulations. Compounding this problem, banks regard their trade data required for a full analysis as proprietary. We adapt a simulation technology combining advances in graph theory to randomly generate entire financial systems sampled from realistic distributions with a novel open-source risk engine to compute risks in financial systems under different regulations. This allows us to consistently evaluate, predict, and optimize the impact of financial regulations on all levels—from a single trade to systemic risk—before it is implemented. The resulting data set is accessible to contemporary data science techniques like data mining, anomaly detection, and visualization. We find that collateralization reduces the costs of resolving a financial system in crisis, yet it does not change the distribution of those costs and can have adverse effects on individual participants in extreme situations.",http://link.springer.com/openurl/fulltext?id=doi:10.1007/978-3-030-11286-8_8,springer
Chapter,doi:10.1007/978-3-030-24367-8_7,Data Science Institutes and Data Centers,Data Science and Visual Computing,10.1007/978-3-030-24367-8_7,Springer,2019-01-01,2019-08-15,"Optimum ways of addressing large data volumes across a variety of disciplines have led to the formation of national and institutional Data Science Institutes and Centers. The objectives and functions of such institutes and centers are summarized. In reflecting the driver of national priority, they are able to attract academic support within their institutions to bring together interdisciplinary expertise to address a wide variety of datasets from disciplines such as astronomy, bioinformatics, engineering, science, medicine, social science, and the humanities. All are generating increasing volumes of data, often in real time, and require efficient and effective solutions. The opportunities and challenges of data science are presented. The processes of knowledge discovery in data science often require new methods and software, new organizational arrangements, and new skills in order to be effective. Data science centers and institutes provide a focus for the development and implementation of such new structures and arrangements for the development of appropriate facilities, with academic leadership and professional support. These are summarized and reviewed.",http://link.springer.com/openurl/fulltext?id=doi:10.1007/978-3-030-24367-8_7,springer
Article,doi:10.1007/s11704-018-7903-5,Parallel intelligence: toward lifelong and eternal developmental AI and learning in cyber-physical-social spaces,Frontiers of Computer Science,10.1007/s11704-018-7903-5,Springer,2018-06-01,2018-01-24,,http://link.springer.com/openurl/pdf?id=doi:10.1007/s11704-018-7903-5,springer
Article,doi:10.1007/s10588-017-9251-7,Neural networks: an introductory guide for social scientists by G. David Garson,Computational and Mathematical Organization Theory,10.1007/s10588-017-9251-7,Springer,2018-06-01,2017-03-24,,http://link.springer.com/openurl/fulltext?id=doi:10.1007/s10588-017-9251-7,springer
Article,doi:10.1038/s41559-018-0466-x,Machine learning for tracking illegal wildlife trade on social media,Nature Ecology & Evolution,10.1038/s41559-018-0466-x,Nature,2018-03-01,2018-01-15,,https://www.nature.com/articles/s41559-018-0466-x,springer
Article,doi:10.1557/mrs.2018.11,Neural network identifies lattice defects in electron microscope images of 2D materials,MRS Bulletin,10.1557/mrs.2018.11,Springer,2018-02-01,2018-02-09,,http://link.springer.com/openurl/fulltext?id=doi:10.1557/mrs.2018.11,springer
Article,doi:10.1557/mrs.2018.147,Quantum materials for brain sciences and artificial intelligence,MRS Bulletin,10.1557/mrs.2018.147,Springer,2018-07-01,2018-07-10,"A hallmark of life is plasticity, which enables reproduction, evolution, and environmental adaptivity. It is natural to wonder if these remarkable features in nature and biology can be realized in the materials world and implemented in the emerging fields of autonomous systems, artificial intelligence, and animal–machine interfaces. First, we describe fundamental features of neurons and synapses in the brain that are responsible for information processing. Then we discuss mechanisms governing electronic plasticity in correlated electronic quantum materials that mimic organismic behavior. We give examples of learning networks and circuits designed using quantum materials that can be implemented for machine intelligence. We conclude with suggestions for future interdisciplinary research wherein synergistic interactions between orbital filling, defects, and strain could give rise to new functionality of relevance to sensory interfaces (e.g., haptics), neural information processing, and neuroscience.",http://link.springer.com/openurl/fulltext?id=doi:10.1557/mrs.2018.147,springer
Article,doi:10.1007/s40471-017-0129-5,"Data Science, Design, and Causal Inference",Current Epidemiology Reports,10.1007/s40471-017-0129-5,Springer,2017-12-01,2017-10-24,,http://link.springer.com/openurl/fulltext?id=doi:10.1007/s40471-017-0129-5,springer
Article,doi:10.1007/s40593-016-0123-y,Preface for the Special Issue on AI-Supported Education in Computer Science,International Journal of Artificial Intelligence in Education,10.1007/s40593-016-0123-y,Springer,2017-03-01,2016-11-23,,http://link.springer.com/openurl/fulltext?id=doi:10.1007/s40593-016-0123-y,springer
Chapter ReferenceWorkEntry,doi:10.1007/978-1-4899-7993-3_636-2,Machine Learning in Computational Biology,Encyclopedia of Database Systems,10.1007/978-1-4899-7993-3_636-2,Springer,2017-01-01,2017-08-08,,http://link.springer.com/openurl/fulltext?id=doi:10.1007/978-1-4899-7993-3_636-2,springer
Article,doi:10.1186/s12859-016-1305-1,Selected proceedings of Machine Learning in Systems Biology: MLSB 2016,BMC Bioinformatics,10.1186/s12859-016-1305-1,BioMed Central,2016-12-13,2016-12-13,,https://www.biomedcentral.com/openurl?doi=10.1186/s12859-016-1305-1,springer
Chapter ConferencePaper,doi:10.1007/978-3-319-58562-8_21,Intent Classification of Social Media Texts with Machine Learning for Customer Service Improvement,Social Computing and Social Media. Applications and Analytics,10.1007/978-3-319-58562-8_21,Springer,2017-01-01,2017-05-13,"Social media platforms in the last few years have facilitated the development of communities that discuss real-world events, and have shaped the way users interact. The content generated in these platforms reflect a variety of intentions, ranging from social interaction to commercial interest, among many others. The present study aims at the implementation of an automatic intent classification system for a Chilean electricity company social media account. The dataset was created from 5000 tweets that were manually classified by 5 people. If discrepancies were detected, a majority voting scheme was used in order to tag the tweets’ intentions. In order to perform the experimental validation of the automatic classification with the machine learning algorithms, several text representations were used (tf-idf, tf-rfl and bin-rfl). The results obtained from the various tests that were conducted yielded satisfactory results. We also analyzed how to assign automatic responses to frequently asked questions, and obtained promising results.",http://link.springer.com/openurl/fulltext?id=doi:10.1007/978-3-319-58562-8_21,springer
Chapter ConferencePaper,doi:10.1007/978-3-319-47913-2_24,Assessment of Driver Behavior Based on Machine Learning Approaches in a Social Gaming Scenario,"Applications in Electronics Pervading Industry, Environment and Society",10.1007/978-3-319-47913-2_24,Springer,2017-01-01,2017-01-03,"The estimation of user performance analytics in the area of car driver performance was carried out in this paper. The main focus relies on the descriptive analysis with our approaches emphasizing on educational serious games, in order to improvise the driver’s behavior (specifically green driving) in a pleasant and challenging way. We also propose a general Internet of the Things (IoT) social gaming platform (SGP) concept that could be adaptable and deployable to any kind of application domain. The social gaming scenario in this application enables the users to compete with peers based on their physical location. The efficient drivers will be awarded with virtual coins and gained virtual coins can be used in real world applications (such as purchasing travel tickets, reservation of parking lots, etc.). This research work is part of TEAM project co-funded within the EU FP7 ICT research program.",http://link.springer.com/openurl/fulltext?id=doi:10.1007/978-3-319-47913-2_24,springer
Chapter,doi:10.1007/978-3-319-60164-9_4,The IoT and Smart Environments: An Overview,Internet of Things and Smart Environments,10.1007/978-3-319-60164-9_4,Springer,2017-01-01,2017-07-21,"The enterprises are beginning to take advantage of the opportunities that the IoT offers by implanting sensors and actuators into their products and services. The IoT adoptions have also enabled the development of smart environments. These advances are drastically shifting the way businesses function and how people engage with the physical world. The pervasive nature of the IoT and the context-aware characteristics that stem from connecting everything together, support the provisions of ambient intelligence. The capabilities to communicate such intelligence with other machines, including those nearby and those providing cloud-based deep learning and AI capacities, hold significant potentials for improving people’s lives in many respects. This chapter outlines the fundamental structure and characteristics of the IoT and smart environments, focusing on those features that can be substantial for assistive technology developments and employments. The chapter also presents some of the typical applications of the IoT and smart environments, to demonstrate the advantages and implications of their deployment in aged-care and for empowering people living with disability or dementia.",http://link.springer.com/openurl/fulltext?id=doi:10.1007/978-3-319-60164-9_4,springer
Article,doi:10.1007/s40593-015-0046-z,RETRACTED ARTICLE: Worked Examples are more Efficient for Learning than High-Assistance Instructional Software,International Journal of Artificial Intelligence in Education,10.1007/s40593-015-0046-z,Springer,2016-12-01,2015-05-28,,http://link.springer.com/openurl/fulltext?id=doi:10.1007/s40593-015-0046-z,springer
