contentType,identifier,title,publicationName,doi,publisher,publicationDate,onlineDate,abstract,url,database
Chapter,doi:10.1007/978-3-030-75123-4_10,IoT-Based Pervasive Sentiment Analysis: A Fine-Grained Text Normalization Framework for Context Aware Hybrid Applications,Information and Knowledge in Internet of Things,10.1007/978-3-030-75123-4_10,Springer,2022-01-01,2021-10-07,"The Internet of Things (IoT) integrates physical objects in a networked real-world environment utilizing sensor-based software technologies in order to connect, share and exchange data with other relevant devices or platforms over the Internet. The contemporary business intelligence solutions encourage the IoT industry to reap benefits of big data dependent pervasive semantic orientation of public moods and relevant information shared in textual form using context aware integrated information management, by means of opinion mining through social media-based pervasive hybrid applications. Opinion mining (OM), also referred as pervasive sentiment analysis, is a process of extracting user orientation regarding products, services, businesses and other entities. It aims to classify an opinionative clue into positive or negative based on the sense and semantic category, which remains hidden from the human eye and non-pervasive applications. The microblog and social media-based information is intrinsically hybrid in nature, which may comprise an ample amount of ubiquitous noise. The public opinions can be classified through supervised, semi-supervised, or unsupervised classifiers. Effective sentiment analysis is common to use in data science research, but unfortunately microblogging services like Twitter allows short text for communication, which compels online publishers to post unstructured and short form of opinions towards the target entities. Unstructured and short form of tweets makes it difficult to extract meaningful and accurate sentiment orientation. This limitation can be tackled through an effective preprocessing of text. Text normalization or preprocessing is the process of removing undesired symbols, tags and conversion of unstructured data into valuable information in order to make quality input for efficient sentiment analysis. It is observed that existing preprocessors and text normalizers ignored the informal nature of text especially slangs and subject tags due to scarcity of linguistic resources, which sometimes affects the sentiment accuracy. Therefore, this research proposes a framework for effective preprocessing of text in order to generate quality input. The proposed framework for an effective text preprocessing involves the following: (i). Extraction of text (ii). Removal of undesired tags (iii). Stop word removal (iv). Definition of slang terms (v). Stemming and lemmatization (vi). Part-of-speech tagging (vii). Coreference resolution (viii). Tag identification Informal text (a.k.a. slang) and tag identification are the major contributions of proposed framework. Slangs and Tags play a significant role in the semantic orientation of sentiments and emotions. The performance of proposed framework is evaluated over Twitter dataset using Python natural language toolkit. Experimental setup revealed that the proposed system achieved promising results with an average F1-Measure of 71% and accuracy of 72.4%.",http://link.springer.com/openurl/fulltext?id=doi:10.1007/978-3-030-75123-4_10,springer
Chapter ConferencePaper,doi:10.1007/978-981-16-3071-2_12,Predicting Prior Academic Failure of Students’ Using Machine Learning Approach,International Conference on Innovative Computing and Communications,10.1007/978-981-16-3071-2_12,Springer,2022-01-01,2021-08-29,"In the educational institutions, research on educational data is on demand due to its predictive power and decision-making process using machine learning approach. The present research work can be broadly categorized into two modules. Firstly, data pre-processing directed on real-time data of Government Polytechnic College Ambala, Haryana, India. Secondly, desired data collected along with exploratory data analysis and human-interpretable features is tested on six different classifier to predict student third-year performance as binary classification based on first- and second-year performance, and maximum accuracy of 98.7% was achieved. This generates a chance to identify low-performing students, and accordingly, early interventions can be deployed to prevent them from failing or dropping. This study also suggests a viable direction to use educational data for getting insights by using the machine learning approach.",http://link.springer.com/openurl/fulltext?id=doi:10.1007/978-981-16-3071-2_12,springer
Chapter ConferencePaper,doi:10.1007/978-981-16-4126-8_25,Toward a Social Media Emergency Events Detection Based on Supervised Learning,"Communication, Smart Technologies and Innovation for Society",10.1007/978-981-16-4126-8_25,Springer,2022-01-01,2021-09-28,"Urban emergency events affect many lives and property of people every day. They should be tackled in a fast, precise, and with an early detection goal. In recent years, social media has become popular, turning its users into proper “citizen sensors,” which means a person who, through devices, records incidents on these platforms. Therefore, they become real-time communicators of emergency events. This paper presents a preliminary study based on supervised learning toward social media emergency events detection. This approach has four phases: the first two correspond to data acquisition and preprocessing, where tweets available in a public repository about emergency and non-emergency were taken, filtered, and converted through a process of lemma feature extraction. In the third phase, four most commonly used supervised algorithms were implemented to detect tweets containing emergency events. Finally, using validation metrics and algorithms to detect emergency and non-emergency reported in the tweets was verified. Computational results showed that all evaluated algorithms achieved average rates of 85.38% of accuracy meanwhile that in execution time about 23 seconds, to detect a real emergency event. The best algorithm when trade-offs between execution time and emergency detection capability are considered was the SVM.",http://link.springer.com/openurl/fulltext?id=doi:10.1007/978-981-16-4126-8_25,springer
Chapter,doi:10.1007/978-981-16-6210-2_3,Artificial Intelligence in Agri-Food Systems—An Introduction,"Internet of Things and Analytics for Agriculture, Volume 3",10.1007/978-981-16-6210-2_3,Springer,2022-01-01,2021-11-11,"Artificial intelligence (AI) is a replacement to human intelligence with expanded capabilities that has empowered the industries to handle and drive more complex systems. In agri-food industrial systems, an artificial intelligent system would drive a system towards the set objectives based on the information and knowledge gathered from the consumers, farmers, machines, and domain experts. Machine learning (ML) is the preferred tool to process the knowledge and information for identifying some underlying rules and patterns to support the implementation of the AI based solution. ML-based AI is preferred, because the heterogeneity in consumer preference, biological variability of material characteristics, and unpredictable system behavior presents a highly complex system to be handled by the rule based expert systems. This chapter gives an insight of the fundamentals of machine learning and deep learning with the emphasis on their application for AI implementation in the field of agri-food material handling. Popular ML algorithms viz., support vector machine (SVM), K-nearest neighbor (KNN), artificial neural networks (ANN), decision trees, and convolutional neural networks (CNN) are discussed as feature description methods for classification and recognition, based on the product images. Works from different researchers are cited to demonstrate the potential application of these techniques for solving real-life complex problems.",http://link.springer.com/openurl/fulltext?id=doi:10.1007/978-981-16-6210-2_3,springer
Chapter ConferencePaper,doi:10.1007/978-981-16-3346-1_35,Efficacious Governance During Pandemics Like Covid-19 Using Intelligent Decision Support Framework for User Generated Content,Proceedings of Second Doctoral Symposium on Computational Intelligence,10.1007/978-981-16-3346-1_35,Springer,2022-01-01,2021-09-20,"Jindal, Rajni Malhotra, Anshu During the unprecedented global health emergency caused by the pandemic Covid-19, the governments and nationalized organizations of all countries are struggling to control its spread by enforcing various measures, and also manage its social economic impact through policy intervention. In such critical situation, it becomes imperative to take data driven decisions. User generated content over online social media is an untapped data source that can be leveraged to gain insights for effective governance and decision making; and can also serve as a first hand communication medium between the various government bodies and citizens. In this paper, we have proposed a novel governance framework that leverages user generated content on social media for effective decision making by the authorities. We have used topic modelling techniques to discover social-economic trends, and to understand the issues or concerns of public interest. We used information extraction techniques like noun and verb phrase extraction, and Named Entity Recognition to measure the geographical spread, identify Covid-19 hotspots, assist in contact tracing, and discovering new health conditions. From the available literature, we could not find any intelligent framework for effective governance during pandemics, where user generated content has been utilized for real time decision making. In this paper, we address this real world problem through our proposed decision support System, and demonstrate as a proof-of-concept of how it can be used for effective governance during the pandemics through its prototype implementation.",http://link.springer.com/openurl/fulltext?id=doi:10.1007/978-981-16-3346-1_35,springer
Article,doi:10.1007/s12517-021-08936-w,Retraction Note: Research on artificial intelligence-based mountain mineral composition detection and big data chemistry education,Arabian Journal of Geosciences,10.1007/s12517-021-08936-w,Springer,2021-11-15,2021-11-15,,http://link.springer.com/openurl/fulltext?id=doi:10.1007/s12517-021-08936-w,springer
Article,doi:10.1007/s11004-021-09982-6,Correction to: Surface Warping Incorporating Machine Learning Assisted Domain Likelihood Estimation: A New Paradigm in Mine Geology Modeling and Automation,Mathematical Geosciences,10.1007/s11004-021-09982-6,Springer,2021-11-11,2021-11-11,,http://link.springer.com/openurl/fulltext?id=doi:10.1007/s11004-021-09982-6,springer
Article,doi:10.1038/s41592-021-01304-2,Author Correction: DOME: recommendations for supervised machine learning validation in biology,Nature Methods,10.1038/s41592-021-01304-2,Nature,2021-11-01,2021-09-23,,https://www.nature.com/articles/s41592-021-01304-2,springer
Article,doi:10.1007/s00603-021-02657-y,Prediction of Particle Size Distribution Curves of Dump Materials Using Convolutional Neural Networks,Rock Mechanics and Rock Engineering,10.1007/s00603-021-02657-y,Springer,2021-10-15,2021-10-15,,http://link.springer.com/openurl/fulltext?id=doi:10.1007/s00603-021-02657-y,springer
Article,doi:10.1007/s42514-021-00077-6,Editorial for the special issue on large-scale AI in classical HPC environment and AI for science,CCF Transactions on High Performance Computing,10.1007/s42514-021-00077-6,Springer,2021-09-01,2021-09-20,,http://link.springer.com/openurl/fulltext?id=doi:10.1007/s42514-021-00077-6,springer
Article,doi:10.1140/epjs/s11734-021-00275-x,Measure or infer? Role of modeling and machine learning in modern astronomy,The European Physical Journal Special Topics,10.1140/epjs/s11734-021-00275-x,Springer,2021-09-01,2021-09-07,,http://link.springer.com/openurl/fulltext?id=doi:10.1140/epjs/s11734-021-00275-x,springer
Article,doi:10.1007/s13246-021-01028-9,AI Notes: A new article type in Physical and Engineering Sciences in Medicine,Physical and Engineering Sciences in Medicine,10.1007/s13246-021-01028-9,Springer,2021-09-01,2021-07-01,,http://link.springer.com/openurl/fulltext?id=doi:10.1007/s13246-021-01028-9,springer
Article,doi:10.1007/s42438-021-00242-8,Review of Cathrine Hasse (2020). Posthumanist Learning: What Robots and Cyborgs Teach us About Being Ultra-social,Postdigital Science and Education,10.1007/s42438-021-00242-8,Springer,2021-07-22,2021-07-22,,http://link.springer.com/openurl/fulltext?id=doi:10.1007/s42438-021-00242-8,springer
Article,doi:10.1007/s12524-021-01376-9,Utilizing Geo-Social Media as a Proxy Data for Enhanced Flood Monitoring,Journal of the Indian Society of Remote Sensing,10.1007/s12524-021-01376-9,Springer,2021-09-01,2021-06-07,"Social media plays an important role in disseminating spontaneous information during natural disasters/emergencies. It is a crowdsourcing platform, capable of complementing and supplementing remote sensing data in disaster mapping. Continuous monitoring of disasters such as floods from pre-stage to post stage is essential and geo-social media can attain it. The present research proposes a robust architecture to develop a social media-based near-real time flood monitoring system. In addition, our research article also emphasizes the efficient methods to process, analyse and explore multiple data dimensions of social media. A prototype model was prepared and tested on the tweets of Chennai floods 2015 to demonstrate social media potential in disaster monitoring. We implemented Natural Language Processing and Supervised Machine Learning in data processing and analysis segments of the framework by assembling various open source python libraries to develop the prototype. Initially, we built the required tweet corpus and performed pre-processing steps on it. Later, the collected tweets were geocoded with the place names available in the tweets and classified them into various flood topic related classes using Naive Bayes classifier. Subsequently, the tweets showcasing the flood condition were determined to generate a point map and a point density map to identify the flood hotspots. We verified our results with openly available 2015 Chennai flood map that is generated using remote sensing images and found positive outcome. A prototype web portal was developed to publish the results from above model as web maps. Furthermore, the portal would prove to be useful as a source for disseminating information to the public. The results prove that the proposed framework is evidently supportive in establishing a near real time monitoring system during emergencies.",http://link.springer.com/openurl/fulltext?id=doi:10.1007/s12524-021-01376-9,springer
Article,doi:10.1007/s10489-021-02584-z,30th Anniversary of Applied Intelligence: A combination of bibliometrics and thematic analysis using SciMAT,Applied Intelligence,10.1007/s10489-021-02584-z,Springer,2021-09-01,2021-07-12,"Applied Intelligence is one of the most important international scientific journals in the field of artificial intelligence. From 1991, Applied Intelligence has been oriented to support research advances in new and innovative intelligent systems, methodologies, and their applications in solving real-life complex problems. In this way, Applied Intelligence hosts more than 2,400 publications and achieves around 31,800 citations. Moreover, Applied Intelligence is recognized by the industrial, academic, and scientific communities as a source of the latest innovative and advanced solutions in intelligent manufacturing, privacy-preserving systems, risk analysis, knowledge-based management, modern techniques to improve healthcare systems, methods to assist government, and solving industrial problems that are too complex to be solved through conventional approaches. Bearing in mind that Applied Intelligence celebrates its 30th anniversary in 2021, it is appropriate to analyze its bibliometric performance, conceptual structure, and thematic evolution. To do that, this paper conducts a bibliometric performance and conceptual structure analysis of Applied Intelligence from 1991 to 2020 using SciMAT . Firstly, the performance of the journal is analyzed according to the data retrieved from Scopus , putting the focus on the productivity of the authors, citations, countries, organizations, funding agencies, and most relevant publications. Finally, the conceptual structure of the journal is analyzed with the bibliometric software tool SciMAT , identifying the main thematic areas that have been the object of research and their composition, relationship, and evolution during the period analyzed.",http://link.springer.com/openurl/fulltext?id=doi:10.1007/s10489-021-02584-z,springer
Article,doi:10.1186/s40545-021-00329-4,"Big data, medicines safety and pharmacovigilance",Journal of Pharmaceutical Policy and Practice,10.1186/s40545-021-00329-4,BioMed Central,2021-06-02,2021-06-02,,https://www.biomedcentral.com/openurl?doi=10.1186/s40545-021-00329-4,springer
Article,doi:10.1007/s00146-020-01086-9,"Review of Artificial Intelligence: Reflections in Philosophy, Theology and the Social Sciences by Benedikt P. Göcke and Astrid Rosenthal-von der Pütten",AI & SOCIETY,10.1007/s00146-020-01086-9,Springer,2021-06-01,2020-10-22,,http://link.springer.com/openurl/fulltext?id=doi:10.1007/s00146-020-01086-9,springer
Article,doi:10.1007/s43926-021-00016-5,Social media analytics of the Internet of Things,Discover Internet of Things,10.1007/s43926-021-00016-5,Springer,2021-07-19,2021-07-19,"The Internet of Things technology offers convenience and innovation in areas such as smart homes and smart cities. Internet of Things solutions require careful management of devices and the risk mitigation of potential vulnerabilities within cyber-physical systems. The Internet of Things concept, its implementations, and applications are frequently discussed on social media platforms. This research illuminates the public view of the Internet of Things through a content-based and network analysis of contemporary conversations occurring on the Twitter platform. Tweets can be analyzed with machine learning methods to converge the volume and variety of conversations into predictive and descriptive models. We have reviewed 684,503 tweets collected in a 2-week period. Using supervised and unsupervised machine learning methods, we have identified trends within the realm of IoT and their interconnecting relationships between the most mentioned industries. We have identified characteristics of language sentiment which can help to predict the popularity of IoT conversation topics. We found the healthcare industry as the leading use case industry for IoT implementations. This is not surprising as the current COVID-19 pandemic is driving significant social media discussions. There was an alarming dearth of conversations towards cybersecurity. Recent breaches and ransomware events denote that organizations should spend more time communicating about risks and mitigations. Only 12% of the tweets relating to the Internet of Things contained any mention of topics such as encryption, vulnerabilities, or risk, among other cybersecurity-related terms. We propose an IoT Cybersecurity Communication Scorecard to help organizations benchmark the density and sentiment of their corporate communications regarding security against their specific industry.",http://link.springer.com/openurl/fulltext?id=doi:10.1007/s43926-021-00016-5,springer
Article,doi:10.1007/s13218-021-00733-7,Teaching Artificial Intelligence to K-12 Through a Role-Playing Game Questioning the Intelligence Concept,KI - Künstliche Intelligenz,10.1007/s13218-021-00733-7,Springer,2021-06-01,2021-06-24,"Although artificial intelligence (AI) is becoming increasingly important in the media environment (search engines, chatbots, home assistants, recommendation systems, etc.), the general audiences’ knowledge of it remains limited, which biases their representations. To compensate for this, some governments show an interest in teaching it from an early age. It appears that educational resources related to AI literacy in schools are most often focused on technical skills. However, the challenges of such education are also ethical and societal, requiring an interdisciplinary and critical approach. This research aims at developing a 10–14 years old curriculum questioning the concept of intelligence in AI systems, and crossing computer science education and media literacy education. Through a role-playing game, the children discover the basic concepts of machine learning. Beyond their initial representations, which they become aware that they are largely fueled by the media, they can realize that an AI system is the result of design choices and that it only works within the framework that has been defined for it. Moreover, the possibility for teachers to teach the curriculum themselves in their classes is also evaluated. To this end, the curriculum was taught to 60 future trainee teachers, 70 middle school pupils, and 12 elementary pupils. Interviews were conducted also with 5 teachers who had either observed the curriculum taught by a researcher or attempted to teach it themselves. The results show that the children’s representations have evolved towards representations that are more technically correct (although incomplete), but not very oriented towards aspects that open up critical questioning. The difficulties revealed in the implementation of the critical part are due in particular to the complexity of the IT concepts to be addressed, but also to the lack of teacher training. However, the data collected seems to confirm the interest and feasibility of crossing different disciplinary approaches to address certain aspects of AI. In conclusion, in addition to the curriculum, this paper describes a theoretical model of critical citizenship education in technology that integrates approaches to computer science education and media literacy education, and gives avenues for other designers and researchers to create AI critical educational experiences for K-12 learners.",http://link.springer.com/openurl/fulltext?id=doi:10.1007/s13218-021-00733-7,springer
Article,doi:10.1007/s12525-020-00414-7,AI-based chatbots in customer service and their effects on user compliance,Electronic Markets,10.1007/s12525-020-00414-7,Springer,2021-06-01,2020-03-17,"Communicating with customers through live chat interfaces has become an increasingly popular means to provide real-time customer service in many e-commerce settings. Today, human chat service agents are frequently replaced by conversational software agents or chatbots, which are systems designed to communicate with human users by means of natural language often based on artificial intelligence (AI). Though cost- and time-saving opportunities triggered a widespread implementation of AI-based chatbots, they still frequently fail to meet customer expectations, potentially resulting in users being less inclined to comply with requests made by the chatbot. Drawing on social response and commitment-consistency theory, we empirically examine through a randomized online experiment how verbal anthropomorphic design cues and the foot-in-the-door technique affect user request compliance. Our results demonstrate that both anthropomorphism as well as the need to stay consistent significantly increase the likelihood that users comply with a chatbot’s request for service feedback. Moreover, the results show that social presence mediates the effect of anthropomorphic design cues on user compliance.",http://link.springer.com/openurl/fulltext?id=doi:10.1007/s12525-020-00414-7,springer
