contentType,identifier,title,publicationName,doi,publisher,publicationDate,abstract,url,database,query_name,query_value
Article,doi:10.1007/s11227-020-03399-4,Improving the learning of self-driving vehicles based on real driving behavior using deep neural network techniques,The Journal of Supercomputing,10.1007/s11227-020-03399-4,Springer,2021-04-01,"Considering the significant advancements in autonomous vehicle technology, research in this field is of interest to researchers. To drive vehicles autonomously, controlling steer angle, gas hatch, and brakes needs to be learned. The behavioral cloning method is used to imitate humans’ driving behavior. We created a dataset of driving in different routes and conditions, and using the designed model, the output used for controlling the vehicle is obtained. In this paper, the learning of self-driving vehicles based on real driving behavior using deep neural network techniques (LSV-DNN) is proposed. We designed a convolutional network which uses the real driving data obtained through the vehicle’s camera and computer. The response of the driver during driving is recorded in different situations, and by converting the real driver’s driving video to images and transferring the data to an Excel file, obstacle detection is carried out with the best accuracy and speed using the Yolo algorithm version 3. This way, the network learns the response of the driver to obstacles in different locations and the network is trained with the Yolo algorithm version 3 and the output of obstacle detection. Then, it outputs the steer angle and amount of brake, gas, and vehicle acceleration. This study focuses on designing a convolutional network using behavioral cloning and motion planning of autonomous vehicle using a deep learning framework. Neural networks are effective systems for finding relationships between data, modeling, and predict new data or classify data. As a result Neural networks with input real data predict steer angle and speed for autonomous driving. The LSV-DNN is evaluated here via extensive simulations carried out in Python and TensorFlow environment. We evaluated the network error using the loss function. The results confirmed that our scheme is capable of exhibiting high prediction accuracy (exceeding 92.93%). In addition, our proposed scheme has high speed (more than 64.41%), low FPR (less than 6.89%), and low FNR (less than 3.95%), in comparison with the other approaches currently being employed. By comparing other methods which were conducted on the simulator’s data, we obtained good performance results for the designed network on the data from KITTI benchmark, the data collected using a private vehicle, and the data we collected.",http://link.springer.com/openurl/fulltext?id=doi:10.1007/s11227-020-03399-4,springer,autonomous vehicle,'autonomous vehicle' AND 'machine learning' AND ('real-world' AND 'deploy')
Article,doi:10.1007/s00542-019-04695-7,Machine learning based null allocation design for adaptive beamforming in unmanned aerial vehicle communications,Microsystem Technologies,10.1007/s00542-019-04695-7,Springer,2021-04-01,"In order to communicate with target unmanned aerial vehicles (UAVs), ground control stations (GCSs) typically adopt adaptive beamforming with high antenna gain and co-channel interference rejection. Multiple interfering signals arriving from different directions arise from other UAVs and other GCSs, and the beamformer installed in the home GCS will usually attempt to null unwanted signals from all these directions of arrival (DoAs) without analyzing the distribution of the angles of arrival. Consequently, the beamformer will fail to allocate nulls in some directions, and the signal-to-interference-plus-noise (SINR) performance of the home GCS is impaired. In this paper, a new approach to null allocation is proposed, based on machine learning using k -means clustering. The design first involves the collection of information about the DoAs and the corresponding received signal strengths of all the interfering signals into a two-dimensional dataset. Secondly, this dataset is broken down into clusters by using k -means clustering, and the cluster centroids are calculated. In each cluster, the interfering signal that has the shortest Euclidean distance to the centroid is identified as the approximated centroid. Only the approximated centroids are selected as input to the beamformer, with the aim that each complete cluster of interference sources can be nulled by allocating one null per cluster. To optimize the number of clusters k used in the null allocation process, the design adopts the particle swarm optimization technique to adaptively update the value of k to maximize the SINR at the home GCS. Simulation results show that our design yields a maximum SINR improvement of about 12 dB when compared to cases where no null allocation is considered. Moreover, our design also outperforms null steering in the UAV scenarios. Advantageously, this enhanced performance is obtained without the need for additional power amplification or hardware modification to the beamformer.",http://link.springer.com/openurl/fulltext?id=doi:10.1007/s00542-019-04695-7,springer,autonomous vehicle,'autonomous vehicle' AND 'machine learning' AND ('real-world' AND 'deploy')
Article,doi:10.1007/s10657-020-09671-5,Grounding the case for a European approach to the regulation of automated driving: the technology-selection effect of liability rules,European Journal of Law and Economics,10.1007/s10657-020-09671-5,Springer,2021-04-01,"In the current paper, we discuss the need for regulation at EU level of Connected and Automated Driving solutions (henceforth CAD) based on multiple considerations, namely (i) the need for uniformity of criteria across European Member States, and (ii) the impact that regulation—or the absence of it—has on the proliferation of specific technological solutions. The analysis is grounded on legal and economic considerations of possible interactions between vehicles with different levels of automation, and shows how the existing framework delays innovation. A Risk-Management Approach, identifying one sole responsible party ex ante (one-stop-shop), liable under all circumstances—pursuant to a strict, if not absolute liability rule—is to be preferred. We analyse the solution adopted by some Member States in light of those considerations and conclude that none truly corresponds to a RMA approach, and differences will also cause market fragmentation. We conclude that because legal rules determine what kind of technological application is favoured over others—and thence they are not technology-neutral—uniformity across MSs is of essential relevance, and discuss possible policy approaches to be adopted at European level.",http://link.springer.com/openurl/fulltext?id=doi:10.1007/s10657-020-09671-5,springer,autonomous vehicle,'autonomous vehicle' AND 'machine learning' AND ('real-world' AND 'deploy')
Article,doi:10.1007/s11370-020-00343-6,RCNet: road classification convolutional neural networks for intelligent vehicle system,Intelligent Service Robotics,10.1007/s11370-020-00343-6,Springer,2021-04-01,"Vision-based techniques for intelligent vehicles in heterogeneous road environments are gaining significant attention from researchers and industrialists. Unfortunately, the mechanisms in this domain suffer from limited performance due to scene complexity, varying road structure, and improper illumination conditions. These challenging situations may lead an intelligent vehicle into dangerous situations such as collisions or road accidents and may cause higher mortality. The application of intelligent methods and other machine learning techniques for road surface classification is little explored in the existing literature. Thus, we propose a convolutional neural network-based road classification network (RCNet) for the accurate classification of road surfaces. This procedure includes the classification of five major categories of road surfaces: curvy, dry, ice, rough, and wet roads. The experimental results reveal the behavior of the proposed RCNet under various optimizer techniques. The standard performance evaluation measures have been used to test and validate the proposed method on the Oxford RobotCar dataset. RCNet achieves classification accuracy, precision, and sensitivity of 99.90%, and 99.97% of specificity. Results of implemented work are significantly higher than available state-of-the-art techniques and show accurate and effective performance in the complex road environment.",http://link.springer.com/openurl/fulltext?id=doi:10.1007/s11370-020-00343-6,springer,autonomous vehicle,'autonomous vehicle' AND 'machine learning' AND ('real-world' AND 'deploy')
Article,doi:10.1007/s12524-020-01231-3,Deep Learning Based Supervised Image Classification Using UAV Images for Forest Areas Classification,Journal of the Indian Society of Remote Sensing,10.1007/s12524-020-01231-3,Springer,2021-03-01,"Applications of unmanned aerial vehicles (UAVs) based remote sensing is increasing rapidly due to their advanced accessibility, capability for fast and easy deployment, capability for miniaturization of sensors and efficient collection of remotely-sensed data from relatively low altitudes. Recently, UAV data sets have been found to be quite useful for forest feature identification due to their relatively high spatial resolution. Several machine learning algorithms have been broadly used for remotely-sensed image classification. In remote sensing image classification, deep learning based methods can be considered quite effective techniques as they have achieved promising results. In this study, we have used deep learning based supervised image classification algorithm and images collected using UAV for classification of forest areas. The deep learning algorithm stacked Auto-encoder has been found to have tremendous potential regarding image classification and the assessment of forest coverage area. Our experimental results show that deep learning method provides better accuracy compared to other machine learning algorithms. Cross-validation showed that the overall accuracy of the deep learning method is about 93%. This study highlights the essential role that UAV observations and deep learning could play in the planning and management of forest areas which are often under the threat of deforestation and forest encroachment.",http://link.springer.com/openurl/fulltext?id=doi:10.1007/s12524-020-01231-3,springer,autonomous vehicle,'autonomous vehicle' AND 'machine learning' AND ('real-world' AND 'deploy')
Article,doi:10.1007/s12667-020-00414-8,Application of AI in image recognition technology for power line inspection,Energy Systems,10.1007/s12667-020-00414-8,Springer,2021-02-04,"Artificial Intelligence (AI) is an energetic consideration in the electric power company for the scrutiny of the power lines in the forest area. The inspection is escorted to reduce input resources, less cost, rehabilitate electricity, and avoid overhead transmission and distribution lines. The imperfection in the electric companies is deliberate outage management, safety hazards, and diversified system, expensive and not flexible, which disturb the inspection in the forest areas. To recognize the images and status of the power lines, the Naïve Bayesian classifier with Automatic Classification (NBC-AC) algorithms is implemented to classify the observed probabilistic variables of inspection accurately. To monitor the images in long-distance, an Unmanned Aerial Vehicle–Hunter (UAV-H) is proposed to predict the different features of power lines. Hence NBC-AC algorithms with UAV-H systems are used to recognize and classify the characteristics of the power line images with 95% accuracy in the forest area for the electric power company. This encouraging technique contributes to high efficiency and accuracy with the best quality of images and the results were obtained for many AI applications.",http://link.springer.com/openurl/fulltext?id=doi:10.1007/s12667-020-00414-8,springer,autonomous vehicle,'autonomous vehicle' AND 'machine learning' AND ('real-world' AND 'deploy')
Article,doi:10.1007/s43545-020-00043-z,In support of “no-fault” civil liability rules for artificial intelligence,SN Social Sciences,10.1007/s43545-020-00043-z,Nature,2021-01-11,"Civil liability is traditionally understood as indirect market regulation, since the risk of incurring liability for damages gives incentives to invest in safety. Such an approach, however, is inappropriate in the markets of artificial intelligence devices. In fact, according to the current paradigm of civil liability, compensation is allowed only to the extent that “someone” is identified as a debtor. However, in many cases it would not be useful to impose the obligation to pay such compensation to producers and programmers: the algorithms, in fact, can “behave” far independently from the instructions initially provided by programmers so that they can err despite no flaw in design or implementation. Therefore, application of “traditional” civil liability to AI may represent a disincentive to new technologies based on artificial intelligence. This is why I think artificial intelligence requires that the law evolves, on this matter, from an issue of civil liability into one of financial management of losses. No-fault redress schemes could be an interesting and worthy regulatory strategy in order to enable this evolution. Of course, such schemes should apply only in cases where there is no evidence that producers and programmers have acted under conditions of negligence, imprudence or unskillfulness and their activity is adequately compliant with scientifically validated standards.",https://www.nature.com/articles/s43545-020-00043-z,springer,autonomous vehicle,'autonomous vehicle' AND 'machine learning' AND ('real-world' AND 'deploy')
Chapter ConferencePaper,doi:10.1007/978-981-15-9774-9_58,Self-driving Car in Virtual Simulation: A Non-AI Approach,Emerging Technologies in Data Mining and Information Security,10.1007/978-981-15-9774-9_58,Springer,2021-01-01,"Over the last few decades, the self-driving car industry has come a long way and is going toward a future where human drivers might no longer exist. Researchers and engineers in motor companies are trying to innovate new ways to make and train self-driving cars to reduce the number of collisions. So, a lot of progress has been made but the cost of making them grew up with them. In this paper, we propose a simpler version of making and training a self-driving car in a simulated environment using a non-AI approach.",http://link.springer.com/openurl/fulltext?id=doi:10.1007/978-981-15-9774-9_58,springer,autonomous vehicle,'autonomous vehicle' AND 'machine learning' AND ('real-world' AND 'deploy')
Chapter ConferencePaper,doi:10.1007/978-981-33-6546-9_39,The Categorization of Artificial Intelligence (AI) Based on the Autonomous Vehicles and Its Other Applications,Proceedings of International Conference on Communication and Artificial Intelligence,10.1007/978-981-33-6546-9_39,Springer,2021-01-01,"The artificial intelligence (AI) is creating the great impacts and revolution in the technological world, education world, industry world, and business world. The concepts in artificial intelligence are improving themselves day by day, and it is becoming a part of human’s everyday activities. It plays a major role in the human life, and the situation becomes the people cannot live without this AI. In this book chapter, the categorization of artificial intelligence based on the autonomous vehicles and its other applications is to be discussed in brief. The artificial intelligence technique is based on the artificial neural network (ANN), machine learning (ML), deep neural network (DNN), recurrent neural network (RNN), and convolution neural network (CNN). To implement these types of neural network, the system should use the programming languages like MATLAB programming, Python programming, R programming, etc.",http://link.springer.com/openurl/fulltext?id=doi:10.1007/978-981-33-6546-9_39,springer,autonomous vehicle,'autonomous vehicle' AND 'machine learning' AND ('real-world' AND 'deploy')
Chapter ConferencePaper,doi:10.1007/978-981-15-3383-9_19,Traffic Sign Recognition for Self-driving Cars with Deep Learning,Advanced Machine Learning Technologies and Applications,10.1007/978-981-15-3383-9_19,Springer,2021-01-01,"The purpose of this research was to create a model for an autonomous car in traffic sign recognition. A high-accuracy model is needed to analyze the signs. Previous studies have mainly been centered on European countries, and the models created in Europe are not applicable to American autonomous cars. The contributions of this paper are twofold. First, this study generated a dataset that was collected and annotated in order to establish a suitable model for the USA. The dataset was custom made and acquired by using camera footage that was converted into individual frames. The dataset was named Cyber Identity and Biometrics Lab Traffic Sign Dataset Version 1 (CIB TS V1). Then, it was annotated into different classes and labels with LabelIMG. With a customized program, we used the annotations to crop out images and categorized them. Second, the data was run through a deep learning algorithm called modified AlexNet. A lighter version of the AlexNet was used for our experiments. Results showed that the model achieved above 99% accuracy on the validation set.",http://link.springer.com/openurl/fulltext?id=doi:10.1007/978-981-15-3383-9_19,springer,autonomous vehicle,'autonomous vehicle' AND 'machine learning' AND ('real-world' AND 'deploy')
Chapter ConferencePaper,doi:10.1007/978-3-030-76426-5_13,Neuroevolution vs Reinforcement Learning for Training Non Player Characters in Games: The Case of a Self Driving Car,Intelligent Technologies for Interactive Entertainment,10.1007/978-3-030-76426-5_13,Springer,2021-01-01,"The aim of this project is to compare two popular machine learning methods, a non-gradient-based algorithm such as neuro-evolution with a gradient-based reinforcement learning on an irregular task of training a car to self-drive around 3D circuits with varying complexity. A series of 3D circuits with a physics based car model were modeled using the Unity game engine. The data collected during evaluation show that neuro-evolution converges faster to a solution when compared to the reinforcement learning approach. However, when the reinforcement learning approach is allowed to train for long enough, it outperforms the neuro-evolution in terms of car speed and lap times achieved by the trained model of the car.",http://link.springer.com/openurl/fulltext?id=doi:10.1007/978-3-030-76426-5_13,springer,autonomous vehicle,'autonomous vehicle' AND 'machine learning' AND ('real-world' AND 'deploy')
Chapter,doi:10.1007/978-981-16-0598-7_11,Design of a Machine Learning-Based Self-driving Car,Machine Learning for Robotics Applications,10.1007/978-981-16-0598-7_11,Springer,2021-01-01,"In this work, an algorithm of machine learning for self-driving car using udacity and unity self-driving car simulation software has been presented. Using the software, the car is driven on the simulated circuit having three cameras mounted on car hood which generate three images simultaneously and acceleration and de-acceleration of the car steering angle and brake. This method includes a behavior cloning approach and tries to replicate a behavior of human driver. For training the model, approximately, 18,000 training samples are required, and by using image augmentation technique, an increase in the data sample with few times is obtained, which leads to little robust simulated self-driving car.",http://link.springer.com/openurl/fulltext?id=doi:10.1007/978-981-16-0598-7_11,springer,autonomous vehicle,'autonomous vehicle' AND 'machine learning' AND ('real-world' AND 'deploy')
Chapter ConferencePaper,doi:10.1007/978-981-33-4572-0_114,Artificial Intelligence in the Field of Driverless Cars,Big Data Analytics for Cyber-Physical System in Smart City,10.1007/978-981-33-4572-0_114,Springer,2021-01-01,"Nowadays, new technologies led by artificial intelligence and big data are booming, and have been widely used in many fields such as medical, transportation, military, and industrial. Automobile driving is one of the main application directions of artificial intelligence in the field of transportation. The purpose of this article is to explore the application of artificial intelligence technology in the field of driverless cars, with a view to bringing precision and real-time improvement to pedestrian detection in driverless systems. In this paper, based on the verification model and the pedestrian recognition algorithm based on the recognition model, a new recognition algorithm combining two types of models is proposed. After optimization and testing on the Market1501 pedestrian re-identification data set, it is concluded that the multi-camera test mAP of this algorithm is 72.55%, which greatly improves the detection accuracy compared with other mainstream re-identification algorithms. The research in this paper basically solves the problems of low accuracy, poor real-time performance and discontinuous cross-camera detection, which is beneficial to the successful application of pedestrian detection in unmanned driving.",http://link.springer.com/openurl/fulltext?id=doi:10.1007/978-981-33-4572-0_114,springer,autonomous vehicle,'autonomous vehicle' AND 'machine learning' AND ('real-world' AND 'deploy')
Chapter ConferencePaper,doi:10.1007/978-981-16-2712-5_6,Low-Altitude Unmanned Aerial Vehicle for Real-Time Greenhouse Plant Disease Monitoring Using Convolutional Neural Network,Soft Computing for Problem Solving,10.1007/978-981-16-2712-5_6,Springer,2021-01-01,"This study presents a novel approach to real-time plant infection detection and automatic pesticide spraying using an unmanned aerial vehicle (UAV) inside greenhouses. Greenhouse maintains controlled environments for plant growth, which is presently achieved by using conventional labor-driven methods that are proven to be inefficient causing lower yields. To overcome such difficulties and improve the yields, a multipurpose unmanned aerial vehicle capable of capturing vision data has been developed to detect infected areas and automatically spray useful chemicals based on the detection. Onboard the UAV is an edge device connected to environmental parameters sensors continuously uploading data to ThingSpeak. The IOT cloud platform provides real-time temperature and humidity of the precise location. In this research work, a fast-semantic segmentation algorithm called LinkNet-34 is employed for real-time segmentation of the infected region. The experimental results during manual flights indicate a detection accuracy of 0.922 (MIoU) with LinkNet-34. The UAV can achieve 14 min of flight-time while spraying 500 mm of pesticide over 42 m^2 area, during which time, a field map highlighting the infected regions is automatically generated and uploaded to the cloud for future analysis.",http://link.springer.com/openurl/fulltext?id=doi:10.1007/978-981-16-2712-5_6,springer,autonomous vehicle,'autonomous vehicle' AND 'machine learning' AND ('real-world' AND 'deploy')
Chapter ConferencePaper,doi:10.1007/978-3-030-68154-8_91,AutoMove: An End-to-End Deep Learning System for Self-driving Vehicles,Intelligent Computing and Optimization,10.1007/978-3-030-68154-8_91,Springer,2021-01-01,"End to End learning is a deep learning approach that has been used to solve complex problems that would usually be carried out by humans with great effect. A deep structure was designed within this study to simulate humans’ steering patterns in highway driving situations. The architecture of the network was based on image processing algorithm which is integrated with deep learning convolutional neural network (CNN). There are five aspects in this work, which enables the vehicle to detect the lanes, detect the speed of the vehicle, detect the angle of the road, recognize the objects on the road and predict the steering angle of the vehicle. A self-derived mathematical model is used to calculate the road angles for the prediction of vehicle’s steering angles. The model is trained on 2937 video frame samples and validated on 1259 samples with 30 epochs. The video of the local road was set as the output which will show the difference between actual steering angles and predicted steering angle. The experiments have been carried out in a newly built industrial park with suitable industry 4.0 standard design of urban smart development.",http://link.springer.com/openurl/fulltext?id=doi:10.1007/978-3-030-68154-8_91,springer,autonomous vehicle,'autonomous vehicle' AND 'machine learning' AND ('real-world' AND 'deploy')
