id,updated,published,title,summary,database,query_name,query_value
http://arxiv.org/abs/1909.07554v1,2019-09-17T02:22:09Z,2019-09-17T02:22:09Z,"Gated Recurrent Units Learning for Optimal Deployment of Visible Light
  Communications Enabled UAVs","In this paper, the problem of optimizing the deployment of unmanned aerial
vehicles (UAVs) equipped with visible light communication (VLC) capabilities is
studied. In the studied model, the UAVs can simultaneously provide
communications and illumination to service ground users. Ambient illumination
increases the interference over VLC links while reducing the illumination
threshold of the UAVs. Therefore, it is necessary to consider the illumination
distribution of the target area for UAV deployment optimization. This problem
is formulated as an optimization problem whose goal is to minimize the total
transmit power while meeting the illumination and communication requirements of
users. To solve this problem, an algorithm based on the machine learning
framework of gated recurrent units (GRUs) is proposed. Using GRUs, the UAVs can
model the long-term historical illumination distribution and predict the future
illumination distribution. In order to reduce the complexity of the prediction
algorithm while accurately predicting the illumination distribution, a Gaussian
mixture model (GMM) is used to fit the illumination distribution of the target
area at each time slot. Based on the predicted illumination distribution, the
optimization problem is proved to be a convex optimization problem that can be
solved by using duality. Simulations using real data from the Earth
observations group (EOG) at NOAA/NCEI show that the proposed approach can
achieve up to 22.1% reduction in transmit power compared to a conventional
optimal UAV deployment that does not consider the illumination distribution.
The results also show that UAVs must hover at areas having strong illumination,
thus providing useful guidelines on the deployment of VLC-enabled UAVs.",arxiv,autonomous vehicle,'autonomous vehicle' AND 'machine learning' AND ('real-world' AND 'deploy')
http://arxiv.org/abs/1909.03854v1,2019-09-09T13:40:12Z,2019-09-09T13:40:12Z,A Convolutional Neural Network Approach Towards Self-Driving Cars,"A convolutional neural network (CNN) approach is used to implement a level 2
autonomous vehicle by mapping pixels from the camera input to the steering
commands. The network automatically learns the maximum variable features from
the camera input, hence requires minimal human intervention. Given realistic
frames as input, the driving policy trained on the dataset by NVIDIA and
Udacity can adapt to real-world driving in a controlled environment. The CNN is
tested on the CARLA open-source driving simulator. Details of a beta-testing
platform are also presented, which consists of an ultrasonic sensor for
obstacle detection and an RGBD camera for real-time position monitoring at
10Hz. Arduino Mega and Raspberry Pi are used for motor control and processing
respectively to output the steering angle, which is converted to angular
velocity for steering.",arxiv,autonomous vehicle,'autonomous vehicle' AND 'machine learning' AND ('real-world' AND 'deploy')
http://arxiv.org/abs/1909.02562v1,2019-09-05T13:21:22Z,2019-09-05T13:21:22Z,"TFCheck : A TensorFlow Library for Detecting Training Issues in Neural
  Network Programs","The increasing inclusion of Machine Learning (ML) models in safety critical
systems like autonomous cars have led to the development of multiple
model-based ML testing techniques. One common denominator of these testing
techniques is their assumption that training programs are adequate and
bug-free. These techniques only focus on assessing the performance of the
constructed model using manually labeled data or automatically generated data.
However, their assumptions about the training program are not always true as
training programs can contain inconsistencies and bugs. In this paper, we
examine training issues in ML programs and propose a catalog of verification
routines that can be used to detect the identified issues, automatically. We
implemented the routines in a Tensorflow-based library named TFCheck. Using
TFCheck, practitioners can detect the aforementioned issues automatically. To
assess the effectiveness of TFCheck, we conducted a case study with real-world,
mutants, and synthetic training programs. Results show that TFCheck can
successfully detect training issues in ML code implementations.",arxiv,autonomous vehicle,'autonomous vehicle' AND 'machine learning' AND ('real-world' AND 'deploy')
http://arxiv.org/abs/1907.08985v2,2020-02-08T22:59:03Z,2019-07-21T15:16:12Z,"Achieving Super-Linear Speedup across Multi-FPGA for Real-Time DNN
  Inference","Real-time Deep Neural Network (DNN) inference with low-latency requirement
has become increasingly important for numerous applications in both cloud
computing (e.g., Apple's Siri) and edge computing (e.g., Google/Waymo's
driverless car). FPGA-based DNN accelerators have demonstrated both superior
flexibility and performance; in addition, for real-time inference with low
batch size, FPGA is expected to achieve further performance improvement.
However, the performance gain from the single-FPGA design is obstructed by the
limited on-chip resource. In this paper, we employ multiple FPGAs to
cooperatively run DNNs with the objective of achieving super-linear speed-up
against single-FPGA design. In implementing such systems, we found two barriers
that hinder us from achieving the design goal: (1) the lack of a clear
partition scheme for each DNN layer to fully exploit parallelism, and (2) the
insufficient bandwidth between the off-chip memory and the accelerator due to
the growing size of DNNs. To tackle these issues, we propose a general
framework, ""Super-LIP"", which can support different kinds of DNNs. In this
paper, we take Convolutional Neural Network (CNN) as a vehicle to illustrate
Super-LIP. We first formulate an accurate system-level model to support the
exploration of best partition schemes. Then, we develop a novel design
methodology to effectively alleviate the heavy loads on memory bandwidth by
moving traffic from memory bus to inter-FPGA links. We implement Super-LIP
based on ZCU102 FPGA boards. Results demonstrate that Super-LIP with 2 FPGAs
can achieve 3.48x speedup, compared to the state-of-the-art single-FPGA design.
What is more, as the number of FPGAs scales up, the system latency can be
further reduced while maintaining high energy efficiency.",arxiv,autonomous vehicle,'autonomous vehicle' AND 'machine learning' AND ('real-world' AND 'deploy')
http://arxiv.org/abs/1907.01038v1,2019-07-01T19:42:37Z,2019-07-01T19:42:37Z,AVFI: Fault Injection for Autonomous Vehicles,"Autonomous vehicle (AV) technology is rapidly becoming a reality on U.S.
roads, offering the promise of improvements in traffic management, safety, and
the comfort and efficiency of vehicular travel. With this increasing popularity
and ubiquitous deployment, resilience has become a critical requirement for
public acceptance and adoption. Recent studies into the resilience of AVs have
shown that though the AV systems are improving over time, they have not reached
human levels of automation. Prior work in this area has studied the safety and
resilience of individual components of the AV system (e.g., testing of neural
networks powering the perception function). However, methods for holistic
end-to-end resilience assessment of AV systems are still non-existent.",arxiv,autonomous vehicle,'autonomous vehicle' AND 'machine learning' AND ('real-world' AND 'deploy')
http://arxiv.org/abs/1906.01562v2,2019-09-27T13:22:08Z,2019-06-04T16:27:47Z,Privacy-preserving Crowd-guided AI Decision-making in Ethical Dilemmas,"With the rapid development of artificial intelligence (AI), ethical issues
surrounding AI have attracted increasing attention. In particular, autonomous
vehicles may face moral dilemmas in accident scenarios, such as staying the
course resulting in hurting pedestrians or swerving leading to hurting
passengers. To investigate such ethical dilemmas, recent studies have adopted
preference aggregation, in which each voter expresses her/his preferences over
decisions for the possible ethical dilemma scenarios, and a centralized system
aggregates these preferences to obtain the winning decision. Although a useful
methodology for building ethical AI systems, such an approach can potentially
violate the privacy of voters since moral preferences are sensitive information
and their disclosure can be exploited by malicious parties. In this paper, we
report a first-of-its-kind privacy-preserving crowd-guided AI decision-making
approach in ethical dilemmas. We adopt the notion of differential privacy to
quantify privacy and consider four granularities of privacy protection by
taking voter-/record-level privacy protection and centralized/distributed
perturbation into account, resulting in four approaches VLCP, RLCP, VLDP, and
RLDP. Moreover, we propose different algorithms to achieve these privacy
protection granularities, while retaining the accuracy of the learned moral
preference model. Specifically, VLCP and RLCP are implemented with the data
aggregator setting a universal privacy parameter and perturbing the averaged
moral preference to protect the privacy of voters' data. VLDP and RLDP are
implemented in such a way that each voter perturbs her/his local moral
preference with a personalized privacy parameter. Extensive experiments on both
synthetic and real data demonstrate that the proposed approach can achieve high
accuracy of preference aggregation while protecting individual voter's privacy.",arxiv,autonomous vehicle,'autonomous vehicle' AND 'machine learning' AND ('real-world' AND 'deploy')
http://arxiv.org/abs/1905.11299v1,2019-05-27T15:32:59Z,2019-05-27T15:32:59Z,"ImgSensingNet: UAV Vision Guided Aerial-Ground Air Quality Sensing
  System","Given the increasingly serious air pollution problem, the monitoring of air
quality index (AQI) in urban areas has drawn considerable attention. This paper
presents ImgSensingNet, a vision guided aerial-ground sensing system, for
fine-grained air quality monitoring and forecasting using the fusion of haze
images taken by the unmanned-aerial-vehicle (UAV) and the AQI data collected by
an on-ground three-dimensional (3D) wireless sensor network (WSN).
Specifically, ImgSensingNet first leverages the computer vision technique to
tell the AQI scale in different regions from the taken haze images, where
haze-relevant features and a deep convolutional neural network (CNN) are
designed for direct learning between haze images and corresponding AQI scale.
Based on the learnt AQI scale, ImgSensingNet determines whether to wake up
on-ground wireless sensors for small-scale AQI monitoring and inference, which
can greatly reduce the energy consumption of the system. An entropy-based model
is employed for accurate real-time AQI inference at unmeasured locations and
future air quality distribution forecasting. We implement and evaluate
ImgSensingNet on two university campuses since Feb. 2018, and has collected
17,630 photos and 2.6 millions of AQI data samples. Experimental results
confirm that ImgSensingNet can achieve higher inference accuracy while greatly
reduce the energy consumption, compared to state-of-the-art AQI monitoring
approaches.",arxiv,autonomous vehicle,'autonomous vehicle' AND 'machine learning' AND ('real-world' AND 'deploy')
http://arxiv.org/abs/1905.04166v1,2019-05-10T13:34:18Z,2019-05-10T13:34:18Z,"An Open Source and Open Hardware Deep Learning-powered Visual Navigation
  Engine for Autonomous Nano-UAVs","Nano-size unmanned aerial vehicles (UAVs), with few centimeters of diameter
and sub-10 Watts of total power budget, have so far been considered incapable
of running sophisticated visual-based autonomous navigation software without
external aid from base-stations, ad-hoc local positioning infrastructure, and
powerful external computation servers. In this work, we present what is, to the
best of our knowledge, the first 27g nano-UAV system able to run aboard an
end-to-end, closed-loop visual pipeline for autonomous navigation based on a
state-of-the-art deep-learning algorithm, built upon the open-source CrazyFlie
2.0 nano-quadrotor. Our visual navigation engine is enabled by the combination
of an ultra-low power computing device (the GAP8 system-on-chip) with a novel
methodology for the deployment of deep convolutional neural networks (CNNs). We
enable onboard real-time execution of a state-of-the-art deep CNN at up to
18Hz. Field experiments demonstrate that the system's high responsiveness
prevents collisions with unexpected dynamic obstacles up to a flight speed of
1.5m/s. In addition, we also demonstrate the capability of our visual
navigation engine of fully autonomous indoor navigation on a 113m previously
unseen path. To share our key findings with the embedded and robotics
communities and foster further developments in autonomous nano-UAVs, we
publicly release all our code, datasets, and trained networks.",arxiv,autonomous vehicle,'autonomous vehicle' AND 'machine learning' AND ('real-world' AND 'deploy')
http://arxiv.org/abs/1904.06025v2,2020-02-21T18:00:23Z,2019-04-12T04:01:18Z,"Interaction-aware Decision Making with Adaptive Strategies under Merging
  Scenarios","In order to drive safely and efficiently under merging scenarios, autonomous
vehicles should be aware of their surroundings and make decisions by
interacting with other road participants. Moreover, different strategies should
be made when the autonomous vehicle is interacting with drivers having
different level of cooperativeness. Whether the vehicle is on the merge-lane or
main-lane will also influence the driving maneuvers since drivers will behave
differently when they have the right-of-way than otherwise. Many traditional
methods have been proposed to solve decision making problems under merging
scenarios. However, these works either are incapable of modeling complicated
interactions or require implementing hand-designed rules which cannot properly
handle the uncertainties in real-world scenarios. In this paper, we proposed an
interaction-aware decision making with adaptive strategies (IDAS) approach that
can let the autonomous vehicle negotiate the road with other drivers by
leveraging their cooperativeness under merging scenarios. A single policy is
learned under the multi-agent reinforcement learning (MARL) setting via the
curriculum learning strategy, which enables the agent to automatically infer
other drivers' various behaviors and make decisions strategically. A masking
mechanism is also proposed to prevent the agent from exploring states that
violate common sense of human judgment and increase the learning efficiency. An
exemplar merging scenario was used to implement and examine the proposed
method.",arxiv,autonomous vehicle,'autonomous vehicle' AND 'machine learning' AND ('real-world' AND 'deploy')
http://arxiv.org/abs/1904.00035v1,2019-03-29T18:15:24Z,2019-03-29T18:15:24Z,Autonomous Highway Driving using Deep Reinforcement Learning,"The operational space of an autonomous vehicle (AV) can be diverse and vary
significantly. This may lead to a scenario that was not postulated in the
design phase. Due to this, formulating a rule based decision maker for
selecting maneuvers may not be ideal. Similarly, it may not be effective to
design an a-priori cost function and then solve the optimal control problem in
real-time. In order to address these issues and to avoid peculiar behaviors
when encountering unforeseen scenario, we propose a reinforcement learning (RL)
based method, where the ego car, i.e., an autonomous vehicle, learns to make
decisions by directly interacting with simulated traffic. The decision maker
for AV is implemented as a deep neural network providing an action choice for a
given system state. In a critical application such as driving, an RL agent
without explicit notion of safety may not converge or it may need extremely
large number of samples before finding a reliable policy. To best address the
issue, this paper incorporates reinforcement learning with an additional short
horizon safety check (SC). In a critical scenario, the safety check will also
provide an alternate safe action to the agent provided if it exists. This leads
to two novel contributions. First, it generalizes the states that could lead to
undesirable ""near-misses"" or ""collisions "". Second, inclusion of safety check
can provide a safe and stable training environment. This significantly enhances
learning efficiency without inhibiting meaningful exploration to ensure safe
and optimal learned behavior. We demonstrate the performance of the developed
algorithm in highway driving scenario where the trained AV encounters varying
traffic density in a highway setting.",arxiv,autonomous vehicle,'autonomous vehicle' AND 'machine learning' AND ('real-world' AND 'deploy')
http://arxiv.org/abs/1902.01084v2,2021-01-15T20:47:41Z,2019-02-04T08:51:50Z,Paracosm: A Language and Tool for Testing Autonomous Driving Systems,"Systematic testing of autonomous vehicles operating in complex real-world
scenarios is a difficult and expensive problem. We present Paracosm, a reactive
language for writing test scenarios for autonomous driving systems. Paracosm
allows users to programmatically describe complex driving situations with
specific visual features, e.g., road layout in an urban environment, as well as
reactive temporal behaviors of cars and pedestrians. Paracosm programs are
executed on top of a game engine that provides realistic physics simulation and
visual rendering. The infrastructure allows systematic exploration of the state
space, both for visual features (lighting, shadows, fog) and for reactive
interactions with the environment (pedestrians, other traffic). We define a
notion of test coverage for Paracosm configurations based on combinatorial
testing and low dispersion sequences. Paracosm comes with an automatic test
case generator that uses random sampling for discrete parameters and
deterministic quasi-Monte Carlo generation for continuous parameters. Through
an empirical evaluation, we demonstrate the modeling and testing capabilities
of Paracosm on a suite of autonomous driving systems implemented using deep
neural networks developed in research and education. We show how Paracosm can
expose incorrect behaviors or degraded performance.",arxiv,autonomous vehicle,'autonomous vehicle' AND 'machine learning' AND ('real-world' AND 'deploy')
http://arxiv.org/abs/1812.08273v1,2018-12-19T22:25:52Z,2018-12-19T22:25:52Z,Analog Signal Processing Using Stochastic Magnets,"We present a low barrier magnet based compact hardware unit for analog
stochastic neurons and demonstrate its use as a building-block for neuromorphic
hardware. By coupling circular magnetic tunnel junctions (MTJs) with a CMOS
based analog buffer, we show that these units can act as leaky-integrate-and
fire (LIF) neurons, a model of biological neural networks particularly suited
for temporal inferencing and pattern recognition. We demonstrate examples of
temporal sequence learning, processing, and prediction tasks in real time, as a
proof of concept demonstration of scalable and adaptive signal-processors.
Efficient non von-Neumann hardware implementation of such processors can open
up a pathway for integration of hardware based cognition in a wide variety of
emerging systems such as IoT, industrial controls, bio- and photo-sensors, and
Unmanned Autonomous Vehicles.",arxiv,autonomous vehicle,'autonomous vehicle' AND 'machine learning' AND ('real-world' AND 'deploy')
http://arxiv.org/abs/1811.00145v3,2019-01-12T19:27:45Z,2018-10-31T22:47:22Z,Scalable End-to-End Autonomous Vehicle Testing via Rare-event Simulation,"While recent developments in autonomous vehicle (AV) technology highlight
substantial progress, we lack tools for rigorous and scalable testing.
Real-world testing, the $\textit{de facto}$ evaluation environment, places the
public in danger, and, due to the rare nature of accidents, will require
billions of miles in order to statistically validate performance claims. We
implement a simulation framework that can test an entire modern autonomous
driving system, including, in particular, systems that employ deep-learning
perception and control algorithms. Using adaptive importance-sampling methods
to accelerate rare-event probability evaluation, we estimate the probability of
an accident under a base distribution governing standard traffic behavior. We
demonstrate our framework on a highway scenario, accelerating system evaluation
by $2$-$20$ times over naive Monte Carlo sampling methods and $10$-$300
\mathsf{P}$ times (where $\mathsf{P}$ is the number of processors) over
real-world testing.",arxiv,autonomous vehicle,'autonomous vehicle' AND 'machine learning' AND ('real-world' AND 'deploy')
http://arxiv.org/abs/1810.09729v1,2018-10-23T08:51:54Z,2018-10-23T08:51:54Z,"Design Challenges of Multi-UAV Systems in Cyber-Physical Applications: A
  Comprehensive Survey, and Future Directions","Unmanned Aerial Vehicles (UAVs) have recently rapidly grown to facilitate a
wide range of innovative applications that can fundamentally change the way
cyber-physical systems (CPSs) are designed. CPSs are a modern generation of
systems with synergic cooperation between computational and physical potentials
that can interact with humans through several new mechanisms. The main
advantages of using UAVs in CPS application is their exceptional features,
including their mobility, dynamism, effortless deployment, adaptive altitude,
agility, adjustability, and effective appraisal of real-world functions anytime
and anywhere. Furthermore, from the technology perspective, UAVs are predicted
to be a vital element of the development of advanced CPSs. Therefore, in this
survey, we aim to pinpoint the most fundamental and important design challenges
of multi-UAV systems for CPS applications. We highlight key and versatile
aspects that span the coverage and tracking of targets and infrastructure
objects, energy-efficient navigation, and image analysis using machine learning
for fine-grained CPS applications. Key prototypes and testbeds are also
investigated to show how these practical technologies can facilitate CPS
applications. We present and propose state-of-the-art algorithms to address
design challenges with both quantitative and qualitative methods and map these
challenges with important CPS applications to draw insightful conclusions on
the challenges of each application. Finally, we summarize potential new
directions and ideas that could shape future research in these areas.",arxiv,autonomous vehicle,'autonomous vehicle' AND 'machine learning' AND ('real-world' AND 'deploy')
http://arxiv.org/abs/1808.10134v1,2018-08-30T06:29:10Z,2018-08-30T06:29:10Z,"Baidu Apollo Auto-Calibration System - An Industry-Level Data-Driven and
  Learning based Vehicle Longitude Dynamic Calibrating Algorithm","For any autonomous driving vehicle, control module determines its road
performance and safety, i.e. its precision and stability should stay within a
carefully-designed range. Nonetheless, control algorithms require vehicle
dynamics (such as longitudinal dynamics) as inputs, which, unfortunately, are
obscure to calibrate in real time. As a result, to achieve reasonable
performance, most, if not all, research-oriented autonomous vehicles do manual
calibrations in a one-by-one fashion. Since manual calibration is not
sustainable once entering into mass production stage for industrial purposes,
we here introduce a machine-learning based auto-calibration system for
autonomous driving vehicles. In this paper, we will show how we build a
data-driven longitudinal calibration procedure using machine learning
techniques. We first generated offline calibration tables from human driving
data. The offline table serves as an initial guess for later uses and it only
needs twenty-minutes data collection and process. We then used an
online-learning algorithm to appropriately update the initial table (the
offline table) based on real-time performance analysis. This longitudinal
auto-calibration system has been deployed to more than one hundred Baidu Apollo
self-driving vehicles (including hybrid family vehicles and electronic
delivery-only vehicles) since April 2018. By August 27, 2018, it had been
tested for more than two thousands hours, ten thousands kilometers (6,213
miles) and yet proven to be effective.",arxiv,autonomous vehicle,'autonomous vehicle' AND 'machine learning' AND ('real-world' AND 'deploy')
