contentType,identifier,title,publicationName,doi,publisher,publicationDate,abstract,url,database,query_name,query_value
Chapter ConferencePaper,doi:10.1007/978-3-030-97774-0_38,Multi-agent Computation Offloading in UAV Assisted MEC via Deep Reinforcement Learning,Smart Computing and Communication,10.1007/978-3-030-97774-0_38,Springer,2022-01-01,"Due to its high maneuverability and flexibility, there have been a growing popularity to adopt Unmanned Aerial Vehicles (UAVs) on Mobile Edge Computing (MEC), serving as edge platforms in infrastructure- unavailable scenarios, e.g., disaster rescue, field operation. Owing to the weak workload, UAVs are typically equipped with limited computing and energy resources. Hence, it is crucial to design efficient edge computation offloading algorithms which could achieve high edge computing performance while keeping low energy consumption. A variety of UAV assisted computation offloading algorithms have been proposed, most of which focus on the scheduling of computation offloading in a centralized way and could become infeasible when the network size increases greatly. To address the issue, we propose a semi-distributed computation offloading framework based on Multi-Agent Twin Delayed (MATD3) deep deterministic policy gradient to minimize the average system cost of the MEC network. We adopt the actor-critic reinforcement learning framework to learn an offloading decision model for each User Equipment (UE), so that each UE could make near-optimal computation offloading decisions by its own and does not suffer from the booming of the network size. Extensive experiments are carried out via numerical simulation and the experimental results verify the effectiveness of the proposed algorithm.",http://link.springer.com/openurl/fulltext?id=doi:10.1007/978-3-030-97774-0_38,springer,autonomous vehicle,'autonomous vehicle' AND 'machine learning' AND ('real-world' AND 'deploy')
Article,doi:10.1007/s11042-021-11437-3,Deep reinforcement learning based control for Autonomous Vehicles in CARLA,Multimedia Tools and Applications,10.1007/s11042-021-11437-3,Springer,2022-01-01,"Nowadays, Artificial Intelligence (AI) is growing by leaps and bounds in almost all fields of technology, and Autonomous Vehicles (AV) research is one more of them. This paper proposes the using of algorithms based on Deep Learning (DL) in the control layer of an autonomous vehicle. More specifically, Deep Reinforcement Learning (DRL) algorithms such as Deep Q-Network (DQN) and Deep Deterministic Policy Gradient (DDPG) are implemented in order to compare results between them. The aim of this work is to obtain a trained model, applying a DRL algorithm, able of sending control commands to the vehicle to navigate properly and efficiently following a determined route. In addition, for each of the algorithms, several agents are presented as a solution, so that each of these agents uses different data sources to achieve the vehicle control commands. For this purpose, an open-source simulator such as CARLA is used, providing to the system with the ability to perform a multitude of tests without any risk into an hyper-realistic urban simulation environment, something that is unthinkable in the real world. The results obtained show that both DQN and DDPG reach the goal, but DDPG obtains a better performance. DDPG perfoms trajectories very similar to classic controller as LQR. In both cases RMSE is lower than 0.1m following trajectories with a range 180-700m. To conclude, some conclusions and future works are commented.",http://link.springer.com/openurl/fulltext?id=doi:10.1007/s11042-021-11437-3,springer,autonomous vehicle,'autonomous vehicle' AND 'machine learning' AND ('real-world' AND 'deploy')
Chapter ConferencePaper,doi:10.1007/978-3-031-05230-9_79,Object Detection and Reinforcement Learning Approach for Intelligent Control of UAV,"New Technologies, Development and Application V",10.1007/978-3-031-05230-9_79,Springer,2022-01-01,"In recent years, the development of deep learning models that can generate more accurate predictions and operate in real-time has brought both opportunities and challenges across the various domains of robotic vision. This breakthrough enables researchers to design and deploy more challenging tasks on intelligent mobile robots, which require emphasized abilities of learning and reasoning. In this paper, a new method for intelligent robot control, based on deep learning and reinforcement learning is proposed. The fundamental idea of this work is how the UAV equipped with a monocular camera can learn significant information about the object of interest in the context of its localization and navigation. For such purpose, the object detection system based on Tiny YOLOv2 architecture is employed. Furthermore, bounding box data generated by a convolution neural network is utilized for depth estimation and determining object boundaries. This information has shown how the state-space dimensions can be significantly reduced, which was essential for further implementation of the Q-learning algorithm. In order to test the proposed framework, a model is developed in MATLAB Simulink. The simulation, which covered different scenarios, was carried out on the UAV within the 3D scene rendered by Unreal Engine. The obtained results have demonstrated the applicability of the proposed methodology for depth estimation, gathering information about the object, object-driven navigation, and autonomous localization and navigation.",http://link.springer.com/openurl/fulltext?id=doi:10.1007/978-3-031-05230-9_79,springer,autonomous vehicle,'autonomous vehicle' AND 'machine learning' AND ('real-world' AND 'deploy')
Chapter ConferencePaper,doi:10.1007/978-981-16-2406-3_70,Autonomous Lane Navigation: Using Hand-Coded Method and Deep Learning Method,Proceedings of the 12th National Technical Seminar on Unmanned System Technology 2020,10.1007/978-981-16-2406-3_70,Springer,2022-01-01,"Autonomous vehicle is known as a vehicle that requires no or little human decision while in motion because it’s capable of sensing its environment, it has been a continuous field of research and falls under autonomous navigation system (ANS). Autonomous navigation depicts that a vehicle is capable to plot its path and achieve its plan without human interference remote navigation aids are used in the planning process. In this project, the navigation aid is a front-facing camera mounted and images from the camera are used to compute steering commands. This work made use of two methods which are the handcrafted method for lane navigation and the end to end learning scheme developed by Nvidia cooperation to train a model to compute steering command from a front-facing camera. The deep learning model is compared with the handcraft method of computing steering angle. The difference between these two methods is presented in this work as the navigation of a modelled car which navigates through the designed lanes using both methods, the accuracy of the car following the lanes is used to determine the better method for lane navigation. Which turns out to be the end to end learning method for lane navigation.",http://link.springer.com/openurl/fulltext?id=doi:10.1007/978-981-16-2406-3_70,springer,autonomous vehicle,'autonomous vehicle' AND 'machine learning' AND ('real-world' AND 'deploy')
Chapter ConferencePaper,doi:10.1007/978-981-16-4016-2_65,The Mythical or Realistic Implementation of AI-powered Driverless Cars in Africa: A Review of Challenges and Risks,Smart Trends in Computing and Communications,10.1007/978-981-16-4016-2_65,Springer,2022-01-01,"In recent times, African nations have been mostly absent in discussions concerning artificial intelligence (AI)-powered driverless cars. Additionally, it was also discovered that several global surveys and other studies on driverless car acceptance, popularity and confidence excluded Africa. This is in the light of its immense benefits which include the reduction of road accidents, an effectual car-sharing and transport structure and accurate navigation with less consideration of distractions. Therefore, we examined the challenges and risks attendant to the deployment of self-driving cars in a developing region such as Africa. Several challenges were identified, and they include lack of needed infrastructure, absence of law and order, cost, absence of image detection and recognition projects, absence of practical artificial intelligence courseware, need for an advanced AI-based algorithm, weak legal framework and other ethical issues, criminalization, security and privacy and high tendency to cause more unemployment. The paper highlights several risks attendant to such forms of advancement in Africa.",http://link.springer.com/openurl/fulltext?id=doi:10.1007/978-981-16-4016-2_65,springer,autonomous vehicle,'autonomous vehicle' AND 'machine learning' AND ('real-world' AND 'deploy')
Chapter,doi:10.1007/978-3-030-97113-7_15,Multi-sensor Fusion Methods for Unmanned Aerial Vehicles to Detect Environment Using Deep Learning Techniques,Computational Intelligence for Unmanned Aerial Vehicles Communication Networks,10.1007/978-3-030-97113-7_15,Springer,2022-01-01,"Sensor fusion is the ability to merge the inputs of multiple sensors like radars and cameras to form a single image of the environment around a vehicle. The output model brings an accurate image since it compares the strengths of the different sensors. Deep learning provides some networks and techniques to avail sensor fusion capability. Deep learning is the branch of Machine learning. Deep learning is based on learning and improving on its own by examining computer algorithms. Sensor fusion is possible through deep learning since sensors need to merge themselves to get a clear and accurate output of the surrounding of a vehicle. In this study, I have put together some techniques of deep learning based sensor fusion for detecting environments around Unmanned Aerial vehicles.",http://link.springer.com/openurl/fulltext?id=doi:10.1007/978-3-030-97113-7_15,springer,autonomous vehicle,'autonomous vehicle' AND 'machine learning' AND ('real-world' AND 'deploy')
Chapter ConferencePaper,doi:10.1007/978-981-16-5429-9_45,Real-time Trajectory Prediction of Unmanned Aircraft Vehicles Based on Gated Recurrent Unit,Green Connected Automated Transportation and Safety,10.1007/978-981-16-5429-9_45,Springer,2022-01-01,"In view of the increasing number of unmanned aircraft vehicles (UAVs) in low altitude airspace, which leads to the increasing difficulty of surveillance, a real-time trajectory prediction method based on the gated recurrent unit (GRU) is proposed. The parameters of the GRU model are determined including the number of hidden layers, the cell sizes of a single hidden layer and the time step. Historical trajectory data are used to train and test the model. The result shows that the mean absolute errors (MAE) of altitude, longitude, and latitude predicted by the GRU model are 0.86 m, 2.85 m, and 3.65 m, respectively. The prediction results of the GRU model are compared with the long and short-term memory (LSTM), the support vector regression (SVR) and the autoregressive integrated moving average model (ARIMA). It is found that the GRU and LSTM outperform the two other models. The LSTM prediction accuracy is slightly higher than that of the GRU model. However, the space complexity of the LSTM model is much larger than that of the GRU model, and its training time is much longer.",http://link.springer.com/openurl/fulltext?id=doi:10.1007/978-981-16-5429-9_45,springer,autonomous vehicle,'autonomous vehicle' AND 'machine learning' AND ('real-world' AND 'deploy')
Chapter ConferencePaper,doi:10.1007/978-3-030-95467-3_38,Deep Learning Detection of GPS Spoofing,"Machine Learning, Optimization, and Data Science",10.1007/978-3-030-95467-3_38,Springer,2022-01-01,"Unmanned aerial vehicles (UAVs) are widely deployed in air navigation, where numerous applications use them for safety-of-life and positioning, navigation, and timing tasks. Consequently, GPS spoofing attacks are more and more frequent. The aim of this work is to enhance GPS systems of UAVs, by providing the ability of detecting and preventing spoofing attacks. The proposed solution is based on a multilayer perceptron neural network, which processes the flight parameters and the GPS signals to generate alarms signalling GPS spoofing attacks. The obtained accuracy lies between 83.23% for TEXBAT dataset and 99.93% for MAVLINK dataset.",http://link.springer.com/openurl/fulltext?id=doi:10.1007/978-3-030-95467-3_38,springer,autonomous vehicle,'autonomous vehicle' AND 'machine learning' AND ('real-world' AND 'deploy')
Chapter,doi:10.1007/978-981-16-9991-7_3,A Deep Learning-Based Detection System of Multi-class Crops and Orchards Using a UAV,"Computer Vision and Machine Learning in Agriculture, Volume 2",10.1007/978-981-16-9991-7_3,Springer,2022-01-01,"Agriculture is vital to the country’s economy. A 70% increase in agricultural consumption is expected by 2050 as the world’s population approaches 9 billion people. However, obtaining this figure is difficult due to weather and natural disasters. Modernizing this field’s technologies can help achieve the desired outcome. Precision agriculture is a type of ICT-based technology that has significantly increased global productivity. Since their introduction in agriculture, unmanned aerial vehicles (UAVs) and other robots have also offered the potential to be used in various PA applications such as health monitoring, yield estimation, and spraying. In this context, a real-time deep learning detection system based on an improved faster-RCNN is proposed to detect multi-class crops and orchards accurately. The proposed framework was implemented and evaluated in two different croplands (garlic and coriander) and two different orchards (loquat and peach). The developed system outperformed its competitors with 91.3% mean average precision (mAP) and a processing time of 0.235 s. Thus, the proposed framework provided an excellent potential to be deployed on autonomous systems (UAVs, robots, etc.) for various PA applications.",http://link.springer.com/openurl/fulltext?id=doi:10.1007/978-981-16-9991-7_3,springer,autonomous vehicle,'autonomous vehicle' AND 'machine learning' AND ('real-world' AND 'deploy')
Chapter,doi:10.1007/978-3-030-92084-5_2,The Technological Revolution: The Rise of Machines,Making the Global Economy Work for Everyone,10.1007/978-3-030-92084-5_2,Springer,2022-01-01,"We are living in the most innovative period in all of human history. On the one hand, the technological and scientific revolution opens up unprecedented opportunities: accelerating human progress, improving the quality of life and overcoming many constraints. From an economic point of view, technology and science can increase productivity and expand the economy generating wealth, relieve humans from heavy and dangerous activities, and increase labour flexibility. On the other hand, some technologies can be used for criminal activities, terrorism, sabotage, restriction of personal freedoms, repression and other ethically controversial objectives. The risks also affect the sustainability of economic growth, the fabric of society and the future of labour, humanity as a whole and its role. Simply witnessing technological development as a mere spectator is not possible. New technologies influence the way we live, think, produce and work. Beyond the technical aspects, they introduce new mental, cultural and strategic models. The upcoming wave of innovation affects everyone. To ride this wave instead of being overwhelmed by it, one must grasp the main innovations and understand how they work and are connected to one another.",http://link.springer.com/openurl/fulltext?id=doi:10.1007/978-3-030-92084-5_2,springer,autonomous vehicle,'autonomous vehicle' AND 'machine learning' AND ('real-world' AND 'deploy')
Chapter ConferencePaper,doi:10.1007/978-3-030-85540-6_1,"Human and Machine Trust Considerations, Concerns and Constraints for Lethal Autonomous Weapon Systems (LAWS)","Human Interaction, Emerging Technologies and Future Systems V",10.1007/978-3-030-85540-6_1,Springer,2022-01-01,"Trust and autonomous systems, especially weapon systems, could be the most difficult technological challenge facing defense industries, militaries, politicians, and the public because the algorithms have to be trusted. Furthermore, the operator, the military, defense industry, politicians and the public need to trust the system to also follow ethical and legal rules. This paper briefly describes the trust considerations, concerns and constraints regarding autonomous weapons systems and concludes with a brief description of the current development programs and projects by the various US military services.",http://link.springer.com/openurl/fulltext?id=doi:10.1007/978-3-030-85540-6_1,springer,autonomous vehicle,'autonomous vehicle' AND 'machine learning' AND ('real-world' AND 'deploy')
Chapter,doi:10.1007/978-3-030-97113-7_3,Machine Learning Techniques for UAV Trajectory Optimization—A Survey,Computational Intelligence for Unmanned Aerial Vehicles Communication Networks,10.1007/978-3-030-97113-7_3,Springer,2022-01-01,"Unmanned Aerial Vehicles (UAVs), generally known as drone are utilized in various genuine applications like payload conveyance, traffic observing, moving articles in apparently risky climate, and observation. When utilized in mechanical scenery, UAVs can shape a center piece of modern automation alongside IoT gadgets. With regard to the traditional applications, their trend of getting in similar domains is expected to have enhanced outputs, inspite of many new challenges. To meet out the issues in this scenario, the Artificial Intelligence support is needed to play a vital role when UAVs are applied. A deep study is made and presented in this work with a keen study of all Machine Learning techniques utilized for UAV linked changes, for example, channel displaying, asset the board, situating, and security.",http://link.springer.com/openurl/fulltext?id=doi:10.1007/978-3-030-97113-7_3,springer,autonomous vehicle,'autonomous vehicle' AND 'machine learning' AND ('real-world' AND 'deploy')
Chapter ConferencePaper,doi:10.1007/978-981-16-9492-9_176,Improved Model Reference Adaptive Controller with RBF Neural Network Approximation for UAV,Proceedings of 2021 International Conference on Autonomous Unmanned Systems (ICAUS 2021),10.1007/978-981-16-9492-9_176,Springer,2022-01-01,"This paper presents an improved model reference adaptive controller (I-MRAC) with RBF neural network approximation to deal with the model uncertainties, unknown actuator dynamics and input saturation of the unmanned aerial vehicle (UAV). On the one hand, the output of the RBF neural network (NN) is used as the compensator to eliminate the uncertainties of the system. On the other hand, the reference model is modified to deal with the unknown actuator dynamics and input saturation, improve stability and robustness, and prevent the high frequency oscillations. Meanwhile, the stability of the whole closed-loop system is proved by the Lyapunov analysis. The numerical simulation results of UAV attitude control demonstrate the effectiveness of the proposed method.",http://link.springer.com/openurl/fulltext?id=doi:10.1007/978-981-16-9492-9_176,springer,autonomous vehicle,'autonomous vehicle' AND 'machine learning' AND ('real-world' AND 'deploy')
Chapter ConferencePaper,doi:10.1007/978-3-031-10388-9_25,Deep Learning for Acoustic Pattern Recognition in Wind Turbines Aerial Inspections,Proceedings of the Sixteenth International Conference on Management Science and Engineering Management – Volume 1,10.1007/978-3-031-10388-9_25,Springer,2022-01-01,"Wind turbine maintenance management requires new condition monitoring systems and robust algorithms for fault detection. Acoustic inspection can detect anomalies in rotatory components through the analysis of acoustic data with advanced pattern recognition algorithms. Unmanned Aerial Vehicles can carry large sensors and technologies, being one of the most relevant techniques for non-destructive inspections. This article presents a new approach to analyze the acoustic data acquired by the condition monitoring system developed in previous research studies, formed by an acoustic sensor embedded in an unmanned aerial vehicle. This approach develops different deep learning methods for acoustic signal analysis to detect abnormal patterns. One of the most suitable tools for this purpose is the Recurrent Neural Network, concretely the Long Short-Term Memory neuronal network commonly employed in sound pattern recognition. It is presented a real case study, obtaining a sound pattern classification based on the trained networks achieving 87% accuracy. This methodology aims to develop a future integrated system capable of detecting wind farms anomalies with acoustic datasets.",http://link.springer.com/openurl/fulltext?id=doi:10.1007/978-3-031-10388-9_25,springer,autonomous vehicle,'autonomous vehicle' AND 'machine learning' AND ('real-world' AND 'deploy')
Chapter ConferencePaper,doi:10.1007/978-3-030-96040-7_45,Lane Detection for Autonomous Vehicle in Hazy Environment with Optimized Deep Learning Techniques,Advanced Network Technologies and Intelligent Computing,10.1007/978-3-030-96040-7_45,Springer,2022-01-01,"In this technological era, the devices are getting more intelligent and smarter with the advent of artificial intelligence and related technologies. The autonomous vehicle is one of the emerging and important example using the same machine intelligence for effective and efficient vehicle driving experience. However to make the working of autonomous vehicle in a smooth and responsive, the accurate lane detection is a crucial aspects and other co-variate like weather condition also place an important role in it. The present work explores lane detection in foggy or hazy environment on time series data of a continuous driving scene. The proposed methodology uses Dark Channel Prior (DCP) to make images un-hazy and this is passed as an input to the proposed hybrid architecture by connecting a convolutional neural network (CNN) architecture with a recurrent neural network architecture (RNN). The model uses Long-Short Term Memory (LSTM) for time-series data analysis as it captures and process the time series data well in advance. In this model, the CNN block first extracts the feature maps from each frame which is given as input of the time series data and after this these feature maps are provided to LSTM to obtain the final prediction. The model also uses dark channel prior (Image enhancing technique) to enhance image in case of foggy or hazy environment and then detecting lane with the help of enhanced images. Finally, the accuracy of the model is shown in terms of standard performance metrics like precision, recall and F1 score.",http://link.springer.com/openurl/fulltext?id=doi:10.1007/978-3-030-96040-7_45,springer,autonomous vehicle,'autonomous vehicle' AND 'machine learning' AND ('real-world' AND 'deploy')
Chapter ConferencePaper,doi:10.1007/978-3-030-96040-7_45,Lane Detection for Autonomous Vehicle in Hazy Environment with Optimized Deep Learning Techniques,Advanced Network Technologies and Intelligent Computing,10.1007/978-3-030-96040-7_45,Springer,2022-01-01,"In this technological era, the devices are getting more intelligent and smarter with the advent of artificial intelligence and related technologies. The autonomous vehicle is one of the emerging and important example using the same machine intelligence for effective and efficient vehicle driving experience. However to make the working of autonomous vehicle in a smooth and responsive, the accurate lane detection is a crucial aspects and other co-variate like weather condition also place an important role in it. The present work explores lane detection in foggy or hazy environment on time series data of a continuous driving scene. The proposed methodology uses Dark Channel Prior (DCP) to make images un-hazy and this is passed as an input to the proposed hybrid architecture by connecting a convolutional neural network (CNN) architecture with a recurrent neural network architecture (RNN). The model uses Long-Short Term Memory (LSTM) for time-series data analysis as it captures and process the time series data well in advance. In this model, the CNN block first extracts the feature maps from each frame which is given as input of the time series data and after this these feature maps are provided to LSTM to obtain the final prediction. The model also uses dark channel prior (Image enhancing technique) to enhance image in case of foggy or hazy environment and then detecting lane with the help of enhanced images. Finally, the accuracy of the model is shown in terms of standard performance metrics like precision, recall and F1 score.",http://link.springer.com/openurl/fulltext?id=doi:10.1007/978-3-030-96040-7_45,springer,autonomous vehicle,'autonomous vehicle' AND 'machine learning' AND ('real-world' AND 'deploy')
