contentType,identifier,title,publicationName,doi,publisher,publicationDate,abstract,url,database,query_name,query_value
Chapter ConferencePaper,doi:10.1007/978-3-030-74728-2_3,Palm Tree Detection in Drone Images Using Deep Convolutional Neural Networks: Investigating the Effective Use of YOLO V3,Digital Interaction and Machine Intelligence,10.1007/978-3-030-74728-2_3,Springer,2021-01-01,"Owing to the agricultural and economic importance to many countries, computer based automated palm-tree detection from aerial images, has been an area of research significance to the computer vision research community worldwide. Most previous approaches have applied traditional machine learning algorithms for palm-tree detection. However, in the recent past, deep neural network based learning has been proven to be a far more superior approach for general object detection and recognition tasks in many application areas. Alongside this technological development lightweight UAVs, e.g. Drones , have been widely accepted as having great practical potential and economic benefit in the surveillance of large areas of land, in significantly higher resolution, as compared to the traditional use of satellite images or more expensive large UAVs. This research presents a novel methodology based on the latest YOLO Version-3 Convolutional Neural Network object detector for detecting palm-trees in drone images captured in a desert area that includes palm-trees of different sizes, resolution, ground spread, degree of overlap, etc. In particular, we discuss the specific training strategy adopted and hyper-parameter optimisations carried out to improve the accuracy from a modest 0.78 to 0.96.",http://link.springer.com/openurl/fulltext?id=doi:10.1007/978-3-030-74728-2_3,springer,autonomous vehicle,'autonomous vehicle' AND 'machine learning' AND ('real-world' AND 'deploy')
Chapter ConferencePaper,doi:10.1007/978-3-030-74893-7_24,LiDAR Localization and Mapping for Autonomous Vehicles: Recent Solutions and Trends,"Automation 2021: Recent Achievements in Automation, Robotics and Measurement Techniques",10.1007/978-3-030-74893-7_24,Springer,2021-01-01,"This paper presents a brief survey of the current achievements in LiDAR SLAM and discusses some recent trends and new ideas in this area. The focus is on LiDAR SLAM applied to autonomous vehicles, which still strugle with real-world complexity. We identify the challenges in efficient environment representation, robust estimation over large state spaces, and real-time handling of the scene dynamics and diversified semantics. Some of these issues are illustrated by preliminary results of our recent research in LiDAR SLAM.",http://link.springer.com/openurl/fulltext?id=doi:10.1007/978-3-030-74893-7_24,springer,autonomous vehicle,'autonomous vehicle' AND 'machine learning' AND ('real-world' AND 'deploy')
Chapter,doi:10.1007/978-981-15-9255-3_1,Challenges for and with Autonomous Vehicles: An Introduction,Autonomous Vehicles,10.1007/978-981-15-9255-3_1,Springer,2021-01-01,"The deployment of autonomous vehicles has been announced for years. Yet, full autonomous vehicles are not on public roads. Elon Musk Elon Musk , speaking at an event during the first half of 2020, stated that his firm will be able to present a fully autonomous vehicle technology by the end of the year. This statement is met with skepticism, especially because several of the challenges that existed have not been solved. Road traffic laws have not been adjusted to face the reality of driving by an autonomous machine. The only way that full autonomous vehicles can hit public roads is through test procedures. There also exists quite some uncertainty on who should be liable for accidents with autonomous vehicles. Accidents may occur, and this is something that adversarial machine learning Adversarial machine learning is showing. Even with the best set of sensors, the interpretation of the sensed environment may be misinterpreted. Connectivity Connectivity is being suggested as a possible solution to several of the problems autonomous vehicles are facing. Deploying autonomous vehicles will also challenge business organization, as car manufacturers Manufacturer may turn their business vehicles into mobility service providers. This may require a different type of organization within the firm.",http://link.springer.com/openurl/fulltext?id=doi:10.1007/978-981-15-9255-3_1,springer,autonomous vehicle,'autonomous vehicle' AND 'machine learning' AND ('real-world' AND 'deploy')
Chapter,doi:10.1007/978-3-030-65661-4_11,"Synergy of Internet of Things with Cloud, Artificial Intelligence and Blockchain for Empowering Autonomous Vehicles",Deep Learning and Big Data for Intelligent Transportation,10.1007/978-3-030-65661-4_11,Springer,2021-01-01,"Out of the advancements in Information Technology, the Internet of Things (IoT) plays an important and major role as it metamorphose the object from real world Scenario to intelligent virtual form. The term Internet of Things is coined from two phrases such as Internet and Thing which states that the physical objects such as computing devices acts through the network of connection. This technological ecosystem allows the object or thing to collect and transfer the data through the internet, without any physical assistance. It includes four major processes such as collect, communicate, analyse and act. The main purpose of IoT is making the human life smart thereby reducing the human effort. The cloud is an environment that seems to be a reinforcement of booming technology. It provides everything as service, right from storage to computing power through internet. It seems to be a flexible computing model that has intensified the growth of information technology. It enchanted the sprout of IoT as it needs more storage for the data that are acquired from the objects. Another booming technology is artificial intelligence where the intelligence of machine is used for enabling smart tasks than using the human intelligence. It is in existence since 1950 s but the resurgence of it happens during twenty-first century with the advances in computing power and storage of voluminous data. The main purpose of AI is to achieve accurate interpretation of voluminous data and extract valuable learning from the data thereby achieving the appropriate goals in a flexible manner. The IoT with this gleaming AI allows the physical objects to collect the valuable data through continuous streaming and allows it to perceive its tasks and domains for greatest chance of prosperous goal achievement. Blockchain is another revolution of the information technology. The blockchain or Distributed Ledger Technology is a promising technology where the digital assets of myriad users are managed by maintaining the transparency and evading the undesirable alterations. It stores and manages the data in the form of multiple blocks with respective cryptographic hashing. It is a distributed and decentralized model where the digital form of transactions are recorded in multiple devices, this allows the system to do any alterations or changes in each and every blocks so as to make changes in the record. This model avoids the precarious changes that may occur in the digital world. The IoT with this blockchain technology or the blockchain of thing may allow the digital environment to create a permanent, verifiable and secure method of managing the valuable data through intelligent machines. It will enable humanless interventions for decision making through proper environment interactions. This chapter elaborates all the four technologies such as IoT, AI, Cloud and Blockchain with regard to the autonomous vehicles. The need for these flickering technologies are explored and exposed so as to understand these technologies. The synergies of IoT with other three technologies are discussed for better understanding and upgradation of the technology. It also scrutinizes the recent developments with all these technological synergies.",http://link.springer.com/openurl/fulltext?id=doi:10.1007/978-3-030-65661-4_11,springer,autonomous vehicle,'autonomous vehicle' AND 'machine learning' AND ('real-world' AND 'deploy')
Chapter ConferencePaper,doi:10.1007/978-3-030-90966-6_20,Bibliometric Analysis on the Safety of Autonomous Vehicles with Artificial Intelligence,"HCI International 2021 - Late Breaking Papers: HCI Applications in Health, Transport, and Industry",10.1007/978-3-030-90966-6_20,Springer,2021-01-01,"The objective of the study was to look at the trend and advancement of Artificial Intelligence, Transportation, and Safety research through bibliometric analysis. The review retrieved data in Web of Science using specific terms related to Artificial Intelligence, Transportation, and Safety. VOSViewer, CiteSpace, and MAXQDA were utilized to conduct the citation analysis and content analysis of the Web of Science data set and 8 selected documents including 6 research articles and 2 chapters from the textbook Occupational Safety and Health for Technologists, Engineers, and Managers. Articles from GoogleScholar using Harzing’s Publish or Perish software and Web of Science database were used. The citation analysis creating a co-occurrence map discovered several keywords within clusters that were suggested to be subtopics of the general topic. Performing content analysis using the 8 selected documents has shown the most occurring keywords to be similar to those discovered in the citation analysis. The articles utilized bibliometric analysis tools to have further insight on the contributing journals and keywords drawn from multiple sources and methods of Artificial Intelligence and Transportation research. Articles from the Citespace citation burst and VOSViewer co-citation analysis were used to further support the necessity of automation and safety in artificial intelligence and transportation.",http://link.springer.com/openurl/fulltext?id=doi:10.1007/978-3-030-90966-6_20,springer,autonomous vehicle,'autonomous vehicle' AND 'machine learning' AND ('real-world' AND 'deploy')
Chapter ConferencePaper,doi:10.1007/978-3-030-90963-5_36,Applying Human Cognition to Assured Autonomy,"HCI International 2021 - Late Breaking Papers: Multimodality, eXtended Reality, and Artificial Intelligence",10.1007/978-3-030-90963-5_36,Springer,2021-01-01,"The scaled deployment of semi- and fully autonomous systems undeniably depends on assured autonomy. This reality, however, has become far more complex than expected because it necessarily demands an integrated tripartite solution not yet achieved: consensus-based standards and compliance across industry, scientific innovation within artificial intelligence R&D of explainability, and robust end-user education. In this is paper I present my human-centered approach to the design, development, and deployment of autonomous systems and break down how human factors such as cognitive and behavioral insights into how we think, feel, act, plan, make decisions, and problem-solve are foundational to assuring autonomy.",http://link.springer.com/openurl/fulltext?id=doi:10.1007/978-3-030-90963-5_36,springer,autonomous vehicle,'autonomous vehicle' AND 'machine learning' AND ('real-world' AND 'deploy')
Chapter ConferencePaper,doi:10.1007/978-3-030-90966-6_38,Safety Management and Challenges Associated with Industry 4.0 on Transportation and Logistics: A Systematic Literature Review,"HCI International 2021 - Late Breaking Papers: HCI Applications in Health, Transport, and Industry",10.1007/978-3-030-90966-6_38,Springer,2021-01-01,"“Industry 4.0” has become the most significant subject of the emerging fields in manufacturing and industrial practices over the decade. It leverages the new smart technologies, including Artificial Intelligence, the Internet of Things, Autonomous Vehicles, Advanced Robots, etc. for the high involvement of automation. Such highly automated processes may raise different concerns from the traditional industry. They should have impacts on the safety management with adaption to the current development. Here we narrow down to the role of Industry 4.0 in the aspects of transformation and logistics and conducted a systematic literature review of the associated topics. We used various tools, such as CiteSpace and VOSviewer to analyze the metadata as well as several collected articles from the databases for trend, co-citation, and content analyses. We found that there is still an apparent lack of studies to incorporate the safety issues in Industry 4.0. And we suggest that safety management for Industry 4.0 on transportation and logistics should consider system design, data communication (as cybersecurity), and integration of intelligent technologies. Subjects of health and sustainability should be also included as challenges related to safety. Though many challenges are needed to be handled, emerging technologies can play significant roles to improve the safety of the work environment in the era of Industry 4.0.",http://link.springer.com/openurl/fulltext?id=doi:10.1007/978-3-030-90966-6_38,springer,autonomous vehicle,'autonomous vehicle' AND 'machine learning' AND ('real-world' AND 'deploy')
Chapter ConferencePaper,doi:10.1007/978-3-030-77626-8_13,Human-Machine Interaction for Autonomous Vehicles: A Review,Social Computing and Social Media: Experience Design and Social Network Analysis,10.1007/978-3-030-77626-8_13,Springer,2021-01-01,"The rate of advancement in autonomous systems has been increasing and humans rely on such systems for every aspect of daily life. This is especially true in the area of autonomous vehicles, where new techniques and discoveries have been uncovered and Society of Automotive Engineers (SAE) Level 5 self-driving might be a reality in a few years. Despite the significant body of work on self driving technology, many people are still sceptical about the idea of riding in a fully autonomous vehicle (AV). There is a need to build trust between humans and vehicles for successful adoption of AVs. In this paper we complement existing surveys by describing 3 active research areas that are key for enhancing trust in autonomous vehicles, namely 1) Trust in Autonomous Vehicles, 2) Human Machine Interfaces, and 3) Driver Activity Detection. We discuss and highlight the key ideas and techniques in recent research works of each field, and discuss potential future directions.",http://link.springer.com/openurl/fulltext?id=doi:10.1007/978-3-030-77626-8_13,springer,autonomous vehicle,'autonomous vehicle' AND 'machine learning' AND ('real-world' AND 'deploy')
Chapter ConferencePaper,doi:10.1007/978-3-030-79150-6_12,Enhanced Security Framework for Enabling Facial Recognition in Autonomous Shuttles Public Transportation During COVID-19,Artificial Intelligence Applications and Innovations,10.1007/978-3-030-79150-6_12,Springer,2021-01-01,"Autonomous Vehicles (AVs) can potentially reduce the accident risk while a human is driving. They can also improve the public transportation by connecting city centers with main mass transit systems. The development of technologies that can provide a sense of security to the passenger when the driver is missing remains a challenging task. Moreover, such technologies are forced to adopt to the new reality formed by the COVID-19 pandemic, as it has created significant restrictions to passenger mobility through public transportation. In this work, an image-based approach, supported by novel AI algorithms, is proposed as a service to increase autonomy of non-fully autonomous people such as kids, grandparents and disabled people. The proposed real-time service, can identify family members via facial characteristics and efficiently ignore face masks, while providing notifications for their condition to their supervisor relatives. The envisioned AI-supported security framework, apart from enhancing the trust to autonomous mobility, could be advantageous in other applications also related to domestic security and defense.",http://link.springer.com/openurl/fulltext?id=doi:10.1007/978-3-030-79150-6_12,springer,autonomous vehicle,'autonomous vehicle' AND 'machine learning' AND ('real-world' AND 'deploy')
Article,doi:10.1007/s10846-020-01295-w,Controlling Draft Interactions Between Quadcopter Unmanned Aerial Vehicles with Physics-aware Modeling,Journal of Intelligent & Robotic Systems,10.1007/s10846-020-01295-w,Springer,2020-12-15,"In this paper, we address the problem of multiple quadcopter control, where the quadcopters maneuver in close proximity resulting in interference due to air-drafts. We use sparse experimental data to estimate the interference area between palm sized quadcopters and to derive physics-infused models that describe how the air-draft generated by two quadcopters (flying one above the other) affect each other. The observed significant altitude deviations due to airdraft interactions, mainly in the lower quadcopter, is adequately captured by our physics infused machine learning model. We use two strategies to mitigate these effects. First, we propose non-invasive, online and offline trajectory re-planning strategies that allow avoiding the interference zone while reducing the deviations from desired minimum snap trajectories. Second, we propose invasive strategies that re-design control algorithms by incorporating the interference model. We demonstrate how to modify the standard quadcopter PID controller, and how to formulate a model predictive control approach when considering the interference model. Both invasive and non-invasive strategies show significant reduction in tracking error and control signal energy as compared to the case where the interference area is ignored.",http://link.springer.com/openurl/fulltext?id=doi:10.1007/s10846-020-01295-w,springer,autonomous vehicle,'autonomous vehicle' AND 'machine learning' AND ('real-world' AND 'deploy')
Article,doi:10.1007/s10846-020-01274-1,A Dynamically Feasible Fast Replanning Strategy with Deep Reinforcement Learning,Journal of Intelligent & Robotic Systems,10.1007/s10846-020-01274-1,Springer,2020-12-11,"In this work, we aim to develop a fast trajectory replanning methodology enabling highly agile aerial vehicles to navigate in cluttered environments. By focusing on reducing complexity and accelerating the replanning problem under strict dynamical constraints, we employ the b-spline theory with local support property for defining the high dimensional agile flight trajectories. We utilize the differential flatness model of an aerial vehicle, allowing us to directly map the desired output trajectory into input states to track a high dimensional trajectory. Dynamically feasible replanning problem is addressed through regenerating the local b-splines with control point reallocation. As the geometric form of the trajectory based on the location of the control points and the knot intervals, the control point reallocation for fast replanning with dynamical constraints is turned into a constrained optimization problem and solved through deep reinforcement learning. The proposed methodology enables generating dynamically feasible local trajectory segments, which are continuous to the existing, hence provides fast local replanning for collision avoidance. The DRL agent is trained with different environmental complexities, and through the batch simulations, it is shown that the proposed methodology allows to solve fast trajectory replanning problem under given or hard dynamical constraints and provide real-time applicability for such collision avoidance applications in agile unmanned aerial vehicles. Hardware implementation tests of the algorithm with the agile trajectory tracker to a small UAV can bee seen in the following video link: https://youtu.be/8IiLQFQ3V0E .",http://link.springer.com/openurl/fulltext?id=doi:10.1007/s10846-020-01274-1,springer,autonomous vehicle,'autonomous vehicle' AND 'machine learning' AND ('real-world' AND 'deploy')
Article,doi:10.1007/s10846-020-01284-z,Deep Learning-based Monocular Obstacle Avoidance for Unmanned Aerial Vehicle Navigation in Tree Plantations,Journal of Intelligent & Robotic Systems,10.1007/s10846-020-01284-z,Springer,2020-12-08,"In recent years, Unmanned Aerial Vehicles (UAVs) are widely utilized in precision agriculture, such as tree plantations. Due to limited intelligence, these UAVs can only operate at high altitudes, leading to the use of expensive and heavy sensors for obtaining important health information of the plants. To fly at low altitudes, these UAVs must possess the capability of obstacle avoidance to prevent crashes. However, most current obstacle avoidance systems with active sensors are not applicable to small aerial vehicles due to the cost, weight, and power consumption constraints. To this end, this paper presents a novel approach to the autonomous navigation of a small UAV in tree plantations only using a single camera. As the monocular vision does not provide depth information, a machine learning model, Faster Region-based Convolutional Neural Network (Faster R-CNN), was trained for the tree trunk detection. A control strategy was implemented to avoid the collision with trees. The detection model uses image heights of detected trees to indicate their distances from the UAV and image widths between trees to find the widest obstacle-free space. The control strategy allows the UAV to navigate until any approaching obstacle is detected and to turn to the safest area before continuing its flight. This paper demonstrates the feasibility and performance of the proposed algorithms by carrying out 11 flight tests in real tree plantation environments at two different locations, one of which is a new place. All the successful results indicate that the proposed method is accurate and robust for autonomous navigation in tree plantations.",http://link.springer.com/openurl/fulltext?id=doi:10.1007/s10846-020-01284-z,springer,autonomous vehicle,'autonomous vehicle' AND 'machine learning' AND ('real-world' AND 'deploy')
Article,doi:10.1007/s11227-020-03251-9,Secure decentralized peer-to-peer training of deep neural networks based on distributed ledger technology,The Journal of Supercomputing,10.1007/s11227-020-03251-9,Springer,2020-12-01,"The accuracy and performance of deep neural network models become important issues as the applications of deep learning increase. For example, the navigation system of autonomous self-driving vehicles requires very accurate deep learning models. If a self-driving car fails to detect a pedestrian in bad weather, the result can be devastating. If we can increase the model accuracy by increasing the training data, the probability of avoiding such scenarios increases significantly. However, the problem of privacy for consumers and lack of enthusiasm for sharing their personal data, e.g., the recordings of their self-driving car, is an obstacle for using this valuable data. In Blockchain technology, many entities which cannot trust each other in normal conditions can join together to achieve a mutual goal. In this paper, a secure decentralized peer-to-peer framework for training the deep neural network models based on the distributed ledger technology in Blockchain ecosystem is proposed. The proposed framework anonymizes the identity of data providers and therefore can be used as an incentive for consumers to share their private data for training deep learning models. The proposed framework uses the Stellar Blockchain infrastructure for secure decentralized training of the deep models. A deep learning coin is proposed for Blockchain compensation.",http://link.springer.com/openurl/fulltext?id=doi:10.1007/s11227-020-03251-9,springer,autonomous vehicle,'autonomous vehicle' AND 'machine learning' AND ('real-world' AND 'deploy')
Article,doi:10.1007/s12008-020-00717-1,Explainable navigation system using fuzzy reinforcement learning,International Journal on Interactive Design and Manufacturing (IJIDeM),10.1007/s12008-020-00717-1,Springer,2020-12-01,"Abstract Explainable outcomes in autonomous navigation have become crucial for drivers, other vehicles, as well as for pedestrians. Creating trustworthy strategies is mandatory for the integration of self-driving cars into quotidian environments. This paper presents the successful implementation of an explainable Fuzzy Deep Reinforcement Learning approach for autonomous vehicles based on the AWS DeepRacer $$^{\mathrm{TM}}$$ TM platform. A model of the environment is created by transforming crisp values into linguistic variables. A fuzzy inference system is used to define the reward of the vehicle depending on its current state. Guidelines to define the actions and to improve performance of the reinforcement learning agent are given based on the characteristics of the existing hardware. The performance of the models is tested on tracks with distinctive properties using agents with different policies and action spaces, and shows explainable and successful navigation of the agent on diverse scenarios. Graphic Abstract ",http://link.springer.com/openurl/fulltext?id=doi:10.1007/s12008-020-00717-1,springer,autonomous vehicle,'autonomous vehicle' AND 'machine learning' AND ('real-world' AND 'deploy')
