id,updated,published,title,summary,database,query_name,query_value
http://arxiv.org/abs/2110.07742v1,2021-10-14T21:53:03Z,2021-10-14T21:53:03Z,"Beyond Classification: Directly Training Spiking Neural Networks for
  Semantic Segmentation","Spiking Neural Networks (SNNs) have recently emerged as the low-power
alternative to Artificial Neural Networks (ANNs) because of their sparse,
asynchronous, and binary event-driven processing. Due to their energy
efficiency, SNNs have a high possibility of being deployed for real-world,
resource-constrained systems such as autonomous vehicles and drones. However,
owing to their non-differentiable and complex neuronal dynamics, most previous
SNN optimization methods have been limited to image recognition. In this paper,
we explore the SNN applications beyond classification and present semantic
segmentation networks configured with spiking neurons. Specifically, we first
investigate two representative SNN optimization techniques for recognition
tasks (i.e., ANN-SNN conversion and surrogate gradient learning) on semantic
segmentation datasets. We observe that, when converted from ANNs, SNNs suffer
from high latency and low performance due to the spatial variance of features.
Therefore, we directly train networks with surrogate gradient learning,
resulting in lower latency and higher performance than ANN-SNN conversion.
Moreover, we redesign two fundamental ANN segmentation architectures (i.e.,
Fully Convolutional Networks and DeepLab) for the SNN domain. We conduct
experiments on two public semantic segmentation benchmarks including the PASCAL
VOC2012 dataset and the DDD17 event-based dataset. In addition to showing the
feasibility of SNNs for semantic segmentation, we show that SNNs can be more
robust and energy-efficient compared to their ANN counterparts in this domain.",arxiv,autonomous vehicle,'autonomous vehicle' AND 'machine learning' AND ('real-world' AND 'deploy')
http://arxiv.org/abs/2109.15286v2,2022-02-28T16:30:54Z,2021-09-30T17:30:43Z,Unsupervised Domain Adaptation for LiDAR Panoptic Segmentation,"Scene understanding is a pivotal task for autonomous vehicles to safely
navigate in the environment. Recent advances in deep learning enable accurate
semantic reconstruction of the surroundings from LiDAR data. However, these
models encounter a large domain gap while deploying them on vehicles equipped
with different LiDAR setups which drastically decreases their performance.
Fine-tuning the model for every new setup is infeasible due to the expensive
and cumbersome process of recording and manually labeling new data.
Unsupervised Domain Adaptation (UDA) techniques are thus essential to fill this
domain gap and retain the performance of models on new sensor setups without
the need for additional data labeling. In this paper, we propose AdaptLPS, a
novel UDA approach for LiDAR panoptic segmentation that leverages task-specific
knowledge and accounts for variation in the number of scan lines, mounting
position, intensity distribution, and environmental conditions. We tackle the
UDA task by employing two complementary domain adaptation strategies,
data-based and model-based. While data-based adaptations reduce the domain gap
by processing the raw LiDAR scans to resemble the scans in the target domain,
model-based techniques guide the network in extracting features that are
representative for both domains. Extensive evaluations on three pairs of
real-world autonomous driving datasets demonstrate that AdaptLPS outperforms
existing UDA approaches by up to 6.41 pp in terms of the PQ score.",arxiv,autonomous vehicle,'autonomous vehicle' AND 'machine learning' AND ('real-world' AND 'deploy')
http://arxiv.org/abs/2109.13751v2,2021-11-25T14:01:38Z,2021-09-28T14:11:36Z,StereoSpike: Depth Learning with a Spiking Neural Network,"Depth estimation is an important computer vision task, useful in particular
for navigation in autonomous vehicles, or for object manipulation in robotics.
Here we solved it using an end-to-end neuromorphic approach, combining two
event-based cameras and a Spiking Neural Network (SNN) with a slightly modified
U-Net-like encoder-decoder architecture, that we named StereoSpike. More
specifically, we used the Multi Vehicle Stereo Event Camera Dataset (MVSEC). It
provides a depth ground-truth, which was used to train StereoSpike in a
supervised manner, using surrogate gradient descent. We propose a novel readout
paradigm to obtain a dense analog prediction -- the depth of each pixel -- from
the spikes of the decoder. We demonstrate that this architecture generalizes
very well, even better than its non-spiking counterparts, leading to
state-of-the-art test accuracy. To the best of our knowledge, it is the first
time that such a large-scale regression problem is solved by a fully spiking
network. Finally, we show that low firing rates (<10%) can be obtained via
regularization, with a minimal cost in accuracy. This means that StereoSpike
could be efficiently implemented on neuromorphic chips, opening the door for
low power and real time embedded systems.",arxiv,autonomous vehicle,'autonomous vehicle' AND 'machine learning' AND ('real-world' AND 'deploy')
http://arxiv.org/abs/2109.11661v3,2022-05-04T14:37:45Z,2021-09-23T21:55:12Z,"Deep Reinforcement Learning-Based Long-Range Autonomous Valet Parking
  for Smart Cities","In this paper, to reduce the congestion rate at the city center and increase
the quality of experience (QoE) of each user, the framework of long-range
autonomous valet parking (LAVP) is presented, where an Autonomous Vehicle (AV)
is deployed in the city, which can pick up, drop off users at their required
spots, and then drive to the car park out of city center autonomously. In this
framework, we aim to minimize the overall distance of the AV, while guarantee
all users are served, i.e., picking up, and dropping off users at their
required spots through optimizing the path planning of the AV and number of
serving time slots. To this end, we first propose a learning based algorithm,
which is named as Double-Layer Ant Colony Optimization (DL-ACO) algorithm to
solve the above problem in an iterative way. Then, to make the real-time
decision, while consider the dynamic environment (i.e., the AV may pick up and
drop off users from different locations), we further present a deep
reinforcement learning (DRL) based algorithm, which is known as deep Q network
(DQN). The experimental results show that the DL-ACO and DQN-based algorithms
both achieve the considerable performance.",arxiv,autonomous vehicle,'autonomous vehicle' AND 'machine learning' AND ('real-world' AND 'deploy')
http://arxiv.org/abs/2109.06668v4,2022-07-12T18:27:19Z,2021-09-14T13:16:33Z,Exploration in Deep Reinforcement Learning: A Comprehensive Survey,"Deep Reinforcement Learning (DRL) and Deep Multi-agent Reinforcement Learning
(MARL) have achieved significant successes across a wide range of domains,
including game AI, autonomous vehicles, robotics, and so on. However, DRL and
deep MARL agents are widely known to be sample inefficient that millions of
interactions are usually needed even for relatively simple problem settings,
thus preventing the wide application and deployment in real-industry scenarios.
One bottleneck challenge behind is the well-known exploration problem, i.e.,
how efficiently exploring the environment and collecting informative
experiences that could benefit policy learning towards the optimal ones. This
problem becomes more challenging in complex environments with sparse rewards,
noisy distractions, long horizons, and non-stationary co-learners. In this
paper, we conduct a comprehensive survey on existing exploration methods for
both single-agent and multi-agent RL. We start the survey by identifying
several key challenges to efficient exploration. Beyond the above two main
branches, we also include other notable exploration methods with different
ideas and techniques. In addition to algorithmic analysis, we provide a
comprehensive and unified empirical comparison of different exploration methods
for DRL on a set of commonly used benchmarks. According to our algorithmic and
empirical investigation, we finally summarize the open problems of exploration
in DRL and deep MARL and point out a few future directions.",arxiv,autonomous vehicle,'autonomous vehicle' AND 'machine learning' AND ('real-world' AND 'deploy')
http://arxiv.org/abs/2109.06126v4,2022-07-21T15:48:43Z,2021-09-13T17:05:43Z,"Neural Network Guided Evolutionary Fuzzing for Finding Traffic
  Violations of Autonomous Vehicles","Self-driving cars and trucks, autonomous vehicles (AVs), should not be
accepted by regulatory bodies and the public until they have much higher
confidence in their safety and reliability -- which can most practically and
convincingly be achieved by testing. But existing testing methods are
inadequate for checking the end-to-end behaviors of AV controllers against
complex, real-world corner cases involving interactions with multiple
independent agents such as pedestrians and human-driven vehicles. While
test-driving AVs on streets and highways fails to capture many rare events,
existing simulation-based testing methods mainly focus on simple scenarios and
do not scale well for complex driving situations that require sophisticated
awareness of the surroundings. To address these limitations, we propose a new
fuzz testing technique, called AutoFuzz, which can leverage widely-used AV
simulators' API grammars to generate semantically and temporally valid complex
driving scenarios (sequences of scenes). To efficiently search for traffic
violations-inducing scenarios in a large search space, we propose a constrained
neural network (NN) evolutionary search method to optimize AutoFuzz. Evaluation
of our prototype on one state-of-the-art learning-based controller, two
rule-based controllers, and one industrial-grade controller in five scenarios
shows that AutoFuzz efficiently finds hundreds of traffic violations in
high-fidelity simulation environments. For each scenario, AutoFuzz can find on
average 10-39% more unique traffic violations than the best-performing baseline
method. Further, fine-tuning the learning-based controller with the traffic
violations found by AutoFuzz successfully reduced the traffic violations found
in the new version of the AV controller software.",arxiv,autonomous vehicle,'autonomous vehicle' AND 'machine learning' AND ('real-world' AND 'deploy')
http://arxiv.org/abs/2109.02529v2,2021-09-07T04:46:01Z,2021-09-06T15:12:17Z,"ViSTA: a Framework for Virtual Scenario-based Testing of Autonomous
  Vehicles","In this paper, we present ViSTA, a framework for Virtual Scenario-based
Testing of Autonomous Vehicles (AV), developed as part of the 2021 IEEE
Autonomous Test Driving AI Test Challenge. Scenario-based virtual testing aims
to construct specific challenges posed for the AV to overcome, albeit in
virtual test environments that may not necessarily resemble the real world.
This approach is aimed at identifying specific issues that arise safety
concerns before an actual deployment of the AV on the road. In this paper, we
describe a comprehensive test case generation approach that facilitates the
design of special-purpose scenarios with meaningful parameters to form test
cases, both in automated and manual ways, leveraging the strength and
weaknesses of either. Furthermore, we describe how to automate the execution of
test cases, and analyze the performance of the AV under these test cases.",arxiv,autonomous vehicle,'autonomous vehicle' AND 'machine learning' AND ('real-world' AND 'deploy')
http://arxiv.org/abs/2109.01896v5,2022-03-18T04:24:39Z,2021-09-04T16:26:31Z,"GamePlan: Game-Theoretic Multi-Agent Planning with Human Drivers at
  Intersections, Roundabouts, and Merging","We present a new method for multi-agent planning involving human drivers and
autonomous vehicles (AVs) in unsignaled intersections, roundabouts, and during
merging. In multi-agent planning, the main challenge is to predict the actions
of other agents, especially human drivers, as their intentions are hidden from
other agents. Our algorithm uses game theory to develop a new auction, called
GamePlan, that directly determines the optimal action for each agent based on
their driving style (which is observable via commonly available sensors).
GamePlan assigns a higher priority to more aggressive or impatient drivers and
a lower priority to more conservative or patient drivers; we theoretically
prove that such an approach is game-theoretically optimal prevents collisions
and deadlocks. We compare our approach with prior state-of-the-art auction
techniques including economic auctions, time-based auctions (first-in
first-out), and random bidding and show that each of these methods result in
collisions among agents when taking into account driver behavior. We compare
with methods based on DRL, deep learning, and game theory and present our
benefits over these approaches. Finally, we show that our approach can be
implemented in the real-world with human drivers.",arxiv,autonomous vehicle,'autonomous vehicle' AND 'machine learning' AND ('real-world' AND 'deploy')
http://arxiv.org/abs/2108.10617v1,2021-08-24T10:06:53Z,2021-08-24T10:06:53Z,Image-free single-pixel segmentation,"The existing segmentation techniques require high-fidelity images as input to
perform semantic segmentation. Since the segmentation results contain most of
edge information that is much less than the acquired images, the throughput gap
leads to both hardware and software waste. In this letter, we report an
image-free single-pixel segmentation technique. The technique combines
structured illumination and single-pixel detection together, to efficiently
samples and multiplexes scene's segmentation information into compressed
one-dimensional measurements. The illumination patterns are optimized together
with the subsequent reconstruction neural network, which directly infers
segmentation maps from the single-pixel measurements. The end-to-end
encoding-and-decoding learning framework enables optimized illumination with
corresponding network, which provides both high acquisition and segmentation
efficiency. Both simulation and experimental results validate that accurate
segmentation can be achieved using two-order-of-magnitude less input data. When
the sampling ratio is 1%, the Dice coefficient reaches above 80% and the pixel
accuracy reaches above 96%. We envision that this image-free segmentation
technique can be widely applied in various resource-limited platforms such as
UAV and unmanned vehicle that require real-time sensing.",arxiv,autonomous vehicle,'autonomous vehicle' AND 'machine learning' AND ('real-world' AND 'deploy')
http://arxiv.org/abs/2108.01884v1,2021-08-04T07:30:04Z,2021-08-04T07:30:04Z,"Adaptive Path Planning for UAV-based Multi-Resolution Semantic
  Segmentation","In this paper, we address the problem of adaptive path planning for accurate
semantic segmentation of terrain using unmanned aerial vehicles (UAVs). The
usage of UAVs for terrain monitoring and remote sensing is rapidly gaining
momentum due to their high mobility, low cost, and flexible deployment.
However, a key challenge is planning missions to maximize the value of acquired
data in large environments given flight time limitations. To address this, we
propose an online planning algorithm which adapts the UAV paths to obtain
high-resolution semantic segmentations necessary in areas on the terrain with
fine details as they are detected in incoming images. This enables us to
perform close inspections at low altitudes only where required, without wasting
energy on exhaustive mapping at maximum resolution. A key feature of our
approach is a new accuracy model for deep learning-based architectures that
captures the relationship between UAV altitude and semantic segmentation
accuracy. We evaluate our approach on the application of crop/weed segmentation
in precision agriculture using real-world field data.",arxiv,autonomous vehicle,'autonomous vehicle' AND 'machine learning' AND ('real-world' AND 'deploy')
http://arxiv.org/abs/2107.14389v2,2022-03-27T07:09:17Z,2021-07-30T01:37:24Z,DarkLighter: Light Up the Darkness for UAV Tracking,"Recent years have witnessed the fast evolution and promising performance of
the convolutional neural network (CNN)-based trackers, which aim at imitating
biological visual systems. However, current CNN-based trackers can hardly
generalize well to low-light scenes that are commonly lacked in the existing
training set. In indistinguishable night scenarios frequently encountered in
unmanned aerial vehicle (UAV) tracking-based applications, the robustness of
the state-of-the-art (SOTA) trackers drops significantly. To facilitate aerial
tracking in the dark through a general fashion, this work proposes a low-light
image enhancer namely DarkLighter, which dedicates to alleviate the impact of
poor illumination and noise iteratively. A lightweight map estimation network,
i.e., ME-Net, is trained to efficiently estimate illumination maps and noise
maps jointly. Experiments are conducted with several SOTA trackers on numerous
UAV dark tracking scenes. Exhaustive evaluations demonstrate the reliability
and universality of DarkLighter, with high efficiency. Moreover, DarkLighter
has further been implemented on a typical UAV system. Real-world tests at night
scenes have verified its practicability and dependability.",arxiv,autonomous vehicle,'autonomous vehicle' AND 'machine learning' AND ('real-world' AND 'deploy')
http://arxiv.org/abs/2107.13869v4,2022-04-11T10:54:43Z,2021-07-29T10:11:36Z,"Autonomous UAV Base Stations for Next Generation Wireless Networks: A
  Deep Learning Approach","To address the ever-growing connectivity demands of wireless communications,
the adoption of ingenious solutions, such as Unmanned Aerial Vehicles (UAVs) as
mobile Base Stations (BSs), is imperative. In general, the location of a UAV
Base Station (UAV-BS) is determined by optimization algorithms, which have high
computationally complexities and place heavy demands on UAV resources. In this
paper, we show that a Convolutional Neural Network (CNN) model can be trained
to infer the location of a UAV-BS in real time. In so doing, we create a
framework to determine the UAV locations that considers the deployment of
Mobile Users (MUs) to generate labels by using the data obtained from an
optimization algorithm. Performance evaluations reveal that once the CNN model
is trained with the given labels and locations of MUs, the proposed approach is
capable of approximating the results given by the adopted optimization
algorithm with high fidelity, outperforming Reinforcement Learning (RL)-based
approaches. We also explore future research challenges and highlight key
issues.",arxiv,autonomous vehicle,'autonomous vehicle' AND 'machine learning' AND ('real-world' AND 'deploy')
http://arxiv.org/abs/2107.12137v2,2021-08-11T06:54:54Z,2021-07-26T12:18:23Z,AA3DNet: Attention Augmented Real Time 3D Object Detection,"In this work, we address the problem of 3D object detection from point cloud
data in real time. For autonomous vehicles to work, it is very important for
the perception component to detect the real world objects with both high
accuracy and fast inference. We propose a novel neural network architecture
along with the training and optimization details for detecting 3D objects using
point cloud data. We present anchor design along with custom loss functions
used in this work. A combination of spatial and channel wise attention module
is used in this work. We use the Kitti 3D Birds Eye View dataset for
benchmarking and validating our results. Our method surpasses previous state of
the art in this domain both in terms of average precision and speed running at
> 30 FPS. Finally, we present the ablation study to demonstrate that the
performance of our network is generalizable. This makes it a feasible option to
be deployed in real time applications like self driving cars.",arxiv,autonomous vehicle,'autonomous vehicle' AND 'machine learning' AND ('real-world' AND 'deploy')
http://arxiv.org/abs/2107.08325v1,2021-07-18T00:00:48Z,2021-07-18T00:00:48Z,"Vision-Based Autonomous Car Racing Using Deep Imitative Reinforcement
  Learning","Autonomous car racing is a challenging task in the robotic control area.
Traditional modular methods require accurate mapping, localization and
planning, which makes them computationally inefficient and sensitive to
environmental changes. Recently, deep-learning-based end-to-end systems have
shown promising results for autonomous driving/racing. However, they are
commonly implemented by supervised imitation learning (IL), which suffers from
the distribution mismatch problem, or by reinforcement learning (RL), which
requires a huge amount of risky interaction data. In this work, we present a
general deep imitative reinforcement learning approach (DIRL), which
successfully achieves agile autonomous racing using visual inputs. The driving
knowledge is acquired from both IL and model-based RL, where the agent can
learn from human teachers as well as perform self-improvement by safely
interacting with an offline world model. We validate our algorithm both in a
high-fidelity driving simulation and on a real-world 1/20-scale RC-car with
limited onboard computation. The evaluation results demonstrate that our method
outperforms previous IL and RL methods in terms of sample efficiency and task
performance. Demonstration videos are available at
https://caipeide.github.io/autorace-dirl/",arxiv,autonomous vehicle,'autonomous vehicle' AND 'machine learning' AND ('real-world' AND 'deploy')
http://arxiv.org/abs/2107.01784v1,2021-07-05T04:34:51Z,2021-07-05T04:34:51Z,"Learning a Model for Inferring a Spatial Road Lane Network Graph using
  Self-Supervision","Interconnected road lanes are a central concept for navigating urban roads.
Currently, most autonomous vehicles rely on preconstructed lane maps as
designing an algorithmic model is difficult. However, the generation and
maintenance of such maps is costly and hinders large-scale adoption of
autonomous vehicle technology. This paper presents the first self-supervised
learning method to train a model to infer a spatially grounded lane-level road
network graph based on a dense segmented representation of the road scene
generated from onboard sensors. A formal road lane network model is presented
and proves that any structured road scene can be represented by a directed
acyclic graph of at most depth three while retaining the notion of intersection
regions, and that this is the most compressed representation. The formal model
is implemented by a hybrid neural and search-based model, utilizing a novel
barrier function loss formulation for robust learning from partial labels.
Experiments are conducted for all common road intersection layouts. Results
show that the model can generalize to new road layouts, unlike previous
approaches, demonstrating its potential for real-world application as a
practical learning-based lane-level map generator.",arxiv,autonomous vehicle,'autonomous vehicle' AND 'machine learning' AND ('real-world' AND 'deploy')
http://arxiv.org/abs/2107.01581v2,2022-02-08T16:41:28Z,2021-07-04T09:37:45Z,"Noise Tolerant Identification and Tuning Approach Using Deep Neural
  Networks For Visual Servoing Applications","Vision based control of Unmanned Aerial Vehicles (UAVs) has been adopted by a
wide range of applications due to the availability of low-cost on-board sensors
and computers. Tuning such systems to work properly requires extensive domain
specific experience, which limits the growth of emerging applications.
Moreover, obtaining performance limits of UAV based visual servoing is
difficult due to the complexity of the models used. In this paper, we propose a
novel noise tolerant approach for real-time identification and tuning of visual
servoing systems, based on deep neural networks (DNN) classification of system
response generated by the modified relay feedback test (MRFT). The proposed
method, called DNN with noise protected MRFT (DNN-NP-MRFT), can be used with a
multitude of vision sensors and estimation algorithms despite the high levels
of sensor's noise. Response of DNN-NP-MRFT to noise perturbations is
investigated and its effect on identification and tuning performance is
analyzed. The proposed DNN-NP-MRFT is able to detect performance changes due to
the use of high latency vision sensors, or due to the integration of inertial
measurement unit (IMU) measurements in the UAV states estimation. Experimental
identification closely matches simulation results, which can be used to explain
system behaviour and predict the closed loop performance limits for a given
hardware and software setup. We also demonstrate the ability of DNN-NP-MRFT
tuned UAVs to reject external disturbances like wind, or human push and pull.
Finally, we discuss the advantages of the proposed DNN-NP-MRFT visual servoing
design approach compared with other approaches in literature.",arxiv,autonomous vehicle,'autonomous vehicle' AND 'machine learning' AND ('real-world' AND 'deploy')
