id,updated,published,title,summary,database,query_name,query_value
http://arxiv.org/abs/2101.10463v2,2021-01-27T02:22:33Z,2021-01-25T22:34:06Z,"RTGPU: Real-Time GPU Scheduling of Hard Deadline Parallel Tasks with
  Fine-Grain Utilization","Many emerging cyber-physical systems, such as autonomous vehicles and robots,
rely heavily on artificial intelligence and machine learning algorithms to
perform important system operations. Since these highly parallel applications
are computationally intensive, they need to be accelerated by graphics
processing units (GPUs) to meet stringent timing constraints. However, despite
the wide adoption of GPUs, efficiently scheduling multiple GPU applications
while providing rigorous real-time guarantees remains a challenge. In this
paper, we propose RTGPU, which can schedule the execution of multiple GPU
applications in real-time to meet hard deadlines. Each GPU application can have
multiple CPU execution and memory copy segments, as well as GPU kernels. We
start with a model to explicitly account for the CPU and memory copy segments
of these applications. We then consider the GPU architecture in the development
of a precise timing model for the GPU kernels and leverage a technique known as
persistent threads to implement fine-grained kernel scheduling with improved
performance through interleaved execution. Next, we propose a general method
for scheduling parallel GPU applications in real time. Finally, to schedule
multiple parallel GPU applications, we propose a practical real-time scheduling
algorithm based on federated scheduling and grid search (for GPU kernel
segments) with uniprocessor fixed priority scheduling (for multiple CPU and
memory copy segments). Our approach provides superior schedulability compared
with previous work, and gives real-time guarantees to meet hard deadlines for
multiple GPU applications according to comprehensive validation and evaluation
on a real NVIDIA GTX1080Ti GPU system.",arxiv,autonomous vehicle,'autonomous vehicle' AND 'machine learning' AND ('real-world' AND 'deploy')
http://arxiv.org/abs/2101.06409v1,2021-01-16T09:00:34Z,2021-01-16T09:00:34Z,Shape Back-Projection In 3D Scenes,"In this work, we propose a novel framework shape back-projection for
computationally efficient point cloud processing in a probabilistic manner. The
primary component of the technique is shape histogram and a back-projection
procedure. The technique measures similarity between 3D surfaces, by analyzing
their geometrical properties. It is analogous to color back-projection which
measures similarity between images, simply by looking at their color
distributions. In the overall process, first, shape histogram of a sample
surface (e.g. planar) is computed, which captures the profile of surface
normals around a point in form of a probability distribution. Later, the
histogram is back-projected onto a test surface and a likelihood score is
obtained. The score depicts that how likely a point in the test surface behaves
similar to the sample surface, geometrically. Shape back-projection finds its
application in binary surface classification, high curvature edge detection in
unorganized point cloud, automated point cloud labeling for 3D-CNNs
(convolutional neural network) etc. The algorithm can also be used for
real-time robotic operations such as autonomous object picking in warehouse
automation, ground plane extraction for autonomous vehicles and can be deployed
easily on computationally limited platforms (UAVs).",arxiv,autonomous vehicle,'autonomous vehicle' AND 'machine learning' AND ('real-world' AND 'deploy')
http://arxiv.org/abs/2101.06175v1,2021-01-15T15:36:22Z,2021-01-15T15:36:22Z,PaddleSeg: A High-Efficient Development Toolkit for Image Segmentation,"Image Segmentation plays an essential role in computer vision and image
processing with various applications from medical diagnosis to autonomous car
driving. A lot of segmentation algorithms have been proposed for addressing
specific problems. In recent years, the success of deep learning techniques has
tremendously influenced a wide range of computer vision areas, and the modern
approaches of image segmentation based on deep learning are becoming prevalent.
In this article, we introduce a high-efficient development toolkit for image
segmentation, named PaddleSeg. The toolkit aims to help both developers and
researchers in the whole process of designing segmentation models, training
models, optimizing performance and inference speed, and deploying models.
Currently, PaddleSeg supports around 20 popular segmentation models and more
than 50 pre-trained models from real-time and high-accuracy levels. With
modular components and backbone networks, users can easily build over one
hundred models for different requirements. Furthermore, we provide
comprehensive benchmarks and evaluations to show that these segmentation
algorithms trained on our toolkit have more competitive accuracy. Also, we
provide various real industrial applications and practical cases based on
PaddleSeg. All codes and examples of PaddleSeg are available at
https://github.com/PaddlePaddle/PaddleSeg.",arxiv,autonomous vehicle,'autonomous vehicle' AND 'machine learning' AND ('real-world' AND 'deploy')
http://arxiv.org/abs/2101.04319v1,2021-01-12T06:42:45Z,2021-01-12T06:42:45Z,"DeepiSign: Invisible Fragile Watermark to Protect the Integrityand
  Authenticity of CNN","Convolutional Neural Networks (CNNs) deployed in real-life applications such
as autonomous vehicles have shown to be vulnerable to manipulation attacks,
such as poisoning attacks and fine-tuning. Hence, it is essential to ensure the
integrity and authenticity of CNNs because compromised models can produce
incorrect outputs and behave maliciously. In this paper, we propose a
self-contained tamper-proofing method, called DeepiSign, to ensure the
integrity and authenticity of CNN models against such manipulation attacks.
DeepiSign applies the idea of fragile invisible watermarking to securely embed
a secret and its hash value into a CNN model. To verify the integrity and
authenticity of the model, we retrieve the secret from the model, compute the
hash value of the secret, and compare it with the embedded hash value. To
minimize the effects of the embedded secret on the CNN model, we use a
wavelet-based technique to transform weights into the frequency domain and
embed the secret into less significant coefficients. Our theoretical analysis
shows that DeepiSign can hide up to 1KB secret in each layer with minimal loss
of the model's accuracy. To evaluate the security and performance of DeepiSign,
we performed experiments on four pre-trained models (ResNet18, VGG16, AlexNet,
and MobileNet) using three datasets (MNIST, CIFAR-10, and Imagenet) against
three types of manipulation attacks (targeted input poisoning, output
poisoning, and fine-tuning). The results demonstrate that DeepiSign is
verifiable without degrading the classification accuracy, and robust against
representative CNN manipulation attacks.",arxiv,autonomous vehicle,'autonomous vehicle' AND 'machine learning' AND ('real-world' AND 'deploy')
http://arxiv.org/abs/2101.02780v1,2021-01-07T22:01:30Z,2021-01-07T22:01:30Z,"SHARKS: Smart Hacking Approaches for RisK Scanning in Internet-of-Things
  and Cyber-Physical Systems based on Machine Learning","Cyber-physical systems (CPS) and Internet-of-Things (IoT) devices are
increasingly being deployed across multiple functionalities, ranging from
healthcare devices and wearables to critical infrastructures, e.g., nuclear
power plants, autonomous vehicles, smart cities, and smart homes. These devices
are inherently not secure across their comprehensive software, hardware, and
network stacks, thus presenting a large attack surface that can be exploited by
hackers. In this article, we present an innovative technique for detecting
unknown system vulnerabilities, managing these vulnerabilities, and improving
incident response when such vulnerabilities are exploited. The novelty of this
approach lies in extracting intelligence from known real-world CPS/IoT attacks,
representing them in the form of regular expressions, and employing machine
learning (ML) techniques on this ensemble of regular expressions to generate
new attack vectors and security vulnerabilities. Our results show that 10 new
attack vectors and 122 new vulnerability exploits can be successfully generated
that have the potential to exploit a CPS or an IoT ecosystem. The ML
methodology achieves an accuracy of 97.4% and enables us to predict these
attacks efficiently with an 87.2% reduction in the search space. We demonstrate
the application of our method to the hacking of the in-vehicle network of a
connected car. To defend against the known attacks and possible novel exploits,
we discuss a defense-in-depth mechanism for various classes of attacks and the
classification of data targeted by such attacks. This defense mechanism
optimizes the cost of security measures based on the sensitivity of the
protected resource, thus incentivizing its adoption in real-world CPS/IoT by
cybersecurity practitioners.",arxiv,autonomous vehicle,'autonomous vehicle' AND 'machine learning' AND ('real-world' AND 'deploy')
http://arxiv.org/abs/2012.15717v2,2021-11-07T05:23:47Z,2020-12-31T17:15:09Z,"FGraDA: A Dataset and Benchmark for Fine-Grained Domain Adaptation in
  Machine Translation","Previous research for adapting a general neural machine translation (NMT)
model into a specific domain usually neglects the diversity in translation
within the same domain, which is a core problem for domain adaptation in
real-world scenarios. One representative of such challenging scenarios is to
deploy a translation system for a conference with a specific topic, e.g.,
global warming or coronavirus, where there are usually extremely less resources
due to the limited schedule. To motivate wider investigation in such a
scenario, we present a real-world fine-grained domain adaptation task in
machine translation (FGraDA). The FGraDA dataset consists of Chinese-English
translation task for four sub-domains of information technology: autonomous
vehicles, AI education, real-time networks, and smart phone. Each sub-domain is
equipped with a development set and test set for evaluation purposes. To be
closer to reality, FGraDA does not employ any in-domain bilingual training data
but provides bilingual dictionaries and wiki knowledge base, which can be
easier obtained within a short time. We benchmark the fine-grained domain
adaptation task and present in-depth analyses showing that there are still
challenging problems to further improve the performance with heterogeneous
resources.",arxiv,autonomous vehicle,'autonomous vehicle' AND 'machine learning' AND ('real-world' AND 'deploy')
http://arxiv.org/abs/2012.10706v4,2021-07-30T13:36:36Z,2020-12-19T14:53:56Z,Siamese Anchor Proposal Network for High-Speed Aerial Tracking,"In the domain of visual tracking, most deep learning-based trackers highlight
the accuracy but casting aside efficiency. Therefore, their real-world
deployment on mobile platforms like the unmanned aerial vehicle (UAV) is
impeded. In this work, a novel two-stage Siamese network-based method is
proposed for aerial tracking, \textit{i.e.}, stage-1 for high-quality anchor
proposal generation, stage-2 for refining the anchor proposal. Different from
anchor-based methods with numerous pre-defined fixed-sized anchors, our
no-prior method can 1) increase the robustness and generalization to different
objects with various sizes, especially to small, occluded, and fast-moving
objects, under complex scenarios in light of the adaptive anchor generation, 2)
make calculation feasible due to the substantial decrease of anchor numbers. In
addition, compared to anchor-free methods, our framework has better performance
owing to refinement at stage-2. Comprehensive experiments on three benchmarks
have proven the superior performance of our approach, with a speed of around
200 frames/s.",arxiv,autonomous vehicle,'autonomous vehicle' AND 'machine learning' AND ('real-world' AND 'deploy')
http://arxiv.org/abs/2012.06992v1,2020-12-13T07:28:18Z,2020-12-13T07:28:18Z,"Edge Intelligence for Autonomous Driving in 6G Wireless System: Design
  Challenges and Solutions","In a level-5 autonomous driving system, the autonomous driving vehicles (AVs)
are expected to sense the surroundings via analyzing a large amount of data
captured by a variety of onboard sensors in near-real-time. As a result,
enormous computing costs will be introduced to the AVs for processing the tasks
with the deployed machine learning (ML) model, while the inference accuracy may
not be guaranteed. In this context, the advent of edge intelligence (EI) and
sixth-generation (6G) wireless networking are expected to pave the way to more
reliable and safer autonomous driving by providing multi-access edge computing
(MEC) together with ML to AVs in close proximity. To realize this goal, we
propose a two-tier EI-empowered autonomous driving framework. In the
autonomous-vehicles tier, the autonomous vehicles are deployed with the shallow
layers by splitting the trained deep neural network model. In the
edge-intelligence tier, an edge server is implemented with the remaining layers
(also deep layers) and an appropriately trained multi-task learning (MTL)
model. In particular, obtaining the optimal offloading strategy (including the
binary offloading decision and the computational resources allocation) can be
formulated as a mixed-integer nonlinear programming (MINLP) problem, which is
solved via MTL in near-real-time with high accuracy. On another note, an
edge-vehicle joint inference is proposed through neural network segmentation to
achieve efficient online inference with data privacy-preserving and less
communication delay. Experiments demonstrate the effectiveness of the proposed
framework, and open research topics are finally listed.",arxiv,autonomous vehicle,'autonomous vehicle' AND 'machine learning' AND ('real-world' AND 'deploy')
http://arxiv.org/abs/2012.05410v1,2020-12-10T02:08:47Z,2020-12-10T02:08:47Z,Artificial Intelligence at the Edge,"The Internet of Things (IoT) and edge computing applications aim to support a
variety of societal needs, including the global pandemic situation that the
entire world is currently experiencing and responses to natural disasters.
  The need for real-time interactive applications such as immersive video
conferencing, augmented/virtual reality, and autonomous vehicles, in education,
healthcare, disaster recovery and other domains, has never been higher. At the
same time, there have been recent technological breakthroughs in highly
relevant fields such as artificial intelligence (AI)/machine learning (ML),
advanced communication systems (5G and beyond), privacy-preserving
computations, and hardware accelerators. 5G mobile communication networks
increase communication capacity, reduce transmission latency and error, and
save energy -- capabilities that are essential for new applications. The
envisioned future 6G technology will integrate many more technologies,
including for example visible light communication, to support groundbreaking
applications, such as holographic communications and high precision
manufacturing. Many of these applications require computations and analytics
close to application end-points: that is, at the edge of the network, rather
than in a centralized cloud. AI techniques applied at the edge have tremendous
potential both to power new applications and to need more efficient operation
of edge infrastructure. However, it is critical to understand where to deploy
AI systems within complex ecosystems consisting of advanced applications and
the specific real-time requirements towards AI systems.",arxiv,autonomous vehicle,'autonomous vehicle' AND 'machine learning' AND ('real-world' AND 'deploy')
http://arxiv.org/abs/2011.07699v1,2020-11-16T02:56:13Z,2020-11-16T02:56:13Z,"Efficient falsification approach for autonomous vehicle validation using
  a parameter optimisation technique based on reinforcement learning","The widescale deployment of Autonomous Vehicles (AV) appears to be imminent
despite many safety challenges that are yet to be resolved. It is well-known
that there are no universally agreed Verification and Validation (VV)
methodologies guarantee absolute safety, which is crucial for the acceptance of
this technology. The uncertainties in the behaviour of the traffic participants
and the dynamic world cause stochastic reactions in advanced autonomous
systems. The addition of ML algorithms and probabilistic techniques adds
significant complexity to the process for real-world testing when compared to
traditional methods. Most research in this area focuses on generating
challenging concrete scenarios or test cases to evaluate the system performance
by looking at the frequency distribution of extracted parameters as collected
from the real-world data. These approaches generally employ Monte-Carlo
simulation and importance sampling to generate critical cases. This paper
presents an efficient falsification method to evaluate the System Under Test.
The approach is based on a parameter optimisation problem to search for
challenging scenarios. The optimisation process aims at finding the challenging
case that has maximum return. The method applies policy-gradient reinforcement
learning algorithm to enable the learning. The riskiness of the scenario is
measured by the well established RSS safety metric, euclidean distance, and
instance of a collision. We demonstrate that by using the proposed method, we
can more efficiently search for challenging scenarios which could cause the
system to fail in order to satisfy the safety requirements.",arxiv,autonomous vehicle,'autonomous vehicle' AND 'machine learning' AND ('real-world' AND 'deploy')
http://arxiv.org/abs/2011.01840v1,2020-11-03T16:50:37Z,2020-11-03T16:50:37Z,"Distributional Reinforcement Learning for mmWave Communications with
  Intelligent Reflectors on a UAV","In this paper, a novel communication framework that uses an unmanned aerial
vehicle (UAV)-carried intelligent reflector (IR) is proposed to enhance
multi-user downlink transmissions over millimeter wave (mmWave) frequencies. In
order to maximize the downlink sum-rate, the optimal precoding matrix (at the
base station) and reflection coefficient (at the IR) are jointly derived. Next,
to address the uncertainty of mmWave channels and maintain line-of-sight links
in a real-time manner, a distributional reinforcement learning approach, based
on quantile regression optimization, is proposed to learn the propagation
environment of mmWave communications, and, then, optimize the location of the
UAV-IR so as to maximize the long-term downlink communication capacity.
Simulation results show that the proposed learning-based deployment of the
UAV-IR yields a significant advantage, compared to a non-learning UAV-IR, a
static IR, and a direct transmission schemes, in terms of the average data rate
and the achievable line-of-sight probability of downlink mmWave communications.",arxiv,autonomous vehicle,'autonomous vehicle' AND 'machine learning' AND ('real-world' AND 'deploy')
http://arxiv.org/abs/2010.06626v2,2020-12-29T01:09:57Z,2020-10-13T18:37:38Z,"On Deep Learning Techniques to Boost Monocular Depth Estimation for
  Autonomous Navigation","Inferring the depth of images is a fundamental inverse problem within the
field of Computer Vision since depth information is obtained through 2D images,
which can be generated from infinite possibilities of observed real scenes.
Benefiting from the progress of Convolutional Neural Networks (CNNs) to explore
structural features and spatial image information, Single Image Depth
Estimation (SIDE) is often highlighted in scopes of scientific and
technological innovation, as this concept provides advantages related to its
low implementation cost and robustness to environmental conditions. In the
context of autonomous vehicles, state-of-the-art CNNs optimize the SIDE task by
producing high-quality depth maps, which are essential during the autonomous
navigation process in different locations. However, such networks are usually
supervised by sparse and noisy depth data, from Light Detection and Ranging
(LiDAR) laser scans, and are carried out at high computational cost, requiring
high-performance Graphic Processing Units (GPUs). Therefore, we propose a new
lightweight and fast supervised CNN architecture combined with novel feature
extraction models which are designed for real-world autonomous navigation. We
also introduce an efficient surface normals module, jointly with a simple
geometric 2.5D loss function, to solve SIDE problems. We also innovate by
incorporating multiple Deep Learning techniques, such as the use of
densification algorithms and additional semantic, surface normals and depth
information to train our framework. The method introduced in this work focuses
on robotic applications in indoor and outdoor environments and its results are
evaluated on the competitive and publicly available NYU Depth V2 and KITTI
Depth datasets.",arxiv,autonomous vehicle,'autonomous vehicle' AND 'machine learning' AND ('real-world' AND 'deploy')
http://arxiv.org/abs/2010.02663v1,2020-10-06T12:23:05Z,2020-10-06T12:23:05Z,"Heterogeneous Multi-Agent Reinforcement Learning for Unknown Environment
  Mapping","Reinforcement learning in heterogeneous multi-agent scenarios is important
for real-world applications but presents challenges beyond those seen in
homogeneous settings and simple benchmarks. In this work, we present an
actor-critic algorithm that allows a team of heterogeneous agents to learn
decentralized control policies for covering an unknown environment. This task
is of interest to national security and emergency response organizations that
would like to enhance situational awareness in hazardous areas by deploying
teams of unmanned aerial vehicles. To solve this multi-agent coverage path
planning problem in unknown environments, we augment a multi-agent actor-critic
architecture with a new state encoding structure and triplet learning loss to
support heterogeneous agent learning. We developed a simulation environment
that includes real-world environmental factors such as turbulence, delayed
communication, and agent loss, to train teams of agents as well as probe their
robustness and flexibility to such disturbances.",arxiv,autonomous vehicle,'autonomous vehicle' AND 'machine learning' AND ('real-world' AND 'deploy')
http://arxiv.org/abs/2009.14349v3,2020-12-07T20:08:44Z,2020-09-30T00:01:54Z,"Computing Systems for Autonomous Driving: State-of-the-Art and
  Challenges","The recent proliferation of computing technologies (e.g., sensors, computer
vision, machine learning, and hardware acceleration), and the broad deployment
of communication mechanisms (e.g., DSRC, C-V2X, 5G) have pushed the horizon of
autonomous driving, which automates the decision and control of vehicles by
leveraging the perception results based on multiple sensors. The key to the
success of these autonomous systems is making a reliable decision in real-time
fashion. However, accidents and fatalities caused by early deployed autonomous
vehicles arise from time to time. The real traffic environment is too
complicated for current autonomous driving computing systems to understand and
handle. In this paper, we present state-of-the-art computing systems for
autonomous driving, including seven performance metrics and nine key
technologies, followed by twelve challenges to realize autonomous driving. We
hope this paper will gain attention from both the computing and automotive
communities and inspire more research in this direction.",arxiv,autonomous vehicle,'autonomous vehicle' AND 'machine learning' AND ('real-world' AND 'deploy')
http://arxiv.org/abs/2009.11722v1,2020-09-23T09:23:29Z,2020-09-23T09:23:29Z,"Cloud2Edge Elastic AI Framework for Prototyping and Deployment of AI
  Inference Engines in Autonomous Vehicles","Self-driving cars and autonomous vehicles are revolutionizing the automotive
sector, shaping the future of mobility altogether. Although the integration of
novel technologies such as Artificial Intelligence (AI) and Cloud/Edge
computing provides golden opportunities to improve autonomous driving
applications, there is the need to modernize accordingly the whole prototyping
and deployment cycle of AI components. This paper proposes a novel framework
for developing so-called AI Inference Engines for autonomous driving
applications based on deep learning modules, where training tasks are deployed
elastically over both Cloud and Edge resources, with the purpose of reducing
the required network bandwidth, as well as mitigating privacy issues. Based on
our proposed data driven V-Model, we introduce a simple yet elegant solution
for the AI components development cycle, where prototyping takes place in the
cloud according to the Software-in-the-Loop (SiL) paradigm, while deployment
and evaluation on the target ECUs (Electronic Control Units) is performed as
Hardware-in-the-Loop (HiL) testing. The effectiveness of the proposed framework
is demonstrated using two real-world use-cases of AI inference engines for
autonomous vehicles, that is environment perception and most probable path
prediction.",arxiv,autonomous vehicle,'autonomous vehicle' AND 'machine learning' AND ('real-world' AND 'deploy')
