id,updated,published,title,summary,database,query_name,query_value
http://arxiv.org/abs/2101.02780v1,2021-01-07T22:01:30Z,2021-01-07T22:01:30Z,"SHARKS: Smart Hacking Approaches for RisK Scanning in Internet-of-Things
  and Cyber-Physical Systems based on Machine Learning","Cyber-physical systems (CPS) and Internet-of-Things (IoT) devices are
increasingly being deployed across multiple functionalities, ranging from
healthcare devices and wearables to critical infrastructures, e.g., nuclear
power plants, autonomous vehicles, smart cities, and smart homes. These devices
are inherently not secure across their comprehensive software, hardware, and
network stacks, thus presenting a large attack surface that can be exploited by
hackers. In this article, we present an innovative technique for detecting
unknown system vulnerabilities, managing these vulnerabilities, and improving
incident response when such vulnerabilities are exploited. The novelty of this
approach lies in extracting intelligence from known real-world CPS/IoT attacks,
representing them in the form of regular expressions, and employing machine
learning (ML) techniques on this ensemble of regular expressions to generate
new attack vectors and security vulnerabilities. Our results show that 10 new
attack vectors and 122 new vulnerability exploits can be successfully generated
that have the potential to exploit a CPS or an IoT ecosystem. The ML
methodology achieves an accuracy of 97.4% and enables us to predict these
attacks efficiently with an 87.2% reduction in the search space. We demonstrate
the application of our method to the hacking of the in-vehicle network of a
connected car. To defend against the known attacks and possible novel exploits,
we discuss a defense-in-depth mechanism for various classes of attacks and the
classification of data targeted by such attacks. This defense mechanism
optimizes the cost of security measures based on the sensitivity of the
protected resource, thus incentivizing its adoption in real-world CPS/IoT by
cybersecurity practitioners.",arxiv,health,'health' AND 'machine learning' AND ('real-world' AND 'deploy')
http://arxiv.org/abs/2101.03170v2,2021-09-17T17:17:45Z,2021-01-07T20:18:43Z,"BDNNSurv: Bayesian deep neural networks for survival analysis using
  pseudo values","There has been increasing interest in modeling survival data using deep
learning methods in medical research. In this paper, we proposed a Bayesian
hierarchical deep neural networks model for modeling and prediction of survival
data. Compared with previously studied methods, the new proposal can provide
not only point estimate of survival probability but also quantification of the
corresponding uncertainty, which can be of crucial importance in predictive
modeling and subsequent decision making. The favorable statistical properties
of point and uncertainty estimates were demonstrated by simulation studies and
real data analysis. The Python code implementing the proposed approach was
provided.",arxiv,health,'health' AND 'machine learning' AND ('real-world' AND 'deploy')
http://arxiv.org/abs/2012.14704v2,2021-12-02T13:58:01Z,2020-12-29T11:10:12Z,"Advances in deep learning methods for pavement surface crack detection
  and identification with visible light visual images","Compared to NDT and health monitoring method for cracks in engineering
structures, surface crack detection or identification based on visible light
images is non-contact, with the advantages of fast speed, low cost and high
precision. Firstly, typical pavement (concrete also) crack public data sets
were collected, and the characteristics of sample images as well as the random
variable factors, including environmental, noise and interference etc., were
summarized. Subsequently, the advantages and disadvantages of three main crack
identification methods (i.e., hand-crafted feature engineering, machine
learning, deep learning) were compared. Finally, from the aspects of model
architecture, testing performance and predicting effectiveness, the development
and progress of typical deep learning models, including self-built CNN,
transfer learning(TL) and encoder-decoder(ED), which can be easily deployed on
embedded platform, were reviewed. The benchmark test shows that: 1) It has been
able to realize real-time pixel-level crack identification on embedded
platform: the entire crack detection average time cost of an image sample is
less than 100ms, either using the ED method (i.e., FPCNet) or the TL method
based on InceptionV3. It can be reduced to less than 10ms with TL method based
on MobileNet (a lightweight backbone base network). 2) In terms of accuracy, it
can reach over 99.8% on CCIC which is easily identified by human eyes. On
SDNET2018, some samples of which are difficult to be identified, FPCNet can
reach 97.5%, while TL method is close to 96.1%.
  To the best of our knowledge, this paper for the first time comprehensively
summarizes the pavement crack public data sets, and the performance and
effectiveness of surface crack detection and identification deep learning
methods for embedded platform, are reviewed and evaluated.",arxiv,health,'health' AND 'machine learning' AND ('real-world' AND 'deploy')
http://arxiv.org/abs/2012.13968v1,2020-12-27T16:03:32Z,2020-12-27T16:03:32Z,"Detecting Medical Misinformation on Social Media Using Multimodal Deep
  Learning","In 2019, outbreaks of vaccine-preventable diseases reached the highest number
in the US since 1992. Medical misinformation, such as antivaccine content
propagating through social media, is associated with increases in vaccine delay
and refusal. Our overall goal is to develop an automatic detector for
antivaccine messages to counteract the negative impact that antivaccine
messages have on the public health. Very few extant detection systems have
considered multimodality of social media posts (images, texts, and hashtags),
and instead focus on textual components, despite the rapid growth of
photo-sharing applications (e.g., Instagram). As a result, existing systems are
not sufficient for detecting antivaccine messages with heavy visual components
(e.g., images) posted on these newer platforms. To solve this problem, we
propose a deep learning network that leverages both visual and textual
information. A new semantic- and task-level attention mechanism was created to
help our model to focus on the essential contents of a post that signal
antivaccine messages. The proposed model, which consists of three branches, can
generate comprehensive fused features for predictions. Moreover, an ensemble
method is proposed to further improve the final prediction accuracy. To
evaluate the proposed model's performance, a real-world social media dataset
that consists of more than 30,000 samples was collected from Instagram between
January 2016 and October 2019. Our 30 experiment results demonstrate that the
final network achieves above 97% testing accuracy and outperforms other
relevant models, demonstrating that it can detect a large amount of antivaccine
messages posted daily. The implementation code is available at
https://github.com/wzhings/antivaccine_detection.",arxiv,health,'health' AND 'machine learning' AND ('real-world' AND 'deploy')
http://arxiv.org/abs/2012.12794v1,2020-12-23T16:56:28Z,2020-12-23T16:56:28Z,"NeuXus: A Biosignal Processing and Classification Pipeline for Real-Time
  Brain-Computer Interaction","In the last few years,Brain-Computer Interfaces (BCIs) have progressed as an
emerging research area in the fields of human-computer interaction and
interactive systems.This is primarily due to the introduction of low-cost
electroencephalographic (EEG) systems that render BCI technology accessible for
non-medical research but also due to the advancements of signal processing and
machine learning methods.Consequently,BCIs could provide a wide new range of
possibilities in the way users interact with a computer system (e.g.,
neuroadaptive interfaces).However,major challenges must still be addressed for
BCI systems to mature into an established communication medium for effective
human-computer interaction. One of the major challenges involves the easy
integration of real-time processing pipelines with portable EEG systems for an
out-of-the-lab use. To date, despite the amount of options current open-source
tools provide, most toolboxes focus mainly in extending the processing and
classification methods but lack on the ability to provide an easy-to-design yet
extensible architecture for ubiquitous use.Here, we present NeuXus, a modular
toolbox in Python for real-time biosignal processing and pipeline design.NeuXus
is open-source and platform independent,providing high-level implementation of
processing pipelines for easy BCI design and deployment.",arxiv,health,'health' AND 'machine learning' AND ('real-world' AND 'deploy')
http://arxiv.org/abs/2012.11952v1,2020-12-22T12:11:42Z,2020-12-22T12:11:42Z,"A Feasibility study for Deep learning based automated brain tumor
  segmentation using Magnetic Resonance Images","Deep learning algorithms have accounted for the rapid acceleration of
research in artificial intelligence in medical image analysis, interpretation,
and segmentation with many potential applications across various sub
disciplines in medicine. However, only limited number of research which
investigates these application scenarios, are deployed into the clinical sector
for the evaluation of the real requirement and the practical challenges of the
model deployment. In this research, a deep convolutional neural network (CNN)
based classification network and Faster RCNN based localization network were
developed for brain tumor MR image classification and tumor localization. A
typical edge detection algorithm called Prewitt was used for tumor segmentation
task, based on the output of the tumor localization. Overall performance of the
proposed tumor segmentation architecture, was analyzed using objective quality
parameters including Accuracy, Boundary Displacement Error (BDE), Dice score
and confidence interval. A subjective quality assessment of the model was
conducted based on the Double Stimulus Impairment Scale (DSIS) protocol using
the input of medical expertise. It was observed that the confidence level of
our segmented output was in a similar range to that of experts. Also, the
Neurologists have rated the output of our model as highly accurate
segmentation.",arxiv,health,'health' AND 'machine learning' AND ('real-world' AND 'deploy')
http://arxiv.org/abs/2101.03889v2,2021-02-16T13:44:56Z,2020-12-21T10:25:27Z,A Comprehensive Survey of 6G Wireless Communications,"While fifth-generation (5G) communications are being rolled out worldwide,
sixth-generation (6G) communications have attracted much attention from both
the industry and the academia. Compared with 5G, 6G will have a wider frequency
band, higher transmission rate, spectrum efficiency, greater connection
capacity, shorter delay, broader coverage, and more robust anti-interference
capability to satisfy various network requirements. This survey presents an
insightful understanding of 6G wireless communications by introducing
requirements, features, critical technologies, challenges, and applications.
First, we give an overview of 6G from perspectives of technologies, security
and privacy, and applications. Subsequently, we introduce various 6G
technologies and their existing challenges in detail, e.g., artificial
intelligence (AI), intelligent surfaces, THz, space-air-ground-sea integrated
network, cell-free massive MIMO, etc. Because of these technologies, 6G is
expected to outperform existing wireless communication systems regarding the
transmission rate, latency, global coverage, etc. Next, we discuss security and
privacy techniques that can be applied to protect data in 6G. Since edge
devices are expected to gain popularity soon, the vast amount of generated data
and frequent data exchange make the leakage of data easily. Finally, we predict
real-world applications built on the technologies and features of 6G; for
example, smart healthcare, smart city, and smart manufacturing will be
implemented by taking advantage of AI.",arxiv,health,'health' AND 'machine learning' AND ('real-world' AND 'deploy')
http://arxiv.org/abs/2012.10853v1,2020-12-20T06:06:08Z,2020-12-20T06:06:08Z,eTREE: Learning Tree-structured Embeddings,"Matrix factorization (MF) plays an important role in a wide range of machine
learning and data mining models. MF is commonly used to obtain item embeddings
and feature representations due to its ability to capture correlations and
higher-order statistical dependencies across dimensions. In many applications,
the categories of items exhibit a hierarchical tree structure. For instance,
human diseases can be divided into coarse categories, e.g., bacterial, and
viral. These categories can be further divided into finer categories, e.g.,
viral infections can be respiratory, gastrointestinal, and exanthematous viral
diseases. In e-commerce, products, movies, books, etc., are grouped into
hierarchical categories, e.g., clothing items are divided by gender, then by
type (formal, casual, etc.). While the tree structure and the categories of the
different items may be known in some applications, they have to be learned
together with the embeddings in many others. In this work, we propose eTREE, a
model that incorporates the (usually ignored) tree structure to enhance the
quality of the embeddings. We leverage the special uniqueness properties of
Nonnegative MF (NMF) to prove identifiability of eTREE. The proposed model not
only exploits the tree structure prior, but also learns the hierarchical
clustering in an unsupervised data-driven fashion. We derive an efficient
algorithmic solution and a scalable implementation of eTREE that exploits
parallel computing, computation caching, and warm start strategies. We showcase
the effectiveness of eTREE on real data from various application domains:
healthcare, recommender systems, and education. We also demonstrate the
meaningfulness of the tree obtained from eTREE by means of domain experts
interpretation.",arxiv,health,'health' AND 'machine learning' AND ('real-world' AND 'deploy')
http://arxiv.org/abs/2012.10020v1,2020-12-18T02:37:49Z,2020-12-18T02:37:49Z,"EVA: Generating Longitudinal Electronic Health Records Using Conditional
  Variational Autoencoders","Researchers require timely access to real-world longitudinal electronic
health records (EHR) to develop, test, validate, and implement machine learning
solutions that improve the quality and efficiency of healthcare. In contrast,
health systems value deeply patient privacy and data security. De-identified
EHRs do not adequately address the needs of health systems, as de-identified
data are susceptible to re-identification and its volume is also limited.
Synthetic EHRs offer a potential solution. In this paper, we propose EHR
Variational Autoencoder (EVA) for synthesizing sequences of discrete EHR
encounters (e.g., clinical visits) and encounter features (e.g., diagnoses,
medications, procedures). We illustrate that EVA can produce realistic EHR
sequences, account for individual differences among patients, and can be
conditioned on specific disease conditions, thus enabling disease-specific
studies. We design efficient, accurate inference algorithms by combining
stochastic gradient Markov Chain Monte Carlo with amortized variational
inference. We assess the utility of the methods on large real-world EHR
repositories containing over 250, 000 patients. Our experiments, which include
user studies with knowledgeable clinicians, indicate the generated EHR
sequences are realistic. We confirmed the performance of predictive models
trained on the synthetic data are similar with those trained on real EHRs.
Additionally, our findings indicate that augmenting real data with synthetic
EHRs results in the best predictive performance - improving the best baseline
by as much as 8% in top-20 recall.",arxiv,health,'health' AND 'machine learning' AND ('real-world' AND 'deploy')
http://arxiv.org/abs/2012.07278v1,2020-12-14T05:54:55Z,2020-12-14T05:54:55Z,"Learning how to approve updates to machine learning algorithms in
  non-stationary settings","Machine learning algorithms in healthcare have the potential to continually
learn from real-world data generated during healthcare delivery and adapt to
dataset shifts. As such, the FDA is looking to design policies that can
autonomously approve modifications to machine learning algorithms while
maintaining or improving the safety and effectiveness of the deployed models.
However, selecting a fixed approval strategy, a priori, can be difficult
because its performance depends on the stationarity of the data and the quality
of the proposed modifications. To this end, we investigate a
learning-to-approve approach (L2A) that uses accumulating monitoring data to
learn how to approve modifications. L2A defines a family of strategies that
vary in their ""optimism''---where more optimistic policies have faster approval
rates---and searches over this family using an exponentially weighted average
forecaster. To control the cumulative risk of the deployed model, we give L2A
the option to abstain from making a prediction and incur some fixed abstention
cost instead. We derive bounds on the average risk of the model deployed by
L2A, assuming the distributional shifts are smooth. In simulation studies and
empirical analyses, L2A tailors the level of optimism for each problem-setting:
It learns to abstain when performance drops are common and approve beneficial
modifications quickly when the distribution is stable.",arxiv,health,'health' AND 'machine learning' AND ('real-world' AND 'deploy')
http://arxiv.org/abs/2012.06448v2,2020-12-19T10:02:04Z,2020-12-11T16:16:32Z,"An Unsupervised Reconstruction Method For Low-Dose CT Using Deep
  Generative Regularization Prior","Low-dose CT imaging requires reconstruction from noisy indirect measurements
which can be defined as an ill-posed linear inverse problem. In addition to
conventional FBP method in CT imaging, recent compressed sensing based methods
exploit handcrafted priors which are mostly simplistic and hard to determine.
More recently, deep learning (DL) based methods have become popular in medical
imaging field. In CT imaging, DL based methods try to learn a function that
maps low-dose images to normal-dose images. Although the results of these
methods are promising, their success mostly depends on the availability of
high-quality massive datasets. In this study, we proposed a method that does
not require any training data or a learning process. Our method exploits such
an approach that deep convolutional neural networks (CNNs) generate patterns
easier than the noise, therefore randomly initialized generative neural
networks can be suitable priors to be used in regularizing the reconstruction.
In the experiments, the proposed method is implemented with different loss
function variants. Both analytical CT phantoms and real-world CT images are
used with different views. Conventional FBP method, a popular iterative method
(SART), and TV regularized SART are used in the comparisons. We demonstrated
that our method with different loss function variants outperforms the other
methods both qualitatively and quantitatively.",arxiv,health,'health' AND 'machine learning' AND ('real-world' AND 'deploy')
http://arxiv.org/abs/2012.06354v1,2020-12-10T13:56:00Z,2020-12-10T13:56:00Z,Privacy-preserving medical image analysis,"The utilisation of artificial intelligence in medicine and healthcare has led
to successful clinical applications in several domains. The conflict between
data usage and privacy protection requirements in such systems must be resolved
for optimal results as well as ethical and legal compliance. This calls for
innovative solutions such as privacy-preserving machine learning (PPML). We
present PriMIA (Privacy-preserving Medical Image Analysis), a software
framework designed for PPML in medical imaging. In a real-life case study we
demonstrate significantly better classification performance of a securely
aggregated federated learning model compared to human experts on unseen
datasets. Furthermore, we show an inference-as-a-service scenario for
end-to-end encrypted diagnosis, where neither the data nor the model are
revealed. Lastly, we empirically evaluate the framework's security against a
gradient-based model inversion attack and demonstrate that no usable
information can be recovered from the model.",arxiv,health,'health' AND 'machine learning' AND ('real-world' AND 'deploy')
http://arxiv.org/abs/2012.05410v1,2020-12-10T02:08:47Z,2020-12-10T02:08:47Z,Artificial Intelligence at the Edge,"The Internet of Things (IoT) and edge computing applications aim to support a
variety of societal needs, including the global pandemic situation that the
entire world is currently experiencing and responses to natural disasters.
  The need for real-time interactive applications such as immersive video
conferencing, augmented/virtual reality, and autonomous vehicles, in education,
healthcare, disaster recovery and other domains, has never been higher. At the
same time, there have been recent technological breakthroughs in highly
relevant fields such as artificial intelligence (AI)/machine learning (ML),
advanced communication systems (5G and beyond), privacy-preserving
computations, and hardware accelerators. 5G mobile communication networks
increase communication capacity, reduce transmission latency and error, and
save energy -- capabilities that are essential for new applications. The
envisioned future 6G technology will integrate many more technologies,
including for example visible light communication, to support groundbreaking
applications, such as holographic communications and high precision
manufacturing. Many of these applications require computations and analytics
close to application end-points: that is, at the edge of the network, rather
than in a centralized cloud. AI techniques applied at the edge have tremendous
potential both to power new applications and to need more efficient operation
of edge infrastructure. However, it is critical to understand where to deploy
AI systems within complex ecosystems consisting of advanced applications and
the specific real-time requirements towards AI systems.",arxiv,health,'health' AND 'machine learning' AND ('real-world' AND 'deploy')
http://arxiv.org/abs/2012.03426v2,2021-09-27T05:48:50Z,2020-12-07T02:47:36Z,"Deep Learning Based Signal Enhancement of Low-Resolution Accelerometer
  for Fall Detection Systems","In the last two decades, fall detection (FD) systems have been developed as a
popular assistive technology. Such systems automatically detect critical fall
events and immediately alert medical professionals or caregivers. To support
long-term FD services, various power-saving strategies have been implemented.
Among them, a reduced sampling rate is a common approach for an
energy-efficient system in the real-world. However, the performance of FD
systems is diminished owing to low-resolution (LR) accelerometer signals. To
improve the detection accuracy with LR accelerometer signals, several technical
challenges must be considered, including misalignment, mismatch of effective
features, and the degradation effects. In this work, a deep-learning-based
accelerometer signal enhancement (ASE) model is proposed to improve the
detection performance of LR-FD systems. This proposed model reconstructs
high-resolution (HR) signals from the LR signals by learning the relationship
between the LR and HR signals. The results show that the FD system using
support vector machine and the proposed ASE model at an extremely low sampling
rate (sampling rate < 2 Hz) achieved 97.34% and 90.52% accuracies in the
SisFall and FallAllD datasets, respectively, while those without ASE models
only achieved 95.92% and 87.47% accuracies in the SisFall and FallAllD
datasets, respectively. This study demonstrates that the ASE model helps the FD
systems tackle the technical challenges of LR signals and achieve better
detection performance.",arxiv,health,'health' AND 'machine learning' AND ('real-world' AND 'deploy')
