id,updated,published,title,summary,database,query_name,query_value
http://arxiv.org/abs/1912.02102v1,2019-12-03T02:11:50Z,2019-12-03T02:11:50Z,"Artificial Intelligence for Low-Resource Communities: Influence
  Maximization in an Uncertain World","The potential of Artificial Intelligence (AI) to tackle challenging problems
that afflict society is enormous, particularly in the areas of healthcare,
conservation and public safety and security. Many problems in these domains
involve harnessing social networks of under-served communities to enable
positive change, e.g., using social networks of homeless youth to raise
awareness about Human Immunodeficiency Virus (HIV) and other STDs.
Unfortunately, most of these real-world problems are characterized by
uncertainties about social network structure and influence models, and previous
research in AI fails to sufficiently address these uncertainties. This thesis
addresses these shortcomings by advancing the state-of-the-art to a new
generation of algorithms for interventions in social networks. In particular,
this thesis describes the design and development of new influence maximization
algorithms which can handle various uncertainties that commonly exist in
real-world social networks. These algorithms utilize techniques from sequential
planning problems and social network theory to develop new kinds of AI
algorithms. Further, this thesis also demonstrates the real-world impact of
these algorithms by describing their deployment in three pilot studies to
spread awareness about HIV among actual homeless youth in Los Angeles. This
represents one of the first-ever deployments of computer science based
influence maximization algorithms in this domain. Our results show that our AI
algorithms improved upon the state-of-the-art by 160% in the real-world. We
discuss research and implementation challenges faced in deploying these
algorithms, and lessons that can be gleaned for future deployment of such
algorithms. The positive results from these deployments illustrate the enormous
potential of AI in addressing societally relevant problems.",arxiv,health,'health' AND 'machine learning' AND ('real-world' AND 'deploy')
http://arxiv.org/abs/1911.08090v1,2019-11-19T04:33:05Z,2019-11-19T04:33:05Z,Deep Detector Health Management under Adversarial Campaigns,"Machine learning models are vulnerable to adversarial inputs that induce
seemingly unjustifiable errors. As automated classifiers are increasingly used
in industrial control systems and machinery, these adversarial errors could
grow to be a serious problem. Despite numerous studies over the past few years,
the field of adversarial ML is still considered alchemy, with no practical
unbroken defenses demonstrated to date, leaving PHM practitioners with few
meaningful ways of addressing the problem. We introduce turbidity detection as
a practical superset of the adversarial input detection problem, coping with
adversarial campaigns rather than statistically invisible one-offs. This
perspective is coupled with ROC-theoretic design guidance that prescribes an
inexpensive domain adaptation layer at the output of a deep learning model
during an attack campaign. The result aims to approximate the Bayes optimal
mitigation that ameliorates the detection model's degraded health. A
proactively reactive type of prognostics is achieved via Monte Carlo simulation
of various adversarial campaign scenarios, by sampling from the model's own
turbidity distribution to quickly deploy the correct mitigation during a
real-world campaign.",arxiv,health,'health' AND 'machine learning' AND ('real-world' AND 'deploy')
http://arxiv.org/abs/1911.08089v2,2019-12-07T03:42:06Z,2019-11-19T04:28:47Z,"""The Human Body is a Black Box"": Supporting Clinical Decision-Making
  with Deep Learning","Machine learning technologies are increasingly developed for use in
healthcare. While research communities have focused on creating
state-of-the-art models, there has been less focus on real world implementation
and the associated challenges to accuracy, fairness, accountability, and
transparency that come from actual, situated use. Serious questions remain
under examined regarding how to ethically build models, interpret and explain
model output, recognize and account for biases, and minimize disruptions to
professional expertise and work cultures. We address this gap in the literature
and provide a detailed case study covering the development, implementation, and
evaluation of Sepsis Watch, a machine learning-driven tool that assists
hospital clinicians in the early diagnosis and treatment of sepsis. We, the
team that developed and evaluated the tool, discuss our conceptualization of
the tool not as a model deployed in the world but instead as a socio-technical
system requiring integration into existing social and professional contexts.
Rather than focusing on model interpretability to ensure a fair and accountable
machine learning, we point toward four key values and practices that should be
considered when developing machine learning to support clinical
decision-making: rigorously define the problem in context, build relationships
with stakeholders, respect professional discretion, and create ongoing feedback
loops with stakeholders. Our work has significant implications for future
research regarding mechanisms of institutional accountability and
considerations for designing machine learning systems. Our work underscores the
limits of model interpretability as a solution to ensure transparency,
accuracy, and accountability in practice. Instead, our work demonstrates other
means and goals to achieve FATML values in design and in practice.",arxiv,health,'health' AND 'machine learning' AND ('real-world' AND 'deploy')
http://arxiv.org/abs/1911.06633v1,2019-11-15T13:50:27Z,2019-11-15T13:50:27Z,"HealthFog: An Ensemble Deep Learning based Smart Healthcare System for
  Automatic Diagnosis of Heart Diseases in Integrated IoT and Fog Computing
  Environments","Cloud computing provides resources over the Internet and allows a plethora of
applications to be deployed to provide services for different industries. The
major bottleneck being faced currently in these cloud frameworks is their
limited scalability and hence inability to cater to the requirements of
centralized Internet of Things (IoT) based compute environments. The main
reason for this is that latency-sensitive applications like health monitoring
and surveillance systems now require computation over large amounts of data
(Big Data) transferred to centralized database and from database to cloud data
centers which leads to drop in performance of such systems. The new paradigms
of fog and edge computing provide innovative solutions by bringing resources
closer to the user and provide low latency and energy-efficient solutions for
data processing compared to cloud domains. Still, the current fog models have
many limitations and focus from a limited perspective on either accuracy of
results or reduced response time but not both. We proposed a novel framework
called HealthFog for integrating ensemble deep learning in Edge computing
devices and deployed it for a real-life application of automatic Heart Disease
analysis. HealthFog delivers healthcare as a fog service using IoT devices and
efficiently manages the data of heart patients, which comes as user requests.
Fog-enabled cloud framework, FogBus is used to deploy and test the performance
of the proposed model in terms of power consumption, network bandwidth,
latency, jitter, accuracy and execution time. HealthFog is configurable to
various operation modes that provide the best Quality of Service or prediction
accuracy, as required, in diverse fog computation scenarios and for different
user requirements.",arxiv,health,'health' AND 'machine learning' AND ('real-world' AND 'deploy')
http://arxiv.org/abs/1911.05521v1,2019-11-13T14:56:36Z,2019-11-13T14:56:36Z,"Real-time ultra-low power ECG anomaly detection using an event-driven
  neuromorphic processor","Accurate detection of pathological conditions in human subjects can be
achieved through off-line analysis of recorded biological signals such as
electrocardiograms (ECGs). However, human diagnosis is time-consuming and
expensive, as it requires the time of medical professionals. This is especially
inefficient when indicative patterns in the biological signals are infrequent.
Moreover, patients with suspected pathologies are often monitored for extended
periods, requiring the storage and examination of large amounts of
non-pathological data, and entailing a difficult visual search task for
diagnosing professionals.
  In this work we propose a compact and sub-mW low power neural processing
system that can be used to perform on-line and real-time preliminary diagnosis
of pathological conditions, to raise warnings for the existence of possible
pathological conditions, or to trigger an off-line data recording system for
further analysis by a medical professional. We apply the system to real-time
classification of ECG data for distinguishing between healthy heartbeats and
pathological rhythms.
  Multi-channel analog ECG traces are encoded as asynchronous streams of binary
events and processed using a spiking recurrent neural network operated in a
reservoir computing paradigm. An event-driven neuron output layer is then
trained to recognize one of several pathologies. Finally, the filtered activity
of this output layer is used to generate a binary trigger signal indicating the
presence or absence of a pathological pattern.
  We validate the approach proposed using a Dynamic Neuromorphic Asynchronous
Processor (DYNAP) chip, implemented using a standard 180 nm CMOS VLSI process,
and present experimental results measured from the chip.",arxiv,health,'health' AND 'machine learning' AND ('real-world' AND 'deploy')
http://arxiv.org/abs/1911.02508v2,2020-02-03T18:53:50Z,2019-11-06T17:52:20Z,"Fooling LIME and SHAP: Adversarial Attacks on Post hoc Explanation
  Methods","As machine learning black boxes are increasingly being deployed in domains
such as healthcare and criminal justice, there is growing emphasis on building
tools and techniques for explaining these black boxes in an interpretable
manner. Such explanations are being leveraged by domain experts to diagnose
systematic errors and underlying biases of black boxes. In this paper, we
demonstrate that post hoc explanations techniques that rely on input
perturbations, such as LIME and SHAP, are not reliable. Specifically, we
propose a novel scaffolding technique that effectively hides the biases of any
given classifier by allowing an adversarial entity to craft an arbitrary
desired explanation. Our approach can be used to scaffold any biased classifier
in such a way that its predictions on the input data distribution still remain
biased, but the post hoc explanations of the scaffolded classifier look
innocuous. Using extensive evaluation with multiple real-world datasets
(including COMPAS), we demonstrate how extremely biased (racist) classifiers
crafted by our framework can easily fool popular explanation techniques such as
LIME and SHAP into generating innocuous explanations which do not reflect the
underlying biases.",arxiv,health,'health' AND 'machine learning' AND ('real-world' AND 'deploy')
http://arxiv.org/abs/1910.13580v1,2019-10-29T23:43:01Z,2019-10-29T23:43:01Z,Domain Generalization via Model-Agnostic Learning of Semantic Features,"Generalization capability to unseen domains is crucial for machine learning
models when deploying to real-world conditions. We investigate the challenging
problem of domain generalization, i.e., training a model on multi-domain source
data such that it can directly generalize to target domains with unknown
statistics. We adopt a model-agnostic learning paradigm with gradient-based
meta-train and meta-test procedures to expose the optimization to domain shift.
Further, we introduce two complementary losses which explicitly regularize the
semantic structure of the feature space. Globally, we align a derived soft
confusion matrix to preserve general knowledge about inter-class relationships.
Locally, we promote domain-independent class-specific cohesion and separation
of sample features with a metric-learning component. The effectiveness of our
method is demonstrated with new state-of-the-art results on two common object
recognition benchmarks. Our method also shows consistent improvement on a
medical image segmentation task.",arxiv,health,'health' AND 'machine learning' AND ('real-world' AND 'deploy')
http://arxiv.org/abs/1910.03060v1,2019-10-07T20:06:38Z,2019-10-07T20:06:38Z,Impact of Inference Accelerators on hardware selection,"As opportunities for AI-assisted healthcare grow steadily, model deployment
faces challenges due to the specific characteristics of the industry. The
configuration choice for a production device can impact model performance while
influencing operational costs. Moreover, in healthcare some situations might
require fast, but not real time, inference. We study different configurations
and conduct a cost-performance analysis to determine the optimized hardware for
the deployment of a model subject to healthcare domain constraints. We observe
that a naive performance comparison may not lead to an optimal configuration
selection. In fact, given realistic domain constraints, CPU execution might be
preferable to GPU accelerators. Hence, defining beforehand precise expectations
for model deployment is crucial.",arxiv,health,'health' AND 'machine learning' AND ('real-world' AND 'deploy')
http://arxiv.org/abs/1910.01177v1,2019-10-02T19:24:31Z,2019-10-02T19:24:31Z,Improving Differentially Private Models with Active Learning,"Broad adoption of machine learning techniques has increased privacy concerns
for models trained on sensitive data such as medical records. Existing
techniques for training differentially private (DP) models give rigorous
privacy guarantees, but applying these techniques to neural networks can
severely degrade model performance. This performance reduction is an obstacle
to deploying private models in the real world. In this work, we improve the
performance of DP models by fine-tuning them through active learning on public
data. We introduce two new techniques - DIVERSEPUBLIC and NEARPRIVATE - for
doing this fine-tuning in a privacy-aware way. For the MNIST and SVHN datasets,
these techniques improve state-of-the-art accuracy for DP models while
retaining privacy guarantees.",arxiv,health,'health' AND 'machine learning' AND ('real-world' AND 'deploy')
http://arxiv.org/abs/1909.13343v2,2019-10-01T16:06:39Z,2019-09-29T19:15:08Z,"ISTHMUS: Secure, Scalable, Real-time and Robust Machine Learning
  Platform for Healthcare","In recent times, machine learning (ML) and artificial intelligence (AI) based
systems have evolved and scaled across different industries such as finance,
retail, insurance, energy utilities, etc. Among other things, they have been
used to predict patterns of customer behavior, to generate pricing models, and
to predict the return on investments. But the successes in deploying machine
learning models at scale in those industries have not translated into the
healthcare setting. There are multiple reasons why integrating ML models into
healthcare has not been widely successful, but from a technical perspective,
general-purpose commercial machine learning platforms are not a good fit for
healthcare due to complexities in handling data quality issues, mandates to
demonstrate clinical relevance, and a lack of ability to monitor performance in
a highly regulated environment with stringent security and privacy needs. In
this paper, we describe Isthmus, a turnkey, cloud-based platform which
addresses the challenges above and reduces time to market for operationalizing
ML/AI in healthcare. Towards the end, we describe three case studies which shed
light on Isthmus capabilities. These include (1) supporting an end-to-end
lifecycle of a model which predicts trauma survivability at hospital trauma
centers, (2) bringing in and harmonizing data from disparate sources to create
a community data platform for inferring population as well as patient level
insights for Social Determinants of Health (SDoH), and (3) ingesting
live-streaming data from various IoT sensors to build models, which can
leverage real-time and longitudinal information to make advanced time-sensitive
predictions.",arxiv,health,'health' AND 'machine learning' AND ('real-world' AND 'deploy')
http://arxiv.org/abs/1909.10868v2,2020-02-01T02:19:29Z,2019-09-18T04:45:53Z,"Adversarial Representation Learning for Robust Patient-Independent
  Epileptic Seizure Detection","Objective: Epilepsy is a chronic neurological disorder characterized by the
occurrence of spontaneous seizures, which affects about one percent of the
world's population. Most of the current seizure detection approaches strongly
rely on patient history records and thus fail in the patient-independent
situation of detecting the new patients. To overcome such limitation, we
propose a robust and explainable epileptic seizure detection model that
effectively learns from seizure states while eliminates the inter-patient
noises. Methods: A complex deep neural network model is proposed to learn the
pure seizure-specific representation from the raw non-invasive
electroencephalography (EEG) signals through adversarial training. Furthermore,
to enhance the explainability, we develop an attention mechanism to
automatically learn the importance of each EEG channels in the seizure
diagnosis procedure. Results: The proposed approach is evaluated over the
Temple University Hospital EEG (TUH EEG) database. The experimental results
illustrate that our model outperforms the competitive state-of-the-art
baselines with low latency. Moreover, the designed attention mechanism is
demonstrated ables to provide fine-grained information for pathological
analysis. Conclusion and significance: We propose an effective and efficient
patient-independent diagnosis approach of epileptic seizure based on raw EEG
signals without manually feature engineering, which is a step toward the
development of large-scale deployment for real-life use.",arxiv,health,'health' AND 'machine learning' AND ('real-world' AND 'deploy')
http://arxiv.org/abs/1909.02511v2,2019-09-27T21:48:31Z,2019-09-05T16:31:40Z,"CT Data Curation for Liver Patients: Phase Recognition in Dynamic
  Contrast-Enhanced CT","As the demand for more descriptive machine learning models grows within
medical imaging, bottlenecks due to data paucity will exacerbate. Thus,
collecting enough large-scale data will require automated tools to harvest
data/label pairs from messy and real-world datasets, such as hospital PACS.
This is the focus of our work, where we present a principled data curation tool
to extract multi-phase CT liver studies and identify each scan's phase from a
real-world and heterogenous hospital PACS dataset. Emulating a typical
deployment scenario, we first obtain a set of noisy labels from our
institutional partners that are text mined using simple rules from DICOM tags.
We train a deep learning system, using a customized and streamlined 3D SE
architecture, to identify non-contrast, arterial, venous, and delay phase
dynamic CT liver scans, filtering out anything else, including other types of
liver contrast studies. To exploit as much training data as possible, we also
introduce an aggregated cross entropy loss that can learn from scans only
identified as ""contrast"". Extensive experiments on a dataset of 43K scans of
7680 patient imaging studies demonstrate that our 3DSE architecture, armed with
our aggregated loss, can achieve a mean F1 of 0.977 and can correctly harvest
up to 92.7% of studies, which significantly outperforms the text-mined and
standard-loss approach, and also outperforms other, and more complex, model
architectures.",arxiv,health,'health' AND 'machine learning' AND ('real-world' AND 'deploy')
http://arxiv.org/abs/1908.11863v1,2019-08-30T17:48:05Z,2019-08-30T17:48:05Z,Systematic Analysis of Image Generation using GANs,"Generative Adversarial Networks have been crucial in the developments made in
unsupervised learning in recent times. Exemplars of image synthesis from text
or other images, these networks have shown remarkable improvements over
conventional methods in terms of performance. Trained on the adversarial
training philosophy, these networks aim to estimate the potential distribution
from the real data and then use this as input to generate the synthetic data.
Based on this fundamental principle, several frameworks can be generated that
are paragon implementations in several real-life applications such as art
synthesis, generation of high resolution outputs and synthesis of images from
human drawn sketches, to name a few. While theoretically GANs present better
results and prove to be an improvement over conventional methods in many
factors, the implementation of these frameworks for dedicated applications
remains a challenge. This study explores and presents a taxonomy of these
frameworks and their use in various image to image synthesis and text to image
synthesis applications. The basic GANs, as well as a variety of different niche
frameworks, are critically analyzed. The advantages of GANs for image
generation over conventional methods as well their disadvantages amongst other
frameworks are presented. The future applications of GANs in industries such as
healthcare, art and entertainment are also discussed.",arxiv,health,'health' AND 'machine learning' AND ('real-world' AND 'deploy')
http://arxiv.org/abs/1908.08733v3,2020-03-03T15:27:57Z,2019-08-23T09:38:13Z,Neural Cognitive Diagnosis for Intelligent Education Systems,"Cognitive diagnosis is a fundamental issue in intelligent education, which
aims to discover the proficiency level of students on specific knowledge
concepts. Existing approaches usually mine linear interactions of student
exercising process by manual-designed function (e.g., logistic function), which
is not sufficient for capturing complex relations between students and
exercises. In this paper, we propose a general Neural Cognitive Diagnosis
(NeuralCD) framework, which incorporates neural networks to learn the complex
exercising interactions, for getting both accurate and interpretable diagnosis
results. Specifically, we project students and exercises to factor vectors and
leverage multi neural layers for modeling their interactions, where the
monotonicity assumption is applied to ensure the interpretability of both
factors. Furthermore, we propose two implementations of NeuralCD by
specializing the required concepts of each exercise, i.e., the NeuralCDM with
traditional Q-matrix and the improved NeuralCDM+ exploring the rich text
content. Extensive experimental results on real-world datasets show the
effectiveness of NeuralCD framework with both accuracy and interpretability.",arxiv,health,'health' AND 'machine learning' AND ('real-world' AND 'deploy')
http://arxiv.org/abs/1908.05764v5,2020-10-23T10:45:37Z,2019-08-15T21:03:42Z,"Learning Sub-Sampling and Signal Recovery with Applications in
  Ultrasound Imaging","Limitations on bandwidth and power consumption impose strict bounds on data
rates of diagnostic imaging systems. Consequently, the design of suitable (i.e.
task- and data-aware) compression and reconstruction techniques has attracted
considerable attention in recent years. Compressed sensing emerged as a popular
framework for sparse signal reconstruction from a small set of compressed
measurements. However, typical compressed sensing designs measure a
(non)linearly weighted combination of all input signal elements, which poses
practical challenges. These designs are also not necessarily task-optimal. In
addition, real-time recovery is hampered by the iterative and time-consuming
nature of sparse recovery algorithms. Recently, deep learning methods have
shown promise for fast recovery from compressed measurements, but the design of
adequate and practical sensing strategies remains a challenge. Here, we propose
a deep learning solution termed Deep Probabilistic Sub-sampling (DPS), that
learns a task-driven sub-sampling pattern, while jointly training a subsequent
task model. Once learned, the task-based sub-sampling patterns are fixed and
straightforwardly implementable, e.g. by non-uniform analog-to-digital
conversion, sparse array design, or slow-time ultrasound pulsing schemes. The
effectiveness of our framework is demonstrated in-silico for sparse signal
recovery from partial Fourier measurements, and in-vivo for both anatomical
image and tissue-motion (Doppler) reconstruction from sub-sampled medical
ultrasound imaging data.",arxiv,health,'health' AND 'machine learning' AND ('real-world' AND 'deploy')
