id,updated,published,title,summary,database,query_name,query_value
http://arxiv.org/abs/2110.00086v1,2021-09-30T20:56:37Z,2021-09-30T20:56:37Z,On the Trustworthiness of Tree Ensemble Explainability Methods,"The recent increase in the deployment of machine learning models in critical
domains such as healthcare, criminal justice, and finance has highlighted the
need for trustworthy methods that can explain these models to stakeholders.
Feature importance methods (e.g. gain and SHAP) are among the most popular
explainability methods used to address this need. For any explainability
technique to be trustworthy and meaningful, it has to provide an explanation
that is accurate and stable. Although the stability of local feature importance
methods (explaining individual predictions) has been studied before, there is
yet a knowledge gap about the stability of global features importance methods
(explanations for the whole model). Additionally, there is no study that
evaluates and compares the accuracy of global feature importance methods with
respect to feature ordering. In this paper, we evaluate the accuracy and
stability of global feature importance methods through comprehensive
experiments done on simulations as well as four real-world datasets. We focus
on tree-based ensemble methods as they are used widely in industry and measure
the accuracy and stability of explanations under two scenarios: 1) when inputs
are perturbed 2) when models are perturbed. Our findings provide a comparison
of these methods under a variety of settings and shed light on the limitations
of global feature importance methods by indicating their lack of accuracy with
and without noisy inputs, as well as their lack of stability with respect to:
1) increase in input dimension or noise in the data; 2) perturbations in models
initialized by different random seeds or hyperparameter settings.",arxiv,health,'health' AND 'machine learning' AND ('real-world' AND 'deploy')
http://arxiv.org/abs/2109.14885v2,2022-05-05T19:11:45Z,2021-09-30T07:05:20Z,"Out-of-Distribution Detection for Medical Applications: Guidelines for
  Practical Evaluation","Detection of Out-of-Distribution (OOD) samples in real time is a crucial
safety check for deployment of machine learning models in the medical field.
Despite a growing number of uncertainty quantification techniques, there is a
lack of evaluation guidelines on how to select OOD detection methods in
practice. This gap impedes implementation of OOD detection methods for
real-world applications. Here, we propose a series of practical considerations
and tests to choose the best OOD detector for a specific medical dataset. These
guidelines are illustrated on a real-life use case of Electronic Health Records
(EHR). Our results can serve as a guide for implementation of OOD detection
methods in clinical practice, mitigating risks associated with the use of
machine learning models in healthcare.",arxiv,health,'health' AND 'machine learning' AND ('real-world' AND 'deploy')
http://arxiv.org/abs/2109.13521v2,2021-11-23T05:34:54Z,2021-09-28T06:49:40Z,"A multi-stage semi-supervised improved deep embedded clustering method
  for bearing fault diagnosis under the situation of insufficient labeled
  samples","Although data-driven fault diagnosis methods have been widely applied,
massive labeled data are required for model training. However, a difficulty of
implementing this in real industries hinders the application of these methods.
Hence, an effective diagnostic approach that can work well in such situation is
urgently needed.In this study, a multi-stage semi-supervised improved deep
embedded clustering (MS-SSIDEC) method, which combines semi-supervised learning
with improved deep embedded clustering (IDEC), is proposed to jointly explore
scarce labeled data and massive unlabeled data. In the first stage, a
skip-connection-based convolutional auto-encoder (SCCAE) that can automatically
map the unlabeled data into a low-dimensional feature space is proposed and
pre-trained to be a fault feature extractor. In the second stage, a
semi-supervised improved deep embedded clustering (SSIDEC) network is proposed
for clustering. It is first initialized with available labeled data and then
used to simultaneously optimize the clustering label assignment and make the
feature space to be more clustering-friendly. To tackle the phenomenon of
overfitting, virtual adversarial training (VAT) is introduced as a
regularization term in this stage. In the third stage, pseudo labels are
obtained by the high-quality results of SSIDEC. The labeled dataset can be
augmented by these pseudo-labeled data and then leveraged to train a bearing
fault diagnosis model. Two public datasets of vibration data from rolling
bearings are used to evaluate the performance of the proposed method.
Experimental results indicate that the proposed method achieves a promising
performance in both semi-supervised and unsupervised fault diagnosis tasks.
This method provides a new approach for fault diagnosis under the situation of
limited labeled samples by effectively exploring unsupervised data.",arxiv,health,'health' AND 'machine learning' AND ('real-world' AND 'deploy')
http://arxiv.org/abs/2109.09435v1,2021-09-20T11:33:09Z,2021-09-20T11:33:09Z,Incremental Learning Techniques for Online Human Activity Recognition,"Unobtrusive and smart recognition of human activities using smartphones
inertial sensors is an interesting topic in the field of artificial
intelligence acquired tremendous popularity among researchers, especially in
recent years. A considerable challenge that needs more attention is the
real-time detection of physical activities, since for many real-world
applications such as health monitoring and elderly care, it is required to
recognize users' activities immediately to prevent severe damages to
individuals' wellness. In this paper, we propose a human activity recognition
(HAR) approach for the online prediction of physical movements, benefiting from
the capabilities of incremental learning algorithms. We develop a HAR system
containing monitoring software and a mobile application that collects
accelerometer and gyroscope data and send them to a remote server via the
Internet for classification and recognition operations. Six incremental
learning algorithms are employed and evaluated in this work and compared with
several batch learning algorithms commonly used for developing offline HAR
systems. The Final results indicated that considering all performance
evaluation metrics, Incremental K-Nearest Neighbors and Incremental Naive
Bayesian outperformed other algorithms, exceeding a recognition accuracy of 95%
in real-time.",arxiv,health,'health' AND 'machine learning' AND ('real-world' AND 'deploy')
http://arxiv.org/abs/2109.07846v1,2021-09-16T10:22:31Z,2021-09-16T10:22:31Z,"Telehealthcare and Covid-19: A Noninvasive & Low Cost Invasive, Scalable
  and Multimodal Real-Time Smartphone Application for Early Diagnosis of
  SARS-CoV-2 Infection","The global coronavirus pandemic overwhelmed many health care systems,
enforcing lockdown and encouraged work from home to control the spread of the
virus and prevent overrunning of hospitalized patients. This prompted a sharp
widespread use of telehealth to provide low-risk care for patients.
Nevertheless, a continuous mutation into new variants and widespread
unavailability of test kits, especially in developing countries, possess the
challenge to control future potential waves of infection. In this paper, we
propose a novel Smartphone application-based platform for early diagnosis of
possible Covid-19 infected patients. The application provides three modes of
diagnosis from possible symptoms, cough sound, and specific blood biomarkers.
When a user chooses a particular setting and provides the necessary
information, it sends the data to a trained machine learning (ML) model
deployed in a remote server using the internet. The ML algorithm then predicts
the possibility of contracting Covid-19 and sends the feedback to the user. The
entire procedure takes place in real-time. Our machine learning models can
identify Covid-19 patients with an accuracy of 100%, 95.65%, and 77.59% from
blood parameters, cough sound, and symptoms respectively. Moreover, the ML
sensitivity for blood and sound is 100%, which indicates correct identification
of Covid positive patients. This is significant in limiting the spread of the
virus. The multimodality offers multiplex diagnostic methods to better classify
possible infectees and together with the instantaneous nature of our technique,
demonstrates the power of telehealthcare as an easy and widespread low-cost
scalable diagnostic solution for future pandemics.",arxiv,health,'health' AND 'machine learning' AND ('real-world' AND 'deploy')
http://arxiv.org/abs/2109.07827v2,2022-04-27T16:38:20Z,2021-09-16T09:36:53Z,"Enabling risk-aware Reinforcement Learning for medical interventions
  through uncertainty decomposition","Reinforcement Learning (RL) is emerging as tool for tackling complex control
and decision-making problems. However, in high-risk environments such as
healthcare, manufacturing, automotive or aerospace, it is often challenging to
bridge the gap between an apparently optimal policy learnt by an agent and its
real-world deployment, due to the uncertainties and risk associated with it.
Broadly speaking RL agents face two kinds of uncertainty, 1. aleatoric
uncertainty, which reflects randomness or noise in the dynamics of the world,
and 2. epistemic uncertainty, which reflects the bounded knowledge of the agent
due to model limitations and finite amount of information/data the agent has
acquired about the world. These two types of uncertainty carry fundamentally
different implications for the evaluation of performance and the level of risk
or trust. Yet these aleatoric and epistemic uncertainties are generally
confounded as standard and even distributional RL is agnostic to this
difference. Here we propose how a distributional approach (UA-DQN) can be
recast to render uncertainties by decomposing the net effects of each
uncertainty. We demonstrate the operation of this method in grid world examples
to build intuition and then show a proof of concept application for an RL agent
operating as a clinical decision support system in critical care",arxiv,health,'health' AND 'machine learning' AND ('real-world' AND 'deploy')
http://arxiv.org/abs/2109.06919v2,2022-01-12T22:08:58Z,2021-09-14T18:41:36Z,Deploying clinical machine learning? Consider the following...,"Despite the intense attention and considerable investment into clinical
machine learning research, relatively few applications have been deployed at a
large-scale in a real-world clinical environment. While research is important
in advancing the state-of-the-art, translation is equally important in bringing
these techniques and technologies into a position to ultimately impact
healthcare. We believe a lack of appreciation for several considerations are a
major cause for this discrepancy between expectation and reality. To better
characterize a holistic perspective among researchers and practitioners, we
survey several practitioners with commercial experience in developing CML for
clinical deployment. Using these insights, we identify several main categories
of challenges in order to better design and develop clinical machine learning
applications.",arxiv,health,'health' AND 'machine learning' AND ('real-world' AND 'deploy')
http://arxiv.org/abs/2109.05742v3,2022-06-28T03:11:58Z,2021-09-13T07:07:23Z,"Domain Generalization for Medical Image Segmentation via Hierarchical
  Consistency Regularization","Modern deep neural networks struggle to transfer knowledge and generalize
across diverse domains when deployed to real-world applications. Currently,
domain generalization (DG) is introduced to learn a universal representation
from multiple domains to improve the network generalization ability on unseen
domains. However, previous DG methods only focus on the data-level consistency
scheme without considering the synergistic regularization among different
consistency schemes. In this paper, we present a novel Hierarchical Consistency
framework for Domain Generalization (HCDG) by integrating Extrinsic Consistency
and Intrinsic Consistency synergistically. Particularly, for the Extrinsic
Consistency, we leverage the knowledge across multiple source domains to
enforce data-level consistency. To better enhance such consistency, we design a
novel Amplitude Gaussian-mixing strategy into Fourier-based data augmentation
called DomainUp. For the Intrinsic Consistency, we perform task-level
consistency for the same instance under the dual-task scenario. We evaluate the
proposed HCDG framework on two medical image segmentation tasks, i.e., optic
cup/disc segmentation on fundus images and prostate MRI segmentation. Extensive
experimental results manifest the effectiveness and versatility of our HCDG
framework.",arxiv,health,'health' AND 'machine learning' AND ('real-world' AND 'deploy')
http://arxiv.org/abs/2109.02915v1,2021-09-07T08:04:02Z,2021-09-07T08:04:02Z,"Few-shot Learning in Emotion Recognition of Spontaneous Speech Using a
  Siamese Neural Network with Adaptive Sample Pair Formation","Speech-based machine learning (ML) has been heralded as a promising solution
for tracking prosodic and spectrotemporal patterns in real-life that are
indicative of emotional changes, providing a valuable window into one's
cognitive and mental state. Yet, the scarcity of labelled data in ambulatory
studies prevents the reliable training of ML models, which usually rely on
""data-hungry"" distribution-based learning. Leveraging the abundance of labelled
speech data from acted emotions, this paper proposes a few-shot learning
approach for automatically recognizing emotion in spontaneous speech from a
small number of labelled samples. Few-shot learning is implemented via a metric
learning approach through a siamese neural network, which models the relative
distance between samples rather than relying on learning absolute patterns of
the corresponding distributions of each emotion. Results indicate the
feasibility of the proposed metric learning in recognizing emotions from
spontaneous speech in four datasets, even with a small amount of labelled
samples. They further demonstrate superior performance of the proposed metric
learning compared to commonly used adaptation methods, including network
fine-tuning and adversarial learning. Findings from this work provide a
foundation for the ambulatory tracking of human emotion in spontaneous speech
contributing to the real-life assessment of mental health degradation.",arxiv,health,'health' AND 'machine learning' AND ('real-world' AND 'deploy')
http://arxiv.org/abs/2109.02418v2,2021-10-17T07:11:58Z,2021-09-06T12:58:25Z,Multitask Balanced and Recalibrated Network for Medical Code Prediction,"Human coders assign standardized medical codes to clinical documents
generated during patients' hospitalization, which is error-prone and
labor-intensive. Automated medical coding approaches have been developed using
machine learning methods such as deep neural networks. Nevertheless, automated
medical coding is still challenging because of the imbalanced class problem,
complex code association, and noise in lengthy documents. To solve these
issues, we propose a novel neural network called Multitask Balanced and
Recalibrated Neural Network. Significantly, the multitask learning scheme
shares the relationship knowledge between different code branches to capture
the code association. A recalibrated aggregation module is developed by
cascading convolutional blocks to extract high-level semantic features that
mitigate the impact of noise in documents. Also, the cascaded structure of the
recalibrated module can benefit the learning from lengthy notes. To solve the
class imbalanced problem, we deploy the focal loss to redistribute the
attention of low and high-frequency medical codes. Experimental results show
that our proposed model outperforms competitive baselines on a real-world
clinical dataset MIMIC-III.",arxiv,health,'health' AND 'machine learning' AND ('real-world' AND 'deploy')
http://arxiv.org/abs/2109.00582v3,2022-07-02T05:44:29Z,2021-09-01T19:20:28Z,"Information-theoretic Classification Accuracy: A Criterion that Guides
  Data-driven Combination of Ambiguous Outcome Labels in Multi-class
  Classification","Outcome labeling ambiguity and subjectivity are ubiquitous in real-world
datasets. While practitioners commonly combine ambiguous outcome labels for all
data points (instances) in an ad hoc way to improve the accuracy of multi-class
classification, there lacks a principled approach to guide the label
combination for all data points by any optimality criterion. To address this
problem, we propose the information-theoretic classification accuracy (ITCA), a
criterion that balances the trade-off between prediction accuracy (how well do
predicted labels agree with actual labels) and classification resolution (how
many labels are predictable), to guide practitioners on how to combine
ambiguous outcome labels. To find the optimal label combination indicated by
ITCA, we propose two search strategies: greedy search and breadth-first search.
Notably, ITCA and the two search strategies are adaptive to all
machine-learning classification algorithms. Coupled with a classification
algorithm and a search strategy, ITCA has two uses: improving prediction
accuracy and identifying ambiguous labels. We first verify that ITCA achieves
high accuracy with both search strategies in finding the correct label
combinations on synthetic and real data. Then we demonstrate the effectiveness
of ITCA in diverse applications including medical prognosis, cancer survival
prediction, user demographics prediction, and cell type classification. We also
provide theoretical insights into ITCA by studying the oracle and the linear
discriminant analysis classification algorithms. Python package itca (available
at https://github.com/JSB-UCLA/ITCA) implements ITCA and search strategies.",arxiv,health,'health' AND 'machine learning' AND ('real-world' AND 'deploy')
http://arxiv.org/abs/2109.00115v1,2021-08-31T23:38:17Z,2021-08-31T23:38:17Z,"Uncertainty Quantified Deep Learning for Predicting Dice Coefficient of
  Digital Histopathology Image Segmentation","Deep learning models (DLMs) can achieve state of the art performance in
medical image segmentation and classification tasks. However, DLMs that do not
provide feedback for their predictions such as Dice coefficients (Dice) have
limited deployment potential in real world clinical settings. Uncertainty
estimates can increase the trust of these automated systems by identifying
predictions that need further review but remain computationally prohibitive to
deploy. In this study, we use a DLM with randomly initialized weights and Monte
Carlo dropout (MCD) to segment tumors from microscopic Hematoxylin and Eosin
(H&E) dye stained prostate core biopsy RGB images. We devise a novel approach
that uses multiple clinical region based uncertainties from a single image
(instead of the entire image) to predict Dice of the DLM model output by linear
models. Image level uncertainty maps were generated and showed correspondence
between imperfect model segmentation and high levels of uncertainty associated
with specific prostate tissue regions with or without tumors. Results from this
study suggest that linear models can learn coefficients of uncertainty
quantified deep learning and correlations ((Spearman's correlation (p<0.05)) to
predict Dice scores of specific regions of medical images.",arxiv,health,'health' AND 'machine learning' AND ('real-world' AND 'deploy')
http://arxiv.org/abs/2109.00516v1,2021-08-31T17:51:15Z,2021-08-31T17:51:15Z,Multistage Pruning of CNN Based ECG Classifiers for Edge Devices,"Using smart wearable devices to monitor patients electrocardiogram (ECG) for
real-time detection of arrhythmias can significantly improve healthcare
outcomes. Convolutional neural network (CNN) based deep learning has been used
successfully to detect anomalous beats in ECG. However, the computational
complexity of existing CNN models prohibits them from being implemented in
low-powered edge devices. Usually, such models are complex with lots of model
parameters which results in large number of computations, memory, and power
usage in edge devices. Network pruning techniques can reduce model complexity
at the expense of performance in CNN models. This paper presents a novel
multistage pruning technique that reduces CNN model complexity with negligible
loss in performance compared to existing pruning techniques. An existing CNN
model for ECG classification is used as a baseline reference. At 60% sparsity,
the proposed technique achieves 97.7% accuracy and an F1 score of 93.59% for
ECG classification tasks. This is an improvement of 3.3% and 9% for accuracy
and F1 Score respectively, compared to traditional pruning with fine-tuning
approach. Compared to the baseline model, we also achieve a 60.4% decrease in
run-time complexity.",arxiv,health,'health' AND 'machine learning' AND ('real-world' AND 'deploy')
http://arxiv.org/abs/2108.13557v2,2022-03-04T19:37:30Z,2021-08-31T00:06:09Z,Towards Observability for Machine Learning Pipelines,"Software organizations are increasingly incorporating machine learning (ML)
into their product offerings, driving a need for new data management tools.
Many of these tools facilitate the initial development of ML applications, but
sustaining these applications post-deployment is difficult due to lack of
real-time feedback (i.e., labels) for predictions and silent failures that
could occur at any stage, or component, of the ML pipeline (e.g., data
distribution shift). We propose a new type of data management system that
offers end-to-end observability, or visibility into complex system behavior,
for ML pipelines through assisted (1) detection, (2) diagnosis, and (3)
reaction to ML-related bugs. We describe new research challenges and suggest
preliminary solution ideas in all three aspects. Finally, we introduce an
example architecture for a ""bolt-on"" ML observability system, or one that wraps
around existing tools in the stack.",arxiv,health,'health' AND 'machine learning' AND ('real-world' AND 'deploy')
http://arxiv.org/abs/2108.13381v1,2021-08-30T17:04:04Z,2021-08-30T17:04:04Z,"Trustworthy AI for Process Automation on a Chylla-Haase Polymerization
  Reactor","In this paper, genetic programming reinforcement learning (GPRL) is utilized
to generate human-interpretable control policies for a Chylla-Haase
polymerization reactor. Such continuously stirred tank reactors (CSTRs) with
jacket cooling are widely used in the chemical industry, in the production of
fine chemicals, pigments, polymers, and medical products. Despite appearing
rather simple, controlling CSTRs in real-world applications is quite a
challenging problem to tackle. GPRL utilizes already existing data from the
reactor and generates fully automatically a set of optimized simplistic control
strategies, so-called policies, the domain expert can choose from. Note that
these policies are white-box models of low complexity, which makes them easy to
validate and implement in the target control system, e.g., SIMATIC PCS 7.
However, despite its low complexity the automatically-generated policy yields a
high performance in terms of reactor temperature control deviation, which we
empirically evaluate on the original reactor template.",arxiv,health,'health' AND 'machine learning' AND ('real-world' AND 'deploy')
http://arxiv.org/abs/2108.13035v1,2021-08-30T07:43:47Z,2021-08-30T07:43:47Z,"SurRoL: An Open-source Reinforcement Learning Centered and dVRK
  Compatible Platform for Surgical Robot Learning","Autonomous surgical execution relieves tedious routines and surgeon's
fatigue. Recent learning-based methods, especially reinforcement learning (RL)
based methods, achieve promising performance for dexterous manipulation, which
usually requires the simulation to collect data efficiently and reduce the
hardware cost. The existing learning-based simulation platforms for medical
robots suffer from limited scenarios and simplified physical interactions,
which degrades the real-world performance of learned policies. In this work, we
designed SurRoL, an RL-centered simulation platform for surgical robot learning
compatible with the da Vinci Research Kit (dVRK). The designed SurRoL
integrates a user-friendly RL library for algorithm development and a real-time
physics engine, which is able to support more PSM/ECM scenarios and more
realistic physical interactions. Ten learning-based surgical tasks are built in
the platform, which are common in the real autonomous surgical execution. We
evaluate SurRoL using RL algorithms in simulation, provide in-depth analysis,
deploy the trained policies on the real dVRK, and show that our SurRoL achieves
better transferability in the real world.",arxiv,health,'health' AND 'machine learning' AND ('real-world' AND 'deploy')
