paperId,url,title,abstract,venue,year,externalIds.DOI,database,query_name,query_value
3af91b1be29551c1cf19866f47e7035b7e139343,https://www.semanticscholar.org/paper/3af91b1be29551c1cf19866f47e7035b7e139343,Objective Image Quality Assessment: Facing The Real-World Challenges,"There has been a growing interest in recent years in the development of objective image quality assessment (IQA) models, whose roles are not only to monitor image quality degradations and benchmark image processing systems, but also to optimize various image and video processing algorithms and systems. While the past achievement is worth celebrating, a number of major challenges remain when we apply existing IQA models in realworld applications. These include obvious ones such as the challenges to largely reduce the complexity of existing IQA algorithms and to make them easy-to-use and easy-to-understand. There are also challenges regarding the applicability of existing IQA models in many real-world problems where image quality needs to be evaluated and compared across dimensionality, across viewing environment, and across the form of representations − specific examples include quality assessment for image resizing, color-togray image conversion, multi-exposure image fusion, image retargeting, and high dynamic range image tone mapping. Here we will first elaborate these challenges, and then concentrate on a specific one, namely the generalization challenge, which we believe is a more fundamental issue in the development, validation and application of IQA models. Specifically, the challenge is about the generalization capability of existing IQA models, which achieve superior quality prediction performance in lab testing environment using a limited number of subject-rated test images, but the performance may not extend to the real-world where we are working with images of a much greater diversity in terms of content and complexity. We will discuss some principle ideas and related work that might help us meet the challenges in the future. Introduction Over the past decades, a growing number of researchers and engineers in the image processing community have started to realize the importance of image/video quality assessment (IQA/VQA) [40, 29, 4]. This is not surprising because no matter what image/video processing problems we are working on, the same issues repeatedly come up − How should we evaluate the images generated from our algorithms/systems? How do we know our algorithm/system is creating an improvement between the input and output images, and by how much? How can we know one algorithm/system performs better than another, and by how much? What should be the quality criterion for which the design of our algorithms/systems should be optimized? Since the human eyes are the ultimate receivers in most image processing applications, human subjective visual testing would be a reliable solution. However, with the exponential increase of the volume of image/video data being generated daily, it becomes impossible to address these quality issues in a timely manner by subjective visual testing, which is slow, cumbersome and expensive. Instead, only trusted objective IQA models may potentially meet these needs. In academia, objective IQA has been a hot research topic, especially in the past 15 years [35, 4, 29]. First, the commonly used numerical disotrtion/quality measures in the past − the mean squared error (MSE) and the peak signal-to-noise ratio (PSNR) − have been shown to correlate poorly with perceived image quality [28, 30]. Second, a large number of perceptually more meaningful IQA models have been proposed, including full-reference (where a perfect quality reference image is available when evaluating a distorted image) [35, 4, 29], no-reference (where the reference image is not accessible) [34, 24, 31], and reduced-reference (where only partial information about the reference image is available) models [39, 36, 31, 29]. Third, several design principles have been discovered and repeatedly demonstrated to be useful in the design and improvement of IQA models. These include psychophysical and physiological visibility models [35, 4], the structural similarity (SSIM) approaches [28, 32, 33, 20, 49], the natural scene statistics (NSS) and information theoretic approaches [36, 39, 21, 31], the visual saliency based approaches [50], and the machine learning based approaches [6]. Fourth, a number of subject-rated image quality databases have been created and made publicly available [22, 7, 8, 17, 16, 47]. They provide a common benchmark platform for the evaluation and comparison of IQA models, among which several algorithms have achieved high correlations with the subjective mean opinion scores (MOSs) of the test images [23, 38, 33, 49]. In the video delivery industry, perceptual objective IQA methods such as the SSIM algorithm have been incorporated into many practical hardware and software systems to monitor image/video quality degradations and to test/compare image/video encoders and transcoders [27, 25, 26]. The wide use of SSIM has resulted in a Primetime Engineering Emmy Award given by the Academy of Television Arts and Sciences [1]. The remarkable development and successful deployment of modern IQA methods are definitely worth celebrating. Nevertheless, this does not necessarily mean that the existing IQA models have already met the real-world challenges. Otherwise, they should have made a much stronger impact and become a gamechanging factor in the industry. Using the video delivery industry as an example, even now most practitioners are still equating bitrate with quality in the practical design of video delivery architectures. However, using the same bitrate to encode different video content could result in dramatically different visual quality. Clearly, the perceptual quality of the video itself, which is presumably the ultimate evaluation criterion of the whole video delivery system, has not been placed at the driver’s seat. While it is understandable that quality degradation is inevitable at many stages in the video delivery chain due to practical constraints, the real concern here is that there is no existing protocol to monitor and control such quality degradation. As a result, various tricks have been used to manipulate the video content and network resources are allocated in suboptimal ways, leaving the creative intent of the content producers unprotected. While it is certain that the industry needs to be better informed about the great potentials of making the best use of IQA/VQA models, we believe that an equally important aspect that slows down the process is that the existing IQA/VQA models still do not meet many real-world challenges. In the following sections, we will elaborate some of these challenges and then focus on a specific one, namely the generalization challenge. We wish our discussions on some fundamental ideas could provide some useful insights for the future development of IQA models that may meet these real-world challenges. The Real-World Challenges Here we make a list of real-world challenges, many of which are described in more details through examples of practical scenarios. 1. It is highly desirable to reduce the complexity of the IQA/VQA algorithms so that they can be computed in realtime or in an even faster speed. This is especially useful in time-sensitive applications such as live broadcasting and videoconferencing. Many existing models are far from meeting this challenge. 2. It is essential to make the IQA/VQA scores easy-to-use and easy-to-understand. For example, the raw SSIM score does not have an explicit perceptual meaning, making it difficult to determine what level of SSIM index can warrant an excellent video quality and how much improvement in the SSIM index is sufficient to create visible quality improvement. Mapping the raw scores into a perceptually linear domain that is easily linked to human expressions about image quality is desirable. 3. The same video stream shown on different display devices could result in very different perceptual quality. For example, a strongly compressed video that exhibits very annoying artifacts on a large TV could appear to have fine quality when viewed on the screen of a smartphone. The quality may also change significantly when the video is watched on the same TV but at two different viewing distances, one at the default distance and the other at a very close distance. However, existing IQA/VQA models give the same score based on the video stream only, completely ignorant of the viewing device and viewing condition. 4. In a video-on-demand application, a high-quality highresolution (e.g., 4K) source video may be encoded into multiple video streams of different resolutions (e.g., 1080p, 720p, 360p, 240p, etc.) and different bit rates, aiming for satisfying a variety of user needs. In order to measure the quality of the encoded videos, most existing VQA models cannot be computed because the source (reference) and test videos have different spatial resolutions. 5. An image or video may need to be displayed on a screen that has a spatial resolution higher than that of the image resolution. As a result, spatial interpolation is performed. Again, most existing VQA models are not applicable because the reference and test images have different spatial resolutions. 6. An image or video of imperfect quality (e.g., being compressed at an earlier stage) is received and then transcoded to multiple images or videos with different bitrates and resolutions. Most existing IQA/VQA models are not applicable not only because they do not allow for cross-resolution quality assessment, but also because they assume the original reference image/video to have perfect quality, which is not the case here. How to carry out “degraded reference” IQA/VQA is a major challenge. 7. A high dynamic range (HDR) image (e.g., the pixels are in 10 or more bit depths) is tone mapped to a standard dynamic range (SDR) image (8 bits per pixel) in order to be visualized on an SDR display. There is certainly information loss that we would like to capture. However, most existing IQA models do not apply because they cannot compare images/videos with different dynamic ranges.",IQSP,2016,10.2352/ISSN.2470-1173.2016.13.IQSP-205,semantic_scholar,e-commerce,'e-commerce' AND 'machine learning' AND ('real-world' AND 'deploy')
8f2a47cd8a04aa7985d36c1106b01f35290be30f,https://www.semanticscholar.org/paper/8f2a47cd8a04aa7985d36c1106b01f35290be30f,Development of 80- and 100- Mile Work Day Cycles Representative of Commercial Pickup and Delivery Operation,"When developing and designing new technology for integrated vehicle systems deployment, standard cycles have long existed for chassis dynamometer testing and tuning of the powertrain. However, to this day with recent developments and advancements in plug-in hybrid and battery electric vehicle technology, no true “work day” cycles exist with which to tune and measure energy storage control and thermal management systems. To address these issues and in support of development of a range-extended pickup and delivery Class 6 commercial vehicle, researchers at the National Renewable Energy Laboratory in collaboration with Cummins analyzed 78,000 days of operational data captured from more than 260 vehicles operating across the United States to characterize the typical daily performance requirements associated with Class 6 commercial pickup and delivery operation. In total, over 2.5 million miles of realworld vehicle operation were condensed into a pair of duty cycles, an 80-mile cycle and a 100-mile cycle representative of the daily operation of U.S. class 3-6 commercial pickup and delivery trucks. Using novel machine learning clustering methods combined with mileage-based weighting, these composite representative cycles correspond to 90th and 95th percentiles for daily vehicle miles traveled by the vehicles observed. In addition to including vehicle speed vs time drive cycles, in an effort to better represent the environmental factors encountered by pickup and delivery vehicles operating across the United States, a nationally representative grade profile and key status information were also appended to the speed vs. time profiles to produce a “work day” cycle that captures the effects of vehicle dynamics, geography, and driver behavior which can be used for future design, development, and validation of technology. Introduction Under DOE-FOA-0001349 FY15 Award for Mediumand Heavy-Duty Vehicle Powertrain Electrification, Cummins and PACCAR jointly proposed the development of a range-extending plug-in hybrid electric Class 6 pickup and delivery truck. The goal of this project is to demonstrate an electrified vehicle that would deliver a minimum of 50% reduction in fuel consumption across a range of representative drive cycles. In addition to achieving the 50% fuel reduction target, the vehicle also needs to demonstrate as good or better drivability and performance while still meeting emissions requirements when compared to existing conventionally fueled baseline vehicles. Most existing duty cycles used to test conventional internal combustion powered vehicles are of a limited time duration. For example, the Hybrid Truck Utility Forum Class 6 Pickup and Delivery cycle is slightly more than one hour. When testing a system using only fuel as its energy source, this is acceptable; a onehour duty cycle can be used to represent the vehicle operation for the entire work day (e.g., fuel consumption in the middle of the day is very similar to fuel consumption at the end of the day). However, with plug-in electric vehicles, the system (battery characteristics and thermal management systems) may operate differently throughout the work day (especially near the end of the day). For example, the available battery energy may be completely spent prior to the completion of the route. A short duty cycle cannot simply be extrapolated. Evaluating the vehicle over the entire work day also provides the ability to interject appropriate stops that are typical of the Class 6-7 pickup and delivery application. These stops can range from several minutes to much longer and can have significant thermal effect on the vehicle and powertrain systems. These stops may also have a large impact on overall duty cycle mileage (and other duty cycle characteristics such as average speed) as the stops may account for roughly half of the work day. As part of the research and development team, the National Renewable Energy Laboratory (NREL) was been NREL/CP-5400-70943. Posted with permission. Presented at WCX 18: SAE World Congress Experience, 10-12 April 2018, Detroit, Michigan.",,2018,10.4271/2018-01-1192,semantic_scholar,e-commerce,'e-commerce' AND 'machine learning' AND ('real-world' AND 'deploy')
cce600d54ef32b3f6312b9166da097e0f9eded8a,https://www.semanticscholar.org/paper/cce600d54ef32b3f6312b9166da097e0f9eded8a,Designing a Visual Analytics System for Industry-Scale Deep Neural Network Models,"The complexity of industry-scale deep learning models and datasets pose unique design, visualization, and system challenges that are inadequately addressed by existing work. Through participatory design sessions with over 15 researchers and engineers at Facebook, we have designed, developed, and deployed ACTIVIS, a visual analytics system for interpreting industry-scale deep learning models and results. By tightly integrating multiple coordinated views, such as a computation graph overview of the model architecture, and a neuron activation view for pattern discovery and comparison, users can explore complex deep neural network models at both instanceand subset-level. ACTIVIS has been deployed on Facebook’s machine learning platform. This article is a summary for the VAST’17 paper (TVCG track) ActiVis: Visual Exploration of Industry-Scale Deep Neural Network Models [2]. 1 DESIGNING FOR INDUSTRY-SCALE MODELS Despite the increasing interest in developing visualization tools for deep learning interpretation [5–7], the complexity of large-scale models and datasets used in industry pose unique design challenges that are inadequately addressed by existing work. For example, while most existing visualization tools target image datasets, deep learning tasks in industry often involve different types of data, including text and numerical data. Furthermore, in designing tools for realworld deployment, it is a high priority that the tools be flexible and scalable, adapting to the wide variety of models and datasets used. These observations motivate us to design and develop ACTIVIS [2], a visual analytics system for deep neural network models, now deployed on Facebook’s machine learning platform. Since the ACTIVIS project started in April 2016, we have conducted participatory design sessions with over 15 Facebook engineers, researchers, and data scientists across multiple teams to learn about their visual analytics needs. We identified six key design challenges — for data, model, and analytics — that have not been adequately addressed by existing deep learning visualization tools. The challenges include the need to support: (1) diverse input data sources, (2) high data volume, (3) complex model architecture, (4) a great variety of models, (5) diverse subset definitions for analytics, and (6) both instanceand subset-level analyses. These challenges shape the main design goals of ACTIVIS. 2 ACTIVIS CONTRIBUTIONS ACTIVIS’s main contributions include: • A novel visual representation that unifies instanceand subsetlevel inspections of neuron activation, facilitating comparison of activation patterns for multiple instances. *e-mail: kahng@gatech.edu †e-mail: mortimer@fb.com ‡e-mail: adityakalro@fb.com §e-mail: polo@gatech.edu • An interface that tightly integrates an overview of graph-structured complex models and local inspection of neuron activations, allowing users to explore the model at different levels of abstraction. • A deployed system scaling to large datasets and models. • Case studies with Facebook engineers and data scientists that highlight how ACTIVIS helps them with their work. ACTIVIS’s multiple coordinated views help users get a high-level overview of the model from which the user can drill down to perform localized inspection of activations. ACTIVIS visualizes how neurons are activated by user-specified instances or instance subsets, to help users understand how a model derives its predictions. The subsets can be flexibly defined using data attributes, features, or output results, enabling model inspection from multiple angles. While many existing deep learning visualization tools support instancelevel exploration [6, 7], ACTIVIS is the first tool that simultaneously supports instanceand subset-level exploration. Both exploration strategies are common and effective, and they offer complementary analytics benefits. Instance-based analysis instructs how individual instances contribute to a model’s accuracy, but it is tedious to inspect many instances one by one. Subset-based analysis leverages input features or instance subsets to help reveal relationships between data attributes and machine learning algorithms’ outputs [3]. It is especially beneficial when dealing with huge datasets in industry, which may consist of millions or billions of data points. By exploring instance subsets and enabling their comparison with individual instances, users can learn how them models respond to many different slices of the data. We refer our readers to the longer version of our ACTIVIS [2] VAST’17 paper published in IEEE Transactions on Visualization and Computer Graphics.",,2017,,semantic_scholar,e-commerce,'e-commerce' AND 'machine learning' AND ('real-world' AND 'deploy')
d64a7ff179c4c6f579c2509eef46df37c022942e,https://www.semanticscholar.org/paper/d64a7ff179c4c6f579c2509eef46df37c022942e,QUAESTUS – A Top-N Recommender System with Ranking Matrix Factorization,"The last decade has seen rapid strides being taken in the field of recommender systems, which has been driven by both consumer demand for personalization as well as academic interest in implementing more accurate and optimized versions of recommender systems. In this paper we have discussed our implementation of Quaestus, a top-n item-based collaborative filtering recommender system with ranked matrix factorization (for relevance based sorting) which we have tested on an e-commerce dataset. We have used sentiment analysis to understand the polarity of reviews and thus extracting a score out of it, which in collaboration with the product rating (which was available on a scale of 1 to 5) has helped build a more robust recommender system. We have deployed Quaestus on an e-commerce website that we have built. The paper describes the phases of implementation and shows the method to deploy our model to the website that we have created. The results after experiments have shown that our model fares better than other algorithms with which we have compared our model. General Terms Recommender System, Natural Language Processing, ECommerce Platform, Web Scraping, Machine Learning, NLP, ML.",,2018,10.5120/ijca2018917135,semantic_scholar,e-commerce,'e-commerce' AND 'machine learning' AND ('real-world' AND 'deploy')
3a9dbcbd447262bebf322781082e9913d802e871,https://www.semanticscholar.org/paper/3a9dbcbd447262bebf322781082e9913d802e871,"HcBench: Methodology, development, and characterization of a customer usage representative big data/Hadoop benchmark","Big Data analytics using Map-Reduce over Hadoop has become a leading edge paradigm for distributed programming over large server clusters. The Hadoop platform is used extensively for interactive and batch analytics in ecommerce, telecom, media, retail, social networking, and being actively evaluated for use in other areas. However, to date no industry standard or customer representative benchmarks exist to measure and evaluate the true performance of a Hadoop cluster. Current Hadoop micro-benchmarks such as HiBench-2, GridMix-3, Terasort, etc. are narrow functional slices of applications that customers run to evaluate their Hadoop clusters. However, these benchmarks fail to capture the real usages and performance in a datacenter environment. Given that typical datacenter deployments of Hadoop process a wide variety of analytic interactive and query jobs in addition to batch transform jobs under strict Service Level Agreement (SLA) requirements, performance benchmarks used to evaluate clusters must capture the effects of concurrently running such diverse job types in production environments. In this paper, we present the methodology and the development of a customer datacenter usage representative Hadoop benchmark ""HcBench"" which includes a mix of large number of customer representative interactive, query, machine learning, and transform jobs, a variety of data sizes, and includes compute, storage 110, and network intensive jobs, with inter-job arrival times as in a typical datacenter environment. We present the details of this benchmark and discuss application level, server and cluster level performance characterization collected on an Intel Sandy Bridge Xeon Processor Hadoop cluster.",2013 IEEE International Symposium on Workload Characterization (IISWC),2013,10.1109/IISWC.2013.6704672,semantic_scholar,e-commerce,'e-commerce' AND 'machine learning' AND ('real-world' AND 'deploy')
