paperId,url,title,abstract,venue,year,externalIds.DOI,database,query_name,query_value
1d3539a8d94bd3ab78993d7cc584efc06ed0e460,https://www.semanticscholar.org/paper/1d3539a8d94bd3ab78993d7cc584efc06ed0e460,Synthetic Benchmarks for Scientific Research in Explainable Machine Learning,"As machine learning models grow more complex and their applications become more high-stakes, tools for explaining model predictions have become increasingly important. This has spurred a flurry of research in model explainability and has given rise to feature attribution methods such as LIME and SHAP. Despite their widespread use, evaluating and comparing different feature attribution methods remains challenging: evaluations ideally require human studies, and empirical evaluation metrics are often data-intensive or computationally prohibitive on realworld datasets. In this work, we address this issue by releasing XAI-BENCH: a suite of synthetic datasets along with a library for benchmarking feature attribution algorithms. Unlike real-world datasets, synthetic datasets allow the efficient computation of conditional expected values that are needed to evaluate groundtruth Shapley values and other metrics. The synthetic datasets we release offer a wide variety of parameters that can be configured to simulate real-world data. We demonstrate the power of our library by benchmarking popular explainability techniques across several evaluation metrics and across a variety of settings. The versatility and efficiency of our library will help researchers bring their explainability methods from development to deployment. Our code is available at https://github.com/abacusai/xai-bench.",NeurIPS Datasets and Benchmarks,2021,,semantic_scholar,e-commerce,'e-commerce' AND 'machine learning' AND ('real-world' AND 'deploy')
ed9b2c4d4ea93d86a6e1167c9e92cfa0a243c4bc,https://www.semanticscholar.org/paper/ed9b2c4d4ea93d86a6e1167c9e92cfa0a243c4bc,Challenges and Opportunities for Unikernels in Machine Learning Inference,"Machine Learning has become a value creator for many new and old businesses. However, efficient realworld machine learning deployments are still a challenge. Traditional Machine Learning deployments suffer from efficient resource utilization and achieving predictable latency. They cannot be treated in the same manner as other application server deployments. Unikernels are a method to specialize application deployment and performance to suit the needs of the application. Traditionally, building or porting applications to unikernels have been challenging. However, recent work has been into simplifying the development of unikernels. Real-world Unikernels as of now are only for specializing applications that run on the CPU. We survey machine learning practitioners and find out that the majority of machine learning practitioners are using the CPU for machine learning deployments, thus, creating an opportunity for unikernels to optimize the performance of these applications. We compare the architecture of two unikernels: nanos and Unikraft. We benchmarked scikit-learn, a popular machine library, inside a unikernel and found that it only offered a 1% advantage over a traditional deployment. However, our testing could not include more innovative systems like Unikraft due to their immaturity and inability to run machine learning libraries. We include a dependency analysis of three popular machine learning libraries Tensorflow Lite, PyTorch and ONNX, to help pave the way for building machine learning applications as Unikraft unikernels.","2021 9th International Conference on Reliability, Infocom Technologies and Optimization (Trends and Future Directions) (ICRITO)",2021,10.1109/icrito51393.2021.9596080,semantic_scholar,e-commerce,'e-commerce' AND 'machine learning' AND ('real-world' AND 'deploy')
b14558c0b727af0ac9086f463b6030b9072dbe16,https://www.semanticscholar.org/paper/b14558c0b727af0ac9086f463b6030b9072dbe16,Methods for Automatic Machine-Learning Workflow Analysis,,ECML/PKDD,2021,10.1007/978-3-030-86517-7_4,semantic_scholar,e-commerce,'e-commerce' AND 'machine learning' AND ('real-world' AND 'deploy')
56e63ffea11c875f7eee257798e18cd04e453b6c,https://www.semanticscholar.org/paper/56e63ffea11c875f7eee257798e18cd04e453b6c,Synthetic Benchmarks for Scientific Research in Explainable Machine Learning,"As machine learning models grow more complex and their applications become more high-stakes, tools for explaining model predictions have become increasingly important. This has spurred a flurry of research in model explainability and has given rise to feature attribution methods such as LIME and SHAP. Despite their widespread use, evaluating and comparing different feature attribution methods remains challenging: evaluations ideally require human studies, and empirical evaluation metrics are often data-intensive or computationally prohibitive on realworld datasets. In this work, we address this issue by releasing XAI-BENCH: a suite of synthetic datasets along with a library for benchmarking feature attribution algorithms. Unlike real-world datasets, synthetic datasets allow the efficient computation of conditional expected values that are needed to evaluate groundtruth Shapley values and other metrics. The synthetic datasets we release offer a wide variety of parameters that can be configured to simulate real-world data. We demonstrate the power of our library by benchmarking popular explainability techniques across several evaluation metrics and across a variety of settings. The versatility and efficiency of our library will help researchers bring their explainability methods from development to deployment. Our code is available at https://github.com/abacusai/xai-bench.",,2021,,semantic_scholar,e-commerce,'e-commerce' AND 'machine learning' AND ('real-world' AND 'deploy')
19552c33b6144ba9cf02b52310cfdccdc66b14f2,https://www.semanticscholar.org/paper/19552c33b6144ba9cf02b52310cfdccdc66b14f2,Empirical observation of negligible fairness-accuracy trade-offs in machine learning for public policy,,Nat. Mach. Intell.,2020,10.1038/s42256-021-00396-x,semantic_scholar,e-commerce,'e-commerce' AND 'machine learning' AND ('real-world' AND 'deploy')
b14692c1e0658dd1d814c737171ce714b1588360,https://www.semanticscholar.org/paper/b14692c1e0658dd1d814c737171ce714b1588360,An Intelligent UAV Deployment Scheme for Load Balance in Small Cell Networks Using Machine Learning,"In wireless networks, network load can be highly unbalanced due to the mobility of user equipments (UEs). Unmanned Aerial Vehicles (UAVs) supported base station with the advantage of flexible deployment, ubiquitous wireless coverage and high speed data rate, is a promising approach to handle with the foregoing problem. However, how to achieve cost-effective UAV deployment in an autonomous and dynamic manner is a significant challenge. Facing this problem, we propose a novel UAV base station intelligent deployment scheme based on machine learning and evaluate its performance on a realworld dataset. First, we conduct data preprocessing to process, clean, and transform raw data into formatted data. Missing values are filled by Conditional Mean Imputation (CMI) method and outliers are corrected by pauta criterion. Then, we use hybrid approach which contains ARIMA model and XGBoost model. Linear predictions are carried out by ARIMA model and later nonlinear model XGBoost are applied on residue of ARIMA. Resultant prediction is obtained by adding linear and nonlinear prediction, hybrid model is estimated by Root Mean Square Error (RMSE) and R2 score. Finally, according to predicted results, UAV base stations can be deployed to cater for dynamically changing demands in the hotspot areas and achieve cost-effective deployment. Simulation results show that the propose scheme is superior to other benchmark schemes in load balancing.",2019 IEEE Wireless Communications and Networking Conference (WCNC),2019,10.1109/WCNC.2019.8885648,semantic_scholar,e-commerce,'e-commerce' AND 'machine learning' AND ('real-world' AND 'deploy')
650387bc1ad4ac0a2730303b366749bd3021c779,https://www.semanticscholar.org/paper/650387bc1ad4ac0a2730303b366749bd3021c779,Advanced attack and defense techniques in machine learning systems,"The security of machine learning systems has become a great concern in many realworld applications involving adversaries, including spam filtering, malware detection and e-commerce. There is an increasing trend of study on the security of machine learning systems but the current research is still far from satisfactory. Towards building secure machine learning systems, the first step is to study their vulnerability, which turns out to be very challenging due to the variety and complexity of machine learning systems. Combating adversaries in machine learning systems is even more challenging due to the strategic behavior of the adversaries. This thesis studies both the adversarial threats and the defenses in real-world machine learning systems. Regarding the adversarial threats, we begin by studying label contamination attacks, which is an important type of data poisoning attacks. Then we generalize the conventional data poisoning attacks on single-task learning models to multi-task learning models. Regarding defending against real-world attacks, we first study the spear phishing attacks in email systems and propose a framework for optimizing the personalized email filtering thresholds to mitigate such attacks. Then, we study the fraud transactions in ecommerce systems and propose a deep reinforcement learning based impression allocation mechanism for combating fraudulent sellers. The specific contributions of this thesis are listed below. First, regarding the label contamination attacks, we develop a Projected Gradient Ascent (PGA) algorithm to compute attacks on a family of empirical risk minimizations and show that an attack on one victim model can also be effective on other victim models. This makes it possible that the attacker designs an attack against a substitute model and transfers it to a black-box victim model. Based on the observation of the transferability, we develop a defense algorithm to identify the data points that are most likely to be attacked. Empirical studies show that PGA significantly outperforms existing baselines and linear learning models are better substitute models than nonlinear ones. Second, in the study of data poisoning attacks on muti-task learning models, we formulate the problem of computing optimal poisoning attacks on Multi-Task Relationship Learning (MTRL) as a bilevel program that is adaptive to arbitrary choice of target tasks and attacking tasks. We propose an efficient algorithm called PATOM for computing optimal attack strategies. PATOM leverages the optimality conditions of the subproblem of MTRL to compute the implicit gradients of the upper level objective function. Experimental results on real-world datasets show that MTRL models are very sensitive to poisoning attacks and the attacker can significantly degrade the performance of target tasks, by either directly poisoning the target tasks or indirectly poisoning the related tasks exploiting the task relatedness. We also found that the tasks being attacked are always strongly correlated, which provides a clue for defending against such attacks. Third, on defending against spear phishing email attacks, we consider two important extensions of the previous threat models. First, we consider the cases where multiple users provide access to the same information or credential. Second, we consider attackers who make sequential attack plans based on the outcome of previous attacks. Our analysis starts from scenarios where there is only one credential and then extends to more general scenarios with multiple credentials. For single-credential scenarios, we demonstrate that the optimal defense strategy can be found by solving a binary combinatorial optimization problem called PEDS. For multiple-credential scenarios, we formulate it as a bilevel optimization problem for finding the optimal defense strategy and then reduce it to a single level optimization problem called PEMS using complementary slackness conditions. Experimental results show that both PEDS and PEMS lead to significant higher defender utilities than two existing benchmarks in different parameter settings. Also, both PEDS and PEMS are more robust than the existing benchmarks considering uncertainties. Fourth, on combating fraudulent sellers in e-commerce platforms, we focus on improving the platform’s impression allocation mechanism to maximize its profit and reduce the sellers’ fraudulent behaviors simultaneously. First, we learn a seller behavior model to predict the sellers’ fraudulent behaviors from the real-world data provided by one of the largest e-commerce company in the world. Then, we formulate the platform’s impression allocation problem as a continuous Markov Decision Process (MDP) with unbounded action space. In order to make the action executable in practice and facilitate learning, we propose a novel deep reinforcement learning algorithm DDPG-ANP that introduces an action norm penalty to the reward function. Experimental results show that our algorithm significantly outperforms existing baselines in terms of scalability and solution quality.",,2018,10.32657/10220/47390,semantic_scholar,e-commerce,'e-commerce' AND 'machine learning' AND ('real-world' AND 'deploy')
26937db6917952a9c13bfe152eddd7defc08e695,https://www.semanticscholar.org/paper/26937db6917952a9c13bfe152eddd7defc08e695,Guest Editorial: Special Issue on Machine Learning Implementations,,J. Signal Process. Syst.,2019,10.1007/s11265-018-1432-1,semantic_scholar,e-commerce,'e-commerce' AND 'machine learning' AND ('real-world' AND 'deploy')
15c8125c49001952d25af8d7bcb74ac992affa92,https://www.semanticscholar.org/paper/15c8125c49001952d25af8d7bcb74ac992affa92,Predictive Model for Multiclass Classification of E-Commerce Data: An Azure Machine Learning Approach,"Electronics Commerce (E-Com) is one among the various business methodologies that addresses the growing requirement of business organizations, and customers. The Ecommerce industry is one of the world's leading and growing industries with market worth around $22.1 trillion globally. Through E-Com, companies are developing the competence in business domain. The business giants like Amazon, Flipkart, etc. utilizing Machine Learning (ML) potential to make matchless competitiveness in the market through data analytics and business intelligence. ML has empowered businesses by analyze the data collected through various sources including social media reviews. Data scientists are in huge demand in E-Commerce market researches because predictive data analytics based on ML can enhance sale prospects and discover the reasons of customer churn, by analyzing customer’s reviews and click-through actions, preferences and past purchase history, in real-time. Massive increase in the volume, variety and velocity of data generated through various businesses or E-Commerce platforms pose a huge computational and storage challenge for data analysis and intelligence tasks. Addressing the computational and storage needs for business intelligence tasks, cloud computing paradigm is evolved. The data and computation can be distributed to any Cloud computing environment with minimal effort nowadays. Also, Cloud computing paradigm turned out to be valuable alternatives to speed-up machine learning platforms. The work, first discusses the ‘E-Commerce advantages’, ‘Importance of Machine Learning in E-Commerce Domain’, ‘Cloud Computing and Need of Cloud platforms for Machine Learning tasks’. Also, the background for ‘E-Commerce Product Data Classification Task’ ‘is established. Introduction to multiclass classification and the literature survey for various classification tasks is presented. Finally, a Predictive Model for E-commerce Data Classification Task is proposed and deployed over Microsoft Azure Cloud. The proposed model predicts the Product Class from a large product dataset released by a well-known e-commerce company for a competition. The proposed model is build using ‘Neural Network’ (Multiclass) and R-Script module for better convergence. The obtained results are compared with benchmark model “Multiclass Logistic Regression” and evaluation is done on basis of prediction accuracy. Proposed work also demonstrates the use of one of the foremost cloud environments for machine learning. The results attained by the proposed model are promising and the paper also mentioned the future research work in the field.",,2017,10.5120/IJCA2017914447,semantic_scholar,e-commerce,'e-commerce' AND 'machine learning' AND ('real-world' AND 'deploy')
5994ea254d8e60e9b240cf0c3824b3e5f40df85a,https://www.semanticscholar.org/paper/5994ea254d8e60e9b240cf0c3824b3e5f40df85a,Machine Learning for Indoor Localization Using Mobile Phone-Based Sensors,"In this paper we investigate the problem of localizing a mobile device based on readings from its embedded sensors utilizing machine learning methodologies. We consider a realworld environment, collect a large dataset of 3110 datapoints, and examine the performance of a substantial number of machine learning algorithms in localizing a mobile device. We have found algorithms that give a mean error as accurate as 0.76 meters, outperforming other indoor localization systems reported in the literature. We also propose a hybrid instance-based approach that results in a speed increase by a factor of ten with no loss of accuracy in a live deployment over standard instance-based methods, allowing for fast and accurate localization. Further, we determine how smaller datasets collected with less density affect accuracy of localization, important for use in real-world environments. Finally, we demonstrate that these approaches are appropriate for real-world deployment by evaluating their performance in an online, in-motion experiment.",ArXiv,2015,10.1109/CCNC.2016.7444919,semantic_scholar,e-commerce,'e-commerce' AND 'machine learning' AND ('real-world' AND 'deploy')
fbbee5da12c0e0f15813254b9ffca18e339d3546,https://www.semanticscholar.org/paper/fbbee5da12c0e0f15813254b9ffca18e339d3546,10 - Machine learning for future intelligent air quality networks,"During the last few years, machine learning emerged as a very effective tool for data analysis and sematic value extraction from the large amount of data generated from deployed chemical multisensors devices. Many works have now highlighted the potential impact on multisensor device calibration, drift counteraction, data assimilation, optimal deployment of these classes of algorithms. Unlike 5 years ago, the huge amount of available data make possible to confirm this potential on realworld long-term deployments. This work analyze the literature produced by EuNetAir partners extracting the lessons cooperatively learnt about their impact and propose a novel architecture for future intelligent air quality networks based on the machine learning emerging paradigm.",,2016,10.5162/6EuNetAir2016/10,semantic_scholar,e-commerce,'e-commerce' AND 'machine learning' AND ('real-world' AND 'deploy')
c6bde5c3b6b5bd9cc4c9de2be3a3c4ed48fe4e86,https://www.semanticscholar.org/paper/c6bde5c3b6b5bd9cc4c9de2be3a3c4ed48fe4e86,"Tambe , Developing the Science and Applications of Security Games : Machine Learning , Uncertainty and Preference Elicitation in Game Theory for Security","Having successfully founded the research area of security games, which has led to real-world applications in scheduling the deployment of limited resources (patrols, checkpoints, inspections, etc.), we now provide fundamental advances by incorporating machine learning to enhance realworld security applications, new models of opportunistic security games, robust methods for handling uncertainty, and novel techniques for preference elicitation techniques.",,2015,,semantic_scholar,e-commerce,'e-commerce' AND 'machine learning' AND ('real-world' AND 'deploy')
362edc0f31ca39ad58d473a3872715a04fe516ed,https://www.semanticscholar.org/paper/362edc0f31ca39ad58d473a3872715a04fe516ed,Fair Policy Learning,"Ensuring machine learning algorithms deployed in the real world do not result in unexpected unfairness or social implications is becoming increasingly important. However, there exists a clear gap in literature for a measure of fairness that can detect discrimination against multiple sensitive attributes while also handling continuous or discrete outcomes. In this thesis, we propose a fairness measure, Fair-COCCO, based on the conditional cross-covariance operator on reproducing kernel Hilbert Spaces. This novel method generalise to the majority of existing fairness notions and naturally extends to settings with continuous outcomes and multidimensional sensitive attributes. Additionally, we demonstrate how the proposed measure can be readily implemented in stochastic gradient optimisation for fair policy learning in supervised learning settings. Empirical evaluations of Fair-COCCO on synthetic and realworld experiments reveal favourable comparisons to state-of-the-art techniques in balancing predictive power and fairness. We also see much potential in applying machine learning to analyse fairness in observed behaviour, especially in complex and high-dimensional real-world environments. To that end, we propose the first known definition of fairness for sequences of decisions and showcase how Fair-COCCO can be applied to quantify fairness in these problems. Building off these definitions, we turn to learning fair policies in real-world conditions, where learning is constrained to be performed offline. We propose Fair-PoLe, a novel inverse reinforcement learning that operates completely offline and is computationally efficient and functionally expressive when compared to existing methods. We illustrate the potential for Fair-PoLe to learn policies that balance imitation of expert policies with fair outcomes on the challenging problem of sepsis treatment.",,2021,,semantic_scholar,e-commerce,'e-commerce' AND 'machine learning' AND ('real-world' AND 'deploy')
0966363ea46368f297999b026c827f0f5ea7fcc9,https://www.semanticscholar.org/paper/0966363ea46368f297999b026c827f0f5ea7fcc9,Efficient Machine-Type Communication Using Multi-Metric Context-Awareness for Cars Used as Mobile Sensors in Upcoming 5G Networks,"Upcoming 5G-based communication networks will be confronted with huge increases in the amount of transmitted sensor data related to massive deployments of static and mobile Internet of Things (IoT) systems. Cars acting as mobile sensors will become important data sources for cloud-based applications like predictive maintenance and dynamic traffic forecast. Due to the limitation of available communication resources, it is expected that the grows in Machine-Type Communication (MTC) will cause severe interference with Human-to-human (H2H) communication. Consequently, more efficient transmission methods are highly required. In this paper, we present a probabilistic scheme for efficient transmission of vehicular sensor data which leverages favorable channel conditions and avoids transmissions when they are expected to be highly resource-consuming. Multiple variants of the proposed scheme are evaluated in comprehensive realworld experiments. Through machine learning based combination of multiple context metrics, the proposed scheme is able to achieve up to 164% higher average data rate values for sensor applications with soft deadline requirements compared to regular periodic transmission.",2018 IEEE 87th Vehicular Technology Conference (VTC Spring),2018,10.1109/VTCSpring.2018.8417753,semantic_scholar,e-commerce,'e-commerce' AND 'machine learning' AND ('real-world' AND 'deploy')
114aa720872462b0ca1b97bfdec0ebd56c36fd0a,https://www.semanticscholar.org/paper/114aa720872462b0ca1b97bfdec0ebd56c36fd0a,Towards Understanding and Mitigating Social Biases in Language Models,"Warning: this paper contains model outputs that may be offensive or upsetting. As machine learning methods are deployed in realworld settings such as healthcare, legal systems, and social science, it is crucial to recognize how they shape social biases and stereotypes in these sensitive decision-making processes. Among such real-world deployments are large-scale pretrained language models (LMs) that can be potentially dangerous in manifesting undesirable representational biases harmful biases resulting from stereotyping that propagate negative generalizations involving gender, race, religion, and other social constructs. As a step towards improving the fairness of LMs, we carefully define several sources of representational biases before proposing new benchmarks and metrics to measure them. With these tools, we propose steps towards mitigating social biases during text generation. Our empirical results and human evaluation demonstrate effectiveness in mitigating bias while retaining crucial contextual information for highfidelity text generation, thereby pushing forward the performance-fairness Pareto frontier.",ICML,2021,,semantic_scholar,e-commerce,'e-commerce' AND 'machine learning' AND ('real-world' AND 'deploy')
