paperId,url,title,abstract,venue,year,externalIds.DOI,database,query_name,query_value
ee9e36c0abe8fd1c48aa73d1f83bcbb22fe3670b,https://www.semanticscholar.org/paper/ee9e36c0abe8fd1c48aa73d1f83bcbb22fe3670b,Hyper-Tune: Towards Efficient Hyper-parameter Tuning at Scale,"The ever-growing demand and complexity of machine learning are putting pressure on hyper-parameter tuning systems: while the evaluation cost of models continues to increase, the scalability of state-of-the-arts starts to become a crucial bottleneck. In this paper, inspired by our experience when deploying hyper-parameter tuning in a real-world application in production and the limitations of existing systems, we propose Hyper-Tune, an efficient and robust distributed hyper-parameter tuning framework. Compared with existing systems, Hyper-Tune highlights multiple system optimizations, including (1) automatic resource allocation, (2) asynchronous scheduling, and (3) multi-fidelity optimizer. We conduct extensive evaluations on benchmark datasets and a large-scale realworld dataset in production. Empirically, with the aid of these optimizations, Hyper-Tune outperforms competitive hyper-parameter tuning systems on a wide range of scenarios, including XGBoost, CNN, RNN, and some architectural hyper-parameters for neural networks. Compared with the state-of-the-art BOHB and A-BOHB, Hyper-Tune achieves up to 11.2× and 5.1× speedups, respectively. PVLDB Reference Format: Yang Li, Yu Shen, Huaijun Jiang, Wentao Zhang, Jixiang Li, Ji Liu, Ce Zhang, and Bin Cui. Hyper-Tune: Towards Efficient Hyper-parameter Tuning at Scale. PVLDB, 14(1): XXX-XXX, 2020. doi:XX.XX/XXX.XX PVLDB Availability Tag: The source code of this research paper has been made publicly available at https://github.com/PKU-DAIR/HyperTune.",Proc. VLDB Endow.,2022,,semantic_scholar,e-commerce,'e-commerce' AND 'machine learning' AND ('real-world' AND 'deploy')
dba3478cb46874a97e301deb0f20f7692c1f1ae9,https://www.semanticscholar.org/paper/dba3478cb46874a97e301deb0f20f7692c1f1ae9,PenDer: Incorporating Shape Constraints via Penalized Derivatives,"When deploying machine learning models in the real-world, system designers may wish that models exhibit certain shape behavior, i.e., model outputs follow a particular shape with respect to input features. Trends such as monotonicity, convexity, diminishing or accelerating returns are some of the desired shapes. Presence of these shapes makes the model more interpretable for the system designers, and adequately fair for the customers. We notice that many such common shapes are related to derivatives, and propose a new approach, PenDer (Penalizing Derivatives), which incorporates these shape constraints by penalizing the derivatives. We further present an Augmented Lagrangian Method (ALM) to learn the joint unconstrained objective function. Experiments on three realworld datasets illustrate that even though both PenDer and state-of-the-art Lattice models achieve similar conformance to shape, PenDer captures better sensitivity of prediction with respect to intended features. We also demonstrate that PenDer achieves better test performance than Lattice while enforcing more desirable shape behavior.",AAAI,2021,,semantic_scholar,e-commerce,'e-commerce' AND 'machine learning' AND ('real-world' AND 'deploy')
d3ac65b10af091759863b8e2c488036bf52a2ce6,https://www.semanticscholar.org/paper/d3ac65b10af091759863b8e2c488036bf52a2ce6,DAG Card is the new Model Card,"With the progressive commoditization of modeling capabilities, data-centric AI recognizes that what happens before and after training becomes crucial for realworld deployments. Following the intuition behind Model Cards, we propose DAG Cards as a form of documentation encompassing the tenets of a data-centric point of view. We argue that Machine Learning pipelines (rather than models) are the most appropriate level of documentation for many practical use cases, and we share with the community an open implementation to generate cards from code.",ArXiv,2021,,semantic_scholar,e-commerce,'e-commerce' AND 'machine learning' AND ('real-world' AND 'deploy')
7d6e9e6e39c70b947296cb4c17aacf4452fc5b29,https://www.semanticscholar.org/paper/7d6e9e6e39c70b947296cb4c17aacf4452fc5b29,Exploring the Use of Synthetic Gradients for Distributed Deep Learning across Cloud and Edge Resources,"With the explosive growth of data, largely contributed by the rapidly and widely deployed smart devices on the edge, we need to rethink the training paradigm for learning on such realworld data. The conventional cloud-only approach can hardly keep up with the computational demand from these deep learning tasks; and the traditional back propagation based training method also makes it difficult to scale out the training. Fortunately, the continuous advancement in System on Chip (SoC) hardware is transforming edge devices into capable computing platforms, and can potentially be exploited to address these challenges. These observations have motivated this paper’s study on the use of synthetic gradients for distributed training cross cloud and edge devices. We employ synthetic gradients into various neural network models to comprehensively evaluate its feasibility in terms of accuracy and convergence speed. We distribute the training of the various layers of a model using synthetic gradients, and evaluate its effectiveness on the edge by using resource-limited containers to emulate edge devices. The evaluation result shows that the synthetic gradient approach can achieve comparable accuracy compared to the conventional back propagation, for an eight-layer model with both fully-connected and convolutional layers. For a more complex model (VGG16), the training suffers from some accuracy degradation (up to 15%). But it achieves 11% improvement in training speed when the layers of a model are decoupled and trained on separate resource-limited containers, compared to the training of the whole model using the conventional method on the physical machine.",HotEdge,2019,,semantic_scholar,e-commerce,'e-commerce' AND 'machine learning' AND ('real-world' AND 'deploy')
f02f6e666aef6b0675cc4a189f9962b716c17487,https://www.semanticscholar.org/paper/f02f6e666aef6b0675cc4a189f9962b716c17487,FARE: Enabling Fine-grained Attack Categorization under Low-quality Labeled Data,"Supervised machine learning classifiers have been widely used for attack detection, but their training requires abundant high-quality labels. Unfortunately, high-quality labels are difficult to obtain in practice due to the high cost of data labeling and the constant evolution of attackers. Without such labels, it is challenging to train and deploy targeted countermeasures. In this paper, we propose FARE, a clustering method to enable fine-grained attack categorization under low-quality labels. We focus on two common issues in data labels: 1) missing labels for certain attack classes or families; and 2) only having coarsegrained labels available for different attack types. The core idea of FARE is to take full advantage of the limited labels while using the underlying data distribution to consolidate the lowquality labels. We design an ensemble model to fuse the results of multiple unsupervised learning algorithms with the given labels to mitigate the negative impact of missing classes and coarsegrained labels. We then train an input transformation network to map the input data into a low-dimensional latent space for fine-grained clustering. Using two security datasets (Android malware and network intrusion traces), we show that FARE significantly outperforms the state-of-the-art (semi-)supervised learning methods in clustering quality/correctness. Further, we perform an initial deployment of FARE by working with a large e-commerce service to detect fraudulent accounts. With realworld A/B tests and manual investigation, we demonstrate the effectiveness of FARE to catch previously-unseen frauds.",NDSS,2021,10.14722/NDSS.2021.24403,semantic_scholar,e-commerce,'e-commerce' AND 'machine learning' AND ('real-world' AND 'deploy')
0f5dc98f4ad051b7e49aa31cfc8fae5c2b532a1e,https://www.semanticscholar.org/paper/0f5dc98f4ad051b7e49aa31cfc8fae5c2b532a1e,Using system context information to complement weakly labeled data,"Real-world datasets collected with sensor networks often contain incomplete and uncertain labels as well as artefacts arising from the system environment. Complete and reliable labeling is often infeasible for large-scale and long-term sensor network deployments due to the labor and time overhead, limited availability of experts and missing ground truth. In addition, if the machine learning method used for analysis is sensitive to certain features of a deployment, labeling and learning needs to be repeated for every new deployment. To address these challenges, we propose to make use of system context information formalized in an information graph and embed it in the learning process via contrastive learning. Based on realworld data we show that this approach leads to an increased accuracy in case of weakly labeled data and leads to an increased robustness and transferability of the classifier to new sensor locations.",ArXiv,2021,,semantic_scholar,e-commerce,'e-commerce' AND 'machine learning' AND ('real-world' AND 'deploy')
3352eb2b731571ca9ba85e671a214b2e2467d8d9,https://www.semanticscholar.org/paper/3352eb2b731571ca9ba85e671a214b2e2467d8d9,Online and Scalable Model Selection with Multi-Armed Bandits,"Many online applications running on live traffic are powered by machine learning models, for which training, validation, and hyperparameter tuning are conducted on historical data. However, it is common for models demonstrating strong performance in offline analysis to yield poorer performance when deployed online. This problem is a consequence of the difficulty of training on historical data in non-stationary environments. Moreover, the machine learning metrics used for model selection may not sufficiently correlate with real-world business metrics used to determine the success of the applications being tested. These problems are particularly prominent in the Real-Time Bidding (RTB) domain, in which ML models power bidding strategies, and a change in models will likely affect performance of the advertising campaigns. In this work, we present Automatic Model Selector (AMS), a system for scalable online selection of RTB bidding strategies based on realworld performance metrics. AMS employs Multi-Armed Bandits (MAB) to near-simultaneously run and evaluate multiple models against live traffic, allocating the most traffic to the bestperforming models while decreasing traffic to those with poorer online performance, thereby minimizing the impact of inferior models on overall campaign performance. The reliance on offline data is avoided, instead making model selections on a case-by-case basis according to actionable business goals. AMS allows new models to be safely introduced into live campaigns as soon as they are developed, minimizing the risk to overall performance. In livetraffic tests on multiple ad campaigns, the AMS system proved highly effective at improving ad campaign performance.",ArXiv,2021,,semantic_scholar,e-commerce,'e-commerce' AND 'machine learning' AND ('real-world' AND 'deploy')
34c59ec266e2f1798918d765c2a2519a2b8d03d2,https://www.semanticscholar.org/paper/34c59ec266e2f1798918d765c2a2519a2b8d03d2,ReLink: Complete-Link Industrial Record Linkage Over Hybrid Feature Spaces,"Record Linkage (ReL) is the task of identifying records from a pair of databases referring to the same realworld entity. This has many applications in organisations of all sizes where related data often exist in silos leading to inefficiency in data engineering and analytics applications as well as ineffectiveness of business applications (e.g., unable to personalise marketing campaigns).State-of-the-art (SOTA) machine learning and deep learning based ReL techniques use adaptive similarity measures and learn their relative contributions based on labeled data. However, we report here that they do not work with similar efficacy on industrial data owing to its fundamental differences such as magnitude of schema heterogeneity, need for leveraging structure of the data, lack of training data etc. Through our proposed system ‘ReLink’, we carefully mitigate these challenges and demonstrate that it not only significantly outperforms SOTA baselines on industrial datasets but also on majority of research benchmarks. ReLink introduces the notion of complete-linkage over attributes as well as uses hybrid feature spaces on lexical and semantic similarity measures using pre-trained models such as BERT. Going beyond empirical demonstration, we provide insights and prescriptive guidance on choice of ReL techniques in industrial settings from our observations and lessons learnt from the experience of transferring and deploying for real use-cases in a large financial services organization.",2021 IEEE 37th International Conference on Data Engineering (ICDE),2021,10.1109/ICDE51399.2021.00293,semantic_scholar,e-commerce,'e-commerce' AND 'machine learning' AND ('real-world' AND 'deploy')
320e3a66dbc51a1331f65b5ac42b937a39d5e051,https://www.semanticscholar.org/paper/320e3a66dbc51a1331f65b5ac42b937a39d5e051,Physical Activity Recognition With Statistical-Deep Fusion Model Using Multiple Sensory Data for Smart Health,"Nowadays, enhancing the living standard with smart healthcare via the Internet of Things is one of the most critical goals of smart cities, in which artificial intelligence plays as the core technology. Many smart services, deployed according to wearable sensor-based physical activity recognition, have been able to early detect unhealthy daily behaviors and further medical risks. Numerous approaches have studied shallow handcrafted features coupled with traditional machine learning (ML) techniques, which find it difficult to model real-world activities. In this work, by revealing deep features from deep convolutional neural networks (DCNNs) in fusion with conventional handcrafted features, we learn an intermediate fusion framework of human activity recognition (HAR). According to transforming the raw signal value to pixel intensity value, segmentation data acquired from a multisensor system are encoded to an activity image for deep model learning. Formulated by several novel residual triple convolutional blocks, the proposed DCNN allows extracting multiscale spatiotemporal signal-level and sensor-level correlations simultaneously from the activity image. In the fusion model, the hybrid feature merged from the handcrafted and deep features is learned by a multiclass support vector machine (SVM) classifier. Based on several experiments of performance evaluation, our fusion approach for activity recognition has achieved the accuracy over 96.0% on three public benchmark data sets, including Daily and Sport Activities, Daily Life Activities, and RealWorld. Furthermore, the method outperforms several state-of-the-art HAR approaches and demonstrates the superiority of the proposed intermediate fusion model in multisensor systems.",IEEE Internet of Things Journal,2021,10.1109/JIOT.2020.3013272,semantic_scholar,e-commerce,'e-commerce' AND 'machine learning' AND ('real-world' AND 'deploy')
de3259f91d4ae41430b9a2da536b761e483d5bf6,https://www.semanticscholar.org/paper/de3259f91d4ae41430b9a2da536b761e483d5bf6,Auto Content Moderation in C2C e-Commerce,"Consumer-to-consumer (C2C) e-Commerce is a large and growing industry with millions of monthly active users. In this paper, we propose auto content moderation for C2C eCommerce to moderate items using Machine Learning (ML). We will also discuss practical knowledge gained from our auto content moderation system. The system has been deployed to production at Mercari since late 2017 and has significantly reduced the operation cost in detecting items violating our policies. This system has increased coverage by 554.8 % over a rule-based approach.",OpML,2020,,semantic_scholar,e-commerce,'e-commerce' AND 'machine learning' AND ('real-world' AND 'deploy')
06d5581ec3f28166cdba265f7da8655eef706d23,https://www.semanticscholar.org/paper/06d5581ec3f28166cdba265f7da8655eef706d23,A machine-learned proactive moderation system for auction fraud detection,"Online auction and shopping are gaining popularity with the growth of web-based eCommerce. Criminals are also taking advantage of these opportunities to conduct fraudulent activities against honest parties with the purpose of deception and illegal profit. In practice, proactive moderation systems are deployed to detect suspicious events for further inspection by human experts. Motivated by real-world applications in commercial auction sites in Asia, we develop various advanced machine learning techniques in the proactive moderation system. Our proposed system is formulated as optimizing bounded generalized linear models in multi-instance learning problems, with intrinsic bias in selective labeling and massive unlabeled samples. In both offline evaluations and online bucket tests, the proposed system significantly outperforms the rule-based system on various metrics, including area under ROC (AUC), loss rate of labeled frauds and customer complaints. We also show that the metrics of loss rates are more effective than AUC in our cases.",CIKM '11,2011,10.1145/2063576.2064002,semantic_scholar,e-commerce,'e-commerce' AND 'machine learning' AND ('real-world' AND 'deploy')
69f91edaf5abc963a9b9b121d1f8bc851333e133,https://www.semanticscholar.org/paper/69f91edaf5abc963a9b9b121d1f8bc851333e133,Active Learning in the Era of Big Data,"Active learning methods automatically adapt data collection by selecting the most informative samples in order to accelerate machine learning. Because of this, real-world testing and comparing active learning algorithms requires collecting new datasets (adaptively), rather than simply applying algorithms to benchmark datasets, as is the norm in (passive) machine learning research. To facilitate the development, testing and deployment of active learning for real applications, we have built an open-source software system for large-scale active learning research and experimentation. The system, called NEXT, provides a unique platform for realworld, reproducible active learning research. This paper details the challenges of building the system and demonstrates its capabilities with several experiments. The results show how experimentation can help expose strengths and weaknesses of active learning algorithms, in sometimes unexpected and enlightening ways.",,2015,10.2172/1225849,semantic_scholar,e-commerce,'e-commerce' AND 'machine learning' AND ('real-world' AND 'deploy')
6af4abe9f3360b2817db4a655e1d3486754ba6b0,https://www.semanticscholar.org/paper/6af4abe9f3360b2817db4a655e1d3486754ba6b0,Large-scale learning for media understanding,,EURASIP J. Image Video Process.,2015,10.1186/S13640-015-0080-7,semantic_scholar,e-commerce,'e-commerce' AND 'machine learning' AND ('real-world' AND 'deploy')
10bbc5556fe6b79b18bb986af5e601b7ac7ab114,https://www.semanticscholar.org/paper/10bbc5556fe6b79b18bb986af5e601b7ac7ab114,LTF: A Label Transformation Framework for Correcting Target Shift,"Distribution shift is a major obstacle to the deployment of current deep learning models on realworld problems. Let Y be the target (label) and X the predictors (features). We focus on one type of distribution shift, target shift, where the marginal distribution of the target variable PY changes but the conditional distribution PX|Y does not. Existing methods estimate the density ratio between the sourceand target-domain label distributions by density matching. However, these methods are either computationally infeasible for large-scale data or restricted to shift correction for discrete labels. In this paper, we propose an end-to-end Label Transformation Framework (LTF) for correcting target shift, which implicitly models the shift of PY and the conditional distribution PX|Y using neural networks. Thanks to the flexibility of deep networks, our framework can handle continuous, discrete, and even multidimensional labels in a unified way and is scalable to large data. Moreover, for high dimensional X , such as images, we find that the redundant information in X severely degrades the estimation accuracy. To remedy this issue, we propose to match the distribution implied by our generative model and the target-domain distribution in a low-dimensional feature space that discards information irrelevant to Y . Both theoretical and empirical studies demonstrate the superiority of our method over previous approaches. UBTECH Sydney AI Centre, School of Computer Science, Faculty of Engineering, The University of Sydney, Darlington, NSW 2008, Australia School of Mathematics and Statistics, The University of Melbourne Department of Philosophy, Carnegie Mellon University. Correspondence to: Jiaxian Guo <jguo5934@uni.sydney.edu.au>. Proceedings of the 37 th International Conference on Machine Learning, Vienna, Austria, PMLR 119, 2020. Copyright 2020 by the author(s).",,2020,,semantic_scholar,e-commerce,'e-commerce' AND 'machine learning' AND ('real-world' AND 'deploy')
a6c7b3c141f6c604e08fee902fa268665b8a4221,https://www.semanticscholar.org/paper/a6c7b3c141f6c604e08fee902fa268665b8a4221,Simple linear classifiers via discrete optimization: learning certifiably optimal scoring systems for decision-making and risk assessment,"Scoring systems are linear classification models that let users make quick predictions by adding, subtracting, and multiplying a few small numbers. These models are widely used in applications where humans have traditionally made decisions because they are easy to understand and validate. In spite of extensive deployment, many scoring systems are still built using ad hoc approaches that combine statistical techniques, heuristics, and expert judgement. Such approaches impose steep trade-offs with performance, making it difficult for practitioners to build scoring systems that will be used and accepted. In this dissertation, we present two new machine learning methods to learn scoring systems from data: Supersparse Linear Integer Models (SLIM) for decision-making applications; and Risk-calibrated Supersparse Linear Integer Models (RiskSLIM) for risk assessment applications. Both SLIM and RiskSLIM solve discrete optimization problems to learn scoring systems that are fully optimized for feature selection, small integer coefficients, and operational constraints. We formulate these problems as integer programming problems and develop specialized algorithms to recover certifiably optimal solutions with an integer programming solver. We illustrate the benefits of this approach by building scoring systems for realworld problems such as recidivism prediction, sleep apnea screening, ICU seizure prediction, and adult ADHD diagnosis. Our results show that a discrete optimization approach can learn simple models that perform well in comparison to the state-ofthe-art, but that are far easier to customize, understand, and validate. Thesis Supervisor: Cynthia Rudin Title: Associate Professor of Computer Science Duke University",,2017,,semantic_scholar,e-commerce,'e-commerce' AND 'machine learning' AND ('real-world' AND 'deploy')
6a2a534a9d01b76ecb5caba20032022a904cb50d,https://www.semanticscholar.org/paper/6a2a534a9d01b76ecb5caba20032022a904cb50d,COSMIC Semantic Segmentation Framework,"Deep space missions such as the Mars Reconnaissance Orbiter collect more data than can be sent back to Earth due to limited communications bandwidth. Machine learning algorithms can be deployed on board orbiters to prioritize the downlink of scientifically interesting images, such as those including fresh impact craters, recurring slope lineae, or dust devils. However, basic machine learning research is necessary to boost realworld performance, and numerous possible convolutional neural network architectures must be evaluated in terms of accuracy and compute requirements. A framework is designed to reduce redundant development, to standardize the algorithm testing process, and to allow developers to focus on the implementation details of novel machine learning algorithms. Three convolutional neural network implementations are included with the framework, pending use in future research. 1Content-based Onboard Summarization to Monitor Infrequent Change 2CL #18-465",,2019,,semantic_scholar,e-commerce,'e-commerce' AND 'machine learning' AND ('real-world' AND 'deploy')
