paperId,url,title,abstract,venue,year,externalIds.DOI,database,query_name,query_value
7f5000f69c30d34f6c1a4ba14d8dbfd0fe5254d2,https://www.semanticscholar.org/paper/7f5000f69c30d34f6c1a4ba14d8dbfd0fe5254d2,"Big Data Analytics Using Splunk: Deriving Operational Intelligence from Social Media, Machine Data, Existing Data Warehouses, and Other Real-Time Streaming Sources","Big Data Analytics Using Splunk is a hands-on book showing how to process and derive business value from big data in real time. Examples in the book draw from social media sources such as Twitter (tweets) and Foursquare (check-ins). You also learn to draw from machine data, enabling you to analyze, say, web server log files and patterns of user access in real time, as the access is occurring. Gone are the days when you need be caught out by shifting public opinion or sudden changes in customer behavior. Splunks easy to use engine helps you recognize and react in real time, as events are occurring. Splunk is a powerful, yet simple analytical tool fast gaining traction in the fields of big data and operational intelligence. Using Splunk, you can monitor data in real time, or mine your data after the fact. Splunks stunning visualizations aid in locating the needle of value in a haystack of a data. Geolocation support spreads your data across a map, allowing you to drill down to geographic areas of interest. Alerts can run in the background and trigger to warn you of shifts or events as they are taking place. With Splunk you can immediately recognize and react to changing trends and shifting public opinion as expressed through social media, and to new patterns of eCommerce and customer behavior. The ability to immediately recognize and react to changing trends provides a tremendous advantage in todays fast-paced world of Internet business. Big Data Analytics Using Splunk opens the door to an exciting world of real-time operational intelligence. Built around hands-on projects Shows how to mine social media Opens the door to real-time operational intelligenceWhat youll learn Monitor and mine social media for trends affecting your business Know how you are perceived, and when that perception is rising or falling Detect changing customer behavior from mining your operational data Collect and analyze in real time, or from historical files Apply basic analytical metrics to better understand your data Create compelling visualizations and easily communicate your findings Who this book is for Big Data Analytics Using Splunk is for those who are interested in exploring the heaps of data they have available, but dont know where to start. It is for the people who have knowledge of the data they want to analyze and are developers or SQL programmers at a level anywhere between beginners and intermediate. Expert developers also benefit from learning how to use such a simple and powerful tool as Splunk. Table of Contents Part I: Splunk's Basic Operation: Getting to Know Splunk Part I: Splunk's Basic Operation: Getting Data into Splunk Part I: Splunk's Basic Operation: Processing and Analysing the Data Part I: Splunk's Basic Operation: Visualizing the Results Part I: Splunk's Basic Operation: Defining Alerts. Part I: Splunk's Basic Operation: Web SiteMonitoring Part I: Splunk's Basic Operation: Using Log Files to Create Advanced Analytics Part II: Airline On-Time Performance Project: On-Time Project Description Part II: Airline On-Time Performance Project: Getting Flight Data Into Splunk Part II: Airline On-Time Performance Project: Analyzing Airlines, Airports, Flights, and Delays Part II: Airline On-Time Performance Project: Analyzing a Specific Flight over Time Part III: Social Media: Analyzing Twitter Data Part III: Social Media: Analyzing Foursquare Check-Ins Part III: Social Media: Sentiment Analysis Part IV: Architecture and Deployment: Distributed Topologies Part IV: Architecture and Deployment: High Availability Appendix A: The Performance of Splunk Appendix B: Related Applications",,2013,,semantic_scholar,e-commerce,'e-commerce' AND 'machine learning' AND ('real-world' AND 'deploy')
8061d521fe7c62430e1ba2cb0b8f4d19f7366e6f,https://www.semanticscholar.org/paper/8061d521fe7c62430e1ba2cb0b8f4d19f7366e6f,Multi Uav Cooperative Surveillance With Spatio Temporal,"Deep Learning for Unmanned SystemsMultiple Heterogeneous Unmanned Aerial VehiclesAdvanced Mobile RoboticsSafe Robot Navigation Among Moving and Steady ObstaclesComputer Safety, Reliability, and SecurityAdvances in Swarm IntelligenceHolonic and Multi-Agent Systems for ManufacturingAdvances in Artificial Intelligence and Applied Cognitive ComputingUnmanned Aircraft SystemsIntelligent Computing Theories and ApplicationAutonomous Airborne Wireless NetworksAd Hoc NetworksEnabling Blockchain Technology for Secure Networking and CommunicationsUAV Sensors for Environmental MonitoringUnmanned Aerial Vehicles: Breakthroughs in Research and PracticeComputational Collective IntelligenceTime-Critical Cooperative Control of Autonomous Air VehiclesAdvances in Cooperative Control and OptimizationCooperative Robots and Sensor Networks 2015Artificial Intelligence and SecurityPRICAI 2016: Trends in Artificial IntelligenceClosing the Gap Between Research and Field Applications for Multi-UAV Cooperative MissionsMulti-rotor Platform Based UAV SystemsProceedings of the Future Technologies Conference (FTC) 2020, Volume 1Unmanned Aerial SystemsAdvanced Distributed Consensus for Multiagent SystemsCooperative Control of MultiAgent SystemsMulti-UAV Planning and Task AllocationMobile Internet SecurityCooperative Control of Multiple Unmanned Aerial Vehicles with Application to Forest Fire Detection and FightingMulti UAV Systems with Motion and Communication ConstraintsIntelligent Autonomy of UAVsIntelligent and Fuzzy Techniques in Big Data Analytics and Decision MakingIntelligent Autonomy of UAVsUAV Cooperative Decision and ControlCooperative Localization and NavigationAdvances in Guidance, Navigation and ControlMachine Learning and Intelligent CommunicationsUnmanned Aerial VehiclesThe Cognitive Approach in Cloud Computing and Internet of Things Technologies for Surveillance Tracking Systems Ad hoc networks, which include a variety of autonomous networks for specific purposes, promise a broad range of civilian, commercial, and military applications. These networks were originally envisioned as collections of autonomous mobile or stationary nodes that dynamically auto-configure themselves into a wireless network without relying on any existing network infrastructure or centralized administration. With the significant advances in the last decade, the concept of ad hoc networks now covers an even broader scope, referring to the many types of autonomous wireless networks designed and deployed for a specific task or function, such as wireless sensor networks, vehicular networks, home networks, and so on. In contrast to the traditional wireless networking paradigm, such networks are all characterized by sporadic connections, highly error-prone communications, distributed autonomous operation, and fragile multi-hop relay paths. The new wireless networking paradigm necessitates reexamination of many established concepts and protocols, and calls for developing a new understanding of fundamental problems such as interference, mobility, connectivity, capacity, and security, among others. While it is essential to advance theoretical research on fundamental and practical research on efficient policies, algorithms and protocols, it is also critical to develop useful applications, experimental prototypes, and real-world deployments to achieve an immediate impact on society for the success of this wireless networking paradigm.A comprehensive review of the state of the art in the control of multi-agent systems theory and applications The superiority of multi-agent systems over single agents for the control of unmanned air, water and ground vehicles has been clearly demonstrated in a wide range of application areas. Their large-scale spatial distribution, robustness, high scalability and low cost enable multi-agent systems to achieve tasks that could not successfully be performed by even the most sophisticated single agent systems. Cooperative Control of Multi-Agent Systems: Theory and Applications provides a wide-ranging review of the latest developments in the cooperative control of multi-agent systems theory and applications. The applications described are mainly in the areas of unmanned aerial vehicles (UAVs) and unmanned ground vehicles (UGVs). Throughout, the authors link basic theory to multi-agent cooperative control practice — illustrated within the context of highly-realistic scenarios of high-level missions — without losing site of the mathematical background needed to provide performance guarantees under general working conditions. Many of the problems and solutions considered involve combinations of both types of vehicles. Topics explored include target assignment, target tracking, consensus, stochastic game theory-based framework, event-triggered control, topology design and identification, coordination under uncertainty and coverage control. Establishes a bridge between fundamental cooperative control theory and specific problems of interest in a wide range of applications areas Includes example applications from the fields of space exploration, radiation shielding, site clearance, tracking/classification, surveillance, search-and-rescue and more Features detailed presentations of specific algorithms and application frameworks with relevant commercial and military applications Provides a comprehensive look at the latest developments in this rapidly evolving field, while offering informed speculation on future directions for collective control systems The use of multi-agent system technologies in both everyday commercial use and national defense is certain to increase tremendously in the years ahead, making this book a valuable resource for researchers, engineers, and applied mathematicians working in systems and controls, as well as advanced undergraduates and graduate students interested in those areas.Time-Critical Cooperative Control of Autonomous Air Vehicles presents, in an easy-to-read style, the latest research conducted in the industry, while also introducing a set of novel ideas that illuminate a new approach to problem-solving. The book is virtually self-contained, giving the reader a complete, integrated presentation of the different concepts, mathematical tools, and control solutions needed to tackle and solve a number of problems concerning time-critical cooperative control of UAVs. By including case studies of fixed-wing and multirotor UAVs, the book effectively broadens the scope of application of the methodologies developed. This theoretical presentation is complemented with the results of flight tests with real UAVs, and is an ideal reference for researchers and practitioners from academia, research labs, commercial companies, government workers, and those in the international aerospace industry. Addresses important topics related to time-critical cooperative control of UAVs Describes solutions to the problems rooted in solid dynamical systems theory Applies the solutions developed to fixed-wing and multirotor UAVs Includes the results of field tests with both classes of UAVsThis book provides the state-of-the-art intelligent methods and techniques for solving realworld problems along with a vision of the future research. The fifth 2020 Future Technologies Conference was organized virtually and received a total of 590 submissions from academic pioneering researchers, scientists, industrial engineers, and students from all over the world. The submitted papers covered a wide range of important topics including but not limited to computing, electronics, artificial intelligence, robotics, security and communications and their applications to the real world. After a double-blind peer review process, 210 submissions (including 6 poster papers) have been selected to be included in these proceedings. One of the meaningful and valuable dimensions of this conference is the way it brings together a large group of technology geniuses in one venue to not only present breakthrough research in future technologies, but also to promote discussions and debate of relevant issues, challenges, opportunities and research findings. The authors hope that readers find the book interesting, exciting and inspiringAdvanced Distributed Consensus for Multiagent Systems contributes to the further development of advanced distributed consensus methods for different classes of multiagent methods. The book expands the field of coordinated multiagent dynamic systems, including discussions on swarms, multi-vehicle and swarm robotics. In addition, it addresses advanced distributed methods for the important topic of multiagent systems, with a goal of providing a high-level treatment of consensus to different versions while preserving systematic analysis of the material and providing an accounting to math development in a unified way. This book is suitable for graduate courses in electrical, mechanical and computer science departments. Consensus control in multiagent systems is becoming increasingly popular among researchers due to its applicability in analyzing and designing coordination behaviors among agents in multiagent frameworks. Multiagent systems have been a fascinating subject amongst researchers as their practical applications span multiple fields ranging from robotics, control theory, systems biology, evolutionary biology, power systems, social and political systems to mention a few. Gathers together the theoretical preliminaries and fundamental issues related to multiagent systems and controls Provides coherent results on adopting a multiagent framework for critically examining problems in smart microgrid systems Presents advanced analysis of multiagent systems under cyberphysical attacks and develops resilient control strategies to guarantee safe operationComplete with online files and updates, this cutting-edge text looks at the next generation of unmanned flying machines. Aerial robots can be considered as an evolution of the Unmanned Aerial Vehicl",,2021,,semantic_scholar,e-commerce,'e-commerce' AND 'machine learning' AND ('real-world' AND 'deploy')
aa30901b02e9923851d507e1f2726bcf9ef1b068,https://www.semanticscholar.org/paper/aa30901b02e9923851d507e1f2726bcf9ef1b068,OccuSpace: Towards a Robust Occupancy Prediction System for Activity Based Workplace,"Workplace occupancy detection is becoming increasingly important in large Activity Based Work (ABW) environments as it helps building and office management understand the utilisation and potential benefits of shared workplace. However, existing sensor-based technologies detect workstation occupancy in indoor spaces require extensive installation of hardware and maintenance incurring ongoing costs. Moreover, accuracy can depend on the specific seating styles of workers since the sensors are usually placed under the table or overhead. In this research, we provide a robust system called OccuSpace to predict occupancy of different atomic zones in large ABW environments. Unlike fixed sensors, OccuSpace uses statistical features engineered from Received Signal Strength Indicator (RSSI) of Bluetooth card beacons carried by workers while they are within the ABW environment. These features are used to train state-of-the-art machine learning algorithms for prediction task. We setup the experiment by deploying our system in a realworld open office environment. The experimental results show that OccuSpace is able to achieve a high accuracy for workplace occupancy prediction.",2019 IEEE International Conference on Pervasive Computing and Communications Workshops (PerCom Workshops),2019,10.1109/PERCOMW.2019.8730762,semantic_scholar,e-commerce,'e-commerce' AND 'machine learning' AND ('real-world' AND 'deploy')
f984227f8186fc4de590b6371184a772eed3bb79,https://www.semanticscholar.org/paper/f984227f8186fc4de590b6371184a772eed3bb79,Hands-on Exercises and Assignments on Google Cloud Platform,"It has been challenging for instructors in the MIS/IST discipline to engage students by using a lectureonly teaching technique. This paper presents a set of nifty assignments that consist of the instructor-led hands-on exercises and the take-home individual assignments in an introductory MIS course. Students were instructed to use an online tool to exchange encrypted messages and use Google Cloud Platform (GCP) to deploy virtual machines running PrestaShop, an eCommerce application. The results of a student survey showed that the assignments were fun, relevant, useful, and helpful in improving the students’ engagement and learning.",AMCIS,2018,,semantic_scholar,e-commerce,'e-commerce' AND 'machine learning' AND ('real-world' AND 'deploy')
22301300c381e0f3a4dbb67e72622d9546f38037,https://www.semanticscholar.org/paper/22301300c381e0f3a4dbb67e72622d9546f38037,FEATURE SELECTION USING MODIFIED ANT COLONY OPTIMIZATION APPROACH ( FS-MACO ) BASED FIVE LAYERED ARTIFICIAL NEURAL NETWORK FOR CROSS DOMAIN OPINION MINING,"Web mining and web usage mining are attracting many researchers to propose new ideas, models, deploying machine learning algorithms and more. Internet usage expands its wings to almost all kind of applications which includes e-commerce. E-commerce facilitates the consumers/customers to buy the products online and at the same time, web analytics helps the website administrators to identify which products sell more. Opinion mining is the key to analytics in many decision-making tasks in the ecommerce arena. This research work aims to propose feature election using modified ant colony optimization approach (FS-MACO) based five layered artificial neural networks for cross-domain opinion mining. Dataset is obtained which consists of reviews about products such as books, DVDs, electronics and kitchen appliances. The features are identified by making use of modified ACO and opinion mining is performed by using ANN. Accuracy and F-measure are the metrics chosen for the evaluating the performance of the proposed work. Comparison of domain-specific and domain – dependent words are presented. Results portray that the proposed work outperforms better than that of the existing work in terms of the chosen performance metrics.",,2018,,semantic_scholar,e-commerce,'e-commerce' AND 'machine learning' AND ('real-world' AND 'deploy')
a812368fe1d4a186322bf72a6d07e1cf60067234,https://www.semanticscholar.org/paper/a812368fe1d4a186322bf72a6d07e1cf60067234,Gaussian processes for modeling of facial expressions,"Automated analysis of facial expressions has been gaining significant attention over the past years. This stems from the fact that it constitutes the primal step toward developing some of the next-generation computer technologies that can make an impact in many domains, ranging from medical imaging and health assessment to marketing and education. No matter the target application, the need to deploy systems under demanding, realworld conditions that can generalize well across the population is urgent. Hence, careful consideration of numerous factors has to be taken prior to designing such a system. The work presented in this thesis focuses on tackling two important problems in automated analysis of facial expressions: (i) view-invariant facial expression analysis; (ii) modeling of the structural patterns in the face, in terms of well coordinated facial muscle movements. Driven by the necessity for efficient and accurate inference mechanisms we explore machine learning techniques based on the probabilistic framework of Gaussian processes (GPs). Our ultimate goal is to design powerful models that can efficiently handle imagery with spontaneously displayed facial expressions, and explain in detail the complex configurations behind the human face in real-world situations. To effectively decouple the head pose and expression in the presence of large outof-plane head rotations we introduce a manifold learning approach based on multi-view learning strategies. Contrary to the majority of existing methods that typically treat the numerous poses as individual problems, in this model we first learn a discriminative manifold shared by multiple views of a facial expression. Subsequently, we perform facial expression classification in the expression manifold. Hence, the pose normalization problem is solved by aligning the facial expressions from different poses in a common latent space. We demonstrate that the recovered manifold can efficiently generalize to various poses and expressions even from a small amount of training data, while also being largely robust to corrupted image features due to illumination variations. State-of-the-art performance is achieved in the task of facial expression classification of basic emotions. The methods that we propose for learning the structure in the configuration of the muscle movements represent some of the first attempts in the field of analysis and intensity estimation of facial expressions. In these models, we extend our multi-view approach to exploit relationships not only in the input features but also in the multi-output labels. The structure of the outputs is imposed into the recovered manifold either from heuristically defined hard constraints, or in an auto-encoded manner, where the structure is learned automatically from the input data. The resulting models are proven to be robust to data with imbalanced expression categories, due to our proposed Bayesian learning of the target manifold. We also propose a novel regression approach based on product of GP experts where we take into account people’s individual expressiveness in order to adapt the learned models on each subject. We demonstrate the superior performance of our proposed models on the task of facial expression recognition and intensity estimation.",,2016,10.25560/44106,semantic_scholar,e-commerce,'e-commerce' AND 'machine learning' AND ('real-world' AND 'deploy')
