id,datePublished,description,title,downloadUrl,journals,publisher,doi,database,query_name,query_value
390020517,2017-12-25T00:00:00,"The economic-legal aspects of the state and trends of the Internet-based technologies (IP) technology, the place of intellectual property in it are considered. It is shown that the Internet of Things creates conditions for the emergence of a synergetic effect from the combination of possibilities of artificial intelligence, cloud computing, set of sensors, mathematical algorithms for processing large data (Big Data), robotic devices of various purposes, data transmission systems (Internet), which allows to provide various services and perform various work with or without the participation of people. The role of the state in promoting the development of IP, the existing problems and ways of their solution are shown. Many governments in recent years are taking measures to analyze the state of affairs with the introduction of IP technologies, the localization of problems and threats that may or may occur in the future in order to formulate a common strategy for the development of industry for the production of IP technologies and their application in various sectors of the economy and public life. The patent landscape of the IP is analyzed, the most productive companies and inventors of IP are discovered, the dynamics of patenting in the IP environment, the value of patents, patent research problems are shown. The problems of intellectual property protection in the sphere of IP, in particular, copyright, inventions, trademarks, commercial secrets, information security are considered. The intellectual potential and untapped potential of Ukraine in the development of IP technologies are considered. It is concluded that in the widespread use of IP technologies, there is a significant potential for increasing the efficiency of any type of human activity. It concerns the real economy, industry and agriculture, health care, public administration, education, financial turnover, etc. The development of IP technologies is the most powerful stimulating factor in the innovative development of nanotechnologies, microelectronics, semiconductor technologies, microiminating of executive devices, telecommunications, radio technologies, software computing, robotics, and moreРассмотрены экономико-правовые аспекты состояния и тенденций развития технологий Интернета вещей (ИВ), места в нем интеллектуальной собственности. Показано, что ИВ создает условия для появления синергетического эффекта от сочетания возможностей искусственного интеллекта, облачных вычислений, множества сенсоров, математических алгоритмов обработки больших данных (Big Data), роботизированных устройств различного назначения, систем передачи данных (сети Интернет), что позволяет предоставлять разнообразные услуги и осуществлять различные работы с участием или без участия людей. Показана роль государства в содействии развитию ИВ, существующие проблемы и пути их решения. Правительства многих стран в последнее время принимают меры по анализу состояния дел с внедрением ИВ-технологий, локализации проблем и угроз, имеющих место или могущих возникнуть в будущем, с целью формирования общей стратегии развития промышленности производства технологий ИВ и их применение в различных секторах экономики и общественной жизни. Проанализированы патентный ландшафт ИВ, выявлены наиболее продуктивные компании и изобретатели ИВ, показана динамика патентования в среде ИВ, ценность патентов, проблемы патентного поиска. Рассмотрены проблемы охраны интеллектуальной собственности в сфере ИВ, в частности, авторских прав, изобретений, торговых марок, коммерческой тайны, информационной безопасности. Рассмотрены интеллектуальный потенциал и неиспользованные возможности Украины в развитии технологий ИВ. Делается вывод, что в широком применении технологий ИВ заложен значительный потенциал повышения эффективности любого вида человеческой деятельности. Это касается сферы реальной экономики, промышленности и сельского хозяйства, системы здравоохранения, государственного управления, образования, финансового оборота и т. п. Развитие технологий ИВ является мощным стимулирующим фактором инновационного развития нанотехнологий, микроэлектроники, полупроводниковых технологий, микроминиатюризации исполнительных устройств, телекоммуникаций, радиотехнологий, программных вычислительных средств, робототехники и многого другого.Розглянуто економіко-правові аспекти стану та тенденцій розвитку технологій Інтернет речей (ІР), місця в ньому інтелектуальної власності. Показано роль держави у сприянні розвитку ІР, існуючі проблеми та шляхи їх вирішення. Проаналізовано патентний ландшафт ІР, виявлені найбільш продуктивні компанії та винахідники ІР, показано динаміку патентування в середовищі ІР, цінність патентів, проблеми патентного пошуку. Визначено проблеми охорони інтелектуальної власності у сфері ІР, зокрема, авторських прав, винаходів, торгових марок, комерційної таємниці, інформаційної безпеки. Розглянуто інтелектуальний потенціал та невикористані можливості України у розвитку технологій ІР.Робиться висновок, що у широкому застосуванні технологій ІР закладено значний потенціал підвищення ефективності економіки",Науково-дослідний інститут інтелектуальної власності НAПрН України,ІНТЕЛЕКТУАЛЬНА ВЛАСНІСТЬ В СИСТЕМІ ІНТЕРНЕТ РЕЧЕЙ: ЕКОНОМІКО-ПРАВОВИЙ АСПЕКТ,,,,core,health,'health' AND 'machine learning' AND ('real-world' AND 'deploy')
251203367,2018-10-11T00:00:00,"BACKGROUND: Logistic regression is a popular technique used in machine learning to construct classification models. Since the construction of such models is based on computing with large datasets, it is an appealing idea to outsource this computation to a cloud service. The privacy-sensitive nature of the input data requires appropriate privacy preserving measures before outsourcing it. Homomorphic encryption enables one to compute on encrypted data directly, without decryption and can be used to mitigate the privacy concerns raised by using a cloud service. METHODS: In this paper, we propose an algorithm (and its implementation) to train a logistic regression model on a homomorphically encrypted dataset. The core of our algorithm consists of a new iterative method that can be seen as a simplified form of the fixed Hessian method, but with a much lower multiplicative complexity. RESULTS: We test the new method on two interesting real life applications: the first application is in medicine and constructs a model to predict the probability for a patient to have cancer, given genomic data as input; the second application is in finance and the model predicts the probability of a credit card transaction to be fraudulent. The method produces accurate results for both applications, comparable to running standard algorithms on plaintext data. CONCLUSIONS: This article introduces a new simple iterative algorithm to train a logistic regression model that is tailored to be applied on a homomorphically encrypted dataset. This algorithm can be used as a privacy-preserving technique to build a binary classification model and can be applied in a wide range of problems that can be modelled with logistic regression. Our implementation results show that our method can handle the large datasets used in logistic regression training.status: publishe",'Springer Science and Business Media LLC',Privacy-preserving logistic regression training,10.1186/s12920-018-0398-y,,"[{'title': 'BMC Medical Genomics', 'identifiers': ['1755-8794', 'issn:1755-8794']}]",core,health,'health' AND 'machine learning' AND ('real-world' AND 'deploy')
143643223,2018-02-01T00:00:00,"Objective: To train a generic deep learning software (DLS) to classify breast cancer on ultrasound images and to compare its performance to human readers with variable breast imaging experience.

Methods: In this retrospective study, all breast ultrasound examinations from January 1, 2014 to December 31, 2014 at our institution were reviewed. Patients with post-surgical scars, initially indeterminate, or malignant lesions with histological diagnoses or 2-year follow-up were included. The DLS was trained with 70% of the images, and the remaining 30% were used to validate the performance. Three readers with variable expertise also evaluated the validation set (radiologist, resident, medical student). Diagnostic accuracy was assessed with a receiver operating characteristic analysis.

Results: 82 patients with malignant and 550 with benign lesions were included. Time needed for training was 7 min (DLS). Evaluation time for the test data set were 3.7 s (DLS) and 28, 22 and 25 min for human readers (decreasing experience). Receiver operating characteristic analysis revealed non-significant differences (p-values 0.45–0.47) in the area under the curve of 0.84 (DLS), 0.88 (experienced and intermediate readers) and 0.79 (inexperienced reader).

Conclusion: DLS may aid diagnosing cancer on breast ultrasound images with an accuracy comparable to radiologists, and learns better and faster than a human reader with no prior experience. Further clinical trials with dedicated algorithms are warranted.

Advances in knowledge: DLS can be trained classify cancer on breast ultrasound images high accuracy even with comparably few training cases. The fast evaluation speed makes real-time image analysis feasible",'British Institute of Radiology',Classification of breast cancer from ultrasound imaging using a generic deep learning analysis software: a pilot study,10.1259/bjr.20170576,https://www.zora.uzh.ch/id/eprint/143409/,,core,health,'health' AND 'machine learning' AND ('real-world' AND 'deploy')
82487224,8/31/2014,"AbstractBovine mastitis is a frequent problem in Swiss dairy herds. One of the main pathogens causing significant economic loss is Staphylococcus aureus. Various Staph. aureus genotypes with different biological properties have been described. Genotype B (GTB) of Staph. aureus was identified as the most contagious and one of the most prevalent strains in Switzerland. The aim of this study was to identify risk factors associated with the herd-level presence of Staph. aureus GTB and Staph. aureus non-GTB in Swiss dairy herds with an elevated yield-corrected herd somatic cell count (YCHSCC). One hundred dairy herds with a mean YCHSCC between 200,000 and 300,000cells/mL in 2010 were recruited and each farm was visited once during milking. A standardized protocol investigating demography, mastitis management, cow husbandry, milking system, and milking routine was completed during the visit. A bulk tank milk (BTM) sample was analyzed by real-time PCR for the presence of Staph. aureus GTB to classify the herds into 2 groups: Staph. aureus GTB-positive and Staph. aureus GTB-negative. Moreover, quarter milk samples were aseptically collected for bacteriological culture from cows with a somatic cell count ≥150,000cells/mL on the last test-day before the visit. The culture results allowed us to allocate the Staph. aureus GTB-negative farms to Staph. aureus non-GTB and Staph. aureus-free groups. Multivariable multinomial logistic regression models were built to identify risk factors associated with the herd-level presence of Staph. aureus GTB and Staph. aureus non-GTB. The prevalence of Staph. aureus GTB herds was 16% (n=16), whereas that of Staph. aureus non-GTB herds was 38% (n=38). Herds that sent lactating cows to seasonal communal pastures had significantly higher odds of being infected with Staph. aureus GTB (odds ratio: 10.2, 95% CI: 1.9–56.6), compared with herds without communal pasturing. Herds that purchased heifers had significantly higher odds of being infected with Staph. aureus GTB (rather than Staph. aureus non-GTB) compared with herds without purchase of heifers. Furthermore, herds that did not use udder ointment as supportive therapy for acute mastitis had significantly higher odds of being infected with Staph. aureus GTB (odds ratio: 8.5, 95% CI: 1.6–58.4) or Staph. aureus non-GTB (odds ratio: 6.1, 95% CI: 1.3–27.8) than herds that used udder ointment occasionally or regularly. Herds in which the milker performed unrelated activities during milking had significantly higher odds of being infected with Staph. aureus GTB (rather than Staph. aureus non-GTB) compared with herds in which the milker did not perform unrelated activities at milking. Awareness of 4 potential risk factors identified in this study guides implementation of intervention strategies to improve udder health in both Staph. aureus GTB and Staph. aureus non-GTB herds",American Dairy Science Association®.,Genotype-specific risk factors for Staphylococcus aureus in Swiss dairy herds with an elevated yield-corrected herd somatic cell count ,10.3168/jds.2013-7760,https://core.ac.uk/download/pdf/82487224.pdf,,core,health,'health' AND 'machine learning' AND ('real-world' AND 'deploy')
302679903,2018-08-17T00:00:00,"While many VA workflows make use of machine-learned models to support analytical tasks, VA workflows have become increasingly important in understanding and improving Machine Learning (ML) processes. In this paper, we propose an ontology (VIS4ML) for a subarea of VA, namely ""VA-assisted ML"". The purpose of VIS4ML is to describe and understand existing VA workflows used in ML as well as to detect gaps in ML processes and the potential of introducing advanced VA techniques to such processes. Ontologies have been widely used to map out the scope of a topic in biology, medicine, and many other disciplines. We adopt the scholarly methodologies for constructing VIS4ML, including the specification, conceptualization, formalization, implementation, and validation of ontologies. In particular, we reinterpret the traditional VA pipeline to encompass model-development workflows. We introduce necessary definitions, rules, syntaxes, and visual notations for formulating VIS4ML and make use of semantic web technologies for implementing it in the Web Ontology Language (OWL). VIS4ML captures the high-level knowledge about previous workflows where VA is used to assist in ML. It is consistent with the established VA concepts and will continue to evolve along with the future developments in VA and ML. While this ontology is an effort for building the theoretical foundation of VA, it can be used by practitioners in real-world applications to optimize model-development workflows by systematically examining the potential benefits that can be brought about by either machine or human capabilities. Meanwhile, VIS4ML is intended to be extensible and will continue to be updated to reflect future advancements in using VA for building high-quality data-analytical models or for building such models rapidly",'Institute of Electrical and Electronics Engineers (IEEE)',VIS4ML: an ontology for visual analytics assisted machine learning,10.1109/TVCG.2018.2864838,,"[{'title': 'IEEE Transactions on Visualization and Computer Graphics', 'identifiers': ['1077-2626', 'issn:1077-2626']}]",core,health,'health' AND 'machine learning' AND ('real-world' AND 'deploy')
301151642,2016-05-01T00:00:00,"This paper is an extended version of one paper published in the 4th IEEE International Work Conference on Bioinspired Intelligence, Donostia, Spain, 9–12 June 2015Biomedical systems produce biosignals that arise from interaction mechanisms. In a general form, those mechanisms occur across multiple scales, both spatial and temporal, and contain linear and non-linear information. In this framework, entropy measures are good candidates in order provide useful evidence about disorder in the system, lack of information in time-series and/or irregularity of the signals. The most common movement disorder is essential tremor (ET), which occurs 20 times more than Parkinson's disease. Interestingly, about 50%-70% of the cases of ET have a genetic origin. One of the most used standard tests for clinical diagnosis of ET is Archimedes' spiral drawing. This work focuses on the selection of non-linear biomarkers from such drawings and handwriting, and it is part of a wider cross study on the diagnosis of essential tremor, where our piece of research presents the selection of entropy features for early ET diagnosis. Classic entropy features are compared with features based on permutation entropy. Automatic analysis system settled on several Machine Learning paradigms is performed, while automatic features selection is implemented by means of ANOVA (analysis of variance) test. The obtained results for early detection are promising and appear applicable to real environments.This work has been partially supported by the University of the Basque Country under project ref. UPV/EHU-58/14, SAIOTEK program and others from the Basque Government, the Spanish Ministerio de Ciencia e Innovacion TEC2012-38630-C04-03, the University of Vic-Central University of Catalonia under the research grant R0904, INNPACTO program from the Spanish Government, and UPV/EHU Summer Courses Foundation",'MDPI AG',Selection of Entropy Based Features for Automatic Analysis of Essential Tremor,10.3390/e18050184,,"[{'title': 'Entropy', 'identifiers': ['1099-4300', 'issn:1099-4300']}]",core,health,'health' AND 'machine learning' AND ('real-world' AND 'deploy')
161502228,2016,"The paper provides a state of the art review of guided wave based structural health monitoring (SHM). First, the fundamental concepts of guided wave propagation and its implementation for SHM is explained. Following sections present the different modeling schemes adopted, developments in the area of transducers for generation, and sensing of wave, signal processing and imaging technique, statistical and machine learning schemes for feature extraction. Next, a section is presented on the recent advancements in nonlinear guided wave for SHM. This is followed by section on Rayleigh and SH waves. Next is a section on real-life implementation of guided wave for industrial problems. The paper, though briefly talks about the early development for completeness,. is primarily focussed on the recent progress made in the last decade. The paper ends by discussing and highlighting the future directions and open areas of research in guided wave based SHM",IOP PUBLISHING LTD,Guided wave based structural health monitoring: A review,10.1088/0964-1726/25/5/053001,,,core,health,'health' AND 'machine learning' AND ('real-world' AND 'deploy')
203932409,12/31/2016,"AbstractThis paper describes the design and evaluation of a mobile software library, HealthTracker, which aims to produce activity and energy expenditure estimations in real-time from accelerometer and gyroscope data provided by wearable sensors. Using feature extraction together with a classifier trained using machine learning, the system will automatically and periodically send all the produced estimations to a cloud-based platform that will allow later evaluation by both the user and a physician or caretaker. The system is presented within the DAPHNE platform, an ICT ecosystem designed to provide a means for remote health and lifestyle monitoring and guidance between physicians and their patients",The Author(s). Published by Elsevier B.V.,Designing and Testing HealthTracker for Activity Recognition and Energy Expenditure Estimation within the DAPHNE Platform ,10.1016/j.procs.2016.09.052,,,core,health,'health' AND 'machine learning' AND ('real-world' AND 'deploy')
81990661,2/28/2017,"AbstractA large part of the biomedical research spectrum is dedicated to develop electrocardiogram (ECG) signal processing techniques to contribute to early diagnosis. However, it is common to find that ECG analysis methods reported are confined to off-line PC host operation. The authors present an arrhythmia classification method implemented on a Digital Signal Processing (DSP) platform intended for on-line, real-time ambulatory operation to classify eight heartbeat conditions: normal sinus rhythm (N), auricular fibrillation (AF), premature atrial contraction (PAC), left bundle branch block (LBBB), right bundle branch block (RBBB), premature ventricular contraction (PVC), sinoauricular heart block (SHB) and supraventricular tachycardia (SVT). The algorithm uses a wavelet transform process based on quadratic wavelets for identifying individual ECG waves and obtain a fiducial marker array. Classification is conducted by means of a Probabilistic Neural Network. The algorithm is tested with 17 ECG records obtained from the PhysioNet repository. The proposed classification procedure was tested initially on MATLAB and the results where compared with the equivalent analogue data fed to a DSP-based ECG data acquisition prototype through an arbitrary waveform generator. The results derived from confusion matrix tests yielded on-line classification accuracy of 92.69% (AF), 97.15% (N), 76.82% (PAC), 91.06% (LBBB), 87.5% (RBBB), 71.04% (PVC), 91.94% (SHB) and 95.45% (SVT), overall classification rate of 92.746% and 100% agreement between the MATLAB and on-line DSP implementations. The results suggest that the method and prototype presented may be suitable for being implemented on wearable sensing applications auxiliary for on-line, real-time diagnosis",The Authors. Published by Elsevier Ltd.,DSP-based arrhythmia classification using wavelet transform and probabilistic neural network ,10.1016/j.bspc.2016.10.005,https://core.ac.uk/download/pdf/81990661.pdf,,core,health,'health' AND 'machine learning' AND ('real-world' AND 'deploy')
