id,datePublished,description,title,downloadUrl,journals,publisher,doi,database,query_name,query_value
523305217,2021-01-01T00:00:00,"Hand gestures based sign language digits have several contactless applications. Applications include communication for impaired people, such as elderly and disabled people, health-care
applications, automotive user interfaces, and security and surveillance. This work presents the design
and implementation of a complete end-to-end deep learning based edge computing system that
can verify a user contactlessly using ‘authentication code’. The ‘authentication code’ is an ‘n’ digit
numeric code and the digits are hand gestures of sign language digits. We propose a memory-efficient
deep learning model to classify the hand gestures of the sign language digits. The proposed deep
learning model is based on the bottleneck module which is inspired by the deep residual networks.
The model achieves classification accuracy of 99.1% on the publicly available sign language digits
dataset. The model is deployed on a Raspberry pi 4 Model B edge computing system to serve as an
edge device for user verification. The edge computing system consists of two steps, it first takes input
from the camera attached to it in real-time and stores it in the buffer. In the second step, the model
classifies the digit with the inference rate of 280 ms, by taking the first image in the buffer as input.publishedVersio",Design and Implementation of Deep Learning Based Contactless Authentication System Using Hand Gestures,https://core.ac.uk/download/523305217.pdf,,'MDPI AG',10.3390/electronics10020182,core,health,'health' AND 'machine learning' AND ('real-world' AND 'deploy')
475070866,2021-06-01T00:00:00,"Multi-class classification is one of the major challenges in machine learning and an ongoing research issue. Classification algorithms are generally binary, but they must be extended to multi-class problems for real-world application. Multi-class classification is more complex than binary classification. In binary classification, only the decision boundaries of one class are to be known, whereas in multiclass classification, several boundaries are involved. The objective of this investigation is to propose a metaheuristic, optimized, multi-level classification learning system for forecasting in civil and construction engineering. The proposed system integrates the firefly algorithm (FA), metaheuristic intelligence, decomposition approaches, the one-against-one (OAO) method, and the least squares support vector machine (LSSVM). The enhanced FA automatically fine-tunes the hyperparameters of the LSSVM to construct an optimized LSSVM classification model. Ten benchmark functions are used to evaluate the performance of the enhanced optimization algorithm. Two binary-class datasets related to geotechnical engineering, concerning seismic bumps and soil liquefaction, are then used to clarify the application of the proposed system to binary problems. Further, this investigation uses multi-class cases in civil engineering and construction management to verify the effectiveness of the model in the diagnosis of faults in steel plates, quality of water in a reservoir, and determining urban land cover. The results reveal that the system predicts faults in steel plates with an accuracy of 91.085%, the quality of water in a reservoir with an accuracy of 93.650%, and urban land cover with an accuracy of 87.274%. To demonstrate the effectiveness of the proposed system, its predictive accuracy is compared with that of a non-optimized baseline model, single multi-class classification algorithms (sequential minimal optimization (SMO), the Multiclass Classifier, the Naïve Bayes, the library support vector machine (LibSVM) and logistic regression) and prior studies. The analytical results show that the proposed system is promising project analytics software to help decision makers solve multi-level classification problems in engineering applications",Metaheuristic Optimized Multi-Level Classification Learning System for Engineering Management,,"[{'title': 'Applied Sciences', 'identifiers': ['2076-3417', 'issn:2076-3417']}]",'MDPI AG',10.3390/app11125533,core,health,'health' AND 'machine learning' AND ('real-world' AND 'deploy')
524738544,2021-12-28T00:00:00,"Розглянуто деякі медичні інформаційні системи, призначенням яких є оптимізація управління діяльністю медичного закладу. Визначено особливості медичних інформаційних систем, які необхідно враховувати при їх виборі. З’ясовано основні характеристики медичної інформаційної системи, на основі яких проведено порівняльний аналіз розглянутих систем, результати якого зібрано у таблицю.В статье рассмотрены некоторые медицинские информационные системы, назначением которых является оптимизация управления деятельностью медицинского учреждения. Определены особенности медицинских информационных систем, которые необходимо учитывать при их выборе. Выяснены основные характеристики медицинской информационной системы, на основе которых проведен сравнительный анализ рассматриваемых систем, результаты которого собраны в таблицу.The article considers such modern Hospital Information System as MedElement, Medods, Clinic365, Meduchet SQL, Doctor Eleks, EMCiMED. The purpose of the described HIS is to optimize the management of the medical institution. They help to improve the quality of service, improve the efficiency of all departments of the organization, get rid of filling a large number of papers and keeping paper records, and use all the benefits of modern technologies such as telemedicine and artificial intelligence. The advantages of using HIS are: transparency of the patient care system and financial activities of medical institutions, wide opportunities for reports, in particular, real-time reporting. The work defines the features of medical information systems that must be considered when choosing them. The main characteristics of the Hospital Information System, on the basis of which the comparative analysis of the systems under consideration, the results of which are collected in the table, are found. It is established that with the successful choice of the Hospital Information System, its implementation contributes to: simplification of access to the necessary information, ease of search for resources, lack of need for double input of data, possibility of using document templates, possibility of access to reference information. When implementing the information system, the personnel of health care institutions need to make certain efforts – to make information to the system, consistently conduct electronic medical documentation and necessarily adhere to the algorithm for working with the information system. Patients of the healthcare institution also have advantages: the ability to access their own medical information, the ability to communicate with a doctor outside the medical institution, the absence of queues (planning time to visit a doctor), improving the medical result (quality management)",THE REVIEW OF MODERN MEDICAL INFORMATION SYSTEMS,,,'Oles Honchar Dnipropetrovsk National University',10.15421/432111,core,health,'health' AND 'machine learning' AND ('real-world' AND 'deploy')
426057424,2021-01-01T00:00:00,"Clinical trials in cancer treatment are imperative in enhancing patients\u2019 survival and quality of life outcomes. The lack of communication among professionals may produce a non-optimization of patients\u2019 accrual in clinical trials. We developed a specific platform, called \u201cDigital Research Assistant\u201d (DRA), to report real-time every available clinical trial and support clinician. Healthcare professionals involved in breast cancer working group agreed nine minimal fields of interest to preliminarily classify the characteristics of patients\u2019 records (including omic data, such as genomic mutations). A progressive web app (PWA) was developed to implement a cross-platform software that was scalable on several electronic devices to share the patients\u2019 records and clinical trials. A specialist is able to use and populate the platform. An AI algorithm helps in the matchmaking between patient\u2019s data and clinical trial\u2019s inclusion criteria to personalize patient enrollment. At the same time, an easy configuration allows the application of the DRA in different oncology working groups (from breast cancer to lung cancer). The DRA might represent a valid research tool supporting clinicians and scientists, in order to optimize the enrollment of patients in clinical trials. User Experience and Technology The acceptance of participants using the DRA is topic of a future analysis",Development of a digital research assistant for the management of patients\u2019 enrollment in oncology clinical trials within a research hospital,,,'MDPI AG',10.3390/jpm11040244,core,health,'health' AND 'machine learning' AND ('real-world' AND 'deploy')
491090983,2021-01-01T00:00:00,"Timely and accurate diagnostics are essential to fight the COVID-19 pandemic, but no test satisfies both conditions. Dogs can scent-identify the unique odors of volatile organic compounds generated during infection by interrogating specimens or, ideally, the body of a patient. After training 6 dogs to detect SARS-CoV-2 by scent in human respiratory secretions (in vitro diagnosis), we retrained 5 of them to search and find the infection by scenting the patient directly (in vivo screening). Then, efficacy trials were designed to compare the diagnostic performance of the dogs against that of the rRT-PCR in 848 human subjects: 269 hospitalized patients (COVID-19 prevalence 30.1%), 259 hospital staff (prevalence 2.7%), and 320 government employees (prevalence 1.25%). The limit of detection in vitro was lower than 10-12 copies ssRNA/mL. During in vivo efficacy experiments, our 5 dogs detected 92 COVID-19 positive patients among the 848 study subjects. The alert (lying down) was immediate, with 95.2% accuracy and high sensitivity (95.9%; 95% C.I. 93.6-97.4), specificity (95.1%; 94.4-95.8), positive predictive value (69.7%; 65.9-73.2), and negative predictive value (99.5%; 99.2-99.7) in relation to rRT-PCR. Seventy-five days after finishing in vivo efficacy experiments, a real-life study (in vivo effectiveness) was executed among the riders of the Metro System of Medellin, deploying the human-canine teams without previous training or announcement. Three dogs were used to examine the scent of 550 volunteers who agreed to participate, both in test with canines and in rRT-PCR testing. Negative predictive value remained at 99.0% (95% C.I. 98.3-99.4), but positive predictive value dropped to 28.2% (95% C.I. 21.1-36.7). Canine scent-detection in vivo is a highly accurate screening test for COVID-19, and it detects more than 99% of infected individuals independent of key variables, such as disease prevalence, time post-exposure, or presence of symptoms. Additional training is required to teach the dogs to ignore odoriferous contamination under real-life conditions",Highly sensitive scent-detection of COVID-19 patients in vivo by trained dogs.,,"[{'title': 'PLoS ONE', 'identifiers': ['issn:1932-6203', '1932-6203']}]",'Public Library of Science (PLoS)',10.1371/journal.pone.0257474,core,health,'health' AND 'machine learning' AND ('real-world' AND 'deploy')
388542285,2021-05-01T00:00:00,"BACKGROUND: In the emergency department (ED) setting, rapid testing for SARS-CoV-2 is likely associated with advantages to patients and healthcare workers, for example, enabling early but rationale use of limited isolation resources. Most recently, several SARS-CoV-2 rapid point-of-care antigen tests (AGTEST) became available. There is a growing need for data regarding their clinical utility and performance in the diagnosis of SARS-CoV-2 infection in the real life setting EDs. METHODS: We implemented AGTEST (here: Roche/SD Biosensor) in all four adult and the one paediatric EDs at Charité - Universitätsmedizin Berlin in our diagnostic testing strategy. Test indication was limited to symptomatic suspected COVID-19 patients. Detailed written instructions on who to test were distributed and testing personnel were trained in proper specimen collection and handling. In each suspected COVID-19 patient, two sequential deep oro-nasopharyngeal swabs were obtained for viral tests. The first swab was collected for nucleic acid testing through SARS-CoV-2 real-time reverse transcriptase (rt)-PCR diagnostic panel (PCRTEST) in the central laboratory. The second swab was collected to perform the AGTEST. Analysis of routine data was prospectively planned and data were retrieved from the medical records after the inclusion period in the adult or paediatric ED. Diagnostic performance was calculated using the PCRTEST as reference standard. False negative and false positive AGTEST results were analysed individually and compared with viral concentrations derived from the calibrated PCRTEST. RESULTS: We included n = 483 patients including n = 202 from the paediatric ED. N = 10 patients had to be excluded due to missing data and finally n = 473 patients were analysed. In the adult cohort, the sensitivity of the AGTEST was 75.3 (95%CI: 65.8/83.4)% and the specificity was 100 (95%CI: 98.4/100)% with a SARS-CoV-2 prevalence of 32.8%; the positive predictive value was 100 (95%CI: 95.7/100)% and the negative predictive value 89.2 (95%CI: 84.5/93.9)%. In the paediatric cohort, the sensitivity was 72.0 (95%CI: 53.3/86.7)%, the specificity was 99.4 (95%CI:97.3/99.9)% with a prevalence of 12.4%; the positive predictive value was 94.7 (95%CI: 78.3/99.7)% and the negative predictive value was 96.2 (95%CI:92.7/98.3)%. Thus, n = 22 adult and n = 7 paediatric patients showed false negative AGTEST results and only one false positive AGTEST occurred, in the paediatric cohort. Calculated viral concentrations from the rt-PCR lay between 3.16 and 9.51 log10 RNA copies/mL buffer. All false negative patients in the adult ED cohort, who had confirmed symptom onset at least seven days earlier had less than 5 × 105 RNA copies/mL buffer. CONCLUSIONS: We conclude that the use of AGTEST among symptomatic patients in the emergency setting is useful for the early identification of COVID-19, but patients who test negative require confirmation by PCRTEST and must stay isolated until this result becomes available. Adult patients with a false negative AGTEST and symptom onset at least one week earlier have typically a low SARS-CoV-2 RNA concentration and are likely no longer infectious",SARS-CoV-2 antigen rapid immunoassay for diagnosis of COVID-19 in the emergency department.,,,Biomarkers,10.17863/CAM.65352,core,health,'health' AND 'machine learning' AND ('real-world' AND 'deploy')
480138097,2021-01-01T00:00:00,"Schizophrenia is a chronic mental illness, characterized by the loss of the notion of reality, failing to distinguish it from the imaginary. It affects the patient in life’s major areas, such as work, interpersonal relationships, or self-care, and the usual treatment is performed with the help of anti- psychotic medication, which targets primarily the hallucinations, delirium, etc. Other symptoms, such as the decreased emotional expression or avolition, require a multidisciplinary approach, including psychopharmacology, cognitive training, and many forms of therapy. In this context, this paper addresses the use of digital technologies to design and develop innovative rehabilitation techniques, particularly focusing on mental health rehabilitation, and contributing for the promotion of well-being and health from a holistic perspective. In this context, serious games and virtual reality allows for creation of immersive environments that contribute to a more effective and lasting recovery, with improvements in terms of quality of life. The use of machine learning techniques will allow the real-time analysis of the data collected during the execution of the rehabilitation procedures, as well as enable their dynamic and automatic adaptation according to the profile and performance of the patients, by increasing or reducing the exercises’ difficulty. It relies on the acquisition of biometric and physiological signals, such as voice, heart rate, and game performance, to estimate the stress level, thus adapting the difficulty of the experience to the skills of the patient. The system described in this paper is currently in development, in collaboration with a health unit, and is an engineering effort that combines hardware and software to develop a rehabilitation tool for schizophrenic patients. A clinical trial is also planned for assessing the effectiveness of the system among negative symptoms in schizophrenia patients.This work is funded by the European Regional Development Fund (ERDF) through the
Regional Operational Program North 2020, within the scope of Project GreenHealth - Digital strategies
in biological assets to improve well-being and promote green health, Norte-01-0145-FEDER-000042.info:eu-repo/semantics/publishedVersio",Digital technologies for innovative mental health rehabilitation,https://core.ac.uk/download/480138097.pdf,,'MDPI AG',10.3390/electronics10182260,core,health,'health' AND 'machine learning' AND ('real-world' AND 'deploy')
481179315,2021-07-01T00:00:00,"International audienceIntroduction: Disease behaviour may guide diagnosis and treatment decisions in patients with interstitial lung disease (ILD). STARLINER aimed to characterise disease behaviour in patients with suspected ILD during the peri-diagnostic period using real-time home-based assessments.Methods: STARLINER (NCT03261037) was an international, multicentre study. Patients ≥ 50 years old with suspected ILD were followed throughout the peri-diagnostic period, consisting of a pre-diagnostic period (from enrolment to diagnosis) and a post-diagnostic period (from diagnosis to treatment initiation). Study length was variable (≤ 18 months). The primary endpoint was time-adjusted semi-annual forced vital capacity (FVC) change measured during the peri-diagnostic period using daily home spirometry in patients with idiopathic pulmonary fibrosis (IPF). Secondary outcomes included changes in FVC (home spirometry) in patients with non-IPF ILD, changes in FVC (site spirometry), changes in physical functional capacity measured by daily home accelerometry and site 6-min walk distance (6MWD), and changes in patient-reported outcomes (PROs) in IPF or non-IPF ILD.Results: Of the 178 patients enrolled in the study, 68 patients were diagnosed with IPF, 62 patients were diagnosed with non-IPF ILD, 9 patients received a non-ILD diagnosis and 39 patients did not receive a diagnosis. Technical and analytical issues led to problems in applying the prespecified linear regression model to analyse the home FVC data. Time-adjusted median (quartile [Q]1, Q3) semi-annual FVC change during the peri-diagnostic period measured using home and site spirometry, respectively, was - 147.7 (- 723.8, 376.2) ml and - 149.0 (- 314.6, 163.9) ml for IPF and 19.1 (- 194.9, 519.0) ml and - 23.4 (- 117.9, 133.5) ml in non-IPF ILD. A greater decline in steps per day was observed for IPF versus non-IPF ILD, whereas an increase in 6MWD was observed for patients with IPF versus a decline in 6MWD for patients with non-IPF ILD. No clear patterns of disease behaviour were observed for IPF versus non-IPF ILD for PROs.Conclusions: Despite home spirometry being feasible for most patients and centres, technical and analytical challenges in the home-based assessments prevented firm conclusions regarding disease behaviour. This highlights that further optimisation of the technology and analysis methods is required before widespread implementation",Disease Behaviour During the Peri-Diagnostic Period in Patients with Suspected Interstitial Lung Disease: The STARLINER Study,,,'Springer Science and Business Media LLC',10.1007/s12325-021-01790-y,core,health,'health' AND 'machine learning' AND ('real-world' AND 'deploy')
491038886,2022-02-01T00:00:00,"The problem of respiratory sound classification has received good attention from the clinical scientists and medical researcher’s community in the last year to the diagnosis of COVID-19 disease. The Artificial Intelligence (AI) based models deployed into the real-world to identify the COVID-19 disease from human-generated sounds such as voice/speech, dry cough, and breath. The CNN (Convolutional Neural Network) is used to solve many real-world problems with Artificial Intelligence (AI) based machines. We have proposed and implemented a multi-channeled Deep Convolutional Neural Network (DCNN) for automatic diagnosis of COVID-19 disease from human respiratory sounds like a voice, dry cough, and breath, and it will give better accuracy and performance than previous models. We have applied multi-feature channels such as the data De-noising Auto Encoder (DAE) technique, GFCC (Gamma-tone Frequency Cepstral Coefficients), and IMFCC (Improved Multi-frequency Cepstral Coefficients) methods on augmented data to extract the deep features for the input of the CNN. The proposed approach improves system performance to the diagnosis of COVID-19 disease and provides better results on the COVID-19 respiratory sound dataset","Automatic diagnosis of COVID-19 disease using deep convolutional neural network with multi-feature channel from respiratory sound data: Cough, voice, and breath",,"[{'title': 'Alexandria Engineering Journal', 'identifiers': ['issn:1110-0168', '1110-0168']}]",'Elsevier BV',10.1016/j.aej.2021.06.024,core,health,'health' AND 'machine learning' AND ('real-world' AND 'deploy')
491076283,2021-11-01T00:00:00,"Smart mirrors are devices that can display any kind of information and can interact with the user using touch and voice commands. Different kinds of smart mirrors exist: general purpose, medical, fashion, and other task specific ones. General purpose smart mirrors are suitable for home environments but the exiting ones offer similar, limited functionalities. In this paper, we present a general-purpose smart mirror that integrates several functionalities, standard and advanced, to support users in their everyday life. Among the advanced functionalities are the capabilities of detecting a person’s emotions, the short- and long-term monitoring and analysis of the emotions, a double authentication protocol to preserve the privacy, and the integration of Alexa Skills to extend the applications of the smart mirrors. We exploit a deep learning technique to develop most of the smart functionalities. The effectiveness of the device is demonstrated by the performances of the implemented functionalities, and the evaluation in terms of its usability with real users",A Smart Mirror for Emotion Monitoring in Home Environments,,"[{'title': 'Sensors', 'identifiers': ['issn:1424-8220', '1424-8220']}]",'MDPI AG',10.3390/s21227453,core,health,'health' AND 'machine learning' AND ('real-world' AND 'deploy')
429956590,2021-01-01T00:00:00,"During the last decade, Convolutional Neural Networks (CNNs) have become the de facto standard for various Computer Vision and Machine Learning operations. CNNs are feed-forward Artificial Neural Networks (ANNs) with alternating convolutional and subsampling layers. Deep 2D CNNs with many hidden layers and millions of parameters have the ability to learn complex objects and patterns providing that they can be trained on a massive size visual database with ground-truth labels. With a proper training, this unique ability makes them the primary tool for various engineering applications for 2D signals such as images and video frames. Yet, this may not be a viable option in numerous applications over 1D signals especially when the training data is scarce or application specific. To address this issue, 1D CNNs have recently been proposed and immediately achieved the state-of-the-art performance levels in several applications such as personalized biomedical data classification and early diagnosis, structural health monitoring, anomaly detection and identification in power electronics and electrical motor fault detection. Another major advantage is that a real-time and low-cost hardware implementation is feasible due to the simple and compact configuration of 1D CNNs that perform only 1D convolutions (scalar multiplications and additions). This paper presents a comprehensive review of the general architecture and principals of 1D CNNs along with their major engineering applications, especially focused on the recent progress in this field. Their state-of-the-art performance is highlighted concluding with their unique properties. The benchmark datasets and the principal 1D CNN software used in those applications are also publicly shared in a dedicated website. While there has not been a paper on the review of 1D CNNs and its applications in the literature, this paper fulfills this gap. (C) 2020 The Author(s). Published by Elsevier Ltd",1D convolutional neural networks and applications : A survey,,,'Elsevier BV',10.1016/j.ymssp.2020.107398,core,health,'health' AND 'machine learning' AND ('real-world' AND 'deploy')
