paperId,url,title,abstract,venue,year,externalIds.DOI,database,query_name,query_value
cdebf1de7b2ccb852b203708f9dc2e584a2abb0c,https://www.semanticscholar.org/paper/cdebf1de7b2ccb852b203708f9dc2e584a2abb0c,Comparing Human-Robot Proxemics between Virtual Reality and the Real World,"Virtual Reality (VR) is gaining more and more popularity as a research tool in the field of Human-Robot Interaction (HRI). To fully deploy the potential of VR and benefit HRI studies, we need to establish the basic understanding of the relationship between the physical, real-world interaction (Live) and VR. This study compared Live and VR HRI with a focus on proxemics, as proxemics preference can reflect comprehensive human intuition, making it suitable to be used to compare Live and VR. To evaluate the influence of different modalities in VR, virtual scenes with different visual familiarity and spatial sound were compared as well. Lab experiments were conducted with a physical Pepper robot and its virtual copy. In both Live and VR, proxemics preferences, the perception of the robot (competence and discomfort) and the feeling of presence were measured and compared. Results suggest that proxemic preferences do not remain consistent in Live and in VR, which could be influenced by the perception of the robot. Therefore, when conducting HRI experiments in VR, the perceptions of the robot need be compared before the experiments. Results also indicate freedom within VR HRI as different VR settings are consistent with each other. Comparing Human-Robot Proxemics between Virtual Reality and the Real World Rui Li KTH Royal Institute of Technology Stockholm, Sweden Rui3@kth.se ABSTRACT Virtual Reality (VR) is gaining more and more popularity as a research tool in the field of HumanRobot Interaction (HRI). To fully deploy the potential of VR and benefit HRI studies, we need to establish the basic understanding of the relationship between the physical, real-world interaction (Live) and VR. This study compared Live and VR HRI with a focus on proxemics, as proxemics preference can reflect comprehensive human intuition, making it suitable to be used to compare Live and VR. To evaluate the influence of different modalities in VR, virtual scenes with different visual familiarity and spatial sound were compared as well. Lab experiments were conducted with a physical Pepper robot and its virtual copy. In both Live and VR, proxemics preferences, the perception of the robot (competence and discomfort) and the feeling of presence were measured and compared. Results suggest that proxemic preferences do not remain consistent in Live and in VR, which could be influenced by the perception of the robot. Therefore, when conducting HRI experiments in VR, the perceptions of the robot need be compared before the experiments. Results also indicate freedom within VR HRI as different VR settings are consistent with each other.Virtual Reality (VR) is gaining more and more popularity as a research tool in the field of HumanRobot Interaction (HRI). To fully deploy the potential of VR and benefit HRI studies, we need to establish the basic understanding of the relationship between the physical, real-world interaction (Live) and VR. This study compared Live and VR HRI with a focus on proxemics, as proxemics preference can reflect comprehensive human intuition, making it suitable to be used to compare Live and VR. To evaluate the influence of different modalities in VR, virtual scenes with different visual familiarity and spatial sound were compared as well. Lab experiments were conducted with a physical Pepper robot and its virtual copy. In both Live and VR, proxemics preferences, the perception of the robot (competence and discomfort) and the feeling of presence were measured and compared. Results suggest that proxemic preferences do not remain consistent in Live and in VR, which could be influenced by the perception of the robot. Therefore, when conducting HRI experiments in VR, the perceptions of the robot need be compared before the experiments. Results also indicate freedom within VR HRI as different VR settings are consistent with each other. INTRODUCTION Virtual Reality (VR) is gaining more and more popularity as a research tool in the field of HumanRobot Interaction (HRI) [1][2][3][4]. VR has been used to test teleoperation and collect demonstration data to train machine learning algorithms, which showcased the effectiveness of learning visuomotor skills using data collected by consumer-grade devices [1]. VR teleoperation systems were proposed to crowdsource robotic demonstrations at scale [2]. A VR simulation framework was also proposed to replace the physical robot, as VR can enable high level abstraction in embodiment and multimodal interaction [3]. VR has also been used as a rapid prototyping tool to design in-vehicle interactions and interfaces for self-driving cars, which showed the evocation to genuine responses from test participants [4]. Compared to other HRI experiment methods, VR as an emerging interactive media provides unique advantages. VR HRI has the potential of having higher immersion and fidelity than picture based HRI, video-based HRI and simulated HRI. In situations where the perception of the robot is challenging, compared to on-screen viewing, VR display showed significant improvement on collaborative tasks [5]. When comparing VR HRI to the physical, realworld interaction (Live HRI), there is a trade-off between the two. VR experiences still cannot replace physical experiences due to system limitation, and limited interaction modalities etc. [6]. For example, system limitations such as limited field of view and low display resolution could reduce immersion and presence of the VR experience, resulting in different behaviors from Live experiments. Limited interaction modalities, such as the absence of touch, means that the participant could not feel the robot or even go through the robot, which could potentially break the entire interaction. Figure 1: Photograph of the Live experiment setting However, with the help of the distribution of consumer-grade VR devices and online crowdsourcing platforms, VR HRI has the potential to gain massive data for training robotic behavior and studying HRI related issues. Data collection through VR can also reduce noise and improve the data quality [1], which help to ease data processing and algorithm training. Furthermore, VR HRI experiments can test concepts and interactions without physical robots, making it more resource efficient and less expensive than Live HRI. Less hardware also means that the experiment will be less cumbersome to set up, easier to be reproduced and to ensure experiment quality. In this study, HRI Proxemics (the preferred personal space between a human and a robot) was compared to give a better justification and more basic understanding of the relationship between Live and VR. Proxemics preferences rely on lower level intuition [7], therefore, reflect the differences in the perceptions between Live and VR better. Compared to other HRI subject such as conversational (audio) or gaze behavior (visual), which are more modality dependent, proxemics can give a comprehensive understanding of the human responses. In addition, variations of modalities in VR can greatly influence human perception. For example, a higher visual familiarity of the physical environment in VR can decrease the effect of distance distortion [8]. Auditory inputs play another important role in VR, the addition of spatial sound can increase the sense of presence in VR and provide sound localization [9]. Thus, this work also compares VR settings with variance in modalities to evaluate the impacts of visual familiarity and spatial sound on VR HRI experiments. A 2 x 3 mixed design experiment was conducted to evaluate the differences between Live and VR HRI, as well as the influence of visual familiarity and spatial sound in VR. For the Live HRI, the pepper robot from Softbank Robotics was used (Figure 1). In the VR HRI, a 3D model of the same robot was used. To measure visual familiarity, the VR scene was created in Blender based on a 3D scan of the physical lab. The spatial sound was created by enabling the movement of the physical robot, due to the difficulties of engineering spatial sound. The interaction was implemented in Unity. As an objective measurement for proxemics preference, the minimum comfort distance (MCD) was measured. In addition, for the psychological perception of the experience, the feeling of presence was measured with the SUS questionnaire. For the perception of the robot, two relevant factors, competence and discomfort was measured with the ROSAS questionnaire.",,2018.0,,semantic_scholar,multimedia,'multimedia' AND 'machine learning' AND ('real-world' AND 'deploy')
59e10d1d4cd454635914cfd0ac5160a318fd0473,https://www.semanticscholar.org/paper/59e10d1d4cd454635914cfd0ac5160a318fd0473,UB09 Session 9,"In the domain of Wireless Sensor Networks (WSN), providing an effective security solution to protect the motes and their communications is challenging. Due to the hard constraints on performance, storage and energy consumption, normal network-security related techniques cannot be applied. Focusing on the ""Intrusion Detection"" problem, we propose a realworld application of our WSN Intrusion Detection System (WIDS). WIDS exploits the Weak Process Models to classify potential security issues in the WSN and to notify the operators when an attack tentative is detected. In this demonstration, we show how our IDS works, how it detects some basic attacks and how the IDS can evolve to fullfil the needs of secure WSN deployments. Download Paper (PDF) UB09.2 RESCUE: EDA TOOLSET FOR INTERDEPENDENT ASPECTS OF RELIABILITY, SECURITY AND QUALITY IN NANOELECTRONIC SYSTEMS DESIGN Authors: Cemil Cem Gürsoy1, Guilherme Cardoso Medeiros2, Junchao Chen3, Nevin George4, Josie Esteban Rodriguez Condia5, Thomas Lange6, Aleksa Damljanovic5, Raphael Segabinazzi Ferreira4, Aneesh Balakrishnan6, Xinhui Anna Lai1, Shayesteh Masoumian7, Dmytro Petryk3, Troya Cagil Koylu2, Felipe Augusto da Silva8, Ahmet Cagri Bagbaba8 and Maksim Jenihhin1 1Tallinn University of Technology, EE; 2Delft University of Technology, NL; 3IHP, DE; 4BTU Cottbus-Senftenberg, DE; 5Politecnico di Torino, IT; 6IROC Technologies, FR; 7Intrinsic ID B.V., NL; 8Cadence Design Systems GmbH, DE Abstract The demonstrator will introduce an EDA toolset developed by a team of PhD students in the H2020-MSCA-ITN RESCUE project. The recent trends for the computing systems include machine intelligence in the era of IoT, complex safety-critical applications, extreme miniaturization of technologies and intensive interaction with the physical world. These trends set tough requirements on mutually dependent extra-functional design aspects. RESCUE is focused on the key challenges for reliability (functional safety, ageing, soft errors), security (tamper-resistance, PUF technology, intelligent security) and quality (novel fault models, functional test, FMEA/FMECA, verification/debug) and related EDA methodologies. The objective of the interdisciplinary cross-sectoral team from Tallinn UT, TU Delft, BTU Cottbus, POLITO, IHP, IROC, Intrinsic-ID, Cadence and Bosch is to develop in collaboration a holistic EDA toolset for modelling, assessment and enhancement of these extra-functional design aspects. Download Paper (PDF)The demonstrator will introduce an EDA toolset developed by a team of PhD students in the H2020-MSCA-ITN RESCUE project. The recent trends for the computing systems include machine intelligence in the era of IoT, complex safety-critical applications, extreme miniaturization of technologies and intensive interaction with the physical world. These trends set tough requirements on mutually dependent extra-functional design aspects. RESCUE is focused on the key challenges for reliability (functional safety, ageing, soft errors), security (tamper-resistance, PUF technology, intelligent security) and quality (novel fault models, functional test, FMEA/FMECA, verification/debug) and related EDA methodologies. The objective of the interdisciplinary cross-sectoral team from Tallinn UT, TU Delft, BTU Cottbus, POLITO, IHP, IROC, Intrinsic-ID, Cadence and Bosch is to develop in collaboration a holistic EDA toolset for modelling, assessment and enhancement of these extra-functional design aspects. Download Paper (PDF) UB09.3 ASAM: AUTOMATIC SYNTHESIS OF ALGORITHMS ON MULTI CHIP/FPGA WITH COMMUNICATION CONSTRAINTS Authors: Amir Masoud Gharehbaghi, Tomohiro Maruoka, Yukio Miyasaka, Akihiro Goda, Amir Masoud Gharehbaghi and Masahiro Fujita, The University of Tokyo, JP Abstract Mapping of large systems/computations on multiple chips/multiple cores needs sophisticated compilation methods. In this demonstration, we present our compiler tools for multi-chip and multi-core systems that considers communication architecture and the related constraints for optimal mapping. Specifically, we demonstrate compilation methods for multi-chip connected with ring topology, and multi-core connected with mesh topology, assuming fine-grained reconfigurable cores, as well as generalization techniques for large problems size as convolutional neural networks. We will demonstrate our mappings methods starting from data-flow graphs (DFGs) and equations, specifically with applications to convolutional neural networks (CNNs) for convolution layers as well as fully connected layers. Download Paper (PDF) UB09.4 HEPSYCODE-MC: ELECTRONIC SYSTEM-LEVEL METHODOLOGY FOR HW/SW CO-DESIGN OF MIXED-CRITICALITY EMBEDDED SYSTEMS Authors: Luigi Pomante1, Vittoriano Muttillo1, Marco Santic1 and Emilio Incerto2 1Università degli Studi dell'Aquila DEWS, IT; 2IMT Lucca, IT Abstract Heterogeneous parallel architectures have been recently exploited for a wide range of embedded application domains. Embedded systems based on such kind of architectures can include different processor cores, memories, dedicated ICs and a set of connections among them. Moreover, especially in automotive and aerospace application domains, they are even more subjected to mixed-criticality constraints. So, this demo addresses the problem of the ESL HW/SW co-design of mixed-criticality embedded systems that exploit hypervisor (HPV) technologies. In particular, it shows an enhanced CSP/SystemC-based design space exploration step, in the context of an existing HW/SW co-design flow that, given the system specification is able to (semi)automatically propose to the designer: a custom heterogeneous parallel HPV-based architecture; an HW/SW partitioning of the application; a mapping of the partitioned entities onto the proposed architecture. Download Paper (PDF)Heterogeneous parallel architectures have been recently exploited for a wide range of embedded application domains. Embedded systems based on such kind of architectures can include different processor cores, memories, dedicated ICs and a set of connections among them. Moreover, especially in automotive and aerospace application domains, they are even more subjected to mixed-criticality constraints. So, this demo addresses the problem of the ESL HW/SW co-design of mixed-criticality embedded systems that exploit hypervisor (HPV) technologies. In particular, it shows an enhanced CSP/SystemC-based design space exploration step, in the context of an existing HW/SW co-design flow that, given the system specification is able to (semi)automatically propose to the designer: a custom heterogeneous parallel HPV-based architecture; an HW/SW partitioning of the application; a mapping of the partitioned entities onto the proposed architecture. Download Paper (PDF) UB09.5 CS: CRAZYSQUARE Authors: Federica Caruso1, Federica Caruso1, Tania Di Mascio1, Alessandro D'Errico1, Marco Pennese2, Luigi Pomante1, Claudia Rinaldi1 and Marco Santic1 1University of L'Aquila, IT; 2Ministry of Education, IT Abstract CrazySquare (CS) is an adaptive learning system, developed as a serious game for music education, specifically indicated for young teenager approaching music for the first time. CS is based on recent educative directions which consist of using a more direct approach to sound instead of the musical notation alone. It has been inspired by a paper-based procedure that is currently used in an Italian middle school. CS represents a support for such teachers who prefer involving their students in a playful dimension of learning rhythmic notation and pitch, and, at the same time, teaching playing a musical instrument. To reach such goals in a cost-effective way, CS fully exploits all the recent advances in the EDA domain. In fact, it is based on a framework composed of mobile applications that will be integrated with augmented reality HW/SW tools to provide virtual/augmented musical instruments. The proposed demo will show the main features of the current CS framework implementation. Download Paper (PDF)CrazySquare (CS) is an adaptive learning system, developed as a serious game for music education, specifically indicated for young teenager approaching music for the first time. CS is based on recent educative directions which consist of using a more direct approach to sound instead of the musical notation alone. It has been inspired by a paper-based procedure that is currently used in an Italian middle school. CS represents a support for such teachers who prefer involving their students in a playful dimension of learning rhythmic notation and pitch, and, at the same time, teaching playing a musical instrument. To reach such goals in a cost-effective way, CS fully exploits all the recent advances in the EDA domain. In fact, it is based on a framework composed of mobile applications that will be integrated with augmented reality HW/SW tools to provide virtual/augmented musical instruments. The proposed demo will show the main features of the current CS framework implementation. Download Paper (PDF) UB09.6 LABSMILING: A SAAS FRAMEWORK, COMPOSED OF A NUMBER OF REMOTELY ACCESSIBLE TESTBEDS AND RELATED SW TOOLS, FOR ANALYSIS, DESIGN AND MANAGEMENT OF LOW DATA-RATE WIRELESS PERSONAL AREA NETWORKS BASED ON IEEE 802.15.4 Authors: Carlo Centofanti, Luigi Pomante, Marco Santic and Walter Tiberti, University of L'Aquila, IT Abstract Low data-rate wireless personal area networks (LR-WPANs) are constantly increasing their presence in the fields of IoT, wearable, home automation, health monitoring. The development, deployment and testing of SW based on IEEE 802.15.4 standard (and derivations, e.g. 15.4e), require the exploitation of a testbed as the network grows in complexity and heterogeneity. This demo shows LabSmiling: a SaaS framework which connects testbeds deployed in a real-world-environment and the related SW tools that make available a meaningful (but still scalable) number of physical devices (sensor nodes) to developers. It provides a comforta",,2019.0,,semantic_scholar,multimedia,'multimedia' AND 'machine learning' AND ('real-world' AND 'deploy')
d91b1b996678425418321d9de5b251778eb506d7,https://www.semanticscholar.org/paper/d91b1b996678425418321d9de5b251778eb506d7,Knowledge engineering with semantic web technologies for decision support systems based on psychological models of expertise,"Machines that provide decision support have traditionally used either a representation of human expertise or used mathematical algorithms. Each approach has its own limitations. This study helps to combine both types of decision support system for a single system. However, the focus is on how the machines can formalise and manipulate the human representation of expertise rather than on data processing or machine learning algorithms. It will be based on a system that represents human expertise in a psychological format. The particular decision support system for testing the approach is based on a psychological model of classification that is called the Galatean model of classification. The simple classification problems only require one XML structure to represent each class and the objects to be assigned to it. However, when the classification system is implemented as a decision support system within more complex realworld domains, there may be many variations of the class specification for different types of object to be assigned to the class in different circumstances and by different types of user making the classification decision. All these XML structures will be related to each other in formal ways, based on the original class specification, but managing their relationships and evolution becomes very difficult when the specifications for the XML variants are text-based documents. For dealing with these complexities a knowledge representation needs to be in a format that can be easily understood by human users as well as supporting ongoing knowledge engineering, including evolution and consistency of knowledge. The aim is to explore how semantic web technologies can be employed to help the knowledge engineering process for decision support systems based on human expertise, but deployed in complex domains with variable circumstances. The research evaluated OWL as a suitable vehicle for representing psychological expertise. The task was to see how well it can provide a machine formalism for the knowledge without losing its psychological validity or transparency: that is, the ability of end users to understand the knowledge representation intuitively despite its OWL format. The OWL Galatea model is designed in this study to help in automatic knowledge maintenance, reducing the replication of knowledge with variant uncertainties and support in knowledge engineering processes. The OWL-based approaches used in this model also aid in the adaptive knowledge management. An adaptive assessment questionnaire is an example of it, which is dynamically derived using the users age as the seed for creating the alternative questionnaires. The credibility of the OWL Galatea model is tested by applying it on two extremely different assessment domains (i.e. GRiST and ADVANCE). The conclusions are that OWLbased specifications provide the complementary structures for managing complex knowledge based on human expertise without impeding the end users’ understanding of the knowledgebase. The generic classification model is applicable to many domains and the accompanying OWL specification facilitates its implementations.",,2016.0,,semantic_scholar,multimedia,'multimedia' AND 'machine learning' AND ('real-world' AND 'deploy')
f2b4d4cba21fbaafdd4c2775d6d046268bda7289,https://www.semanticscholar.org/paper/f2b4d4cba21fbaafdd4c2775d6d046268bda7289,Intelligent Video QoE Prediction Model for Errorprone Networks,"Objective: Quantifying the quality of video transmitted over diversified networks is becoming critical in the frontiers of digital video Communication. The exponential growth of video-driven applications in wireless domain have created plethora of research issues to be explored in real time. Estimation of video quality in wireless environment requires the conception of better framework and methodologies to improve users’ Quality of Experience (QoE).This paper depicts a novel QoE prediction model that uses machine learning algorithms in predicting video quality over an error prone environment with better prediction accuracy. Methods: The work deploys Pseudo Subjective Quality Assessment (PSQA) method that involves a hybrid technique in assessing the multimedia quality using WEKA machine learning workbench. Findings: The proposed model provides a comparative study of well-known Artificial Intelligence (AI) techniques in predicting the perceived quality of multimedia and the efficiency is analyzed using performance indicators such as Root Mean Squared Error, Correlation Coefficient and Mean Absolute Error. The results of the proposed method underline the effective and inherent advantage in using machine learning methods for video quality prediction. Application: The evaluation results exemplify the importance of applying machine learning paradigms in broad areas of visual quality assessment. The output of various error measures and error variation analysis of the model shows the superiority of Multilayer perceptron based AI technique over other methods.",,2015.0,10.17485/IJST/2015/V8I16/65562,semantic_scholar,multimedia,'multimedia' AND 'machine learning' AND ('real-world' AND 'deploy')
