paperId,url,title,abstract,venue,year,externalIds.DOI,database,query_name,query_value
0bca80c452d4f2900a17acaa476c36e92df9a3af,https://www.semanticscholar.org/paper/0bca80c452d4f2900a17acaa476c36e92df9a3af,"DISSIMILAR: Towards fake news detection using information hiding, signal processing and machine learning","Digital media have changed the classical model of mass media that considers the transmitter of a message and a passive receiver, to a model where users of the digital media can appropriate the contents, recreate, and circulate them. In this context, online social media are a suitable circuit for the distribution of fake news and the spread of disinformation. Particularly, photo and video editing tools and recent advances in artificial intelligence allow non-professionals to easily counterfeit multimedia documents and create deep fakes. To avoid the spread of disinformation, some online social media deploy methods to filter fake content. Although this can be an effective method, its centralized approach gives an enormous power to the manager of these services. Considering the above, this paper outlines the main principles and research approach of the ongoing DISSIMILAR project, which is focused on the detection of fake news on social media platforms using information hiding techniques, in particular, digital watermarking, combined with machine learning approaches.",ARES,2021.0,10.1145/3465481.3470088,semantic_scholar,multimedia,'multimedia' AND 'machine learning' AND ('real-world' AND 'deploy')
1d3539a8d94bd3ab78993d7cc584efc06ed0e460,https://www.semanticscholar.org/paper/1d3539a8d94bd3ab78993d7cc584efc06ed0e460,Synthetic Benchmarks for Scientific Research in Explainable Machine Learning,"As machine learning models grow more complex and their applications become more high-stakes, tools for explaining model predictions have become increasingly important. This has spurred a flurry of research in model explainability and has given rise to feature attribution methods such as LIME and SHAP. Despite their widespread use, evaluating and comparing different feature attribution methods remains challenging: evaluations ideally require human studies, and empirical evaluation metrics are often data-intensive or computationally prohibitive on realworld datasets. In this work, we address this issue by releasing XAI-BENCH: a suite of synthetic datasets along with a library for benchmarking feature attribution algorithms. Unlike real-world datasets, synthetic datasets allow the efficient computation of conditional expected values that are needed to evaluate groundtruth Shapley values and other metrics. The synthetic datasets we release offer a wide variety of parameters that can be configured to simulate real-world data. We demonstrate the power of our library by benchmarking popular explainability techniques across several evaluation metrics and across a variety of settings. The versatility and efficiency of our library will help researchers bring their explainability methods from development to deployment. Our code is available at https://github.com/abacusai/xai-bench.",NeurIPS Datasets and Benchmarks,2021.0,,semantic_scholar,multimedia,'multimedia' AND 'machine learning' AND ('real-world' AND 'deploy')
5d730d20cb53ecda86ced0a053b95dc07f9eb72e,https://www.semanticscholar.org/paper/5d730d20cb53ecda86ced0a053b95dc07f9eb72e,Veracity Assessment of Multimedia Facebook Posts for Infodemic Symptom Detection using Bi-modal Unsupervised Machine Learning Approach,"Abstract: Ascertaining the truthfulness and trustworthiness of information posted on social media has been challenging with the proliferation of unsubstantiated, misleading, and inciting news, with different intents by purveyors. Unlike the traditional media with some level of regulations, user-generated posts on social networks does not pass through censorships in order to establish the truism of news items hence the need to be cautious of posted information on the networks. The lingering issue of recent suspension of Twitter microblogging site by the Nigerian government and the consequent decision to regulate social network operations in the country similarly centers on the subject of social media dependability for legitimate social engagements by millions of savvy Nigerian users. Whereas existing models in literature have proposed state-of-the-arts, this study seeks to improve on obtainable studies with a bi-modal machine learning methodology that indicate symptoms of infodemic social media posts. Using a multimedia facebook corpus, an unsupervised natural language processor, Inception v3 model, coupled with a hierarchical clustering network, is deployed for the duo of image and text sentiment analytics. Experimental result uniquely identified infodemic tendencies in facebook text-corpus and efficiently differentiates image-corpus into respective clusters through the Euclidian distance metrics. The most infodemic post returned a -0.9719 compound score while the most positive post returns 0.9488. Veracity assessment of polarized opinions expressed in negative clusters reveals that provocative, derogatory, obnoxious, etc. indicate propensity for infodemic tendencies. Keywords: Fake news. Facebook. Social media. Sentiment Analysis. Infodemic",International Journal for Research in Applied Science and Engineering Technology,2021.0,10.22214/ijraset.2021.39406,semantic_scholar,multimedia,'multimedia' AND 'machine learning' AND ('real-world' AND 'deploy')
a0051e9e2e42f26077b35801c0f504a0eeb328dc,https://www.semanticscholar.org/paper/a0051e9e2e42f26077b35801c0f504a0eeb328dc,MADP-IIME: malware attack detection protocol in IoT-enabled industrial multimedia environment using machine learning approach,,,2021.0,10.1007/S00530-020-00743-9,semantic_scholar,multimedia,'multimedia' AND 'machine learning' AND ('real-world' AND 'deploy')
ed9b2c4d4ea93d86a6e1167c9e92cfa0a243c4bc,https://www.semanticscholar.org/paper/ed9b2c4d4ea93d86a6e1167c9e92cfa0a243c4bc,Challenges and Opportunities for Unikernels in Machine Learning Inference,"Machine Learning has become a value creator for many new and old businesses. However, efficient realworld machine learning deployments are still a challenge. Traditional Machine Learning deployments suffer from efficient resource utilization and achieving predictable latency. They cannot be treated in the same manner as other application server deployments. Unikernels are a method to specialize application deployment and performance to suit the needs of the application. Traditionally, building or porting applications to unikernels have been challenging. However, recent work has been into simplifying the development of unikernels. Real-world Unikernels as of now are only for specializing applications that run on the CPU. We survey machine learning practitioners and find out that the majority of machine learning practitioners are using the CPU for machine learning deployments, thus, creating an opportunity for unikernels to optimize the performance of these applications. We compare the architecture of two unikernels: nanos and Unikraft. We benchmarked scikit-learn, a popular machine library, inside a unikernel and found that it only offered a 1% advantage over a traditional deployment. However, our testing could not include more innovative systems like Unikraft due to their immaturity and inability to run machine learning libraries. We include a dependency analysis of three popular machine learning libraries Tensorflow Lite, PyTorch and ONNX, to help pave the way for building machine learning applications as Unikraft unikernels.","2021 9th International Conference on Reliability, Infocom Technologies and Optimization (Trends and Future Directions) (ICRITO)",2021.0,10.1109/icrito51393.2021.9596080,semantic_scholar,multimedia,'multimedia' AND 'machine learning' AND ('real-world' AND 'deploy')
b14558c0b727af0ac9086f463b6030b9072dbe16,https://www.semanticscholar.org/paper/b14558c0b727af0ac9086f463b6030b9072dbe16,Methods for Automatic Machine-Learning Workflow Analysis,,ECML/PKDD,2021.0,10.1007/978-3-030-86517-7_4,semantic_scholar,multimedia,'multimedia' AND 'machine learning' AND ('real-world' AND 'deploy')
56e63ffea11c875f7eee257798e18cd04e453b6c,https://www.semanticscholar.org/paper/56e63ffea11c875f7eee257798e18cd04e453b6c,Synthetic Benchmarks for Scientific Research in Explainable Machine Learning,"As machine learning models grow more complex and their applications become more high-stakes, tools for explaining model predictions have become increasingly important. This has spurred a flurry of research in model explainability and has given rise to feature attribution methods such as LIME and SHAP. Despite their widespread use, evaluating and comparing different feature attribution methods remains challenging: evaluations ideally require human studies, and empirical evaluation metrics are often data-intensive or computationally prohibitive on realworld datasets. In this work, we address this issue by releasing XAI-BENCH: a suite of synthetic datasets along with a library for benchmarking feature attribution algorithms. Unlike real-world datasets, synthetic datasets allow the efficient computation of conditional expected values that are needed to evaluate groundtruth Shapley values and other metrics. The synthetic datasets we release offer a wide variety of parameters that can be configured to simulate real-world data. We demonstrate the power of our library by benchmarking popular explainability techniques across several evaluation metrics and across a variety of settings. The versatility and efficiency of our library will help researchers bring their explainability methods from development to deployment. Our code is available at https://github.com/abacusai/xai-bench.",,2021.0,,semantic_scholar,multimedia,'multimedia' AND 'machine learning' AND ('real-world' AND 'deploy')
d87648a18c4b7f095baef04ca817cf0fa568e643,https://www.semanticscholar.org/paper/d87648a18c4b7f095baef04ca817cf0fa568e643,Assessment of Machine Learning-Based Audiovisual Quality Predictors,"Quality assessment of audiovisual (AV) signals is important from the perspective of system design, optimization, and management of a modern multimedia communication system. However, automatic prediction of AV quality via the use of computational models remains challenging. In this context, machine learning (ML) appears to be an attractive alternative to the traditional approaches. This is especially when such assessment needs to be made in no-reference (i.e., the original signal is unavailable) fashion. While development of ML-based quality predictors is desirable, we argue that proper assessment and validation of such predictors is also crucial before they can be deployed in practice. To this end, we raise some fundamental questions about the current approach of ML-based model development for AV quality assessment and signal processing for multimedia communication in general. We also identify specific limitations associated with the current validation strategy which have implications on analysis and comparison of ML-based quality predictors. These include a lack of consideration of: (a) data uncertainty, (b) domain knowledge, (c) explicit learning ability of the trained model, and (d) interpretability of the resultant model. Therefore, the primary goal of this article is to shed some light into mentioned factors. Our analysis and proposed recommendations are of particular importance in the light of significant interests in ML methods for multimedia signal processing (specifically in cases where human-labeled data is used), and a lack of discussion of mentioned issues in existing literature.",ACM Trans. Multim. Comput. Commun. Appl.,2021.0,10.1145/3430376,semantic_scholar,multimedia,'multimedia' AND 'machine learning' AND ('real-world' AND 'deploy')
19552c33b6144ba9cf02b52310cfdccdc66b14f2,https://www.semanticscholar.org/paper/19552c33b6144ba9cf02b52310cfdccdc66b14f2,Empirical observation of negligible fairness-accuracy trade-offs in machine learning for public policy,,Nat. Mach. Intell.,2020.0,10.1038/s42256-021-00396-x,semantic_scholar,multimedia,'multimedia' AND 'machine learning' AND ('real-world' AND 'deploy')
b14692c1e0658dd1d814c737171ce714b1588360,https://www.semanticscholar.org/paper/b14692c1e0658dd1d814c737171ce714b1588360,An Intelligent UAV Deployment Scheme for Load Balance in Small Cell Networks Using Machine Learning,"In wireless networks, network load can be highly unbalanced due to the mobility of user equipments (UEs). Unmanned Aerial Vehicles (UAVs) supported base station with the advantage of flexible deployment, ubiquitous wireless coverage and high speed data rate, is a promising approach to handle with the foregoing problem. However, how to achieve cost-effective UAV deployment in an autonomous and dynamic manner is a significant challenge. Facing this problem, we propose a novel UAV base station intelligent deployment scheme based on machine learning and evaluate its performance on a realworld dataset. First, we conduct data preprocessing to process, clean, and transform raw data into formatted data. Missing values are filled by Conditional Mean Imputation (CMI) method and outliers are corrected by pauta criterion. Then, we use hybrid approach which contains ARIMA model and XGBoost model. Linear predictions are carried out by ARIMA model and later nonlinear model XGBoost are applied on residue of ARIMA. Resultant prediction is obtained by adding linear and nonlinear prediction, hybrid model is estimated by Root Mean Square Error (RMSE) and R2 score. Finally, according to predicted results, UAV base stations can be deployed to cater for dynamically changing demands in the hotspot areas and achieve cost-effective deployment. Simulation results show that the propose scheme is superior to other benchmark schemes in load balancing.",2019 IEEE Wireless Communications and Networking Conference (WCNC),2019.0,10.1109/WCNC.2019.8885648,semantic_scholar,multimedia,'multimedia' AND 'machine learning' AND ('real-world' AND 'deploy')
d94808b3136a60218132744df149e414bdccfacf,https://www.semanticscholar.org/paper/d94808b3136a60218132744df149e414bdccfacf,Machine-Assisted Learning in Highly-Interdisciplinary Media Fields: A Multimedia Guide on Modern Art,"Art and technology have always been very tightly intertwined, presenting strong influences on each other. On the other hand, technological evolution led to today’s digital media landscape, elaborating mediated communication tools, thus providing new creative means of expression (i.e., new-media art). Rich-media interaction can expedite the whole process into an augmented schooling experience though art cannot be easily enclosed in classical teaching procedures. The current work focuses on the deployment of a modern-art web-guide, aiming at enhancing traditional approaches with machine-assisted blended-learning. In this perspective, “machine” has a two-folded goal: to offer highly-interdisciplinary multimedia services for both in-class demonstration and self-training support, and to crowdsource users’ feedback, as to train artificial intelligence systems on painting movements semantics. The paper presents the implementation of the “Istoriart” website through the main phases of Analysis, Design, Development, and Evaluation, while also answering typical questions regarding its impact on the targeted audience. Hence, elaborating on this constructive case study, initial hypotheses on the multidisciplinary usefulness, and contribution of the new digital services are put into test and verified.",Education Sciences,2019.0,10.3390/EDUCSCI9030198,semantic_scholar,multimedia,'multimedia' AND 'machine learning' AND ('real-world' AND 'deploy')
2303bdc62a575f3825e691e7cb4d5c48f0baf2d6,https://www.semanticscholar.org/paper/2303bdc62a575f3825e691e7cb4d5c48f0baf2d6,Detección de anomalías de red mediante técnicas de machine learning,"In the current scenario [1] with an increase of traffic (due to the proliferation of the internet of things, the rise of the philosophy of always connected and the increase in multimedia services, cloud, videoconferencing and its associated traffic) along with the proliferation of attacks and new threats, there is a need for fast and adaptable defense models. There are different approaches when dealing with the study of network traffic, but the use of the aggregation approach, both in the capture as in the analysis, comes to partially solve the problems of the huge amounts of traffic that support day-to-day traffic of the organizations. The aggregation allows grouping the traffic, at any given time, in a sequence of packets that share certain values, getting this way reduce the volume of data to be processedwithout losing the relevant information. Despite the reduction in the volume of information, achieved through the use of flows, the use of Big Data techniques to analyze it is still necessary. The current boom in machine learning techniques, hereinafter ML, together with the growth, availability and simplicity of use of distributed computing, provide us with the necessary tools to undertake the tasks focused on the analysis of aggregate traffic. The main objective of this project is to compare and understand different ML techniques applied to the real-time detection of anomalous behaviors in a network’s traffic. In a transversal way we will focus on aspects such as the capture of flows or the implementation and deployment of a distributed solution as tools to provide our model with the expected characteristics of performance and scalability..",,2019.0,,semantic_scholar,multimedia,'multimedia' AND 'machine learning' AND ('real-world' AND 'deploy')
26937db6917952a9c13bfe152eddd7defc08e695,https://www.semanticscholar.org/paper/26937db6917952a9c13bfe152eddd7defc08e695,Guest Editorial: Special Issue on Machine Learning Implementations,,J. Signal Process. Syst.,2019.0,10.1007/s11265-018-1432-1,semantic_scholar,multimedia,'multimedia' AND 'machine learning' AND ('real-world' AND 'deploy')
216f468fbbf5a409c363626e697cab836fcd32a3,https://www.semanticscholar.org/paper/216f468fbbf5a409c363626e697cab836fcd32a3,Securing IP-Multimedia Subsystem (IMS) against Anomalous Message Exploits by Using Machine Learning Algorithms,"Modern communication infrastructure (IP Multimedia Subsystem (IMS) and Voice over IP (VoIP)) are vulnerable to zero day attacks and unknown threats. Anomalous SIP requests can be used to remotely launch malicious activity. Furthermore, anomalous messages are capable of crashing - sometimes with one message only - servers and end points. Recently, it is shown that a malicious SIP message ""INVITE of Death"" crash a server or gain unfettered access to it. In contrast, little research is done to protect IMS against such anomalous messages. In this paper, we propose an anomalous message detection framework that extracts novel syntactical features from SIP messages at the P-CSCF of an IMS. Our framework operates in four steps: (1) analyzes the byte-level distribution of SIP message, (2) extracts spatial features from IMS messages in form of byte transition probabilities, (3) uses well-known feature selection scheme to remove redundancy in the features set, and (4) uses standard machine learning algorithms to raise the final alarm. The benefit of our framework is that it is lightweight requiring less processing and memory resources and provides high detection accuracy. We have evaluated our system on a real-world IMS dataset consisting of more than 10, 000 benign and malicious SIP messages. The results of our experiments demonstrate that using machine learning algorithms, our framework achieves detection accuracy of more than 99%. Last but not least, its testing time is 152μ seconds per packet, as a result, it can be easily deployed on IMS core.",2011 Eighth International Conference on Information Technology: New Generations,2011.0,10.1109/ITNG.2011.102,semantic_scholar,multimedia,'multimedia' AND 'machine learning' AND ('real-world' AND 'deploy')
5994ea254d8e60e9b240cf0c3824b3e5f40df85a,https://www.semanticscholar.org/paper/5994ea254d8e60e9b240cf0c3824b3e5f40df85a,Machine Learning for Indoor Localization Using Mobile Phone-Based Sensors,"In this paper we investigate the problem of localizing a mobile device based on readings from its embedded sensors utilizing machine learning methodologies. We consider a realworld environment, collect a large dataset of 3110 datapoints, and examine the performance of a substantial number of machine learning algorithms in localizing a mobile device. We have found algorithms that give a mean error as accurate as 0.76 meters, outperforming other indoor localization systems reported in the literature. We also propose a hybrid instance-based approach that results in a speed increase by a factor of ten with no loss of accuracy in a live deployment over standard instance-based methods, allowing for fast and accurate localization. Further, we determine how smaller datasets collected with less density affect accuracy of localization, important for use in real-world environments. Finally, we demonstrate that these approaches are appropriate for real-world deployment by evaluating their performance in an online, in-motion experiment.",ArXiv,2015.0,10.1109/CCNC.2016.7444919,semantic_scholar,multimedia,'multimedia' AND 'machine learning' AND ('real-world' AND 'deploy')
fbbee5da12c0e0f15813254b9ffca18e339d3546,https://www.semanticscholar.org/paper/fbbee5da12c0e0f15813254b9ffca18e339d3546,10 - Machine learning for future intelligent air quality networks,"During the last few years, machine learning emerged as a very effective tool for data analysis and sematic value extraction from the large amount of data generated from deployed chemical multisensors devices. Many works have now highlighted the potential impact on multisensor device calibration, drift counteraction, data assimilation, optimal deployment of these classes of algorithms. Unlike 5 years ago, the huge amount of available data make possible to confirm this potential on realworld long-term deployments. This work analyze the literature produced by EuNetAir partners extracting the lessons cooperatively learnt about their impact and propose a novel architecture for future intelligent air quality networks based on the machine learning emerging paradigm.",,2016.0,10.5162/6EuNetAir2016/10,semantic_scholar,multimedia,'multimedia' AND 'machine learning' AND ('real-world' AND 'deploy')
