doi,type,query_name,query_value,publication,publisher,publication_date,database,title,url,abstract,status,semantic_score,id
bca16316e435349f7f793248813cac40b61083d2,preprocessed,citation,citation,semantic_scholar,2024 IEEE International Conference on Blockchain and Distributed Systems Security (ICBDS),2024.0,semantic_scholar,enhancing road safety: the role of intelligent driver drowsiness detection systems,https://www.semanticscholar.org/paper/bca16316e435349f7f793248813cac40b61083d2,"The analysis of this research paper is touching the road safety concerns by focusing on developing a system which catches the drowsy state of the person who is driving which emerges as a big reason that causes up to 30due to this. Throughout the paper, the study discusses about literature review and various methodologies that include physiological, behavioural, and multimodal fusion approaches showing the evolution and history of drowsiness detection technologies. The methodology includes using of various sensor technologies and algorithms to collect data from the driver and process it to analyse data in real time. Eye movement and facial expressions are extracted which helps the system to identify signs of drowsiness with greater accuracy. When the driver is detected as drowsy a mechanism is triggered to alert the driver, averting accidents. Even with some challenges, the system is a big step towards increasing road safety utilizing advanced technologies to reduce the risk of driver fatigueless.",not included,0.8062968552112579,34
c280ddd2030f51f9677d5451b972488251995650,preprocessed,citation,citation,semantic_scholar,Current Oncology,2024.0,semantic_scholar,"the role of artificial intelligence on tumor boards: perspectives from surgeons, medical oncologists and radiation oncologists",https://www.semanticscholar.org/paper/c280ddd2030f51f9677d5451b972488251995650,"The integration of multidisciplinary tumor boards (MTBs) is fundamental in delivering state-of-the-art cancer treatment, facilitating collaborative diagnosis and management by a diverse team of specialists. Despite the clear benefits in personalized patient care and improved outcomes, the increasing burden on MTBs due to rising cancer incidence and financial constraints necessitates innovative solutions. The advent of artificial intelligence (AI) in the medical field offers a promising avenue to support clinical decision-making. This review explores the perspectives of clinicians dedicated to the care of cancer patients—surgeons, medical oncologists, and radiation oncologists—on the application of AI within MTBs. Additionally, it examines the role of AI across various clinical specialties involved in cancer diagnosis and treatment. By analyzing both the potential and the challenges, this study underscores how AI can enhance multidisciplinary discussions and optimize treatment plans. The findings highlight the transformative role that AI may play in refining oncology care and sustaining the efficacy of MTBs amidst growing clinical demands.",not included,0.8065193235874176,35
2c98d009dba99c385c421fcfd99fc16e9198e818,preprocessed,citation,citation,semantic_scholar,Applied Psychology Research,2024.0,semantic_scholar,ethical deployment of cognitive biases in marketing a framework for responsible influence,https://www.semanticscholar.org/paper/2c98d009dba99c385c421fcfd99fc16e9198e818,"This paper examines the intersection of cognitive biases and ethical marketing practices, highlighting how psychological principles can influence consumer behavior within ethical boundaries. Cognitive biases such as scarcity bias, authority bias, the halo effect, and confirmation bias significantly shape consumer perceptions and decisions. However, their application in marketing raises complex ethical concerns, particularly regarding consumer autonomy and the potential for manipulation. This study proposes a conceptual framework that integrates ethical guidelines with marketing strategies that utilize cognitive biases. Through a comprehensive literature review and theoretical analysis, this paper outlines the implications of these biases in marketing, develops a set of ethical guidelines, and discusses the broader impacts on consumer trust and brand integrity. The findings give marketers practical insights for ethically harnessing cognitive biases, ensuring that marketing practices drive business success and maintain consumer respect and loyalty.",not included,0.826026663184166,36
2aee26dd83ba733b3bf3cfa6c89177abaa1f4904,preprocessed,citation,citation,semantic_scholar,The Florida AI Research Society,2024.0,semantic_scholar,sharing accountability of versatile ai systems: the role of developers and practitioners,https://www.semanticscholar.org/paper/2aee26dd83ba733b3bf3cfa6c89177abaa1f4904,"AI systems pose both opportunities and threats in various industries. To harness these opportunities and mitigate risks, accountability is crucial. Traditionally, developers bear the responsibility for auditing and modifying algorithms. How-ever, in the evolving landscape of versatile AI, developers may lack contextual understanding across diverse fields. This paper proposes a theoretical framework that distributes accountability to developers and practitioners according to their capabilities. This framework enhances systemic com-prehension of shared roles, empowering both groups to col-laboratively avert potential adverse impacts.",not included,0.8288842886686325,37
82164ac956e42b26ed64e9741f175d792c95b93f,preprocessed,citation,citation,semantic_scholar,arXiv.org,2023.0,semantic_scholar,"the ethics of ai value chains: an approach for integrating and expanding ai ethics research, practice, and governance",https://www.semanticscholar.org/paper/82164ac956e42b26ed64e9741f175d792c95b93f,"Researchers, practitioners, and policymakers with an interest in AI ethics need more integrative approaches for studying and intervening in AI systems across many contexts and scales of activity. This paper presents AI value chains as an integrative concept that satisfies that need. To more clearly theorize AI value chains and conceptually distinguish them from supply chains, we review theories of value chains and AI value chains from the strategic management, service science, economic geography, industry, government, and applied research literature. We then conduct an integrative review of a sample of 67 sources that cover the ethical concerns implicated in AI value chains. Building upon the findings of our integrative review, we recommend three future directions that researchers, practitioners, and policymakers can take to advance more ethical practices across AI value chains. We urge AI ethics researchers and practitioners to move toward value chain perspectives that situate actors in context, account for the many types of resources involved in co-creating AI systems, and integrate a wider range of ethical concerns across contexts and scales.",not included,0.8351606994867324,38
7c8a533175c24ceff2cdb82dfd340065cc93a1ce,preprocessed,citation,citation,semantic_scholar,Applied Sciences,2023.0,semantic_scholar,"re-thinking data strategy and integration for artificial intelligence: concepts, opportunities, and challenges",https://www.semanticscholar.org/paper/7c8a533175c24ceff2cdb82dfd340065cc93a1ce,"The use of artificial intelligence (AI) is becoming more prevalent across industries such as healthcare, finance, and transportation. Artificial intelligence is based on the analysis of large datasets and requires a continuous supply of high-quality data. However, using data for AI is not without challenges. This paper comprehensively reviews and critically examines the challenges of using data for AI, including data quality, data volume, privacy and security, bias and fairness, interpretability and explainability, ethical concerns, and technical expertise and skills. This paper examines these challenges in detail and offers recommendations on how companies and organizations can address them. By understanding and addressing these challenges, organizations can harness the power of AI to make smarter decisions and gain competitive advantage in the digital age. It is expected, since this review article provides and discusses various strategies for data challenges for AI over the last decade, that it will be very helpful to the scientific research community to create new and novel ideas to rethink our approaches to data strategies for AI.",included,0.8206197261810303,39
6a7e30d7ed98bc6cbd77d63931c45eb4b24f02a8,preprocessed,citation,citation,semantic_scholar,,2022.0,semantic_scholar,a principles-based ethical assurance argument pattern for ai and autonomous systems,https://www.semanticscholar.org/paper/6a7e30d7ed98bc6cbd77d63931c45eb4b24f02a8,"An assurance case presents a clear and defensible argument, supported by evidence, that a system will operate as intended in a particular context. Typically, an assurance case presents an argument that a system will be acceptably safe in its intended context. One emerging proposal within the Trustworthy AI research community is to extend and apply this methodology to provide assurance that the use of an AI system or an autonomous system (AI/AS) will be acceptably ethical in a particular context. In this paper, we advance this proposal further. We do so by presenting a principles-based ethical assurance (PBEA) argument pattern for AI/AS. The PBEA argument pattern offers a framework for reasoning about the overall ethical acceptability of the use of a given AI/AS and it could be an early prototype template for specific ethical assurance cases. The four core ethical principles that form the basis of the PBEA argument pattern are: justice; beneficence; non-maleficence; and respect for personal autonomy. Throughout, we connect stages of the argument pattern to examples of AI/AS applications. This helps to show its initial plausibility. The aim of this paper is to shape the debate around adapting the assurance case methodology to reason about ethically justifiable risk acceptance in the context of AI/AS. As a work in progress, we welcome comments to the corresponding author. 2",not included,0.8252739846706391,40
34779d3610536a4d0f1f6609cab11955704082bd,preprocessed,citation,citation,semantic_scholar,,,semantic_scholar,decentralized innovation: exploring the impact of blockchain technology in software development,https://www.semanticscholar.org/paper/34779d3610536a4d0f1f6609cab11955704082bd,",",not included,0.819400179386139,41
a40fe47a4cf069fb0a824778d374749370d2dc93,preprocessed,citation,citation,semantic_scholar,,,semantic_scholar,the confluence of big data and artificial intelligence: unraveling complex patterns and unveiling novel paradigms for transformative knowledge discovery,https://www.semanticscholar.org/paper/a40fe47a4cf069fb0a824778d374749370d2dc93,": The research paper embarks on an exploratory journey into the intricate intersection of big data and artificial intelligence (AI). This study aims to unravel complex patterns within massive datasets and illuminate novel paradigms, fostering transformative knowledge discovery in an era defined by unprecedented data volume and advanced AI capabilities. The abstract commences by acknowledging the synergy between big data and AI, positioning them as intertwined forces shaping the landscape of knowledge discovery. The paper underscores the need to unravel intricate patterns within vast datasets, emphasizing the transformative potential of this confluence.",not included,0.8052007794380188,42
60915efd60a37edaf553259d757ce994d5e3e430,preprocessed,citation,citation,semantic_scholar,European Conference on Information Systems,2024.0,semantic_scholar,unraveling the nuances of ai accountability: a synthesis of dimensions across disciplines,https://www.semanticscholar.org/paper/60915efd60a37edaf553259d757ce994d5e3e430,"The widespread diffusion of Artificial Intelligence (AI)-based systems offers many opportunities to contribute to the well-being of individuals and the advancement of economies and societies. This diffusion is, however, closely accompanied by public scandals causing harm to individuals, markets, or society, and leading to the increasing importance of accountability. AI accountability itself faces conceptual ambiguity, with research scattered across multiple disciplines. To address these issues, we review current research across multiple disciplines and identify key dimensions of accountability in the context of AI. We reveal six themes with 13 corresponding dimensions and additional accountability facilitators that future research can utilize to specify accountability scenarios in the context of AI-based systems.",not included,0.8411970287561417,43
59124702b213e415f95a1b938aa56981cd3553d1,preprocessed,citation,citation,semantic_scholar,2023 International Conference on Integrated Intelligence and Communication Systems (ICIICS),2023.0,semantic_scholar,analysis system of english translation on cloud platform based on artificial intelligence,https://www.semanticscholar.org/paper/59124702b213e415f95a1b938aa56981cd3553d1,"The rapid development of artificial intelligence has greatly affected various fields including language translation. This paper aims to explore the design and implementation of an AI cloud platform developed specifically for English translation analysis. This is a research work that uses artificial intelligence technology to improve the quality and efficiency of English translation. In this system, artificial intelligence is applied in every link, from data processing to model training and result generation, to achieve more accurate and smooth translation. This paper mainly applies the experimental method and comparative method, proposes machine translation from artificial intelligence, and tests the English translation analysis system on the cloud platform. The experimental results show that the fidelity and fluency of the optical translation system are the highest, respectively 59% and 59.8%, and its translation level is the highest in the experiment. But at the same time, there are still some problems in machine translation, so it is necessary to summarize from its error types and make improvements.",not included,0.8062968552112579,44
e0f63483b9daba4f0e81486651a6f768a9e8b9d8,preprocessed,citation,citation,semantic_scholar,Inf.,2023.0,semantic_scholar,ethics and trustworthiness of ai for predicting the risk of recidivism: a systematic literature review,https://www.semanticscholar.org/paper/e0f63483b9daba4f0e81486651a6f768a9e8b9d8,"Artificial Intelligence (AI) can be very beneficial in the criminal justice system for predicting the risk of recidivism. AI provides unrivalled high computing power, speed, and accuracy; all harnessed to strengthen the efficiency in predicting convicted individuals who may be on the verge of recommitting a crime. The application of AI models for predicting recidivism has brought positive effects by minimizing the possible re-occurrence of crime. However, the question remains of whether criminal justice system stakeholders can trust AI systems regarding fairness, transparency, privacy and data protection, consistency, societal well-being, and accountability when predicting convicted individuals’ possible risk of recidivism. These are all requirements for a trustworthy AI. This paper conducted a systematic literature review examining trust and the different requirements for trustworthy AI applied to predicting the risks of recidivism. Based on this review, we identified current challenges and future directions regarding applying AI models to predict the risk of recidivism. In addition, this paper provides a comprehensive framework of trustworthy AI for predicting the risk of recidivism.",not included,0.8065193235874176,45
e127da5ed504a9f3d143554242a93b7620743d25,preprocessed,citation,citation,semantic_scholar,Journal of Global Information Management,2024.0,semantic_scholar,optimizing digital market decision-making through artificial intelligence platforms,https://www.semanticscholar.org/paper/e127da5ed504a9f3d143554242a93b7620743d25,"As artificial intelligence rapidly advances, addressing the interplay of technical, ethical, and risk factors in optimizing digital market decision-making through AI platforms has become increasingly prominent. However, the impact of these factors on market performance, particularly in investment value, remains underexplored. The study, based on 412 validated responses from service industry professionals gathered through a carefully designed questionnaire, aims to predict the relationship among these factors and their influence on market performance. It also explores how cognitive engagement mediates the relationship between AI platforms and financial metrics. Key findings:(1) the interplay of technical, ethical, and risk factors optimizes market decision-making and guides AI investments; (2) cognitive engagement, especially in the services sector, is essential to maximize the impact of AI platforms on market performance. The study provides valuable insights into AI's role in shaping market dynamics within the services sector and relevant governance recommendations for policymakers.",not included,0.8411970287561417,46
73cdcbd57cadcaecbac76a0af9b75bf304e18011,preprocessed,citation,citation,semantic_scholar,Frontiers Artif. Intell.,2024.0,semantic_scholar,exploring how ai adoption in the workplace affects employees: a bibliometric and systematic review,https://www.semanticscholar.org/paper/73cdcbd57cadcaecbac76a0af9b75bf304e18011,"Introduction The adoption of artificial intelligence (AI) in the workplace is changing the way organizations function, and profoundly affecting employees. These organizational changes raise crucial questions about the employee’s future and well-being. Our study aims to explore the intersection between artificial intelligence and employee well-being through a bibliometric review and a contextual analysis. Methodology Carried out in May 2024, our study is divided into two phases. The first phase, dedicated to bibliometric review, was conducted using the PRISMA method, and explored the Scopus and Web of Science databases for the period from 2015 to 2024. A total of 92 articles were selected for quantitative analysis using VOSviewer software. The second phase is based on an in-depth systematic analysis of 25 articles selected from those previously identified. These articles were selected on the basis of their relevance to the research question, and were subjected to in-depth thematic analysis using NVivo software. Results The bibliometric analysis results reveal a significant increase in publications starting from the year 2020, highlighting advancements in research, primarily in the United States and China. The co-occurrence analysis identifies four main clusters: ethics, work autonomy, employee stress, and mental health, thus illustrating the dynamics created by artificial intelligence in the professional environment. Furthermore, the systematic analysis has brought to light theoretical gaps and under-explored areas, such as the need to conduct empirical studies in non-Western cultural contexts and among diverse target groups, including older adults, individuals of different sexes, people with low education levels, and participants from various sectors, including primary and secondary industries, small manufacturing businesses, call centers, as well as public and private healthcare sectors. Conclusion Existing literature emphasize the importance for organizations to implement supportive strategies aimed at mitigating the potential adverse effects of AI on employee well-being, while also leveraging its benefits to enhance workplace autonomy and satisfaction and promote AI-enabled innovation through employee creativity and self-efficacy.",not included,0.8062968552112579,47
a7b6f3fdf829ad0ec8b450758621938169b5206a,preprocessed,citation,citation,semantic_scholar,Economic Sciences,2024.0,semantic_scholar,a study on steps in building data infrastructure for data-driven hr practices in modern organizations (hr analytics perspective),https://www.semanticscholar.org/paper/a7b6f3fdf829ad0ec8b450758621938169b5206a,"HR analytics is the process of gathering and analyzing HR data to yield useful insights, enhance decision-making, and energize the workplace with data accuracy. Working dimensions are changing every minute in the world with advanced insights into the work environment.  As a part of the progression advanced technologies are adopted in organizations. New landscapes and horizons are made a pool of data as employees work 24/7, work from home, destination works, and various alternatives give rise to the use of the data. Now the data is new blood for the old organizations. So, in this parlance, the use of HR analytics is the need of the hour for HR Managers in developing organizations. A separate infrastructure is needed in the phase of modern organizations to become a rollercoaster in data-driven organizations. This paper focuses on the steps in creating data infrastructure for developing an infrastructure in modern organizations for data-driven HR practices.",not included,0.826026663184166,48
24869fc180b575e3eec292a467d7810e2f1e5bef,preprocessed,citation,citation,semantic_scholar,Human Resource Development Review,2024.0,semantic_scholar,exploring opportunities for artificial intelligence in organization development,https://www.semanticscholar.org/paper/24869fc180b575e3eec292a467d7810e2f1e5bef,"The purpose of this research was to examine the utilization of artificial intelligence (AI) in organization development (OD) through a comprehensive review of existing literature. We also propose potential avenues for future research on AI in OD. We conducted a systematic literature review of 68 studies on AI in OD based on Cummings and Worley’s four OD categories (i.e., human process, human resource, strategic change, and technostructural interventions). We first summarized and analyzed key information about how AI is implemented in OD contexts, and then examined the underlying theories or theoretical frameworks utilized in OD studies focusing on AI. We examined the application of AI in OD, potential ethical concerns, and recommendations for future research and practice using AI in OD. The paper concludes with discussion and implications for research and practice.",not included,0.8288842886686325,49
e1936e4c5e2ef07fe5e8683f5bf3f67ee77ba8ad,preprocessed,citation,citation,semantic_scholar,Mednarodno inovativno poslovanje = Journal of Innovative Business and Management,2024.0,semantic_scholar,the transformative role of artificial intelligence in human resources,https://www.semanticscholar.org/paper/e1936e4c5e2ef07fe5e8683f5bf3f67ee77ba8ad,"The article explores the landscape of Artificial Intelligence (AI) applications in Human Resources (HR) by highlighting current trends and providing some anticipations about future trends and developments. AI is revolutionary reshaping basic HR processes – from workforce planning, recruitment, to employee’s development and fostering diversity and inclusion. AI plays important role in addressing bias in recruitment, enhances objectivity and promotes equal opportunities. AI-driven tools (like chatbots and virtual assistants etc.) integration in HR processes enables seamless communication and propellers HR practices towards enhanced efficiency and strategic decision-making. Furthermore, the article provides a short analysis of some software solutions that serve organizations as AI HR tools. 
By taking a look towards the future, we can predicts that tools like predictive analytics, monitoring of employee well-being, and convergence of AI with augmented reality (AR) and virtual reality (VR) can be projected as some of the future key developments. 
In the conclusion we can stress out the transformative synergy between AI and HR, which allows organizations and HR professionals to embrace innovation in order to deliver better results for all of the stakeholders: employees, management, owners and broader society.",not included,0.8351606994867324,50
