doi,type,query_name,query_value,publication,publisher,publication_date,database,title,url,abstract,status,semantic_score,id
4d5f145f5cdf2f01f2b3a422a6ff4558fd7ebf98,preprocessed,citation,citation,semantic_scholar,OECD Working Papers on Public Governance,2019.0,semantic_scholar,"hello, world",https://www.semanticscholar.org/paper/4d5f145f5cdf2f01f2b3a422a6ff4558fd7ebf98,"Artificial Intelligence (AI) is an area of research and technology application that can have a significant impact on public policies and services in many ways. In just a few years, it is expected that the potential will exist to free up nearly one-third of public servants’ time, allowing them to shift from mundane tasks to high-value work. Governments can also use AI to design better policies and make better decisions, improve communication and engagement with citizens and residents, and improve the speed and quality of public services. While the potential benefits of AI are significant, attaining them is not an easy task. Government use of AI trails that of the private sector; the field is complex and has a steep learning curve; and the purpose of, and context within, government are unique and present a number of challenges.",not included,0.8303640842437744,137
d45ef2d32b09387970a2712de992b5fa531938a0,preprocessed,citation,citation,semantic_scholar,DELITE,2024.0,semantic_scholar,a hybrid human-ai approach for argument map creation from transcripts,https://www.semanticscholar.org/paper/d45ef2d32b09387970a2712de992b5fa531938a0,"In order to overcome challenges of traditional deliberation approaches that often silo information exchange between synchronous and asynchronous modes therefore hindering effective deliberation, we present a hybrid framework combining Large Language Models (LLMs) and human-in-the-loop curation to generate argument maps from deliberation transcripts. This approach aims to enhance the efficiency and quality of the generated argument maps, promote transparency, and connect the asynchronous and synchronous deliberation modes. Finally, we outline a realistic deliberation scenario where this process can be successfully integrated.",not included,0.8474408477544785,138
484b1efe7a4b9c0bb946c50c69ed9aad111469f3,preprocessed,citation,citation,semantic_scholar,,2023.0,semantic_scholar,bsa comments on supporting safe and responsible artificial intelligence in australia,https://www.semanticscholar.org/paper/484b1efe7a4b9c0bb946c50c69ed9aad111469f3,"BSA is the leading advocate for the global software industry. BSA members create technology solutions that power other businesses, including cloud storage services, customer relationship management software, human resources management programs, identity management services, security solutions, and collaboration software. Our members are on the leading edge of providing AIenabled products and services, and tools used by others in the development of AI systems and applications. As a result, they have unique insights into the technology’s tremendous potential to spur digital transformation and the policies that can best support the responsible use of AI.",not included,0.832381296157837,139
d4435fd7abcdd9830599079867c94e826251eb36,preprocessed,citation,citation,semantic_scholar,,2022.0,semantic_scholar,psychosocial intervention,https://www.semanticscholar.org/paper/d4435fd7abcdd9830599079867c94e826251eb36,"Domestic abuse victim risk assessment is crucial for providing victims with the correct level of support. However, it has been shown that the approach currently taken by most UK police forces, the Domestic Abuse, Stalking",not included,0.8011098295450211,140
dbf09a02b23ecc2fcfcd4628713b73aeec98f451,preprocessed,citation,citation,semantic_scholar,Annals of Robotics and Automation,2021.0,semantic_scholar,"artificial intelligence: explainability, ethical issues and bias",https://www.semanticscholar.org/paper/dbf09a02b23ecc2fcfcd4628713b73aeec98f451,"Artifi cial Intelligence (AI) is a topic of growing signifi cance for businesses as well as academic researchers. Its applications encompass many domains such as healthcare [1], fi nance [2] and manufacturing [3]. Artifi cial intelligence is represented in general purpose smart technologies that give the machines the ability to imitate human intelligence and perform complex tasks. Communicating with the machine using natural language, operating autonomous and adaptive assembly lines, and predicting supply chain demand stock market fl uctuations are all examples of AI implementation in industrial contexts. Investigating the literature and despite AI’s broad range of applications in several industry domains, till now, there is no agreement on a unifi ed defi nition of artifi cial intelligence. For instance Simmons and Chappell [4], defi ne AI as the term that “denotes behaviour of a machine which, if a human behaves in the same way, is considered intelligent”. Also Kumar, et al. [5], describe AI as the “A system’s ability to interpret external data correctly, to learn from such data, and to use those learnings to achieve specifi c goals and tasks through fl exible adaptation”. Consequently, it can be inferred that AI is not confi ned to limited number of applications, but rather it is considered as a pervasive economic, societal, and organizational phenomenon.",not included,0.8023776173591614,141
a01495afe37b54088a734891db2e9d723bccafb7,preprocessed,citation,citation,semantic_scholar,E3S Web of Conferences,2021.0,semantic_scholar,assessment of risks and threats to the development of artificial intelligence technologies,https://www.semanticscholar.org/paper/a01495afe37b54088a734891db2e9d723bccafb7,"The paper analyses the risks and threats caused by the development and implementation of artificial intelligence technologies. We believe that these risks and threats need research in the long term. Importantly, the use of intelligent information systems has a twofold effect: it can lead to both positive and negative results. The paper also considers the influence of artificial intelligence technologies on the various activities. It proposes a classification of risks and threats caused by the development and implementation of artificial intelligence technologies by the main spheres of human activity.",not included,0.8071766257286072,142
07b6b6a349a9644ffb64d09fd442d97bbc943517,preprocessed,citation,citation,semantic_scholar,IEEE technology & society magazine,2021.0,semantic_scholar,"artificial intelligence for a fair, just, and equitable world",https://www.semanticscholar.org/paper/07b6b6a349a9644ffb64d09fd442d97bbc943517,"From the 1970s onward, we started to dream of the leisure society in which, thanks to technological progress and consequent increase in productivity, working hours would be minimized and we would all live in abundance We all could devote our time almost exclusively to personal relationships, contact with nature, sciences, the arts, playful activities, and so on Today, this utopia seems more unattainable than it did then Since the 21st century, we have seen inequalities increasingly accentuated: of the increase in wealth in the United States between 2006 and 2018, adjusted for inflation and population growth, more than 87% went to the richest 10% of the population, and the poorest 50% lost wealth [1] Following the crisis of 2008, social inequalities, rights violations, planetary degradation, and the climate emergency worsened and increased (see [2] ) In 2019, the world’s 2153 billionaires had more wealth than 4 6 billion people [3] The World Bank estimates that COVID-19 will push up to 150 million people into extreme poverty [4]",not included,0.8053445428609848,143
0bc528a9fbb004993ce1f5d13c4229b3ea078c34,preprocessed,citation,citation,semantic_scholar,,2021.0,semantic_scholar,a toolkit to enable the design of trustworthy,https://www.semanticscholar.org/paper/0bc528a9fbb004993ce1f5d13c4229b3ea078c34,"Technological progress in artificial intelligence (AI) and machine learning (ML) has an enormous impact on our society, economy and environment. And although the urgent need for creating sustainable and ethical AI technology is admitted, there exists a lack of design tools and expertise to facilitate this advancement. This study investigates how to help designers design for the value of trust in AI systems. A literature review unveiled a myriad of ethical AI principles as well as gathered existing tools addressing the research area. Iterative reviews together with an expert on trust in technology evaluated these guidelines and a toolkit prototype containing 29 design principles had been created. Through multiple participatory design workshops the next iteration of the toolkit was co-designed in collaboration with design professionals. The result is an iterated toolkit comprising 16 principles relevant in the design for trust in AI systems, and providing tool suggestions for each principle.",included,0.8235145151615143,144
8dab76f134da8ddd2c7d3f66d0e639ea46f793b8,preprocessed,citation,citation,semantic_scholar,,2020.0,semantic_scholar,exploitation of expert system in identifying organizational ethics through controlling decision making process,https://www.semanticscholar.org/paper/8dab76f134da8ddd2c7d3f66d0e639ea46f793b8,"Article history: Received: October 24, 2019 Received in revised format: November 28 2019 Accepted: December 22, 2019 Available online: December 22, 2019 This paper examines how expert system may negatively or positively influence ethical based decision making process in an organization. Expert system ethical characteristics are chosen; including lack of human intelligence, lack of emotions, accidental bias and lack of values. Depending on quantitative approach; and through distributing a questionnaire on (132) GM, Deputy GM, project manager and officer, it appeared that expert systems' characteristics negatively influenced on the degree of ethics within the organizational setting. According to analysis, it appears that lack of values and human intelligence were among the characteristics that hinder the ethical stream adoption within an organization leading to ethics problems and malfunctioning on the decision making process. On the other hand, lack of emotions appeared to have good impact on the ethical efforts within an organization. Researchers recommended taking extra measures of surveillance in terms of ethics for individuals who are supposed to develop and monitor expert systems. © 2020 by the authors; licensee Growing Science, Canada",not included,0.826026663184166,145
4f4a2f5c9e1519db0c64e8cd2fb015ea5e3e4d0b,preprocessed,citation,citation,semantic_scholar,Future Internet,2025.0,semantic_scholar,high-risk ai systems—lie detection application,https://www.semanticscholar.org/paper/4f4a2f5c9e1519db0c64e8cd2fb015ea5e3e4d0b,"Integrating artificial intelligence into border control systems may help to strengthen security and make operations more efficient. For example, the emerging application of artificial intelligence for lie detection when inspecting passengers presents significant opportunities for future implementation. However, as it makes use of technology that is associated with artificial intelligence, the system is classified as high risk, in accordance with the EU AI Act and, therefore, must adhere to rigorous regulatory requirements to mitigate potential risks. This manuscript distinctly amalgamates the technical, ethical, and legal aspects, thereby offering an extensive examination of the AI-based lie detection systems utilized in border security. This academic paper is uniquely set apart from others because it undertakes a thorough investigation into the categorization of these emerging technologies in terms of the regulatory framework established by the EU AI Act, which classifies them as high risk. It further makes an assessment of practical case studies, including notable examples such as iBorderCtrl and AVATAR. This in-depth analysis seeks to emphasize not only the enormous challenges ahead for practitioners but also the progress made in this emerging field of study. Furthermore, it seeks to investigate threats, vulnerabilities, and privacy concerns associated with AI, while providing security controls to address difficulties related to lie detection. Finally, we propose a framework that encompasses the EU AI Act’s principles and serves as a foundation for future approaches and research projects. By analyzing current methodologies and considering future directions, the paper aims to provide a comprehensive understanding of the viability and consequences of deploying AI lie detection capabilities in border control.",included,0.8043087244033813,146
c1b237f25358a315527c64fc097e97c1d18edd39,preprocessed,citation,citation,semantic_scholar,Systems,2025.0,semantic_scholar,exploring key considerations for artificial intelligence robots in home healthcare using the unified theory of acceptance and use of technology and the fuzzy analytical hierarchy process method,https://www.semanticscholar.org/paper/c1b237f25358a315527c64fc097e97c1d18edd39,"Most countries face declining birth rates and an aging population, which makes the persistent healthcare labor shortage a pressing challenge. Introducing artificial intelligence (AI) robots into home healthcare could help address these issues. Exploring the primary considerations for integrating AI robots in home healthcare has become an urgent topic. However, previous studies have not systematically examined the factors influencing elderly individuals’ adoption of home healthcare AI robots, hindering an understanding of their acceptance and adoption. Furthermore, traditional methods overlook the relative importance of each consideration and cannot manage the ambiguity inherent in subjective human cognition, potentially leading to biased decision-making. To address these limitations, this study employs the unified theory of acceptance and use of technology (UTAUT) as a theoretical framework, integrating the modified Delphi method (MDM) and the fuzzy analytical hierarchy process (FAHP) to identify the key considerations. The research determined the order of importance of four evaluation criteria and fourteen evaluation sub-criteria, revealing that customization, accompany, and subjective norms are key factors that influence elderly individuals’ adoption of home healthcare AI robots.",not included,0.8062968552112579,147
d821b6252f111fe9263a49abdc399b63683df2d2,preprocessed,citation,citation,semantic_scholar,IEEE International Conference on Bioinformatics and Biomedicine,2024.0,semantic_scholar,"ethics of artificial intelligence: challenges, opportunities and future prospects",https://www.semanticscholar.org/paper/d821b6252f111fe9263a49abdc399b63683df2d2,"Artificial Intelligence (AI) has rapidly transformed numerous sectors, including healthcare, justice, and commerce, providing substantial benefits while also raising complex ethical questions: this article explores the main ethical challenges associated with AI, focusing on issues such as algorithmic bias, data privacy and security, transparency, and accountability. The importance of Explainable Artificial Intelligence (XAI) in enhancing the interpretability of algorithmic decisions is emphasized, particularly in healthcare, where model opacity can have a direct impact on patient outcomes. The paper further examines regulatory frameworks and ethical guidelines, including the European Union’s AI Act, advocating for a multidisciplinary approach that combines innovation and accountability to develop AI systems that respect human rights and foster user trust. In conclusion, the article underscores the need for interdisciplinary collaboration and adaptable regulations to ensure the ethical development of AI, promoting fairness and transparency.",not included,0.826026663184166,148
6242be8ef591473fd1e66283f9978688b72bb324,preprocessed,citation,citation,semantic_scholar,International Journal of Scientific Research and Modern Technology (IJSRMT),2024.0,semantic_scholar,"navigating the dual nature of deepfakes: ethical, legal, and technological perspectives on generative artificial intelligence ai) technology",https://www.semanticscholar.org/paper/6242be8ef591473fd1e66283f9978688b72bb324,"The rapid development of deepfake technology has opened up a range of groundbreaking opportunities while also introducing significant ethical challenges. This paper explores the complex impacts of deepfakes by drawing from fields such as computer science, ethics, media studies, and law. Through a multidisciplinary approach, we examine the technological foundations, uses, and societal effects of deepfakes. Our analysis includes case studies, expert interviews, and a thorough review of existing literature to highlight the dual nature of deepfakes—showcasing their potential benefits in entertainment and education, while also addressing the risks of misinformation and privacy violations. This study emphasizes the urgent need for improved detection methods, ethical guidelines, and strong legal frameworks to address the issues created by deepfakes. It calls for enhanced digital literacy and global cooperation to ensure that the advantages of generative AI are harnessed responsibly, while its inherent risks are minimized. The findings underscore the importance of effective detection strategies, ethical considerations, and legislative reforms to ensure deepfake technology is used in ways that benefit society.",not included,0.8288842886686325,149
a28eee3d30ea401fefca8a07332c1767b087bc7c,preprocessed,citation,citation,semantic_scholar,International Conference on Communication and Network Security,2024.0,semantic_scholar,the ethics of applying artificial intelligence (ai) for communication governance,https://www.semanticscholar.org/paper/a28eee3d30ea401fefca8a07332c1767b087bc7c,"This research paper explores the ethical considerations and implementations surrounding the use of artificial intelligence (AI) in communication governance. In an era marked by the increasing reliance on AI-driven technologies for communication, this study investigates the ethical Implementations, ethics, challenges, and potential benefits associated with AI's role in shaping and regulating information flow. Drawing upon a wide range of literature and discusses a comprehensive overview of applying AI in communication governance.",not included,0.8351606994867324,150
a27ce898e4103a8ea6bf20a7379ccdcbe2fe8111,preprocessed,citation,citation,semantic_scholar,Business and Politics,2024.0,semantic_scholar,investigating the politics and content of us state artificial intelligence legislation,https://www.semanticscholar.org/paper/a27ce898e4103a8ea6bf20a7379ccdcbe2fe8111,"
 The rapid emergence of artificial intelligence (AI) technology and its application by businesses has created a potential need for governmental regulation. While the federal government of the United States has largely sidestepped the issue of crafting law dictating limitations and expectations regarding the use of AI technology, US state legislatures have begun to take the lead in this area. Nonetheless, we know very little about how state legislatures have approached the design, pursuit, and adoption of AI policy and whether traditional political fault lines have manifested themselves in the AI issue area. Here, we gather data on the state-level adoption of AI policy, as well as roll call voting on AI bills (classified on the basis of consumer protection versus economic development), by state legislatures and analyze the political economy of AI legislation. We find that rising unemployment and inflation are negatively associated with a state’s AI policymaking. With respect to individual legislator support, we find that liberal lawmakers and Democrats are more likely to support bills establishing consumer protection requirements on AI usage. The results suggest that economic concerns loom large with AI and that traditional political fault lines may be establishing themselves in this area.",not included,0.8052007794380188,151
37eb0c2177acf85c74ace80a9365d610523bc64b,preprocessed,citation,citation,semantic_scholar,Digit. Gov. Res. Pract.,2024.0,semantic_scholar,introduction to the issue on artificial intelligence in the public sector: risks and benefits of ai for governments,https://www.semanticscholar.org/paper/37eb0c2177acf85c74ace80a9365d610523bc64b,"Artificial Intelligence (AI) is increasingly adopted by public sector organizations to provide better public services and to transform their internal processes. AI is now considered a key enabler for digital innovation and transformation in the public sector. However, AI is still relatively a new research area in the field of digital government. The term, AI, captures a wide range of technologies, techniques, and tools such as machine/deep learning, natural language processing, robotics, computer vision, and more recently Generative AI. While these AI technologies afford different applications and benefits in the government context, they also create social, ethical, and legal challenges. These challenges require solutions combining both technical (e.g., data and algorithmic solutions to minimize bias) and institutional (e.g., governance structures and processes) mechanisms. The special issue is a collection of articles that contribute to a better understanding of the issues associated with AI deployment in different areas of government operations. They cover AI applications in the areas of emergency response, policy analysis, public bids, and citizen participation. The contributions also address the challenge of realizing a legal transparency regime for AI in government and the effect of AI in bureaucratic decision-making.",not included,0.8033411532640458,152
e0c176370fcca6f8d11286f922c2154eaa69fc34,preprocessed,citation,citation,semantic_scholar,Business and Society Review,2024.0,semantic_scholar,what ethics can say on artificial intelligence: insights from a systematic literature review,https://www.semanticscholar.org/paper/e0c176370fcca6f8d11286f922c2154eaa69fc34,"The abundance of literature on ethical concerns regarding artificial intelligence (AI) highlights the need to systematize, integrate, and categorize existing efforts through a systematic literature review. The article aims to investigate prevalent concerns, proposed solutions, and prominent ethical approaches within the field. Considering 309 articles from the beginning of the publications in this field up until December 2021, this systematic literature review clarifies what the ethical concerns regarding AI are, and it charts them into two groups: (i) ethical concerns that arise from the design of AI and (ii) ethical concerns that arise from human–AI interactions. The analysis of the obtained sample highlights the most recurrent ethical concerns. Finally, it exposes the main proposals of the literature to handle the ethical concerns according to the main ethical approaches. It interprets the findings to lay the foundations for future research on the ethics of AI.",not included,0.8437141388654709,153
70a82befa02fea869b427024ec12146b719f03f6,preprocessed,citation,citation,semantic_scholar,Frontiers in Pharmacology,2023.0,semantic_scholar,mapping the regulatory landscape of ai in healthcare in africa,https://www.semanticscholar.org/paper/70a82befa02fea869b427024ec12146b719f03f6,"Introduction: Artificial intelligence (AI)-enhanced technology has seen unprecedented expansion in the recent past. This growth brings with it huge opportunities for the positive transformation of the economy, business, healthcare, and society. However, a critical question is whether, and to what extent, regulatory measures and mechanisms have been implemented to safeguard its design, development, and deployment. This paper offers a scoping exercise that maps the regulatory landscape of AI in healthcare (including health research) in certain African countries. Methods: This research is conducted across 12 African countries: Botswana, Cameroon, The Gambia, Ghana, Kenya, Malawi, Nigeria, Rwanda, South Africa, Tanzania, Uganda, and Zimbabwe. As limited specific AI legislation is found in these African countries, and because AI is informed by ancillary regulatory frameworks, we include data protection, digital health, consumer protection, and intellectual property in our research. A scoping review method was applied with a manual search of digital libraries with search terms customised for each repository consisting of core search terms for the various topics, including, among others, “law,” “regulation,” “artificial intelligence,” “data protection,” “intellectual property,” and “digital health”. Results and discussion: Analysis of the data demonstrated that while in the African countries under investigation there is no sui generis AI regulation, recent developments were found in areas that inform AI adoption, including in digital health, data protection, consumer protection, and intellectual property. Our findings highlight the fragmentation of the African AI regulatory landscape and illustrate the importance of continued AI regulatory development to ensure that Africa is well positioned for future AI adoption in health.",not included,0.8133152216672898,154
