doi,type,query_name,query_value,publication,publisher,publication_date,database,title,url,abstract,status,semantic_score,id
81d7522fe631da5299064e887faff1b94e00b036,preprocessed,citation,citation,semantic_scholar,2023 3rd International Conference on Technological Advancements in Computational Sciences (ICTACS),2023.0,semantic_scholar,disease prediction models using machine learning algorithms,https://www.semanticscholar.org/paper/81d7522fe631da5299064e887faff1b94e00b036,"Disease Prediction Models hold paramount importance in healthcare for enabling early intervention and improving patient outcomes. Machine Learning Algorithms, with their predictive capabilities, offer promising avenues for enhancing disease prediction accuracy. In this research, we explore the application of various machine learning techniques for disease prediction. We begin by introducing the context of disease prediction and the significance of machine learning algorithms. Our study involves preprocessing data, selecting relevant features, and implementing diverse algorithms. Through rigorous experimentation and evaluation, we present comparative insights into algorithm performance. The outcomes underscore the potential of machine learning in revolutionizing disease diagnosis and prognosis. Ethical considerations and potential biases are discussed, highlighting the responsible integration of predictive models in healthcare practices. This research contributes to the growing body of knowledge, paving the way for future advancements in disease prediction and personalized medical interventions.",not included,0.8554961800575256,80
a9b5c98d96cb77b4cdc8a2ee833288f205527795,preprocessed,citation,citation,semantic_scholar,Management &amp; Avenir,2023.0,semantic_scholar,développement de l’ia et questions éthiques : passage d’une perspective statique à une perspective dynamique,https://www.semanticscholar.org/paper/a9b5c98d96cb77b4cdc8a2ee833288f205527795,"L’utilisation éthique de l’IA dans les organisations pose de nombreux défis qui nécessitent que les parties prenantes débattent et expriment les valeurs relatives à leur position éthique. Ces débats donnent lieu à des tensions entre l’idéal de délibération inclusive issu de l’éthique du discours de Habermas, et la conception bourdieusienne de débats se déroulant dans des champs structurés avec des relations de pouvoir entre des parties prenantes concurrentes et inégales. En analysant 137 documents provenant de 21 pays, nous avons pu cartographier les facteurs influençant la prise en compte des questions d’éthique commerciale qui se posent au cours des deux principales étapes du développement d’un système d’IA, à savoir l’étape de sa conception et l’étape de son utilisation. Ensuite, nous élaborons trois dispositifs techniques pour résoudre les questions éthiques et les discutons à la lumière de la tension entre les conceptions idéales et pratiques des débats requis pour une utilisation éthique de l’IA.",not included,0.8145611852407455,81
ec3f19633a9cbf913ae9f418c80d59857e966afb,preprocessed,citation,citation,semantic_scholar,medRxiv,2023.0,semantic_scholar,artificial intelligence and health equity in primary care: a qualitative study with key stakeholders,https://www.semanticscholar.org/paper/ec3f19633a9cbf913ae9f418c80d59857e966afb,"Artificial Intelligence (AI)-augmented interventions are currently being rolled out across primary care, but how it affects health equity remains insufficiently understood. This qualitative study addresses this gap through an ethnographical inquiry based on 32 interviews and focus groups with stakeholders including commissioners, decision makers, AI developers, researchers, GPs and patient groups involved in the implementation of AI in English primary care. We took a sociotechnical perspective in order to assess how the stakeholders can improve health equity through the implementation process of AI within the wider system. We found that regulation and policy alone cannot guarantee equitable implementation of AI but can provide a framework to enable other stakeholders to take measures to promote equity: fostering a shared understanding of the causal mechanisms of AI and health equity, how to measure health equity, and how to share data necessary for equity promotion. Further, all stakeholders need to be on board for equitable implementation, and currently innovation leaves clinicians and patients behind. Capacity building is needed to achieve this, in particular at local commissioning and clinician level. Careful implementation and pragmatically focused research are needed to make AI in primary care capable of advancing health equity.",not included,0.8303640842437744,82
8b28e758be31ac18afd138cb5d6cb0709e45e655,preprocessed,citation,citation,semantic_scholar,Perspectives on Medical Education,2023.0,semantic_scholar,teaching ai ethics in medical education: a scoping review of current literature and practices,https://www.semanticscholar.org/paper/8b28e758be31ac18afd138cb5d6cb0709e45e655,"Introduction: The increasing use of Artificial Intelligence (AI) in medicine has raised ethical concerns, such as patient autonomy, bias, and transparency. Recent studies suggest a need for teaching AI ethics as part of medical curricula. This scoping review aimed to represent and synthesize the literature on teaching AI ethics as part of medical education. Methods: The PRISMA-SCR guidelines and JBI methodology guided a literature search in four databases (PubMed, Embase, Scopus, and Web of Science) for the past 22 years (2000–2022). To account for the release of AI-based chat applications, such as ChatGPT, the literature search was updated to include publications until the end of June 2023. Results: 1384 publications were originally identified and, after screening titles and abstracts, the full text of 87 publications was assessed. Following the assessment of the full text, 10 publications were included for further analysis. The updated literature search identified two additional relevant publications from 2023 were identified and included in the analysis. All 12 publications recommended teaching AI ethics in medical curricula due to the potential implications of AI in medicine. Anticipated ethical challenges such as bias were identified as the recommended basis for teaching content in addition to basic principles of medical ethics. Case-based teaching using real-world examples in interactive seminars and small groups was recommended as a teaching modality. Conclusion: This scoping review reveals a scarcity of literature on teaching AI ethics in medical education, with most of the available literature being recent and theoretical. These findings emphasize the importance of more empirical studies and foundational definitions of AI ethics to guide the development of teaching content and modalities. Recognizing AI’s significant impact of AI on medicine, additional research on the teaching of AI ethics in medical education is needed to best prepare medical students for future ethical challenges.",not included,0.828378900885582,83
8ff4eda4fbde5531cbc01cb2b8d1bae7aa97c265,preprocessed,citation,citation,semantic_scholar,Applied Informatics,2023.0,semantic_scholar,anthropocentrism and environmental wellbeing in ai ethics standards: a scoping review and discussion,https://www.semanticscholar.org/paper/8ff4eda4fbde5531cbc01cb2b8d1bae7aa97c265,"As AI deployment has broadened, so too has an awareness for the ethical implications and problems that may ensue from this deployment. In response, groups across multiple domains have issued AI ethics standards that rely on vague, high-level principles to find consensus. One such high-level principle that is common across the AI landscape is ‘human-centredness’, though oftentimes it is applied without due investigation into its merits and limitations and without a clear, common definition. This paper undertakes a scoping review of AI ethics standards to examine the commitment to ‘human-centredness’ and how this commitment interacts with other ethical concerns, namely, concerns for nonhumans animals and environmental wellbeing. We found that human-centred AI ethics standards tend to prioritise humans over nonhumans more so than nonhuman-centred standards. A critical analysis of our findings suggests that a commitment to human-centredness within AI ethics standards accords with the definition of anthropocentrism in moral philosophy: that humans have, at least, more intrinsic moral value than nonhumans. We consider some of the limitations of anthropocentric AI ethics, which include permitting harm to the environment and animals and undermining the stability of ecosystems.",not included,0.8474408477544785,84
17aedaff08b4fd6f269c838ed8d7cb6698ea5f01,preprocessed,citation,citation,semantic_scholar,Workshop on Visual Analytics in Healthcare,2023.0,semantic_scholar,the iterative design process of an explainable ai application for non-invasive diagnosis of cns tumors: a user-centered approach,https://www.semanticscholar.org/paper/17aedaff08b4fd6f269c838ed8d7cb6698ea5f01,"Artificial Intelligence (AI) is well-suited to help support complex decision-making tasks within clinical medicine, including clinical imaging applications like radiographic differential diagnosis of central nervous system (CNS) tumors. So far, there have been numerous examples of theoretical AI solutions for this space, for example, large-scale corporate efforts like IBM’s Watson AI. However, clinical implementation remains limited due to factors related to the alignment of this technology in the clinical setting. User-Centered Design (UCD) is a design philosophy that focuses on developing tailored solutions for specific users or user groups. In this study, we applied UCD to develop an explainable AI tool to support clinicians in our use case. Through four design iterations, starting from basic functionality and visualizations, we progressed to functional prototypes in a realistic testing environment. We discuss our motivation and approach for each iteration, along with key insights gained. This UCD process has advanced our conceptual idea from feasibility testing to interactive functional AI interfaces designed for specific clinical and cognitive tasks. It has also provided us with directions to develop further an AI system for the non-invasive diagnosis of CNS tumors.",included,0.8040409088134766,85
7d36034e81b7952bbbb1bdb63149df7a06fa709c,preprocessed,citation,citation,semantic_scholar,Neural Information Processing Systems,2023.0,semantic_scholar,how to data in datathons,https://www.semanticscholar.org/paper/7d36034e81b7952bbbb1bdb63149df7a06fa709c,"The rise of datathons, also known as data or data science hackathons, has provided a platform to collaborate, learn, and innovate in a short timeframe. Despite their significant potential benefits, organizations often struggle to effectively work with data due to a lack of clear guidelines and best practices for potential issues that might arise. Drawing on our own experiences and insights from organizing>80 datathon challenges with>60 partnership organizations since 2016, we provide guidelines and recommendations that serve as a resource for organizers to navigate the data-related complexities of datathons. We apply our proposed framework to 10 case studies.",not included,0.832381296157837,86
8b34eee10e3ec5c65ca7e1f5776d1339dded829e,preprocessed,citation,citation,semantic_scholar,Frontiers in Medicine,2023.0,semantic_scholar,doctor-patient interactions in the age of ai: navigating innovation and expertise,https://www.semanticscholar.org/paper/8b34eee10e3ec5c65ca7e1f5776d1339dded829e,"The integration of artificial intelligence (AI) in healthcare has the capacity to transform medical practice. Despite its revolutionary potential, the influence of AI may affect the physician-patient interaction and presents ethical challenges that will need to be carefully considered. This article discusses how patients may interact with this technology, considers how emerging technologies may alter the dynamics of the physician-patient relationship, and reviews some of the limitations that continue to exist. We identify potential challenges that may arise with the integration of AI into medical settings and propose solutions to help mitigate these issues.",not included,0.8262364834547042,87
38c4cfc9dc53f18e57c9c185edac3c085653d628,preprocessed,citation,citation,semantic_scholar,IEEE Transactions on Artificial Intelligence,2023.0,semantic_scholar,the different faces of ai ethics across the world: a principle-to-practice gap analysis,https://www.semanticscholar.org/paper/38c4cfc9dc53f18e57c9c185edac3c085653d628,"Artificial Intelligence (AI) is transforming our daily life with many applications in healthcare, space exploration, banking, and finance. This rapid progress in AI has brought increasing attention to the potential impacts of AI technologies on society, with ethically questionable consequences. In recent years, several ethical principles have been released by governments, national organizations, and international organizations. These principles outline high-level precepts to guide the ethical development, deployment, and governance of AI. However, the abstract nature, diversity, and context-dependence of these principles make them difficult to implement and operationalize, resulting in gaps between principles and their execution. Most recent work analyzed and summarized existing AI principles and guidelines but did not provide findings on principle-to-practice gaps nor how to mitigate them. These findings are particularly important to ensure that AI practical guidances are aligned with ethical principles and values. In this article, we provide a contextual and global evaluation of current ethical AI principles for all continents, with the aim to identify potential principle characteristics tailored to specific countries or applicable across countries. Next, we analyze the current level of AI readiness and current practical guidances of ethical AI principles in different countries, to identify gaps in the practical guidance of AI principles and their causes. Finally, we propose recommendations to mitigate the principle-to-practice gaps.",not included,0.8531478404998779,88
9b8b78b5bee1fed9dd04a00a9e89acb93c64fbba,preprocessed,citation,citation,semantic_scholar,Conference on Designing Interactive Systems,2023.0,semantic_scholar,participatory noticing through photovoice: engaging arts- and community-based approaches in design research,https://www.semanticscholar.org/paper/9b8b78b5bee1fed9dd04a00a9e89acb93c64fbba,"Noticing differently commits to stepping out of familiar reference frameworks while attending to oft-neglected actors, relations, and ways of knowing for design. Photovoice is an arts- and community-based participatory approach allowing individuals to communicate their lives and stories about pressing community concerns through photography. This paper bridges photovoice and the commitment to noticing in HCI and design through a photovoice project with Detroit residents on safety and surveillance. The photovoice process—alongside the production, reflection, and dissemination of photographs—makes residents’ everyday situations legible and sensible, allowing both community members and researchers to orient to and engage with multiple viewpoints, sensibilities, and temporal trajectories. This process confronts the invisibility of both the sociotechnical infrastructures (in our case, surveillance infrastructures) and minoritized communities’ relational ontologies. By advocating participatory noticing in design research, we show the opportunities for adopting arts- and community-based participatory approaches in decentering dominant ways of knowing and seeing, while at the same time fostering community capacity and relations for future potentialities.",not included,0.8011098295450211,89
b7b7f4331639d708d7881267101f54d92eefcf99,preprocessed,citation,citation,semantic_scholar,2023 5th International Conference of the Portuguese Society for Engineering Education (CISPEE),2023.0,semantic_scholar,the importance of ethical reasoning in next generation tech education,https://www.semanticscholar.org/paper/b7b7f4331639d708d7881267101f54d92eefcf99,"Artificial intelligence (AI) is having a profound impact on human life, with both benefits and drawbacks in the societal, environmental, and technological realms. However, the ethical implications of AI are often not addressed in technology education, leaving future professionals with a lack of awareness in this area. This is concerning, as AI has the potential to greatly information delivery and affect human thinking, interaction, decision-making, and communication. To address these issues, there is a need for a framework to guide and help future AI developers make ethically responsible decisions. In this paper we propose a framework to foster ethical awareness and promote respect for human dignity and well-being, while also preventing harm. It is designed to be incorporated into technology education, ensuring that future professionals are equipped to navigate the ethical implications of AI. By prioritizing ethical reasoning in technology education, we can build a better and more responsible AI industry, ensuring that AI can provide benefits for society and does not cause harm. Additionally, a tech industry that values ethics and social responsibility will be better equipped to build technology that serves the public interest, rather than solely maximizing profits. Teaching ethical reasoning in technology education is a crucial step in preparing future professionals to make informed and ethical decisions in the development and use of AI systems. It will lead to a better and more responsible AI industry that benefits all of society.",included,0.8079065144062042,90
40d478b580827c4ef054ed85d31c5ffd6a0a3590,preprocessed,citation,citation,semantic_scholar,Studies in Christian Ethics,2023.0,semantic_scholar,proximate and ultimate concerns in christian ethical responses to artificial intelligence,https://www.semanticscholar.org/paper/40d478b580827c4ef054ed85d31c5ffd6a0a3590,"I argue here that Christian ethical responses to Artificial Intelligence (AI) ought to take on, largely, two different approaches. The first considers proximate ethical concerns related to AI. This ethical approach most often considers more immediate personal and socio-political repercussions and the kind of impact that is occurring now or in the very near future. Proximate ethics of this type includes discussion about fairness, accountability, sustainability and transparency. The second concerns ultimate ethics which focuses on the longer-term impact and implications of AI. Examples of this type might include issues of uniqueness, deep societal transformation and inequality, changes to personal character and even the role AI might have in God's ultimate economy of creation and grace. My contention is that the Christian church needs to attend to both approaches to AI and that when it focuses too myopically on one at the expense of the other it often eclipses the entire witness of the church in our technological society.",not included,0.8023776173591614,91
35ad707180a312ada17aaea15ea59169d1fd876d,preprocessed,citation,citation,semantic_scholar,2023 3rd International Conference on Technology Enhanced Learning in Higher Education (TELE),2023.0,semantic_scholar,ethical problems of applying artificial intelligence: medical intelligent systems and autonomous vehicles,https://www.semanticscholar.org/paper/35ad707180a312ada17aaea15ea59169d1fd876d,"It is impossible to imagine modern life without intelligent systems that facilitate daily routine actions and save time. But how ethical does it become to use them in terms of improving the quality of their work? The paper analyzes the development of artificial intelligence methods, particularly in healthcare and unmanned transportation, and provides a discussion of the ethical aspects of the use of such systems.",not included,0.8071766257286072,92
9d7e76d1132eb4078d2bd1e786aee69a00419db5,preprocessed,citation,citation,semantic_scholar,arXiv.org,2023.0,semantic_scholar,aha!: facilitating ai impact assessment by generating examples of harms,https://www.semanticscholar.org/paper/9d7e76d1132eb4078d2bd1e786aee69a00419db5,"While demands for change and accountability for harmful AI consequences mount, foreseeing the downstream effects of deploying AI systems remains a challenging task. We developed AHA! (Anticipating Harms of AI), a generative framework to assist AI practitioners and decision-makers in anticipating potential harms and unintended consequences of AI systems prior to development or deployment. Given an AI deployment scenario, AHA! generates descriptions of possible harms for different stakeholders. To do so, AHA! systematically considers the interplay between common problematic AI behaviors as well as their potential impacts on different stakeholders, and narrates these conditions through vignettes. These vignettes are then filled in with descriptions of possible harms by prompting crowd workers and large language models. By examining 4113 harms surfaced by AHA! for five different AI deployment scenarios, we found that AHA! generates meaningful examples of harms, with different problematic AI behaviors resulting in different types of harms. Prompting both crowds and a large language model with the vignettes resulted in more diverse examples of harms than those generated by either the crowd or the model alone. To gauge AHA!'s potential practical utility, we also conducted semi-structured interviews with responsible AI professionals (N=9). Participants found AHA!'s systematic approach to surfacing harms important for ethical reflection and discovered meaningful stakeholders and harms they believed they would not have thought of otherwise. Participants, however, differed in their opinions about whether AHA! should be used upfront or as a secondary-check and noted that AHA! may shift harm anticipation from an ideation problem to a potentially demanding review problem. Drawing on our results, we discuss design implications of building tools to help practitioners envision possible harms.",not included,0.8500882655382156,93
c67f9c6a31bb7087a86e5d58c87cea13ce1eef52,preprocessed,citation,citation,semantic_scholar,Gut,2023.0,semantic_scholar,screening of normal endoscopic large bowel biopsies with interpretable graph learning: a retrospective study,https://www.semanticscholar.org/paper/c67f9c6a31bb7087a86e5d58c87cea13ce1eef52,"Objective To develop an interpretable artificial intelligence algorithm to rule out normal large bowel endoscopic biopsies, saving pathologist resources and helping with early diagnosis. Design A graph neural network was developed incorporating pathologist domain knowledge to classify 6591 whole-slides images (WSIs) of endoscopic large bowel biopsies from 3291 patients (approximately 54% female, 46% male) as normal or abnormal (non-neoplastic and neoplastic) using clinically driven interpretable features. One UK National Health Service (NHS) site was used for model training and internal validation. External validation was conducted on data from two other NHS sites and one Portuguese site. Results Model training and internal validation were performed on 5054 WSIs of 2080 patients resulting in an area under the curve-receiver operating characteristic (AUC-ROC) of 0.98 (SD=0.004) and AUC-precision-recall (PR) of 0.98 (SD=0.003). The performance of the model, named Interpretable Gland-Graphs using a Neural Aggregator (IGUANA), was consistent in testing over 1537 WSIs of 1211 patients from three independent external datasets with mean AUC-ROC=0.97 (SD=0.007) and AUC-PR=0.97 (SD=0.005). At a high sensitivity threshold of 99%, the proposed model can reduce the number of normal slides to be reviewed by a pathologist by approximately 55%. IGUANA also provides an explainable output highlighting potential abnormalities in a WSI in the form of a heatmap as well as numerical values associating the model prediction with various histological features. Conclusion The model achieved consistently high accuracy showing its potential in optimising increasingly scarce pathologist resources. Explainable predictions can guide pathologists in their diagnostic decision-making and help boost their confidence in the algorithm, paving the way for its future clinical adoption.",not included,0.8215756505727768,94
